index_name,retriever_method,number_retrieved_docs,llm_name,max_context_size,temperature,prompt_version,question,retrieved_contexts,golden_answer,generated_answer,context_size_valid,rouge1,rouge2,rougeL,hallucination,answer_relevancy,answer_similarity,context_recall,RAGAS_relevancy,duration_retrieval,duration_generation,duration_context_size,duration_total
Fine-tuned_finetuned-ISO-27001_1024_l2_All_1536_264_False,Hybrid_Rerank_Cohere,2,gpt-3.5-turbo,4096,0,1,"What does the term ""asset"" mean in ISO-27001 and what requirement does the standard have regarding the identification and inventory of information assets?","[Document(page_content='asset valuation\nthe whole risk assessment process should consider the\norganisation’s context and the needs and expectations of\ninterested parties.\nfurthermore, iso 27001 provides no guidance as to the basis\non which control selection decisions should be made, other\nthan to say that they should be selected “taking account of\nthe risk assessment results” (6.1.3 a), which will necessarily\ntake into account how the organisation prioritises the risks\nfor treatment (6.1.2 ¢.2).\nfinally, the iso 27001 management system clauses have no\nrequirement in terms of your methodology for the\nidentification or valuation of information assets.\nhow you value an asset in an asset-based methodology is,\nhowever, going to be fundamental to how much you will be\nprepared to invest in protecting it. iso 27000 doesn’t offer a\ndefinition for an asset, although it is reasonable to simply\ndefine it as ‘anything that has value to the organisation’. the\norganisation’s fixed-asset register is unlikely to provide\npractical help in this regard: many critical assets may already\n(through application of the financial depreciation policy, or\nof the accounting convention that assets should be shown on\nthe balance sheet at the /ower of historic cost — less\ndepreciation — or current market value) have been written\ndown below their actual useful value to the organisation.\nmany other, even more critical, assets (such as brand value,\nkey supplier and customer contracts, staff know-how,\nintellectual property and databases) may not even be on', metadata={'doc_ID': 784, 'original_text': 'asset valuation\nthe whole risk assessment process should consider the\norganisation’s context and the needs and expectations of\ninterested parties.\nFurthermore, ISO 27001 provides no guidance as to the basis\non which control selection decisions should be made, other\nthan to say that they should be selected “taking account of\nthe risk assessment results” (6.1.3 a), which will necessarily\ntake into account how the organisation prioritises the risks\nfor treatment (6.1.2 ¢.2).\nFinally, the ISO 27001 management system clauses have no\nrequirement in terms of your methodology for the\nidentification or valuation of information assets.\nHow you value an asset in an asset-based methodology is,\nhowever, going to be fundamental to how much you will be\nprepared to invest in protecting it. ISO 27000 doesn’t offer a\ndefinition for an asset, although it is reasonable to simply\ndefine it as ‘anything that has value to the organisation’. The\norganisation’s fixed-asset register is unlikely to provide\npractical help in this regard: many critical assets may already\n(through application of the financial depreciation policy, or\nof the accounting convention that assets should be shown on\nthe balance sheet at the /ower of historic cost — less\ndepreciation — or current market value) have been written\ndown below their actual useful value to the organisation.\nMany other, even more critical, assets (such as brand value,\nkey supplier and customer contracts, staff know-how,\nintellectual property and databases) may not even be on', 'source': 'Calder - 2019 - Information Security Risk Management for ISO 27001.pdf', 'title': 'Calder - 2019 - Information Security Risk Management for ISO 27001', 'relevance_score': 0.9960392}), Document(page_content='or home office.\n- information about systems in a demilitarized zone, as part of a security/network concept.\nsuch lists or plans are a good starting point for an inventory list according to a-5.9.\nit is worth noting that not all data is contained in a single directory. often, it is spread across multiple subdirectories that are under the responsibility of different entities. the iso 27002 explicitly allows this, but it requires clear organizational guidelines to avoid duplicate or inconsistent entries, different names, etc. in practice, due to expected challenges, it is often concluded that it is better to have a single central inventory list of information assets.\nif existing (older) inventories of the organization are discovered, it is necessary to check whether they meet all the requirements described in a-5.9 before incorporating them into the isms. if necessary, updates or revisions should be made.\nfor each asset, the inventory list should include at least the following information: a unique identifier, asset owner, and asset location.\nbefore explaining these three data fields, it is advisable to maintain the inventory list not only because the standard requires it but also as a basis for further work in the isms.\nuse:\n¢ as part of the risk assessment (isms-6.1), information about security objectives, specific risks, and references to action lists may be listed for each asset in the directory.\ne similarly, for certain types of assets, information about suppliers, procurement costs, maintenance work,', metadata={'doc_ID': 2709, 'original_text': 'or home office.\n- Information about systems in a demilitarized zone, as part of a security/network concept.\nSuch lists or plans are a good starting point for an inventory list according to A-5.9.\nIt is worth noting that not all data is contained in a single directory. Often, it is spread across multiple subdirectories that are under the responsibility of different entities. The ISO 27002 explicitly allows this, but it requires clear organizational guidelines to avoid duplicate or inconsistent entries, different names, etc. In practice, due to expected challenges, it is often concluded that it is better to have a single central inventory list of information assets.\nIf existing (older) inventories of the organization are discovered, it is necessary to check whether they meet all the requirements described in A-5.9 before incorporating them into the ISMS. If necessary, updates or revisions should be made.\nFor each asset, the inventory list should include at least the following information: a unique identifier, asset owner, and asset location.\nBefore explaining these three data fields, it is advisable to maintain the inventory list not only because the standard requires it but also as a basis for further work in the ISMS.\nuse:\n¢ As part of the risk assessment (ISMS-6.1), information about security objectives, specific risks, and references to action lists may be listed for each asset in the directory.\ne Similarly, for certain types of assets, information about suppliers, procurement costs, maintenance work,', 'source': 'ISO 27001_2022_Kersten_und_Schroeder.pdf', 'title': 'ISO 27001_2022_Kersten_und_Schroeder', 'relevance_score': 0.9950371})]","The term ""asset"" in ISO-27001 refers to anything that holds value for an organization. This includes properties, buildings, machinery, facilities, business processes, as well as information assets such as data, systems, and IT services. One requirement of the standard is that all relevant information assets must be identified and inventoried. This is typically done by recording information such as asset location, classification and the asset owner in a table or database. Inventorying can be facilitated by grouping similar assets or implementing a hierarchy.","In ISO 27001, the term ""asset"" refers to anything that has value to the organization. This can include physical assets such as equipment and facilities, as well as intangible assets such as intellectual property and databases. ISO 27001 does not provide a specific definition for assets, but it is reasonable to define them as anything that has value to the organization.

Regarding the identification and inventory of information assets, ISO 27001 does not prescribe a specific methodology. However, it does require organizations to maintain an inventory list of assets as part of their information security management system (ISMS). The inventory list should include at least three pieces of information for each asset: a unique identifier, asset owner, and asset location.

It is recommended to have a single central inventory list of information assets to avoid duplicate or inconsistent entries. If existing inventories are",True,0.48458149779735676,0.16,0.2907488986784141,0.7097839117050171,0.9987471103668213,0.8796371019769422,0.5,0.895391335036854,10.76900839805603,3.5016448497772217,0.6450309753417969,14.270653247833252
Fine-tuned_finetuned-ISO-27001_1024_l2_All_1536_264_False,Hybrid_Rerank_Cohere,2,gpt-3.5-turbo,4096,0,1,What information and documents should be collected in an organization to determine the context as part of ISO 27001?,"[Document(page_content='documents which provide further information and\nare very useful if not essential in using the standard itself. for iso/iec 27001 the one quoted\nhere is iso/iec 27000 which sets out the overview and vocabulary for an isms.\nthere are no requirements to be met in this section.\n3.4 clause 3 terms and definitions\nunlike many other standards, iso/iec 27001 doesn’t list any definitions at all, simply\nreferring the reader to iso/iec 27000. if you feel you need to know the exact definitions of\nsome of the terms used in iso/iec 27001 then this is the place to look, although in many\ncases you may not feel much more enlightened after reading the definition.\nthere are no requirements to be met in this section.\n page 24 of 79\niso/iec 27001 implementation guide\n3.5 clause 4 context of the organization\nrelevant toolkit documents\ne information security context, requirements and scope\nthis clause is about understanding as much as possible about the organization itself and the\nenvironment in which it operates. the key point about the isms is that it should be\nappropriate and relevant to the specifics of the business it is protecting. to ensure this, the\npeople implementing and running the isms must be able to answer questions about what\nthe organization does, where, how and who for (plus many others).\nthe isms will also be affected by the situation within the organization (internal issues) and\noutside the organization (external issues). internal issues are factors such as the culture,\nmanagement structure, locations,', metadata={'doc_ID': 871, 'original_text': 'documents which provide further information and\nare very useful if not essential in using the standard itself. For ISO/IEC 27001 the one quoted\nhere is ISO/IEC 27000 which sets out the overview and vocabulary for an ISMS.\nThere are no requirements to be met in this section.\n3.4 Clause 3 Terms and definitions\nUnlike many other standards, ISO/IEC 27001 doesn’t list any definitions at all, simply\nreferring the reader to ISO/IEC 27000. If you feel you need to know the exact definitions of\nsome of the terms used in ISO/IEC 27001 then this is the place to look, although in many\ncases you may not feel much more enlightened after reading the definition.\nThere are no requirements to be met in this section.\n Page 24 of 79\nISO/IEC 27001 Implementation Guide\n3.5 Clause 4 Context of the organization\nRelevant Toolkit documents\ne Information security Context, Requirements and Scope\nThis clause is about understanding as much as possible about the organization itself and the\nenvironment in which it operates. The key point about the ISMS is that it should be\nappropriate and relevant to the specifics of the business it is protecting. To ensure this, the\npeople implementing and running the ISMS must be able to answer questions about what\nthe organization does, where, how and who for (plus many others).\nThe ISMS will also be affected by the situation within the organization (internal issues) and\noutside the organization (external issues). Internal issues are factors such as the culture,\nmanagement structure, locations,', 'source': 'CERTIKIT_ISO27001_Implementation_Guide_v12.pdf.pdf', 'title': 'CERTIKIT_ISO27001_Implementation_Guide_v12.pdf', 'relevance_score': 0.9937101}), Document(page_content=""with iso 27001. you\nmust document all processes, rules, and procedures related to your isms to\nensure their appropriate implementation. the norm requires documentation of\nthe following aspects: * understanding the organization and its context (e.g., through an environmental analysis) * identification of interested parties * isms scope * communicated management commitment * roles and responsibilities within the isms * risk and opportunity management * change management planning * resource planning * decision logs related to risk management * training * communication matrix * documentation management planning/policy * framework with information security policies and information security guidelines * procedure for information security risk management * statement of applicability (soa) * information security objectives * evidence of competence * information necessary for the organization's isms effectiveness * control and planning of activities * evidence of monitoring and measurement results and evaluation * procedure for internal audits * procedure for management review * evidence of the audit program and its results * evidence of the results of management reviews * evidence of the type of identified non-conformities and all subsequent actions * evidence of"", metadata={'description': 'Discover the comprehensive guide to ISO 27001: Detailed insight into achieving and maintaining this essential information security standard. Explore its critical role in risk management, compliance and robust security practices, and learn step-by-step implementation techniques.', 'doc_ID': 176, 'language': 'en-gb', 'original_text': ""with ISO 27001. You\nmust document all processes, rules, and procedures related to your ISMS to\nensure their appropriate implementation. The norm requires documentation of\nthe following aspects: * Understanding the organization and its context (e.g., through an environmental analysis) * Identification of interested parties * ISMS scope * Communicated management commitment * Roles and responsibilities within the ISMS * Risk and opportunity management * Change management planning * Resource planning * Decision logs related to risk management * Training * Communication matrix * Documentation management planning/policy * Framework with information security policies and information security guidelines * Procedure for information security risk management * Statement of Applicability (SoA) * Information security objectives * Evidence of competence * Information necessary for the organization's ISMS effectiveness * Control and planning of activities * Evidence of monitoring and measurement results and evaluation * Procedure for internal audits * Procedure for management review * Evidence of the audit program and its results * Evidence of the results of management reviews * Evidence of the type of identified non-conformities and all subsequent actions * Evidence of"", 'source': 'https://www.dataguard.co.uk/knowledge/iso-27001/', 'title': 'What is ISO 27001? Key Information at a Glance', 'relevance_score': 0.99256825})]","To determine the context within an organization as part of ISO 27001, the following information and documents should be collected:

1. External factors: This includes the operational environment, legal framework, financial aspects, technology usage and dependencies, suppliers and service providers, as well as social and cultural aspects, especially for internationally operating organizations. Competitive aspects such as the scope of activities, key success factors, image considerations, and relationships with clients, customers, and partners should also be considered.

2. Internal factors: This includes the organizational structure and processes, the purpose and scope of IT implementation, already implemented standards and other requirements such as management systems, documentation and results from previous security activities, available resources for the establishment of an ISMS, approaches to risk management (including other topics), as well as existing internal regulations on security topics and other areas such as quality management and project management.

It is important to compile all relevant information and documentation (in writing or electronically) on the topic of security in order to understand the organization's context.","To determine the context as part of ISO 27001, an organization should collect the following information and documents:

1. Information security Context, Requirements, and Scope: This document should provide an understanding of the organization itself and the environment in which it operates. It should cover factors such as the organization's culture, management structure, locations, and other internal issues that may impact the ISMS.

2. Environmental analysis: An analysis of the organization's internal and external environment should be conducted to identify any factors that may affect the ISMS. This analysis should consider the organization's industry, market conditions, legal and regulatory requirements, and any other relevant external factors.

3. Identification of interested parties: The organization should identify all relevant stakeholders and interested parties that may have an impact on the ISMS. This may include customers, suppliers, employees, regulatory bodies,",True,0.5209003215434083,0.1488673139158576,0.24437299035369775,0.8055354356765747,0.9999146461486816,0.8519083640221828,1.0,0.981575799529641,2.4163413047790527,3.6095542907714844,0.0009937286376953125,6.025895595550537
Fine-tuned_finetuned-ISO-27001_1024_l2_All_1536_264_False,Hybrid_Rerank_Cohere,2,gpt-3.5-turbo,4096,0,1,How can responsibilities for compliance with ISO 27001 and monitoring of the ISMS be established within an organization?,"[Document(page_content=""/ management demonstrating leadership and commitment to information\nsecurity.\nthis is because senior management is ultimately responsible for the\norganisation's information security.\nby demonstrating leadership and commitment, senior management can help to\ncreate a culture of information security within the organisation and ensure\nthat everyone is committed to protecting the organisation's information\nassets.\nhere are some of the specific reasons why iso 27001 clause 5.1 is important\nand what it can help with:\n * ensure that the organisation has an effective information security management system (isms) in place. * help to protect the organisation's information assets from unauthorized access, use, disclosure, modification, or destruction. * aid in how to comply with legal and regulatory requirements. * to reduce the risk of financial losses, reputational damage, and business disruption. * improve the organisation's overall security posture.\n## who is responsible for iso 27001 clause 5.1?\nthe responsibility for iso 27001 clause 5.1 ultimately lies with top\nmanagement. however, all employees in the organisation have a role to play in\nensuring the organisation's information security.\nspecifically, top management is responsible for:\n * taking accountability for the effectiveness of the isms. * ensuring that the isms policy and objectives are established and are compatible with the organisation's context and strategic direction. * integrating the isms into"", metadata={'description': 'Learn how to demonstrate leadership and commitment to information security in accordance with ISO 27001:2022 Clause 5.1.', 'doc_ID': 215, 'language': 'en-gb', 'original_text': ""/ management demonstrating leadership and commitment to information\nsecurity.\nThis is because senior management is ultimately responsible for the\norganisation's information security.\nBy demonstrating leadership and commitment, senior management can help to\ncreate a culture of information security within the organisation and ensure\nthat everyone is committed to protecting the organisation's information\nassets.\nHere are some of the specific reasons why ISO 27001 Clause 5.1 is important\nand what it can help with:\n * Ensure that the organisation has an effective information security management system (ISMS) in place. * Help to protect the organisation's information assets from unauthorized access, use, disclosure, modification, or destruction. * Aid in how to comply with legal and regulatory requirements. * To reduce the risk of financial losses, reputational damage, and business disruption. * Improve the organisation's overall security posture.\n## Who is responsible for ISO 27001 Clause 5.1?\nThe responsibility for ISO 27001 Clause 5.1 ultimately lies with top\nmanagement. However, all employees in the organisation have a role to play in\nensuring the organisation's information security.\nSpecifically, top management is responsible for:\n * Taking accountability for the effectiveness of the ISMS. * Ensuring that the ISMS policy and objectives are established and are compatible with the organisation's context and strategic direction. * Integrating the ISMS into"", 'source': 'https://www.dataguard.co.uk/knowledge/iso-27001/clause-5-1-leadership-and-commitment/', 'title': 'ISO 27001 Clause 5.1: Leadership and Commitment', 'relevance_score': 0.99610037}), Document(page_content='# iso 27001 compliance checklist\n **\u200d** iso 27001 is the global gold standard for ensuring the security of\ninformation and its supporting assets. obtaining iso 27001 certification can\nhelp an organization prove its security practices to potential customers\nanywhere in the world. \u200d our iso 27001 checklist:\n1\ndevelop a roadmap for successful implementation of an isms and iso 27001\ncertification\nimplement plan, do, check, act (pdca) process to recognize challenges and\nidentify gaps for remediation\nconsider iso 27001 certification costs relative to org size and number of\nemployees\nclearly define scope of work to plan certification time to completion\nselect an iso 27001 auditor\n2\nset the scope of your organization’s isms\ndecide which business areas are covered by the isms and which are out of scope\nconsider additional security controls for business processes that are required\nto pass isms-protected information across the trust boundary\ninform stakeholders regarding scope of the isms\n3\nestablish an isms governing body\nbuild a governance team with management oversight\nincorporate key members of top management, e.g. senior leadership and\nexecutive management with responsibility for strategy and resource allocation\n4\nconduct an inventory of information assets\nconsider all assets where information is stored, processed, and accessible\n\u200d\n * record information assets: data and people\n * record physical assets: laptops, servers, and physical building locations\n * record intangible assets:', metadata={'description': 'Our ISO 27001 compliance checklist will help simplify your path to compliance.', 'doc_ID': 8, 'language': 'en', 'original_text': '# ISO 27001 compliance checklist\n **\u200d** ISO 27001 is the global gold standard for ensuring the security of\ninformation and its supporting assets. Obtaining ISO 27001 certification can\nhelp an organization prove its security practices to potential customers\nanywhere in the world. \u200d Our ISO 27001 checklist:\n1\nDevelop a roadmap for successful implementation of an ISMS and ISO 27001\ncertification\nImplement Plan, Do, Check, Act (PDCA) process to recognize challenges and\nidentify gaps for remediation\nConsider ISO 27001 certification costs relative to org size and number of\nemployees\nClearly define scope of work to plan certification time to completion\nSelect an ISO 27001 auditor\n2\nSet the scope of your organization’s ISMS\nDecide which business areas are covered by the ISMS and which are out of scope\nConsider additional security controls for business processes that are required\nto pass ISMS-protected information across the trust boundary\nInform stakeholders regarding scope of the ISMS\n3\nEstablish an ISMS governing body\nBuild a governance team with management oversight\nIncorporate key members of top management, e.g. senior leadership and\nexecutive management with responsibility for strategy and resource allocation\n4\nConduct an inventory of information assets\nConsider all assets where information is stored, processed, and accessible\n\u200d\n * Record information assets: data and people\n * Record physical assets: laptops, servers, and physical building locations\n * Record intangible assets:', 'source': 'https://www.vanta.com/resources/iso-27001-compliance-checklist', 'title': 'The ISO 27001 compliance checklist', 'relevance_score': 0.9960083})]","To establish responsibilities for compliance with ISO 27001 and monitoring of the ISMS within an organization, the top management should define roles, tasks, and authorities. This should include designating a responsible person for compliance with ISO 27001 and a person for reporting on the performance and effectiveness of the ISMS. Additionally, all roles and responsibilities within the organization should be communicated, for example, through a policy or training events.","Responsibilities for compliance with ISO 27001 and monitoring of the ISMS can be established within an organization by assigning specific roles and tasks to individuals or teams. While top management holds ultimate responsibility for ISO 27001 Clause 5.1, all employees have a role to play in ensuring information security.

To establish responsibilities, top management should:

1. Take accountability for the effectiveness of the ISMS.
2. Ensure that the ISMS policy and objectives are established and aligned with the organization's context and strategic direction.
3. Integrate the ISMS into the organization's business processes.
4. Allocate necessary resources for the implementation and maintenance of the ISMS.
5. Communicate the importance of information security and the ISMS to all employees.
6. Assign specific individuals or teams to oversee and monitor compliance with ISO 27001 requirements.
7",True,0.47804878048780486,0.2364532019704434,0.3121951219512195,0.7825405597686768,0.9999665021896362,0.8964240608062733,1.0,0.9763390096116501,2.1893198490142822,3.754997491836548,0.0010044574737548828,5.94431734085083
Fine-tuned_finetuned-ISO-27001_1024_l2_All_1536_264_False,Hybrid_Rerank_Cohere,2,gpt-3.5-turbo,4096,0,1,What are important components inside an ISMS to manage opportunities and risks according to the topic 6.1 (risk and opportunity management)?,"[Document(page_content=""of these risks and opportunities. * treat the risks and opportunities in a way that is proportionate to the risks involved. * monitor and review the effectiveness of their risk management processes.\nread conducting iso 27001 risk assessment in 7 steps for more information.\n## what does iso 27001 requirement 6.1 cover?\niso 27001 requirement 6.1 covers the following topics:\n * the need to plan for the identification, assessment, and treatment of risks and opportunities to information security. * the need to consider the organisation's context and the needs and expectations of interested parties when planning for risk management. * the need to establish and maintain a risk management process that is appropriate to the organisation's size, complexity, and nature of its activities. * the need to document the risk management process and the results of risk assessments. * the need to review and update the risk management process on a regular basis.\n## how to identify, assess and treat information security risks\nalthough not necessarily common practice — scenario-based risk identification\nand assessment is one of the most effective and well-established ways to\nmanage risks. not only does it consider past occurrences, but it also takes a\npreventive approach to risk management. this is a more holistic approach that\ncovers all potential scenarios.\nstep 1: identify and assess risks\nstep 2: create a treatment plan\nstep 3: review residual risks\n ###"", metadata={'source': 'https://www.dataguard.co.uk/knowledge/iso-27001/clause-6-1-actions-to-address-risks-and-opportunities/', 'title': 'ISO 27001 Clause 6.1: Information security objectives', 'description': ""Understand ISO 27001 clause 6.1: Detailing how security objectives align with an organisation's business goals for robust information protection."", 'language': 'en-gb', 'original_text': ""of these risks and opportunities. * Treat the risks and opportunities in a way that is proportionate to the risks involved. * Monitor and review the effectiveness of their risk management processes.\nRead Conducting ISO 27001 risk assessment in 7 steps for more information.\n## What does ISO 27001 requirement 6.1 cover?\nISO 27001 requirement 6.1 covers the following topics:\n * The need to plan for the identification, assessment, and treatment of risks and opportunities to information security. * The need to consider the organisation's context and the needs and expectations of interested parties when planning for risk management. * The need to establish and maintain a risk management process that is appropriate to the organisation's size, complexity, and nature of its activities. * The need to document the risk management process and the results of risk assessments. * The need to review and update the risk management process on a regular basis.\n## How to identify, assess and treat information security risks\nAlthough not necessarily common practice — scenario-based risk identification\nand assessment is one of the most effective and well-established ways to\nmanage risks. Not only does it consider past occurrences, but it also takes a\npreventive approach to risk management. This is a more holistic approach that\ncovers all potential scenarios.\nStep 1: Identify and assess risks\nStep 2: Create a treatment plan\nStep 3: Review residual risks\n ###"", 'doc_ID': 225, 'relevance_score': 0.98054343}), Document(page_content='27001 risk assessment.\n## 6\\. risk management\nrisk management is a core part of any isms. after all, it’s no good\nidentifying and prioritising information security threats if you’re unable to\ndeal with them effectively.\nthis stage isn’t about managing risks themselves but establishing how you’ll\napproach the task. there are several ways you can do this, but most methods\ninvolve looking at risks to specific assets or risks presented in specific\nscenarios.\nhowever you go about the task, the risk assessment process is crucial. after\nidentifying, evaluating and assigning values to your threats, you’ll know\nwhich risks pose the biggest problem.\nyou should take those and determine whether to:\n * treat the risk by applying information security controls laid out in iso 27001; * terminate the risk by avoiding it entirely;\n * share the risk (with an insurance policy or via an agreement with other parties); or\n * accept the risk (if it doesn’t pose a significant threat).\nany risks that you treat should be documented in an soa (statement of\napplicability). this should explain which of the standard’s controls you’ve\nselected and omitted and why you made those choices.\n## 7\\. implement the risk treatment plan\nnow it’s time to implement your risk treatment plan. to ensure these controls\nare effective, you will need to check that staff are able to operate or\ninteract with the controls, and that they are aware of their information\nsecurity obligations.\nyou will also need to develop a process to determine,', metadata={'description': 'ISO 27001 explains the compliance requirements you need to meet, but it doesn’t show you how to implement them.\xa0This blog fills in what you need to know', 'doc_ID': 33, 'language': 'en-GB', 'original_text': '27001 risk assessment.\n## 6\\. Risk management\nRisk management is a core part of any ISMS. After all, it’s no good\nidentifying and prioritising information security threats if you’re unable to\ndeal with them effectively.\nThis stage isn’t about managing risks themselves but establishing how you’ll\napproach the task. There are several ways you can do this, but most methods\ninvolve looking at risks to specific assets or risks presented in specific\nscenarios.\nHowever you go about the task, the risk assessment process is crucial. After\nidentifying, evaluating and assigning values to your threats, you’ll know\nwhich risks pose the biggest problem.\nYou should take those and determine whether to:\n * Treat the risk by applying information security controls laid out in ISO 27001; * Terminate the risk by avoiding it entirely;\n * Share the risk (with an insurance policy or via an agreement with other parties); or\n * Accept the risk (if it doesn’t pose a significant threat).\nAny risks that you treat should be documented in an SoA (Statement of\nApplicability). This should explain which of the Standard’s controls you’ve\nselected and omitted and why you made those choices.\n## 7\\. Implement the risk treatment plan\nNow it’s time to implement your risk treatment plan. To ensure these controls\nare effective, you will need to check that staff are able to operate or\ninteract with the controls, and that they are aware of their information\nsecurity obligations.\nYou will also need to develop a process to determine,', 'source': 'https://www.itgovernance.eu/blog/en/a-9-step-guide-to-implementing-iso-27001', 'title': 'How to Implement ISO 27001: A 9-Step Guide - IT Governance Blog En', 'relevance_score': 0.9769787})]","Important ISMS components for managing opportunities and risks according to Theme 6.1 include:

Compliance Management: Capturing and fulfilling conditions and expectations, including determining measures and regular updates.

Risk management: Identifying, assessing, and treating risks, with repeated steps until acceptance.

Asset management: Capturing and updating the organization's information values.

Process landscape and security analysis: Structuring business activities as a process landscape, securing processes, including IT components.
Continuous improvement: Integrating the goal of continuous improvement, e.g., through the PDCA model.

These components are fundamental to the ISMS and meet the requirements of Section 6.1. Planning often results in documents such as the ISMS guideline or ISMS description.","Important components inside an ISMS to manage opportunities and risks according to ISO 27001 requirement 6.1 (risk and opportunity management) include:

1. Planning for the identification, assessment, and treatment of risks and opportunities to information security.
2. Considering the organization's context and the needs and expectations of interested parties when planning for risk management.
3. Establishing and maintaining a risk management process that is appropriate to the organization's size, complexity, and nature of its activities.
4. Documenting the risk management process and the results of risk assessments.
5. Regularly reviewing and updating the risk management process.

In addition, the process of identifying, assessing, and treating information security risks involves the following steps:

1. Identify and assess risks: This step involves identifying potential risks and evaluating their likelihood and impact.
2. Create a treatment plan",True,0.4552845528455285,0.13934426229508196,0.2682926829268293,0.8083046078681946,0.9999666213989258,0.7602528290035174,0.4,0.8740562184890157,2.1662447452545166,3.5405259132385254,0.0019598007202148438,5.706770658493042
Fine-tuned_finetuned-ISO-27001_1024_l2_All_1536_264_False,Hybrid_Rerank_Cohere,2,gpt-3.5-turbo,4096,0,1,How can risks for an ISMS be classified and treated using criteria?,"[Document(page_content='27001 risk assessment.\n## 6\\. risk management\nrisk management is a core part of any isms. after all, it’s no good\nidentifying and prioritising information security threats if you’re unable to\ndeal with them effectively.\nthis stage isn’t about managing risks themselves but establishing how you’ll\napproach the task. there are several ways you can do this, but most methods\ninvolve looking at risks to specific assets or risks presented in specific\nscenarios.\nhowever you go about the task, the risk assessment process is crucial. after\nidentifying, evaluating and assigning values to your threats, you’ll know\nwhich risks pose the biggest problem.\nyou should take those and determine whether to:\n * treat the risk by applying information security controls laid out in iso 27001; * terminate the risk by avoiding it entirely;\n * share the risk (with an insurance policy or via an agreement with other parties); or\n * accept the risk (if it doesn’t pose a significant threat).\nany risks that you treat should be documented in an soa (statement of\napplicability). this should explain which of the standard’s controls you’ve\nselected and omitted and why you made those choices.\n## 7\\. implement the risk treatment plan\nnow it’s time to implement your risk treatment plan. to ensure these controls\nare effective, you will need to check that staff are able to operate or\ninteract with the controls, and that they are aware of their information\nsecurity obligations.\nyou will also need to develop a process to determine,', metadata={'description': 'ISO 27001 explains the compliance requirements you need to meet, but it doesn’t show you how to implement them.\xa0This blog fills in what you need to know', 'doc_ID': 33, 'language': 'en-GB', 'original_text': '27001 risk assessment.\n## 6\\. Risk management\nRisk management is a core part of any ISMS. After all, it’s no good\nidentifying and prioritising information security threats if you’re unable to\ndeal with them effectively.\nThis stage isn’t about managing risks themselves but establishing how you’ll\napproach the task. There are several ways you can do this, but most methods\ninvolve looking at risks to specific assets or risks presented in specific\nscenarios.\nHowever you go about the task, the risk assessment process is crucial. After\nidentifying, evaluating and assigning values to your threats, you’ll know\nwhich risks pose the biggest problem.\nYou should take those and determine whether to:\n * Treat the risk by applying information security controls laid out in ISO 27001; * Terminate the risk by avoiding it entirely;\n * Share the risk (with an insurance policy or via an agreement with other parties); or\n * Accept the risk (if it doesn’t pose a significant threat).\nAny risks that you treat should be documented in an SoA (Statement of\nApplicability). This should explain which of the Standard’s controls you’ve\nselected and omitted and why you made those choices.\n## 7\\. Implement the risk treatment plan\nNow it’s time to implement your risk treatment plan. To ensure these controls\nare effective, you will need to check that staff are able to operate or\ninteract with the controls, and that they are aware of their information\nsecurity obligations.\nYou will also need to develop a process to determine,', 'source': 'https://www.itgovernance.eu/blog/en/a-9-step-guide-to-implementing-iso-27001', 'title': 'How to Implement ISO 27001: A 9-Step Guide - IT Governance Blog En', 'relevance_score': 0.9803562}), Document(page_content='of the procedure, its good or easy applicability, the specific definition of criteria, classes, and levels - taking into account previous experiences.\nisms-6.1.3 - information security risk treatment\nnow we come to the question of risk treatment. the standard proposes a structured approach with the following steps (a) to (f).\n(a) for each risk assessed according to isms-6.1, a fundamental treatment option should be selected.\nin section 1.4 (keyword risk treatment), we have discussed the classic examples of such options in more detail, so we will only list them briefly here.\n- acceptance: the risk in question is accepted without any further measures.\n- transfer: a risky activity is transferred to a safer location or, for example, to a qualified service provider.\n- mitigation: the risk is addressed through measures within the organization. the measures can come from all areas (organizational, personnel, infrastructure, technology).\n- restructuring or reconstruction: a risky process is appropriately restructured or reconstructed - with the aim of replacing the questionable components or involved assets with those with lower risks.\n- termination: the decision is made to completely terminate a particularly critical business process.\nin the context of a real isms, of course, additional treatment options may be available. it also happens that one or the other option from our list is excluded by the organization - e.g. outsourcing to a service provider - due to high security concerns or high costs.\ntherefore,', metadata={'doc_ID': 2623, 'original_text': 'of the procedure, its good or easy applicability, the specific definition of criteria, classes, and levels - taking into account previous experiences.\nISMS-6.1.3 - Information Security Risk Treatment\nNow we come to the question of risk treatment. The standard proposes a structured approach with the following steps (a) to (f).\n(a) For each risk assessed according to ISMS-6.1, a fundamental treatment option should be selected.\nIn section 1.4 (keyword risk treatment), we have discussed the classic examples of such options in more detail, so we will only list them briefly here.\n- Acceptance: The risk in question is accepted without any further measures.\n- Transfer: A risky activity is transferred to a safer location or, for example, to a qualified service provider.\n- Mitigation: The risk is addressed through measures within the organization. The measures can come from all areas (organizational, personnel, infrastructure, technology).\n- Restructuring or reconstruction: A risky process is appropriately restructured or reconstructed - with the aim of replacing the questionable components or involved assets with those with lower risks.\n- Termination: The decision is made to completely terminate a particularly critical business process.\nIn the context of a real ISMS, of course, additional treatment options may be available. It also happens that one or the other option from our list is excluded by the organization - e.g. outsourcing to a service provider - due to high security concerns or high costs.\nTherefore,', 'source': 'ISO 27001_2022_Kersten_und_Schroeder.pdf', 'title': 'ISO 27001_2022_Kersten_und_Schroeder', 'relevance_score': 0.9789956})]","Risks for an ISMS can be classified and addressed according to established criteria. The criteria include:

Classification:
Hierarchical Classes: Risks can be categorized into hierarchical classes, for example, based on the magnitude of the risk.

Non-hierarchical Classes: Alternatively, non-hierarchical classes can be introduced, such as distinguishing between financial and reputation damages.

Evaluation:
After classification, it is crucial to assess the impact of a risk on the organization. This involves introducing hierarchical evaluation levels ranging from negligible or tolerable to catastrophic.

Risk Treatment:
Risk acceptance rules for tolerable risks.
Measures for extreme risks, including direct communication with the leadership.

Options for treating risks between extremes, such as outsourcing to service providers or preferences for specific types of measures.
The specific details of these criteria, classes, levels, and rules are the responsibility of each organization.","Risks for an ISMS can be classified and treated using criteria by following a structured approach. The ISO 27001 standard proposes a set of fundamental treatment options for each assessed risk. These options include acceptance, transfer, mitigation, restructuring or reconstruction, and termination.

Acceptance involves accepting the risk without taking any further measures. Transfer involves transferring the risky activity to a safer location or outsourcing it to a qualified service provider. Mitigation involves addressing the risk through measures within the organization, which can be from various areas such as organizational, personnel, infrastructure, or technology. Restructuring or reconstruction involves appropriately restructuring or reconstructing a risky process to replace questionable components or assets with those with lower risks. Termination involves making the decision to completely terminate a particularly critical business process.

It is important to note that these treatment options can be customized based on the organization",True,0.4229390681003584,0.12274368231046931,0.2078853046594982,0.7759861648082733,0.999832272529602,0.6695958163094725,1.0,0.7141361112315087,2.433995485305786,3.377462148666382,0.0010025501251220703,5.811457633972168
Fine-tuned_finetuned-ISO-27001_1024_l2_All_1536_264_False,Hybrid_Rerank_Cohere,2,gpt-3.5-turbo,4096,0,1,"How is the selection of measures for implementing risk treatment conducted, and what requirements should be considered and documented according to ISO 27001?","[Document(page_content='or to engage a\nconsultant. 3. **involve management properly and early** a management framework defines all the procedures an organization must\nimplement to achieve its iso 27001 implementation goals. accountability,\nspecifying who in management is responsible for the isms, a schedule of all\nactivities, and regular isms reviews for effectiveness are mechanisms\ncyclically ensuring isms improvement. 4. **conduct a risk assessment** while iso 27001 requires a formal risk assessment, it does not prescribe a\nmethodology. ""formal"" implies that the risk assessment approach is planned in\nadvance, and the associated data, analyses, and results are documented. 5. **implement risk treatment measures** it is the organization\'s task to determine how to proceed with the identified\nrisks. should they be avoided, transferred, accepted, or mitigated? all\ndecisions made for risk treatment must be documented. during a registration or\ncertification audit, an auditor will want to see this documentation. if you\nchoose to mitigate risks, it is crucial to implement the measures, based on\niso 27002 controls, for example. 6. **review and update the related documentation** documentation is one of the requirements you cannot bypass with iso 27001. you\nmust document all processes, rules, and procedures related to your isms to\nensure their appropriate implementation. the norm requires documentation of\nthe following aspects: * understanding the organization and its context (e.g.,', metadata={'description': 'Discover the comprehensive guide to ISO 27001: Detailed insight into achieving and maintaining this essential information security standard. Explore its critical role in risk management, compliance and robust security practices, and learn step-by-step implementation techniques.', 'doc_ID': 175, 'language': 'en-gb', 'original_text': 'or to engage a\nconsultant. 3. **Involve Management Properly and Early** A management framework defines all the procedures an organization must\nimplement to achieve its ISO 27001 implementation goals. Accountability,\nspecifying who in management is responsible for the ISMS, a schedule of all\nactivities, and regular ISMS reviews for effectiveness are mechanisms\ncyclically ensuring ISMS improvement. 4. **Conduct a Risk Assessment** While ISO 27001 requires a formal risk assessment, it does not prescribe a\nmethodology. ""Formal"" implies that the risk assessment approach is planned in\nadvance, and the associated data, analyses, and results are documented. 5. **Implement Risk Treatment Measures** It is the organization\'s task to determine how to proceed with the identified\nrisks. Should they be avoided, transferred, accepted, or mitigated? All\ndecisions made for risk treatment must be documented. During a registration or\ncertification audit, an auditor will want to see this documentation. If you\nchoose to mitigate risks, it is crucial to implement the measures, based on\nISO 27002 controls, for example. 6. **Review and Update the Related Documentation** Documentation is one of the requirements you cannot bypass with ISO 27001. You\nmust document all processes, rules, and procedures related to your ISMS to\nensure their appropriate implementation. The norm requires documentation of\nthe following aspects: * Understanding the organization and its context (e.g.,', 'source': 'https://www.dataguard.co.uk/knowledge/iso-27001/', 'title': 'What is ISO 27001? Key Information at a Glance', 'relevance_score': 0.9977569}), Document(page_content='information security risk treatment is the process of selecting and\nimplementing controls to reduce the likelihood and impact of information\nsecurity risks. it is an essential part of any information security management\nsystem (isms) and is required by the iso 27001 standard.\nclause 8.3 of iso 27001 requires organisations to implement the information\nsecurity risk treatment plan and retain documented information on the results\nof that risk treatment.\nthis means that organisations must have a plan in place for how they will\naddress the risks that have been identified, and they must keep records of how\nthey have implemented that plan.\nhere are some of the things that are involved in requirement 8.3:\n * identifying and assessing risks * developing and implementing risk treatment plans * monitoring and reviewing the effectiveness of risk treatment plans * retaining documented information on the results of risk treatment\norganisations can use a variety of methods to implement requirement 8.3, such\nas:\n * using a risk management framework such as iso 27005 * using a risk management software tool * hiring a consultant to help with risk management\n## what is the information risk treatment plan?\nan information risk treatment plan (irtp) is a document that outlines how an\norganisation will manage and treat the information security risks that have\nbeen identified through its risk assessment process. the irtp should include\nthe following:\n * a list of all identified', metadata={'source': 'https://www.dataguard.co.uk/knowledge/iso-27001/clause-8-3-information-security-risk-treatment/', 'title': 'ISO 27001 Clause 8.3: Information security risk treatment', 'description': 'Learn how to implement the ISO 27001 information security risk treatment plan and reduce the likelihood and impact of information security risks.', 'language': 'en-gb', 'original_text': 'Information security risk treatment is the process of selecting and\nimplementing controls to reduce the likelihood and impact of information\nsecurity risks. It is an essential part of any information security management\nsystem (ISMS) and is required by the ISO 27001 standard.\nClause 8.3 of ISO 27001 requires organisations to implement the information\nsecurity risk treatment plan and retain documented information on the results\nof that risk treatment.\nThis means that organisations must have a plan in place for how they will\naddress the risks that have been identified, and they must keep records of how\nthey have implemented that plan.\nHere are some of the things that are involved in requirement 8.3:\n * Identifying and assessing risks * Developing and implementing risk treatment plans * Monitoring and reviewing the effectiveness of risk treatment plans * Retaining documented information on the results of risk treatment\nOrganisations can use a variety of methods to implement requirement 8.3, such\nas:\n * Using a risk management framework such as ISO 27005 * Using a risk management software tool * Hiring a consultant to help with risk management\n## What is the information risk treatment plan?\nAn information risk treatment plan (IRTP) is a document that outlines how an\norganisation will manage and treat the information security risks that have\nbeen identified through its risk assessment process. The IRTP should include\nthe following:\n * A list of all identified', 'doc_ID': 407, 'relevance_score': 0.9977217})]","The selection of measures for implementing risk treatment is done in two steps. Firstly, a general treatment option is selected for each identified risk. Then, the measures necessary for implementing this option are selected and determined. Various sources such as ISO 27002, the Basic Security Compendium of BSI, or industry catalogs can be consulted during the selection of measures. A comparison with the controls from Annex A of ISO 27001 is necessary during the selection of measures to avoid overlooking important aspects and measures. All requirements that need to be considered during the selection of measures must be documented accordingly.","The selection of measures for implementing risk treatment is conducted by the organization itself. After conducting a risk assessment, the organization needs to determine how to proceed with the identified risks. This can involve avoiding, transferring, accepting, or mitigating the risks. The decisions made for risk treatment must be documented.

According to ISO 27001, the requirements that should be considered and documented for risk treatment include:

1. Identifying and assessing risks: This involves identifying and evaluating the potential risks to the organization's information security.

2. Developing and implementing risk treatment plans: The organization needs to create a plan for how they will address the identified risks and implement controls to reduce the likelihood and impact of those risks.

3. Monitoring and reviewing the effectiveness of risk treatment plans: The organization should regularly review and assess the effectiveness of the implemented risk treatment measures to ensure they are",True,0.4032258064516129,0.13821138211382114,0.23387096774193547,0.7033264338970184,0.9999656677246094,0.7930967486108483,0.6666666666666666,0.8647234769072097,2.164693593978882,3.4682374000549316,0.0010027885437011719,5.6329309940338135
Fine-tuned_finetuned-ISO-27001_1024_l2_All_1536_264_False,Hybrid_Rerank_Cohere,2,gpt-3.5-turbo,4096,0,1,"What resources need to be provided to establish the ISMS according to ISO 27001, and what resources are necessary for the implementation of the risk treatment plan?","[Document(page_content='### clause 7.1 of iso 27001: resources\nclause 7.1 of iso 27001 requires organisations to identify and allocate the\nresources needed for the establishment, implementation, maintenance, and\ncontinual improvement of their (isms). this is because the resources available\nto an organisation will have a significant impact on the effectiveness of its\nisms.\nthe resources that need to be considered include:\n * people: the organisation needs to have the right people with the right skills and knowledge to implement and maintain its isms. this includes security professionals, as well as other employees who have a role to play in information security, such as it staff, line managers, and employees with access to sensitive information. * infrastructure: the organisation needs to have the necessary infrastructure, such as it systems and facilities, to support its isms. this includes hardware, software, and physical security measures. * financial resources: the organisation needs to have the financial resources to invest in its isms. this includes the costs of hiring and training staff, purchasing and maintaining infrastructure, and implementing security controls.\nby ensuring that it has the necessary resources, an organisation can improve\nthe effectiveness of its isms and reduce the risk of security incidents.\n### your iso 27001 certification process made simple.\n### get iso 27001 certified in as little as 3 months. download your free guide now\n## why is it important for organisations to have', metadata={'description': 'ISO 27001 clause 7.1 stipulates that organisations must allocate necessary resources for the establishment, maintenance, and enhancement of their ISMS.', 'doc_ID': 378, 'language': 'en-gb', 'original_text': '### Clause 7.1 of ISO 27001: Resources\nClause 7.1 of ISO 27001 requires organisations to identify and allocate the\nresources needed for the establishment, implementation, maintenance, and\ncontinual improvement of their (ISMS). This is because the resources available\nto an organisation will have a significant impact on the effectiveness of its\nISMS.\nThe resources that need to be considered include:\n * People: The organisation needs to have the right people with the right skills and knowledge to implement and maintain its ISMS. This includes security professionals, as well as other employees who have a role to play in information security, such as IT staff, line managers, and employees with access to sensitive information. * Infrastructure: The organisation needs to have the necessary infrastructure, such as IT systems and facilities, to support its ISMS. This includes hardware, software, and physical security measures. * Financial resources: The organisation needs to have the financial resources to invest in its ISMS. This includes the costs of hiring and training staff, purchasing and maintaining infrastructure, and implementing security controls.\nBy ensuring that it has the necessary resources, an organisation can improve\nthe effectiveness of its ISMS and reduce the risk of security incidents.\n### Your ISO 27001 certification process made simple.\n### Get ISO 27001 certified in as little as 3 months. Download your free guide now\n## Why is it important for organisations to have', 'source': 'https://www.dataguard.co.uk/knowledge/iso-27001/clause-7-1-resources-for-isms/', 'title': 'ISO 27001 requirement 7.1: Identify and allocate resources for ISMS', 'relevance_score': 0.9988441}), Document(page_content='with isms risks\niso/iec 27001, clause 6.1.1 specifies a requirement that is common to all mss and\nis intended for the identification and treatment of risks to the intended outcome of\nthe isms that are not information security specific. for example, a lack of resources\ncould result in internal audits being missed. whilst this could represent a\nnonconformity in respect of iso/iec 27001, clause 9.2 (internal audits), its effect on\nexposure to information security is indirect and depends on whether any information\nsecurity controls are in scope of the audits that might be missed. whilst an\norganisation could use the full rigour of clauses 6.1.2 and 6.1.3 to identify and treat\nsuch risk, it does not have to — an informal approach — essentially just following what\nit says in the standard will be sufficient.\nrelevant resources\niso standards\niso/iec 27000 provides an overview of all the standards in the 27000 series,\ntogether the vocabulary of terms that they use. the principal standards are:\nm iso/iec 27000, information technology — security techniques —\ninformation security management systems — overview and vocabulary;\nm iso/iec 27001, information technology — security techniques —\ninformation security management systems — requirements;\nm iso/iec 27002, information technology — security techniques — code of\npractice for information security controls\nm iso/iec 27003, information technology — security techniques —\ninformation security management system implementation guidance.\nthe following standard explores', metadata={'source': 'Brewer - 2020 - ISO IEC 27001 Mastering Risk Assessment and the Statement of Applicability.pdf', 'title': 'Brewer - 2020 - ISO IEC 27001 Mastering Risk Assessment and the Statement of Applicability', 'original_text': 'with ISMS risks\nISO/IEC 27001, Clause 6.1.1 specifies a requirement that is common to all MSS and\nis intended for the identification and treatment of risks to the intended outcome of\nthe ISMS that are not information security specific. For example, a lack of resources\ncould result in internal audits being missed. Whilst this could represent a\nnonconformity in respect of ISO/IEC 27001, Clause 9.2 (Internal audits), its effect on\nexposure to information security is indirect and depends on whether any information\nsecurity controls are in scope of the audits that might be missed. Whilst an\norganisation could use the full rigour of Clauses 6.1.2 and 6.1.3 to identify and treat\nsuch risk, it does not have to — an informal approach — essentially just following what\nit says in the standard will be sufficient.\nRelevant resources\nISO standards\nISO/IEC 27000 provides an overview of all the standards in the 27000 series,\ntogether the vocabulary of terms that they use. The principal standards are:\nm ISO/IEC 27000, Information technology — Security techniques —\nInformation security management systems — Overview and vocabulary;\nm ISO/IEC 27001, Information technology — Security techniques —\nInformation security management systems — Requirements;\nm ISO/IEC 27002, Information technology — Security techniques — Code of\npractice for information security controls\nm ISO/IEC 27003, Information technology — Security techniques —\nInformation security management system implementation guidance.\nThe following standard explores', 'doc_ID': 580, 'relevance_score': 0.99317604})]","To establish the ISMS according to ISO 27001, various resources need to be provided. These include staff, processes, expertise, training and education, as well as testing and verification procedures. These resources should already be estimated in the planning phase of the ISMS. In addition, resources are necessary to implement the risk treatment plan. These include staff, knowledge/expertise, organizational resources, infrastructure/technology, as well as a budget for expertise, training and education, tests, and audits. External support may also be considered. The estimation of effort and costs for the implementation of the risk treatment plan should be done after the completion of the Statement of Applicability (SoA) and submitted for approval.","According to the context provided, the resources that need to be provided to establish the ISMS (Information Security Management System) according to ISO 27001 include people, infrastructure, and financial resources. People refers to having the right individuals with the necessary skills and knowledge to implement and maintain the ISMS, including security professionals, IT staff, line managers, and employees with access to sensitive information. Infrastructure refers to the necessary IT systems, facilities, hardware, software, and physical security measures to support the ISMS. Financial resources are needed to invest in the ISMS, including costs for hiring and training staff, purchasing and maintaining infrastructure, and implementing security controls.

Regarding the implementation of the risk treatment plan, the context mentions ISO/IEC 27001 Clause 6.1.1, which requires the identification and treatment of risks to the intended outcome",True,0.43089430894308944,0.16393442622950818,0.2845528455284553,0.8858129382133484,0.9999581575393677,0.7853975734988288,1.0,0.824611973927356,2.293386936187744,3.148439645767212,0.0009984970092773438,5.441826581954956
Fine-tuned_finetuned-ISO-27001_1024_l2_All_1536_264_False,Hybrid_Rerank_Cohere,2,gpt-3.5-turbo,4096,0,1,Which three levels are considered when evaluating the security and effectiveness of the ISMS?,"[Document(page_content='the isms, evaluating against the information security objectives\n * correspondence between the determined controls, the statement of applicability and the results of the information security risk assessment and risk treatment process and the information security policy and objectives\n * implementation of controls (see annex a), taking into account the external and internal context\n * and related risks, the organization’s monitoring, measurement and analysis of information security\n * processes and controls to determine whether controls are implemented and effective and meet their stated information security objectives\n * programmes, processes, procedures, records, internal audits and reviews of the isms effectiveness to ensure that these are traceable to top management decisions and the information security policy and objectives\nonce you have completed stage two and passed the audit — you will receive your\nofficial certification.\n * surveillance/periodic audits: happen between certification and recertification audits focusing on specific areas of the isms. this is done every year.\n * recertification audit: this is necessary to keep your certification and covers all aspects of the standard and must be carried out every 3 years.\n## how long does it take to get ready for an iso 27001 external audit?\ndepending on the size of your company or organisation, you can be audit-ready\nin about 8 weeks. if you decide to go the manual route of building your\ndocumentation from scratch, it can take at least', metadata={'source': 'https://www.dataguard.co.uk/knowledge/iso-27001-certification/', 'title': 'ISO 27001 Certification: Your ultimate guide [free guide available]', 'description': 'No matter if you’re an SMB or an international corporation — getting an ISO 27001 certification should be on your agenda. Here’s the ultimate guide on how.', 'language': 'en-gb', 'original_text': 'the ISMS, evaluating against the information security objectives\n * Correspondence between the determined controls, the Statement of Applicability and the results of the information security risk assessment and risk treatment process and the information security policy and objectives\n * Implementation of controls (see Annex A), taking into account the external and internal context\n * And related risks, the organization’s monitoring, measurement and analysis of information security\n * Processes and controls to determine whether controls are implemented and effective and meet their stated information security objectives\n * Programmes, processes, procedures, records, internal audits and reviews of the ISMS effectiveness to ensure that these are traceable to top management decisions and the information security policy and objectives\nOnce you have completed stage two and passed the audit — you will receive your\nofficial certification.\n * Surveillance/periodic audits: happen between certification and recertification audits focusing on specific areas of the ISMS. This is done every year.\n * Recertification audit: This is necessary to keep your certification and covers all aspects of the standard and must be carried out every 3 years.\n## How long does it take to get ready for an ISO 27001 external audit?\nDepending on the size of your company or organisation, you can be audit-ready\nin about 8 weeks. If you decide to go the manual route of building your\ndocumentation from scratch, it can take at least', 'doc_ID': 141, 'relevance_score': 0.98221964}), Document(page_content=""in the iso/iec 27001 standard. the certification body will take the time to gain a sufficient understanding of the isms design in the context of your organization, risk assessment and treatment (including the controls determined), information security policy and objectives. a large emphasis will also be put on your company's preparedness for the audit. this allows planning for stage 2. * **stage 2 audit:** based on documented findings in stage 1's audit report, the certification body will develop an audit plan to conduct stage 2 of the audit. in addition to evaluating the effective implementation of the isms, the aim of stage 2 is to confirm that your company adheres to its own policies, objectives and procedures.\nto do this, the audit will focus on:\n * top management leadership and commitment to information security policy and the information security objectives\n * documentation requirements listed in iso/iec 27001\n * assessment of information security-related risks and that the assessments produce consistent, valid and comparable results if repeated\n * determination of control objectives and controls based on the information security risk assessment risk treatment processes\n * information security performance and the effectiveness of the isms, evaluating against the information security objectives\n * correspondence between the determined controls, the statement of applicability and the results of the information security risk assessment and risk treatment process and the information security"", metadata={'source': 'https://www.dataguard.co.uk/knowledge/iso-27001-certification/', 'title': 'ISO 27001 Certification: Your ultimate guide [free guide available]', 'description': 'No matter if you’re an SMB or an international corporation — getting an ISO 27001 certification should be on your agenda. Here’s the ultimate guide on how.', 'language': 'en-gb', 'original_text': ""in the ISO/IEC 27001 standard. The certification body will take the time to gain a sufficient understanding of the ISMS design in the context of your organization, risk assessment and treatment (including the controls determined), information security policy and objectives. A large emphasis will also be put on your company's preparedness for the audit. This allows planning for stage 2. * **Stage 2 Audit:** Based on documented findings in stage 1's audit report, the certification body will develop an audit plan to conduct stage 2 of the audit. In addition to evaluating the effective implementation of the ISMS, the aim of stage 2 is to confirm that your company adheres to its own policies, objectives and procedures.\nTo do this, the audit will focus on:\n * Top management leadership and commitment to information security policy and the information security objectives\n * Documentation requirements listed in ISO/IEC 27001\n * Assessment of information security-related risks and that the assessments produce consistent, valid and comparable results if repeated\n * Determination of control objectives and controls based on the information security risk assessment Risk treatment processes\n * Information security performance and the effectiveness of the ISMS, evaluating against the information security objectives\n * Correspondence between the determined controls, the Statement of Applicability and the results of the information security risk assessment and risk treatment process and the information security"", 'doc_ID': 140, 'relevance_score': 0.97123843})]","The three levels considered when evaluating the security and effectiveness of the ISMS are:
1. Level - Monitoring, measurement, analysis, and evaluation by the responsible authorities or roles for security (topic 9.1)
2. Level - Review and assessment of security by an independent body separate from operational security (internal audit) (topic 9.2)
3. Level - Evaluation of the ISMS by top management (topic 9.3)","The three levels considered when evaluating the security and effectiveness of the ISMS (Information Security Management System) are:

1. Top management leadership and commitment to information security policy and the information security objectives.
2. Documentation requirements listed in ISO/IEC 27001.
3. Assessment of information security-related risks and that the assessments produce consistent, valid, and comparable results if repeated.

These levels are evaluated during the stage 2 audit of the ISO 27001 certification process. The stage 2 audit aims to confirm that the organization adheres to its own policies, objectives, and procedures. It evaluates the effective implementation of the ISMS and assesses the information security performance and effectiveness of the ISMS against the information security objectives. It also checks the correspondence between the determined controls, the Statement of Applicability, and the results of the information security",True,0.3482587064676617,0.18090452261306533,0.27860696517412936,0.7800633013248444,0.9998182654380798,0.7649656448571636,0.0,0.8300374528555974,2.147691249847412,41.35057497024536,0.001001119613647461,43.49826622009277
Fine-tuned_finetuned-ISO-27001_1024_l2_All_1536_264_False,Hybrid_Rerank_Cohere,2,gpt-3.5-turbo,4096,0,1,What aspects are reviewed in internal audits for ISO 27001 according to NA 9.2 and what information should be specified in the audit program to effectively manage these tasks?,"[Document(page_content=""* the audit must cover all aspects of the isms, including risk assessment, information security controls, isms documentation, awareness and training, and management review. * the audit findings must be documented in a report that is submitted to the organisation's management.\norganisations that are certified according to iso 27001 must also undergo an\nexternal audit by a certification body. there are two kinds of external audit,\none conducted once annually called a surveillance audit where the isms will be\nreviewed as part of ongoing evaluation and the other known as a full external\naudit which is more in-depth and conducted every three years.\nbenefits of iso 27001 audit:\n * improved information security posture * reduced risk of information security incidents * increased compliance with regulations * improved customer confidence * competitive advantage\nif you are considering implementing iso 27001 or if you are already certified,\nit is important to ensure that you are conducting regular internal audits.\ninternal audits are an essential tool for maintaining an effective isms and\nprotecting your organisation from information security threats.\n## where is an internal audit mandatory?\nan internal audit is not required by law or regulation. however, it is a good\npractice for all organisations to conduct regular internal audits of their\ninformation security and other management systems.\nin order to comply with iso 27001, all companies must conduct internal"", metadata={'source': 'https://www.dataguard.co.uk/knowledge/iso-27001/clause-9-2-internal-audit/', 'title': 'ISO 27001 Clause 9.2: Internal Audit', 'description': 'Ensure your ISMS is operating effectively for ISO 27001 compliance. Learn all you need to know about ISO 27001 Clause 9.2 internal audits in our guide.\n', 'language': 'en-gb', 'original_text': ""* The audit must cover all aspects of the ISMS, including risk assessment, information security controls, ISMS documentation, awareness and training, and management review. * The audit findings must be documented in a report that is submitted to the organisation's management.\nOrganisations that are certified according to ISO 27001 must also undergo an\nexternal audit by a certification body. There are two kinds of external audit,\none conducted once annually called a surveillance audit where the ISMS will be\nreviewed as part of ongoing evaluation and the other known as a full external\naudit which is more in-depth and conducted every three years.\nBenefits of ISO 27001 audit:\n * Improved information security posture * Reduced risk of information security incidents * Increased compliance with regulations * Improved customer confidence * Competitive advantage\nIf you are considering implementing ISO 27001 or if you are already certified,\nit is important to ensure that you are conducting regular internal audits.\nInternal audits are an essential tool for maintaining an effective ISMS and\nprotecting your organisation from information security threats.\n## Where is an internal audit mandatory?\nAn internal audit is not required by law or regulation. However, it is a good\npractice for all organisations to conduct regular internal audits of their\ninformation security and other management systems.\nIn order to comply with ISO 27001, all companies must conduct internal"", 'doc_ID': 422, 'relevance_score': 0.9936611}), Document(page_content='findings:** the organisation should follow up on the audit findings and implement any necessary corrective actions.\n## what to look for during an iso 27001 internal audit\nduring an iso 27001 internal audit, the auditor will look for evidence that\nthe isms is conforming to the requirements of iso 27001 and that it is\noperating effectively. the auditor will focus on the following areas and\nevidence that supports them:\n * risk assessment: the auditor will assess whether the organisation has conducted a thorough risk assessment and whether the identified risks have been appropriately addressed. * information security controls: the auditor will assess whether the organisation has implemented and is maintaining appropriate information security controls to mitigate the identified risks. * isms documentation: the auditor will assess whether the isms is adequately documented. you can find a list of the required documentation for the iso 27001 certification here. * awareness and training: the auditor will assess whether staff are aware of their information security responsibilities and have received appropriate training. * management review: the auditor will assess whether the organisation conducts regular management reviews of the isms.\n## how to report on the findings of an iso 27001 internal audit\nthe audit findings should be documented in a report. this report should\ninclude the following:\n * audit objectives: the audit objectives should be clearly stated in the report.', metadata={'description': 'Ensure your ISMS is operating effectively for ISO 27001 compliance. Learn all you need to know about ISO 27001 Clause 9.2 internal audits in our guide.\n', 'doc_ID': 424, 'language': 'en-gb', 'original_text': 'findings:** The organisation should follow up on the audit findings and implement any necessary corrective actions.\n## What to look for during an ISO 27001 internal audit\nDuring an ISO 27001 internal audit, the auditor will look for evidence that\nthe ISMS is conforming to the requirements of ISO 27001 and that it is\noperating effectively. The auditor will focus on the following areas and\nevidence that supports them:\n * Risk assessment: The auditor will assess whether the organisation has conducted a thorough risk assessment and whether the identified risks have been appropriately addressed. * Information security controls: The auditor will assess whether the organisation has implemented and is maintaining appropriate information security controls to mitigate the identified risks. * ISMS documentation: The auditor will assess whether the ISMS is adequately documented. You can find a list of the required documentation for the ISO 27001 certification here. * Awareness and training: The auditor will assess whether staff are aware of their information security responsibilities and have received appropriate training. * Management review: The auditor will assess whether the organisation conducts regular management reviews of the ISMS.\n## How to report on the findings of an ISO 27001 internal audit\nThe audit findings should be documented in a report. This report should\ninclude the following:\n * Audit objectives: The audit objectives should be clearly stated in the report.', 'source': 'https://www.dataguard.co.uk/knowledge/iso-27001/clause-9-2-internal-audit/', 'title': 'ISO 27001 Clause 9.2: Internal Audit', 'relevance_score': 0.9900251})]","The following aspects are reviewed in internal audits according to topic 9.2:
1. The establishment of the ISMS according to the planning
2. The proper functioning of the ISMS
3. The effectiveness of the ISMS
4. Compliance with the requirements of ISO 27001

To effectively manage these tasks, the audit program should specify the following:
1. Different audits with their subject and frequency
2. The responsible personnel for conducting the audits
3. The type of documentation and reporting
4. An audit plan with scheduling, content, and procedural planning
5. Documentation of findings and results in the audit report
6. Inclusion and evaluation of identified deficiencies in the audit report
7. Specification and scheduling of corrective actions
8. Evidence of implementation of corrective actions in the aftermath","During an internal audit for ISO 27001, the auditor will review various aspects of the Information Security Management System (ISMS) as per NA 9.2. These aspects include risk assessment, information security controls, ISMS documentation, awareness and training, and management review. The auditor will assess whether the organization has conducted a thorough risk assessment and appropriately addressed the identified risks. They will also evaluate whether the organization has implemented and is maintaining appropriate information security controls to mitigate the identified risks. The adequacy of ISMS documentation will be assessed, along with the awareness of staff regarding their information security responsibilities and whether they have received appropriate training. Additionally, the auditor will assess whether the organization conducts regular management reviews of the ISMS.

To effectively manage these tasks, the audit program should specify the audit objectives clearly in the report. The report should also document",True,0.4501845018450184,0.1412639405204461,0.24354243542435425,0.8387306034564972,0.9999663829803467,0.7475586038480018,1.0,0.7201268315228971,2.386396646499634,3.2903308868408203,0.0010020732879638672,5.676727533340454
Fine-tuned_finetuned-ISO-27001_1024_l2_All_1536_264_False,Hybrid_Rerank_Cohere,2,gpt-3.5-turbo,4096,0,1,What steps need to be taken to address a deviation of the ISMS from the ISO 27001 norm and what measures can be taken to eliminate the causes of the deviation?,"[Document(page_content='must be observed.\n88 2 requirements for the isms\nisms-10.2 nonconformity and corrective measures\ndeviation from the norm concerns circumstances in an isms that contradict or at least do not fully meet the requirements of iso 27001.\nsuch deviations can be identified in internal audits and certification audits - of course, they can also be discovered by any other form of examination within the framework of the isms. sometimes they are also detected more or less accidentally. however, a corresponding correction is necessary in order to achieve or maintain conformity with the norm. in terms of correction, the following requirements (a) to (g) are made in isms-10.2.\nin clause (a), it is required to react to any occurring (i.e. known) deviation from the norm by initially planning and scheduling a suitable correction (measure).\noften there seems to be a simple correction for a deviation - here a short document, there a quick measure! however, if you analyze it more closely, you will find that this correction ""has wider implications"" - i.e. has consequences for other areas in the isms, perhaps even causes new deviations there. in view of this experience, it is required to first consider the consequences of the planned correction and only then implement it.\nclause (b) essentially asks the following question: how did the deviation in question occur? there must be causes for this. perhaps a certain requirement of the norm was simply overlooked or misunderstood, initially postponed and later forgotten. of course,', metadata={'source': 'ISO 27001_2022_Kersten_und_Schroeder.pdf', 'title': 'ISO 27001_2022_Kersten_und_Schroeder', 'original_text': 'must be observed.\n88 2 Requirements for the ISMS\nISMS-10.2 Nonconformity and corrective measures\nDeviation from the norm concerns circumstances in an ISMS that contradict or at least do not fully meet the requirements of ISO 27001.\nSuch deviations can be identified in internal audits and certification audits - of course, they can also be discovered by any other form of examination within the framework of the ISMS. Sometimes they are also detected more or less accidentally. However, a corresponding correction is necessary in order to achieve or maintain conformity with the norm. In terms of correction, the following requirements (a) to (g) are made in ISMS-10.2.\nIn clause (a), it is required to react to any occurring (i.e. known) deviation from the norm by initially planning and scheduling a suitable correction (measure).\nOften there seems to be a simple correction for a deviation - here a short document, there a quick measure! However, if you analyze it more closely, you will find that this correction ""has wider implications"" - i.e. has consequences for other areas in the ISMS, perhaps even causes new deviations there. In view of this experience, it is required to first consider the consequences of the planned correction and only then implement it.\nClause (b) essentially asks the following question: How did the deviation in question occur? There must be causes for this. Perhaps a certain requirement of the norm was simply overlooked or misunderstood, initially postponed and later forgotten. Of course,', 'doc_ID': 2682, 'relevance_score': 0.9975177}), Document(page_content=""a security policy is not up to date. * **major nonconformity:** a firewall is misconfigured, allowing unauthorized access to the organisation's network. * **minor nonconformity:** a user account is not properly disabled when an employee leaves the organisation. * **major nonconformity:** a data breach occurs due to a lack of security controls. * **minor nonconformity:** a security training session is not conducted on time. * **major nonconformity:** employees are not following security procedures, such as using strong passwords and avoiding phishing emails.\norganisations should have a process in place for identifying, reporting, and\nresolving both minor and major nonconformities. this process should be\ndocumented and communicated to all employees.\nby promptly addressing nonconformities, organisations can help to improve the\noverall effectiveness of their isms and protect their information assets.\n### what are corrective actions in iso 27001?\nonce the root cause of a nonconformity has been determined, the organisation\nshould take corrective action to eliminate the cause and prevent it from\nhappening again. corrective action may involve changing policies and\nprocedures, training employees, or implementing new security controls.\n## nonconformity and corrective action process\nthe following is a general overview of the nonconformity and corrective action\nprocess:\n 1. **identify the nonconformity:** this can be done through a variety of means, such as internal audits,"", metadata={'description': 'Identify & address Nonconformities in your ISMS to improve information security, according to ISO 27001 clause 10.2. Explore our Comprehensive Guide Today!', 'doc_ID': 438, 'language': 'en-gb', 'original_text': ""A security policy is not up to date. * **Major nonconformity:** A firewall is misconfigured, allowing unauthorized access to the organisation's network. * **Minor nonconformity:** A user account is not properly disabled when an employee leaves the organisation. * **Major nonconformity:** A data breach occurs due to a lack of security controls. * **Minor nonconformity:** A security training session is not conducted on time. * **Major nonconformity:** Employees are not following security procedures, such as using strong passwords and avoiding phishing emails.\nOrganisations should have a process in place for identifying, reporting, and\nresolving both minor and major nonconformities. This process should be\ndocumented and communicated to all employees.\nBy promptly addressing nonconformities, organisations can help to improve the\noverall effectiveness of their ISMS and protect their information assets.\n### What are corrective actions in ISO 27001?\nOnce the root cause of a nonconformity has been determined, the organisation\nshould take corrective action to eliminate the cause and prevent it from\nhappening again. Corrective action may involve changing policies and\nprocedures, training employees, or implementing new security controls.\n## Nonconformity and corrective action process\nThe following is a general overview of the nonconformity and corrective action\nprocess:\n 1. **Identify the nonconformity:** This can be done through a variety of means, such as internal audits,"", 'source': 'https://www.dataguard.co.uk/knowledge/iso-27001/clause-10-2-nonconformity-and-corrective-action/', 'title': 'ISO 27001 Clause 10.2: Nonconformity and Corrective Action', 'relevance_score': 0.9953544})]","Treating a deviation in the ISMS requires several steps. Firstly, detailed monitoring should be conducted to accurately capture the situation. Then corrective actions can be taken to eliminate the deviation. It is important to evaluate which measures are suitable for identifying and eliminating the causes of the deviation. A root cause analysis should be conducted to determine if the deviation exists elsewhere or can reoccur. All measures should be appropriate and weighed against the negative consequences of a persisting deviation. The implementation and effectiveness of the measures should be reviewed, and changes to the ISMS may be necessary. It is important to document all steps and outcomes.","To address a deviation of the ISMS from the ISO 27001 norm and eliminate the causes of the deviation, the following steps need to be taken:

1. Identify the nonconformity: This can be done through internal audits, certification audits, or any other form of examination within the framework of the ISMS.

2. Determine the root cause: It is important to understand how the deviation occurred and what factors contributed to it. This could be due to oversight, misunderstanding, or neglect of a requirement.

3. Plan and schedule a suitable correction: Once the root cause is identified, a suitable correction measure should be planned and scheduled. It is important to consider the wider implications of the correction and its potential impact on other areas of the ISMS.

4. Implement corrective action: The planned correction should be implemented, which may involve changing policies",True,0.5161290322580645,0.2113821138211382,0.25806451612903225,0.9195502400398254,0.9999666213989258,0.7884749217775661,1.0,0.987981256871929,2.557878255844116,3.0637035369873047,0.0009980201721191406,5.621581792831421
Fine-tuned_finetuned-ISO-27001_1024_l2_All_1536_264_False,Hybrid_Rerank_Cohere,2,gpt-3.5-turbo,4096,0,1,"What purpose does a self-assessment play in evaluating the effectiveness of protective measures for an ISMS, and what consequences can deviations have?","[Document(page_content='objectives: if they are not sufficient, corrective measures must be ordered. the evaluation also includes reports on security incidents that have occurred and the resulting consequences.\nthere are generally risks involved in achieving the objectives: what can happen on the way to achieving the objectives and what are the consequences for the organization? conclusion: an isms requires qualified risk management, which should be established by the top management level as early as possible.\n(f) it must be ensured that all individuals in the target group contribute to the effectiveness of the isms.\nthe individuals mentioned must take responsibility for security in their work area or work processes so that the isms can fulfill its task. what does this mean specifically? each person in the target group must first know what security requirements apply to their own work area, what this means in practice, how deviations are identified, and that these deviations must be reported.\nas an example for such reports, let\'s take the ""ordinary"" user in the organization who uses an it application and suddenly notices long response times or incorrect data. the security management must be informed about this immediately. if this is not done, these error conditions could escalate, spread, and possibly be repairable only with great effort or reputation loss - scenarios that would contradict the organization\'s goals.\nit is important to realize that the individuals mentioned initially need to be sensitized and trained before they', metadata={'source': 'ISO 27001_2022_Kersten_und_Schroeder.pdf', 'title': 'ISO 27001_2022_Kersten_und_Schroeder', 'original_text': 'objectives: if they are not sufficient, corrective measures must be ordered. The evaluation also includes reports on security incidents that have occurred and the resulting consequences.\nThere are generally risks involved in achieving the objectives: what can happen on the way to achieving the objectives and what are the consequences for the organization? Conclusion: An ISMS requires qualified risk management, which should be established by the top management level as early as possible.\n(f) It must be ensured that all individuals in the target group contribute to the effectiveness of the ISMS.\nThe individuals mentioned must take responsibility for security in their work area or work processes so that the ISMS can fulfill its task. What does this mean specifically? Each person in the target group must first know what security requirements apply to their own work area, what this means in practice, how deviations are identified, and that these deviations must be reported.\nAs an example for such reports, let\'s take the ""ordinary"" user in the organization who uses an IT application and suddenly notices long response times or incorrect data. The security management must be informed about this immediately. If this is not done, these error conditions could escalate, spread, and possibly be repairable only with great effort or reputation loss - scenarios that would contradict the organization\'s goals.\nIt is important to realize that the individuals mentioned initially need to be sensitized and trained before they', 'doc_ID': 2605, 'relevance_score': 0.95318794}), Document(page_content='we have already considered these aspects in the measurements/audits of the isms processes and controls. if no objections arise here, an isms generally delivers the expected performance (= the expected result). the question of adequacy can also be asked for the isms as a whole - analogous to the consideration of controls.\nin terms of effectiveness, it must be assessed whether the organization achieves its security objectives according to isms-5.1 (a) overall. to put it differently, it is difficult to imagine achieving security objectives if:\n- security incidents occur frequently and cause damage,\n- security vulnerabilities exist that pose potential risks,\n- other known risks have not been addressed, or\n- the required controls have not been fully implemented.\nlet\'s go through the four points mentioned above.\nregarding security incidents, one could say: the less incidents and the smaller their impact on the organization, the higher or better the effectiveness of the isms. so what should be monitored/measured in this case? we analyze the security incidents recorded in a ticket system and also capture the severity of the incidents or their damage class (alternatively, their processing priority in the ticket system). this way, we have determined the number of security incidents for each damage class defined in the risk analysis during the considered period. since serious incidents should have a greater impact in the assessment than minor ones, it leads to a product formation of ""number x damage class,"" whose', metadata={'doc_ID': 2664, 'original_text': 'We have already considered these aspects in the measurements/audits of the ISMS processes and controls. If no objections arise here, an ISMS generally delivers the expected performance (= the expected result). The question of adequacy can also be asked for the ISMS as a whole - analogous to the consideration of controls.\nIn terms of effectiveness, it must be assessed whether the organization achieves its security objectives according to ISMS-5.1 (a) overall. To put it differently, it is difficult to imagine achieving security objectives if:\n- Security incidents occur frequently and cause damage,\n- Security vulnerabilities exist that pose potential risks,\n- Other known risks have not been addressed, or\n- The required controls have not been fully implemented.\nLet\'s go through the four points mentioned above.\nRegarding security incidents, one could say: The less incidents and the smaller their impact on the organization, the higher or better the effectiveness of the ISMS. So what should be monitored/measured in this case? We analyze the security incidents recorded in a ticket system and also capture the severity of the incidents or their damage class (alternatively, their processing priority in the ticket system). This way, we have determined the number of security incidents for each damage class defined in the risk analysis during the considered period. Since serious incidents should have a greater impact in the assessment than minor ones, it leads to a product formation of ""number x damage class,"" whose', 'source': 'ISO 27001_2022_Kersten_und_Schroeder.pdf', 'title': 'ISO 27001_2022_Kersten_und_Schroeder', 'relevance_score': 0.9046505})]","Self-assessment plays an significant role in evaluating the effectiveness of protective measures. It involves a self-assessment by management, which is then reviewed by auditors or inspectors for completeness, correctness, and validity. Deviations are documented as issues and classified as minor or major issues depending on their magnitude. For compliance with laws and regulations, even a significant deviation or multiple minor deviations can indicate non-compliance.","A self-assessment plays a crucial role in evaluating the effectiveness of protective measures for an Information Security Management System (ISMS). It allows the organization to assess its own compliance with the established security objectives and controls. By conducting a self-assessment, the organization can identify any deviations or gaps in its security measures and take corrective actions accordingly.

Deviations from the established security objectives and controls can have significant consequences for the organization. These deviations may result in an increased likelihood of security incidents occurring, potential risks not being addressed, or controls not being fully implemented. This can lead to damage to the organization, such as financial losses, reputational damage, or regulatory non-compliance.

To evaluate the effectiveness of the ISMS, the organization should monitor and measure security incidents that occur and their impact on the organization. This can be done by analyzing the recorded security",True,0.38317757009345793,0.1320754716981132,0.23364485981308408,0.9749254584312439,0.9999198913574219,0.7363931695730681,0.25,0.7862443752416014,2.2448558807373047,3.376617193222046,0.001001119613647461,5.621473073959351
Fine-tuned_finetuned-ISO-27001_1024_l2_All_1536_264_False,Hybrid_Rerank_Cohere,2,gpt-3.5-turbo,4096,0,1,What tasks does the role of the risk manager have and why is it important?,"[Document(page_content='with other roles involved in risk management.\nbusiness managers (who are also likely to be information\nasset ‘owners’): are responsible for determining the\ncriticality and sensitivity of business operations and,\ntherefore, of the information assets on which those business\noperations depend. business managers are best placed to\nassess the real asset value that will inform the impact side of\nthe risk assessment equation.\nbusiness and functional managers: those responsible for\nbusiness operations and the procurement process; they must\n61\n4: roles and responsibilities\nalso take an active role in the risk management process.\nthese managers are the individuals with the authority and\nresponsibility for making the trade-off decisions essential to\nachieving business objectives. their involvement in the risk\nmanagement process helps deliver effective security for the\ninformation systems, helping the organisation achieve its\nobjectives with minimal expenditure on resources.\ninformation security officers (isos), information\nsecurity managers and computer security officers: are\nresponsible for their organisation’s information security\nactivity, including the implementation of risk treatment\ndecisions. isos should all be appropriately qualified;\nappropriate qualifications are those (such as cism®,\ncismp) that are focused on managing information security,\nrather than its technical implementation.2> isos have a\nleading role to play in introducing an appropriate, structured\nmethodology that helps identify, evaluate and', metadata={'doc_ID': 712, 'original_text': 'with other roles involved in risk management.\nBusiness managers (who are also likely to be information\nasset ‘owners’): are responsible for determining the\ncriticality and sensitivity of business operations and,\ntherefore, of the information assets on which those business\noperations depend. Business managers are best placed to\nassess the real asset value that will inform the impact side of\nthe risk assessment equation.\nBusiness and functional managers: those responsible for\nbusiness operations and the procurement process; they must\n61\n4: Roles and responsibilities\nalso take an active role in the risk management process.\nThese managers are the individuals with the authority and\nresponsibility for making the trade-off decisions essential to\nachieving business objectives. Their involvement in the risk\nmanagement process helps deliver effective security for the\ninformation systems, helping the organisation achieve its\nobjectives with minimal expenditure on resources.\nInformation security officers (ISOs), information\nsecurity managers and computer security officers: are\nresponsible for their organisation’s information security\nactivity, including the implementation of risk treatment\ndecisions. ISOs should all be appropriately qualified;\nappropriate qualifications are those (such as CISM®,\nCISMP) that are focused on managing information security,\nrather than its technical implementation.2> ISOs have a\nleading role to play in introducing an appropriate, structured\nmethodology that helps identify, evaluate and', 'source': 'Calder - 2019 - Information Security Risk Management for ISO 27001.pdf', 'title': 'Calder - 2019 - Information Security Risk Management for ISO 27001', 'relevance_score': 0.9142907}), Document(page_content='management context.\nrisk management: two phases\nrisk management is the process that allows managers to\nbalance the operational and economic costs of protective\nmeasures and achieve gains in mission capability by\nprotecting the it systems and data that support their\norganisation’s missions.""!\norganisations develop and implement risk management\nstrategies in order to reduce negative impacts and to provide\na structured, consistent basis for making decisions around\nrisk mitigation options. for the purpose of considering the\ntopic of risk management, it has two phases: risk assessment\nand risk treatment, but in practice it is a continual activity\nthat includes horizon scanning, risk assessment, risk\ndecisions, risk treatment(s), communication, reassessment,\nfurther treatments, and so on.\n° iso 27001, clause 5.1 a).\n© tso 27001, clause 5.2 a).\n\'i nist sp 800-30, introduction.\n17\n1: risk management\nrisk assessment is the process of identifying and estimating\nthe risks that the organisation may be subject to.\nrisk treatment is the process of responding to identified risks\nin light of risk decisions.\nrisk assessment typically adopts one of two methods:\ne the process of identifying scenarios, their impact on the\norganisation and the frequency at which they may occur.\ne focusing on information assets and the threats that they\nare subject to. considering the vulnerabilities the threats\nmight exploit enables the risk assessor to identify the\nlikelihood and impact of each identified risk.\nin the simplified', metadata={'doc_ID': 663, 'original_text': 'management context.\nRisk management: two phases\nRisk management is the process that allows managers to\nbalance the operational and economic costs of protective\nmeasures and achieve gains in mission capability by\nprotecting the IT systems and data that support their\norganisation’s missions.""!\nOrganisations develop and implement risk management\nstrategies in order to reduce negative impacts and to provide\na structured, consistent basis for making decisions around\nrisk mitigation options. For the purpose of considering the\ntopic of risk management, it has two phases: risk assessment\nand risk treatment, but in practice it is a continual activity\nthat includes horizon scanning, risk assessment, risk\ndecisions, risk treatment(s), communication, reassessment,\nfurther treatments, and so on.\n° ISO 27001, Clause 5.1 a).\n© TSO 27001, Clause 5.2 a).\n\'I NIST SP 800-30, Introduction.\n17\n1: Risk management\nRisk assessment is the process of identifying and estimating\nthe risks that the organisation may be subject to.\nRisk treatment is the process of responding to identified risks\nin light of risk decisions.\nRisk assessment typically adopts one of two methods:\ne The process of identifying scenarios, their impact on the\norganisation and the frequency at which they may occur.\ne Focusing on information assets and the threats that they\nare subject to. Considering the vulnerabilities the threats\nmight exploit enables the risk assessor to identify the\nlikelihood and impact of each identified risk.\nIn the simplified', 'source': 'Calder - 2019 - Information Security Risk Management for ISO 27001.pdf', 'title': 'Calder - 2019 - Information Security Risk Management for ISO 27001', 'relevance_score': 0.9066531})]","The role of the risk manager encompasses crucial tasks in risk management:

1. Introduction and Implementation:
Responsible for the introduction, implementation, and maintenance of risk management with adequate resources.
2. Ensuring Compliance:
Ensuring that processes align with business requirements and comply with legal and contractual obligations.
3. Maintenance of Security:
Correct application of measures to maintain appropriate security.
4. Audits and Improvements:
Leading audits, responding to results, and continuously improving risk management.
5. Delegation of Tasks:
Delegating tasks, especially to the risk coordinator for risk analysis with departments.
6. Training and Competence Development:
Ensuring that risk management personnel possess necessary competencies through training planning and coordination.

This role is important for effectively managing risks, complying with laws, implementing appropriate security measures, and training personnel, contributing to overall performance improvement in risk management.","The role of the risk manager involves several tasks in the context of risk management. Business managers, who are responsible for determining the criticality and sensitivity of business operations and information assets, play a crucial role in assessing the real asset value that informs the impact side of the risk assessment equation. Business and functional managers, along with procurement process managers, also have an active role in the risk management process. Their involvement helps in making trade-off decisions essential to achieving business objectives and delivering effective security for information systems.

Information security officers (ISOs), information security managers, and computer security officers are responsible for their organization's information security activity, including the implementation of risk treatment decisions. ISOs should be appropriately qualified and have a leading role in introducing a structured methodology for identifying, evaluating, and managing information security risks.

The importance of the risk manager role lies in their",True,0.3745583038869258,0.08540925266903915,0.24734982332155478,0.8417330086231232,0.9986993074417114,0.7172194895089742,1.0,0.9246510010610635,2.161951780319214,3.616856098175049,0.0010068416595458984,5.778807878494263
Fine-tuned_finetuned-ISO-27001_1024_l2_All_1536_264_False,Hybrid_Rerank_Cohere,2,gpt-3.5-turbo,4096,0,1,"What does it mean to monitor or measure objects and their attributes within the framework of the ISMS, and can you give an example for that related to awareness?","[Document(page_content='evaluated with regard to the defined purpose. the question then arises as to what can be derived from the analysis/evaluation for the organization: an assessment of the results.\nin the context of the isms, it is primarily about monitoring the performance of the isms. for this purpose, data is collected during operation that can provide information on:\ne whether the isms is generally able to achieve and maintain the security objectives of the organization (suitability),\ne whether the isms actually achieves the security objectives of the organization with its processes, rules, controls/measures (effectiveness),\ne to what extent the isms in terms of structure, equipment, and operations is appropriate compared to the desired level of security (adequacy).\n26 1 the iso/iec 27000 series of standards and their basic concepts\nfor the organization\'s extended goals (see the keyword ""goals"" in this section), monitoring/measurements can also be established.\nfor all relevant monitoring/measurements, an appropriate program (referred to as a measurement program) should be established within the isms. what is required for this and how the program can be designed will be discussed in chapter 2 in the section on isms-9.1 of the standard.\nto organize the measurement program in the isms properly, especially in a consistent manner, iso 27004 proposes a standardized model for measurements. we will explain it using a simple example and take the incident management process of the isms as an example.\nincident management is the', metadata={'doc_ID': 2574, 'original_text': 'evaluated with regard to the defined purpose. The question then arises as to what can be derived from the analysis/evaluation for the organization: an assessment of the results.\nIn the context of the ISMS, it is primarily about monitoring the performance of the ISMS. For this purpose, data is collected during operation that can provide information on:\ne whether the ISMS is generally able to achieve and maintain the security objectives of the organization (suitability),\ne whether the ISMS actually achieves the security objectives of the organization with its processes, rules, controls/measures (effectiveness),\ne to what extent the ISMS in terms of structure, equipment, and operations is appropriate compared to the desired level of security (adequacy).\n26 1 The ISO/IEC 27000 series of standards and their basic concepts\nFor the organization\'s extended goals (see the keyword ""goals"" in this section), monitoring/measurements can also be established.\nFor all relevant monitoring/measurements, an appropriate program (referred to as a measurement program) should be established within the ISMS. What is required for this and how the program can be designed will be discussed in Chapter 2 in the section on ISMS-9.1 of the standard.\nTo organize the measurement program in the ISMS properly, especially in a consistent manner, ISO 27004 proposes a standardized model for measurements. We will explain it using a simple example and take the incident management process of the ISMS as an example.\nIncident Management is the', 'source': 'ISO 27001_2022_Kersten_und_Schroeder.pdf', 'title': 'ISO 27001_2022_Kersten_und_Schroeder', 'relevance_score': 0.9951136}), Document(page_content='actual objects that should be measured. this defining process could be exemplified by the following\nexample: the organization is the overall object — organization process a/or it system x is a part of that\nobject and constitutes an object in itself— objects within that process that affect information security (people,\nrules, network, applications, facilities etc.) are generally the objects of measure in order to see the\neffectiveness of protecting information.\nwhen implementing an information security measurement program, care should be taken to consider that the\nobjects of measure may serve many organization processes within the isms scope, and may therefore have a\nlarger impact on the effectiveness of the isms and control objectives. such objects should generally be\nprioritized with the scope of the program, such as the security organization and linked process, computer\nhall, co-workers regarding information security, etc.\nthe measurement interval may vary, but is preferable that the measurement is done or summarized at certain\nintervals in order to fit into the management review and the continual improvement process and ambitions of\nthe isms. the design of the program should state this.\nthe reporting of the results should be designed so that communication is assured according to\niso/iec 27004:2009.\n© iso/iec 2010 — all rights reserved 65\niso/iec 27003:2010(e)\nthe design of the information security measurement program should be concluded in a document stipulating\nthe procedure, which should be approved', metadata={'source': 'ISO 27003 2010 (E).pdf', 'title': 'ISO 27003 2010 (E)', 'original_text': 'actual objects that should be measured. This defining process could be exemplified by the following\nexample: The Organization is the overall object — Organization Process A/or IT system X is a part of that\nobject and constitutes an object in itself— Objects within that process that affect information security (People,\nRules, Network, Applications, Facilities etc.) are generally the objects of measure in order to see the\neffectiveness of protecting information.\nWhen implementing an Information Security Measurement Program, care should be taken to consider that the\nobjects of measure may serve many organization processes within the ISMS scope, and may therefore have a\nlarger impact on the effectiveness of the ISMS and Control objectives. Such Objects should generally be\nprioritized with the scope of the program, such as the Security Organization and linked process, Computer\nHall, co-workers regarding information security, etc.\nThe measurement interval may vary, but is preferable that the measurement is done or summarized at certain\nintervals in order to fit into the management review and the continual improvement process and ambitions of\nthe ISMS. The design of the program should state this.\nThe reporting of the results should be designed so that communication is assured according to\nISO/IEC 27004:2009.\n© ISO/IEC 2010 — All rights reserved 65\nISO/IEC 27003:2010(E)\nThe design of the Information Security Measurement program should be concluded in a document stipulating\nthe procedure, which should be approved', 'doc_ID': 1534, 'relevance_score': 0.99290615})]","Within the framework of the ISMS (Information Security Management System), it means to monitor or measure objects and their attributes to analyze and evaluate the effectiveness of the ISMS. An example of this is verifying the effectiveness of organizational measures. The attributes of the objects can include various aspects, such as awareness of a measure. Through interviews, it can be measured how many people are aware of the measure. The results of these measurements can be used to take follow-up actions, such as more intensive training, to improve the effectiveness of the measure. The organization can determine the method of measurement, but certain conditions must be met, such as consistency of measurement results when repeated and regular conduct of the measurements.","In the context of the ISMS (Information Security Management System), monitoring or measuring objects and their attributes refers to collecting data during the operation of the ISMS to assess its performance and effectiveness in achieving the security objectives of the organization. This includes evaluating whether the ISMS is suitable for maintaining the security objectives, whether it is effective in achieving those objectives, and whether it is adequate in terms of structure, equipment, and operations compared to the desired level of security.

An example related to awareness within the ISMS could be measuring the effectiveness of security awareness training programs. The objects of measure in this case would include the people involved in the training program, the rules and policies implemented, the network and applications used for training, and the facilities where the training takes place. By monitoring and measuring these objects, the organization can assess the effectiveness of the security awareness training",True,0.48905109489051096,0.20588235294117646,0.34306569343065696,0.7290946245193481,0.9998666048049927,0.8850928893736858,0.8571428571428571,0.9388260084521064,2.300112009048462,3.441337823867798,0.0009996891021728516,5.74144983291626
Fine-tuned_finetuned-ISO-27001_1024_l2_All_1536_264_False,Hybrid_Rerank_Cohere,2,gpt-3.5-turbo,4096,0,1,Why can conformity to ISO 27001 be important and what benefits does it offer to an organization?,"[Document(page_content='to any organisation.\nthe iso 27001 controls help to clearly categorise potential risks. but what\nare the tangible benefits of mitigating risks?\nnot all organisations choose to adopt iso 27001 certification, but many use it\nas a framework to keep their isms safe from the risk of information security\nbreaches.\niso 27001 compliance demonstrates to stakeholders (such as customers and\nshareholders) that an organisation has prioritised the implementation of\ninformation security best practices. this can lead to the following benefits:\n * improved competitiveness * reduced risks of fines and losses due to data protection breaches * improved brand perception * compliance with relevant business, legal, economic and statutory requirements * improved structure and focus * reduced number of required audits * unbiased assessment of the organisation’s security posture\nin short, iso 27001 certification makes it easier to satisfy regulatory\nobligations, demonstrates your organisation’s reliability to partners, and\nshows your dedication to maintaining the highest standards of information\nsecurity. it also increases the value of your brand, resulting in a win-win\nsituations.\n## our checklist: how to achieve iso 27001 compliance even if they are not seeking official certification, there is always the\noption for organisations to pursue compliance with the iso 27001 standard\nrequirements. the following list shows the best practices you can implement to\nachieve this and can be', metadata={'description': 'ISO 27001 Controls are all 93 measures from Annex A of the new ISO 27001:2022. Explore our Guide and learn everything about the ISO 27001 Annex A controls.', 'doc_ID': 191, 'language': 'en-gb', 'original_text': 'to any organisation.\nThe ISO 27001 controls help to clearly categorise potential risks. But what\nare the tangible benefits of mitigating risks?\nNot all organisations choose to adopt ISO 27001 certification, but many use it\nas a framework to keep their ISMS safe from the risk of information security\nbreaches.\nISO 27001 compliance demonstrates to stakeholders (such as customers and\nshareholders) that an organisation has prioritised the implementation of\ninformation security best practices. This can lead to the following benefits:\n * Improved competitiveness * Reduced risks of fines and losses due to data protection breaches * Improved brand perception * Compliance with relevant business, legal, economic and statutory requirements * Improved structure and focus * Reduced number of required audits * Unbiased assessment of the organisation’s security posture\nIn short, ISO 27001 certification makes it easier to satisfy regulatory\nobligations, demonstrates your organisation’s reliability to partners, and\nshows your dedication to maintaining the highest standards of information\nsecurity. It also increases the value of your brand, resulting in a win-win\nsituations.\n## Our checklist: How to achieve ISO 27001 compliance Even if they are not seeking official certification, there is always the\noption for organisations to pursue compliance with the ISO 27001 standard\nrequirements. The following list shows the best practices you can implement to\nachieve this and can be', 'source': 'https://www.dataguard.co.uk/knowledge/iso-27001-controls-annex-a/', 'title': 'ISO 27001 Controls: Overview of all measures from Annex A', 'relevance_score': 0.9990073}), Document(page_content='for certification can be resource-intensive and time-consuming,\noften taking up to 18 months from the start of the initial certification process in addition to the baseline iso\n27001 certification cost. despite these requirements, iso 27001 certification comes with many benefits that\nset your organization apart from the competition.\nstrongcm 5\nfor example, as the only internationally recognized security standard for isms management, some\norganizations require the companies they work with to demonstrate iso 27001 compliance or certification.\nthus, certification can help you attract and retain clients.\nthis gives organizations of all sizes a clear business advantage and a strong reputation within the international\nmarketplace. plus, even before your organization is officially certified, external audits showing your alignment\nwith iso 27001 isms standards can offer peace of mind to new customers or clients.\nthe regular auditing schedule required for compliance also helps improve your security posture, streamline\nregulatory and compliance reporting, and present new opportunities to strengthen your isms as your\norganization grows and new risks emerge. this is a clear benefit of iso 27001 for startups.\nan iso 27001 audit conducted by an auditing firm or certifying body also provides valuable insight that can\nhelp your organization create more efficient policies or procedures, close security gaps, and improve controls.\nstronger security practices reduce the likelihood of a successful breach, so your organization', metadata={'doc_ID': 1337, 'original_text': 'for certification can be resource-intensive and time-consuming,\noften taking up to 18 months from the start of the initial certification process in addition to the baseline ISO\n27001 certification cost. Despite these requirements, ISO 27001 certification comes with many benefits that\nset your organization apart from the competition.\nstrongcm 5\nFor example, as the only internationally recognized security standard for ISMS management, some\norganizations require the companies they work with to demonstrate ISO 27001 compliance or certification.\nThus, certification can help you attract and retain clients.\nThis gives organizations of all sizes a clear business advantage and a strong reputation within the international\nmarketplace. Plus, even before your organization is officially certified, external audits showing your alignment\nwith ISO 27001 ISMS standards can offer peace of mind to new customers or clients.\nThe regular auditing schedule required for compliance also helps improve your security posture, streamline\nregulatory and compliance reporting, and present new opportunities to strengthen your ISMS as your\norganization grows and new risks emerge. This is a clear benefit of ISO 27001 for startups.\nAn ISO 27001 audit conducted by an auditing firm or certifying body also provides valuable insight that can\nhelp your organization create more efficient policies or procedures, close security gaps, and improve controls.\nStronger security practices reduce the likelihood of a successful breach, so your organization', 'source': 'complete-guide-iso-27001-compliance.pdf', 'title': 'complete-guide-iso-27001-compliance', 'relevance_score': 0.9986276})]","Conformity to ISO 27001 can be important for an organization to meet legal requirements, fulfill external regulations, and be able to participate in bidding processes. Conforming to the standard indicates the organization's competence in information security and can serve as a reference when selecting partners. Additionally, certification provides the advantage of independent experts confirming that information security is in order. A successful audit and certification allow the organization to demonstrate its conformity to third parties and fulfill external regulations.","Conformity to ISO 27001 can be important for organizations as it demonstrates their commitment to implementing information security best practices. By obtaining ISO 27001 certification, organizations can showcase to stakeholders, such as customers and shareholders, that they have prioritized the protection of their information assets. This can lead to several benefits.

Firstly, ISO 27001 certification can improve competitiveness by differentiating the organization from its competitors and giving it a strong reputation within the international marketplace. It can also enhance brand perception, as customers and partners will have confidence in the organization's ability to protect their sensitive information.

Secondly, ISO 27001 certification helps reduce the risks of fines and losses due to data protection breaches. By implementing the controls outlined in ISO 27001, organizations can mitigate potential risks and ensure the confidentiality, integrity, and availability of their information assets",True,0.365296803652968,0.10138248847926268,0.228310502283105,0.9939718246459961,0.9998645782470703,0.7310000614105427,0.8,0.7936408377304894,2.193347454071045,2.9015755653381348,0.0009970664978027344,5.09492301940918
Fine-tuned_finetuned-ISO-27001_1024_l2_All_1536_264_False,Hybrid_Rerank_Cohere,2,gpt-3.5-turbo,4096,0,1,What role do audits and certifications play in providing evidence of compliance with ISO 27001?,"[Document(page_content=""comes to the iso 27001 certification are:\ndocumentation, undergoing audits and ensuring your employees adopt the\nprocesses.\n**documentation** includes the creation and maintenance of necessary\ndocumentation for your information security management system (isms), such as\npolicies, procedures, risk assessments, and controls.\n**undergoing audits** includes both the stage 1 audit, which reviews\ndocumentation and readiness, and the stage 2 audit, which assesses the\npractical implementation of your isms. successful completion of these audits\nis necessary to achieve iso 27001 certification. you will also be required to\nundergo internal audits and management reviews.\nit's also crucial to **communicate the processes effectively** this is to\nensure that your organization's information security practices align with the\niso 27001 standards. you will need to have the documentation in place but also\nput the processes into action by ensuring employees are aware of and follow\nthem.\nthe mandatory documents required for the iso 27001 standard are listed below.\nall criteria must be followed and documented accordingly for an organisation\nto present during external audits. the standard requires you to undergo an\ninternal audit before an external one. this will expose any gaps in your isms.\nonce you have prepared the documentation and undergone an internal audit as\nwell as a management review, you need to undergo an external audit by a\ncertified body such as the ukas.\nthe mandatory documents required for iso 27001 are:\n *"", metadata={'description': 'No matter if you’re an SMB or an international corporation — getting an ISO 27001 certification should be on your agenda. Here’s the ultimate guide on how.', 'doc_ID': 146, 'language': 'en-gb', 'original_text': ""comes to the ISO 27001 certification are:\ndocumentation, undergoing audits and ensuring your employees adopt the\nprocesses.\n**Documentation** includes the creation and maintenance of necessary\ndocumentation for your Information Security Management System (ISMS), such as\npolicies, procedures, risk assessments, and controls.\n**Undergoing audits** includes both the Stage 1 Audit, which reviews\ndocumentation and readiness, and the Stage 2 Audit, which assesses the\npractical implementation of your ISMS. Successful completion of these audits\nis necessary to achieve ISO 27001 certification. You will also be required to\nundergo internal audits and management reviews.\nIt's also crucial to **communicate the processes effectively** This is to\nensure that your organization's information security practices align with the\nISO 27001 standards. You will need to have the documentation in place but also\nput the processes into action by ensuring employees are aware of and follow\nthem.\nThe mandatory documents required for the ISO 27001 standard are listed below.\nAll criteria must be followed and documented accordingly for an organisation\nto present during external audits. The standard requires you to undergo an\ninternal audit before an external one. This will expose any gaps in your ISMS.\nOnce you have prepared the documentation and undergone an internal audit as\nwell as a management review, you need to undergo an external audit by a\ncertified body such as the UKAS.\nThe mandatory documents required for ISO 27001 are:\n *"", 'source': 'https://www.dataguard.co.uk/knowledge/iso-27001-certification/', 'title': 'ISO 27001 Certification: Your ultimate guide [free guide available]', 'relevance_score': 0.99090964}), Document(page_content='you may choose to engage a third-\nparty consultant to perform the internal audit, or a member of your\norganization, who is qualified and independent of the control owners, may\nperform the audit.\n\u200d\n **7\\. complete a full certification audit**\nthis is the key piece of your iso 27001 certification: the full audit. your\ncertification organization will conduct an in-depth investigation of your isms\nto evaluate your iso 27001 compliance. this can be an extensive on-site\nprocess.\n keep in mind, though, that compliance automation software like vanta can make\nthis process simpler. as it scans your system, vanta compiles and documents\nevidence of your compliance, so your auditor will have all this documentation\nin one convenient place.\n\u200d\n **8\\. receive your certification**\nif your auditor determines that you adhere to all the necessary components of\niso 27001, you will officially receive your certification.\n\u200d\n\u200d\n## maintain your iso 27001 certification\n\u200d\nit’s important to understand that iso 27001 certification is not a one-time\nprocess. your certification will need to be renewed to some degree every year.\n these certificates use a three-year cycle. one year after your first\ncertification, your certification organization will conduct a less extensive\naudit to check a few key controls. if you pass this, you’ll retain your\ncertification. if not, the organization will conduct a full, intensive audit\nas they did in the first year.\n the same is true for the second year after your initial certification:', metadata={'description': 'Need to get ISO 27001 certified? Find out what you can expect from the ISO 27001 certification process from security compliance experts.', 'doc_ID': 16, 'language': 'en', 'original_text': 'You may choose to engage a third-\nparty consultant to perform the internal audit, or a member of your\norganization, who is qualified and independent of the control owners, may\nperform the audit.\n\u200d\n **7\\. Complete a full certification audit**\nThis is the key piece of your ISO 27001 certification: the full audit. Your\ncertification organization will conduct an in-depth investigation of your ISMS\nto evaluate your ISO 27001 compliance. This can be an extensive on-site\nprocess.\n Keep in mind, though, that compliance automation software like Vanta can make\nthis process simpler. As it scans your system, Vanta compiles and documents\nevidence of your compliance, so your auditor will have all this documentation\nin one convenient place.\n\u200d\n **8\\. Receive your certification**\nIf your auditor determines that you adhere to all the necessary components of\nISO 27001, you will officially receive your certification.\n\u200d\n\u200d\n## Maintain your ISO 27001 certification\n\u200d\nIt’s important to understand that ISO 27001 certification is not a one-time\nprocess. Your certification will need to be renewed to some degree every year.\n These certificates use a three-year cycle. One year after your first\ncertification, your certification organization will conduct a less extensive\naudit to check a few key controls. If you pass this, you’ll retain your\ncertification. If not, the organization will conduct a full, intensive audit\nas they did in the first year.\n The same is true for the second year after your initial certification:', 'source': 'https://www.vanta.com/resources/how-long-does-it-take-to-get-iso-certified', 'title': 'What is the ISO certification timeline?', 'relevance_score': 0.9906238})]","Audits and certifications play a crucial role in demonstrating conformity to ISO 27001. During and as a result of an audit, deficiencies or deviations from the standard may be identified. Rather than being seen as negative, these findings serve as clear indications of improvement potential that will be further addressed. Following a successful external audit and potential certification, it is confirmed that the Information Security Management System (ISMS) is practical, effective, and well-established.

The audit report, documenting the results, is essential and must comply with the requirements of ISO 19011. To demonstrate conformity to third parties, the audit report can be presented to an independent and trustworthy certification body. This body can issue a recognized certificate of conformity that does not contain critical internal information, making it suitable for dissemination to third parties and for proving compliance with external requirements.

Choosing an accredited certification body is recommended to ensure recognition and comparability. In industries with specific requirements, there may be industry-specific standards in addition to ISO 27001. The audit can be based on both standards, allowing a single assessment to demonstrate conformity. The resulting certificate then attests conformity to both ISO 27001 and, if applicable, the industry-specific standard.","Audits and certifications play a crucial role in providing evidence of compliance with ISO 27001. Undergoing audits, both internal and external, is a mandatory requirement for ISO 27001 certification. The Stage 1 Audit reviews documentation and readiness, while the Stage 2 Audit assesses the practical implementation of the Information Security Management System (ISMS). Successful completion of these audits is necessary to achieve ISO 27001 certification.

During the audits, the organization's ISMS is thoroughly evaluated to determine its compliance with ISO 27001 standards. The audits expose any gaps in the ISMS and ensure that the necessary controls and processes are in place. The documentation prepared by the organization, including policies, procedures, risk assessments, and controls, serves as evidence of compliance during the audits.

Once the audits are successfully completed, and the organization is found to adhere",True,0.4451038575667656,0.13134328358208958,0.2314540059347181,0.9380427002906799,0.9996092915534973,0.8108818165786702,1.0,0.8303117580770261,2.18420672416687,5.032649755477905,0.0009999275207519531,7.216856479644775
Fine-tuned_finetuned-ISO-27001_1024_l2_All_1536_264_False,Hybrid_Rerank_Cohere,2,gpt-3.5-turbo,4096,0,1,Is the audit of the ISMS a one-time thing?,"[Document(page_content=""* the audit must cover all aspects of the isms, including risk assessment, information security controls, isms documentation, awareness and training, and management review. * the audit findings must be documented in a report that is submitted to the organisation's management.\norganisations that are certified according to iso 27001 must also undergo an\nexternal audit by a certification body. there are two kinds of external audit,\none conducted once annually called a surveillance audit where the isms will be\nreviewed as part of ongoing evaluation and the other known as a full external\naudit which is more in-depth and conducted every three years.\nbenefits of iso 27001 audit:\n * improved information security posture * reduced risk of information security incidents * increased compliance with regulations * improved customer confidence * competitive advantage\nif you are considering implementing iso 27001 or if you are already certified,\nit is important to ensure that you are conducting regular internal audits.\ninternal audits are an essential tool for maintaining an effective isms and\nprotecting your organisation from information security threats.\n## where is an internal audit mandatory?\nan internal audit is not required by law or regulation. however, it is a good\npractice for all organisations to conduct regular internal audits of their\ninformation security and other management systems.\nin order to comply with iso 27001, all companies must conduct internal"", metadata={'source': 'https://www.dataguard.co.uk/knowledge/iso-27001/clause-9-2-internal-audit/', 'title': 'ISO 27001 Clause 9.2: Internal Audit', 'description': 'Ensure your ISMS is operating effectively for ISO 27001 compliance. Learn all you need to know about ISO 27001 Clause 9.2 internal audits in our guide.\n', 'language': 'en-gb', 'original_text': ""* The audit must cover all aspects of the ISMS, including risk assessment, information security controls, ISMS documentation, awareness and training, and management review. * The audit findings must be documented in a report that is submitted to the organisation's management.\nOrganisations that are certified according to ISO 27001 must also undergo an\nexternal audit by a certification body. There are two kinds of external audit,\none conducted once annually called a surveillance audit where the ISMS will be\nreviewed as part of ongoing evaluation and the other known as a full external\naudit which is more in-depth and conducted every three years.\nBenefits of ISO 27001 audit:\n * Improved information security posture * Reduced risk of information security incidents * Increased compliance with regulations * Improved customer confidence * Competitive advantage\nIf you are considering implementing ISO 27001 or if you are already certified,\nit is important to ensure that you are conducting regular internal audits.\nInternal audits are an essential tool for maintaining an effective ISMS and\nprotecting your organisation from information security threats.\n## Where is an internal audit mandatory?\nAn internal audit is not required by law or regulation. However, it is a good\npractice for all organisations to conduct regular internal audits of their\ninformation security and other management systems.\nIn order to comply with ISO 27001, all companies must conduct internal"", 'doc_ID': 422, 'relevance_score': 0.996503}), Document(page_content='be seen as part of a more comprehensive monitoring/measurement plan to be determined by the organization itself.\nisms-9.2 - internal audit\nsuch an audit compares the existing reality with the existing requirements. this comparison takes place at specific points in time - practically a snapshot of the conditions. while a one-time audit may be helpful, this procedure only achieves its full effect through regular repetition.\nthe general requirement under isms-9.2 is to conduct internal audits at planned intervals to gain insights into whether the isms:\n- meets the organization\'s own requirements and the requirements of the standard,\n- is effectively established and continuously developed.\n""internal"" means that such an audit is conducted under the control of the organization itself and is carried out by its own personnel - or by external personnel commissioned by the organization. depending on the size and complexity of the organization, an internal audit is more likely to be conducted by an audit team.\nthe planned intervals suggest that a schedule - e.g. annually - is created in which the preparation phase, the audit itself, and the necessary follow-up work - e.g. addressing identified deficiencies - as well as reporting to the management level are pre-planned.\nthe first point mentioned above indicates that the required audit should compare the actual isms with the organization\'s own requirements. a second comparison should reflect the actual isms against the requirements of the standard. the wording also', metadata={'source': 'ISO 27001_2022_Kersten_und_Schroeder.pdf', 'title': 'ISO 27001_2022_Kersten_und_Schroeder', 'original_text': 'be seen as part of a more comprehensive monitoring/measurement plan to be determined by the organization itself.\nISMS-9.2 - Internal Audit\nSuch an audit compares the existing reality with the existing requirements. This comparison takes place at specific points in time - practically a snapshot of the conditions. While a one-time audit may be helpful, this procedure only achieves its full effect through regular repetition.\nThe general requirement under ISMS-9.2 is to conduct internal audits at planned intervals to gain insights into whether the ISMS:\n- meets the organization\'s own requirements and the requirements of the standard,\n- is effectively established and continuously developed.\n""Internal"" means that such an audit is conducted under the control of the organization itself and is carried out by its own personnel - or by external personnel commissioned by the organization. Depending on the size and complexity of the organization, an internal audit is more likely to be conducted by an audit team.\nThe planned intervals suggest that a schedule - e.g. annually - is created in which the preparation phase, the audit itself, and the necessary follow-up work - e.g. addressing identified deficiencies - as well as reporting to the management level are pre-planned.\nThe first point mentioned above indicates that the required audit should compare the actual ISMS with the organization\'s own requirements. A second comparison should reflect the actual ISMS against the requirements of the standard. The wording also', 'doc_ID': 2672, 'relevance_score': 0.9954261})]","No, the audit of the ISMS is not a one-time thing. It is advisable to conduct regular reviews to enable continuous improvements. The certification of the ISMS has a time limit and can only be maintained or extended through repeated audits. The duration of validity of a certificate varies depending on the certification body, but in most cases, annual review audits are required. Additionally, security-related changes must be communicated to the certification board, which can lead to a cause-based examination. It is strongly recommended to plan audits in the long term and conduct external audits as a complement to internal audits.","No, the audit of the ISMS (Information Security Management System) is not a one-time thing. According to the context provided, internal audits are an essential tool for maintaining an effective ISMS and protecting the organization from information security threats. The ISO 27001 standard requires companies to conduct internal audits at planned intervals to ensure that the ISMS meets the organization's own requirements and the requirements of the standard, and is effectively established and continuously developed.

The planned intervals suggest that a schedule, such as annually, is created for conducting internal audits. The audit process includes a preparation phase, the audit itself, necessary follow-up work to address identified deficiencies, and reporting to the management level. The internal audit can be conducted by the organization's own personnel or by external personnel commissioned by the organization, depending on the size and complexity of the organization.

Regular internal",True,0.43650793650793646,0.152,0.24603174603174602,0.8303694427013397,0.9992806315422058,0.7510105625168628,0.8333333333333334,0.9393022271884687,2.2913894653320312,3.322436809539795,0.0010035037994384766,5.613826274871826
Fine-tuned_finetuned-ISO-27001_1024_l2_All_1536_264_False,Hybrid_Rerank_Cohere,2,gpt-3.5-turbo,4096,0,1,What are the different types of audits regarding ISO 27001?,"[Document(page_content=""* the audit must cover all aspects of the isms, including risk assessment, information security controls, isms documentation, awareness and training, and management review. * the audit findings must be documented in a report that is submitted to the organisation's management.\norganisations that are certified according to iso 27001 must also undergo an\nexternal audit by a certification body. there are two kinds of external audit,\none conducted once annually called a surveillance audit where the isms will be\nreviewed as part of ongoing evaluation and the other known as a full external\naudit which is more in-depth and conducted every three years.\nbenefits of iso 27001 audit:\n * improved information security posture * reduced risk of information security incidents * increased compliance with regulations * improved customer confidence * competitive advantage\nif you are considering implementing iso 27001 or if you are already certified,\nit is important to ensure that you are conducting regular internal audits.\ninternal audits are an essential tool for maintaining an effective isms and\nprotecting your organisation from information security threats.\n## where is an internal audit mandatory?\nan internal audit is not required by law or regulation. however, it is a good\npractice for all organisations to conduct regular internal audits of their\ninformation security and other management systems.\nin order to comply with iso 27001, all companies must conduct internal"", metadata={'description': 'Ensure your ISMS is operating effectively for ISO 27001 compliance. Learn all you need to know about ISO 27001 Clause 9.2 internal audits in our guide.\n', 'doc_ID': 422, 'language': 'en-gb', 'original_text': ""* The audit must cover all aspects of the ISMS, including risk assessment, information security controls, ISMS documentation, awareness and training, and management review. * The audit findings must be documented in a report that is submitted to the organisation's management.\nOrganisations that are certified according to ISO 27001 must also undergo an\nexternal audit by a certification body. There are two kinds of external audit,\none conducted once annually called a surveillance audit where the ISMS will be\nreviewed as part of ongoing evaluation and the other known as a full external\naudit which is more in-depth and conducted every three years.\nBenefits of ISO 27001 audit:\n * Improved information security posture * Reduced risk of information security incidents * Increased compliance with regulations * Improved customer confidence * Competitive advantage\nIf you are considering implementing ISO 27001 or if you are already certified,\nit is important to ensure that you are conducting regular internal audits.\nInternal audits are an essential tool for maintaining an effective ISMS and\nprotecting your organisation from information security threats.\n## Where is an internal audit mandatory?\nAn internal audit is not required by law or regulation. However, it is a good\npractice for all organisations to conduct regular internal audits of their\ninformation security and other management systems.\nIn order to comply with ISO 27001, all companies must conduct internal"", 'source': 'https://www.dataguard.co.uk/knowledge/iso-27001/clause-9-2-internal-audit/', 'title': 'ISO 27001 Clause 9.2: Internal Audit', 'relevance_score': 0.99520767}), Document(page_content=""an external auditor, your company will\nfirst be required to perform an internal audit. an internal audit involves a\nthorough examination of your organization’s isms and is one of the best ways\nto ensure that your organization’s isms is operating effectively and is in\nalignment with the iso 27001 standard. specifically, organizations are\nrequired to self-verify conformance with the requirements from annex a of iso\n27001 deemed applicable in the isms's documented statement of applicability.\nthe internal audit is intended to help identify any gaps or deficiencies that\ncould affect your isms and impact your organization’s ability to meet its\nintended objectives, as well as to successfully complete an initial or annual\niso 27001 certification audit and maintain the certification.\n **the internal audit function is a requirement under the iso 27001 standard**\nand can be challenging to implement in a way that meets each of the\nrequirements set forth in the standard, especially for smaller organizations.\nthis is because of the prescriptive nature outlined in the standard, and the\nneed for allocated resources that are both independent of the development and\nmaintenance of the isms, while still possessing the necessary competencies to\nperform the internal audit function.\n**unlike a certification review where you must use an external third-party to\nconduct the audit, the internal audit can be conducted either by staff within\nyour organization or by an independent third party, such as a consulting\nfirm.** when"", metadata={'description': 'In this guide, we share the recommended approach to successful implementation of an Information Security Management System (ISMS) according to the ISO 27001 standard to help prepare your organization to undergo an independent evaluation of your ISMS in order to obtain your ISO 27001 certification.', 'doc_ID': 60, 'language': 'en', 'original_text': ""an external auditor, your company will\nfirst be required to perform an internal audit. An internal audit involves a\nthorough examination of your organization’s ISMS and is one of the best ways\nto ensure that your organization’s ISMS is operating effectively and is in\nalignment with the ISO 27001 standard. Specifically, organizations are\nrequired to self-verify conformance with the requirements from Annex A of ISO\n27001 deemed applicable in the ISMS's documented Statement of Applicability.\nThe internal audit is intended to help identify any gaps or deficiencies that\ncould affect your ISMS and impact your organization’s ability to meet its\nintended objectives, as well as to successfully complete an initial or annual\nISO 27001 certification audit and maintain the certification.\n **The internal audit function is a requirement under the ISO 27001 standard**\nand can be challenging to implement in a way that meets each of the\nrequirements set forth in the standard, especially for smaller organizations.\nThis is because of the prescriptive nature outlined in the standard, and the\nneed for allocated resources that are both independent of the development and\nmaintenance of the ISMS, while still possessing the necessary competencies to\nperform the internal audit function.\n**Unlike a certification review where you must use an external third-party to\nconduct the audit, the internal audit can be conducted either by staff within\nyour organization or by an independent third party, such as a consulting\nfirm.** When"", 'source': 'https://www.vanta.com/resources/the-ultimate-iso-27001-guide-powered-by-vanta-and-aprio', 'title': 'The ultimate ISO 27001 guide', 'relevance_score': 0.9937345})]","There are different types of audits regarding ISO 27001. The first aspect under which audits can be classified is the maturity level of the ISMS being audited. Pre-audits, internal audits, certification audits, surveillance audits, and recertification audits differ in this regard. The second aspect relates to the scope and preparation of the audit. There are audits that are scheduled both in terms of timing and content, audits that are only scheduled in terms of timing and content, and unannounced audits. Each of these types of audits serves its own purpose and is used at different times and in different situations.","There are two types of external audits regarding ISO 27001 certification: surveillance audits and full external audits. Surveillance audits are conducted annually and involve a review of the Information Security Management System (ISMS) as part of ongoing evaluation. Full external audits are more in-depth and are conducted every three years.

In addition to external audits, it is important for organizations to conduct regular internal audits of their information security and other management systems. Internal audits are not mandatory by law or regulation, but they are considered a good practice. They help ensure that the organization's ISMS is operating effectively and in alignment with the ISO 27001 standard.

The internal audit function is a requirement under the ISO 27001 standard. It can be conducted by staff within the organization or by an independent third party, such as a consulting firm. The internal audit helps identify any gaps",True,0.38554216867469876,0.09716599190283401,0.22489959839357432,0.7084099352359772,0.9739962816238403,0.7423753988103764,0.4,0.8689375781222562,2.614001989364624,3.46012544631958,0.0,6.074127435684204
Fine-tuned_finetuned-ISO-27001_1024_l2_All_1536_264_False,Hybrid_Rerank_Cohere,2,gpt-3.5-turbo,4096,0,1,What requirements must be met to qualify as an (internal/external) auditor for an ISMS?,"[Document(page_content=""an external auditor, your company will\nfirst be required to perform an internal audit. an internal audit involves a\nthorough examination of your organization’s isms and is one of the best ways\nto ensure that your organization’s isms is operating effectively and is in\nalignment with the iso 27001 standard. specifically, organizations are\nrequired to self-verify conformance with the requirements from annex a of iso\n27001 deemed applicable in the isms's documented statement of applicability.\nthe internal audit is intended to help identify any gaps or deficiencies that\ncould affect your isms and impact your organization’s ability to meet its\nintended objectives, as well as to successfully complete an initial or annual\niso 27001 certification audit and maintain the certification.\n **the internal audit function is a requirement under the iso 27001 standard**\nand can be challenging to implement in a way that meets each of the\nrequirements set forth in the standard, especially for smaller organizations.\nthis is because of the prescriptive nature outlined in the standard, and the\nneed for allocated resources that are both independent of the development and\nmaintenance of the isms, while still possessing the necessary competencies to\nperform the internal audit function.\n**unlike a certification review where you must use an external third-party to\nconduct the audit, the internal audit can be conducted either by staff within\nyour organization or by an independent third party, such as a consulting\nfirm.** when"", metadata={'description': 'In this guide, we share the recommended approach to successful implementation of an Information Security Management System (ISMS) according to the ISO 27001 standard to help prepare your organization to undergo an independent evaluation of your ISMS in order to obtain your ISO 27001 certification.', 'doc_ID': 60, 'language': 'en', 'original_text': ""an external auditor, your company will\nfirst be required to perform an internal audit. An internal audit involves a\nthorough examination of your organization’s ISMS and is one of the best ways\nto ensure that your organization’s ISMS is operating effectively and is in\nalignment with the ISO 27001 standard. Specifically, organizations are\nrequired to self-verify conformance with the requirements from Annex A of ISO\n27001 deemed applicable in the ISMS's documented Statement of Applicability.\nThe internal audit is intended to help identify any gaps or deficiencies that\ncould affect your ISMS and impact your organization’s ability to meet its\nintended objectives, as well as to successfully complete an initial or annual\nISO 27001 certification audit and maintain the certification.\n **The internal audit function is a requirement under the ISO 27001 standard**\nand can be challenging to implement in a way that meets each of the\nrequirements set forth in the standard, especially for smaller organizations.\nThis is because of the prescriptive nature outlined in the standard, and the\nneed for allocated resources that are both independent of the development and\nmaintenance of the ISMS, while still possessing the necessary competencies to\nperform the internal audit function.\n**Unlike a certification review where you must use an external third-party to\nconduct the audit, the internal audit can be conducted either by staff within\nyour organization or by an independent third party, such as a consulting\nfirm.** When"", 'source': 'https://www.vanta.com/resources/the-ultimate-iso-27001-guide-powered-by-vanta-and-aprio', 'title': 'The ultimate ISO 27001 guide', 'relevance_score': 0.9976495}), Document(page_content='the identified information security requirements, and are\neffectively implemented and maintained.\nhowever, selecting the internal isms auditors may be difficult for small companies. if not enough resources\nare available to have these kinds of audits performed by experienced internal members of staff, external\nexperts should instead be charged with carrying out auditing activities.\\when organizations use external\nauditors, the following should be considered: external auditors are themselves familiar with the internal isms\naudits; however they may not have enough knowledge about the organizational environment of the\norganization. this information should be supplied by internal staff. on the other hand, internal auditors may be\nable to perform detailed audits considering the organization’s organizational environment, but may not have\nenough knowledge about performing isms audits. organizations should recognize the characteristics and\npotential shortcomings of internal vs. external auditors carrying out the internal isms audits.\nthe effectiveness and efficiency of the implemented controls (see iso/iec 27004:2009) should be examined\nwithin the scope of internal audits.\nit is important that none of the audits are carried out by those individuals who were involved in the planning\nand design of the security objectives, because it is difficult to find one’s own mistakes. therefore, organization\nunits or individuals that are outside the scope of internal isms audits should be selected as the auditors by\nmanagement.', metadata={'doc_ID': 1516, 'original_text': 'the identified information security requirements, and are\neffectively implemented and maintained.\nHowever, selecting the internal ISMS auditors may be difficult for small companies. If not enough resources\nare available to have these kinds of audits performed by experienced internal members of staff, external\nexperts should instead be charged with carrying out auditing activities.\\When organizations use external\nauditors, the following should be considered: external auditors are themselves familiar with the internal ISMS\naudits; however they may not have enough knowledge about the organizational environment of the\norganization. This information should be supplied by internal staff. On the other hand, internal auditors may be\nable to perform detailed audits considering the organization’s organizational environment, but may not have\nenough knowledge about performing ISMS audits. Organizations should recognize the characteristics and\npotential shortcomings of internal vs. external auditors carrying out the internal ISMS audits.\nThe effectiveness and efficiency of the implemented controls (see ISO/IEC 27004:2009) should be examined\nwithin the scope of internal audits.\nIt is important that none of the audits are carried out by those individuals who were involved in the planning\nand design of the security objectives, because it is difficult to find one’s own mistakes. Therefore, Organization\nunits or individuals that are outside the scope of internal ISMS audits should be selected as the auditors by\nmanagement.', 'source': 'ISO 27003 2010 (E).pdf', 'title': 'ISO 27003 2010 (E)', 'relevance_score': 0.99732697})]","To qualify as an auditor for an ISMS, several requirements must be met. First, employees from departments involved in the implementation of information security should not be assigned as auditors. Suitable candidates, however, would be employees from the auditing, quality management, or similar cross-functional or staff functions, provided they have experience in the field of information security. It may also be useful to have an IT specialist on the audit team who can assess technical security aspects. Personal requirements are also important, as auditors should be objective, impartial, polite, and correct in their conduct. Furthermore, auditors should not be subordinate to the superiors to ensure independent verification. If certification is sought, it is advisable to document the selection of internal auditors and provide qualification evidence such as training, degrees, or reference projects. External auditors should be qualified and have proof of qualification. It is important that the external audit is conducted separately from any form of consulting to ensure neutrality and objectivity.","To qualify as an auditor for an Information Security Management System (ISMS), there are certain requirements that must be met. According to the context provided, the internal audit function is a requirement under the ISO 27001 standard. The internal audit can be conducted either by staff within the organization or by an independent third party, such as a consulting firm.

When selecting internal auditors, it is important to consider their independence from the development and maintenance of the ISMS. They should possess the necessary competencies to perform the internal audit function. It is also recommended that auditors are individuals or units outside the scope of the internal ISMS audits, as they should not have been involved in the planning and design of the security objectives to avoid bias.

For smaller organizations that may not have enough resources or experienced internal staff, external experts can be hired to carry out",True,0.5192307692307692,0.12258064516129032,0.24358974358974358,0.7094710171222687,0.9985974431037903,0.8342330738076185,0.875,0.8801118589110078,2.2974884510040283,3.6336464881896973,0.0010008811950683594,5.931134939193726
Fine-tuned_finetuned-ISO-27001_1024_l2_All_1536_264_False,Hybrid_Rerank_Cohere,2,gpt-3.5-turbo,4096,0,1,What preparations can be made before an initial audit for the ISO 27001 certification to ensure that the existing documentation meets the requirements of the standard?,"[Document(page_content='auditor should be prepared.\nthere is no substitute for practice so conduct a mock audit beforehand if you can and\nidentify any improvements needed before the day. having obvious signs of information\nsecurity-related activity on display at your location does no harm; this could be performance\ncharts or posters for raising awareness on the walls.\nit’s all about showing the auditor that you are a professional organization that is in control;\nyou may be surprised how little the auditor feels they need to look at if the overall\nimpression they are getting is very positive.\n5.4 during the audit\nthe auditor should have provided an audit plan which will set out the structure of the audit,\nincluding areas to be reviewed, people to be met and timings (this often doesn’t happen so\n page 76 of 79\niso/iec 27001 implementation guide\ndon’t worry if you don’t get one). despite the appearance of power, auditing is quite strictly\nregulated so the auditor will have specific things they need to do, in a specific format,\nstarting with an opening meeting and ending with a closing meeting. do what you can to\nmake it easy for them by providing access to the relevant documents and resources as\nquickly and smoothly as possible.\nbasically, all the auditor is doing is the same exercise as you did yourself when you\nperformed (and repeated) the gap assessment. it’s purely a matter of going through the\nrequirements of the iso/iec 27001 standard and asking to be shown how you meet them.\nthe auditor will need to record the evidence', metadata={'doc_ID': 963, 'original_text': 'auditor should be prepared.\nThere is no substitute for practice so conduct a mock audit beforehand if you can and\nidentify any improvements needed before the day. Having obvious signs of information\nsecurity-related activity on display at your location does no harm; this could be performance\ncharts or posters for raising awareness on the walls.\nIt’s all about showing the auditor that you are a professional organization that is in control;\nyou may be surprised how little the auditor feels they need to look at if the overall\nimpression they are getting is very positive.\n5.4 During the audit\nThe auditor should have provided an audit plan which will set out the structure of the audit,\nincluding areas to be reviewed, people to be met and timings (this often doesn’t happen so\n Page 76 of 79\nISO/IEC 27001 Implementation Guide\ndon’t worry if you don’t get one). Despite the appearance of power, auditing is quite strictly\nregulated so the auditor will have specific things they need to do, in a specific format,\nstarting with an opening meeting and ending with a closing meeting. Do what you can to\nmake it easy for them by providing access to the relevant documents and resources as\nquickly and smoothly as possible.\nBasically, all the auditor is doing is the same exercise as you did yourself when you\nperformed (and repeated) the gap assessment. It’s purely a matter of going through the\nrequirements of the ISO/IEC 27001 standard and asking to be shown how you meet them.\nThe auditor will need to record the evidence', 'source': 'CERTIKIT_ISO27001_Implementation_Guide_v12.pdf.pdf', 'title': 'CERTIKIT_ISO27001_Implementation_Guide_v12.pdf', 'relevance_score': 0.9940197}), Document(page_content='defines the boundaries\nof your organization’s isms, what elements of your\nisms are reviewed for certification, and which\ncontrols are relevant to the scope of your project.\nled\ncc\ncc]\nplanning\nthis section helps organizations to create objectives\nbased on risks and opportunities. organizations use\nthis information to establish a plan to maintain a\nrisk-based approach to isms management and\ndetermine how they will monitor and measure\ntheir objectives.\nperformance evaluation\nthis section guides organizations to define\nprocedures for measuring, monitoring, and main-\ntaining isms records. it also includes information\non establishing an internal audit schedule and\nmanagement reviews to address remediation\nactions for issues discovered during audits.\nimprovement\nhelps organizations create a process for recording\nand managing recommendations for improvement\nand non-conformities discovered during audits.\nthe initial certification process for iso 27001 certificate eligibility comprises two stages: a documentation\nreview audit and an evidential audit. the clauses detailed in part 1 of the iso 27001 structure help organizations\nprepare written documentation, processes, procedures, and guidelines that explain your isms implementation\nand the business processes that support it.\nthese documents are then reviewed by an approved, objective auditor during the stage 1 documentation\nreview. during this first stage, the auditor ensures that a company’s documentation aligns with iso 27001\nstandards and may recommend them', metadata={'doc_ID': 1340, 'original_text': 'defines the boundaries\nof your organization’s ISMS, what elements of your\nISMS are reviewed for certification, and which\ncontrols are relevant to the scope of your project.\nLed\nCc\nCc]\nPlanning\nThis section helps organizations to create objectives\nbased on risks and opportunities. Organizations use\nthis information to establish a plan to maintain a\nrisk-based approach to ISMS management and\ndetermine how they will monitor and measure\ntheir objectives.\nPerformance Evaluation\nThis section guides organizations to define\nprocedures for measuring, monitoring, and main-\ntaining ISMS records. It also includes information\non establishing an internal audit schedule and\nmanagement reviews to address remediation\nactions for issues discovered during audits.\nImprovement\nHelps organizations create a process for recording\nand managing recommendations for improvement\nand non-conformities discovered during audits.\nThe initial certification process for ISO 27001 certificate eligibility comprises two stages: a documentation\nreview audit and an evidential audit. The clauses detailed in part 1 of the ISO 27001 structure help organizations\nprepare written documentation, processes, procedures, and guidelines that explain your ISMS implementation\nand the business processes that support it.\nThese documents are then reviewed by an approved, objective auditor during the Stage 1 Documentation\nReview. During this first stage, the auditor ensures that a company’s documentation aligns with ISO 27001\nstandards and may recommend them', 'source': 'complete-guide-iso-27001-compliance.pdf', 'title': 'complete-guide-iso-27001-compliance', 'relevance_score': 0.9918121})]","To ensure that the existing documentation meets the requirements of the standard, various preparations can be made before an initial audit. One option is to engage external consultants with experience in dealing with the relevant standard. They can assist in writing critical documents or examining existing records to assess conformity. Additionally, contractual agreements with the certification body should be checked to determine which documents and evidence are required and whether they are available, up-to-date, and formally correct. Furthermore, it is important to ensure that the documentation is consistent and coherent and meets the requirements of the standard. Additionally, any agreed-upon corrective and preventive actions from previous audits should be implemented and documented in writing.","Before an initial audit for ISO 27001 certification, there are several preparations that can be made to ensure that the existing documentation meets the requirements of the standard. 

Firstly, conducting a mock audit can be helpful in identifying any improvements needed before the actual audit. This allows the organization to practice and address any potential issues or gaps in their documentation.

Secondly, displaying obvious signs of information security-related activity at the organization's location can create a positive impression for the auditor. This can include performance charts or posters that raise awareness about information security.

Additionally, it is important to provide the auditor with access to relevant documents and resources quickly and smoothly. This can make the audit process easier for the auditor and demonstrate the organization's professionalism and control.

During the audit, the auditor will follow a specific audit plan, which sets out the structure of the audit,",True,0.3955223880597016,0.15789473684210528,0.2537313432835821,0.9107256829738617,0.9999665021896362,0.7117958844036851,0.8333333333333334,0.9078609614564979,2.2553060054779053,3.408416748046875,0.0010018348693847656,5.66372275352478
Fine-tuned_finetuned-ISO-27001_1024_l2_All_1536_264_False,Hybrid_Rerank_Cohere,2,gpt-3.5-turbo,4096,0,1,What would be useful to do just before an external audit for the ISO 27001 certification to become more confident?,"[Document(page_content=""comes to the iso 27001 certification are:\ndocumentation, undergoing audits and ensuring your employees adopt the\nprocesses.\n**documentation** includes the creation and maintenance of necessary\ndocumentation for your information security management system (isms), such as\npolicies, procedures, risk assessments, and controls.\n**undergoing audits** includes both the stage 1 audit, which reviews\ndocumentation and readiness, and the stage 2 audit, which assesses the\npractical implementation of your isms. successful completion of these audits\nis necessary to achieve iso 27001 certification. you will also be required to\nundergo internal audits and management reviews.\nit's also crucial to **communicate the processes effectively** this is to\nensure that your organization's information security practices align with the\niso 27001 standards. you will need to have the documentation in place but also\nput the processes into action by ensuring employees are aware of and follow\nthem.\nthe mandatory documents required for the iso 27001 standard are listed below.\nall criteria must be followed and documented accordingly for an organisation\nto present during external audits. the standard requires you to undergo an\ninternal audit before an external one. this will expose any gaps in your isms.\nonce you have prepared the documentation and undergone an internal audit as\nwell as a management review, you need to undergo an external audit by a\ncertified body such as the ukas.\nthe mandatory documents required for iso 27001 are:\n *"", metadata={'source': 'https://experta.com/shared-post/a73a0b00-a398-4e8a-afcf-632f9631cb69', 'title': 'Experta', 'language': 'No language found.', 'original_text': ""comes to the ISO 27001 certification are:\ndocumentation, undergoing audits and ensuring your employees adopt the\nprocesses.\n**Documentation** includes the creation and maintenance of necessary\ndocumentation for your Information Security Management System (ISMS), such as\npolicies, procedures, risk assessments, and controls.\n**Undergoing audits** includes both the Stage 1 Audit, which reviews\ndocumentation and readiness, and the Stage 2 Audit, which assesses the\npractical implementation of your ISMS. Successful completion of these audits\nis necessary to achieve ISO 27001 certification. You will also be required to\nundergo internal audits and management reviews.\nIt's also crucial to **communicate the processes effectively** This is to\nensure that your organization's information security practices align with the\nISO 27001 standards. You will need to have the documentation in place but also\nput the processes into action by ensuring employees are aware of and follow\nthem.\nThe mandatory documents required for the ISO 27001 standard are listed below.\nAll criteria must be followed and documented accordingly for an organisation\nto present during external audits. The standard requires you to undergo an\ninternal audit before an external one. This will expose any gaps in your ISMS.\nOnce you have prepared the documentation and undergone an internal audit as\nwell as a management review, you need to undergo an external audit by a\ncertified body such as the UKAS.\nThe mandatory documents required for ISO 27001 are:\n *"", 'doc_ID': 283, 'relevance_score': 0.9915544}), Document(page_content='auditor should be prepared.\nthere is no substitute for practice so conduct a mock audit beforehand if you can and\nidentify any improvements needed before the day. having obvious signs of information\nsecurity-related activity on display at your location does no harm; this could be performance\ncharts or posters for raising awareness on the walls.\nit’s all about showing the auditor that you are a professional organization that is in control;\nyou may be surprised how little the auditor feels they need to look at if the overall\nimpression they are getting is very positive.\n5.4 during the audit\nthe auditor should have provided an audit plan which will set out the structure of the audit,\nincluding areas to be reviewed, people to be met and timings (this often doesn’t happen so\n page 76 of 79\niso/iec 27001 implementation guide\ndon’t worry if you don’t get one). despite the appearance of power, auditing is quite strictly\nregulated so the auditor will have specific things they need to do, in a specific format,\nstarting with an opening meeting and ending with a closing meeting. do what you can to\nmake it easy for them by providing access to the relevant documents and resources as\nquickly and smoothly as possible.\nbasically, all the auditor is doing is the same exercise as you did yourself when you\nperformed (and repeated) the gap assessment. it’s purely a matter of going through the\nrequirements of the iso/iec 27001 standard and asking to be shown how you meet them.\nthe auditor will need to record the evidence', metadata={'doc_ID': 963, 'original_text': 'auditor should be prepared.\nThere is no substitute for practice so conduct a mock audit beforehand if you can and\nidentify any improvements needed before the day. Having obvious signs of information\nsecurity-related activity on display at your location does no harm; this could be performance\ncharts or posters for raising awareness on the walls.\nIt’s all about showing the auditor that you are a professional organization that is in control;\nyou may be surprised how little the auditor feels they need to look at if the overall\nimpression they are getting is very positive.\n5.4 During the audit\nThe auditor should have provided an audit plan which will set out the structure of the audit,\nincluding areas to be reviewed, people to be met and timings (this often doesn’t happen so\n Page 76 of 79\nISO/IEC 27001 Implementation Guide\ndon’t worry if you don’t get one). Despite the appearance of power, auditing is quite strictly\nregulated so the auditor will have specific things they need to do, in a specific format,\nstarting with an opening meeting and ending with a closing meeting. Do what you can to\nmake it easy for them by providing access to the relevant documents and resources as\nquickly and smoothly as possible.\nBasically, all the auditor is doing is the same exercise as you did yourself when you\nperformed (and repeated) the gap assessment. It’s purely a matter of going through the\nrequirements of the ISO/IEC 27001 standard and asking to be shown how you meet them.\nThe auditor will need to record the evidence', 'source': 'CERTIKIT_ISO27001_Implementation_Guide_v12.pdf.pdf', 'title': 'CERTIKIT_ISO27001_Implementation_Guide_v12.pdf', 'relevance_score': 0.9861514})]","To feel more confident before an external audit, it would be advisable to conduct a pre-audit shortly beforehand. This pre-audit can be considered as an internal audit carried out in accordance with the requirements of ISO 27001. It is important that a stress test is conducted during this trial run, where the audit subjects and the exact date are not communicated, thus surprising all employees. A favorable time for the pre-audit is about 4 weeks before the official audit, to allow time for any identified deficiencies to be addressed. It is also important to create an audit report listing all identified deficiencies. It is not a problem to identify shortcomings if appropriate measures are derived from them.","To become more confident before an external audit for ISO 27001 certification, it would be useful to conduct a mock audit beforehand. This will allow you to practice and identify any improvements needed before the actual audit. Additionally, displaying obvious signs of information security-related activity at your location, such as performance charts or awareness posters, can create a positive impression on the auditor.

During the audit, the auditor should provide an audit plan that outlines the structure of the audit, including areas to be reviewed, people to be met, and timings. However, if this is not provided, it is not a cause for concern. The auditor will follow a specific format, starting with an opening meeting and ending with a closing meeting. It is important to make it easy for the auditor by providing quick and smooth access to relevant documents and resources.

The auditor's role is to",True,0.4814814814814815,0.16417910447761194,0.2666666666666666,0.8830973207950592,0.9998880624771118,0.7363806241095231,1.0,0.8777789024801876,2.4108715057373047,3.6120452880859375,0.0010378360748291016,6.022916793823242
Fine-tuned_finetuned-ISO-27001_1024_l2_All_1536_264_False,Hybrid_Rerank_Cohere,2,gpt-3.5-turbo,4096,0,1,How is the process of an ISO 27001 audit determined in the planning phase and what steps are involved?,"[Document(page_content='audit is not required by law or regulation. however, it is a good\npractice for all organisations to conduct regular internal audits of their\ninformation security and other management systems.\nin order to comply with iso 27001, all companies must conduct internal audits,\nno matter their country or industry.\n## how to plan and conduct an iso 27001 internal audit\nto plan and conduct an iso 27001 internal audit, organisations should follow\nthe following steps:\n 1. **define the scope of the audit:** the first step is to define the scope of the audit. this includes identifying the isms processes and controls that will be audited. 2. **develop an audit plan:** the next step is to develop an audit plan. this plan should identify the audit objectives, the audit methodology, and the audit resources required. 3. **conduct the audit:** the audit should be conducted in accordance with the audit plan. this involves interviewing staff, reviewing documentation, and observing processes. 4. **document the audit findings:** the audit findings should be documented in a report. this report should include the audit objectives, the audit methodology, the audit findings, and any recommendations for improvement. 5. **follow up on the audit findings:** the organisation should follow up on the audit findings and implement any necessary corrective actions.\n## what to look for during an iso 27001 internal audit\nduring an iso 27001 internal audit, the auditor will look for evidence that\nthe isms is', metadata={'description': 'Ensure your ISMS is operating effectively for ISO 27001 compliance. Learn all you need to know about ISO 27001 Clause 9.2 internal audits in our guide.\n', 'doc_ID': 423, 'language': 'en-gb', 'original_text': 'audit is not required by law or regulation. However, it is a good\npractice for all organisations to conduct regular internal audits of their\ninformation security and other management systems.\nIn order to comply with ISO 27001, all companies must conduct internal audits,\nno matter their country or industry.\n## How to plan and conduct an ISO 27001 internal audit\nTo plan and conduct an ISO 27001 internal audit, organisations should follow\nthe following steps:\n 1. **Define the scope of the audit:** The first step is to define the scope of the audit. This includes identifying the ISMS processes and controls that will be audited. 2. **Develop an audit plan:** The next step is to develop an audit plan. This plan should identify the audit objectives, the audit methodology, and the audit resources required. 3. **Conduct the audit:** The audit should be conducted in accordance with the audit plan. This involves interviewing staff, reviewing documentation, and observing processes. 4. **Document the audit findings:** The audit findings should be documented in a report. This report should include the audit objectives, the audit methodology, the audit findings, and any recommendations for improvement. 5. **Follow up on the audit findings:** The organisation should follow up on the audit findings and implement any necessary corrective actions.\n## What to look for during an ISO 27001 internal audit\nDuring an ISO 27001 internal audit, the auditor will look for evidence that\nthe ISMS is', 'source': 'https://www.dataguard.co.uk/knowledge/iso-27001/clause-9-2-internal-audit/', 'title': 'ISO 27001 Clause 9.2: Internal Audit', 'relevance_score': 0.98813087}), Document(page_content='defines the boundaries\nof your organization’s isms, what elements of your\nisms are reviewed for certification, and which\ncontrols are relevant to the scope of your project.\nled\ncc\ncc]\nplanning\nthis section helps organizations to create objectives\nbased on risks and opportunities. organizations use\nthis information to establish a plan to maintain a\nrisk-based approach to isms management and\ndetermine how they will monitor and measure\ntheir objectives.\nperformance evaluation\nthis section guides organizations to define\nprocedures for measuring, monitoring, and main-\ntaining isms records. it also includes information\non establishing an internal audit schedule and\nmanagement reviews to address remediation\nactions for issues discovered during audits.\nimprovement\nhelps organizations create a process for recording\nand managing recommendations for improvement\nand non-conformities discovered during audits.\nthe initial certification process for iso 27001 certificate eligibility comprises two stages: a documentation\nreview audit and an evidential audit. the clauses detailed in part 1 of the iso 27001 structure help organizations\nprepare written documentation, processes, procedures, and guidelines that explain your isms implementation\nand the business processes that support it.\nthese documents are then reviewed by an approved, objective auditor during the stage 1 documentation\nreview. during this first stage, the auditor ensures that a company’s documentation aligns with iso 27001\nstandards and may recommend them', metadata={'doc_ID': 1340, 'original_text': 'defines the boundaries\nof your organization’s ISMS, what elements of your\nISMS are reviewed for certification, and which\ncontrols are relevant to the scope of your project.\nLed\nCc\nCc]\nPlanning\nThis section helps organizations to create objectives\nbased on risks and opportunities. Organizations use\nthis information to establish a plan to maintain a\nrisk-based approach to ISMS management and\ndetermine how they will monitor and measure\ntheir objectives.\nPerformance Evaluation\nThis section guides organizations to define\nprocedures for measuring, monitoring, and main-\ntaining ISMS records. It also includes information\non establishing an internal audit schedule and\nmanagement reviews to address remediation\nactions for issues discovered during audits.\nImprovement\nHelps organizations create a process for recording\nand managing recommendations for improvement\nand non-conformities discovered during audits.\nThe initial certification process for ISO 27001 certificate eligibility comprises two stages: a documentation\nreview audit and an evidential audit. The clauses detailed in part 1 of the ISO 27001 structure help organizations\nprepare written documentation, processes, procedures, and guidelines that explain your ISMS implementation\nand the business processes that support it.\nThese documents are then reviewed by an approved, objective auditor during the Stage 1 Documentation\nReview. During this first stage, the auditor ensures that a company’s documentation aligns with ISO 27001\nstandards and may recommend them', 'source': 'complete-guide-iso-27001-compliance.pdf', 'title': 'complete-guide-iso-27001-compliance', 'relevance_score': 0.98667485})]","The process of an audit in the planning phase is determined in a joint meeting of the parties involved. The audit subject, objective, and procedure, as well as the necessary personnel, are discussed and consensus is reached. Prior to the actual audit, auditors can create checklists to serve as a guide for the process. During the planning phase, there are technical discussions where the organization presents any changes compared to the previous audit, and the auditors ask questions and express any correction requests.","In the planning phase of an ISO 27001 audit, the process is determined by following certain steps. Firstly, the scope of the audit needs to be defined, which involves identifying the ISMS processes and controls that will be audited. Secondly, an audit plan should be developed, which includes identifying the audit objectives, the audit methodology, and the audit resources required. 

Once the planning is complete, the audit can be conducted. This involves interviewing staff, reviewing documentation, and observing processes. The purpose of the audit is to gather evidence that the ISMS is effectively implemented and maintained.

After conducting the audit, the findings need to be documented in a report. This report should include the audit objectives, the audit methodology, the audit findings, and any recommendations for improvement.

Finally, the organization should follow up on the audit findings and implement any necessary",True,0.39285714285714285,0.11711711711711711,0.26785714285714285,0.90416020154953,0.9998855590820312,0.7461218329906477,0.0,0.9413198226047798,2.509530544281006,3.518193244934082,0.0010013580322265625,6.027723789215088
Fine-tuned_finetuned-ISO-27001_1024_l2_All_1536_264_False,Hybrid_Rerank_Cohere,2,gpt-3.5-turbo,4096,0,1,What should be considered during on-site visits as part of an ISO 27001 audit?,"[Document(page_content='auditor should be prepared.\nthere is no substitute for practice so conduct a mock audit beforehand if you can and\nidentify any improvements needed before the day. having obvious signs of information\nsecurity-related activity on display at your location does no harm; this could be performance\ncharts or posters for raising awareness on the walls.\nit’s all about showing the auditor that you are a professional organization that is in control;\nyou may be surprised how little the auditor feels they need to look at if the overall\nimpression they are getting is very positive.\n5.4 during the audit\nthe auditor should have provided an audit plan which will set out the structure of the audit,\nincluding areas to be reviewed, people to be met and timings (this often doesn’t happen so\n page 76 of 79\niso/iec 27001 implementation guide\ndon’t worry if you don’t get one). despite the appearance of power, auditing is quite strictly\nregulated so the auditor will have specific things they need to do, in a specific format,\nstarting with an opening meeting and ending with a closing meeting. do what you can to\nmake it easy for them by providing access to the relevant documents and resources as\nquickly and smoothly as possible.\nbasically, all the auditor is doing is the same exercise as you did yourself when you\nperformed (and repeated) the gap assessment. it’s purely a matter of going through the\nrequirements of the iso/iec 27001 standard and asking to be shown how you meet them.\nthe auditor will need to record the evidence', metadata={'doc_ID': 963, 'original_text': 'auditor should be prepared.\nThere is no substitute for practice so conduct a mock audit beforehand if you can and\nidentify any improvements needed before the day. Having obvious signs of information\nsecurity-related activity on display at your location does no harm; this could be performance\ncharts or posters for raising awareness on the walls.\nIt’s all about showing the auditor that you are a professional organization that is in control;\nyou may be surprised how little the auditor feels they need to look at if the overall\nimpression they are getting is very positive.\n5.4 During the audit\nThe auditor should have provided an audit plan which will set out the structure of the audit,\nincluding areas to be reviewed, people to be met and timings (this often doesn’t happen so\n Page 76 of 79\nISO/IEC 27001 Implementation Guide\ndon’t worry if you don’t get one). Despite the appearance of power, auditing is quite strictly\nregulated so the auditor will have specific things they need to do, in a specific format,\nstarting with an opening meeting and ending with a closing meeting. Do what you can to\nmake it easy for them by providing access to the relevant documents and resources as\nquickly and smoothly as possible.\nBasically, all the auditor is doing is the same exercise as you did yourself when you\nperformed (and repeated) the gap assessment. It’s purely a matter of going through the\nrequirements of the ISO/IEC 27001 standard and asking to be shown how you meet them.\nThe auditor will need to record the evidence', 'source': 'CERTIKIT_ISO27001_Implementation_Guide_v12.pdf.pdf', 'title': 'CERTIKIT_ISO27001_Implementation_Guide_v12.pdf', 'relevance_score': 0.9781772}), Document(page_content='consideration of what evidence — measures of\neffectiveness — will be required “to provide information on\nwhether the information security management system is\n152\n14: risk treatment and the selection of controls\neffectively implemented and maintained”** and that each\nrisk has been reduced to an acceptable level. in other words,\ncontrols must be constructed in such a manner that any error,\nor failure during their execution, can be promptly detected\nand that planned corrective action, whether automated or\nmanual, is effective in reducing the risk of whatever may\nhappen next to an acceptable level.\nannex a of iso 27001 has 14 major categories of control,\neach of which has a number of subsections. there are 114\nsub-clauses, each of which has a four-character alpha-\nnumeric clause number. each of these is a control under iso\n27001 and each needs to be considered and a decision made\nas to whether or not it is applicable. the outcome of that\ndecision is recorded in the soa, which is described in the\nnext chapter.\nthe application of a control should reduce the risk it is\ndesigned to address. it will not always reduce that risk below\nthe acceptable risk level. in this case, additional controls\nmust be selected and applied until the cumulative effect of\nthe controls is to reduce the identified risk below that\nacceptable risk threshold. the principle of not investing\nmore on controlling a risk continues to apply as the size of\nthe risk is reduced by the application of successive controls.\nit is, in other words,', metadata={'source': 'Calder - 2019 - Information Security Risk Management for ISO 27001.pdf', 'title': 'Calder - 2019 - Information Security Risk Management for ISO 27001', 'original_text': 'consideration of what evidence — measures of\neffectiveness — will be required “to provide information on\nwhether the information security management system is\n152\n14: Risk treatment and the selection of controls\neffectively implemented and maintained”** and that each\nrisk has been reduced to an acceptable level. In other words,\ncontrols must be constructed in such a manner that any error,\nor failure during their execution, can be promptly detected\nand that planned corrective action, whether automated or\nmanual, is effective in reducing the risk of whatever may\nhappen next to an acceptable level.\nAnnex A of ISO 27001 has 14 major categories of control,\neach of which has a number of subsections. There are 114\nsub-clauses, each of which has a four-character alpha-\nnumeric clause number. Each of these is a control under ISO\n27001 and each needs to be considered and a decision made\nas to whether or not it is applicable. The outcome of that\ndecision is recorded in the SoA, which is described in the\nnext chapter.\nThe application of a control should reduce the risk it is\ndesigned to address. It will not always reduce that risk below\nthe acceptable risk level. In this case, additional controls\nmust be selected and applied until the cumulative effect of\nthe controls is to reduce the identified risk below that\nacceptable risk threshold. The principle of not investing\nmore on controlling a risk continues to apply as the size of\nthe risk is reduced by the application of successive controls.\nIt is, in other words,', 'doc_ID': 818, 'relevance_score': 0.97324073})]","During on-site visits as part of an ISO 27001 audit, several things need to be considered. The auditors will want to inspect specific premises, workstations, processes, or IT systems to conduct a comparison between documentation and practice. It is important to plan the route through the premises in advance and only show the relevant areas to minimize potential attack surfaces. If the ISMS is distributed across multiple locations, travel between the sites may be required. The results of the on-site visits will be documented in an audit report and communicated to the organization. Corrective and preventive actions can be agreed upon to address identified issues. In case of significant deviations, a re-audit on-site may be conducted.","During on-site visits as part of an ISO 27001 audit, several considerations should be taken into account. Firstly, the auditor should be prepared and may have provided an audit plan outlining the structure of the audit, areas to be reviewed, people to be met, and timings. However, if an audit plan is not provided, it is not a cause for concern.

To make the audit process easier for the auditor, the organization should provide quick and smooth access to relevant documents and resources. The auditor will be going through the requirements of the ISO/IEC 27001 standard and asking for evidence of how the organization meets them. The evidence should demonstrate the effectiveness of the information security management system and the reduction of risks to an acceptable level.

Annex A of ISO 27001 contains 14 major categories of control, each with subsections and",True,0.43939393939393945,0.16793893129770993,0.2727272727272727,0.5451114773750305,0.9970241189002991,0.7007466186978555,0.875,0.9717846621693694,2.4841971397399902,3.2819149494171143,0.0010001659393310547,5.7661120891571045
Fine-tuned_finetuned-ISO-27001_1024_l2_All_1536_264_False,Hybrid_Rerank_Cohere,2,gpt-3.5-turbo,4096,0,1,What are typical deficits within the security policy and organization that can arise during an ISO 27001 audit?,"[Document(page_content='of these issues.\nsteve also warns against these things when preparing for iso 27001:\nimproperly defining the isms scope\ninadequate employee security training\nimproperly performed risk assessments\nmetrics and implementation plans for info sec don’t align with company objectives\nimproper record keeping—iso is really big on having evidence\ninadequate access controls and access management—especially in devops how do i know my organization is ready for an iso 27001 audit?\nif you’re in a mature organization with several infosec controls, it could merely be putting those policies into place. for those starting from scratch, it could be a heavier lift. once you have everything in place (internal audit, pre-certification readiness assessment), steve recommends conducting a management review to make sure upper management is aware of the entire isms. these reviews go over every single part of the isms—including policies, metrics, operations, and any deficiencies in the internal audit.\nbefore undergoing an audit, steve suggests you have:\nall the basic documentation in place, including running the system for a period of three to six months.\na trained team that promotes a cyber aware culture.\nrisk assessment and risk treatment plans in place.\na connection with your certification body—they can offer specific advice as to what you need to do to get ready and what you should be on the lookout for.\nat least 75% passing tests and controls in your compliance automation system.\n“you’ll know if you’re ready. do', metadata={'description': 'Achieving ISO 27001 can come with a lot of questions. Lead Auditor at ARORA Solutions, Steve Cullen, breaks down how to set your organization up for a successful ISO 27001 audit.', 'doc_ID': 91, 'language': 'en', 'original_text': 'of these issues.\nSteve also warns against these things when preparing for ISO 27001:\nImproperly defining the ISMS scope\nInadequate employee security training\nImproperly performed risk assessments\nMetrics and implementation plans for info sec don’t align with company objectives\nImproper record keeping—ISO is really big on having evidence\nInadequate access controls and access management—especially in DevOps How Do I Know My Organization is Ready for an ISO 27001 Audit?\nIf you’re in a mature organization with several infosec controls, it could merely be putting those policies into place. For those starting from scratch, it could be a heavier lift. Once you have everything in place (internal audit, pre-certification readiness assessment), Steve recommends conducting a management review to make sure upper management is aware of the entire ISMS. These reviews go over every single part of the ISMS—including policies, metrics, operations, and any deficiencies in the internal audit.\nBefore undergoing an audit, Steve suggests you have:\nAll the basic documentation in place, including running the system for a period of three to six months.\nA trained team that promotes a cyber aware culture.\nRisk assessment and risk treatment plans in place.\nA connection with your certification body—they can offer specific advice as to what you need to do to get ready and what you should be on the lookout for.\nAt least 75% passing tests and controls in your compliance automation system.\n“You’ll know if you’re ready. Do', 'source': 'https://www.drata.com/blog/ask-an-auditor-demystifying-iso-27001', 'title': 'Ask an Auditor: Demystifying the ISO 27001 Certification Process With Steve Cullen From ARORA Solutions', 'relevance_score': 0.98469365}), Document(page_content='access control policy.\n144\nchapter 6 execution\nfor external audit: an external auditor conducting the iso 27001 certification audit\nwill check the access control policy in order to verify how the organization has defined\nand communicated the policy to all stakeholders.\na.9.1.2 access to networks and network services (iso 27001 control)\nusers should only be provided access to the network and network services that they have\nbeen specifically authorized to use.\nexplanation/what is required: the requirement is the same as the objective says,\norganizations must ensure only authorized users/employees are provided access to\norganization network and network services. any unauthorized use can pose a threat to\nthe organization’s information.\nthe network policy should cover the following:\ne information on networks that is accessible\ne how the users/employees would be authenticated for permissions\n¢ mode of using the network i.e. wireless, lan, vpn, etc.\ne hownetwork will be monitored to safeguard information\nevidence that can be prepared: access control policy, network control policy,\nnetwork diagram, and network monitoring logs\nwho prepares it: the it helpdesk team along with the information security team\nwould prepare the evidence.\nfor external audit: an external auditor conducting the iso 27001 certification\naudit will check the evidence in order to verify how the organization has defined and\nimplemented network policy, measures taken to protect network and network services.\na.9.2 user access', metadata={'doc_ID': 1167, 'original_text': 'access control policy.\n144\nCHAPTER 6 EXECUTION\nFor external audit: An external auditor conducting the ISO 27001 certification audit\nwill check the access control policy in order to verify how the organization has defined\nand communicated the policy to all stakeholders.\nA.9.1.2 Access to Networks and Network Services (ISO 27001 Control)\nUsers should only be provided access to the network and network services that they have\nbeen specifically authorized to use.\nExplanation/what is required: The requirement is the same as the objective says,\norganizations must ensure only authorized users/employees are provided access to\norganization network and network services. Any unauthorized use can pose a threat to\nthe organization’s information.\nThe network policy should cover the following:\ne Information on networks that is accessible\ne How the users/employees would be authenticated for permissions\n¢ Mode of using the network i.e. wireless, LAN, VPN, etc.\ne Hownetwork will be monitored to safeguard information\nEvidence that can be prepared: Access control policy, network control policy,\nnetwork diagram, and network monitoring logs\nWho prepares it: The IT Helpdesk team along with the information security team\nwould prepare the evidence.\nFor external audit: An external auditor conducting the ISO 27001 certification\naudit will check the evidence in order to verify how the organization has defined and\nimplemented network policy, measures taken to protect network and network services.\nA.9.2 User Access', 'source': 'Chopra, Chaudhary - 2020 - Implementing an Information Security Management System - Security Management Based On ISO 27001.pdf', 'title': 'Chopra, Chaudhary - 2020 - Implementing an Information Security Management System - Security Management Based On ISO 27001', 'relevance_score': 0.88363826})]","Typical deficiencies within the security policy and organization that can occur during an audit are:

1. Lack of involvement from management: No security policies are commissioned or not enforced through signatures. There is no approved resource plan for information security, and there is no official security organization. Additionally, no reporting system has been installed.
2. Lack of participation from organization departments: There is no interest in participation, lack of transparency in business processes, and no contributions to security planning. The level of implementation of measures is unknown, and there is no information flow within the organization.
3. Insufficiently informed and motivated employees: They are not familiar with the guidelines, no training is planned, and they are unaware of their security responsibilities. Furthermore, relevant documents are not available at the workplace.
4. Overloaded security management with conflicting tasks. It functions only as a figurehead.","During an ISO 27001 audit, typical deficits within the security policy and organization that can arise include improperly defined ISMS scope, inadequate employee security training, improperly performed risk assessments, misalignment of metrics and implementation plans with company objectives, improper record keeping, and inadequate access controls and access management, especially in DevOps.

The access control policy is an important aspect that auditors will check during the certification audit. The organization must have defined and communicated the policy to all stakeholders, ensuring that only authorized users/employees are provided access to the network and network services. The policy should cover information on accessible networks, authentication methods for permissions, modes of network usage (e.g., wireless, LAN, VPN), and network monitoring measures to safeguard information.

To prepare for the audit, the IT Helpdesk team along with the information security team should prepare evidence such as",True,0.32280701754385965,0.07773851590106007,0.18245614035087718,0.9865149855613708,0.9999514818191528,0.621240202910956,0.75,0.9984913448815548,2.4533700942993164,52.46797251701355,0.001001596450805664,54.921342611312866
Fine-tuned_finetuned-ISO-27001_1024_l2_All_1536_264_False,Hybrid_Rerank_Cohere,2,gpt-3.5-turbo,4096,0,1,What are typical deficits identified during an ISO 27001 audit regarding assets and risks?,"[Document(page_content='number of security incidents for each damage class defined in the risk analysis during the considered period. since serious incidents should have a greater impact in the assessment than minor ones, it leads to a product formation of ""number x damage class,"" whose distribution then becomes the indicator ""security incidents in the isms.""\nduring audit activities in the isms, security vulnerabilities or weaknesses are often identified or knowledge of possible vulnerabilities and new risks is obtained from various sources. an effective isms is characterized by promptly responding to such insights: recording the insights, analyzing the resulting risks, fixing deficits/weaknesses if necessary, documenting solutions.\nin this context, the efficiency of handling such insights is a notable indicator for the performance of the isms. an organization could proceed with the motto: if we have no deficits or weaknesses, or at least quickly eliminate them, we have largely achieved our goal of secure information processing.\nsecurity objectives have been assigned controls according to isms-6.2. we have already discussed step-by-step plans for the implementation of controls above for each individual control.\nsome things have been implemented, including the possibility of measurements. an interesting aspect here would be the degree of implementation as an average across all controls of the isms - for example, as the average of individual values or with appropriate weighting. it is clear that this average/weighted degree of', metadata={'source': 'ISO 27001_2022_Kersten_und_Schroeder.pdf', 'title': 'ISO 27001_2022_Kersten_und_Schroeder', 'original_text': 'number of security incidents for each damage class defined in the risk analysis during the considered period. Since serious incidents should have a greater impact in the assessment than minor ones, it leads to a product formation of ""number x damage class,"" whose distribution then becomes the indicator ""security incidents in the ISMS.""\nDuring audit activities in the ISMS, security vulnerabilities or weaknesses are often identified or knowledge of possible vulnerabilities and new risks is obtained from various sources. An effective ISMS is characterized by promptly responding to such insights: Recording the insights, analyzing the resulting risks, fixing deficits/weaknesses if necessary, documenting solutions.\nIn this context, the efficiency of handling such insights is a notable indicator for the performance of the ISMS. An organization could proceed with the motto: If we have no deficits or weaknesses, or at least quickly eliminate them, we have largely achieved our goal of secure information processing.\nSecurity objectives have been assigned controls according to ISMS-6.2. We have already discussed step-by-step plans for the implementation of controls above for each individual control.\nsome things have been implemented, including the possibility of measurements. An interesting aspect here would be the degree of implementation as an average across all controls of the ISMS - for example, as the average of individual values or with appropriate weighting. It is clear that this average/weighted degree of', 'doc_ID': 2665, 'relevance_score': 0.93439513}), Document(page_content='they gather about their risks to develop\nand implement appropriate controls to mitigate those risks. controls can be\ntechnical, procedural, or organisational.\norganisations should also conduct internal audits, assessments, and management\nreviews on a regular basis to ensure that their isms is effective in managing\nrisks. this will help organisations to identify and address any gaps in their\nisms.\n> overall, clause 4.1 is an important requirement of iso 27001. by\n> understanding the organisation and its context, organisations can better\n> protect their information assets and achieve their business goals.', metadata={'description': ""Guide to ISO 27001 Clause 4.1: Delve into the organisation's internal & external issues. Explore the significance of this clause in forming a robust ISMS."", 'doc_ID': 198, 'language': 'en-gb', 'original_text': 'they gather about their risks to develop\nand implement appropriate controls to mitigate those risks. Controls can be\ntechnical, procedural, or organisational.\nOrganisations should also conduct internal audits, assessments, and management\nreviews on a regular basis to ensure that their ISMS is effective in managing\nrisks. This will help organisations to identify and address any gaps in their\nISMS.\n> Overall, Clause 4.1 is an important requirement of ISO 27001. By\n> understanding the organisation and its context, organisations can better\n> protect their information assets and achieve their business goals.', 'source': 'https://www.dataguard.co.uk/knowledge/iso-27001/clause-4-1-requirements-of-interested-parties/', 'title': 'ISO 27001 Clause 4.1: Understanding Organisation & Context for Infosec', 'relevance_score': 0.9094255})]","Typical deficiencies in an ISO 27001 audit regarding information assets and risks include:

1. Unidentified information assets: Comprehensive identification and documentation of all relevant information were lacking, leading to unclear protective measures.
2. Inconsistent directories within the organization: There were different directories of information assets within the same organization, indicating a lack of standardization and clear structures.
3. Lack of assignment of information assets to responsible owners: Clear responsibilities for protecting information assets were not established, affecting the effectiveness of information management.
4. Incomplete identification of risks and vulnerabilities: Potential risks were not comprehensively recognized, and vulnerabilities in the security structure were overlooked.
5. Unrealistic risk assessments: The risk analysis was either too detailed or flawed, and the assumed figures were unrealistic, compromising the efficiency of risk assessment.","During an ISO 27001 audit, typical deficits identified regarding assets and risks may include:

1. Inadequate recording and analysis of security vulnerabilities or weaknesses: The organization may not have a systematic process in place to record and analyze insights obtained from various sources, such as internal audits or external vulnerability assessments. This can lead to a lack of awareness of potential vulnerabilities and new risks.

2. Ineffective response to identified risks: The organization may not have a prompt and effective process for responding to insights and fixing deficits or weaknesses. This can result in a delay in implementing appropriate controls to mitigate risks.

3. Insufficient implementation of controls: The organization may not have fully implemented the controls assigned to security objectives according to ISMS-6.2. This can indicate a gap in the organization's ability to manage risks effectively.

4. Lack of regular internal",True,0.42490842490842495,0.09594095940959409,0.2197802197802198,0.6932261884212494,0.999962329864502,0.7645857881462983,0.8333333333333334,0.9979931563602508,2.5285913944244385,3.2511277198791504,0.0010001659393310547,5.779719114303589
Fine-tuned_finetuned-ISO-27001_1024_l2_All_1536_264_False,Hybrid_Rerank_Cohere,2,gpt-3.5-turbo,4096,0,1,How is the ISO 27001 audit report created after an audit and what information does it contain?,"[Document(page_content=""of the isms.\n## how to report on the findings of an iso 27001 internal audit\nthe audit findings should be documented in a report. this report should\ninclude the following:\n * audit objectives: the audit objectives should be clearly stated in the report. * audit methodology: the audit methodology should be described in the report. this includes the audit techniques that were used and the sampling methods that were applied. * audit findings: the audit findings should be described in the report. this includes a description of any weaknesses that were identified in the isms. * recommendations: the report should include any recommendations for improvement.\nthe audit report should be submitted to the organisation's management"", metadata={'description': 'Ensure your ISMS is operating effectively for ISO 27001 compliance. Learn all you need to know about ISO 27001 Clause 9.2 internal audits in our guide.\n', 'doc_ID': 425, 'language': 'en-gb', 'original_text': ""of the ISMS.\n## How to report on the findings of an ISO 27001 internal audit\nThe audit findings should be documented in a report. This report should\ninclude the following:\n * Audit objectives: The audit objectives should be clearly stated in the report. * Audit methodology: The audit methodology should be described in the report. This includes the audit techniques that were used and the sampling methods that were applied. * Audit findings: The audit findings should be described in the report. This includes a description of any weaknesses that were identified in the ISMS. * Recommendations: The report should include any recommendations for improvement.\nThe audit report should be submitted to the organisation's management"", 'source': 'https://www.dataguard.co.uk/knowledge/iso-27001/clause-9-2-internal-audit/', 'title': 'ISO 27001 Clause 9.2: Internal Audit', 'relevance_score': 0.9717254}), Document(page_content='findings:** the organisation should follow up on the audit findings and implement any necessary corrective actions.\n## what to look for during an iso 27001 internal audit\nduring an iso 27001 internal audit, the auditor will look for evidence that\nthe isms is conforming to the requirements of iso 27001 and that it is\noperating effectively. the auditor will focus on the following areas and\nevidence that supports them:\n * risk assessment: the auditor will assess whether the organisation has conducted a thorough risk assessment and whether the identified risks have been appropriately addressed. * information security controls: the auditor will assess whether the organisation has implemented and is maintaining appropriate information security controls to mitigate the identified risks. * isms documentation: the auditor will assess whether the isms is adequately documented. you can find a list of the required documentation for the iso 27001 certification here. * awareness and training: the auditor will assess whether staff are aware of their information security responsibilities and have received appropriate training. * management review: the auditor will assess whether the organisation conducts regular management reviews of the isms.\n## how to report on the findings of an iso 27001 internal audit\nthe audit findings should be documented in a report. this report should\ninclude the following:\n * audit objectives: the audit objectives should be clearly stated in the report.', metadata={'source': 'https://www.dataguard.co.uk/knowledge/iso-27001/clause-9-2-internal-audit/', 'title': 'ISO 27001 Clause 9.2: Internal Audit', 'description': 'Ensure your ISMS is operating effectively for ISO 27001 compliance. Learn all you need to know about ISO 27001 Clause 9.2 internal audits in our guide.\n', 'language': 'en-gb', 'original_text': 'findings:** The organisation should follow up on the audit findings and implement any necessary corrective actions.\n## What to look for during an ISO 27001 internal audit\nDuring an ISO 27001 internal audit, the auditor will look for evidence that\nthe ISMS is conforming to the requirements of ISO 27001 and that it is\noperating effectively. The auditor will focus on the following areas and\nevidence that supports them:\n * Risk assessment: The auditor will assess whether the organisation has conducted a thorough risk assessment and whether the identified risks have been appropriately addressed. * Information security controls: The auditor will assess whether the organisation has implemented and is maintaining appropriate information security controls to mitigate the identified risks. * ISMS documentation: The auditor will assess whether the ISMS is adequately documented. You can find a list of the required documentation for the ISO 27001 certification here. * Awareness and training: The auditor will assess whether staff are aware of their information security responsibilities and have received appropriate training. * Management review: The auditor will assess whether the organisation conducts regular management reviews of the ISMS.\n## How to report on the findings of an ISO 27001 internal audit\nThe audit findings should be documented in a report. This report should\ninclude the following:\n * Audit objectives: The audit objectives should be clearly stated in the report.', 'doc_ID': 424, 'relevance_score': 0.9705764})]","After an ISO 27001 audit, the auditors, possibly supported by specialists, prepare an audit report for the organization's management. The audit report serves to describe the audit process, the input used, and the presentation of identified problems and deviations from the desired state. The audit report also reflects the organization's proposed action plan, including agreed-upon implementation deadlines, assessed as effective by the auditors. In this way, the audit report becomes a document that serves as a basis for preparing the next regular (internal, external) audit. The organization's management, in turn, uses the audit report to decide, assign, and monitor the corrective actions for the identified deficiencies. Remediation of deficiencies should occur without undue delay. If deadlines were already agreed upon during the audit's closing discussion, the responsible management should ensure compliance with these dates. A good audit report is characterized by describing in understandable language what was examined, how it was assessed, and with what results. In cases of deviations from the standard, the auditors specify the normative requirements, describe the found condition regarding documentation and implementation, and provide a justification, if necessary, especially in all non-obvious cases.","After conducting an ISO 27001 internal audit, the audit findings should be documented in a report. This report should include several key elements. Firstly, the audit objectives should be clearly stated in the report. This helps to provide context and clarity on what the audit aimed to achieve. Secondly, the report should describe the audit methodology, including the techniques and sampling methods used during the audit. This helps to ensure transparency and consistency in the audit process.

The report should also include a description of the audit findings. This involves detailing any weaknesses or non-conformities that were identified in the Information Security Management System (ISMS). These findings should be presented objectively and supported by evidence gathered during the audit.

Additionally, the report should provide recommendations for improvement. These recommendations should be based on the identified weaknesses and should aim to address any gaps in the ISMS.

",True,0.44574780058651026,0.08849557522123894,0.2346041055718475,0.9930059313774109,0.9218057990074158,0.7044867283041886,1.0,0.7978254161734687,2.2814407348632812,3.779700756072998,0.001007080078125,6.061141490936279
Fine-tuned_finetuned-ISO-27001_1024_l2_All_1536_264_False,Hybrid_Rerank_Cohere,2,gpt-3.5-turbo,4096,0,1,How is Annex A of ISO 27001 (version 2013) structured and what information does it contain?,"[Document(page_content='to those in annex a as a\ncheck to confirm that no necessary\ncontrol has been overlooked\nrelevance of the soa to certification audits\nthe soa is a principal driver of certification audits. common practice amongst\ncertification bodies is to devise an assessment programme that covers all the\ncontrols in annex a as well as the isms requirements (i.e., iso/iec 27001 clauses\n4-10).\nit is important to realise, however, that the controls in iso/iec 27001 annex a are\nnot requirements, albeit the necessary controls in the soa are organisational\nrequirements. the iso requirement (clause 6.1.3 c)) is the comparison process.\nmoreover, there is no requirement to express the organisation’s necessary controls\nin terms of the annex a controls. that means:\na) the soa does not need to have the same structure as annex a.\nb) provided that there are no unnecessary controls in annex a, the soa does\nnot have to contain any annex a controls (otherwise the soa will have to\nidentify and justify those that are unnecessary).\nhowever, it is prudent to be able to demonstrate conformity with clause 6.1.3 c),\nand most organisations do that by adopting the structure of annex a for their soa.\nthus, the practice of auditing all the controls in annex a is just a shorthand for\nauditing all the necessary controls.\ncustom controls, obviations, and variants\niso/iec 27003 provides guidance and understanding of the iso/iec 27001\nrequirements. in its explanation of the soa, it introduces the concepts of a custom\ncontrol and an obviated', metadata={'doc_ID': 565, 'original_text': 'to those in Annex A as a\ncheck to confirm that no necessary\ncontrol has been overlooked\nRelevance of the SOA to certification audits\nThe SOA is a principal driver of certification audits. Common practice amongst\ncertification bodies is to devise an assessment programme that covers all the\ncontrols in Annex A as well as the ISMS requirements (i.e., ISO/IEC 27001 Clauses\n4-10).\nIt is important to realise, however, that the controls in ISO/IEC 27001 Annex A are\nnot requirements, albeit the necessary controls in the SOA are organisational\nrequirements. The ISO requirement (Clause 6.1.3 c)) is the comparison process.\nMoreover, there is no requirement to express the organisation’s necessary controls\nin terms of the Annex A controls. That means:\na) The SOA does not need to have the same structure as Annex A.\nb) Provided that there are no unnecessary controls in Annex A, the SOA does\nnot have to contain any Annex A controls (otherwise the SOA will have to\nidentify and justify those that are unnecessary).\nHowever, it is prudent to be able to demonstrate conformity with Clause 6.1.3 c),\nand most organisations do that by adopting the structure of Annex A for their SOA.\nThus, the practice of auditing all the controls in Annex A is just a shorthand for\nauditing all the necessary controls.\nCustom controls, obviations, and variants\nISO/IEC 27003 provides guidance and understanding of the ISO/IEC 27001\nrequirements. In its explanation of the SOA, it introduces the concepts of a custom\ncontrol and an obviated', 'source': 'Brewer - 2020 - ISO IEC 27001 Mastering Risk Assessment and the Statement of Applicability.pdf', 'title': 'Brewer - 2020 - ISO IEC 27001 Mastering Risk Assessment and the Statement of Applicability', 'relevance_score': 0.99351174}), Document(page_content='the standard was revised for the third time. the current version of the\nstandard is iso 27001:2022.\nthis framework, iso 27001, safeguards the confidentiality, integrity and\navailability of the sensitive consumer information you collect. compliance\nwith iso 27001 helps you prevent unauthorised access, breaches and regulatory\nfines.\nmoreover, achieving iso 27001 certification not only ensures robust\ninformation security but also aligns with the requirements of nis2, the new eu\ndirective, emphasising its importance in the current digital landscape.\n## what is the iso 27001 annex a?\na simple approach to think of annex a is as a portfolio of information\nsecurity controls that you can choose from – you can pick and select from 93\nmeasures specified in annex a that are relevant to your organisation’s scope.\niso 27001 annex a is arguably the most well-known annex of all the iso\nstandards, as it contains the essential instrument for managing information\nsecurity risks: a list of security controls (or safeguards) that should be\nused to strengthen the security of information assets.\nthe 27001 annex a lists all relevant controls and provides guidance on how to\nimplement the standard measures.\n## iso 27001 vs. iso 27002: what is the difference?\niso 27001 is the framework that gives companies a basic understanding of the\ncontrols and clauses in annex a. while it does not go into great depth\nregarding each control, it does provide you with an idea of what you need to\naccomplish, but not how to execute it. each', metadata={'source': 'https://www.dataguard.co.uk/knowledge/iso-27001-controls-annex-a/', 'title': 'ISO 27001 Controls: Overview of all measures from Annex A', 'description': 'ISO 27001 Controls are all 93 measures from Annex A of the new ISO 27001:2022. Explore our Guide and learn everything about the ISO 27001 Annex A controls.', 'language': 'en-gb', 'original_text': 'the standard was revised for the third time. The current version of the\nstandard is ISO 27001:2022.\nThis framework, ISO 27001, safeguards the confidentiality, integrity and\navailability of the sensitive consumer information you collect. Compliance\nwith ISO 27001 helps you prevent unauthorised access, breaches and regulatory\nfines.\nMoreover, achieving ISO 27001 certification not only ensures robust\ninformation security but also aligns with the requirements of NIS2, the new EU\nDirective, emphasising its importance in the current digital landscape.\n## What is the ISO 27001 Annex A?\nA simple approach to think of Annex A is as a portfolio of information\nsecurity controls that you can choose from – you can pick and select from 93\nmeasures specified in Annex A that are relevant to your organisation’s scope.\nISO 27001 Annex A is arguably the most well-known annex of all the ISO\nstandards, as it contains the essential instrument for managing information\nsecurity risks: a list of security controls (or safeguards) that should be\nused to strengthen the security of information assets.\nThe 27001 Annex A lists all relevant controls and provides guidance on how to\nimplement the standard measures.\n## ISO 27001 vs. ISO 27002: What is the difference?\nISO 27001 is the framework that gives companies a basic understanding of the\ncontrols and clauses in Annex A. While it does not go into great depth\nregarding each control, it does provide you with an idea of what you need to\naccomplish, but not how to execute it. Each', 'doc_ID': 180, 'relevance_score': 0.9928509})]","Annex A of ISO 27001 (version 2013) is a catalog that includes 14 security domains, 35 control objectives, and 114 controls. Each security domain is broken down into one or more objectives that are intended to be achieved through the implementation of the associated controls. Annex A is normative and all controls must be ""addressed,"" but only the controls relevant to the organization need to be implemented. All other controls can be left out, however, this needs to be justified.","Annex A of ISO 27001 (version 2013) is a portfolio of information security controls that organizations can choose from to strengthen the security of their information assets. It contains a list of 93 security controls or safeguards that are relevant to an organization's scope. The controls listed in Annex A are not requirements, but the necessary controls in the Statement of Applicability (SOA) are organizational requirements.

The SOA is a principal driver of certification audits, and it is common practice for certification bodies to assess all the controls in Annex A as well as the ISMS requirements. While the SOA does not need to have the same structure as Annex A, many organizations adopt the structure of Annex A for their SOA to demonstrate conformity with the ISO requirement (Clause 6.1.3 c).

ISO 27003 provides guidance",True,0.365296803652968,0.11981566820276499,0.2648401826484018,0.6030350476503372,0.9988278746604919,0.7065497920233299,0.0,0.858172001407211,2.1610002517700195,3.095146656036377,0.0010478496551513672,5.2561469078063965
Fine-tuned_finetuned-ISO-27001_1024_l2_All_1536_264_False,Hybrid_Rerank_Cohere,2,gpt-3.5-turbo,4096,0,1,What are the 14 security topics included in the appendix of ISO 27001 (version 2013)?,"[Document(page_content='is made up of a list\nof security controls that your company can utilize to improve the security of\nits information assets. iso 27001 comprises 114 controls divided into 14\nsections, also known as domains. the sections are focused on information\ntechnology and beyond, taking into consideration the wide range of factors\nthat can impact the security of your information environment. the 14 iso\ndomains are focused on organizational issues, human resources, it, physical\nsecurity, and legal issues. there is no requirement to implement the full list\nof iso 27001’s controls; rather, they are possibilities for an organization to\nconsider based on its particular needs. utilizing the 114 controls listed in\nannex a, your company can select those that are applicable to the needs of\nyour company and your customers. the 14 domains are:\n * information security policies (a.5)\n * organization of information security and assignment of responsibility (a.6)\n * human resources security (a.7)\n * asset management (a.8)\n * user access control (a.9)\n * encryption and management of sensitive information (a.10)\n * physical and environmental security (a.11)\n * operational security (a.12)\n * communications security (a.13)\n * system acquisition, development, and maintenance (a.14)\n * supplier relationships (a.15)\n * information security incident management (a.16)\n * information security aspects of business continuity management (a.17)\n * compliance (a.18)\n## deep-dive: iso 27001 required documents\niso 27001 isms required', metadata={'source': 'https://www.vanta.com/resources/the-ultimate-iso-27001-guide-powered-by-vanta-and-aprio', 'title': 'The ultimate ISO 27001 guide', 'description': 'In this guide, we share the recommended approach to successful implementation of an Information Security Management System (ISMS) according to the ISO 27001 standard to help prepare your organization to undergo an independent evaluation of your ISMS in order to obtain your ISO 27001 certification.', 'language': 'en', 'original_text': 'is made up of a list\nof security controls that your company can utilize to improve the security of\nits information assets. ISO 27001 comprises 114 controls divided into 14\nsections, also known as domains. The sections are focused on information\ntechnology and beyond, taking into consideration the wide range of factors\nthat can impact the security of your information environment. The 14 ISO\ndomains are focused on organizational issues, human resources, IT, physical\nsecurity, and legal issues. There is no requirement to implement the full list\nof ISO 27001’s controls; rather, they are possibilities for an organization to\nconsider based on its particular needs. Utilizing the 114 controls listed in\nAnnex A, your company can select those that are applicable to the needs of\nyour company and your customers. The 14 domains are:\n * Information security policies (A.5)\n * Organization of information security and assignment of responsibility (A.6)\n * Human resources security (A.7)\n * Asset management (A.8)\n * User access control (A.9)\n * Encryption and management of sensitive information (A.10)\n * Physical and environmental security (A.11)\n * Operational security (A.12)\n * Communications security (A.13)\n * System acquisition, development, and maintenance (A.14)\n * Supplier relationships (A.15)\n * Information security incident management (A.16)\n * Information security aspects of business continuity management (A.17)\n * Compliance (A.18)\n## Deep-dive: ISO 27001 required documents\nISO 27001 ISMS Required', 'doc_ID': 64, 'relevance_score': 0.99317604}), Document(page_content='it easier to apply\nthe relevant controls selectively to your organization.\norganizational controls (37 measures)\nthese controls are applicable when the risks do not fall under the topics of\npeople, technology, or physical security. they include, for example, identity\nmanagement, responsibilities, and evidence collection.\nnew organizational controls include:\n * 5.7: threat intelligence * 5.23: information security for the use of cloud services * 5.30: ict readiness for business continuity\nthreat intelligence is a particularly important innovation in this area. this\nmeasure goes beyond the detection of malicious domain names. threat analysis\nhelps organizations better understand how they can be attacked and take\nappropriate precautions.\npeople controls (8 measures)\nremote work is a hot topic in the people area. however, the restructuring of\nthe working world also comes with risks. this is where the people measures of\niso 27001 come in. the area related to personnel only includes eight controls.\nthese focus on how employees handle sensitive information during their daily\nwork. this includes topics such as remote work, non-disclosure agreements, and\nscreenings. in addition, onboarding and offboarding processes and\nresponsibilities for reporting incidents are relevant.\nphysical controls (14 measures)\nphysical controls include security monitoring, maintenance, facility security,\nand storage media. this category is about how you protect yourself against\nphysical and environmental threats', metadata={'source': 'https://experta.com/shared-post/367d5f2c-e60f-4187-9faf-cb44fb209cdc', 'title': 'Experta', 'language': 'No language found.', 'original_text': 'it easier to apply\nthe relevant controls selectively to your organization.\nOrganizational controls (37 measures)\nThese controls are applicable when the risks do not fall under the topics of\npeople, technology, or physical security. They include, for example, identity\nmanagement, responsibilities, and evidence collection.\nNew organizational controls include:\n * 5.7: Threat intelligence * 5.23: Information security for the use of cloud services * 5.30: ICT readiness for business continuity\nThreat intelligence is a particularly important innovation in this area. This\nmeasure goes beyond the detection of malicious domain names. Threat analysis\nhelps organizations better understand how they can be attacked and take\nappropriate precautions.\nPeople controls (8 measures)\nRemote work is a hot topic in the people area. However, the restructuring of\nthe working world also comes with risks. This is where the people measures of\nISO 27001 come in. The area related to personnel only includes eight controls.\nThese focus on how employees handle sensitive information during their daily\nwork. This includes topics such as remote work, non-disclosure agreements, and\nscreenings. In addition, onboarding and offboarding processes and\nresponsibilities for reporting incidents are relevant.\nPhysical controls (14 measures)\nPhysical controls include security monitoring, maintenance, facility security,\nand storage media. This category is about how you protect yourself against\nphysical and environmental threats', 'doc_ID': 307, 'relevance_score': 0.9692078})]","The 14 security topics in Appendix A of ISO 27001 (version 2013) are:

1. Information security policies
2. Organization of information security
3. Human resource security
4. Asset management
5. Access control
6. Cryptography
7. Physical and environmental security
8. Operations security
9. Communications security
10. Acquisition, development, and maintenance of information systems
11. Supplier relationships
12. Incident management
13. Business continuity management
14. Compliance with legal, contractual, and regulatory requirements.","The 14 security topics included in the appendix of ISO 27001 (version 2013) are as follows:

1. Information security policies (A.5)
2. Organization of information security and assignment of responsibility (A.6)
3. Human resources security (A.7)
4. Asset management (A.8)
5. User access control (A.9)
6. Encryption and management of sensitive information (A.10)
7. Physical and environmental security (A.11)
8. Operational security (A.12)
9. Communications security (A.13)
10. System acquisition, development, and maintenance (A.14)
11. Supplier relationships (A.15)
12. Information security incident management (A.16)
13. Information security aspects of business continuity management (A.17)
14.",True,0.7191011235955056,0.42045454545454547,0.6629213483146067,0.543465867638588,0.9999665021896362,0.9444556797984325,1.0,0.9999999999997647,2.2575273513793945,3.1713201999664307,0.0010044574737548828,5.428847551345825
Fine-tuned_finetuned-ISO-27001_1024_l2_All_1536_264_False,Hybrid_Rerank_Cohere,2,gpt-3.5-turbo,4096,0,1,What is the purpose of information security policies (A.5) in an organization and how are they defined?,"[Document(page_content=""## **what is an information security policy?**\nan information security policy, often referred to as an _infosec policy_ , is\na set of regulations carefully designed to govern the access, use and\nretention of critical business information. these policies implement a robust\nframework of processes and tools to ensure absolute protection against\nunauthorised access, thereby safeguarding an organisation's sensitive\ninformation assets.\ninformation security policies follow a common structure and format. they\ninclude:\n * a statement describing the types of activities covered by the policy\n * a statement of commitment issued by management, providing evidence that management has assigned sufficient resources to support ongoing compliance with the policy\n * a number of specific responsibilities for employees regarding their use and protection of organisational data. note that most organisations should aim to employ a data protection officer, whose role it is to maintain and implement these changes as well as add solutions to data protection problems.\n## **what is annex a.5?**\nthis annex describes the concepts, requirements and recommendations related to\ninformation security policies. the purpose of this annex is to describe the\nconcepts, requirements and recommendations related to information security\npolicies. it covers policy definition, implementation and review.\nin addition to providing guidance on the implementation of information\nsecurity policies, annex a.5 also addresses how to report on"", metadata={'source': 'https://www.dataguard.co.uk/blog/iso-27001-annex-a5-information-security-policies', 'title': 'ISO 27001 - Annex A.5 - Information Security Policies - DataGuard', 'description': ""Annex A 5 is a set of policies that manage how information is stored and used. Read on to learn more about information security policies and its' benefits. "", 'language': 'en-gb', 'original_text': ""## **What is an information security policy?**\nAn information security policy, often referred to as an _infosec policy_ , is\na set of regulations carefully designed to govern the access, use and\nretention of critical business information. These policies implement a robust\nframework of processes and tools to ensure absolute protection against\nunauthorised access, thereby safeguarding an organisation's sensitive\ninformation assets.\nInformation security policies follow a common structure and format. They\ninclude:\n * A statement describing the types of activities covered by the policy\n * A statement of commitment issued by management, providing evidence that management has assigned sufficient resources to support ongoing compliance with the policy\n * A number of specific responsibilities for employees regarding their use and protection of organisational data. Note that most organisations should aim to employ a data protection officer, whose role it is to maintain and implement these changes as well as add solutions to data protection problems.\n## **What is Annex A.5?**\nThis Annex describes the concepts, requirements and recommendations related to\ninformation security policies. The purpose of this Annex is to describe the\nconcepts, requirements and recommendations related to information security\npolicies. It covers policy definition, implementation and review.\nIn addition to providing guidance on the implementation of information\nsecurity policies, Annex A.5 also addresses how to report on"", 'doc_ID': 443, 'relevance_score': 0.99928474}), Document(page_content='though both are against organisational policy), that could be considered inconsistent enforcement.\n * **integrity:** when assigning system permissions, have the system users got minimum viable access rights, or do they have permissions that could compromise the integrity of the system unnecessarily?\n## **what is the objective of annex a.5?**\nthe purpose of information security policies is to help protect an\norganisation’s assets and operations from risks associated with cybersecurity.\nthey are meant to be flexible enough to cover different types of systems and\ntheir vulnerabilities, as well as multiple modes of operation, such as\ntraditional and cloud-based operations.\ninformation security policies are the documents that define the standards for\ninformation security within an organisation. they can be formal or informal.\nthis annex describes how to develop an information security policy and how to\nimplement it in your organisation.\n## **what are the annex a.5 information security policy controls?**\n### **a.5.1.1 policies for information security**\naccording to iso 27001, all organisations must conduct themselves in a\ntransparent manner with their stakeholders. to protect their data, all\nstakeholders must be informed of the policies in place within the\norganisation.\npolicies play a critical role throughout the whole information security\nprocess. therefore, any policies created by the business must first be\nexamined, authorised, and then communicated to employees and third parties.\nthey must also be', metadata={'source': 'https://www.dataguard.co.uk/blog/iso-27001-annex-a5-information-security-policies', 'title': 'ISO 27001 - Annex A.5 - Information Security Policies - DataGuard', 'description': ""Annex A 5 is a set of policies that manage how information is stored and used. Read on to learn more about information security policies and its' benefits. "", 'language': 'en-gb', 'original_text': 'though both are against organisational policy), that could be considered inconsistent enforcement.\n * **Integrity:** When assigning system permissions, have the system users got minimum viable access rights, or do they have permissions that could compromise the integrity of the system unnecessarily?\n## **What is the objective of Annex A.5?**\nThe purpose of information security policies is to help protect an\norganisation’s assets and operations from risks associated with cybersecurity.\nThey are meant to be flexible enough to cover different types of systems and\ntheir vulnerabilities, as well as multiple modes of operation, such as\ntraditional and cloud-based operations.\nInformation security policies are the documents that define the standards for\ninformation security within an organisation. They can be formal or informal.\nThis Annex describes how to develop an information security policy and how to\nimplement it in your organisation.\n## **What are the Annex A.5 information security policy controls?**\n### **A.5.1.1 Policies for information security**\nAccording to ISO 27001, all organisations must conduct themselves in a\ntransparent manner with their stakeholders. To protect their data, all\nstakeholders must be informed of the policies in place within the\norganisation.\nPolicies play a critical role throughout the whole information security\nprocess. Therefore, any policies created by the business must first be\nexamined, authorised, and then communicated to employees and third parties.\nThey must also be', 'doc_ID': 445, 'relevance_score': 0.9992206})]","Information security policies (A.5) hold great importance in an organization. They serve to depict the overall direction of the organization regarding information security and establish goals and strategies to achieve these objectives. These policies contain fundamental rules and procedures that are applicable within the organization. In addition to a security policy, there are often topic-specific security policies targeting specific audiences, which describe the applicable security rules and measures for a particular subject. Examples of such policies include workplace security practices, virus/malware protection, email security, and access control. The organization is free to create and implement relevant policies.","The purpose of information security policies (A.5) in an organization is to protect the organization's assets and operations from cybersecurity risks. These policies define the standards for information security within the organization and provide guidance on how to develop and implement an information security policy. 

Information security policies are designed to govern the access, use, and retention of critical business information. They ensure the protection of sensitive information assets by implementing a robust framework of processes and tools. 

The policies include a statement describing the types of activities covered, a statement of commitment from management, and specific responsibilities for employees regarding the use and protection of organizational data. 

Annex A.5 of ISO 27001 describes the concepts, requirements, and recommendations related to information security policies. It covers policy definition, implementation, and review. The objective of Annex A.5 is to provide guidance",True,0.43442622950819676,0.14049586776859505,0.2786885245901639,0.8874289393424988,0.9999620914459229,0.7386937801865131,0.8333333333333334,0.9403194719349314,2.5359997749328613,3.015432119369507,0.0010001659393310547,5.551431894302368
Fine-tuned_finetuned-ISO-27001_1024_l2_All_1536_264_False,Hybrid_Rerank_Cohere,2,gpt-3.5-turbo,4096,0,1,What should a guideline for the use of mobile devices in a professional context include?,"[Document(page_content='never be left unattended.\nnotebooks should always be carried as hand luggage and, wherever\npossible, disguised. notebook computers or usb sticks should not be left\nin cabs, on planes or anywhere else — but they often are, and the\norganization needs to think through the consequent risks. possible\ncontrols include placing a limit on the data that can be carried on the c:\ndrive of a notebook, requiring back-ups to a usb stick to be carried out\nat regular intervals, signing up for a web-based incremental back-up\nservice, and limiting the period of time that confidential information can\nbe stored on the notebook. preferably, password protection (including\nscreen savers) should be standard, and confidential information should\nbe encrypted. mobile devices should be backed up regularly, and access\nto both smartphones should be restricted by means of access codes.\n- staff should be trained in how to protect equipment from risks identified\nby the manufacturer, such as electromagnetic fields, and these requirements\nshould be built into the user authorization requirements. while the idea\nof creating rules for handoffs between staff in relation to custody of\nmobile devices seems intellectually interesting, the reality is that devices\nwill be lost or mislaid and, therefore, building remote wipe into the\nmobile device policy may be a more pragmatic solution to this issue than\nan exchanges log.\n« a risk assessment in respect of home working should lead to designation\nof standard — and, where necessary, special — measures,', metadata={'source': 'Watkins, Calder - 2020 - IT Governance - An International Guide to Data Security and ISO 27001 ISO 27002.pdf', 'title': 'Watkins, Calder - 2020 - IT Governance - An International Guide to Data Security and ISO 27001 ISO 27002', 'original_text': 'never be left unattended.\nNotebooks should always be carried as hand luggage and, wherever\npossible, disguised. Notebook computers or USB sticks should not be left\nin cabs, on planes or anywhere else — but they often are, and the\norganization needs to think through the consequent risks. Possible\ncontrols include placing a limit on the data that can be carried on the C:\ndrive of a notebook, requiring back-ups to a USB stick to be carried out\nat regular intervals, signing up for a web-based incremental back-up\nservice, and limiting the period of time that confidential information can\nbe stored on the notebook. Preferably, password protection (including\nscreen savers) should be standard, and confidential information should\nbe encrypted. Mobile devices should be backed up regularly, and access\nto both smartphones should be restricted by means of access codes.\n- Staff should be trained in how to protect equipment from risks identified\nby the manufacturer, such as electromagnetic fields, and these requirements\nshould be built into the user authorization requirements. While the idea\nof creating rules for handoffs between staff in relation to custody of\nmobile devices seems intellectually interesting, the reality is that devices\nwill be lost or mislaid and, therefore, building remote wipe into the\nmobile device policy may be a more pragmatic solution to this issue than\nan exchanges log.\n« A risk assessment in respect of home working should lead to designation\nof standard — and, where necessary, special — measures,', 'doc_ID': 2270, 'relevance_score': 0.9832789}), Document(page_content='(notebooks, smart-\nphones).\nit governance\nthis policy should consolidate all the procedures discussed elsewhere in\nthis manual in respect of mobile computing and handheld usage. it should\nset out clearly the requirements for physical protection, access controls,\ncryptography, back-ups and malware protection. it should include clear\nguidance on how to connect to the organizational network and how mobile\ntools should be used in public places. ‘public places’ include meeting rooms\noutside the organization’s own secure premises and wherever notebooks\nand handhelds remain tempting targets for hackers and thieves, who can\nhave as much impact on the availability of data as a particularly virulent\nvirus. guidance on where mobile devices may be used, and for what\npurposes, should also be provided, with due consideration being given to\nwho may be able to see or hear what is being ‘processed’.\nthe organization will need to develop an effective method of ensuring\nthat anti-malware protection is completely up to date on mobile computers\n(which are also known as ‘endpoints’, reflecting the reality that for many\nnetworks, it is the notebook and mobile devices that exist beyond the secure\ncorporate perimeter that are the endpoint for corporate security activity).\nthis is best done by using an automatic update service that updates all\ncomputers the moment they log on to the organizational network. it is\nimportant that the mobile user is not given any authority to override this\nupdate and is not able to proceed until the', metadata={'source': 'Watkins, Calder - 2020 - IT Governance - An International Guide to Data Security and ISO 27001 ISO 27002.pdf', 'title': 'Watkins, Calder - 2020 - IT Governance - An International Guide to Data Security and ISO 27001 ISO 27002', 'original_text': '(notebooks, smart-\nphones).\nIT GOVERNANCE\nThis policy should consolidate all the procedures discussed elsewhere in\nthis manual in respect of mobile computing and handheld usage. It should\nset out clearly the requirements for physical protection, access controls,\ncryptography, back-ups and malware protection. It should include clear\nguidance on how to connect to the organizational network and how mobile\ntools should be used in public places. ‘Public places’ include meeting rooms\noutside the organization’s own secure premises and wherever notebooks\nand handhelds remain tempting targets for hackers and thieves, who can\nhave as much impact on the availability of data as a particularly virulent\nvirus. Guidance on where mobile devices may be used, and for what\npurposes, should also be provided, with due consideration being given to\nwho may be able to see or hear what is being ‘processed’.\nThe organization will need to develop an effective method of ensuring\nthat anti-malware protection is completely up to date on mobile computers\n(which are also known as ‘endpoints’, reflecting the reality that for many\nnetworks, it is the notebook and mobile devices that exist beyond the secure\ncorporate perimeter that are the endpoint for corporate security activity).\nThis is best done by using an automatic update service that updates all\ncomputers the moment they log on to the organizational network. It is\nimportant that the mobile user is not given any authority to override this\nupdate and is not able to proceed until the', 'doc_ID': 2079, 'relevance_score': 0.94407386})]","A guideline for the use of mobile devices in a professional context should include the following:

- Determination of whether the professional use of personal mobile devices (BYOD) is allowed
- Regulations regarding the private use of organization-owned mobile devices
- Guidelines for procurement, configuration, and issuance of mobile devices
- Clarification of software licensing issues and restrictions on configuration changes
- Regulations regarding the use of organization-owned devices by third parties
- Obligation to report suspected misuse or loss of a device
- Measures for theft protection
- Obligation to apply cryptographic procedures
- Rules for backup, restore, online synchronization, and antivirus protection
- Prohibition of using unsecured Wi-Fi and hotspots","A guideline for the use of mobile devices in a professional context should include the following:

1. Physical protection: Mobile devices should never be left unattended and should be carried as hand luggage. They should be disguised whenever possible to minimize the risk of theft.

2. Data protection: Limit the amount of data that can be carried on the device's C: drive. Regular backups to a USB stick or a web-based incremental backup service should be required. Confidential information should be encrypted and password-protected, including screen savers.

3. Access controls: Access to mobile devices, especially smartphones, should be restricted by means of access codes. Staff should be trained on how to protect equipment from risks identified by the manufacturer, such as electromagnetic fields.

4. Remote wipe: Building remote wipe capability into the mobile device policy can be a pragmatic solution to the risk",True,0.33466135458167334,0.14457831325301207,0.247011952191235,0.7982895076274872,0.9999450445175171,0.7216582334986952,1.0,0.9267046749174419,2.2767324447631836,3.2034645080566406,0.001001596450805664,5.480196952819824
Fine-tuned_finetuned-ISO-27001_1024_l2_All_1536_264_False,Hybrid_Rerank_Cohere,2,gpt-3.5-turbo,4096,0,1,How does ISO 27001 certification ensure the security of employees and contractors in terms of their responsibilities and roles?,"[Document(page_content='version 2015)\nobjective: to ensure that employees, contractors and third party users understand their\nresponsibilities, and are suitable for the roles they are considered for, and to reduce the\nrisk of theft, fraud or misuse of facilities.\na.8.1.1\nroles and responsibilities\ncontrol\nsecurity roles and responsibilities of employees, contractors and third party users shall be\ndefined and documented in accordance with the organization’s information security\npolicy.\na.8.1.2\nscreening\ncontrol\nbackground verification checks on all candidates for employment, contractors, and third\nparty users shall be carried out in accordance with relevant laws, regulations and ethics,\nand proportional to the business requirements, the classification of the information to be\naccessed, and the perceived risks.\na.8.1.3 terms and conditions of employment\ncontrol\nas part of their contractual obligation, employees, contractors and third party users shall\nagree and sign the terms and conditions of their employment contract, which shall state\ntheir and the organization’s responsibilities for information security.\na. 8.2 during employment (iso 27001:2015, version 2015)\nobjective: to ensure that all employees, contractors and third party users are aware of\ninformation security threats and concerns, their responsibilities and liabilities, and are\nequipped to support organizational security policy in the course of their normal work, and\nto reduce the risk of human error.\na.8.2.1\nmanagement responsibilities\ncontrol\nmanagement', metadata={'source': 'ISO 27001 Controls and Objectives Annex A.pdf', 'title': 'ISO 27001 Controls and Objectives Annex A', 'original_text': 'Version 2015)\nObjective: To ensure that employees, contractors and third party users understand their\nresponsibilities, and are suitable for the roles they are considered for, and to reduce the\nrisk of theft, fraud or misuse of facilities.\nA.8.1.1\nRoles and responsibilities\nControl\nSecurity roles and responsibilities of employees, contractors and third party users shall be\ndefined and documented in accordance with the organization’s information security\npolicy.\nA.8.1.2\nScreening\nControl\nBackground verification checks on all candidates for employment, contractors, and third\nparty users shall be carried out in accordance with relevant laws, regulations and ethics,\nand proportional to the business requirements, the classification of the information to be\naccessed, and the perceived risks.\nA.8.1.3 Terms and conditions of employment\nControl\nAs part of their contractual obligation, employees, contractors and third party users shall\nagree and sign the terms and conditions of their employment contract, which shall state\ntheir and the organization’s responsibilities for information security.\nA. 8.2 During employment (ISO 27001:2015, Version 2015)\nObjective: To ensure that all employees, contractors and third party users are aware of\ninformation security threats and concerns, their responsibilities and liabilities, and are\nequipped to support organizational security policy in the course of their normal work, and\nto reduce the risk of human error.\nA.8.2.1\nManagement responsibilities\nControl\nManagement', 'doc_ID': 1411, 'relevance_score': 0.9989267}), Document(page_content='they will check\nwhether all the terms and conditions are stated clearly and completely.\na.7.2 during employment\nobjective: to ensure that employees and contractors are aware of and fulfill their\ninformation security responsibilities.\nexplanation: employees are fully aware of the threats to their data that occur during\ntheir daily job activities and understand their responsibilities to mitigate these threats.\na.7.2.1 management responsibilities (iso 27001 control)\nmanagement should require all employees and contractors to follow the information\nsecurity guidelines in accordance with the established policies and procedures of the\norganization.\nexplanation/what is required: this control requires management to communicate\nto employees and contractors the standard operating procedures to ensure that security\npractices are implemented accordingly.\nevidence that can be prepared: communication emails, minutes of the meeting,\nand signed/approved policies and procedures.\nwho prepares it: an email from management, and the minutes of a meeting to be\nmaintained by the information security team. the information security department\nshould also maintain signed hard copies of approved policies and procedures and scan\nsoft copies to be maintained as a backup.\nfor external audit: the external auditor conducting the iso 27001 certification\naudit will check for the evidence.\n133\nchapter 6 execution\na.7.2.2 information security awareness, education, and training (iso\n27001 control)\nall employees of the organization', metadata={'source': 'Chopra, Chaudhary - 2020 - Implementing an Information Security Management System - Security Management Based On ISO 27001.pdf', 'title': 'Chopra, Chaudhary - 2020 - Implementing an Information Security Management System - Security Management Based On ISO 27001', 'original_text': 'they will check\nwhether all the terms and conditions are stated clearly and completely.\nA.7.2 During Employment\nObjective: To ensure that employees and contractors are aware of and fulfill their\ninformation security responsibilities.\nExplanation: Employees are fully aware of the threats to their data that occur during\ntheir daily job activities and understand their responsibilities to mitigate these threats.\nA.7.2.1 Management Responsibilities (ISO 27001 Control)\nManagement should require all employees and contractors to follow the information\nsecurity guidelines in accordance with the established policies and procedures of the\norganization.\nExplanation/what is required: This control requires management to communicate\nto employees and contractors the standard operating procedures to ensure that security\npractices are implemented accordingly.\nEvidence that can be prepared: Communication emails, minutes of the meeting,\nand signed/approved policies and procedures.\nWho prepares it: An email from management, and the minutes of a meeting to be\nmaintained by the information security team. The information security department\nshould also maintain signed hard copies of approved policies and procedures and scan\nsoft copies to be maintained as a backup.\nFor external audit: The external auditor conducting the ISO 27001 certification\naudit will check for the evidence.\n133\nCHAPTER 6 EXECUTION\nA.7.2.2 Information Security Awareness, Education, and Training (ISO\n27001 Control)\nAll employees of the organization', 'doc_ID': 1149, 'relevance_score': 0.9983515})]","ISO 27001 certification ensures the security of employees and contractors in terms of their responsibilities and roles by prescribing specific controls and measures. For example, control A.7.1.1 requires a security screening of all individuals applying for employment. This screening must be in accordance with relevant laws, regulations, and ethical principles, and be appropriate to the business requirements, classification of information to be obtained, and perceived risks. It is important that applicants are sufficiently qualified for their tasks and understand their responsibilities. Such screening may include various aspects such as identity verification, verification of education and qualifications, background checks, etc. For personnel provided by contractors, the screening can be done in collaboration with the contractor. It is also important to ensure that the screenings are conducted in accordance with legal requirements and that the information obtained is appropriate for the purpose of the screening.","ISO 27001 certification ensures the security of employees and contractors in terms of their responsibilities and roles through several controls outlined in the standard. 

Firstly, the roles and responsibilities of employees, contractors, and third-party users are defined and documented in accordance with the organization's information security policy (A.8.1.1). This ensures that everyone understands their specific responsibilities and what is expected of them in terms of information security.

Secondly, background verification checks are carried out on all candidates for employment, contractors, and third-party users in accordance with relevant laws, regulations, and ethics (A.8.1.2). This helps to ensure that individuals with a history of theft, fraud, or other security risks are not given access to sensitive information or facilities.

Thirdly, employees, contractors, and third-party users are required to agree and",True,0.5352112676056338,0.22695035460992907,0.29577464788732394,0.9608904719352722,0.9999659061431885,0.808318324869004,0.6,0.9143046639987205,2.80029034614563,3.2894105911254883,0.001003265380859375,6.089700937271118
Fine-tuned_finetuned-ISO-27001_1024_l2_All_1536_264_False,Hybrid_Rerank_Cohere,2,gpt-3.5-turbo,4096,0,1,What activities does control A.7.2.2 include to create adequate awareness among employees?,"[Document(page_content='7.2 and 7.3 of the standard and control a.7.2 (information secu-\nrity awareness and training) require the organization to ensure that its\nemployees and contractors are aware of information security threats as well\nas their responsibilities and liabilities, and that it has appropriately compe-\ntent personnel. the objective of this clause is simply to ensure that all users\nof the organization’s information assets, or those who are assigned respon-\nsibilities in the isms, are aware of information security threats and are\ncompetent and adequately equipped to perform the requested tasks and to\nsupport the organization’s information security policy in their work.\ncontrol a.7.2.2 deals with information security awareness, education\nand training, and follows on from the previous control. all employees of the\norganization (including contractors) must receive appropriate awareness\ntraining and other training, as well as regular updates and communications.\ntraditional training, which relies on someone delivering subject matter\nfrom the front of the classroom, is not a particularly effective method of\nensuring that all of a large number of employees acquire the information,\nskills or knowledge that are needed. it is certainly not a method that reliably\ndemonstrates that this requirement of the standard has been met. the best\nway of delivering information security staff awareness training is via e-learn-\ning that is run on a recognized learning management system (lms) or in a\ncloud-based environment, supported by a range', metadata={'source': 'Watkins, Calder - 2020 - IT Governance - An International Guide to Data Security and ISO 27001 ISO 27002.pdf', 'title': 'Watkins, Calder - 2020 - IT Governance - An International Guide to Data Security and ISO 27001 ISO 27002', 'original_text': '7.2 and 7.3 of the standard and control A.7.2 (information secu-\nrity awareness and training) require the organization to ensure that its\nemployees and contractors are aware of information security threats as well\nas their responsibilities and liabilities, and that it has appropriately compe-\ntent personnel. The objective of this clause is simply to ensure that all users\nof the organization’s information assets, or those who are assigned respon-\nsibilities in the ISMS, are aware of information security threats and are\ncompetent and adequately equipped to perform the requested tasks and to\nsupport the organization’s information security policy in their work.\nControl A.7.2.2 deals with information security awareness, education\nand training, and follows on from the previous control. All employees of the\norganization (including contractors) must receive appropriate awareness\ntraining and other training, as well as regular updates and communications.\nTraditional training, which relies on someone delivering subject matter\nfrom the front of the classroom, is not a particularly effective method of\nensuring that all of a large number of employees acquire the information,\nskills or knowledge that are needed. It is certainly not a method that reliably\ndemonstrates that this requirement of the standard has been met. The best\nway of delivering information security staff awareness training is via e-learn-\ning that is run on a recognized learning management system (LMS) or in a\ncloud-based environment, supported by a range', 'doc_ID': 2105, 'relevance_score': 0.9950177}), Document(page_content='external audit: the external auditor conducting the iso 27001 certification\naudit will check for the evidence.\n133\nchapter 6 execution\na.7.2.2 information security awareness, education, and training (iso\n27001 control)\nall employees of the organization and, when relevant, contractors should receive\nappropriate awareness training and regular updates to organizational policies and\nprocedures, as relevant to their job function.\nexplanation/what is required: information security awareness sessions should\nbe planned and conducted for all the employees, including your support staff, such as\ncleaners, security guards, etc. whenever any changes/updates take place to any of the\npolicies or standard operating procedures, employees must be made aware of them.\nthese awareness sessions must be conducted for contractors and third-party users as\nwell, as they also pose risks to information security.\nawareness helps reduce security risks, so these awareness sessions must be\nconducted on a regular basis and should be a mandatory part of the new hire induction\nprogram.\nevidence that can be prepared: attendance records of participants/employees who\nattended the awareness sessions. feedback forms and records of any quizzes.\nwho prepares it: awareness sessions are conducted by the information security\ndepartment. whenever sessions are conducted, attendance records need to be\nmaintained.\nfor external audit: the external auditor conducting the iso 27001 certification\naudit will check for the records of the awareness', metadata={'source': 'Chopra, Chaudhary - 2020 - Implementing an Information Security Management System - Security Management Based On ISO 27001.pdf', 'title': 'Chopra, Chaudhary - 2020 - Implementing an Information Security Management System - Security Management Based On ISO 27001', 'original_text': 'external audit: The external auditor conducting the ISO 27001 certification\naudit will check for the evidence.\n133\nCHAPTER 6 EXECUTION\nA.7.2.2 Information Security Awareness, Education, and Training (ISO\n27001 Control)\nAll employees of the organization and, when relevant, contractors should receive\nappropriate awareness training and regular updates to organizational policies and\nprocedures, as relevant to their job function.\nExplanation/what is required: Information security awareness sessions should\nbe planned and conducted for all the employees, including your support staff, such as\ncleaners, security guards, etc. Whenever any changes/updates take place to any of the\npolicies or standard operating procedures, employees must be made aware of them.\nThese awareness sessions must be conducted for contractors and third-party users as\nwell, as they also pose risks to information security.\nAwareness helps reduce security risks, so these awareness sessions must be\nconducted on a regular basis and should be a mandatory part of the new hire induction\nprogram.\nEvidence that can be prepared: Attendance records of participants/employees who\nattended the awareness sessions. Feedback forms and records of any quizzes.\nWho prepares it: Awareness sessions are conducted by the information security\ndepartment. Whenever sessions are conducted, attendance records need to be\nmaintained.\nFor external audit: The external auditor conducting the ISO 27001 certification\naudit will check for the records of the awareness', 'doc_ID': 1150, 'relevance_score': 0.9829547})]","Control A.7.2.2 requires that all employees and, if applicable, contractors are adequately informed about the organization's policies and procedures. This is done through raising awareness, education, training and regular updates. Awareness aims to make employees aware of potentially overlooked security issues and explain their impact on the organization. Training imparts solutions, with a focus on a comprehensive understanding of existing regulations and measures. Particularly for critical and complex tasks, practical exercises must be conducted, not just information dissemination. Changes to requirements and measures, as well as current security incidents, should be incorporated into awareness measures. The specific design of the measures is the responsibility of the organization.","Control A.7.2.2 of ISO 27001 requires organizations to provide information security awareness, education, and training to all employees and contractors. This control emphasizes the importance of ensuring that all users of the organization's information assets are aware of information security threats and are competent to perform their tasks in line with the organization's information security policy.

To create adequate awareness among employees, organizations should plan and conduct information security awareness sessions for all employees, including support staff, contractors, and third-party users. These sessions should cover relevant organizational policies and procedures and should be conducted regularly, preferably as a mandatory part of the new hire induction program.

The best way to deliver information security staff awareness training is through e-learning, which can be run on a recognized learning management system (LMS) or in a cloud-based environment. Attendance records of participants, feedback",True,0.48648648648648646,0.14785992217898833,0.23166023166023167,0.9799502193927765,0.9993133544921875,0.7334104495186295,0.875,0.6221603605333926,2.369368314743042,3.1799867153167725,0.0010039806365966797,5.5493550300598145
Fine-tuned_finetuned-ISO-27001_1024_l2_All_1536_264_False,Hybrid_Rerank_Cohere,2,gpt-3.5-turbo,4096,0,1,What information and values need to be included in the inventory of assets (control A.8.1.1) and why is it important to maintain them?,"[Document(page_content='under control a-5.8 and must be developed within the project.\na-5.9 inventory of information and other associated assets\nthe mentioned information assets can include datasets, data carriers, hardware, software, facilities, personnel, etc. more details can be found in section 1.4 under the keyword ""resources and assets.""\nall information assets assigned to the scope of the isms should be inventoried. it is important to note that such an inventory list must be maintained in written form, usually electronically. this can be a simple table or a qualified database, for example.\ndirectories of information assets exist in many organizations. here are some examples:\n- lists of purchased or leased devices and subscribed services (e.g., cloud services) - usually managed by administration or procurement departments, sometimes as part of asset accounting.\n- blueprints of locations and building plans with information about facilities - available from property management.\n- lists of it systems in a data center with information about location, deployment environment, and specific technical characteristics.\n- data about computers and mobile systems (tablets, mobile phones, etc.) issued to employees by it support - e.g., for workplace equipment, remote work, or home office.\n- information about systems in a demilitarized zone, as part of a security/network concept.\nsuch lists or plans are a good starting point for an inventory list according to a-5.9.\nit is worth noting that not all data is contained in a single', metadata={'source': 'ISO 27001_2022_Kersten_und_Schroeder.pdf', 'title': 'ISO 27001_2022_Kersten_und_Schroeder', 'original_text': 'under Control A-5.8 and must be developed within the project.\nA-5.9 Inventory of Information and other Associated Assets\nThe mentioned information assets can include datasets, data carriers, hardware, software, facilities, personnel, etc. More details can be found in section 1.4 under the keyword ""resources and assets.""\nAll information assets assigned to the scope of the ISMS should be inventoried. It is important to note that such an inventory list must be maintained in written form, usually electronically. This can be a simple table or a qualified database, for example.\nDirectories of information assets exist in many organizations. Here are some examples:\n- Lists of purchased or leased devices and subscribed services (e.g., cloud services) - usually managed by administration or procurement departments, sometimes as part of asset accounting.\n- Blueprints of locations and building plans with information about facilities - available from property management.\n- Lists of IT systems in a data center with information about location, deployment environment, and specific technical characteristics.\n- Data about computers and mobile systems (tablets, mobile phones, etc.) issued to employees by IT support - e.g., for workplace equipment, remote work, or home office.\n- Information about systems in a demilitarized zone, as part of a security/network concept.\nSuch lists or plans are a good starting point for an inventory list according to A-5.9.\nIt is worth noting that not all data is contained in a single', 'doc_ID': 2708, 'relevance_score': 0.99097973}), Document(page_content='stations, etc. taken alone, none of these objects would be an information value, but they are ""connected"" to them and should therefore be listed in the inventory directory.\nthirdly, let\'s consider a server landscape in which processes run in virtual (vm) instances. these instances usually have a more or less short lifespan. iso 27002 points out that such short-lived assets do not necessarily have to be recorded in the inventory directory. however, the situation is different if, for example, the provider of a public cloud operates such instances for its customers in a shared server environment and it must be ensured that one customer cannot access another customer\'s instance - an essential security property. in such cases, at least vm instances should be entered as a grouped asset in the directory.\nbefore we lose our orientation, we should align ourselves with the following summary: in the inventory directory, we record everything that has value for the organization and its secure information processing. in addition to the information/data itself, this includes all information-processing facilities!? and everything that contributes to their support.\nare there any other requirements related to the inventory directory? the entries in the asset directory according to a-5.9 must be correct, up-to-date, and consistent with other directories if applicable. let\'s go through these points:\nto ensure correctness, regular inventories of the assets can be carried out at intervals and the results can be compared with', metadata={'doc_ID': 2714, 'original_text': 'stations, etc. Taken alone, none of these objects would be an information value, but they are ""connected"" to them and should therefore be listed in the inventory directory.\nThirdly, let\'s consider a server landscape in which processes run in virtual (VM) instances. These instances usually have a more or less short lifespan. ISO 27002 points out that such short-lived assets do not necessarily have to be recorded in the inventory directory. However, the situation is different if, for example, the provider of a public cloud operates such instances for its customers in a shared server environment and it must be ensured that one customer cannot access another customer\'s instance - an essential security property. In such cases, at least VM instances should be entered as a grouped asset in the directory.\nBefore we lose our orientation, we should align ourselves with the following summary: In the inventory directory, we record everything that has value for the organization and its secure information processing. In addition to the information/data itself, this includes all information-processing facilities!? and everything that contributes to their support.\nAre there any other requirements related to the inventory directory? The entries in the asset directory according to A-5.9 must be correct, up-to-date, and consistent with other directories if applicable. Let\'s go through these points:\nTo ensure correctness, regular inventories of the assets can be carried out at intervals and the results can be compared with', 'source': 'ISO 27001_2022_Kersten_und_Schroeder.pdf', 'title': 'ISO 27001_2022_Kersten_und_Schroeder', 'relevance_score': 0.98269093})]","The inventory of assets (control A.8.1.1) must include all information and other values related to information and information processing facilities. This includes information about security requirements, criticality, and material value of the assets, as well as the physical location for physical assets or the storage location for data and software. It is important to maintain the inventory list because the asset data undergoes a rapid cycle of change and can become outdated. In addition, the created lists can also be used for other areas such as occupational safety, insurance and financial matters, procurement and purchasing, and compliance measures. Furthermore, responsible parties must be appointed for all values listed in the inventory. These responsible parties, also known as owners, are accountable to the organizational management. They must ensure that the information values are properly inventoried, classified, and protected according to their value. The responsibility for an asset may even include risk responsibility, but ISO 27001 also allows for a separation between risk responsibility and operational responsibility.","The inventory of assets, as outlined in control A.8.1.1 of ISO 27001, should include all information assets assigned to the scope of the ISMS. This can include datasets, data carriers, hardware, software, facilities, personnel, and other associated assets. The inventory list should be maintained in written form, typically electronically, and can be a simple table or a qualified database.

The importance of maintaining the inventory of assets lies in several factors. Firstly, it provides a comprehensive understanding of the organization's information assets, allowing for effective management and protection of those assets. It helps in identifying vulnerabilities, assessing risks, and implementing appropriate controls.

Secondly, the inventory of assets serves as a reference for other processes and activities within the ISMS. It ensures that all relevant assets are considered in risk assessments, treatment plans, and incident",True,0.477124183006536,0.1513157894736842,0.26143790849673204,0.4829968363046646,0.9996198415756226,0.7706962135402295,1.0,0.7108206797889697,3.028935194015503,2.927745819091797,0.0010037422180175781,5.9566810131073
Fine-tuned_finetuned-ISO-27001_1024_l2_All_1536_264_False,Hybrid_Rerank_Cohere,2,gpt-3.5-turbo,4096,0,1,What criteria are used for classifying information according to control A.8.2.1?,"[Document(page_content='in terms of legal requirements, value, criticality, and\nsensitivity to unauthorized disclosure or modification.\nexplanation/what is required: the control says that classification of information\nshould be done based on criticality, value, and sensitivity. the information classification\nshould be done based on a risk assessment activity. information classification must\nbe defined based on the business need and there must be a process for defining and\ndocumenting information classification.\nthe frequency of information classification should be defined in the policy and\nshould be updated based on the value and criticality of the information.\nevidence that can be prepared: information classification policy and information\nclassification guideline.\nwho prepares it: the information security team is responsible for preparing the\ninformation classification policy and guideline.\nfor external audit: the external auditor in the iso 27001 audit will check for this\ndocument.\na.8.2.2 labeling of information (control iso 27001)\nan appropriate set of procedures for information labeling should be developed and\nimplemented in accordance with the information classification scheme adopted by the\norganization.\nexplanation/what is required: this control covers the procedures required for\nlabeling information assets under the classification plan of the organization. you need to\nmention:\ne where and how the label can be attached\ne on what types of media labeling is required\ne where labeling is not required\nevidence that can', metadata={'doc_ID': 1160, 'original_text': 'in terms of legal requirements, value, criticality, and\nsensitivity to unauthorized disclosure or modification.\nExplanation/what is required: The control says that classification of information\nshould be done based on criticality, value, and sensitivity. The information classification\nshould be done based on a risk assessment activity. Information classification must\nbe defined based on the business need and there must be a process for defining and\ndocumenting information classification.\nThe frequency of information classification should be defined in the policy and\nshould be updated based on the value and criticality of the information.\nEvidence that can be prepared: Information classification policy and information\nclassification guideline.\nWho prepares it: The Information security team is responsible for preparing the\ninformation classification policy and guideline.\nFor external audit: The external auditor in the ISO 27001 audit will check for this\ndocument.\nA.8.2.2 Labeling of Information (Control ISO 27001)\nAn appropriate set of procedures for information labeling should be developed and\nimplemented in accordance with the information classification scheme adopted by the\norganization.\nExplanation/what is required: This control covers the procedures required for\nlabeling information assets under the classification plan of the organization. You need to\nmention:\ne Where and how the label can be attached\ne On what types of media labeling is required\ne Where labeling is not required\nEvidence that can', 'source': 'Chopra, Chaudhary - 2020 - Implementing an Information Security Management System - Security Management Based On ISO 27001.pdf', 'title': 'Chopra, Chaudhary - 2020 - Implementing an Information Security Management System - Security Management Based On ISO 27001', 'relevance_score': 0.9962638}), Document(page_content='must be clearly stated in agreements, and regular audits of\nassets are required to ensure their protection.\n### 2\\. annex a.8.2 - information classification\nthe objective of a.8.2 is to ensure that information assets receive the\nnecessary protection based on their importance as well as in accordance with\nstakeholder expectations.\n * a.8.2.1 - classification of information control: information must be classified to reflect business activity, in terms\nof value, legal requirements, and criteria surrounding unauthorised disclosure\nand modification.\nimplementation: classification must include standards for information sharing\nand restriction. related, non-information, assets may also fall under such\nclassification. proper classification is key to ensuring the protection of\ninformation so some organisations may have a few options depending on the\nvalue of the information assets.\nhowever, classification options must be kept simple to meet the right number\nof engineering controls and so as not to confuse users. the effectiveness of\nclassification must be reviewed regularly, and the classification scheme must\nbe kept consistent throughout the organisation.\n * **a.8.2.2 - labelling of information** ** **control:**** procedures for labelling must be developed in accordance\nwith the organisation’s classification scheme established in a.8.2.1. **implementation:** these procedures must be made available in physical and\nelectronic formats. labelling must be easily recognisable, documented and', metadata={'description': 'Annex A.8 covers Asset Management . Learn about Annex A.8 in detail, the requirements for effective asset management, and how to build an asset inventory.', 'doc_ID': 466, 'language': 'en-gb', 'original_text': 'must be clearly stated in agreements, and regular audits of\nassets are required to ensure their protection.\n### 2\\. Annex A.8.2 - Information Classification\nThe objective of A.8.2 is to ensure that information assets receive the\nnecessary protection based on their importance as well as in accordance with\nstakeholder expectations.\n * A.8.2.1 - Classification of information Control: Information must be classified to reflect business activity, in terms\nof value, legal requirements, and criteria surrounding unauthorised disclosure\nand modification.\nImplementation: Classification must include standards for information sharing\nand restriction. Related, non-information, assets may also fall under such\nclassification. Proper classification is key to ensuring the protection of\ninformation so some organisations may have a few options depending on the\nvalue of the information assets.\nHowever, classification options must be kept simple to meet the right number\nof engineering controls and so as not to confuse users. The effectiveness of\nclassification must be reviewed regularly, and the classification scheme must\nbe kept consistent throughout the organisation.\n * **A.8.2.2 - Labelling of information** ** **Control:**** Procedures for labelling must be developed in accordance\nwith the organisation’s classification scheme established in A.8.2.1. **Implementation:** These procedures must be made available in physical and\nelectronic formats. Labelling must be easily recognisable, documented and', 'source': 'https://www.dataguard.co.uk/blog/iso-27001-annex-a.8-asset-management', 'title': 'ISO 27001 Controls: Annex A.8 Asset Management - DataGuard', 'relevance_score': 0.9961606})]","According to control A.8.2.1, information is classified based on multiple criteria. These criteria include legal requirements, the value of the information, its criticality, and its sensitivity to unauthorized disclosure or alteration. It is recommended to keep the number of classes or classifications low to allow for clear differentiation between classes. In areas without their own classification scheme, all information should be treated as UNCLASSIFIED.","According to control A.8.2.1 of ISO 27001, information should be classified based on its value, legal requirements, and criteria surrounding unauthorized disclosure and modification. This means that the classification of information should take into account factors such as the importance of the information to the business, any legal requirements for its protection, and the sensitivity of the information to unauthorized access or modification. The classification should be based on a risk assessment activity and should be defined based on the business need. There should also be a process for defining and documenting the information classification.

In terms of control A.8.2.2, an appropriate set of procedures for labeling information should be developed and implemented in accordance with the information classification scheme adopted by the organization. The procedures should specify where and how labels can be attached, on what types of media labeling is required,",True,0.3703703703703703,0.14953271028037385,0.28703703703703703,0.37339337170124054,0.998792290687561,0.7889259417361957,0.75,0.8574825488704209,2.9842817783355713,2.976611375808716,0.00103759765625,5.960893154144287
Fine-tuned_finetuned-ISO-27001_1024_l2_All_1536_264_False,Hybrid_Rerank_Cohere,2,gpt-3.5-turbo,4096,0,1,What measures should be taken for the disposal of data carriers according to control A.8.3.2?,"[Document(page_content='disclosure,\nmodification, removal or destruction of information assets stored on media.\n * a.8.3.1 \\- management of removable media control: procedures for the management of removable media must be implemented\nin accordance with the classification scheme established in a.8.2.1.\nimplementation: media must only be made removable if justified by a business\nreason, and must be made unrecoverable when no longer required. the general\nuse of removable media must be risk assessed, and its removal must be recorded\nand require authorisation.\nwhen necessary, added security measures, such as cryptographic keys, must be\napplied. media should be stored according to manufacturer specifications, and\ncopies should be stored across different formats to prevent total accidental\nloss or damage.\n * **a.8.3.2** \\- **disposal of media** **control:** media must be disposed of in accordance with documented\nprocedures, once no longer required. **implementation:** procedures for the disposal of media are required to\nprevent the unauthorised leakage of confidential information. these procedures\nmust depend on the sensitivity and confidentiality of the information in\nquestion. confidential media must be disposed of through physical means such as\nshredding or incineration, or through data erasure. assets which require\nsecure disposal must be identified. data disposal must be logged to maintain\nan audit trail, and it is best to dispose of media collectively, in one go. * **a.8.3.3** \\- **physical media', metadata={'source': 'https://www.dataguard.co.uk/blog/iso-27001-annex-a.8-asset-management', 'title': 'ISO 27001 Controls: Annex A.8 Asset Management - DataGuard', 'description': 'Annex A.8 covers Asset Management . Learn about Annex A.8 in detail, the requirements for effective asset management, and how to build an asset inventory.', 'language': 'en-gb', 'original_text': 'disclosure,\nmodification, removal or destruction of information assets stored on media.\n * A.8.3.1 \\- Management of removable media Control: Procedures for the management of removable media must be implemented\nin accordance with the classification scheme established in A.8.2.1.\nImplementation: Media must only be made removable if justified by a business\nreason, and must be made unrecoverable when no longer required. The general\nuse of removable media must be risk assessed, and its removal must be recorded\nand require authorisation.\nWhen necessary, added security measures, such as cryptographic keys, must be\napplied. Media should be stored according to manufacturer specifications, and\ncopies should be stored across different formats to prevent total accidental\nloss or damage.\n * **A.8.3.2** \\- **Disposal of media** **Control:** Media must be disposed of in accordance with documented\nprocedures, once no longer required. **Implementation:** Procedures for the disposal of media are required to\nprevent the unauthorised leakage of confidential information. These procedures\nmust depend on the sensitivity and confidentiality of the information in\nquestion. Confidential media must be disposed of through physical means such as\nshredding or incineration, or through data erasure. Assets which require\nsecure disposal must be identified. Data disposal must be logged to maintain\nan audit trail, and it is best to dispose of media collectively, in one go. * **A.8.3.3** \\- **Physical media', 'doc_ID': 468, 'relevance_score': 0.99796516}), Document(page_content='or incineration, or through data erasure. assets which require\nsecure disposal must be identified. data disposal must be logged to maintain\nan audit trail, and it is best to dispose of media collectively, in one go. * **a.8.3.3** \\- **physical media transfer** **control:** media containing information assets must be protected during\ntransportation unless already publicly available. **implementation:** reliable couriers should be agreed upon with management,\nprotective packaging must be used to prevent physical damage, and all\ntransport activities should be logged. logs must include security measures\napplied, transfer times and details of custodians. extra care must be taken in\nthe case of unencrypted media. ## what are the other annex a control categories?\nthe other 13 categories of annex a controls cover other domains of an\norganisation that require management for the protection of information assets:\n * a.5 - information security policies\n * a.6 - organisation of information security\n * a.7 - human resources security\n * a.9 - access control\n * a.10 - cryptography\n * a.11 - physical and environmental security\n * a.12 - operational security\n * a.13 - communications security\n * a.14 - systems acquisition, development and maintenance\n * a.15 - supplier relationships\n * a.16 - information security incident management\n * a.17 - information security aspects of business continuity management\n * a.18 - compliance\nwhen combined, annex a can be used as a list of iso 27001 controls,', metadata={'source': 'https://www.dataguard.co.uk/blog/iso-27001-annex-a.8-asset-management', 'title': 'ISO 27001 Controls: Annex A.8 Asset Management - DataGuard', 'description': 'Annex A.8 covers Asset Management . Learn about Annex A.8 in detail, the requirements for effective asset management, and how to build an asset inventory.', 'language': 'en-gb', 'original_text': 'or incineration, or through data erasure. Assets which require\nsecure disposal must be identified. Data disposal must be logged to maintain\nan audit trail, and it is best to dispose of media collectively, in one go. * **A.8.3.3** \\- **Physical media transfer** **Control:** Media containing information assets must be protected during\ntransportation unless already publicly available. **Implementation:** Reliable couriers should be agreed upon with management,\nprotective packaging must be used to prevent physical damage, and all\ntransport activities should be logged. Logs must include security measures\napplied, transfer times and details of custodians. Extra care must be taken in\nthe case of unencrypted media. ## What are the other Annex A control categories?\nThe other 13 categories of Annex A controls cover other domains of an\norganisation that require management for the protection of information assets:\n * A.5 - Information Security Policies\n * A.6 - Organisation of Information Security\n * A.7 - Human Resources Security\n * A.9 - Access Control\n * A.10 - Cryptography\n * A.11 - Physical and Environmental Security\n * A.12 - Operational Security\n * A.13 - Communications Security\n * A.14 - Systems Acquisition, Development and Maintenance\n * A.15 - Supplier Relationships\n * A.16 - Information Security Incident Management\n * A.17 - Information Security aspects of Business Continuity Management\n * A.18 - Compliance\nWhen combined, Annex A can be used as a list of ISO 27001 controls,', 'doc_ID': 469, 'relevance_score': 0.99759394})]","According to control A.8.3.2, security-related measures should be taken for the disposal of data carriers. This includes the secure and formal disposal of no longer needed data carriers, both those that are separately accessible and those that are built into devices. Disposal can be done in several ways, such as secure storage of the data carriers by the organization, physical destruction (shredding, burning, etc.), or handing them over to a qualified disposal company. For certain classification levels, it is important to document the disposal. Further information on the disposal of data carriers can be found in DIN 66399.","According to control A.8.3.2, the measures that should be taken for the disposal of data carriers are as follows:

1. Media must be disposed of in accordance with documented procedures once they are no longer required.
2. The procedures for disposal should prevent the unauthorized leakage of confidential information.
3. The disposal procedures should depend on the sensitivity and confidentiality of the information in question.
4. Confidential media should be disposed of through physical means such as shredding or incineration, or through data erasure.
5. Assets that require secure disposal must be identified.
6. Data disposal must be logged to maintain an audit trail.
7. It is best to dispose of media collectively, in one go.

These measures are necessary to ensure that confidential information does not fall into the wrong hands and to maintain the security and integrity of the organization",True,0.5020242914979757,0.20408163265306123,0.291497975708502,0.5572307109832764,0.9999662637710571,0.7861163116365502,1.0,0.9977210083654477,2.3681366443634033,2.719003438949585,0.0009975433349609375,5.087140083312988
Fine-tuned_finetuned-ISO-27001_1024_l2_All_1536_264_False,Hybrid_Rerank_Cohere,2,gpt-3.5-turbo,4096,0,1,What four areas does the topic area A.9 of the ISO 27001 certification cover in relation to access control?,"[Document(page_content='in such scenarios it must be changed\nimmediately.\nevidence that can be prepared: access control policy, secret authentication\ninformation policy, requests for the secret authentication information, list of users with\nsecret authentication\nwho prepares it: the it helpdesk team will share the secret authentication\ninformation and will maintain associated record/evidence. the information security\nteam would review and provide consulting about the process.\nfor external audit: an external auditor conducting the iso 27001 certification\naudit will check the evidence in order to verify how the organization will share secret\nauthentication information with the user/employee and how it will be protected by user/\nemployee while using it for the official purposes.\na.9.4 system and application access control\nobjective: to prevent unauthorized access to systems and applications.\nexplanation/what is required: the objective is that organization must create\nprovisions to prevent systems and applications from unauthorized access.\na.9.4.1 information access restriction (iso 27001 control)\naccess to information and application system functions should be restricted in\naccordance with the access control policy.\nexplanation/what is required: the organization should consider the following\nexample points, while providing access permissions to users/employees on information\nand application systems. as the organization provides or stores most of the information/\ndata on application systems, restriction to access must be done in', metadata={'doc_ID': 1177, 'original_text': 'In such scenarios it must be changed\nimmediately.\nEvidence that can be prepared: Access control policy, secret authentication\ninformation policy, requests for the secret authentication information, list of users with\nsecret authentication\nWho prepares it: The IT Helpdesk team will share the secret authentication\ninformation and will maintain associated record/evidence. The information security\nteam would review and provide consulting about the process.\nFor external audit: An external auditor conducting the ISO 27001 certification\naudit will check the evidence in order to verify how the organization will share secret\nauthentication information with the user/employee and how it will be protected by user/\nemployee while using it for the official purposes.\nA.9.4 System and Application Access Control\nObjective: To prevent unauthorized access to systems and applications.\nExplanation/what is required: The objective is that organization must create\nprovisions to prevent systems and applications from unauthorized access.\nA.9.4.1 Information access restriction (ISO 27001 Control)\nAccess to information and application system functions should be restricted in\naccordance with the access control policy.\nExplanation/what is required: The organization should consider the following\nexample points, while providing access permissions to users/employees on information\nand application systems. As the organization provides or stores most of the information/\ndata on application systems, restriction to access must be done in', 'source': 'Chopra, Chaudhary - 2020 - Implementing an Information Security Management System - Security Management Based On ISO 27001.pdf', 'title': 'Chopra, Chaudhary - 2020 - Implementing an Information Security Management System - Security Management Based On ISO 27001', 'relevance_score': 0.993831}), Document(page_content='access control policy.\n144\nchapter 6 execution\nfor external audit: an external auditor conducting the iso 27001 certification audit\nwill check the access control policy in order to verify how the organization has defined\nand communicated the policy to all stakeholders.\na.9.1.2 access to networks and network services (iso 27001 control)\nusers should only be provided access to the network and network services that they have\nbeen specifically authorized to use.\nexplanation/what is required: the requirement is the same as the objective says,\norganizations must ensure only authorized users/employees are provided access to\norganization network and network services. any unauthorized use can pose a threat to\nthe organization’s information.\nthe network policy should cover the following:\ne information on networks that is accessible\ne how the users/employees would be authenticated for permissions\n¢ mode of using the network i.e. wireless, lan, vpn, etc.\ne hownetwork will be monitored to safeguard information\nevidence that can be prepared: access control policy, network control policy,\nnetwork diagram, and network monitoring logs\nwho prepares it: the it helpdesk team along with the information security team\nwould prepare the evidence.\nfor external audit: an external auditor conducting the iso 27001 certification\naudit will check the evidence in order to verify how the organization has defined and\nimplemented network policy, measures taken to protect network and network services.\na.9.2 user access', metadata={'doc_ID': 1167, 'original_text': 'access control policy.\n144\nCHAPTER 6 EXECUTION\nFor external audit: An external auditor conducting the ISO 27001 certification audit\nwill check the access control policy in order to verify how the organization has defined\nand communicated the policy to all stakeholders.\nA.9.1.2 Access to Networks and Network Services (ISO 27001 Control)\nUsers should only be provided access to the network and network services that they have\nbeen specifically authorized to use.\nExplanation/what is required: The requirement is the same as the objective says,\norganizations must ensure only authorized users/employees are provided access to\norganization network and network services. Any unauthorized use can pose a threat to\nthe organization’s information.\nThe network policy should cover the following:\ne Information on networks that is accessible\ne How the users/employees would be authenticated for permissions\n¢ Mode of using the network i.e. wireless, LAN, VPN, etc.\ne Hownetwork will be monitored to safeguard information\nEvidence that can be prepared: Access control policy, network control policy,\nnetwork diagram, and network monitoring logs\nWho prepares it: The IT Helpdesk team along with the information security team\nwould prepare the evidence.\nFor external audit: An external auditor conducting the ISO 27001 certification\naudit will check the evidence in order to verify how the organization has defined and\nimplemented network policy, measures taken to protect network and network services.\nA.9.2 User Access', 'source': 'Chopra, Chaudhary - 2020 - Implementing an Information Security Management System - Security Management Based On ISO 27001.pdf', 'title': 'Chopra, Chaudhary - 2020 - Implementing an Information Security Management System - Security Management Based On ISO 27001', 'relevance_score': 0.9923933})]","The topic area A.9 of the ISO 27001 certification in relation to access control covers several areas. Firstly, it addresses the business requirements for access control, which should be reflected in corresponding policies (A.9.1). Secondly, it focuses on user access management, including the authorization, verification, and revocation of user permissions (A.9.2). Thirdly, it addresses the responsibilities of users in access control (A.9.3). And fourthly, it deals with access control for systems and applications, including authorization concepts and access policies (A.9.4). Access control should always be in line with the classification of information assets and include practical rules.","The topic area A.9 of the ISO 27001 certification covers four areas in relation to access control. These areas are:

1. A.9.4 System and Application Access Control: The objective is to prevent unauthorized access to systems and applications. The organization must create provisions to restrict access to information and application system functions in accordance with the access control policy.

2. A.9.4.1 Information access restriction: Access to information and application system functions should be restricted in accordance with the access control policy. The organization should consider access permissions to users/employees on information and application systems, and define and communicate the access control policy to all stakeholders.

3. A.9.1.2 Access to Networks and Network Services: Users should only be provided access to the network and network services that they have been specifically authorized to use. The",True,0.5119999999999999,0.20967741935483872,0.344,0.7438226938247681,0.9999666213989258,0.8299837952537568,0.8333333333333334,0.9916837217959745,2.4781410694122314,3.121840715408325,0.0009968280792236328,5.599981784820557
Fine-tuned_finetuned-ISO-27001_1024_l2_All_1536_264_False,Hybrid_Rerank_Cohere,2,gpt-3.5-turbo,4096,0,1,What basic principles can be applied when designing an access control policy for ISO 27001?,"[Document(page_content='areas that should be considered may include the classification of the\ninformation involved, privacy considerations, data storage and transmission, logging and\ninput validation, amongst others.\n4.4.27 a.8.27 secure system architecture and engineering principles\nrelevant toolkit documents\ne principles for engineering secure systems\nwhen designing information systems, a set of guiding principles should be adopted which\nencourage the creation of secure environments by default. these principles can vary widely\nand can be established by the organization itself or taken from an external source such as\nnist (national institute for science and technology). at a basic level, principles could be as\nsimple as:\ne defence in depth\ne privacy by design\ne security by default\ne least privilege\ne adopt zero trust\nthe applicability of this control and the depth into which it requires definition will depend\nupon the size of your organization’s infrastructure and the types of system being\nimplemented.\n4.4.28 a.8.28 secure coding\nrelevant toolkit documents\ne secure coding policy\nan organization that has a software development function will want to write code that\nintroduces as few vulnerabilities as reasonably possible, whilst achieving their objectives.\nthis will require activities to be carried out before, during and after coding and the specifics\n page 68 of 79\niso/iec 27001 implementation guide\nwill depend on the languages and other technologies adopted. as well as establishing the\nbasic principles used, detailed', metadata={'source': 'CERTIKIT_ISO27001_Implementation_Guide_v12.pdf.pdf', 'title': 'CERTIKIT_ISO27001_Implementation_Guide_v12.pdf', 'original_text': 'areas that should be considered may include the classification of the\ninformation involved, privacy considerations, data storage and transmission, logging and\ninput validation, amongst others.\n4.4.27 A.8.27 Secure system architecture and engineering principles\nRelevant Toolkit documents\ne Principles for Engineering Secure Systems\nWhen designing information systems, a set of guiding principles should be adopted which\nencourage the creation of secure environments by default. These principles can vary widely\nand can be established by the organization itself or taken from an external source such as\nNIST (National Institute for Science and Technology). At a basic level, principles could be as\nsimple as:\ne Defence in depth\ne Privacy by design\ne Security by default\ne Least privilege\ne Adopt zero trust\nThe applicability of this control and the depth into which it requires definition will depend\nupon the size of your organization’s infrastructure and the types of system being\nimplemented.\n4.4.28 A.8.28 Secure coding\nRelevant Toolkit documents\ne Secure Coding Policy\nAn organization that has a software development function will want to write code that\nintroduces as few vulnerabilities as reasonably possible, whilst achieving their objectives.\nThis will require activities to be carried out before, during and after coding and the specifics\n Page 68 of 79\nISO/IEC 27001 Implementation Guide\nwill depend on the languages and other technologies adopted. As well as establishing the\nbasic principles used, detailed', 'doc_ID': 948, 'relevance_score': 0.9961755}), Document(page_content='to information and application system functions shall be\nrestricted in accordance with the access control policy.\nsecure log-on proce-\ndures\ncontrol\nwhere required by the access control policy, access to systems and\napplications shall be controlled by a secure log-on procedure.\n© iso/iec 2013 - all rights reserved\n13\niso/iec 27001:2013(e)\ntable a.1 (continued)\npassword manage-\nment system\nuse of privileged util-\nity programs\naccess control to pro-\ngram source code\ncontrol\npassword management systems shall be interactive and shall\nensure quality passwords.\ncontrol\nthe use of utility programs that might be capable of overriding\nsystem and application controls shall be restricted and tightly\ncontrolled.\ncontrol\naccess to program source code shall be restricted.\na.10\ncryptography\na.10.1 cryptographic controls\nobjective: to ensure proper and effective use of cryptography to protect the confidentiality, authen-\nticity and/or integrity of information.\npolicy on the use of\ncryptographic controls\ncontrol\na policy on the use of cryptographic controls for protection of\ninformation shall be developed and implemented.\nkey management\ncontrol\na policy on the use, protection and lifetime of cryptographic keys\nshall be developed and implemented through their whole lifecycle.\nphysical and environmental security\na.11.1 secure areas\nobjective: to prevent unauthorized physical access, damage and interference to the organization’s\ninformation and information processing facilities.\ncontrol\na11.11', metadata={'doc_ID': 3015, 'original_text': 'to information and application system functions shall be\nrestricted in accordance with the access control policy.\nSecure log-on proce-\ndures\nControl\nWhere required by the access control policy, access to systems and\napplications shall be controlled by a secure log-on procedure.\n© ISO/IEC 2013 - All rights reserved\n13\nISO/IEC 27001:2013(E)\nTable A.1 (continued)\nPassword manage-\nment system\nUse of privileged util-\nity programs\nAccess control to pro-\ngram source code\nControl\nPassword management systems shall be interactive and shall\nensure quality passwords.\nControl\nThe use of utility programs that might be capable of overriding\nsystem and application controls shall be restricted and tightly\ncontrolled.\nControl\nAccess to program source code shall be restricted.\nA.10\nCryptography\nA.10.1 Cryptographic controls\nObjective: To ensure proper and effective use of cryptography to protect the confidentiality, authen-\nticity and/or integrity of information.\nPolicy on the use of\ncryptographic controls\nControl\nA policy on the use of cryptographic controls for protection of\ninformation shall be developed and implemented.\nKey management\nControl\nA policy on the use, protection and lifetime of cryptographic keys\nshall be developed and implemented through their whole lifecycle.\nPhysical and environmental security\nA.11.1 Secure areas\nObjective: To prevent unauthorized physical access, damage and interference to the organization’s\ninformation and information processing facilities.\nControl\nA11.11', 'source': 'ISO 27001 2013 (E).pdf', 'title': 'ISO 27001 2013 (E)', 'relevance_score': 0.9792749})]","The basic principles that can be applied when designing an access control policy are based on various approaches. One possibility is to choose an open or restrictive strategy, where either everything is allowed unless explicitly prohibited, or everything is prohibited unless explicitly allowed. Another approach is user-defined access control (DAC), where the owner of an asset determines who has access to that asset. Alternatively, mandatory access control (MAC) can be applied, where access to assets depends on the classification of the assets and the permissions of the users. Another option is role-based access control (RBAC), where permissions are tied to specific roles. The principle of ""need-to-know"" states that a user only gets access to an asset if they require it for their activities. Other approaches are default permissions that can be preset to facilitate the set-up of new users and temporary permissions that should only be granted under certain conditions and have time restrictions. Finally, divisions or separations can be made to bind security-critical activities to the presence of multiple individuals or to create separate accounts for high permissions.","When designing an access control policy for ISO 27001, several basic principles can be applied. These principles include:

1. Defence in depth: Implement multiple layers of security controls to protect information and systems.

2. Privacy by design: Incorporate privacy considerations into the design of information systems.

3. Security by default: Ensure that security measures are enabled by default and that users are not required to take additional steps to secure their access.

4. Least privilege: Grant users the minimum level of access necessary to perform their job functions.

5. Adopt zero trust: Implement a zero-trust approach to access control, where all users and devices are treated as potentially untrusted and must be verified before being granted access.

These principles should be adopted as part of the organization's secure system architecture and engineering principles. The specific implementation and depth of these principles will depend",True,0.3575757575757576,0.07317073170731707,0.18787878787878787,0.8237271010875702,0.9999665021896362,0.6737635584433868,1.0,0.9956360402230073,2.5085365772247314,3.896435260772705,0.0009963512420654297,6.4049718379974365
Fine-tuned_finetuned-ISO-27001_1024_l2_All_1536_264_False,Hybrid_Rerank_Cohere,2,gpt-3.5-turbo,4096,0,1,"What does objective 10.1 in Annex A of ISO 27001 state, and what factors need to be considered when implementing such a policy?","[Document(page_content=""to prove that the controls identified in the\nsoa align with the standards outlined in annex a. if the implementation of these controls and appropriate\nbusiness processes operates as expected, an organization is eligible for iso 27001 certification.\nstrongcm 8\niso 27001 controls\nthe controls defined in annex a go beyond the responsibility of it. the\n114 controls sorted into 14 category domains detail security measures\nthat support information asset management best practices across the\norganization, even if the scope of an organization's isms iso 27001\ncertifications is more limited. these 14 domains include:\ninformation security policies\norganization of information security\nhuman resources security\nasset management\naccess control\ncryptography\nphysical and environmental security\noperational security\ncommunications security\nsystem acquisition, development, and maintenance\n“teattihh||\nsupplier relationships\ninformation security incident management\ncompliance\ninformation security aspects of business continuity\nmanagement\ncreating controls for risk management and demonstrating their success is an essential part of achieving iso\n27001 certification. as part of the organization's risk treatment plan, some control objectives must be put in\nplace during the certification process.\nbusinesses explain their choice to use or not use each control in annex a within their soa. however, based on\nthe updated guidelines in iso 21007:2013, there is no express requirement to use the controls suggested in\nannex a."", metadata={'doc_ID': 1342, 'original_text': ""to prove that the controls identified in the\nSoA align with the standards outlined in Annex A. If the implementation of these controls and appropriate\nbusiness processes operates as expected, an organization is eligible for ISO 27001 certification.\nstrongcm 8\nISO 27001 Controls\nThe controls defined in Annex A go beyond the responsibility of IT. The\n114 controls sorted into 14 category domains detail security measures\nthat support information asset management best practices across the\norganization, even if the scope of an organization's ISMS ISO 27001\ncertifications is more limited. These 14 domains include:\nInformation Security Policies\nOrganization of Information Security\nHuman Resources Security\nAsset Management\nAccess Control\nCryptography\nPhysical and Environmental Security\nOperational Security\nCommunications Security\nSystem Acquisition, Development, and Maintenance\n“teattihh||\nSupplier Relationships\nInformation Security Incident Management\nCompliance\nInformation Security Aspects of Business Continuity\nManagement\nCreating controls for risk management and demonstrating their success is an essential part of achieving ISO\n27001 certification. As part of the organization's risk treatment plan, some control objectives must be put in\nplace during the certification process.\nBusinesses explain their choice to use or not use each control in Annex A within their SoA. However, based on\nthe updated guidelines in ISO 21007:2013, there is no express requirement to use the controls suggested in\nAnnex A."", 'source': 'complete-guide-iso-27001-compliance.pdf', 'title': 'complete-guide-iso-27001-compliance', 'relevance_score': 0.98532796}), Document(page_content='* 9.1 evidence of the monitoring and measurement of results\n * 9.2 a documented internal audit process\n * 9.2 evidence of the audit programmes and the audit results\n * 9.3 evidence of the results of management reviews\n * 10.1 evidence of the nature of the non-conformities and any subsequent actions taken\n * 10.1 evidence of the results of any corrective actions\nto get a full breakdown of the iso 27001 requirements, check the iso 27001\nrequirements: a comprehensive list.\n## what are iso 27001 controls, and how to go about implementation?\na control is a measure that manages risk.\nwhen it comes to the 2022 version of iso 27001, there are 93 annex a controls\nthat cover various areas of an organisation. these controls are segmented into\n4 different categories (domains). depending on which are relevant for your\ncompany, risks, industry and customers — you will fulfil the requirements in\nspecific annexes.\nstandard controls include:\n * 8 asset management\n * 14 system acquisition development and maintenance\n * 10 cryptography\n * 18 compliance\n## the costs of iso 27001 certification\nthe price or costs for getting iso 27001 certified depends on many things.\nthese are the most relevant influences on what you will need to invest in your\niso 27001 certification:\n * the level of maturity reflected in the isms.\n * the range of activities conducted within the defined boundaries of the isms.\n * the extent of technology utilisation across the various facets of the isms.\n * the degree of external sourcing', metadata={'source': 'https://experta.com/shared-post/a73a0b00-a398-4e8a-afcf-632f9631cb69', 'title': 'Experta', 'language': 'No language found.', 'original_text': '* 9.1 Evidence of the monitoring and measurement of results\n * 9.2 A documented internal audit process\n * 9.2 Evidence of the audit programmes and the audit results\n * 9.3 Evidence of the results of management reviews\n * 10.1 Evidence of the nature of the non-conformities and any subsequent actions taken\n * 10.1 Evidence of the results of any corrective actions\nTo get a full breakdown of the ISO 27001 requirements, check the ISO 27001\nrequirements: A comprehensive list.\n## What are ISO 27001 controls, and how to go about implementation?\nA control is a measure that manages risk.\nWhen it comes to the 2022 version of ISO 27001, there are 93 Annex A controls\nthat cover various areas of an organisation. These controls are segmented into\n4 different categories (domains). Depending on which are relevant for your\ncompany, risks, industry and customers — you will fulfil the requirements in\nspecific annexes.\nStandard controls include:\n * 8 asset management\n * 14 system acquisition development and maintenance\n * 10 cryptography\n * 18 compliance\n## The costs of ISO 27001 certification\nThe price or costs for getting ISO 27001 certified depends on many things.\nThese are the most relevant influences on what you will need to invest in your\nISO 27001 certification:\n * The level of maturity reflected in the ISMS.\n * The range of activities conducted within the defined boundaries of the ISMS.\n * The extent of technology utilisation across the various facets of the ISMS.\n * The degree of external sourcing', 'doc_ID': 285, 'relevance_score': 0.98340684})]","Objective 10.1 in Annex A of ISO 27001 states that the appropriate and effective use of cryptography must be ensured to secure the confidentiality, authenticity, and integrity of information. A policy for the use of cryptographic measures must be developed and implemented to ensure that cryptographic measures are used correctly within the organization. Various aspects need to be considered when introducing such a policy, such as the appropriate use of cryptography in relation to the value of the information and existing risks, suitable procedures and products, potential constraints imposed by national laws, and the response to security vulnerabilities or breaches in the cryptographic mechanisms used. It is important to have appropriate management and a responsible entity in place for the implementation and updating of the policy. It is also recommended to create a dedicated cryptographic concept that can serve as a basis for the policy.","Objective 10.1 in Annex A of ISO 27001 states that evidence of the nature of non-conformities and any subsequent actions taken must be provided. This objective is part of the certification process and requires organizations to demonstrate that they have identified non-conformities with the controls outlined in Annex A and have taken appropriate actions to address them.

When implementing this policy, several factors need to be considered. Firstly, organizations must have a robust monitoring and measurement process in place to identify non-conformities. This can include regular internal audits and management reviews, as stated in the context. Secondly, organizations must have a documented process for conducting internal audits and evidence of the audit programs and results. This ensures that non-conformities are properly identified and documented. Finally, organizations must have evidence of the results of any corrective actions taken to address non-con",True,0.4452054794520548,0.1310344827586207,0.2671232876712329,0.6440329849720001,0.9999610185623169,0.4796223278175786,0.8333333333333334,0.882835353838956,2.4315171241760254,27.349808931350708,0.0009980201721191406,29.781326055526733
Fine-tuned_finetuned-ISO-27001_1024_l2_All_1536_264_False,Hybrid_Rerank_Cohere,2,gpt-3.5-turbo,4096,0,1,What does control A.11.1.2 state about access control and how can adequate access control be ensured in a secure area?,"[Document(page_content='controls to ensure that\nonly authorized personnel are allowed access.\nexplanation: the organizational secure areas such as entry gates, server rooms,\nand other important facilities are accessible by the authorized personnel only. all\nthe sensitive entry areas should be identified. here are some the tips to ensure no\nunauthorized access is allowed.\n158\nchapter 6 execution\ne entry by personnel access control only. for example, by using\nbiometric devices.\ne visitor entry must be recorded in a visitor logbook and they get\ntemporary access to entry with a visitor card.\na.11.1.3 securing offices, rooms, and facilities\ncontrol: physical security of offices, rooms, and facilities should be designed and\napplied.\nexplanation: the security of offices, rooms, and other facilities is not usually a big\nchallenge. they can be secured by implementing the basic security components. to\nimplement this control, ask yourself some basic questions like these:\ne isaccess protected and revoked when not required?\ne isthere a policy to remove the organizational asset after use if the\nrooms and facilities are shared among different organizations?\nnote the external auditor may inspect the offices, rooms, and facilities to check\nif there is evidence of risk-based control implementations.\na.11.1.4 protecting against external and environmental threats\ncontrol: physical protection against natural disasters, malicious attacks, or accidents\nshould be designed and applied.\nexplanation: this control covers how you protect your', metadata={'doc_ID': 1189, 'original_text': 'controls to ensure that\nonly authorized personnel are allowed access.\nExplanation: The organizational secure areas such as entry gates, server rooms,\nand other important facilities are accessible by the authorized personnel only. All\nthe sensitive entry areas should be identified. Here are some the tips to ensure no\nunauthorized access is allowed.\n158\nCHAPTER 6 EXECUTION\ne Entry by personnel access control only. For example, by using\nbiometric devices.\ne Visitor entry must be recorded in a visitor logbook and they get\ntemporary access to entry with a visitor card.\nA.11.1.3 Securing Offices, Rooms, and Facilities\nControl: Physical security of offices, rooms, and facilities should be designed and\napplied.\nExplanation: The security of offices, rooms, and other facilities is not usually a big\nchallenge. They can be secured by implementing the basic security components. To\nimplement this control, ask yourself some basic questions like these:\ne Isaccess protected and revoked when not required?\ne Isthere a policy to remove the organizational asset after use if the\nrooms and facilities are shared among different organizations?\nNote The external auditor may inspect the offices, rooms, and facilities to check\nif there is evidence of risk-based control implementations.\nA.11.1.4 Protecting Against External and Environmental Threats\nControl: Physical protection against natural disasters, malicious attacks, or accidents\nshould be designed and applied.\nExplanation: This control covers how you protect your', 'source': 'Chopra, Chaudhary - 2020 - Implementing an Information Security Management System - Security Management Based On ISO 27001.pdf', 'title': 'Chopra, Chaudhary - 2020 - Implementing an Information Security Management System - Security Management Based On ISO 27001', 'relevance_score': 0.9953725}), Document(page_content=""physical and environmental\nthreats. in today's world, the information around the organization is very critical. this\ncontrol is broken into two parts a.11.1, “secure areas” and a.11.2, “equipment” the next\nsections discuss each control one by one.\na.11.1 secure areas\nobjective: to prevent unauthorized physical access, damage, and interference to the\norganization’s information and information processing facilities.\nexplanation: prevent unauthorized physical access and prevent damage to the\norganizational site and information. this includes the office building, rooms, and the\nfacilities such as air-conditioning, heating, electricity, etc.\nthis control is further broken down into six subparts.\na.11.1.1 physical security perimeter\ncontrol: security perimeters should be defined and used to protect areas that contain\neither sensitive or critical information and information processing facilities.\nexplanation: the boundaries of the organization must be secured and defined.\nthe expectation here is to have a secure fence or building wall that can protect critical\ninformation from compromise. the sensitive assets can be kept under secured room and\nin lockers.\na.11.1.2 physical entry controls\ncontrol: secure areas should be protected by appropriate entry controls to ensure that\nonly authorized personnel are allowed access.\nexplanation: the organizational secure areas such as entry gates, server rooms,\nand other important facilities are accessible by the authorized personnel only. all\nthe sensitive entry areas"", metadata={'source': 'Chopra, Chaudhary - 2020 - Implementing an Information Security Management System - Security Management Based On ISO 27001.pdf', 'title': 'Chopra, Chaudhary - 2020 - Implementing an Information Security Management System - Security Management Based On ISO 27001', 'original_text': ""physical and environmental\nthreats. In today's world, the information around the organization is very critical. This\ncontrol is broken into two parts A.11.1, “Secure Areas” and A.11.2, “Equipment” The next\nsections discuss each control one by one.\nA.11.1 Secure Areas\nObjective: To prevent unauthorized physical access, damage, and interference to the\norganization’s information and information processing facilities.\nExplanation: Prevent unauthorized physical access and prevent damage to the\norganizational site and information. This includes the office building, rooms, and the\nfacilities such as air-conditioning, heating, electricity, etc.\nThis control is further broken down into six subparts.\nA.11.1.1 Physical Security Perimeter\nControl: Security perimeters should be defined and used to protect areas that contain\neither sensitive or critical information and information processing facilities.\nExplanation: The boundaries of the organization must be secured and defined.\nThe expectation here is to have a secure fence or building wall that can protect critical\ninformation from compromise. The sensitive assets can be kept under secured room and\nin lockers.\nA.11.1.2 Physical Entry Controls\nControl: Secure areas should be protected by appropriate entry controls to ensure that\nonly authorized personnel are allowed access.\nExplanation: The organizational secure areas such as entry gates, server rooms,\nand other important facilities are accessible by the authorized personnel only. All\nthe sensitive entry areas"", 'doc_ID': 1188, 'relevance_score': 0.99505633})]","Control A.11.1.2 states that secure areas should be protected through adequate access control to ensure that only authorized personnel have access. Adequate access control can be achieved through controllable access points in the perimeter, such as doors, turnstiles, or barriers. These points can be either guarded by personnel who control access or secured by locked doors that only authorized individuals have keys for. Alternatively, doors or turnstiles with automated authorization control using chip card verification or PIN entry can be used. It is important that the physical security perimeter has no gaps or weakly protected areas and that intrusion attempts can be detected and alarmed. Adequate access controls also take resistance classes into account which indicate how long the security measures can withstand an attack and how long it takes before unauthorized individuals and attacks can be repelled. Access control should follow the principle of least privilege, and the exercise of permissions should be logged to enable access tracking.","Control A.11.1.2 states that secure areas should be protected by appropriate entry controls to ensure that only authorized personnel are allowed access. In the given context, it is mentioned that the organizational secure areas such as entry gates, server rooms, and other important facilities are accessible only by authorized personnel. It is also mentioned that entry by personnel access control can be implemented using biometric devices, and visitor entry can be recorded in a visitor logbook with temporary access granted through a visitor card.

To ensure adequate access control in a secure area, organizations can implement various measures such as:

1. Implementing strong authentication mechanisms like biometric devices or smart cards to verify the identity of authorized personnel.
2. Maintaining a visitor logbook to record the entry of visitors and providing them with temporary access through visitor cards.
3. Regularly reviewing and updating",True,0.461038961038961,0.18954248366013074,0.2857142857142857,0.5691972821950912,0.999922513961792,0.7819022371162551,0.16666666666666666,0.771045560813385,2.47690749168396,3.444087028503418,0.0010027885437011719,5.920994520187378
Fine-tuned_finetuned-ISO-27001_1024_l2_All_1536_264_False,Hybrid_Rerank_Cohere,2,gpt-3.5-turbo,4096,0,1,Which controls are covered in topic A.12?,"[Document(page_content='bit by bit.\nan example of a time channel with the resource ""process table"" in an it system: the sender starts a process identifiable in the process table to transfer the bit ""1"" according to the interval, and the process is not started for ""0"". the receiver observes the process table synchronously in the same interval and recognizes the ""1"" or the ""0"". this channel is usually not monitorable because the display of the process table is not normally monitored.\nespecially with time channels, only limited protection is often possible - sometimes it is enough to know about the existence of such a channel.\nif you want to learn more about the topic of data leakage, refer to [13].\ncontrol a-8.12 - also a new candidate in the 2022 version of the standard - requires:\n- identifying data groups susceptible to data leakage and in need of protection\n- monitoring known channels as far as possible\n- taking immediate action and potentially blocking the transfer in case of suspicious transfer activities.\nthese requirements cannot be fulfilled ""manually"" in ongoing it operations; instead, suitable monitoring facilities are needed, such as data loss prevention (dlp) products for the detection/prevention of unauthorized data leaks. these products are primarily software-based but are often supported by hardware (dlp network monitors) in the network environment.\n202 3 controls: requirements and measures\ndlp tools are capable of identifying data as sensitive in an organization\'s it landscape through configurable rules,', metadata={'source': 'ISO 27001_2022_Kersten_und_Schroeder.pdf', 'title': 'ISO 27001_2022_Kersten_und_Schroeder', 'original_text': 'bit by bit.\nAn example of a time channel with the resource ""process table"" in an IT system: The sender starts a process identifiable in the process table to transfer the bit ""1"" according to the interval, and the process is not started for ""0"". The receiver observes the process table synchronously in the same interval and recognizes the ""1"" or the ""0"". This channel is usually not monitorable because the display of the process table is not normally monitored.\nEspecially with time channels, only limited protection is often possible - sometimes it is enough to know about the existence of such a channel.\nIf you want to learn more about the topic of data leakage, refer to [13].\nControl A-8.12 - also a new candidate in the 2022 version of the standard - requires:\n- Identifying data groups susceptible to data leakage and in need of protection\n- Monitoring known channels as far as possible\n- Taking immediate action and potentially blocking the transfer in case of suspicious transfer activities.\nThese requirements cannot be fulfilled ""manually"" in ongoing IT operations; instead, suitable monitoring facilities are needed, such as Data Loss Prevention (DLP) products for the detection/prevention of unauthorized data leaks. These products are primarily software-based but are often supported by hardware (DLP network monitors) in the network environment.\n202 3 Controls: Requirements and Measures\nDLP tools are capable of identifying data as sensitive in an organization\'s IT landscape through configurable rules,', 'doc_ID': 2880, 'relevance_score': 0.95490044}), Document(page_content='of a file in different sectors than currently belong to the file. of course, a recognized and secure algorithm should be used for encryption. the used key is no longer needed and should not appear or be recorded anywhere - it is also not necessary: think of a key, type it in, encrypt the data, and forget the key!\nnote that labeled data carriers (a.7.10) carry information about their previous, potentially confidential use. therefore, it must be checked whether the labeling needs to be removed or renewed before the data carrier can be reused.\nfurther information on this important topic of secure deletion can be found, for example, in [10]. deletion methods are also addressed in the standard iso 27040 under the heading of storage security.\nin the context of data protection, deletion of personal data for special reasons (e.g. at the request of those affected by the data) is required - here, the techniques explained above are also applicable - but in terms of data protection, it is an extended deletion that encompasses not just a single file but all storage locations of the relevant data.\nthe second topic in this control concerns the disposal of devices:\nif devices have reached the end of their life or are to be decommissioned for other reasons (defect, outdated technology), secure deletion is also necessary - if still possible. a defect or existing incompatibility with new it can prevent this, under certain circumstances. in this case, secure disposal of the devices is definitely required, e.g. shredding or', metadata={'source': 'ISO 27001_2022_Kersten_und_Schroeder.pdf', 'title': 'ISO 27001_2022_Kersten_und_Schroeder', 'original_text': 'of a file in different sectors than currently belong to the file. Of course, a recognized and secure algorithm should be used for encryption. The used key is no longer needed and should not appear or be recorded anywhere - it is also not necessary: Think of a key, type it in, encrypt the data, and forget the key!\nNote that labeled data carriers (A.7.10) carry information about their previous, potentially confidential use. Therefore, it must be checked whether the labeling needs to be removed or renewed before the data carrier can be reused.\nFurther information on this important topic of secure deletion can be found, for example, in [10]. Deletion methods are also addressed in the standard ISO 27040 under the heading of Storage Security.\nIn the context of data protection, deletion of personal data for special reasons (e.g. at the request of those affected by the data) is required - here, the techniques explained above are also applicable - but in terms of data protection, it is an extended deletion that encompasses not just a single file but all storage locations of the relevant data.\nThe second topic in this control concerns the disposal of devices:\nIf devices have reached the end of their life or are to be decommissioned for other reasons (defect, outdated technology), secure deletion is also necessary - if still possible. A defect or existing incompatibility with new IT can prevent this, under certain circumstances. In this case, secure disposal of the devices is definitely required, e.g. shredding or', 'doc_ID': 2843, 'relevance_score': 0.86036915})]","The controls covered in topic A.12 are operational processes and responsibilities (A.12.1), protection against malware (A.12.2), backup of information (A.12.3), logging and monitoring (A.12.4), control of operational software (A.12.5), management of technical vulnerabilities (A.12.6), and information systems audit (A.12.7). The control group A.12.1 is comprehensive, while the other groups serve as further elaboration.",I am sorry. I do not have knowledge on that topic.,True,0.024691358024691357,0.0,0.024691358024691357,0.04331196378916502,7.30662650312297e-05,0.2924041820512846,0.5,0.3287045344794853,2.8487088680267334,40.897541761398315,0.0009970664978027344,43.74625062942505
Fine-tuned_finetuned-ISO-27001_1024_l2_All_1536_264_False,Hybrid_Rerank_Cohere,2,gpt-3.5-turbo,4096,0,1,What are the two important aspects of control A.13.1.2 and what do they deal with?,"[Document(page_content='and\napplications.\nexplanation/what is required: the organization can do the following to implement\nnetwork control measures:\ne establish the procedures and clear responsibilities for managing the\nnetwork equipment.\ne« implement controls to safeguard the information that travels over the\nnetwork to protect the systems and applications running on the network.\ne maintain network activity logs and monitor them on a regular basis.\n181\nchapter 6 execution\nevidence that can be prepared:\ne access control policy\ne network control policy\ne procedure for managing network equipment\ne risk tracker (with identified risks as part of access permissions)\nwho prepares it: the information security team needs to get input from various\ndepartments, including critical ones like the it helpdesk team, to define the access\ncontrol policy.\nfor external audit: the external auditor conducting the iso 27001 certification\naudit will check the evidence in order to verify how the organization has defined and\ncommunicated the policy to all stakeholders.\na.13.1.2 security of network services (iso 27001 control)\nsecurity mechanisms, service levels, and management requirements of all network\nservices should be identified and included in network services agreements, whether\nthese services are provided in-house or outsourced.\nexplanation/what is required: organizations hire network service providers for\ntheir internet service requirements, it is important to assess whether service providers\nare capable to provide internet services by', metadata={'source': 'Chopra, Chaudhary - 2020 - Implementing an Information Security Management System - Security Management Based On ISO 27001.pdf', 'title': 'Chopra, Chaudhary - 2020 - Implementing an Information Security Management System - Security Management Based On ISO 27001', 'original_text': 'and\napplications.\nExplanation/what is required: The organization can do the following to implement\nnetwork control measures:\ne Establish the procedures and clear responsibilities for managing the\nnetwork equipment.\ne« Implement controls to safeguard the information that travels over the\nnetwork to protect the systems and applications running on the network.\ne Maintain network activity logs and monitor them on a regular basis.\n181\nCHAPTER 6 EXECUTION\nEvidence that can be prepared:\ne Access control policy\ne Network control policy\ne Procedure for managing network equipment\ne Risk tracker (with identified risks as part of access permissions)\nWho prepares it: The information security team needs to get input from various\ndepartments, including critical ones like the IT Helpdesk team, to define the access\ncontrol policy.\nFor external audit: The external auditor conducting the ISO 27001 certification\naudit will check the evidence in order to verify how the organization has defined and\ncommunicated the policy to all stakeholders.\nA.13.1.2 Security of Network Services (ISO 27001 Control)\nSecurity mechanisms, service levels, and management requirements of all network\nservices should be identified and included in network services agreements, whether\nthese services are provided in-house or outsourced.\nExplanation/what is required: Organizations hire network service providers for\ntheir Internet service requirements, it is important to assess whether service providers\nare capable to provide Internet services by', 'doc_ID': 1223, 'relevance_score': 0.98421544}), Document(page_content=""two main controls are: a.11.1 secure areas and a.11.2 equipment.\n### **objective of a.11.1 secure areas**\nphysical and environmental security are at the core of annex a.11.1. the\nobjective of this control is to prevent unauthorised physical access and\ndamage to the organisation's stored data.\n### **objective of a.11.2 equipment**\nequipment is equally important as secure areas of annex a.11.2. the objective\nof this control is to avoid asset loss, damage and or theft as well as\ndisruption of business activities.\n## what is physical and environmental security?\nphysical and environmental security refers to the precautions put in place to\nprotect systems, buildings, and supporting equipment against physical threats.\nit refers to the protection of people's data, property data, and physical\nasset data against physical threats such as natural disasters, theft, and\nintentional destruction.\nphysical and environmental security, according to iso 27001, are sometimes\noverlooked yet remain critical in safeguarding information.\nthere are three principles that organisations must follow when it comes to\nphysical and environmental security. they are: physical deterrence, detection\nof intruders, and response to those risks.\n## what are the annex a 11 controls?\n### **a.11.1.1 physical security perimeter**\nsecurity perimeters, as well as each parameter's location, must be provided.\nyour organisation can use the risk assessment results, as well as the security\nneeds of the assets within the perimeter, should be used"", metadata={'source': 'https://www.dataguard.co.uk/blog/iso-27001-annex-a.11-physical-and-environmental-security/', 'title': 'ISO 27001 - Annex A.11 - physical and environmental security', 'description': 'Annex A 11 helps implement the physical environmental security of an organisation. Read on to learn more about physical space InfoSec and its benefits.', 'language': 'en-gb', 'original_text': ""two main controls are: A.11.1 Secure areas and A.11.2 Equipment.\n### **Objective of A.11.1 Secure areas**\nPhysical and environmental security are at the core of Annex A.11.1. The\nobjective of this control is to prevent unauthorised physical access and\ndamage to the organisation's stored data.\n### **Objective of A.11.2 Equipment**\nEquipment is equally important as secure areas of Annex A.11.2. The objective\nof this control is to avoid asset loss, damage and or theft as well as\ndisruption of business activities.\n## What is physical and environmental security?\nPhysical and environmental security refers to the precautions put in place to\nprotect systems, buildings, and supporting equipment against physical threats.\nIt refers to the protection of people's data, property data, and physical\nasset data against physical threats such as natural disasters, theft, and\nintentional destruction.\nPhysical and environmental security, according to ISO 27001, are sometimes\noverlooked yet remain critical in safeguarding information.\nThere are three principles that organisations must follow when it comes to\nphysical and environmental security. They are: physical deterrence, detection\nof intruders, and response to those risks.\n## What are the Annex A 11 controls?\n### **A.11.1.1 Physical Security Perimeter**\nSecurity perimeters, as well as each parameter's location, must be provided.\nYour organisation can use the risk assessment results, as well as the security\nneeds of the assets within the perimeter, should be used"", 'doc_ID': 491, 'relevance_score': 0.8200375})]","Control A.13.1.2 deals with the security of network services and encompasses two central aspects:

1. Determination of Security Mechanisms and Service Levels:
Definition and documentation of security mechanisms (e.g., encryption techniques and authentication procedures) and service-level requirements (e.g., scope and service speed) for network services.

2. Inclusion in Agreements with Service Providers:
Integration of the defined security and service-level requirements into written agreements with service providers, both internal and external.

The control aims to ensure that security mechanisms and service levels are clearly defined, documented, and incorporated into agreements with network service providers, ensuring the security and efficiency of the services provided. Incorrect or non-compliant management of network services can have significant consequences for an organization.","I am sorry. The context provided does not mention control A.13.1.2 or its important aspects. Therefore, I do not have knowledge of the two important aspects of control A.13.1.2 or what they deal with.",True,0.23170731707317074,0.07407407407407408,0.13414634146341464,0.21233810484409332,0.7641227841377258,0.39199818899902605,0.8,0.26405191497233926,2.928915500640869,1.6937146186828613,0.0009970664978027344,4.6226301193237305
Fine-tuned_finetuned-ISO-27001_1024_l2_All_1536_264_False,Hybrid_Rerank_Cohere,2,gpt-3.5-turbo,4096,0,1,What does control A.14.1.2 include and what security measures should be considered when transmitting information through services over public networks?,"[Document(page_content='there should be a\nformal process for testing cots products, and contracts should only be\nfinalized once they can include appropriate requirements for addressing any\nsecurity issues that have been identified. where the supplier cannot meet\nthe requirement, alternative controls should be considered such that the\ncriteria for the organization’s risk treatment plan can be met. if a product\nprovides unwanted security features, they should either be disabled or\nincorporated into the existing framework if there is a way in which this can\ncost-effectively enhance organizational information security.\nsecuring application services on public networks\ncontrol 14.1.2 of iss027002 focuses on the need to ensure that information\nused in applications or application services and which passes over public\nnetworks should be protected from fraud, contract dispute, and compro-\nmises to its integrity and confidentiality.\nas online commerce has become more and more widespread, so a control\ncategory that dealt primarily with e-commerce has been expanded to deal\nsystem acquisition, development and maintenance\nwith security in a wide range of application activity on the internet, includ-\ning application-based e-commerce.\ncontrol a.14.1.3 now requires any organization involved in ‘application\nservices transactions’ (which includes traditional e-commerce and in-app\ntransactions) to protect that information and its services against fraudulent\nactivity, contract dispute, disclosure or modification of information, misrout-\ning of', metadata={'source': 'Watkins, Calder - 2020 - IT Governance - An International Guide to Data Security and ISO 27001 ISO 27002.pdf', 'title': 'Watkins, Calder - 2020 - IT Governance - An International Guide to Data Security and ISO 27001 ISO 27002', 'original_text': 'there should be a\nformal process for testing COTS products, and contracts should only be\nfinalized once they can include appropriate requirements for addressing any\nsecurity issues that have been identified. Where the supplier cannot meet\nthe requirement, alternative controls should be considered such that the\ncriteria for the organization’s risk treatment plan can be met. If a product\nprovides unwanted security features, they should either be disabled or\nincorporated into the existing framework if there is a way in which this can\ncost-effectively enhance organizational information security.\nSecuring application services on public networks\nControl 14.1.2 of IsS027002 focuses on the need to ensure that information\nused in applications or application services and which passes over public\nnetworks should be protected from fraud, contract dispute, and compro-\nmises to its integrity and confidentiality.\nAs online commerce has become more and more widespread, so a control\ncategory that dealt primarily with e-commerce has been expanded to deal\nSYSTEM ACQUISITION, DEVELOPMENT AND MAINTENANCE\nwith security in a wide range of application activity on the internet, includ-\ning application-based e-commerce.\nControl A.14.1.3 now requires any organization involved in ‘application\nservices transactions’ (which includes traditional e-commerce and in-app\ntransactions) to protect that information and its services against fraudulent\nactivity, contract dispute, disclosure or modification of information, misrout-\ning of', 'doc_ID': 2356, 'relevance_score': 0.99862224}), Document(page_content='customer.\nsystem acquisition, development and maintenance\n+ non-repudiation of submission. there must be evidence (such as a\npostmark) that the thing was actually sent at a particular time.\n+ non-repudiation of receipt. it must be possible to prove that the receiving\nparty has actually received what was sent. lesser issues include verifying\nthe time and place of transmission.\napplication service management is an emerging discipline that deals with\nhow transaction information is delivered to an end user through an aggrega-\ntion of interdependent applications, operating systems, hardware platforms,\nand network connections; it recognizes that effective e-commerce depends\non much more than simple transaction-level security.\nit is against this background that the issues identified in clause 14.1.3 of\niso27002 should be considered. the control objective is that application\nservices information passing over public networks should be protected from\nfraudulent activity, contract dispute and unauthorized disclosure and modi-\nfication. in implementing this, there are a number of interlinked issues, many\nof which should be addressed in formal agreements between parties:\n- authentication, to ensure that there is some confidence that customers or\ntraders are who they say they are.\n- authorization, to ensure that trading partners know that prices set, or\ncontracts agreed, have been agreed by someone authorized to do so, and\nthat trading partners know what each other’s authorization procedures\nare.\n- dealing, in', metadata={'source': 'Watkins, Calder - 2020 - IT Governance - An International Guide to Data Security and ISO 27001 ISO 27002.pdf', 'title': 'Watkins, Calder - 2020 - IT Governance - An International Guide to Data Security and ISO 27001 ISO 27002', 'original_text': 'customer.\nSYSTEM ACQUISITION, DEVELOPMENT AND MAINTENANCE\n+ Non-repudiation of submission. There must be evidence (such as a\npostmark) that the thing was actually sent at a particular time.\n+ Non-repudiation of receipt. It must be possible to prove that the receiving\nparty has actually received what was sent. Lesser issues include verifying\nthe time and place of transmission.\nApplication Service Management is an emerging discipline that deals with\nhow transaction information is delivered to an end user through an aggrega-\ntion of interdependent applications, operating systems, hardware platforms,\nand network connections; it recognizes that effective e-commerce depends\non much more than simple transaction-level security.\nIt is against this background that the issues identified in clause 14.1.3 of\nISO27002 should be considered. The control objective is that application\nservices information passing over public networks should be protected from\nfraudulent activity, contract dispute and unauthorized disclosure and modi-\nfication. In implementing this, there are a number of interlinked issues, many\nof which should be addressed in formal agreements between parties:\n- Authentication, to ensure that there is some confidence that customers or\ntraders are who they say they are.\n- Authorization, to ensure that trading partners know that prices set, or\ncontracts agreed, have been agreed by someone authorized to do so, and\nthat trading partners know what each other’s authorization procedures\nare.\n- Dealing, in', 'doc_ID': 2361, 'relevance_score': 0.9975845})]","Control A.14.1.2 includes securing application services in public networks. It ensures that information transmitted through these services is protected from fraudulent activity, contractual disputes, unauthorized disclosure, and alteration. To ensure this, various security measures should be considered when transmitting information through application services over public networks. These include secure identity verification, secure declaration of intent, authenticity and confidentiality of documents, authorization control, secure payment processes, traceability, as well as liability and insurance issues.","Control A.14.1.2 of ISO 27001 focuses on securing application services on public networks. It aims to protect information used in applications or application services that pass over public networks from fraud, contract disputes, and compromises to its integrity and confidentiality. 

When transmitting information through services over public networks, several security measures should be considered. These include:

1. Authentication: Ensuring that there is confidence in the identity of customers or traders involved in the transaction.

2. Authorization: Ensuring that trading partners are aware of the authorization procedures and that prices set or contracts agreed upon have been authorized by the appropriate individuals.

3. Non-repudiation of submission and receipt: Providing evidence that the information was actually sent at a particular time and that the receiving party has received what was sent.

4. Protection against fraudulent activity, contract disputes,",True,0.45370370370370366,0.21495327102803738,0.2962962962962963,0.711806058883667,0.9999665021896362,0.8624972882188828,0.75,0.5113548357520075,4.605824708938599,2.8518893718719482,0.0010006427764892578,7.457714080810547
Fine-tuned_finetuned-ISO-27001_1024_l2_All_1536_264_False,Hybrid_Rerank_Cohere,2,gpt-3.5-turbo,4096,0,1,What do controls A.14.2.8 and A.14.2.9 state?,"[Document(page_content='environment.\na.14.2.7 outsourced development (control iso 27001)\nthe organization should supervise and monitor the activity of outsourced system\ndevelopment\nexample/what is required: this control covers the outsourced development\nsecurity and the following points should be considered:\ne code ownership and intellectual copyright related to outsourced\ndevelopment.\ne« acceptance testing for the quality and accuracy of software\ndeliverables.\ne complete documentation deliverables.\ne company who outsourced the development have full rights to audit\nthe development cycle.\n195\nchapter 6 execution\nevidence that can be prepared:\ne agreement between both the parties\ne the complete list of software deliverables\ne test results\ne audit results\nwho prepares it: management, along with relevant stakeholders, will be responsible\nfor agreement along with the legal team and the software development team for test\nresults and audit.\nfor external audit: the auditor may check the agreement or legal binding\ndocument between both parties.\na.14.2.8 system security testing (control iso 27001)\ntesting the security functionality should be carried out during development.\nexplanation/what is required: this control covers system security testing, which\nis performed during the development cycle. the security testing should be performed\nrigorously for the development project. independent software testing should be\nperformed for the acceptance of software application/product.\nevidence that can be prepared: security test cases for', metadata={'source': 'Chopra, Chaudhary - 2020 - Implementing an Information Security Management System - Security Management Based On ISO 27001.pdf', 'title': 'Chopra, Chaudhary - 2020 - Implementing an Information Security Management System - Security Management Based On ISO 27001', 'original_text': 'environment.\nA.14.2.7 Outsourced Development (Control ISO 27001)\nThe organization should supervise and monitor the activity of outsourced system\ndevelopment\nExample/what is required: This control covers the outsourced development\nsecurity and the following points should be considered:\ne Code ownership and intellectual copyright related to outsourced\ndevelopment.\ne« Acceptance testing for the quality and accuracy of software\ndeliverables.\ne Complete documentation deliverables.\ne Company who outsourced the development have full rights to audit\nthe development cycle.\n195\nCHAPTER 6 EXECUTION\nEvidence that can be prepared:\ne Agreement between both the parties\ne The complete list of software deliverables\ne Test results\ne Audit results\nWho prepares it: Management, along with relevant stakeholders, will be responsible\nfor agreement along with the legal team and the software development team for test\nresults and audit.\nFor external audit: The auditor may check the agreement or legal binding\ndocument between both parties.\nA.14.2.8 System Security Testing (Control ISO 27001)\nTesting the security functionality should be carried out during development.\nExplanation/what is required: This control covers system security testing, which\nis performed during the development cycle. The security testing should be performed\nrigorously for the development project. Independent software testing should be\nperformed for the acceptance of software application/product.\nEvidence that can be prepared: Security test cases for', 'doc_ID': 1242, 'relevance_score': 0.9893063}), Document(page_content='applica-\ntions shall be reviewed and tested to ensure there is no adverse\nimpact on organizational operations or security.\n18\nrestrictions on\nchanges to software\npackages\nsecure system engi-\nneering principles\ncontrol\nmodifications to software packages shall be discouraged, limited to\nnecessary changes and all changes shall be strictly controlled.\ncontrol\nprinciples for engineering secure systems shall be established,\ndocumented, maintained and applied to any information system\nimplementation efforts.\n© iso/iec 2013 - all rights reserved\niso/iec 27001:2013(e)\ntable a.1 (continued)\ncontrol\na.14.2.6 secure development organizations shall establish and appropriately protect secure\nenvironment\ndevelopment environments for system development and integra-\ntion efforts that cover the entire system development lifecycle.\na.14.2.7\noutsourced develop-\nment\nsystem security test-\ning\ncontrol\nthe organization shall supervise and monitor the activity of out-\nsourced system development.\ncontrol\ntesting of security functionality shall be carried out during devel-\nopment.\na.14.2.9\nsystem acceptance\ntesting\ncontrol\nacceptance testing programs and related criteria shall be estab-\nlished for new information systems, upgrades and new versions.\na.14.3 test data\nobjective: to ensure the protection of data used for testing.\na.14,3.1\nprotection of test data\ncontrol\ntest data shall be selected carefully, protected and controlled.\na.15 supplier relationships\na.15.1 information security in supplier', metadata={'source': 'ISO 27001 2013 (E).pdf', 'title': 'ISO 27001 2013 (E)', 'original_text': 'applica-\ntions shall be reviewed and tested to ensure there is no adverse\nimpact on organizational operations or security.\n18\nRestrictions on\nchanges to software\npackages\nSecure system engi-\nneering principles\nControl\nModifications to software packages shall be discouraged, limited to\nnecessary changes and all changes shall be strictly controlled.\nControl\nPrinciples for engineering secure systems shall be established,\ndocumented, maintained and applied to any information system\nimplementation efforts.\n© ISO/IEC 2013 - All rights reserved\nISO/IEC 27001:2013(E)\nTable A.1 (continued)\nControl\nA.14.2.6 Secure development Organizations shall establish and appropriately protect secure\nenvironment\ndevelopment environments for system development and integra-\ntion efforts that cover the entire system development lifecycle.\nA.14.2.7\nOutsourced develop-\nment\nSystem security test-\ning\nControl\nThe organization shall supervise and monitor the activity of out-\nsourced system development.\nControl\nTesting of security functionality shall be carried out during devel-\nopment.\nA.14.2.9\nSystem acceptance\ntesting\nControl\nAcceptance testing programs and related criteria shall be estab-\nlished for new information systems, upgrades and new versions.\nA.14.3 Test data\nObjective: To ensure the protection of data used for testing.\nA.14,3.1\nProtection of test data\nControl\nTest data shall be selected carefully, protected and controlled.\nA.15 Supplier relationships\nA.15.1 Information security in supplier', 'doc_ID': 3024, 'relevance_score': 0.9879462})]","Control A.14.2.8 states that security functionality should be tested during development. It is recommended to test at three levels: developer tests, tests by independent testing teams, and tests by a separate ""tiger team"" that attempts to bypass or penetrate the security features. Test suites, test tools, and ""hacker tools"" can be used for this purpose.

Control A.14.2.9 relates to the system acceptance test for new information systems, updates, and new versions. Acceptance test programs and criteria are established. After successful tests, an official acceptance procedure is conducted by individuals not involved in the development and testing phases. Various criteria are reviewed, including compliance with specifications, successful completion of all tests, and adherence to development requirements. Acceptance should occur before transitioning to operational use, and in many cases, pre-contracted agreements for the acceptance process are crucial, especially in externally contracted development projects. After the acceptance and transition to operational use, another testing phase ensures that the expected characteristics are also confirmed in actual operation. If successful, system accreditation can be granted.","Control A.14.2.8 states that system security testing should be carried out during development. This control emphasizes the need for rigorous security testing during the development cycle of a project. It also mentions that independent software testing should be performed to ensure the acceptance of the software application or product.

Control A.14.2.9 states that organizations should establish acceptance testing programs and related criteria for new information systems, upgrades, and new versions. This control highlights the importance of conducting acceptance testing to ensure that the system meets the required standards and criteria before it is implemented.

Both controls, A.14.2.8 and A.14.2.9, are part of the ISO 27001 standard and focus on the testing and acceptance of software applications or systems to ensure their security and functionality.",True,0.49840255591054317,0.19292604501607716,0.28753993610223644,0.9487709701061249,0.9998759031295776,0.7744701613098065,1.0,0.5124760230886986,2.839003562927246,2.9110755920410156,0.001003265380859375,5.750079154968262
Fine-tuned_finetuned-ISO-27001_1024_l2_All_1536_264_False,Hybrid_Rerank_Cohere,2,gpt-3.5-turbo,4096,0,1,What is important for implementing the information security policy for supplier relationships (A.15.1.11) and how can this be properly documented?,"[Document(page_content='suppliers access to information and assets, there must be\nprovisions to protect them from unauthorized access.\n197\nchapter 6 execution\na.15.1.1 information security policy for supplier relationships (iso 27001\ncontrol)\ninformation security requirements for mitigating the risks associated with supplier’s\naccess to the organization’s assets should be agreed with the supplier and documented.\nexplanation/what is required: organizations must identify all the essential security\ncontrols and communicate to all employees/contractors/suppliers by creating a policy.\norganizations need to mandate that suppliers adhere to the organizational policy and\nno unauthorized attempts be made for gaining access to the organization information\nand assets. it is important to define a clear procedure to implement identified security\ncontrols to guide the implementation teams.\nan organization can consider the following points, while planning to manage\nsupplier relationships.\ne identify and prepare the list of suppliers with information such as\nsupplier name, type of services provided by the supplier for example\nservices like it, logistics, infrastructure, etc.\ne identify the types of access that need to be provided to all the\ndifferent suppliers and how access will be monitored and controlled.\ne define the agreements with each supplier based on the information\nsecurity control and business needs of the organization. agreements\nmust be signed by both parties i.e. by supplier and your organization,\nto ensure all the obligations', metadata={'source': 'Chopra, Chaudhary - 2020 - Implementing an Information Security Management System - Security Management Based On ISO 27001.pdf', 'title': 'Chopra, Chaudhary - 2020 - Implementing an Information Security Management System - Security Management Based On ISO 27001', 'original_text': 'suppliers access to information and assets, there must be\nprovisions to protect them from unauthorized access.\n197\nCHAPTER 6 EXECUTION\nA.15.1.1 Information Security Policy for Supplier Relationships (ISO 27001\nControl)\nInformation security requirements for mitigating the risks associated with supplier’s\naccess to the organization’s assets should be agreed with the supplier and documented.\nExplanation/what is required: Organizations must identify all the essential security\ncontrols and communicate to all employees/contractors/suppliers by creating a policy.\nOrganizations need to mandate that suppliers adhere to the organizational policy and\nno unauthorized attempts be made for gaining access to the organization information\nand assets. It is important to define a clear procedure to implement identified security\ncontrols to guide the implementation teams.\nAn organization can consider the following points, while planning to manage\nsupplier relationships.\ne Identify and prepare the list of suppliers with information such as\nsupplier name, type of services provided by the supplier for example\nservices like IT, logistics, infrastructure, etc.\ne Identify the types of access that need to be provided to all the\ndifferent suppliers and how access will be monitored and controlled.\ne Define the agreements with each supplier based on the information\nsecurity control and business needs of the organization. Agreements\nmust be signed by both parties i.e. by supplier and your organization,\nto ensure all the obligations', 'doc_ID': 1245, 'relevance_score': 0.9993737}), Document(page_content='need to be able to rely on the confidentiality, integrity and\navailability of information shared with their suppliers, on the security of\ntheir supply chain connectivity and the reliability and robustness of their\nsupply chains. risks in supply chains range from external and environmen-\ntal threats to geo-political ones and include issues like quality, security,\nservice, resilience, integrity and health and safety. control category a.15.1\ncontains a number of controls which work toward the overall objective of\nmitigating risks in relation to organizational assets that are accessible by\nsuppliers; these controls should become part of any broader scrm plan\nthat the organization has in place. iso/iec 27036 (parts 1, 2 and 3) contain\ncurrent best practice for supply chain risk management. itil organizations\nwill integrate these controls into their supplier management processes.\ninformation security policy for supplier relationships\nthe starting point for the information security aspects of scrm is for the\norganization to determine what its policy will be. control 15.1.1 of\niso27002 focuses on the idea that how the organization had decided to\nmitigate its information security risks should be agreed in writing with\nsuppliers and that an overriding policy should be in place to ensure that all\nsupplier agreements are structured in line with a specific set of control\nrequirements. of course, any such requirements would have to be built into\nthe existing procurement process (which means that buy-in from', metadata={'source': 'Watkins, Calder - 2020 - IT Governance - An International Guide to Data Security and ISO 27001 ISO 27002.pdf', 'title': 'Watkins, Calder - 2020 - IT Governance - An International Guide to Data Security and ISO 27001 ISO 27002', 'original_text': 'need to be able to rely on the confidentiality, integrity and\navailability of information shared with their suppliers, on the security of\ntheir supply chain connectivity and the reliability and robustness of their\nsupply chains. Risks in supply chains range from external and environmen-\ntal threats to geo-political ones and include issues like quality, security,\nservice, resilience, integrity and health and safety. Control category A.15.1\ncontains a number of controls which work toward the overall objective of\nmitigating risks in relation to organizational assets that are accessible by\nsuppliers; these controls should become part of any broader SCRM plan\nthat the organization has in place. ISO/IEC 27036 (parts 1, 2 and 3) contain\ncurrent best practice for supply chain risk management. ITIL organizations\nwill integrate these controls into their supplier management processes.\nInformation security policy for supplier relationships\nThe starting point for the information security aspects of SCRM is for the\norganization to determine what its policy will be. Control 15.1.1 of\nISO27002 focuses on the idea that how the organization had decided to\nmitigate its information security risks should be agreed in writing with\nsuppliers and that an overriding policy should be in place to ensure that all\nsupplier agreements are structured in line with a specific set of control\nrequirements. Of course, any such requirements would have to be built into\nthe existing procurement process (which means that buy-in from', 'doc_ID': 2393, 'relevance_score': 0.9986646})]","The successful implementation of the information security policy for supplier relationships (A.15.1.11) requires a clear definition of security requirements for suppliers. These requirements should be documented in written agreements with suppliers, accompanied by careful risk analyses and assessments to develop effective measures to reduce the risk of external access to organization assets. It is crucial to consider specific requirements for different groups of suppliers, whether they are service technicians with access to IT systems, internet service providers, or IT service providers (outsourcing, cloud services).

To properly document the information security policy for supplier relationships (A.15.1.11), the requirements should be divided into two areas. The first area encompasses the requirements that the supplier must adhere to for service delivery within the organization. This can include personnel security checks, entry and exit controls, and compliance with access control rules. The second area deals with the measures that the supplier must take in their own sphere, such as compliance with contractual rules for data storage, processing, and deletion, adherence to technical security specifications, and compliance with regulatory requirements such as data protection and copyright. The policy should clearly outline the division and specific requirements for each supplier group.","For implementing the information security policy for supplier relationships (A.15.1.11) and properly documenting it, the following steps are important:

1. Identify and prepare a list of suppliers: This includes gathering information such as the supplier's name and the type of services they provide (e.g., IT, logistics, infrastructure).

2. Determine the types of access needed: Define the access requirements for each supplier and establish how access will be monitored and controlled.

3. Define agreements with suppliers: Based on the organization's information security controls and business needs, create agreements that outline the obligations of both parties. These agreements should be signed by both the supplier and the organization.

4. Communicate the policy to suppliers: Mandate that suppliers adhere to the organization's information security policy and ensure that no unauthorized attempts are made to gain access to the organization's",True,0.5043478260869565,0.16909620991253643,0.24927536231884057,0.37425000965595245,0.9999663829803467,0.83609568342404,1.0,0.8933465868228251,2.2752861976623535,2.999077558517456,0.0009992122650146484,5.27436375617981
Fine-tuned_finetuned-ISO-27001_1024_l2_All_1536_264_False,Hybrid_Rerank_Cohere,2,gpt-3.5-turbo,4096,0,1,What needs to be considered when dealing with security incidents in ISO 27001?,"[Document(page_content='all the responses on the security incident must be logged, as it might\nbe needed n the future for analysis purposes.\ne determine the root cause of the information security incident.\nonce all the required actions are taken on the incident, the status should change to\nclosed and all the details should be recorded.\nevidence that can be prepared:\ne« incident management procedure\ne« incident responses/results\nwho prepares it: the it helpdesk team can prepare all the evidence/records by\nconsulting the information security team.\nfor external audit: the external auditor conducting the iso 27001 certification audit\nwill check the procedure/records in order to verify how security incident responses are\ncommunicated and recorded by the organization.\n208\nchapter 6 execution\na.16.1.6 learning from information security incidents (iso control)\nknowledge gained from analyzing and resolving information security should be used to\nreduce the likelihood or impact of future incidents.\nexplanation/what is required: organizations must analyze all the data collected\nduring the evaluation of information security incident. this data will help to assess\nwhether similar type of incidents may occur on a frequent basis. after the analysis of\nsuch data, organizations must identify appropriate security controls for implementation\nto minimize the occurrence and impact of information security incident. the whole\npurpose of this control is to plan and implement improvements.\nevidence that can be prepared:\ne incident management', metadata={'doc_ID': 1260, 'original_text': 'All the responses on the security incident must be logged, as it might\nbe needed n the future for analysis purposes.\ne Determine the root cause of the information security incident.\nOnce all the required actions are taken on the incident, the status should change to\nclosed and all the details should be recorded.\nEvidence that can be prepared:\ne« Incident management procedure\ne« Incident responses/results\nWho prepares it: The IT Helpdesk team can prepare all the evidence/records by\nconsulting the information security team.\nFor external audit: The external auditor conducting the ISO 27001 certification audit\nwill check the procedure/records in order to verify how security incident responses are\ncommunicated and recorded by the organization.\n208\nCHAPTER 6 EXECUTION\nA.16.1.6 Learning from Information Security Incidents (ISO Control)\nKnowledge gained from analyzing and resolving information security should be used to\nreduce the likelihood or impact of future incidents.\nExplanation/what is required: Organizations must analyze all the data collected\nduring the evaluation of information security incident. This data will help to assess\nwhether similar type of incidents may occur on a frequent basis. After the analysis of\nsuch data, organizations must identify appropriate security controls for implementation\nto minimize the occurrence and impact of information security incident. The whole\npurpose of this control is to plan and implement improvements.\nEvidence that can be prepared:\ne Incident management', 'source': 'Chopra, Chaudhary - 2020 - Implementing an Information Security Management System - Security Management Based On ISO 27001.pdf', 'title': 'Chopra, Chaudhary - 2020 - Implementing an Information Security Management System - Security Management Based On ISO 27001', 'relevance_score': 0.9862046}), Document(page_content='the evidence/records by\nconsulting the information security team.\nfor external audit: the external auditor conducting the iso 27001 certification\naudit will check the procedure/records to verify how the organization has defined\nand managed incident management activities, how incidents are reported, and the\nresolution status communicated with the incident reporter.\n205\nchapter 6 execution\na.16.1.2 reporting information security events (iso control)\ninformation security events should be reported through appropriate management\nchannels as quickly as possible.\nexplanation/what is required: the requirement is whenever any employee or\ncontractor observes any security events in the system, it must be reported to the incident\nresponse team as quickly as possible, so that they can respond to the incident faster\nto minimize its impact on the organization information security. it is important that\nemployee/contractor must be made aware of the procedures for reporting the security\nevents and knows to whom to report any security event.\nsome of the scenarios could be considered security incidents. organizations can\nassess and prepare their own security incident definitions.\ne incident due to human error/mistake\ne ineffective security controls\ne physical security access breaches\ne unauthorized/unapproved system changes\ne practices that are not followed as per policy and procedures\ne errors in the system i.e. software or hardware\nevidence that can be prepared:\ne« incident management procedure\ne« form/tools to', metadata={'doc_ID': 1256, 'original_text': 'the evidence/records by\nconsulting the information security team.\nFor external audit: The external auditor conducting the ISO 27001 certification\naudit will check the procedure/records to verify how the organization has defined\nand managed incident management activities, how incidents are reported, and the\nresolution status communicated with the incident reporter.\n205\nCHAPTER 6 EXECUTION\nA.16.1.2 Reporting Information Security Events (ISO Control)\nInformation security events should be reported through appropriate management\nchannels as quickly as possible.\nExplanation/what is required: The requirement is whenever any employee or\ncontractor observes any security events in the system, it must be reported to the incident\nresponse team as quickly as possible, so that they can respond to the incident faster\nto minimize its impact on the organization information security. It is important that\nemployee/contractor must be made aware of the procedures for reporting the security\nevents and knows to whom to report any security event.\nSome of the scenarios could be considered security incidents. Organizations can\nassess and prepare their own security incident definitions.\ne Incident due to human error/mistake\ne Ineffective security controls\ne Physical security access breaches\ne Unauthorized/unapproved system changes\ne Practices that are not followed as per policy and procedures\ne Errors in the system i.e. software or hardware\nEvidence that can be prepared:\ne« Incident management procedure\ne« Form/tools to', 'source': 'Chopra, Chaudhary - 2020 - Implementing an Information Security Management System - Security Management Based On ISO 27001.pdf', 'title': 'Chopra, Chaudhary - 2020 - Implementing an Information Security Management System - Security Management Based On ISO 27001', 'relevance_score': 0.9832789})]","When dealing with security incidents according to ISO 27001, certain aspects need to be considered. A unified and effective approach to handling security incidents is required. It is important to notify all relevant parts of the organization in a timely manner about security events and vulnerabilities to take appropriate countermeasures. The incident response plan should include answers to questions regarding the application of the plan, responsibilities, notification, incident logging and recording, and handling steps. Training and awareness measures should ensure that personnel have the necessary competence. Additionally, an emergency organization for handling IT emergencies should be established.","When dealing with security incidents in ISO 27001, there are several considerations that need to be taken into account. Firstly, all responses to security incidents must be logged for future analysis purposes. This includes determining the root cause of the incident and recording all details once the required actions have been taken. The evidence that can be prepared includes the incident management procedure and the incident responses/results.

Additionally, organizations must learn from information security incidents and use the knowledge gained to reduce the likelihood or impact of future incidents. This involves analyzing the data collected during the evaluation of incidents to assess whether similar incidents may occur frequently. Based on this analysis, appropriate security controls should be identified and implemented to minimize the occurrence and impact of incidents. The evidence that can be prepared for this includes the incident management records.

Furthermore, it is important to report information security events through appropriate management channels",True,0.4126984126984127,0.13599999999999998,0.23015873015873017,0.9861100018024445,0.9984598159790039,0.7359953095010441,0.8333333333333334,0.9742596199592541,2.5301525592803955,3.3399269580841064,0.000995635986328125,5.870079517364502
Fine-tuned_finetuned-ISO-27001_1024_l2_All_1536_264_False,Hybrid_Rerank_Cohere,2,gpt-3.5-turbo,4096,0,1,What does Business Continuity Management deal with and what does objective A.17.1 state?,"[Document(page_content='necessary that a lawyer or the police be involved as soon as possible.\nevidence that can be prepared:\n¢ incident management procedure\n¢« implemented security controls to protect the evidence\n209\nchapter 6 execution\n¢ list of people having access to the folders/files\ne regular reviews of access list/logs to monitor unauthorized access\nattempts made to the evidence folder/files\nwho prepares it: the it helpdesk team can prepare all the evidence/records by\nconsulting the information security team.\nfor external audit: the external auditor conducting the iso 27001 certification\naudit will check the procedure/records in order to verify how security controls are\nimplemented and monitored to protect the evidence from being altered or deleted.\na.17 information security aspects of business continuity\nmanagement\na.17.1 information security continuity\nobjective: information security continuity should be embedded in the organization’s\nbusiness continuity management systems.\nexplanation/what is required: protect information security from loss in any adverse\nsituations that your organization may face. organizations must always be prepared for\nadverse situations by establishing a robust business continuity management system.\na.17.1.1 planning information security continuity (iso 27001 control)\nthe organization should determine its requirements for information security and the\ncontinuity of information security management in adverse situations e.g. during a crisis\nor disaster.\nexplanation/what is required:', metadata={'source': 'Chopra, Chaudhary - 2020 - Implementing an Information Security Management System - Security Management Based On ISO 27001.pdf', 'title': 'Chopra, Chaudhary - 2020 - Implementing an Information Security Management System - Security Management Based On ISO 27001', 'original_text': 'necessary that a lawyer or the police be involved as soon as possible.\nEvidence that can be prepared:\n¢ Incident management procedure\n¢« Implemented security controls to protect the evidence\n209\nCHAPTER 6 EXECUTION\n¢ List of people having access to the folders/files\ne Regular reviews of access list/logs to monitor unauthorized access\nattempts made to the evidence folder/files\nWho prepares it: The IT Helpdesk team can prepare all the evidence/records by\nconsulting the information security team.\nFor external audit: The external auditor conducting the ISO 27001 certification\naudit will check the procedure/records in order to verify how security controls are\nimplemented and monitored to protect the evidence from being altered or deleted.\nA.17 Information Security Aspects of Business Continuity\nManagement\nA.17.1 Information Security Continuity\nObjective: Information security continuity should be embedded in the organization’s\nbusiness continuity management systems.\nExplanation/what is required: Protect information security from loss in any adverse\nsituations that your organization may face. Organizations must always be prepared for\nadverse situations by establishing a robust business continuity management system.\nA.17.1.1 Planning Information Security Continuity (ISO 27001 Control)\nThe organization should determine its requirements for information security and the\ncontinuity of information security management in adverse situations e.g. during a crisis\nor disaster.\nExplanation/what is required:', 'doc_ID': 1262, 'relevance_score': 0.9883127}), Document(page_content='and confidentiality of information in accordance with all\nrelevant regulations, legislature and policies.\n## **what are the annex a.17 controls?**\nannex a.17 comprises 4 controls across two subsets aimed at ensuring, planning\nand implementing information security continuity. these controls are as\nfollows:\n### **a.17.1 information security continuity**\na.17.1 states policies that ensure the continuity of information security\nshould be considered a part of and integrated into the organisation’s business\ncontinuity management processes.\n * #### **a.17.1.1 planning information security continuity**\nwhen faced with disruptions and adverse circumstances, organisations must\ndetermine their requirements for the continuity of information security during\nand after the event.\nan effectively managed isms may already have control mechanisms in place that\nreduce the need for an a.17 based disaster management plan. even so, a\ndetailed plan must be documented; one that ensures infosec continuity and\nassumes existing infosec requirements remain the same across normal and\nadverse conditions. alternatively, a risk analysis may be conducted to\nidentify new information security requirements relevant to the disruption or\nadverse situation at hand.\n * **a.17.1.2 implementing information security continuity** once infosec continuity requirements have been identified, the organisation\nmust implement policies and controls to facilitate the satisfaction of these\nrequirements. all aspects of work (parties responsible,', metadata={'source': 'https://www.dataguard.co.uk/blog/iso-27001-annex-a.17-information-security-aspects-of-business-continuity-management/', 'title': 'ISO 27001 - Annex A.17 and business continuity management', 'description': ""Annex A 17 guides the infosec measures included in an organisation's business continuity management plan. Learn more about recovering systems and data."", 'language': 'en-gb', 'original_text': 'and confidentiality of information in accordance with all\nrelevant regulations, legislature and policies.\n## **What are the Annex A.17 controls?**\nAnnex A.17 comprises 4 controls across two subsets aimed at ensuring, planning\nand implementing information security continuity. These controls are as\nfollows:\n### **A.17.1 Information Security Continuity**\nA.17.1 states policies that ensure the continuity of information security\nshould be considered a part of and integrated into the organisation’s business\ncontinuity management processes.\n * #### **A.17.1.1 Planning Information Security Continuity**\nWhen faced with disruptions and adverse circumstances, organisations must\ndetermine their requirements for the continuity of information security during\nand after the event.\nAn effectively managed ISMS may already have control mechanisms in place that\nreduce the need for an A.17 based disaster management plan. Even so, a\ndetailed plan must be documented; one that ensures infosec continuity and\nassumes existing infosec requirements remain the same across normal and\nadverse conditions. Alternatively, a risk analysis may be conducted to\nidentify new information security requirements relevant to the disruption or\nadverse situation at hand.\n * **A.17.1.2 Implementing Information Security Continuity** Once infosec continuity requirements have been identified, the organisation\nmust implement policies and controls to facilitate the satisfaction of these\nrequirements. All aspects of work (parties responsible,', 'doc_ID': 538, 'relevance_score': 0.9877587})]","Business Continuity Management (BCM) is concerned with maintaining the operational activities of an organization under adverse conditions. This involves establishing responsibilities, procedures, and a management system to prevent adverse circumstances related to crucial business processes; minimizing potential damages; and swiftly returning to normal operational states. Adverse circumstances could include severe disruptions in supplies (power, air conditioning) or IT support (cloud services, service providers), failure of essential security measures in infrastructure (access controls, monitoring systems), or disclosure of vulnerabilities in widely used cryptographic algorithms. However, each organization can determine by itself which situations are seen as adverse. 

Objective A.17.1 states that the maintenance of information security must be embedded in the organization's BCM. The information security process must function under all circumstances, including adverse conditions, to prevent any reduction or suspension of security. The integration into the BCM ensures this. If BCM is not in place, the task of maintaining information security must be transferred to another position within the ISMS.","Business Continuity Management (BCM) deals with ensuring the continuity of information security in adverse situations or during a crisis or disaster. Objective A.17.1 of ISO 27001 states that information security continuity should be embedded in the organization's business continuity management systems.

A.17.1.1 Planning Information Security Continuity is a control under Annex A.17. It requires organizations to determine their requirements for the continuity of information security during adverse situations. This includes identifying the necessary measures to protect the availability, integrity, and confidentiality of information in accordance with relevant regulations, legislature, and policies.

The other control under Annex A.17 is A.17.1.2 Implementing Information Security Continuity. Once the requirements for information security continuity have been identified, organizations must implement policies and controls to meet these requirements. This includes assigning responsibilities, establishing",True,0.4635761589403974,0.11333333333333333,0.2582781456953642,0.9474666714668274,0.999150276184082,0.7900485284646709,0.75,0.6332684891012876,2.4363210201263428,3.185415029525757,0.0009970664978027344,5.6217360496521
Fine-tuned_finetuned-ISO-27001_1024_l2_All_1536_264_False,Hybrid_Rerank_Cohere,2,gpt-3.5-turbo,4096,0,1,What do companies based within the EU need to consider regarding control A.18.1.4?,"[Document(page_content='personal information\nwithin the eu, as the eu gdpr forbids the movement of the data of eu\nresidents to any country that does not have an eu-equivalent data\nprotection regime. the usa, for instance, does not and so information\nsystems that store personal data and are hosted with a us-based cloud\nservices provider are quite likely to be a legal breach, unless the\norganization concerned has an eu-us privacy shield registration. the\nother key aspect to consider is that, under the eu gdpr, a data controller\ncannot transfer the accountability for the protection of personal data it\nhas collected to any contracted supplier.\n- staff awareness training may be an issue that is identified in the risk\nassessment; this training might be applicable to both the supplier and the\ncustomer and could cover any aspect of the relationship where one or\nboth parties need to understand the ‘rules of engagement’ and how\nspecific, identified risks are to be managed and mitigated.\n+ how the transition (particularly for larger projects} from contract\nnegotiation to delivery should be managed; this obviously covers\nmaintaining information security through a transitionary process —\ncovering, for instance, access to premises and facilities, to systems and to\ndata.\naddressing security within supplier agreements\ncontrol 15.1.2 of is027002 translates policy into action and requires the\norganization to ensure that all the security controls, service definitions and\ndelivery levels identified in the third-party service contract are carried', metadata={'source': 'Watkins, Calder - 2020 - IT Governance - An International Guide to Data Security and ISO 27001 ISO 27002.pdf', 'title': 'Watkins, Calder - 2020 - IT Governance - An International Guide to Data Security and ISO 27001 ISO 27002', 'original_text': 'personal information\nwithin the EU, as the EU GDPR forbids the movement of the data of EU\nresidents to any country that does not have an EU-equivalent data\nprotection regime. The USA, for instance, does not and so information\nsystems that store personal data and are hosted with a US-based cloud\nservices provider are quite likely to be a legal breach, unless the\norganization concerned has an EU-US Privacy Shield registration. The\nother key aspect to consider is that, under the EU GDPR, a data controller\ncannot transfer the accountability for the protection of personal data it\nhas collected to any contracted supplier.\n- Staff awareness training may be an issue that is identified in the risk\nassessment; this training might be applicable to both the supplier and the\ncustomer and could cover any aspect of the relationship where one or\nboth parties need to understand the ‘rules of engagement’ and how\nspecific, identified risks are to be managed and mitigated.\n+ How the transition (particularly for larger projects} from contract\nnegotiation to delivery should be managed; this obviously covers\nmaintaining information security through a transitionary process —\ncovering, for instance, access to premises and facilities, to systems and to\ndata.\nAddressing security within supplier agreements\nControl 15.1.2 of IS027002 translates policy into action and requires the\norganization to ensure that all the security controls, service definitions and\ndelivery levels identified in the third-party service contract are carried', 'doc_ID': 2397, 'relevance_score': 0.98849183}), Document(page_content='(such as,\nfor instance, an information security manager) cannot also be the dpo.\nin particular, organizations should be cognizant of the restrictions on\ntransferring personal data to countries that are not within the european\nunion. this restriction is particularly important for organizations ‘offshor-\ning’ any part of their customer support operations, or consolidating in a\nsingle location services previously delivered from multiple jurisdictions.\nthe eu-us privacy shield framework\nthis allows us corporations that are regulated by the federal trade\ncommission (ftc) and have operations in the eu to receive eu personal\ndata. the privacy shield provides us organizations with a way to demon-\nstrate a level of data protection that is not normally available under us\nfederal law. the privacy shield compliance standards are certified through\nthe department of commerce and enforced by the ftc; they are set out on\nthe commerce department and fic websites and carry commerce\ndepartment certification. only a small percentage of corporations have\ncompliance\nmet a requirement that enables them to obtain eu member state (one year\nrenewable) permission to transfer data out of the european union. more\ninformation on the safe harbor framework is at https://www.export.gov/\nsafeharbor/eg_main_018236.asp (archived at https://perma.cc/3585-\nu2m4).\nregulation of cryptographic controls\ncontrol 18.1.5 of is027002 says the organization should put in place\ncontrols to ensure compliance with any national agreements, laws,', metadata={'source': 'Watkins, Calder - 2020 - IT Governance - An International Guide to Data Security and ISO 27001 ISO 27002.pdf', 'title': 'Watkins, Calder - 2020 - IT Governance - An International Guide to Data Security and ISO 27001 ISO 27002', 'original_text': '(such as,\nfor instance, an information security manager) cannot also be the DPO.\nIn particular, organizations should be cognizant of the restrictions on\ntransferring personal data to countries that are not within the European\nUnion. This restriction is particularly important for organizations ‘offshor-\ning’ any part of their customer support operations, or consolidating in a\nsingle location services previously delivered from multiple jurisdictions.\nThe EU-US Privacy Shield framework\nThis allows US corporations that are regulated by the Federal Trade\nCommission (FTC) and have operations in the EU to receive EU personal\ndata. The Privacy Shield provides US organizations with a way to demon-\nstrate a level of data protection that is not normally available under US\nFederal Law. The Privacy Shield compliance standards are certified through\nthe Department of Commerce and enforced by the FTC; they are set out on\nthe Commerce Department and FIC websites and carry Commerce\nDepartment certification. Only a small percentage of corporations have\nCOMPLIANCE\nmet a requirement that enables them to obtain EU member state (one year\nrenewable) permission to transfer data out of the European Union. More\ninformation on the safe harbor framework is at https://www.export.gov/\nsafeharbor/eg_main_018236.asp (archived at https://perma.cc/3585-\nU2M4).\nRegulation of cryptographic controls\nControl 18.1.5 of IS027002 says the organization should put in place\ncontrols to ensure compliance with any national agreements, laws,', 'doc_ID': 2512, 'relevance_score': 0.98492736})]","Companies based within the EU must ensure privacy and the protection of personal information as required by relevant laws and regulations when it comes to control A.18.1.4. This may include compliance with the EU General Data Protection Regulation (GDPR), the Federal Data Protection Act, and corresponding state laws. To fulfill the control, proof of GDPR compliance is required, which can be provided through a separate data protection concept or its own data protection management system. It is important to note that an ISO 27001 certification for organizations outside the EU does not automatically mean GDPR compliance and this must be considered when selecting service providers and providers.","Based on the provided context, companies based within the EU need to consider control A.18.1.4 in relation to the transfer of personal data to countries outside the European Union. The EU GDPR prohibits the transfer of personal data of EU residents to any country that does not have an EU-equivalent data protection regime. This means that if a company stores personal data in information systems hosted with a US-based cloud services provider, it may be a legal breach unless the organization has an EU-US Privacy Shield registration.

Control A.18.1.4 also requires companies to ensure that the accountability for the protection of personal data collected cannot be transferred to any contracted supplier. This means that companies need to be cautious when offshoring customer support operations or consolidating services previously delivered from multiple jurisdictions, as restrictions on transferring personal data to countries outside the EU apply",True,0.44866920152091255,0.1302681992337165,0.22813688212927757,0.770145446062088,0.9972104430198669,0.7024209989535056,1.0,0.7577095549025495,2.463442087173462,2.961442232131958,0.0009927749633789062,5.42488431930542
Fine-tuned_finetuned-ISO-27001_1024_l2_All_1536_264_False,Hybrid_Rerank_Cohere,2,gpt-3.5-turbo,4096,0,1,What impact does the inclusion of data protection have on ISO 27001 and the ISMS?,"[Document(page_content='these methodologies skew the risk treatment decisions.\nfor instance, an asset with a very high confidentiality impact\nlevel and a very low availability impact level needs different\ncontrols for risks to confidentiality than to availability.\nshould you apply controls that are more appropriate for one\nrisk than the other, or should you apply something ‘in the\nmiddle’ that is appropriate for neither? in either case, what\nyou have is a situation in which your risk treatment decision\nis not directly related to the risk, and the investment in the\ncontrols is unlikely to be in proportion to the potential impact\nagainst which you are guarding. in other words, this sort of\napproach is unlikely to lead either to an isms that conforms\nto iso 27001 or to one that is cost-effectively optimised.\nthe risk analysis above doesn’t yet include an assessment as\nto the actual cost of the impact on the organisation in any of\nthe nine identified areas, nor does it include an assessment as\nto the likelihood of occurrence of the threat-vulnerability\ncombination. it is, therefore, impossible to determine which\nof the identified risks should be accepted, which rejected and\nwhich transferred or controlled.\nestimating impact\npart of how we make that decision has to take into account\nthe cost of controlling the risk: should we spend more, less\nthan, or the same as the potential cost of the impact?\niso 27001 defines the purpose of an isms as “[preserving]\nthe confidentiality, integrity and availability of information\nby applying a risk', metadata={'source': 'Calder - 2019 - Information Security Risk Management for ISO 27001.pdf', 'title': 'Calder - 2019 - Information Security Risk Management for ISO 27001', 'original_text': 'these methodologies skew the risk treatment decisions.\nFor instance, an asset with a very high confidentiality impact\nlevel and a very low availability impact level needs different\ncontrols for risks to confidentiality than to availability.\nShould you apply controls that are more appropriate for one\nrisk than the other, or should you apply something ‘in the\nmiddle’ that is appropriate for neither? In either case, what\nyou have is a situation in which your risk treatment decision\nis not directly related to the risk, and the investment in the\ncontrols is unlikely to be in proportion to the potential impact\nagainst which you are guarding. In other words, this sort of\napproach is unlikely to lead either to an ISMS that conforms\nto ISO 27001 or to one that is cost-effectively optimised.\nThe risk analysis above doesn’t yet include an assessment as\nto the actual cost of the impact on the organisation in any of\nthe nine identified areas, nor does it include an assessment as\nto the likelihood of occurrence of the threat-vulnerability\ncombination. It is, therefore, impossible to determine which\nof the identified risks should be accepted, which rejected and\nwhich transferred or controlled.\nEstimating impact\nPart of how we make that decision has to take into account\nthe cost of controlling the risk: should we spend more, less\nthan, or the same as the potential cost of the impact?\nISO 27001 defines the purpose of an ISMS as “[preserving]\nthe confidentiality, integrity and availability of information\nby applying a risk', 'doc_ID': 791, 'relevance_score': 0.90295243}), Document(page_content='effectiveness of its isms and reduce the risk of security incidents.\n### your iso 27001 certification process made simple.\n### get iso 27001 certified in as little as 3 months. download your free guide now\n## why is it important for organisations to have adequate resources for their\nisms?\nadequate resources are essential for the successful implementation and\nmaintenance of an isms. without adequate resources, organisations may not be\nable to:\n * hire and train staff * purchase and maintain the necessary infrastructure * implement and maintain the necessary security controls * monitor and improve their isms\nas a result, organisations with inadequate resources may be more vulnerable to\ninformation security incidents.\n## what are the challenges that organisations may face in identifying and\nallocating resources for their isms?\nthe following are some of the challenges that organisations may face in\nidentifying and allocating resources for their isms:\n * lack of awareness of the importance of information security: some organisations may not be aware of the importance of information security or the resources that are needed to implement and maintain an isms. * limited budget: organisations may have limited budgets and may not be able to afford to invest in the necessary resources for their isms. * competition for resources: organisations may face competition for resources from other departments or initiatives. * lack of skilled staff: there may be a', metadata={'source': 'https://www.dataguard.co.uk/knowledge/iso-27001/clause-7-1-resources-for-isms/', 'title': 'ISO 27001 requirement 7.1: Identify and allocate resources for ISMS', 'description': 'ISO 27001 clause 7.1 stipulates that organisations must allocate necessary resources for the establishment, maintenance, and enhancement of their ISMS.', 'language': 'en-gb', 'original_text': 'effectiveness of its ISMS and reduce the risk of security incidents.\n### Your ISO 27001 certification process made simple.\n### Get ISO 27001 certified in as little as 3 months. Download your free guide now\n## Why is it important for organisations to have adequate resources for their\nISMS?\nAdequate resources are essential for the successful implementation and\nmaintenance of an ISMS. Without adequate resources, organisations may not be\nable to:\n * Hire and train staff * Purchase and maintain the necessary infrastructure * Implement and maintain the necessary security controls * Monitor and improve their ISMS\nAs a result, organisations with inadequate resources may be more vulnerable to\ninformation security incidents.\n## What are the challenges that organisations may face in identifying and\nallocating resources for their ISMS?\nThe following are some of the challenges that organisations may face in\nidentifying and allocating resources for their ISMS:\n * Lack of awareness of the importance of information security: Some organisations may not be aware of the importance of information security or the resources that are needed to implement and maintain an ISMS. * Limited budget: Organisations may have limited budgets and may not be able to afford to invest in the necessary resources for their ISMS. * Competition for resources: Organisations may face competition for resources from other departments or initiatives. * Lack of skilled staff: There may be a', 'doc_ID': 379, 'relevance_score': 0.86118835})]","The integration of data protection into ISO 27001 and the ISMS has the following impact:
1. Business Context and Scope:
Addition of data protection regulations to the business context.
Expansion of the ISMS scope to include the processing of personal data.

2. Asset Inventory and Processes:
Comprehensive inventory of all assets related to data processing.
Extension of Change & Configuration Management and Incident Management to include data protection.

3.ISMS Establishment, Implementation, and Maintenance:
Integration of data protection aspects into all phases of the ISMS.

4. Information Security Objectives:
Extension of information security objectives to include data protection goals.

5. Policy and Roles:
Consideration of data protection aspects in policies and role definitions.

6. Risk Management (clause 6):
Identification, analysis, assessment, and treatment of risks related to personal data processing.
Consideration of new risk objects (affected individuals) with significant implications for risk management.","The inclusion of data protection has a significant impact on ISO 27001 and the ISMS (Information Security Management System). Data protection is a crucial aspect of information security, and it aligns with the objectives of ISO 27001 to preserve the confidentiality, integrity, and availability of information.

By including data protection in ISO 27001, organizations are required to implement controls and measures to safeguard personal data and comply with relevant data protection regulations. This includes implementing appropriate technical and organizational measures to protect personal data against unauthorized access, disclosure, alteration, or destruction.

The inclusion of data protection in ISO 27001 also affects the risk treatment decisions. Organizations need to consider the specific risks and impacts related to the confidentiality of personal data and implement controls accordingly. This ensures that the investment in controls is proportionate to the potential impact against which the organization is guarding.

",True,0.4755244755244755,0.14788732394366194,0.2657342657342657,0.8425484299659729,0.9997838139533997,0.757667633950307,0.2222222222222222,0.9721767394455147,2.599601984024048,3.0050101280212402,0.001028299331665039,5.604612112045288
Fine-tuned_finetuned-ISO-27001_1024_l2_All_1536_264_False,Hybrid_Rerank_Cohere,2,gpt-3.5-turbo,4096,0,1,What standards are provided by BSI to establish an ISO 27001 compliant Information Security Management System (ISMS) based on IT-Grundschutz?,"[Document(page_content=""01\nwhat is iso 27001?\niso/iec 27001, or iso 27001, is the international standard that defines best practices for implementing and\nmanaging information security controls within an information security management system (isms).\niso/iec 27001 is one part of the overarching iso 27000 family of security standards determined by the\ninternational organization for standardization (iso) and the international electrotechnical commission (iec).\nthe purpose of iso 27001 is to address how organizations establish, monitor, maintain, and improve their isms\nto keep their data, documents, and other information assets secure.\norganizations that can demonstrate their processes and controls meet iso 27001 compliance requirements\nduring a two-stage audit are eligible to receive certification from their country's certifying body. this\ncertification verifies that the organization's security systems and it processes follow current best practices.\n02\nhistory of iso 27001\nas cybersecurity needs evolved and more organizations adopted ismses, the british standards institute group\n(bsi group) sought to define it standards outlining how organizations should design their isms to secure their\ninformation assets.\nin 1995, the bsi partnered with the united kingdom government's department of trade and industry (dti) to\nwrite vendor-neutral standards that uphold the availability, confidentiality, and integrity of an organization's\ndata and proprietary information. these essential it standards—known as bs 7799—became the foundation"", metadata={'source': 'complete-guide-iso-27001-compliance.pdf', 'title': 'complete-guide-iso-27001-compliance', 'original_text': ""01\nWhat is ISO 27001?\nISO/IEC 27001, or ISO 27001, is the international standard that defines best practices for implementing and\nmanaging information security controls within an information security management system (ISMS).\nISO/IEC 27001 is one part of the overarching ISO 27000 family of security standards determined by the\nInternational Organization for Standardization (ISO) and the International Electrotechnical Commission (IEC).\nThe purpose of ISO 27001 is to address how organizations establish, monitor, maintain, and improve their ISMS\nto keep their data, documents, and other information assets secure.\nOrganizations that can demonstrate their processes and controls meet ISO 27001 compliance requirements\nduring a two-stage audit are eligible to receive certification from their country's certifying body. This\ncertification verifies that the organization's security systems and IT processes follow current best practices.\n02\nHistory of ISO 27001\nAs cybersecurity needs evolved and more organizations adopted ISMSes, the British Standards Institute Group\n(BSI Group) sought to define IT standards outlining how organizations should design their ISMS to secure their\ninformation assets.\nIn 1995, the BSI partnered with the United Kingdom Government's Department of Trade and Industry (DTI) to\nwrite vendor-neutral standards that uphold the availability, confidentiality, and integrity of an organization's\ndata and proprietary information. These essential IT standards—known as BS 7799—became the foundation"", 'doc_ID': 1333, 'relevance_score': 0.99021614}), Document(page_content='critical\ninfrastructures (kritis), which are organizations and facilities in germany in\nthe fields of state and administration, food, finance and insurances, water,\nmedia and culture, transport and traffic, information technology and\ntelecommunication, health and energy.\nkritis organizations must prove that their it security is state of the art\naccording to §8a bsig. this means that an information security management\nsystem (isms) needs to be implemented according to iso 27001 or it grundschutz\nby bsi.\n\u200d **\u200d**\n## **why should other organizations besides kritis implement an isms?**\n **\u200d** as a result of the cybersecurity act and other standards, this is not only a\nfactual and liability law problem, but increasingly also a criminal law and\nexistential problem for companies, because the number of cyber attacks is\ncontinuously increasing.\nin order to organize operational it in a legally compliant manner, one should\nfollow recognized standards such as iso 27001. the technical standards of din\niso 27001 provide the guidelines that regulate the handling of in-house it,\nbecause there is a legal obligation to ensure it compliance.\nthis duty and responsibility of management to comply with the law or to ensure\ncompliance arises not only from the cybersecurity act, but also from the\nadministrative offenses act, the stock corporation act and the limited\nliability companies act. according to these, those responsible are obliged to\navert economic damage to the company and therefore not to tolerate violations\nof the', metadata={'source': 'https://www.secfix.com/post/when-is-an-iso-27001-certification-required', 'title': 'Which industries require ISO 27001 certification?', 'description': 'ISO 27001 applies to any organization that needs to formalize business processes around information security, data protection & securing its information assets', 'language': 'en', 'original_text': 'critical\ninfrastructures (KRITIS), which are organizations and facilities in Germany in\nthe fields of State and Administration, Food, Finance and Insurances, Water,\nMedia and Culture, Transport and Traffic, Information Technology and\nTelecommunication, Health and Energy.\nKRITIS organizations must prove that their IT Security is state of the art\naccording to §8a BSIG. This means that an Information Security Management\nSystem (ISMS) needs to be implemented according to ISO 27001 or IT Grundschutz\nby BSI.\n\u200d **\u200d**\n## **Why should other organizations besides KRITIS implement an ISMS?**\n **\u200d** As a result of the Cybersecurity Act and other standards, this is not only a\nfactual and liability law problem, but increasingly also a criminal law and\nexistential problem for companies, because the number of cyber attacks is\ncontinuously increasing.\nIn order to organize operational IT in a legally compliant manner, one should\nfollow recognized standards such as ISO 27001. The technical standards of DIN\nISO 27001 provide the guidelines that regulate the handling of in-house IT,\nbecause there is a legal obligation to ensure IT compliance.\nThis duty and responsibility of management to comply with the law or to ensure\ncompliance arises not only from the Cybersecurity Act, but also from the\nAdministrative Offenses Act, the Stock Corporation Act and the Limited\nLiability Companies Act. According to these, those responsible are obliged to\navert economic damage to the company and therefore not to tolerate violations\nof the', 'doc_ID': 375, 'relevance_score': 0.9854405})]","The Federal Office for Information Security (BSI) offers various standards to establish an ISO 27001 compliant Information Security Management System (ISMS) based on IT-Grundschutz. These standards are:

- BSI 200-1: Information Security Management Systems (ISMS)
- BSI 200-2: IT-Grundschutz Methodology
- BSI 200-3: Risk Analysis based on IT-Grundschutz

In addition, the extensive IT-Grundschutz Compendium is available, which provides a comprehensive set of measures for the basic protection of an information network.","The BSI (British Standards Institute) provides standards to establish an ISO 27001 compliant Information Security Management System (ISMS) based on IT-Grundschutz. IT-Grundschutz is a set of standards developed by the BSI to help organizations in Germany implement information security measures. It is specifically mentioned that KRITIS organizations in Germany must implement an ISMS according to ISO 27001 or IT-Grundschutz by BSI to prove that their IT security is state of the art.

ISO 27001 is an international standard that defines best practices for implementing and managing information security controls within an ISMS. Organizations that can demonstrate compliance with ISO 27001 requirements are eligible to receive certification from their country's certifying body.

In summary, the BSI provides standards based on IT-Grundschutz to",True,0.48756218905472637,0.23115577889447236,0.31840796019900497,0.9250328242778778,0.9999659061431885,0.9106510375040249,0.3333333333333333,0.7840696440153305,2.65899920463562,3.177281379699707,0.0010027885437011719,5.836280584335327
Fine-tuned_finetuned-ISO-27001_1024_l2_All_1536_264_False,Hybrid_Rerank_Cohere,2,gpt-3.5-turbo,4096,0,1,The ISO-2700x series focuses on which standard and what is its function?,"[Document(page_content='audit should follow the requirements of iso 27007, including topics such as personnel selection, planning, implementation, and reporting of results. it is important to note that these audits primarily focus on the management system (isms).\nin contrast, iso 27008 focuses on audits regarding the controls and their implementation - in short, it primarily focuses on technical audits. however, it should be noted that the performance of such (technical) audits is not generally required by iso 27001 or within the scope of certification. however, in practice, during management audits, the controls and their implementation are often reviewed on a sampling basis. the correct implementation of relevant controls and their effectiveness are the main focus.\nthe requirements of iso 27006-1 are not exhaustive: the mentioned institutions must also comply with iso 17021-1 [1] and iso 19011 [2].\nprivacy information management system (pims).\nthe iso/iec 27000 series and its fundamental concepts\ntable 1.1 basic standards\nstandard parts stand-e stand-d\n27000 2018-02 2020-06\n27001 2022-10 2023-04 (draft)\n27002 2022-02 2022-08 (draft)\n27003 2017-03 -\n27004 2016-12 -\n27005 2022-10\n27006 iso 27006-1 2015-10 + correction 2020 2023-05 (draft)\niso 27006-2 2021-02 -\n27007 2020-01 2022-10?\n27008 2019-01 -\n27009 2020-04 2022-09\nsince almost all basic standards in the series are kept at a relatively abstract level, there is often a need to interpret, refine, or supplement the requirements of iso 27001 for specific topics,', metadata={'source': 'ISO 27001_2022_Kersten_und_Schroeder.pdf', 'title': 'ISO 27001_2022_Kersten_und_Schroeder', 'original_text': 'audit should follow the requirements of ISO 27007, including topics such as personnel selection, planning, implementation, and reporting of results. It is important to note that these audits primarily focus on the management system (ISMS).\nIn contrast, ISO 27008 focuses on audits regarding the controls and their implementation - in short, it primarily focuses on technical audits. However, it should be noted that the performance of such (technical) audits is not generally required by ISO 27001 or within the scope of certification. However, in practice, during management audits, the controls and their implementation are often reviewed on a sampling basis. The correct implementation of relevant controls and their effectiveness are the main focus.\nThe requirements of ISO 27006-1 are not exhaustive: the mentioned institutions must also comply with ISO 17021-1 [1] and ISO 19011 [2].\nPrivacy Information Management System (PIMS).\nThe ISO/IEC 27000 series and its fundamental concepts\nTable 1.1 Basic standards\nStandard Parts Stand-E Stand-D\n27000 2018-02 2020-06\n27001 2022-10 2023-04 (Draft)\n27002 2022-02 2022-08 (Draft)\n27003 2017-03 -\n27004 2016-12 -\n27005 2022-10\n27006 ISO 27006-1 2015-10 + Correction 2020 2023-05 (Draft)\nISO 27006-2 2021-02 -\n27007 2020-01 2022-10?\n27008 2019-01 -\n27009 2020-04 2022-09\nSince almost all basic standards in the series are kept at a relatively abstract level, there is often a need to interpret, refine, or supplement the requirements of ISO 27001 for specific topics,', 'doc_ID': 2538, 'relevance_score': 0.9829547}), Document(page_content=""redundancy), and how long the data should be stored or retained (storage and archiving periods), who should have what kind of access, etc.\nwith this enumeration, we are already moving towards the management of documented information, which is the subject of the standard (in its main part) - we will come back to this in chapter 2.\n11. context\nevery organization operates in an environment that influences and controls its business and administrative activities. this includes legal requirements - from all countries in which the organization operates, as well as from supranational institutions - requirements from supervisory and reporting bodies, requirements and expectations from customers, business partners, and shareholders - and finally, the organization's own requirements, for example, regarding the improvement of products/services.\nin cross-border activities, cultural, social, and mental differences in the individual countries are also to be considered as part of the environment.\nat least recommendations and guidelines have (technical, administrative) requirements from (industry) associations and organizations.\nthis environment of an organization is referred to as the context of an organization in the iso 27000 series as a whole. this context is the starting point for the establishment of the so-called information security management system, abbreviated as isms. all information describing the context is referred to as context information.\nthey are sorted according to their source: requirements or"", metadata={'source': 'ISO 27001_2022_Kersten_und_Schroeder.pdf', 'title': 'ISO 27001_2022_Kersten_und_Schroeder', 'original_text': ""redundancy), and how long the data should be stored or retained (storage and archiving periods), who should have what kind of access, etc.\nWith this enumeration, we are already moving towards the management of documented information, which is the subject of the standard (in its main part) - we will come back to this in Chapter 2.\n11. Context\nEvery organization operates in an environment that influences and controls its business and administrative activities. This includes legal requirements - from all countries in which the organization operates, as well as from supranational institutions - requirements from supervisory and reporting bodies, requirements and expectations from customers, business partners, and shareholders - and finally, the organization's own requirements, for example, regarding the improvement of products/services.\nIn cross-border activities, cultural, social, and mental differences in the individual countries are also to be considered as part of the environment.\nAt least recommendations and guidelines have (technical, administrative) requirements from (industry) associations and organizations.\nThis environment of an organization is referred to as the context of an organization in the ISO 27000 series as a whole. This context is the starting point for the establishment of the so-called Information Security Management System, abbreviated as ISMS. All information describing the context is referred to as context information.\nThey are sorted according to their source: requirements or"", 'doc_ID': 2559, 'relevance_score': 0.94078976})]","The ISO-2700x series particularly focuses on the standard ISO 27001. This norm defines obligatory requirements for an Information Security Management System (ISMS). ISO 27001 serves as a central standard against which companies can seek certification, establishing the foundations for IT security management. Other standards within the ISO-2700x series, such as ISO 27000 and ISO 27006, provide an overview and explain fundamental connections. While ISO 27001 defines the obligatory requirements, the other standards in the series specify subdomains of IT security management and offer practical guidance for IT security managers. Collectively, the norms in the ISO-2700x series highlight their applicability to businesses of all types and sizes, emphasizing processes over technical details.","The ISO-2700x series focuses on the ISO 27001 standard and its function is to provide requirements for establishing, implementing, maintaining, and continually improving an Information Security Management System (ISMS). The ISMS is a systematic approach to managing sensitive company information, ensuring its confidentiality, integrity, and availability. ISO 27001 sets out the criteria for a comprehensive ISMS, including risk assessment and treatment, security controls, and ongoing monitoring and review.

ISO 27007 is mentioned in the context as a standard that outlines the requirements for conducting audits of the ISMS. It focuses on topics such as personnel selection, planning, implementation, and reporting of audit results. ISO 27008, on the other hand, primarily focuses on technical audits of controls and their implementation.

ISO 27006-1 is mentioned as a standard that provides requirements",True,0.4571428571428571,0.15637860082304528,0.2775510204081632,0.21547305583953857,0.9999179840087891,0.7686092291210408,0.8571428571428571,0.8672270278447499,2.53348445892334,3.3930823802948,0.0010027885437011719,5.92656683921814
Fine-tuned_finetuned-ISO-27001_1024_l2_All_1536_264_False,Hybrid_Rerank_Cohere,2,gpt-3.5-turbo,4096,0,1,What are the criticisms of ISO 27001?,"[Document(page_content='the likelihood and the severity to determine the level of risk\nthese steps are in one-to-one correspondence to the requirements of iso/iec\n27001 clauses 6.1.2 c)1), d)1), d)2) and d)3). the method is central to the guidance\ngiven in iso 31000 and specific information security relevant guidance is given in\nbs 7799-3:2017 and in the book “an introduction to iso/iec 27001:201308801)_\nother methods\nhistorically, information security risk assessments were performed by an analysis of\nassets, threats, and vulnerabilities. indeed, this was a requirement of iso/iec\n27001:2005. however, the need to determine vulnerabilities means that the method\ncannot cope with zero-day vulnerabilities. moreover, whilst the standard regarded an\n“asset” as “anything that has value to organisation’, it is better to interpret “asset” as\nmeaning “information that needs to be protected”, lest organisations that store other\norganisation’s information (e.g., a website hosting service provider) neglect to\nconsider such information because they regard it as a /iability (as in the accounting\npractice sense). however, perhaps the greatest criticisms of the method are that, by\ncasting the analysis in technical terms, it is easy to lose sight of the overall purpose\nof determining necessary controls; it is not readily understood by top management\n(see dbb01, chapter 4, page 131, paperback edition); and it can omit\nconsiderations of the societal and other relevant risks (see scope, above). thus,\nthere are situations that the method does not deal', metadata={'source': 'Brewer - 2020 - ISO IEC 27001 Mastering Risk Assessment and the Statement of Applicability.pdf', 'title': 'Brewer - 2020 - ISO IEC 27001 Mastering Risk Assessment and the Statement of Applicability', 'original_text': 'the likelihood and the severity to determine the level of risk\nThese steps are in one-to-one correspondence to the requirements of ISO/IEC\n27001 Clauses 6.1.2 c)1), d)1), d)2) and d)3). The method is central to the guidance\ngiven in ISO 31000 and specific information security relevant guidance is given in\nBS 7799-3:2017 and in the book “An introduction to ISO/IEC 27001:201308801)_\nOther methods\nHistorically, information security risk assessments were performed by an analysis of\nassets, threats, and vulnerabilities. Indeed, this was a requirement of ISO/IEC\n27001:2005. However, the need to determine vulnerabilities means that the method\ncannot cope with zero-day vulnerabilities. Moreover, whilst the standard regarded an\n“asset” as “anything that has value to organisation’, it is better to interpret “asset” as\nmeaning “information that needs to be protected”, lest organisations that store other\norganisation’s information (e.g., a Website Hosting Service Provider) neglect to\nconsider such information because they regard it as a /iability (as in the accounting\npractice sense). However, perhaps the greatest criticisms of the method are that, by\ncasting the analysis in technical terms, it is easy to lose sight of the overall purpose\nof determining necessary controls; it is not readily understood by top management\n(see DBB01, Chapter 4, Page 131, paperback edition); and it can omit\nconsiderations of the societal and other relevant risks (see Scope, above). Thus,\nthere are situations that the method does not deal', 'doc_ID': 570, 'relevance_score': 0.9913892}), Document(page_content='face when implementing the standard along with advice on what you\ncan do to avoid them.\n**not defining the right scope**\nfinding the right scope for implementing your organisation’s isms can be\ntricky. organisations often set over-ambitious goals for the implementation of\ntheir isms, leading to the adoption of several redundant and unneeded controls\nand processes.\nthis can lead to resource wastage, increased cost of information security, and\ndemotivated employees chasing unachievable targets. on the other hand, an\norganisation may define their scope too narrowly, and the needed controls may\nnot be adopted. this could lead to noncompliance with the iso 27001 standard\nand can make it appear that your organisation is not in control of its isms\nduring the certification audit.\n**lack of management**\ncommitment in many organisations, implementing the iso 27001 is considered to\nbe an it exercise and the responsibility of the it department of the business.\nin reality, it is a management standard for information security. the upper\nmanagement in an organisation may not see the value the implementation of iso\n27001 adds to the business and they may be hesitant to fully commit to its\nimplementation.\n**too few resources**\noften, the implementation of the iso 27001 falls to a particular individual or\nteam within the organisation. this type of approach can create information\nsecurity silos where only very few individuals are aware of the controls and\nprocedures around the isms and other aspects of the standard. the', metadata={'description': 'No matter if you’re an SMB or an international corporation — getting an ISO 27001 certification should be on your agenda. Here’s the ultimate guide on how.', 'doc_ID': 127, 'language': 'en-gb', 'original_text': 'face when implementing the standard along with advice on what you\ncan do to avoid them.\n**Not defining the right scope**\nFinding the right scope for implementing your organisation’s ISMS can be\ntricky. Organisations often set over-ambitious goals for the implementation of\ntheir ISMS, leading to the adoption of several redundant and unneeded controls\nand processes.\nThis can lead to resource wastage, increased cost of information security, and\ndemotivated employees chasing unachievable targets. On the other hand, an\norganisation may define their scope too narrowly, and the needed controls may\nnot be adopted. This could lead to noncompliance with the ISO 27001 standard\nand can make it appear that your organisation is not in control of its ISMS\nduring the certification audit.\n**Lack of management**\nCommitment In many organisations, implementing the ISO 27001 is considered to\nbe an IT exercise and the responsibility of the IT department of the business.\nIn reality, it is a management standard for information security. The upper\nmanagement in an organisation may not see the value the implementation of ISO\n27001 adds to the business and they may be hesitant to fully commit to its\nimplementation.\n**Too few resources**\nOften, the implementation of the ISO 27001 falls to a particular individual or\nteam within the organisation. This type of approach can create information\nsecurity silos where only very few individuals are aware of the controls and\nprocedures around the ISMS and other aspects of the standard. The', 'source': 'https://www.dataguard.co.uk/knowledge/iso-27001-certification/', 'title': 'ISO 27001 Certification: Your ultimate guide [free guide available]', 'relevance_score': 0.95938325})]","Regarding ISO 27001, two main points of criticism are often emphasized. Firstly, this concerns the documentation within the Information Security Management System (ISMS). The standard does not provide specific guidelines for the structure of forms or documents, particularly lacking guidance on implementation with electronic means. As a result, even large companies often resort to using Excel for ISMS tools.

Secondly, there is criticism concerning the measurement of the success of implemented measures or risks in general. ISO 27001 does not offer clear guidelines on how to measure the success of implemented measures. The absence of precise instructions leads to technical challenges, as the success of activities or IT systems often depends on a detailed level of bits and bytes. The associated standard ISO 27004, ""ISMS Metrics and Measurement,"" is considered superficial. Overall, it is pointed out that the practical application of the PDCA cycle (Plan-Do-Check-Act) for continuous improvement poses difficulties.","One of the criticisms of ISO 27001 is that the risk assessment method it employs may not be comprehensive enough. The historical method of analyzing assets, threats, and vulnerabilities, which was required in the previous version of the standard (ISO/IEC 27001:2005), is limited in its ability to address zero-day vulnerabilities. Additionally, the definition of ""asset"" as ""anything that has value to the organization"" may lead to overlooking the protection of information that needs to be safeguarded, especially in cases where organizations store other organizations' information. Another criticism is that the technical nature of the analysis can make it difficult for top management to understand the overall purpose of determining necessary controls. Furthermore, the method may omit considerations of societal and other relevant risks.

In terms of implementing the standard, there are several challenges that organizations may face. One",True,0.3673469387755102,0.06164383561643835,0.17006802721088435,0.8756871521472931,0.8777274489402771,0.5390936801258586,0.6,0.8825930029982781,2.8260016441345215,3.3181474208831787,0.0010027885437011719,6.1441490650177
Fine-tuned_finetuned-ISO-27001_1024_l2_All_1536_264_False,Hybrid_Rerank_Cohere,2,gpt-3.5-turbo,4096,0,1,What is ISO 27001 and what is it for?,"[Document(page_content=""01\nwhat is iso 27001?\niso/iec 27001, or iso 27001, is the international standard that defines best practices for implementing and\nmanaging information security controls within an information security management system (isms).\niso/iec 27001 is one part of the overarching iso 27000 family of security standards determined by the\ninternational organization for standardization (iso) and the international electrotechnical commission (iec).\nthe purpose of iso 27001 is to address how organizations establish, monitor, maintain, and improve their isms\nto keep their data, documents, and other information assets secure.\norganizations that can demonstrate their processes and controls meet iso 27001 compliance requirements\nduring a two-stage audit are eligible to receive certification from their country's certifying body. this\ncertification verifies that the organization's security systems and it processes follow current best practices.\n02\nhistory of iso 27001\nas cybersecurity needs evolved and more organizations adopted ismses, the british standards institute group\n(bsi group) sought to define it standards outlining how organizations should design their isms to secure their\ninformation assets.\nin 1995, the bsi partnered with the united kingdom government's department of trade and industry (dti) to\nwrite vendor-neutral standards that uphold the availability, confidentiality, and integrity of an organization's\ndata and proprietary information. these essential it standards—known as bs 7799—became the foundation"", metadata={'doc_ID': 1333, 'original_text': ""01\nWhat is ISO 27001?\nISO/IEC 27001, or ISO 27001, is the international standard that defines best practices for implementing and\nmanaging information security controls within an information security management system (ISMS).\nISO/IEC 27001 is one part of the overarching ISO 27000 family of security standards determined by the\nInternational Organization for Standardization (ISO) and the International Electrotechnical Commission (IEC).\nThe purpose of ISO 27001 is to address how organizations establish, monitor, maintain, and improve their ISMS\nto keep their data, documents, and other information assets secure.\nOrganizations that can demonstrate their processes and controls meet ISO 27001 compliance requirements\nduring a two-stage audit are eligible to receive certification from their country's certifying body. This\ncertification verifies that the organization's security systems and IT processes follow current best practices.\n02\nHistory of ISO 27001\nAs cybersecurity needs evolved and more organizations adopted ISMSes, the British Standards Institute Group\n(BSI Group) sought to define IT standards outlining how organizations should design their ISMS to secure their\ninformation assets.\nIn 1995, the BSI partnered with the United Kingdom Government's Department of Trade and Industry (DTI) to\nwrite vendor-neutral standards that uphold the availability, confidentiality, and integrity of an organization's\ndata and proprietary information. These essential IT standards—known as BS 7799—became the foundation"", 'source': 'complete-guide-iso-27001-compliance.pdf', 'title': 'complete-guide-iso-27001-compliance', 'relevance_score': 0.99927634}), Document(page_content='what is iso 27001?\niso 27001 is the international standard that describes best practices for an information security management systems (isms). it’s based on a set of iso 27001 controls and measures, which organizations can use to achieve information security. the iso 27001 standard requires that you have procedures in place to cover aspects of the isms, including:\ninformation security risk management (what are the risks you face and how do you treat those risks?)\nmonitoring, measurement, analysis, and evaluation (how is the effectiveness of the information security management system evaluated?)\nimprovement (how are nonconformities evaluated and corrected?)\nwho needs iso 27001?\nany business experiencing growth in international markets that wants to demonstrate to customers they are preserving the confidentiality, integrity, and availability of information by applying a risk management process can benefit from iso 27001. the primary focus is empowering organizations to establish, implement, maintain, and continually improve their isms.\ncurious about how iso 27001 compares to soc 2? learn more in this article on our blog.\nwhy is iso 27001 important?\nthe iso 27001 standard is an effective way to keep your company’s information secure when you take the right steps to implement it. it provides a structured approach to implementing, integrating, and continuously improving your isms. this helps protect assets from both internal and external threats by making sure you:\nunderstand the organization’s needs,', metadata={'description': ""Starting your journey to ISO 27001 compliance? Here's an easy-to-follow guide to get you on the right track"", 'doc_ID': 70, 'language': 'en', 'original_text': 'What is ISO 27001?\nISO 27001 is the international standard that describes best practices for an Information Security Management Systems (ISMS). It’s based on a set of ISO 27001 controls and measures, which organizations can use to achieve information security. The ISO 27001 standard requires that you have procedures in place to cover aspects of the ISMS, including:\nInformation security risk management (What are the risks you face and how do you treat those risks?)\nMonitoring, measurement, analysis, and evaluation (How is the effectiveness of the information security management system evaluated?)\nImprovement (How are nonconformities evaluated and corrected?)\nWho Needs ISO 27001?\nAny business experiencing growth in international markets that wants to demonstrate to customers they are preserving the confidentiality, integrity, and availability of information by applying a risk management process can benefit from ISO 27001. The primary focus is empowering organizations to establish, implement, maintain, and continually improve their ISMS.\nCurious about how ISO 27001 compares to SOC 2? Learn more in this article on our blog.\nWhy is ISO 27001 Important?\nThe ISO 27001 standard is an effective way to keep your company’s information secure when you take the right steps to implement it. It provides a structured approach to implementing, integrating, and continuously improving your ISMS. This helps protect assets from both internal and external threats by making sure you:\nUnderstand the organization’s needs,', 'source': 'https://www.drata.com/blog/iso-27001-compliance', 'title': 'ISO 27001: A Beginner’s Guide', 'relevance_score': 0.99919903})]","ISO 27001 is a leading norm for the certification of an Information Security Management System (ISMS) and thus provides a central framework for standardized information protection. The ISMS is a document and process management system that follows the PDCA cycle (Plan-Do-Check-Act). ISO 27001 addresses the four phases of the cycle, namely planning; implementation and operation; checking; and maintenance and improvement of the ISMS. The standard sets clear requirements and avoids vague formulations. It offers a catalog of measures that covers most IT security areas and allows for assigning work packages to the corresponding organizational areas.","ISO 27001 is an international standard that defines best practices for implementing and managing information security controls within an Information Security Management System (ISMS). It is part of the ISO 27000 family of security standards and is designed to help organizations establish, monitor, maintain, and improve their ISMS to keep their data and information assets secure.

ISO 27001 certification is obtained through a two-stage audit process, where organizations demonstrate that their processes and controls meet the compliance requirements of ISO 27001. This certification verifies that the organization's security systems and IT processes follow current best practices.

ISO 27001 is important because it provides a structured approach to implementing, integrating, and continuously improving an ISMS. It helps organizations protect their assets from internal and external threats by understanding their needs, assessing and treating risks, and evaluating the effectiveness of their information security",True,0.42323651452282157,0.100418410041841,0.22406639004149378,0.9942294061183929,0.9985507130622864,0.7984485871999163,0.2,0.909681598685343,2.8115499019622803,3.0801186561584473,0.0009989738464355469,5.8916685581207275
Fine-tuned_finetuned-ISO-27001_1024_l2_All_1536_264_False,Hybrid_Rerank_Cohere,2,gpt-3.5-turbo,4096,0,1,What is an Information Security Management System (ISMS)?,"[Document(page_content='financial losses due to data breaches * brand perception is constantly improving. * achieving compliance in all areas (business, legal, economic, and legal) * improved structure and focus * the number of required audits decreases * you receive an unbiased assessment of your security situation.\nto this end, every organization and company is encouraged to establish an\ninformation security management system (isms) - an efficient, technology-\nindependent, risk-based means of securing information values based on regular\ninformation security assessments (isas) for risk assessment.\n## implementation of iso 27001 controls and establishment of an isms\n## what is an isms?\nan information security management system (isms) is a management system for\nprotecting the information security of an organization or company. it consists\nof a series of measures that an organization should implement to:\n * know who their stakeholders are and what expectations they have regarding the information security of their organization. * know what risks the information is exposed to. * achieve the defined requirements and, to do so, manage the risks, develop measures (security mechanisms) and establish other strategies for damage mitigation. * define clear goals, which minimum measures are to be taken with regard to information security. * implement all necessary measures and other strategies for risk mitigation. * regularly check to what extent the measures', metadata={'source': 'https://www.dataguard.co.uk/knowledge/iso-27001/', 'title': 'What is ISO 27001? Key Information at a Glance', 'description': 'Discover the comprehensive guide to ISO 27001: Detailed insight into achieving and maintaining this essential information security standard. Explore its critical role in risk management, compliance and robust security practices, and learn step-by-step implementation techniques.', 'language': 'en-gb', 'original_text': 'financial losses due to data breaches * Brand perception is constantly improving. * Achieving compliance in all areas (business, legal, economic, and legal) * Improved structure and focus * The number of required audits decreases * You receive an unbiased assessment of your security situation.\nTo this end, every organization and company is encouraged to establish an\ninformation security management system (ISMS) - an efficient, technology-\nindependent, risk-based means of securing information values based on regular\ninformation security assessments (ISAs) for risk assessment.\n## Implementation of ISO 27001 controls and establishment of an ISMS\n## What is an ISMS?\nAn information security management system (ISMS) is a management system for\nprotecting the information security of an organization or company. It consists\nof a series of measures that an organization should implement to:\n * Know who their stakeholders are and what expectations they have regarding the information security of their organization. * Know what risks the information is exposed to. * Achieve the defined requirements and, to do so, manage the risks, develop measures (security mechanisms) and establish other strategies for damage mitigation. * Define clear goals, which minimum measures are to be taken with regard to information security. * Implement all necessary measures and other strategies for risk mitigation. * Regularly check to what extent the measures', 'doc_ID': 161, 'relevance_score': 0.99852204}), Document(page_content='for information security management systems that you must\nadhere to receive your certification. if you’re already certified and need to\ntransition to the 2022 iteration, then our iso 27001:2022 transition guide is\nyour go-to resource.\n## what is an isms?\nan information security management system (isms) provides a framework of\n**documented policies, procedures, and controls** designed to **mitigate\ninformation security risks**. once you’ve built your isms, getting it\ncertified against an international standard such as iso 27001 is best practice\n## how to establish and implement an isms?\nestablishing and implementing an isms, in its simplest form, can be broken\ndown into 4 phases, also known as the pdca cycle:\n 1. **plan:** this is the phase in which you establish the isms, i.e. get your documentation in check.\n 2. **do:** the processes and procedures you established in the plan phase, also need to be implemented and operated — this is what happens during the do phase of the pdca cycle.\n 3. **check:** then you check whether your isms aligns with the iso 27001 standard and identify any gaps. this happens during internal and external audits.\n 4. **act:** during this phase, you improve the isms and close any information security gaps to ensure you can obtain and keep your iso 27001 certification.\n## why is iso 27001 important? why get an iso 27001 certification?\nthe certification is beneficial for a number of reasons; these are the most\nimportant ones:\n**establishes stakeholder trust:**\npossessing an', metadata={'source': 'https://www.dataguard.co.uk/knowledge/iso-27001-certification/', 'title': 'ISO 27001 Certification: Your ultimate guide [free guide available]', 'description': 'No matter if you’re an SMB or an international corporation — getting an ISO 27001 certification should be on your agenda. Here’s the ultimate guide on how.', 'language': 'en-gb', 'original_text': 'for information security management systems that you must\nadhere to receive your certification. If you’re already certified and need to\ntransition to the 2022 iteration, then our ISO 27001:2022 transition guide is\nyour go-to resource.\n## What is an ISMS?\nAn information security management system (ISMS) provides a framework of\n**documented policies, procedures, and controls** designed to **mitigate\ninformation security risks**. Once you’ve built your ISMS, getting it\ncertified against an international standard such as ISO 27001 is best practice\n## How to establish and implement an ISMS?\nEstablishing and implementing an ISMS, in its simplest form, can be broken\ndown into 4 phases, also known as the PDCA cycle:\n 1. **Plan:** This is the phase in which you establish the ISMS, i.e. get your documentation in check.\n 2. **Do:** The processes and procedures you established in the plan phase, also need to be implemented and operated — this is what happens during the DO phase of the PDCA cycle.\n 3. **Check:** Then you check whether your ISMS aligns with the ISO 27001 standard and identify any gaps. This happens during internal and external audits.\n 4. **Act:** During this phase, you improve the ISMS and close any information security gaps to ensure you can obtain and keep your ISO 27001 certification.\n## Why is ISO 27001 important? Why get an ISO 27001 certification?\nThe certification is beneficial for a number of reasons; these are the most\nimportant ones:\n**Establishes stakeholder trust:**\nPossessing an', 'doc_ID': 123, 'relevance_score': 0.99768585})]","An Information Security Management System (ISMS) in accordance with ISO 27001 guidelines manages an organization's information security through setting objectives, risk analysis, and continuous improvement. It is an integral part of the entire management system, which also includes quality, environmental protection, and compliance, and is not limited to the IT department. The main tasks of an ISMS include formulating security objectives, identifying and assessing risks, and implementing security measures.","An Information Security Management System (ISMS) is a management system designed to protect the information security of an organization or company. It consists of a series of measures that an organization should implement to understand stakeholder expectations, assess information security risks, meet defined requirements, manage risks, develop security mechanisms, establish strategies for damage mitigation, define clear goals for information security, implement necessary measures, and regularly evaluate the effectiveness of these measures.

The ISMS provides a framework of documented policies, procedures, and controls to mitigate information security risks. It is best practice to get the ISMS certified against an international standard such as ISO 27001.

Establishing and implementing an ISMS can be broken down into four phases: Plan, Do, Check, and Act (PDCA cycle). In the Plan phase, the ISMS is established and documentation is prepared. In",True,0.4077669902912622,0.12745098039215688,0.22330097087378642,0.9724270701408386,0.9999665021896362,0.8207490622399812,1.0,0.941464237030433,2.344834327697754,2.978410005569458,0.0009996891021728516,5.323244333267212
Fine-tuned_finetuned-ISO-27001_1024_l2_All_1536_264_False,Hybrid_Rerank_Cohere,2,gpt-3.5-turbo,4096,0,1,What are the benefits of implementing an ISMS?,"[Document(page_content=""an isms benefit my organisation?\nan isms can benefit your organisation in a number of ways, including:\n * reduce the risk of data breaches and other security incidents.\n * improve compliance with information security regulations and standards.\n * protect the confidentiality, integrity, and availability of information assets.\n * reduce the cost of security measures.\n * improve the efficiency of security operations.\n * increase employee awareness of security risks.\n * enhance your organisation's reputation and brand value.\n#### what are the challenges of implementing an isms?\nthe challenges of implementing an isms can vary depending on the size and\ncomplexity of your organisation. however, some common challenges include:\n * lack of management commitment.\n * lack of resources.\n * lack of expertise.\n * resistance to change.\n * the cost of implementation.\n#### how can i get started with an isms?\nthe first step in getting started with an isms is to assess your\norganisation's current security posture. this will help you to identify the\ngaps that need to be addressed. once you have identified the gaps, you can\ndevelop a plan to implement the isms.\n#### what are the requirements of iso 27001:2022 clause 4.4?\nclause 4.4 of iso 27001:2022 is the requirement for organisations to\nestablish, implement, maintain, and continually improve an isms. this clause\nemphasises the importance of management commitment to information security and\nthe need to involve all relevant stakeholders in the development"", metadata={'source': 'https://www.dataguard.co.uk/knowledge/iso-27001/clause-4-4-information-security-management-system/', 'title': 'ISO 27001 Clause 4.4: Information Security Management System (ISMS)', 'description': 'Learn about the key elements of ISO 27001 Clause 4.4. The requirements for organisations to establish, implement, maintain, and improve an ISMS.', 'language': 'en-gb', 'original_text': ""an ISMS benefit my organisation?\nAn ISMS can benefit your organisation in a number of ways, including:\n * Reduce the risk of data breaches and other security incidents.\n * Improve compliance with information security regulations and standards.\n * Protect the confidentiality, integrity, and availability of information assets.\n * Reduce the cost of security measures.\n * Improve the efficiency of security operations.\n * Increase employee awareness of security risks.\n * Enhance your organisation's reputation and brand value.\n#### What are the challenges of implementing an ISMS?\nThe challenges of implementing an ISMS can vary depending on the size and\ncomplexity of your organisation. However, some common challenges include:\n * Lack of management commitment.\n * Lack of resources.\n * Lack of expertise.\n * Resistance to change.\n * The cost of implementation.\n#### How can I get started with an ISMS?\nThe first step in getting started with an ISMS is to assess your\norganisation's current security posture. This will help you to identify the\ngaps that need to be addressed. Once you have identified the gaps, you can\ndevelop a plan to implement the ISMS.\n#### What are the requirements of ISO 27001:2022 Clause 4.4?\nClause 4.4 of ISO 27001:2022 is the requirement for organisations to\nestablish, implement, maintain, and continually improve an ISMS. This clause\nemphasises the importance of management commitment to information security and\nthe need to involve all relevant stakeholders in the development"", 'doc_ID': 212, 'relevance_score': 0.99962735}), Document(page_content='asset protection requirements achieved through the application\nof information security risk management (see iso/iec 27005);\ne) an effective information security awareness, training and education programme, informing all\nemployees and other relevant parties of their information security obligations set forth in the\ninformation security policies, standards, etc., and motivating them to act accordingly;\nf) an effective information security incident management process;\ng) aneffective business continuity management approach;\nh) a measurement system used to evaluate performance in information security management and\nfeedback suggestions for improvement.\nan isms increases the likelihood of an organization consistently achieving the critical success factors\nrequired to protect its information assets.\n4.7 benefits of the isms family of standards\nthe benefits of implementing an isms primarily result from a reduction in information security risks\n(i.e. reducing the probability of and/or impact caused by information security incidents). specifically,\nbenefits realized for an organization to achieve sustainable success from the adoption of the isms\nfamily of standards include the following:\na) a structured framework supporting the process of specifying, implementing, operating and\nmaintaining a comprehensive, cost-effective, value creating, integrated and aligned isms that\nmeets the organization’s needs across different operations and sites;\n© iso/iec 2018 - all rights reserved 17\niso/iec', metadata={'source': 'ISO 27000 2018 (E).pdf', 'title': 'ISO 27000 2018 (E)', 'original_text': 'asset protection requirements achieved through the application\nof information security risk management (see ISO/IEC 27005);\ne) an effective information security awareness, training and education programme, informing all\nemployees and other relevant parties of their information security obligations set forth in the\ninformation security policies, standards, etc., and motivating them to act accordingly;\nf) an effective information security incident management process;\ng) aneffective business continuity management approach;\nh) a measurement system used to evaluate performance in information security management and\nfeedback suggestions for improvement.\nAn ISMS increases the likelihood of an organization consistently achieving the critical success factors\nrequired to protect its information assets.\n4.7 Benefits of the ISMS family of standards\nThe benefits of implementing an ISMS primarily result from a reduction in information security risks\n(i.e. reducing the probability of and/or impact caused by information security incidents). Specifically,\nbenefits realized for an organization to achieve sustainable success from the adoption of the ISMS\nfamily of standards include the following:\na) a structured framework supporting the process of specifying, implementing, operating and\nmaintaining a comprehensive, cost-effective, value creating, integrated and aligned ISMS that\nmeets the organization’s needs across different operations and sites;\n© ISO/IEC 2018 - All rights reserved 17\nISO/IEC', 'doc_ID': 1389, 'relevance_score': 0.9993538})]","The implementation of an Information Security Management System (ISMS) according to ISO 27001 offers numerous benefits. First, it enables compliance with legal requirements. This is crucial for fulfilling legal obligations and meeting external demands from customers, regulatory authorities, or banks. It is often also a prerequisite for participating in tenders, which enhances competitiveness.

Second, conformity to the standard signals the organization's competence in information security. This is not only important for the organization itself but can also influence other companies in the selection of business partners.

Third, proven compliance with the ISO standard provides legal protection. In the case of legal disputes or claims for compensation due to insufficient information security, certification and adherence to the standard serve as strong arguments.","Implementing an ISMS (Information Security Management System) can provide several benefits to an organization. These benefits include reducing the risk of data breaches and security incidents, improving compliance with information security regulations and standards, protecting the confidentiality, integrity, and availability of information assets, reducing the cost of security measures, improving the efficiency of security operations, increasing employee awareness of security risks, and enhancing the organization's reputation and brand value.

However, implementing an ISMS can also present challenges. Some common challenges include a lack of management commitment, resources, and expertise, resistance to change, and the cost of implementation.

To get started with an ISMS, the first step is to assess the organization's current security posture and identify any gaps that need to be addressed. Once the gaps are identified, a plan can be developed to implement the ISMS.

ISO 270",True,0.3422053231939164,0.06896551724137931,0.21292775665399244,0.8555827736854553,0.9993839263916016,0.7020689797780411,1.0,0.786309128683623,2.276998519897461,2.751551628112793,0.0009634494781494141,5.028550148010254
Fine-tuned_finetuned-ISO-27001_1024_l2_All_1536_264_False,Hybrid_Rerank_Cohere,2,gpt-3.5-turbo,4096,0,1,What are the requirements for an ISMS?,"[Document(page_content=""business needs:** the scope of the isms should cover the information assets and activities that are critical to the organisation's business. * **the organisation's legal and regulatory requirements:** the scope of the isms should include the information assets and activities that are subject to legal and regulatory requirements.\nonce the scope of the isms has been determined, it should be documented in the\nfollowing locations:\n * your statement of applicability (soa). the soa should be kept up-to-date as the organisation changes. this explains what specific controls you are looking to implement as per the scope – document is an ever-changing document that evolves in the creation of the isms. * a scope policy that goes into specific detail as to what will be included in the scope from a business perspective, this includes the following areas: * activities\n * products\n * services\n * interfaces\n * boundaries (both digital and physical) * in addition to this, you will also want to state if there are any exclusions which can be stated in both the soa and the scope policy. ## why is it important to determine the scope of your isms?\ndefining the scope of your information security management system (isms) is of\nparamount importance, as it establishes the extent to which the standard\napplies.\nnot all information assets and activities are covered by this standard. by\ndefining your isms scope, you ensure that the system is only implemented for\nthe information assets and"", metadata={'source': 'https://experta.com/shared-post/e85c338f-efe2-48d5-a57e-4d4a337112dd', 'title': 'Experta', 'language': 'No language found.', 'original_text': ""business needs:** The scope of the ISMS should cover the information assets and activities that are critical to the organisation's business. * **The organisation's legal and regulatory requirements:** The scope of the ISMS should include the information assets and activities that are subject to legal and regulatory requirements.\nOnce the scope of the ISMS has been determined, it should be documented in the\nfollowing locations:\n * Your statement of applicability (SoA). The SoA should be kept up-to-date as the organisation changes. This explains what specific controls you are looking to implement as per the scope – document is an ever-changing document that evolves in the creation of the ISMS. * A scope policy that goes into specific detail as to what will be included in the scope from a business perspective, this includes the following areas: * Activities\n * Products\n * Services\n * Interfaces\n * Boundaries (both digital and physical) * In addition to this, you will also want to state if there are any exclusions which can be stated in both the SoA and the scope policy. ## Why is it important to determine the scope of your ISMS?\nDefining the scope of your Information Security Management System (ISMS) is of\nparamount importance, as it establishes the extent to which the standard\napplies.\nNot all information assets and activities are covered by this standard. By\ndefining your ISMS scope, you ensure that the system is only implemented for\nthe information assets and"", 'doc_ID': 342, 'relevance_score': 0.9933072}), Document(page_content=""use, disclosure, modification, or destruction.\n## faqs about information security management systems (isms)\n#### what is an isms, and why is it important?\nan isms (information security management system) is a set of policies,\nprocedures, and controls that are designed to protect an organisation's\ninformation assets, such as financial data, customer data, and intellectual\nproperty. it is important because it helps organisations to:\n * protect their information assets from unauthorized access, use, disclosure, modification, or destruction.\n * comply with information security regulations and standards.\n * reduce the risk of data breaches and other security incidents.\n * improve their overall security posture.\nwatch this video to find out more about why an isms is essential for your\norganisation.\n#### what is iso 27001, and how does it relate to isms?\niso 27001 is an international standard that specifies the requirements for an\nisms. it is the most widely recognised standard for information security\nmanagement, and it is used by organisations of all sizes in all industries.\nan isms that is compliant with iso 27001:2022 is considered to be a best\npractice, and it can help organisations demonstrate their commitment to\ninformation security.\nhow does an isms benefit my organisation?\nan isms can benefit your organisation in a number of ways, including:\n * reduce the risk of data breaches and other security incidents.\n * improve compliance with information security regulations and standards.\n * protect"", metadata={'source': 'https://experta.com/shared-post/2cb61d0d-6ec9-44d8-8373-dd90539f0222', 'title': 'Experta', 'language': 'No language found.', 'original_text': ""use, disclosure, modification, or destruction.\n## FAQs about Information Security Management Systems (ISMS)\n#### What is an ISMS, and why is it important?\nAn ISMS (Information Security Management System) is a set of policies,\nprocedures, and controls that are designed to protect an organisation's\ninformation assets, such as financial data, customer data, and intellectual\nproperty. It is important because it helps organisations to:\n * Protect their information assets from unauthorized access, use, disclosure, modification, or destruction.\n * Comply with information security regulations and standards.\n * Reduce the risk of data breaches and other security incidents.\n * Improve their overall security posture.\nWatch this video to find out more about why an ISMS is essential for your\norganisation.\n#### What is ISO 27001, and how does it relate to ISMS?\nISO 27001 is an international standard that specifies the requirements for an\nISMS. It is the most widely recognised standard for information security\nmanagement, and it is used by organisations of all sizes in all industries.\nAn ISMS that is compliant with ISO 27001:2022 is considered to be a best\npractice, and it can help organisations demonstrate their commitment to\ninformation security.\nHow does an ISMS benefit my organisation?\nAn ISMS can benefit your organisation in a number of ways, including:\n * Reduce the risk of data breaches and other security incidents.\n * Improve compliance with information security regulations and standards.\n * Protect"", 'doc_ID': 348, 'relevance_score': 0.9897514})]","The requirements for an Information Security Management System (ISMS) according to ISO 27001 include the following main tasks:

Formulating security objectives: Security objectives should be defined to ensure the confidentiality, integrity, and availability of information and resources. These objectives must be tailored to the organization and can also include compliance goals. The above objectives and the scope of the ISMS must then be documented in a security policy.

Identifying assets: It is necessary to capture and inventory all relevant information assets. This includes information/data, systems, applications, IT services, and other assets.

Risk assessment: A thorough risk assessment should be conducted to identify security risks. This includes assessing the magnitude of damage and the likelihood of occurrence for each identified risk.

Risk treatment: Appropriate options and security measures for addressing the identified risks should be determined. This can include risk acceptance, risk transfer, risk reduction, or risk avoidance. Security measures can come from various areas such as legal, organizational, personnel, infrastructural, and IT measures.

Continuous improvement: A process of continuous improvement should be integrated into the ISMS. This includes regular review and adjustment of the ISMS to ensure it meets security objectives and changing requirements.","The requirements for an ISMS (Information Security Management System) include determining the scope of the system. The scope should cover the information assets and activities that are critical to the organization's business and are subject to legal and regulatory requirements. The scope should be documented in the statement of applicability (SoA) and a scope policy, which provide specific details on what will be included in the scope from a business perspective, such as activities, products, services, interfaces, and boundaries.

Defining the scope of the ISMS is important because it establishes the extent to which the ISO 27001 standard applies. Not all information assets and activities are covered by the standard, so by defining the scope, organizations ensure that the system is only implemented for the relevant information assets and activities. This helps organizations protect their information assets from unauthorized access, use, disclosure,",True,0.42603550295857995,0.11904761904761904,0.242603550295858,0.9356475174427032,0.9958983063697815,0.6887110794169032,0.8333333333333334,0.6183023722243249,2.212625026702881,2.8105762004852295,0.0010004043579101562,5.02320122718811
Fine-tuned_finetuned-ISO-27001_1024_l2_All_1536_264_False,Hybrid_Rerank_Cohere,2,gpt-3.5-turbo,4096,0,1,What are the steps involved in the ISO-27001 certification process?,"[Document(page_content='but also to have a unified\nstandard that tells them other governments are thoroughly secure.\n\u200d\n\u200d\n## iso 27001 certification process and requirements overview\n\u200d\nthe 27001 certification process involves:\n\u200d\n 1. scoping and effectively implementing an information security management system (isms)\n 2. establishing an isms governing body composed of senior management and key stakeholders from throughout the company\n 3. performing an internal audit to assess the organization’s isms and its implementation\n 4. undergoing an iso audit with an external third-party auditor\nthe internal audit is one of the best ways to ensure that your organization’s\nisms is operating effectively and in alignment with the iso 27001 standard.\nthe internal audit is required under the iso 27001 standard and internal\nauditors must be objective and impartial. in order to make sure your iso 27001\ncertification is up to industry standards, auditors should not be responsible\nfor implementing, operating, or monitoring any of the controls under audit.\nonce the internal audit is complete, results should be shared with the\ncompany’s isms governing body and senior management to address any issues\nbefore proceeding to the next step of the iso 27001 certification process—the\nexternal audit.\nthe external audit is composed of two stages. stage 1 audit consists of an\nextensive documentation review, during which an external iso 27001 auditor\nreviews an organization’s policies and procedures to ensure they meet the\nrequirements of the iso', metadata={'description': ""Read our blog to learn more about what is ISO 27001 certification and who needs ISO 27001. We're here to help make the process simple and straightforward."", 'doc_ID': 5, 'language': 'en', 'original_text': 'but also to have a unified\nstandard that tells them other governments are thoroughly secure.\n\u200d\n\u200d\n## ISO 27001 certification process and requirements overview\n\u200d\nThe 27001 certification process involves:\n\u200d\n 1. Scoping and effectively implementing an Information Security Management System (ISMS)\n 2. Establishing an ISMS governing body composed of senior management and key stakeholders from throughout the company\n 3. Performing an internal audit to assess the organization’s ISMS and its implementation\n 4. Undergoing an ISO audit with an external third-party auditor\nThe internal audit is one of the best ways to ensure that your organization’s\nISMS is operating effectively and in alignment with the ISO 27001 standard.\nThe internal audit is required under the ISO 27001 standard and internal\nauditors must be objective and impartial. In order to make sure your ISO 27001\ncertification is up to industry standards, auditors should not be responsible\nfor implementing, operating, or monitoring any of the controls under audit.\nOnce the internal audit is complete, results should be shared with the\ncompany’s ISMS governing body and senior management to address any issues\nbefore proceeding to the next step of the ISO 27001 certification process—the\nexternal audit.\nThe external audit is composed of two stages. Stage 1 Audit consists of an\nextensive documentation review, during which an external ISO 27001 auditor\nreviews an organization’s policies and procedures to ensure they meet the\nrequirements of the ISO', 'source': 'https://www.vanta.com/resources/who-needs-iso-27001-certification', 'title': 'What is ISO 27001 Certification and Who Needs it? | Vanta', 'relevance_score': 0.99040353}), Document(page_content=""comes to the iso 27001 certification are:\ndocumentation, undergoing audits and ensuring your employees adopt the\nprocesses.\n**documentation** includes the creation and maintenance of necessary\ndocumentation for your information security management system (isms), such as\npolicies, procedures, risk assessments, and controls.\n**undergoing audits** includes both the stage 1 audit, which reviews\ndocumentation and readiness, and the stage 2 audit, which assesses the\npractical implementation of your isms. successful completion of these audits\nis necessary to achieve iso 27001 certification. you will also be required to\nundergo internal audits and management reviews.\nit's also crucial to **communicate the processes effectively** this is to\nensure that your organization's information security practices align with the\niso 27001 standards. you will need to have the documentation in place but also\nput the processes into action by ensuring employees are aware of and follow\nthem.\nthe mandatory documents required for the iso 27001 standard are listed below.\nall criteria must be followed and documented accordingly for an organisation\nto present during external audits. the standard requires you to undergo an\ninternal audit before an external one. this will expose any gaps in your isms.\nonce you have prepared the documentation and undergone an internal audit as\nwell as a management review, you need to undergo an external audit by a\ncertified body such as the ukas.\nthe mandatory documents required for iso 27001 are:\n *"", metadata={'description': 'No matter if you’re an SMB or an international corporation — getting an ISO 27001 certification should be on your agenda. Here’s the ultimate guide on how.', 'doc_ID': 146, 'language': 'en-gb', 'original_text': ""comes to the ISO 27001 certification are:\ndocumentation, undergoing audits and ensuring your employees adopt the\nprocesses.\n**Documentation** includes the creation and maintenance of necessary\ndocumentation for your Information Security Management System (ISMS), such as\npolicies, procedures, risk assessments, and controls.\n**Undergoing audits** includes both the Stage 1 Audit, which reviews\ndocumentation and readiness, and the Stage 2 Audit, which assesses the\npractical implementation of your ISMS. Successful completion of these audits\nis necessary to achieve ISO 27001 certification. You will also be required to\nundergo internal audits and management reviews.\nIt's also crucial to **communicate the processes effectively** This is to\nensure that your organization's information security practices align with the\nISO 27001 standards. You will need to have the documentation in place but also\nput the processes into action by ensuring employees are aware of and follow\nthem.\nThe mandatory documents required for the ISO 27001 standard are listed below.\nAll criteria must be followed and documented accordingly for an organisation\nto present during external audits. The standard requires you to undergo an\ninternal audit before an external one. This will expose any gaps in your ISMS.\nOnce you have prepared the documentation and undergone an internal audit as\nwell as a management review, you need to undergo an external audit by a\ncertified body such as the UKAS.\nThe mandatory documents required for ISO 27001 are:\n *"", 'source': 'https://www.dataguard.co.uk/knowledge/iso-27001-certification/', 'title': 'ISO 27001 Certification: Your ultimate guide [free guide available]', 'relevance_score': 0.9767137})]","The ISO 27001 certification process includes the following steps:

1. Leadership and commitment: The definition and establishment of an ISMS must originate from the organization's leadership level. This includes developing a security policy, setting security objectives, determining the scope of the ISMS, and defining roles and responsibilities in the area of information security.

2. Risk assessment and treatment: Identification and evaluation of risks to the organization's information values, including deciding how these risks should be addressed.

3. Implementation of controls for risk treatment: Selection and implementation of appropriate security measures to address identified risks, based on the requirements of Annex A of ISO 27001. This includes technical, organizational, personnel, and infrastructural measures.

4. Monitoring and reviewing the ISMS: Regular review of the ISMS's effectiveness, including monitoring compliance with security policies and procedures and conducting internal audits.

5. Continuous improvement: Applying the PDCA cycle (Plan-Do-Check-Act) for the continuous improvement of the ISMS. This includes adapting the ISMS to changes in the organization or security environment and addressing identified vulnerabilities and deficiencies.

6. External certification: Conducting an external audit by an accredited certification body to verify the ISMS's conformity with ISO 27001 requirements. Successful auditing results in a certificate that confirms compliance with the standard.","The steps involved in the ISO 27001 certification process are as follows:

1. Scoping and implementing an Information Security Management System (ISMS): This involves creating and maintaining necessary documentation for the ISMS, such as policies, procedures, risk assessments, and controls.

2. Establishing an ISMS governing body: This body should consist of senior management and key stakeholders from throughout the company.

3. Performing an internal audit: This is to assess the organization's ISMS and its implementation. Internal auditors must be objective and impartial, and the results should be shared with the ISMS governing body and senior management to address any issues.

4. Undergoing an external audit: This audit is conducted by an external third-party auditor. It consists of two stages - Stage 1 Audit, which reviews documentation and readiness, and Stage 2 Audit,",True,0.4373177842565598,0.14076246334310852,0.21574344023323616,0.8814671337604523,0.9999663829803467,0.7985190428193344,1.0,0.99601175567377,2.1286444664001465,2.799436092376709,0.0010001659393310547,4.9280805587768555
