index_name,retriever_method,number_retrieved_docs,llm_name,max_context_size,temperature,prompt_version,question,retrieved_contexts,golden_answer,generated_answer,context_size_valid,rouge1,rouge2,rougeL,hallucination,answer_relevancy,answer_similarity,context_recall,RAGAS_relevancy,duration_retrieval,duration_generation,duration_context_size,duration_total
Fine-tuned_finetuned-ISO-27001_1024_l2_All_1536_264_False_Kers,Hybrid_Rerank_Cohere_Compression,8,gpt-3.5-turbo-16k,16385,0,1,"What does the term ""asset"" mean in ISO-27001 and what requirement does the standard have regarding the identification and inventory of information assets?","[Document(page_content='with the commitment of employees to comply with the\nrules and a commitment from management to actively support security or the isms.\nassets\nassets are understood to be anything of value to an organization. these can initially be land, buildings, machinery and equipment, business processes\n— but of course also the so-called information assets like\ninformation/data, systems, applications, it services. additionally, one can also consider\nsoft assets such as the image or creditworthiness of an organization.\none requirement of the standard is that all information assets relevant to the organization must be identified or inventoried — for example in the form of a table or a\ndatabase. in addition to the designation of an asset, additional data is usually recorded, e.g., information about the location of an asset, a\nclassification of its value, and the asset owner. this person, role, or organizational unit is responsible for the respective asset and is also the primary contact person\nfor all security aspects associated with this asset. this function often also includes\ncontrol over the risks to which an asset is exposed. occasionally, one may also find a division into asset owner and risk owner.\ngiven the multitude of assets in practice, inventorying can be quite labor-intensive.\none method to limit the effort is to consider similar assets (e.g., certain servers) together as one asset. this group is then included as one\nelement in the inventory list. this grouping is always possible when similar assets (comparable', metadata={'doc_ID': 3154, 'original_text': '- assets\n- one requirement of the standard is that all information assets relevant to the organization must be identified or inventoried', 'source': 'Kersten et al. - 2020 - IT-Sicherheitsmanagement nach der neuen ISO 27001_removed.pdf', 'title': 'Kersten et al. - 2020 - IT-Sicherheitsmanagement nach der neuen ISO 27001_removed', 'relevance_score': 0.99630713}), Document(page_content='asset valuation\nthe whole risk assessment process should consider the\norganisation’s context and the needs and expectations of\ninterested parties.\nfurthermore, iso 27001 provides no guidance as to the basis\non which control selection decisions should be made, other\nthan to say that they should be selected “taking account of\nthe risk assessment results” (6.1.3 a), which will necessarily\ntake into account how the organisation prioritises the risks\nfor treatment (6.1.2 ¢.2).\nfinally, the iso 27001 management system clauses have no\nrequirement in terms of your methodology for the\nidentification or valuation of information assets.\nhow you value an asset in an asset-based methodology is,\nhowever, going to be fundamental to how much you will be\nprepared to invest in protecting it. iso 27000 doesn’t offer a\ndefinition for an asset, although it is reasonable to simply\ndefine it as ‘anything that has value to the organisation’. the\norganisation’s fixed-asset register is unlikely to provide\npractical help in this regard: many critical assets may already\n(through application of the financial depreciation policy, or\nof the accounting convention that assets should be shown on\nthe balance sheet at the /ower of historic cost — less\ndepreciation — or current market value) have been written\ndown below their actual useful value to the organisation.\nmany other, even more critical, assets (such as brand value,\nkey supplier and customer contracts, staff know-how,\nintellectual property and databases) may not even be on', metadata={'doc_ID': 784, 'original_text': '- ""iso 27001 management system clauses have no requirement in terms of your methodology for the identification or valuation of information assets.""\n- ""how you value an asset in an asset-based methodology is, however, going to be fundamental to how much you will be prepared to invest in protecting it.""\n- ""iso 27000 doesn’t offer a definition for an asset, although it is reasonable to simply define it as ‘anything that has value to the organisation’.""\n- ""many critical assets may already (through application of the financial depreciation policy, or of the accounting convention that assets should be shown on the balance sheet at the /ower of historic cost — less depreciation — or current market value) have been written down below their actual useful value to the organisation.""\n- ""many other, even more critical, assets (such as brand value, key supplier and customer contracts, staff know-how, intellectual property and databases) may not even be on""', 'source': 'Calder - 2019 - Information Security Risk Management for ISO 27001.pdf', 'title': 'Information Security Risk Management for ISO 27001', 'relevance_score': 0.9960392}), Document(page_content='or home office.\n- information about systems in a demilitarized zone, as part of a security/network concept.\nsuch lists or plans are a good starting point for an inventory list according to a-5.9.\nit is worth noting that not all data is contained in a single directory. often, it is spread across multiple subdirectories that are under the responsibility of different entities. the iso 27002 explicitly allows this, but it requires clear organizational guidelines to avoid duplicate or inconsistent entries, different names, etc. in practice, due to expected challenges, it is often concluded that it is better to have a single central inventory list of information assets.\nif existing (older) inventories of the organization are discovered, it is necessary to check whether they meet all the requirements described in a-5.9 before incorporating them into the isms. if necessary, updates or revisions should be made.\nfor each asset, the inventory list should include at least the following information: a unique identifier, asset owner, and asset location.\nbefore explaining these three data fields, it is advisable to maintain the inventory list not only because the standard requires it but also as a basis for further work in the isms.\nuse:\n¢ as part of the risk assessment (isms-6.1), information about security objectives, specific risks, and references to action lists may be listed for each asset in the directory.\ne similarly, for certain types of assets, information about suppliers, procurement costs, maintenance work,', metadata={'doc_ID': 2709, 'original_text': '- the iso 27002 explicitly allows this, but it requires clear organizational guidelines to avoid duplicate or inconsistent entries, different names, etc.\n- it is often concluded that it is better to have a single central inventory list of information assets.\n- for each asset, the inventory list should include at least the following information: a unique identifier, asset owner, and asset location.\n- before explaining these three data fields, it is advisable to maintain the inventory list not only because the standard requires it but also as a basis for further work in the isms.\n- use:\n¢ as part of the risk assessment (isms-6.1), information about security objectives, specific risks, and references to action lists may be listed for each asset in the directory.\n- e similarly, for certain types of assets, information about suppliers, procurement costs, maintenance work,', 'source': 'ISO 27001_2022_Kersten_und_Schroeder.pdf', 'title': 'ISO 27001 2022', 'relevance_score': 0.9950371}), Document(page_content='the guidelines and any related asset\nlabelling scheme developed to meet the requirements of\ncontrol a.8.2.2 (labelling of information) or similar\ncontrols.\nare vendors assets?\nwe identified one of the classes of information assets as\n“services on which computer systems depend: computing\nand communications services, and general utilities such as\nheating, lighting, power and air-conditioning”. this gives\nrise to a simple question: are the suppliers/vendors of these\nessential services also assets?\nthere are two practical answers to this question. the best\nsolution is probably to use a mix of the two, but in doing so\n*” see, specifically, chapter 9 of it governance: an international guide\nto data security and iso27001/tso27002, alan calder and steve g\nwatkins (kogan page, 2019).\n101\n8: information assets\nit is essential that the exact approach to be used in each\nspecific case is determined by a common set of rules. these\nshould be defined in the risk assessment documentation.\none option is to decide that the vendor itself is not an asset —\nthe organisation that is within the scope of the isms does not\nown the vendors — but that the services provided by the\nvendor and, possibly, the relationship with the vendor are\nboth assets within the scope of the isms. the logic behind\nthis option is that a relationship with a vendor can be an asset\nif it is a key supplier in terms of the information aspects of\nwhatever it is they supply.\nfor example, a stationery supplier would not, we suggest, be\na key relationship', metadata={'source': 'Calder - 2019 - Information Security Risk Management for ISO 27001.pdf', 'title': 'Calder - 2019 - Information Security Risk Management for ISO 27001', 'original_text': '- ""the guidelines and any related asset labelling scheme developed to meet the requirements of control a.8.2.2 (labelling of information) or similar controls.""\n- ""are vendors assets?""\n- ""we identified one of the classes of information assets as “services on which computer systems depend: computing and communications services, and general utilities such as heating, lighting, power and air-conditioning”.""\n- ""are the suppliers/vendors of these essential services also assets?""\n- ""the best solution is probably to use a mix of the two, but in doing so *” see, specifically, chapter 9 of it governance: an international guide to data security and iso27001/tso27002, alan calder and steve g watkins (kogan page, 2019).""\n- ""one option is to decide that the vendor itself is not an asset — the organisation that is within the scope of the isms does not own the vendors — but that the services provided by the vendor and, possibly, the relationship with the vendor are both assets within the scope of the isms.""\n- ""the logic behind this option is that a relationship with a vendor can be an asset if it is a key supplier in terms of the information aspects of whatever it', 'doc_ID': 761, 'relevance_score': 0.9918753}), Document(page_content='that can actually lead to a security incident.\nproblems related to information assets\nit is a norm requirement to maintain and manage a list of information assets for the scope of application. for example, this list was incomplete, with entire groups of assets missing. this naturally resulted in no risk analysis and treatment being available for the assets. it also happened that either information about the location or the asset owner was missing.\nhowever, these gaps did not affect the actual remote control technology. the control system itself already has information about each individual remote control module, and it is usually up to date. however, gaps occurred when it came to proper backups, for example, of parameterization data. the facilities used for backups also belong in the inventory directory.\nthe current iso 27002 provides a welcome clarification regarding information assets, which was not present in earlier editions and was also missing in iso 27000: the information assets are classified into primary and secondary (or related) assets. primary assets include not only information, but also business processes and activities. this clarification is helpful because organizations sometimes believe that business processes are not part of the scope of their isms.\nalthough the incompleteness of the asset inventory was a relatively common problem, no general cause could be found for it, so it can only be pointed out here that the completeness and currency of the inventory for the scope of application', metadata={'source': 'ISO 27001_2022_Kersten_und_Schroeder.pdf', 'title': 'ISO 27001_2022_Kersten_und_Schroeder', 'original_text': 'the current iso 27002 provides a welcome clarification regarding information assets, which was not present in earlier editions and was also missing in iso 27000: the information assets are classified into primary and secondary (or related) assets. primary assets include not only information, but also business processes and activities.', 'doc_ID': 2974, 'relevance_score': 0.9858821}), Document(page_content='iso 27001 is an international standard that provides a framework for managing\ninformation security. it is designed to help organisations protect their\ninformation assets from a variety of threats, including unauthorized access,\nuse, disclosure, modification, or destruction.\nclause 8.2 of iso 27001 is concerned with information security risk\nassessment. this clause requires organisations to identify, assess, and\ncontrol the risks to their information assets.\n## what is iso 27001 clause 8.2 information security risk assessment?\niso 27001 clause 8.2 information security risk assessment is titled\n""information security risk assessment"". information security risk assessment\nis a critical process for any organization that wants to protect its data and\nsystems. by identifying and assessing risks, organizations can take steps to\nmitigate them and prevent security incidents from occurring. a risk management\nprocess should be following:\n * systematic * documented * regularly reviewed and updated.\n## asset-based risk management vs. scenario-based risk management\nthere are two main types of information security risk assessment: asset-based\nand scenario-based.\nasset-based risk assessment focuses on identifying and assessing the risks to\nspecific information assets, such as customer data, financial data, and\nintellectual property.\n### asset-based risk management process\nasset-based risk assessment typically involves the following steps:\n 1. identify the information assets that need to be', metadata={'description': 'Learn about ISO 27001 clause 8.2, requiring organisations to conduct a risk assessment to identify, assess & prioritize risks to their information assets. ', 'doc_ID': 399, 'language': 'en-gb', 'original_text': '- iso 27001 is an international standard that provides a framework for managing information security.\n- clause 8.2 of iso 27001 is concerned with information security risk assessment.\n- this clause requires organisations to identify, assess, and control the risks to their information assets.\n- iso 27001 clause 8.2 information security risk assessment is titled ""information security risk assessment"".\n- information security risk assessment is a critical process for any organization that wants to protect its data and systems.\n- by identifying and assessing risks, organizations can take steps to mitigate them and prevent security incidents from occurring.\n- a risk management process should be following: systematic, documented, regularly reviewed and updated.\n- there are two main types of information security risk assessment: asset-based and scenario-based.\n- asset-based risk assessment focuses on identifying and assessing the risks to specific information assets, such as customer data, financial data, and intellectual property.\n- asset-based risk assessment typically involves the following steps: identify the information assets that need to be.', 'source': 'https://www.dataguard.co.uk/knowledge/iso-27001/clause-8-2-information-security-risk-assessment/', 'title': 'ISO 27001 Clause 8.2: Information security risk assessment ', 'relevance_score': 0.98538435}), Document(page_content='maintenance\n * a.15 - supplier relationships\n * a.16 - information security incident management\n * a.17 - information security aspects of business continuity management\n * a.18 - compliance\nwhen combined, annex a can be used as a list of iso 27001 controls, and while\nnot mandatory, organisations should identify and implement controls that best\nalign with stakeholder expectations of information security.\nachieving iso 27001 compliance includes many policies and guidelines, as well\nas several documents that may make the compliance process seem daunting to\nthose who are unfamiliar. read our comprehensive guide to iso 27001\nrequirements to find out what you need to get started.\n## how do you build an asset inventory?\nit is vital to know which assets your organisation possesses, who is\nresponsible for their management and how they must be handled.\nbuilding an asset inventory is best done during the risk assessment process of\nimplementing your isms, using a “describe what you see” approach to take all\nassets in use into account. this includes all softwares installed and physical\nstorage (cabinets etc) tied to the information in question.\nconsider including the following information in your asset inventory:\n * asset name\n * asset ownership\n * asset category\n * asset location\n * any relevant notes\n## conclusion\nit is important to take time to identify which information assets require\nprotection and how they fit into the scope of your organisation’s isms.\nlisting assets helps you and your', metadata={'description': 'Annex A.8 covers Asset Management . Learn about Annex A.8 in detail, the requirements for effective asset management, and how to build an asset inventory.', 'doc_ID': 470, 'language': 'en-gb', 'original_text': 'building an asset inventory is best done during the risk assessment process of\nimplementing your isms, using a “describe what you see” approach to take all\nassets in use into account. this includes all softwares installed and physical\nstorage (cabinets etc) tied to the information in question.\nconsider including the following information in your asset inventory:\n * asset name\n * asset ownership\n * asset category\n * asset location\n * any relevant notes', 'source': 'https://www.dataguard.co.uk/blog/iso-27001-annex-a.8-asset-management', 'title': 'ISO 27001 Controls: Annex A.8 Asset Management - DataGuard', 'relevance_score': 0.98054343}), Document(page_content='under control a-5.8 and must be developed within the project.\na-5.9 inventory of information and other associated assets\nthe mentioned information assets can include datasets, data carriers, hardware, software, facilities, personnel, etc. more details can be found in section 1.4 under the keyword ""resources and assets.""\nall information assets assigned to the scope of the isms should be inventoried. it is important to note that such an inventory list must be maintained in written form, usually electronically. this can be a simple table or a qualified database, for example.\ndirectories of information assets exist in many organizations. here are some examples:\n- lists of purchased or leased devices and subscribed services (e.g., cloud services) - usually managed by administration or procurement departments, sometimes as part of asset accounting.\n- blueprints of locations and building plans with information about facilities - available from property management.\n- lists of it systems in a data center with information about location, deployment environment, and specific technical characteristics.\n- data about computers and mobile systems (tablets, mobile phones, etc.) issued to employees by it support - e.g., for workplace equipment, remote work, or home office.\n- information about systems in a demilitarized zone, as part of a security/network concept.\nsuch lists or plans are a good starting point for an inventory list according to a-5.9.\nit is worth noting that not all data is contained in a single', metadata={'doc_ID': 2708, 'original_text': '- a-5.9 inventory of information and other associated assets\n- the mentioned information assets can include datasets, data carriers, hardware, software, facilities, personnel, etc.\n- all information assets assigned to the scope of the isms should be inventoried.\n- directories of information assets exist in many organizations.\n- lists of purchased or leased devices and subscribed services (e.g., cloud services) - usually managed by administration or procurement departments, sometimes as part of asset accounting.\n- blueprints of locations and building plans with information about facilities - available from property management.\n- lists of it systems in a data center with information about location, deployment environment, and specific technical characteristics.\n- data about computers and mobile systems (tablets, mobile phones, etc.) issued to employees by it support - e.g., for workplace equipment, remote work, or home office.\n- information about systems in a demilitarized zone, as part of a security/network concept.\n- such lists or plans are a good starting point for an inventory list according to a-5.9.', 'source': 'ISO 27001_2022_Kersten_und_Schroeder.pdf', 'title': 'ISO 27001 2022', 'relevance_score': 0.98005307})]","The term ""asset"" in ISO-27001 refers to anything that holds value for an organization. This includes properties, buildings, machinery, facilities, business processes, as well as information assets such as data, systems, and IT services. One requirement of the standard is that all relevant information assets must be identified and inventoried. This is typically done by recording information such as asset location, classification and the asset owner in a table or database. Inventorying can be facilitated by grouping similar assets or implementing a hierarchy.","In ISO 27001, the term ""asset"" refers to anything that has value to the organization. The standard requires that all information assets relevant to the organization must be identified or inventoried. This inventory should include at least a unique identifier, asset owner, and asset location for each asset. The standard does not prescribe a specific methodology for the identification or valuation of information assets, but it is essential to have clear organizational guidelines to avoid duplicate or inconsistent entries. It is recommended to maintain a single central inventory list of information assets to facilitate management and avoid confusion. Additionally, the standard allows for the inclusion of information about security objectives, specific risks, and references to action lists for each asset in the inventory, which can be beneficial for risk assessment and management processes.",True,0.488479262672811,0.16744186046511625,0.2764976958525346,0.5089171379804611,0.99930739402771,0.846559152810147,1.0,0.9576003607895484,3.125401496887207,3.1884403228759766,0.0039577484130859375,6.313841819763184
Fine-tuned_finetuned-ISO-27001_1024_l2_All_1536_264_False_Kers,Hybrid_Rerank_Cohere_Compression,8,gpt-3.5-turbo-16k,16385,0,1,What information and documents should be collected in an organization to determine the context as part of ISO 27001?,"[Document(page_content='documents which provide further information and\nare very useful if not essential in using the standard itself. for iso/iec 27001 the one quoted\nhere is iso/iec 27000 which sets out the overview and vocabulary for an isms.\nthere are no requirements to be met in this section.\n3.4 clause 3 terms and definitions\nunlike many other standards, iso/iec 27001 doesn’t list any definitions at all, simply\nreferring the reader to iso/iec 27000. if you feel you need to know the exact definitions of\nsome of the terms used in iso/iec 27001 then this is the place to look, although in many\ncases you may not feel much more enlightened after reading the definition.\nthere are no requirements to be met in this section.\n page 24 of 79\niso/iec 27001 implementation guide\n3.5 clause 4 context of the organization\nrelevant toolkit documents\ne information security context, requirements and scope\nthis clause is about understanding as much as possible about the organization itself and the\nenvironment in which it operates. the key point about the isms is that it should be\nappropriate and relevant to the specifics of the business it is protecting. to ensure this, the\npeople implementing and running the isms must be able to answer questions about what\nthe organization does, where, how and who for (plus many others).\nthe isms will also be affected by the situation within the organization (internal issues) and\noutside the organization (external issues). internal issues are factors such as the culture,\nmanagement structure, locations,', metadata={'doc_ID': 871, 'original_text': '- 3.5 clause 4 context of the organization\n- relevant toolkit documents\n- information security context, requirements and scope\n- this clause is about understanding as much as possible about the organization itself and the environment in which it operates.\n- the key point about the isms is that it should be appropriate and relevant to the specifics of the business it is protecting.\n- the people implementing and running the isms must be able to answer questions about what the organization does, where, how and who for (plus many others).\n- the isms will also be affected by the situation within the organization (internal issues) and outside the organization (external issues).\n- internal issues are factors such as the culture, management structure, locations.', 'source': 'CERTIKIT_ISO27001_Implementation_Guide_v12.pdf.pdf', 'title': 'CERTIKIT ISO27001 Implementation Guide_v12', 'relevance_score': 0.9937101}), Document(page_content=""with iso 27001. you\nmust document all processes, rules, and procedures related to your isms to\nensure their appropriate implementation. the norm requires documentation of\nthe following aspects: * understanding the organization and its context (e.g., through an environmental analysis) * identification of interested parties * isms scope * communicated management commitment * roles and responsibilities within the isms * risk and opportunity management * change management planning * resource planning * decision logs related to risk management * training * communication matrix * documentation management planning/policy * framework with information security policies and information security guidelines * procedure for information security risk management * statement of applicability (soa) * information security objectives * evidence of competence * information necessary for the organization's isms effectiveness * control and planning of activities * evidence of monitoring and measurement results and evaluation * procedure for internal audits * procedure for management review * evidence of the audit program and its results * evidence of the results of management reviews * evidence of the type of identified non-conformities and all subsequent actions * evidence of"", metadata={'description': 'Discover the comprehensive guide to ISO 27001: Detailed insight into achieving and maintaining this essential information security standard. Explore its critical role in risk management, compliance and robust security practices, and learn step-by-step implementation techniques.', 'doc_ID': 176, 'language': 'en-gb', 'original_text': ""- understanding the organization and its context (e.g., through an environmental analysis)\n- isms scope\n- communicated management commitment\n- roles and responsibilities within the isms\n- risk and opportunity management\n- change management planning\n- resource planning\n- decision logs related to risk management\n- training\n- communication matrix\n- documentation management planning/policy\n- framework with information security policies and information security guidelines\n- procedure for information security risk management\n- statement of applicability (soa)\n- information security objectives\n- evidence of competence\n- information necessary for the organization's isms effectiveness\n- control and planning of activities\n- evidence of monitoring and measurement results and evaluation\n- procedure for internal audits\n- procedure for management review\n- evidence of the audit program and its results\n- evidence of the results of management reviews\n- evidence of the type of identified non-conformities and all subsequent actions"", 'source': 'https://www.dataguard.co.uk/knowledge/iso-27001/', 'title': 'What is ISO 27001? Key Information at a Glance', 'relevance_score': 0.99256825}), Document(page_content='any gaps in your isms.\nonce you have prepared the documentation and undergone an internal audit as\nwell as a management review, you need to undergo an external audit by a\ncertified body such as the ukas.\nthe mandatory documents required for iso 27001 are:\n * 4.1 understanding the organization and its context\n * 4.2 understanding the needs and expectations of interested parties\n * 4.3 the scope of the isms\n * 4.4 information security management system process\n * 5.1 commitment of the isms\n * 5.2 information security policy\n * 5.3 roles and their responsibilities (raci/rasci)\n * 6.1.2 information security risk assessment and treatment process\n * 6.1.3 information security risk treatment and assessment plan\n * 6.1.3 the statement of applicability\n * 6.2 information security objectives\n * 6.3 change management for the isms\n * 7.1 ressource planning\n * 7.3 awareness plan\n * 7.4 communication plan\n * 7.2 evidence of competence\n * 7.5 document control policy\n * 5.5.1 documented information determined by the organisation as being necessary for the effectiveness of the isms\n * 8.1 operational planning and control\n * 8.2 results of the information security risk assessment\n * 8.3 results of the information security risk treatment\n * 9.1 evidence of the monitoring and measurement of results\n * 9.2 a documented internal audit process\n * 9.2 evidence of the audit programmes and the audit results\n * 9.3 evidence of the results of management reviews\n * 10.1 evidence of the nature of the', metadata={'description': 'No matter if you’re an SMB or an international corporation — getting an ISO 27001 certification should be on your agenda. Here’s the ultimate guide on how.', 'doc_ID': 147, 'language': 'en-gb', 'original_text': '* 4.1 understanding the organization and its context\n* 4.2 understanding the needs and expectations of interested parties\n* 4.3 the scope of the isms\n* 6.1.2 information security risk assessment and treatment process\n* 6.1.3 information security risk treatment and assessment plan\n* 6.1.3 the statement of applicability\n* 6.2 information security objectives\n* 6.3 change management for the isms\n* 7.1 ressource planning\n* 7.3 awareness plan\n* 7.4 communication plan\n* 7.2 evidence of competence\n* 7.5 document control policy\n* 5.5.1 documented information determined by the organisation as being necessary for the effectiveness of the isms\n* 8.1 operational planning and control\n* 8.2 results of the information security risk assessment\n* 8.3 results of the information security risk treatment\n* 9.1 evidence of the monitoring and measurement of results\n* 9.2 a documented internal audit process\n* 9.2 evidence of the audit programmes and the audit results\n* 9.3 evidence of the results of', 'source': 'https://www.dataguard.co.uk/knowledge/iso-27001-certification/', 'title': 'ISO 27001 Certification: Your ultimate guide [free guide available]', 'relevance_score': 0.99135584}), Document(page_content='specific pieces of documentation you need to get iso 27001 certification, which will require additional time and resources.\nsome of the requirements include:\n4.3 the scope of the isms\n5.2 information security policy\n6.1.2 information security risk assessment process\n6.1.3 information security risk treatment plan\n6.1.3 the statement of applicability\n6.2 information security objectives\n7.5.3 control of documented information\n8.1 operational planning and control\n8.2 results of the information security risk assessment\n8.3 results of the information security risk treatment\n9.1 evidence of the monitoring and measurement of results\n9.2 an internal audit process\n9.2 evidence of the audit programs and the audit results\n9.3 evidence of the results of management reviews\n10.1 evidence of any non-conformities and corrective actions taken\nthink through the time it will take for your company to collect and organize all this information. every organization will be in a different place when it comes to managing and collecting these details.\ntraining\nas you take on this initiative, you’ll need to provide security awareness training to the people in your organization. in addition to the upfront cost of the training program, you’ll also need to factor in the time spent by your employees to complete their training and any downturn in productivity.\nestablishing new processes\nnew processes and controls will need to be implemented, some of which may be corrective actions that are critical to meet compliance. they', metadata={'description': 'Considering ISO 27001? Learn what you need to know about ISO 27001 certification costs and how they may vary for your organization.', 'doc_ID': 106, 'language': 'en', 'original_text': '4.3 the scope of the isms\n5.2 information security policy\n6.1.2 information security risk assessment process\n6.1.3 information security risk treatment plan\n6.1.3 the statement of applicability\n6.2 information security objectives\n7.5.3 control of documented information\n8.1 operational planning and control\n8.2 results of the information security risk assessment\n8.3 results of the information security risk treatment\n9.1 evidence of the monitoring and measurement of results\n9.2 an internal audit process\n9.2 evidence of the audit programs and the audit results\n9.3 evidence of the results of management reviews\n10.1 evidence of any non-conformities and corrective actions taken', 'source': 'https://www.drata.com/blog/iso-27001-certification-cost', 'title': 'Budgeting for ISO 27001: How Much Does Certification Cost?', 'relevance_score': 0.9878996}), Document(page_content=""# iso 27001 clause 4.1: understanding the organisation and its context\nclause 4.1 of the iso 27001 requires organisations to understand their\norganisation and its context\nthis includes understanding the following:\n * mission, vision, and values * products and services * customers and suppliers * legal and regulatory requirements * internal and external environment * risks and opportunities ## iso 27001:2022 clause 4.1: understanding the organisation and its context\nthe organisation shall determine external and internal issues that are\nrelevant to its purpose and that affect its ability to achieve the intended\noutcome(s) of its information security management system.\nby understanding its organisation and its context, an organisation can better\nidentify the threats and vulnerabilities that its information assets face.\nthis information can then be used to develop and implement appropriate\ncontrols to mitigate the risks and capitalise on the opportunities.\nhere are some tips for understanding the organisation and its context for iso\n27001:\n * **conduct a risk assessment:risk assessments** will help you to identify the threats and vulnerabilities that your information assets face. * **review the organisation's mission, vision, and values:** this will help you to understand the organisation's strategic goals. * **identify the organisation's products and services and the customers and suppliers that rely on them:** this will help you to understand"", metadata={'description': ""Guide to ISO 27001 Clause 4.1: Delve into the organisation's internal & external issues. Explore the significance of this clause in forming a robust ISMS."", 'doc_ID': 193, 'language': 'en-gb', 'original_text': ""- iso 27001 clause 4.1: understanding the organisation and its context\n- clause 4.1 of the iso 27001 requires organisations to understand their organisation and its context\n- this includes understanding the following:\n  * mission, vision, and values\n  * products and services\n  * customers and suppliers\n  * legal and regulatory requirements\n  * internal and external environment\n  * risks and opportunities\n- the organisation shall determine external and internal issues that are relevant to its purpose and that affect its ability to achieve the intended outcome(s) of its information security management system.\n- by understanding its organisation and its context, an organisation can better identify the threats and vulnerabilities that its information assets face.\n- this information can then be used to develop and implement appropriate controls to mitigate the risks and capitalise on the opportunities.\n- here are some tips for understanding the organisation and its context for iso 27001:\n  * **conduct a risk assessment:risk assessments** will help you to identify the threats and vulnerabilities that your information assets face.\n  * **review the organisation's mission, vision, and values:** this will help you to understand the organisation's strategic goals.\n  * **identify the organisation's products and services and the customers and suppliers"", 'source': 'https://www.dataguard.co.uk/knowledge/iso-27001/clause-4-1-requirements-of-interested-parties/', 'title': 'ISO 27001 Clause 4.1: Understanding Organisation & Context for Infosec', 'relevance_score': 0.9840936}), Document(page_content=""redundancy), and how long the data should be stored or retained (storage and archiving periods), who should have what kind of access, etc.\nwith this enumeration, we are already moving towards the management of documented information, which is the subject of the standard (in its main part) - we will come back to this in chapter 2.\n11. context\nevery organization operates in an environment that influences and controls its business and administrative activities. this includes legal requirements - from all countries in which the organization operates, as well as from supranational institutions - requirements from supervisory and reporting bodies, requirements and expectations from customers, business partners, and shareholders - and finally, the organization's own requirements, for example, regarding the improvement of products/services.\nin cross-border activities, cultural, social, and mental differences in the individual countries are also to be considered as part of the environment.\nat least recommendations and guidelines have (technical, administrative) requirements from (industry) associations and organizations.\nthis environment of an organization is referred to as the context of an organization in the iso 27000 series as a whole. this context is the starting point for the establishment of the so-called information security management system, abbreviated as isms. all information describing the context is referred to as context information.\nthey are sorted according to their source: requirements or"", metadata={'source': 'ISO 27001_2022_Kersten_und_Schroeder.pdf', 'title': 'ISO 27001_2022_Kersten_und_Schroeder', 'original_text': ""- every organization operates in an environment that influences and controls its business and administrative activities.\n- this includes legal requirements - from all countries in which the organization operates, as well as from supranational institutions - requirements from supervisory and reporting bodies, requirements and expectations from customers, business partners, and shareholders - and finally, the organization's own requirements, for example, regarding the improvement of products/services.\n- in cross-border activities, cultural, social, and mental differences in the individual countries are also to be considered as part of the environment.\n- at least recommendations and guidelines have (technical, administrative) requirements from (industry) associations and organizations.\n- this environment of an organization is referred to as the context of an organization in the iso 27000 series as a whole. this context is the starting point for the establishment of the so-called information security management system, abbreviated as isms. all information describing the context is referred to as context information."", 'doc_ID': 2559, 'relevance_score': 0.9822877}), Document(page_content='a.5.27 learning from information security incidents\nrelevant toolkit documents\ne incident lessons learned report\nwe would recommend that some analysis is done after a significant incident has been\nexperienced (such as a breach of personal data) to identify the lessons learned from the way\nit was discovered and managed, and a template report is provided in the toolkit for this\npurpose, together with an example of a completed report.\n4.1.28 a.5.28 collection of evidence\nrelevant toolkit documents\ne this control is addressed by documents in other folders - see toolkit index\none of the main differences for information security incidents (compared to normal\ntechnical incidents) may be the need to preserve evidence for later investigation and\npossibly legal action or prosecution, particularly where there may have been fraud carried\nout by an insider. the basic rules for this may be defined for your internal staff to follow, but\nit is likely you will need the help of a specialist provider to achieve this effectively. part of\nyour planning should be to select such a provider in advance, check them out, and have\ntheir contact details to hand.\n page 48 of 79\niso/iec 27001 implementation guide\n4.1.29 a.5.29 information security during disruption\nrelevant toolkit documents\ne this control is addressed by documents in other folders - see toolkit index\nthe key point to make with regard to business continuity in the context of the iso/iec\n27001 standard is that the requirements in this control refer to the information', metadata={'source': 'CERTIKIT_ISO27001_Implementation_Guide_v12.pdf.pdf', 'title': 'CERTIKIT_ISO27001_Implementation_Guide_v12.pdf', 'original_text': '- a.5.27 learning from information security incidents\n- relevant toolkit documents\n- e incident lessons learned report\n- we would recommend that some analysis is done after a significant incident has been experienced (such as a breach of personal data) to identify the lessons learned from the way it was discovered and managed, and a template report is provided in the toolkit for this purpose, together with an example of a completed report.\n- 4.1.28 a.5.28 collection of evidence\n- relevant toolkit documents\n- e this control is addressed by documents in other folders - see toolkit index\n- one of the main differences for information security incidents (compared to normal technical incidents) may be the need to preserve evidence for later investigation and possibly legal action or prosecution, particularly where there may have been fraud carried out by an insider. the basic rules for this may be defined for your internal staff to follow, but it is likely you will need the help of a specialist provider to achieve this effectively. part of your planning should be to select such a provider in advance, check them out, and have their contact details to hand.\n- page 48 of 79\n- iso/iec 27001 implementation guide\n- 4.1.29 a', 'doc_ID': 916, 'relevance_score': 0.98080254}), Document(page_content='document, is one of the first documents that an auditor will review\nas part of the audit process. the statement of applicability helps your\nauditor understand your organization, as well as what controls have been\nimplemented and must be assessed as part of your audit.\n### create an isms information security policy (isms policy)\nthe isms information security policy is the highest-level internal document in\nyour isms. it should provide a framework to be applied when establishing,\nimplementing, maintaining, and continually improving the isms, and should\ninclude substantial information for, or make general statements with\nappropriate references to, supporting documentation regarding the following:\n * information security objectives\n * leadership and commitment\n * roles, responsibilities, and authorities\n * approach to assessing and treating risk\n * control of documented information\n * communication\n * internal audit\n * management review\n * corrective action and continual improvement\n * policy violations\nyour organization will also need to create supplemental policies and\nprocedures to support the requirements outlined in iso 27001 for the isms as\nwell as the annex a controls.\n### iso 27001: the internal audit\nbefore undergoing an iso audit with an external auditor, your company will\nfirst be required to perform an internal audit. an internal audit involves a\nthorough examination of your organization’s isms and is one of the best ways\nto ensure that your organization’s isms is operating effectively and', metadata={'source': 'https://www.vanta.com/resources/the-ultimate-iso-27001-guide-powered-by-vanta-and-aprio', 'title': 'The ultimate ISO 27001 guide', 'description': 'In this guide, we share the recommended approach to successful implementation of an Information Security Management System (ISMS) according to the ISO 27001 standard to help prepare your organization to undergo an independent evaluation of your ISMS in order to obtain your ISO 27001 certification.', 'language': 'en', 'original_text': '- document, is one of the first documents that an auditor will review as part of the audit process.\n- create an isms information security policy (isms policy)\n- the isms information security policy is the highest-level internal document in your isms.\n- your organization will also need to create supplemental policies and procedures to support the requirements outlined in iso 27001 for the isms as well as the annex a controls.\n- iso 27001: the internal audit\n- before undergoing an iso audit with an external auditor, your company will first be required to perform an internal audit.', 'doc_ID': 59, 'relevance_score': 0.9776285})]","To determine the context within an organization as part of ISO 27001, the following information and documents should be collected:

1. External factors: This includes the operational environment, legal framework, financial aspects, technology usage and dependencies, suppliers and service providers, as well as social and cultural aspects, especially for internationally operating organizations. Competitive aspects such as the scope of activities, key success factors, image considerations, and relationships with clients, customers, and partners should also be considered.

2. Internal factors: This includes the organizational structure and processes, the purpose and scope of IT implementation, already implemented standards and other requirements such as management systems, documentation and results from previous security activities, available resources for the establishment of an ISMS, approaches to risk management (including other topics), as well as existing internal regulations on security topics and other areas such as quality management and project management.

It is important to compile all relevant information and documentation (in writing or electronically) on the topic of security in order to understand the organization's context.","To determine the context as part of ISO 27001, an organization should collect information and documents such as the organization's mission, vision, and values, products and services, customers and suppliers, legal and regulatory requirements, internal and external environment, risks and opportunities. Additionally, the organization should consider factors like legal requirements from all countries of operation, requirements from supervisory bodies, customer expectations, and industry guidelines. Conducting a risk assessment, reviewing strategic goals, and identifying products and services are essential steps in understanding the organization's context. The information gathered will help in identifying threats, vulnerabilities, and opportunities for the information security management system (ISMS) to implement appropriate controls effectively.",True,0.4571428571428572,0.14388489208633093,0.25,0.7273625209927559,0.9999653100967407,0.8135714232072584,1.0,0.8588959207076069,1.7579693794250488,2.6433722972869873,0.0020012855529785156,4.401341676712036
Fine-tuned_finetuned-ISO-27001_1024_l2_All_1536_264_False_Kers,Hybrid_Rerank_Cohere_Compression,8,gpt-3.5-turbo-16k,16385,0,1,How can responsibilities for compliance with ISO 27001 and monitoring of the ISMS be established within an organization?,"[Document(page_content=""under this condition, disclosure can take place via the organization's intranet - but also through distribution (mail, email) to the individuals affected. a good idea is to support the introduction of such a policy through training activities.\nplease also note the requirements from control group a.5 on this subject.\nna 5.3 - roles, responsibilities, and authorities in the organization\nanother task of top management is to establish responsibilities for security matters, i.e., to define roles and their tasks and authorities.\nthis naturally concerns security management - in the simplest case in the form of a security officer and a deputy - but also asset management, process owners, department coordinators, it emergency officers, backup managers, compliance managers, etc.\nif roles are not explicitly required by iso 27001 (among others in annex a), the organization can select these at its discretion and define their tasks.\nthe guideline is that all security-related tasks must be assigned to a responsible entity or role. na 5.3 mentions two functions that must be established:\n* someone must be responsible for ensuring compliance with iso 27001 or monitoring compliance.\n* the task of preparing reports on the performance and effectiveness of the isms and submitting them to top management must be assigned.\nall roles and responsibilities must also be made known within the organization - for example, through the policy from na 5.2 or through training events.\n2.3 planning (nk 6)\nthis chapter of the standard is"", metadata={'doc_ID': 3175, 'original_text': 'na 5.3 - roles, responsibilities, and authorities in the organization\nanother task of top management is to establish responsibilities for security matters, i.e., to define roles and their tasks and authorities.\nthis naturally concerns security management - in the simplest case in the form of a security officer and a deputy - but also asset management, process owners, department coordinators, it emergency officers, backup managers, compliance managers, etc.\nif roles are not explicitly required by iso 27001 (among others in annex a), the organization can select these at its discretion and define their tasks.\nthe guideline is that all security-related tasks must be assigned to a responsible entity or role. na 5.3 mentions two functions that must be established:\n* someone must be responsible for ensuring compliance with iso 27001 or monitoring compliance.\n* the task of preparing reports on the performance and effectiveness of the isms and submitting them to top management must be assigned.\nall roles and responsibilities must also be made known within the organization - for example, through the policy from na 5.2 or through training events.', 'source': 'Kersten et al. - 2020 - IT-Sicherheitsmanagement nach der neuen ISO 27001_removed.pdf', 'title': 'Kersten et al. - 2020 - IT-Sicherheitsmanagement nach der neuen ISO 27001_removed', 'relevance_score': 0.9981827}), Document(page_content=""/ management demonstrating leadership and commitment to information\nsecurity.\nthis is because senior management is ultimately responsible for the\norganisation's information security.\nby demonstrating leadership and commitment, senior management can help to\ncreate a culture of information security within the organisation and ensure\nthat everyone is committed to protecting the organisation's information\nassets.\nhere are some of the specific reasons why iso 27001 clause 5.1 is important\nand what it can help with:\n * ensure that the organisation has an effective information security management system (isms) in place. * help to protect the organisation's information assets from unauthorized access, use, disclosure, modification, or destruction. * aid in how to comply with legal and regulatory requirements. * to reduce the risk of financial losses, reputational damage, and business disruption. * improve the organisation's overall security posture.\n## who is responsible for iso 27001 clause 5.1?\nthe responsibility for iso 27001 clause 5.1 ultimately lies with top\nmanagement. however, all employees in the organisation have a role to play in\nensuring the organisation's information security.\nspecifically, top management is responsible for:\n * taking accountability for the effectiveness of the isms. * ensuring that the isms policy and objectives are established and are compatible with the organisation's context and strategic direction. * integrating the isms into"", metadata={'description': 'Learn how to demonstrate leadership and commitment to information security in accordance with ISO 27001:2022 Clause 5.1.', 'doc_ID': 215, 'language': 'en-gb', 'original_text': ""- management demonstrating leadership and commitment to information security.\n- senior management is ultimately responsible for the organisation's information security.\n- demonstrating leadership and commitment, senior management can help to create a culture of information security within the organisation and ensure that everyone is committed to protecting the organisation's information assets.\n- here are some of the specific reasons why iso 27001 clause 5.1 is important and what it can help with:\n  * ensure that the organisation has an effective information security management system (isms) in place.\n  * help to protect the organisation's information assets from unauthorized access, use, disclosure, modification, or destruction.\n  * aid in how to comply with legal and regulatory requirements.\n  * to reduce the risk of financial losses, reputational damage, and business disruption.\n  * improve the organisation's overall security posture.\n- who is responsible for iso 27001 clause 5.1?\n- the responsibility for iso 27001 clause 5.1 ultimately lies with top management.\n- however, all employees in the organisation have a role to play in ensuring the organisation's information security.\n- specifically, top management is responsible for:\n  * taking accountability for the effectiveness of the isms.\n  * ensuring that the isms policy and objectives are established"", 'source': 'https://www.dataguard.co.uk/knowledge/iso-27001/clause-5-1-leadership-and-commitment/', 'title': 'ISO 27001 Clause 5.1: Leadership and Commitment', 'relevance_score': 0.99610037}), Document(page_content='# iso 27001 compliance checklist\n **\u200d** iso 27001 is the global gold standard for ensuring the security of\ninformation and its supporting assets. obtaining iso 27001 certification can\nhelp an organization prove its security practices to potential customers\nanywhere in the world. \u200d our iso 27001 checklist:\n1\ndevelop a roadmap for successful implementation of an isms and iso 27001\ncertification\nimplement plan, do, check, act (pdca) process to recognize challenges and\nidentify gaps for remediation\nconsider iso 27001 certification costs relative to org size and number of\nemployees\nclearly define scope of work to plan certification time to completion\nselect an iso 27001 auditor\n2\nset the scope of your organization’s isms\ndecide which business areas are covered by the isms and which are out of scope\nconsider additional security controls for business processes that are required\nto pass isms-protected information across the trust boundary\ninform stakeholders regarding scope of the isms\n3\nestablish an isms governing body\nbuild a governance team with management oversight\nincorporate key members of top management, e.g. senior leadership and\nexecutive management with responsibility for strategy and resource allocation\n4\nconduct an inventory of information assets\nconsider all assets where information is stored, processed, and accessible\n\u200d\n * record information assets: data and people\n * record physical assets: laptops, servers, and physical building locations\n * record intangible assets:', metadata={'description': 'Our ISO 27001 compliance checklist will help simplify your path to compliance.', 'doc_ID': 8, 'language': 'en', 'original_text': '- iso 27001 compliance checklist\n- iso 27001 is the global gold standard for ensuring the security of information and its supporting assets.\n- obtaining iso 27001 certification can help an organization prove its security practices to potential customers anywhere in the world.\n- develop a roadmap for successful implementation of an isms and iso 27001 certification\n- implement plan, do, check, act (pdca) process to recognize challenges and identify gaps for remediation\n- consider iso 27001 certification costs relative to org size and number of employees\n- clearly define scope of work to plan certification time to completion\n- set the scope of your organization’s isms\n- decide which business areas are covered by the isms and which are out of scope\n- consider additional security controls for business processes that are required to pass isms-protected information across the trust boundary\n- establish an isms governing body\n- build a governance team with management oversight\n- incorporate key members of top management, e.g. senior leadership and executive management with responsibility for strategy and resource allocation\n- conduct an inventory of information assets\n- consider all assets where information is stored, processed, and accessible\n- record information assets: data and people\n- record physical assets: laptops,', 'source': 'https://www.vanta.com/resources/iso-27001-compliance-checklist', 'title': 'The ISO 27001 compliance checklist', 'relevance_score': 0.9960083}), Document(page_content='of iso 27001 is assigning responsibility\nto an isms owner who is responsible for ensuring compliance with the standard\nand reporting to top management. identify the owner and assign responsibility\nin order to drive the effort forward.\n\u200d\n **2\\. determine where you stand**\nbefore you can start updating and fortifying your security system to meet iso\n27001 compliance, you need to know which boxes you already check and which\nones you need to address. while some companies do this with a time-consuming\nmanual assessment, a more thorough and time-saving way is to use a compliance\nautomation software like vanta.\n vanta scans and evaluates your isms, comparing it against the iso 27001\ncontrols. it gives you a clear picture of the standards you’ve already met\nand, most importantly, a clear list of the controls and policies you need to\nimplement to reach the compliance level you need.\n\u200d\n **3\\. implement the needed security controls and protocols**\nusing your vanta report as a guide, your team can now begin implementing all\nthe controls and protocols you’re missing one by one. some of these may be\nquick while others may require a project of their own, like developing\nsecurity protocols for staff to follow and training all staff members on those\nprotocols.\n\u200d\n **4\\. re-assess your readiness**\nafter you’ve followed vanta’s guide and implemented the security controls you\nwere missing, it’s time to check your work. run a vanta scan again to assess\nwhere you now stand with your compliance readiness. ideally, it', metadata={'description': 'Need to get ISO 27001 certified? Find out what you can expect from the ISO 27001 certification process from security compliance experts.', 'doc_ID': 14, 'language': 'en', 'original_text': '- assigning responsibility to an isms owner who is responsible for ensuring compliance with the standard and reporting to top management.\n- identify the owner and assign responsibility in order to drive the effort forward.\n- determine where you stand\n- vanta scans and evaluates your isms, comparing it against the iso 27001 controls.\n- a clear picture of the standards you’ve already met and a clear list of the controls and policies you need to implement to reach the compliance level you need.\n- implement the needed security controls and protocols\n- using your vanta report as a guide\n- re-assess your readiness\n- run a vanta scan again to assess where you now stand with your compliance readiness.', 'source': 'https://www.vanta.com/resources/how-long-does-it-take-to-get-iso-certified', 'title': 'What is the ISO certification timeline?', 'relevance_score': 0.9954616}), Document(page_content='# iso 27001 clause 5.3: organisational roles, responsibilities and authorities\nclause 5.3 of iso 27001 addresses the organisational roles, responsibilities,\nand authorities (or&as) for information security. this clause requires\norganisations to define and assign the or&as for all aspects of their isms.\n### iso 27001:2022 clause 5.3 organisational roles, responsibilities and\nauthorities top management shall ensure that the responsibilities and authorities for\nroles relevant to information security are assigned and communicated within\nthe organisation.\n### top management shall assign the responsibility and authority for:\n * ensuring that the information security management system conforms to the requirements of this document. * reporting on the performance of the information security management system to top management. ## what is the 5th clause of iso 27001?\nthe 5th clause of iso 27001 is titled ""management responsibility"". this clause\nrequires organisations to demonstrate leadership and commitment to information\nsecurity. it also requires organisations to appoint a management\nrepresentative to oversee the implementation and maintenance of the isms.\n### get iso 27001 certified in as little as 3 months.\n### your iso 27001 certification process made simple.\n* * *\n download your free guide to fast & sustainable certification\ndownload your free guide\n## what are the requirements of iso 27001 clause 5.3?\nthe specific requirements of iso 27001 clause 5.3 are as follows:\n * top', metadata={'description': 'ISO 27001 Clause 5.3 defines the requirements for defining and assigning organisational roles, responsibilities, and authorities for information security.', 'doc_ID': 221, 'language': 'en-gb', 'original_text': '- Clause 5.3 of ISO 27001\n- Organisational roles, responsibilities, and authorities (OR&As) for information security\n- Top management\'s responsibility for assigning and communicating responsibilities and authorities\n- Ensuring that the information security management system conforms to the requirements of ISO 27001\n- Reporting on the performance of the information security management system to top management\n- The 5th clause of ISO 27001 titled ""management responsibility""\n- Leadership and commitment to information security\n- Appointing a management representative to oversee the implementation and maintenance of the ISMS\n- The specific requirements of ISO 27001 clause 5.3', 'source': 'https://www.dataguard.co.uk/knowledge/iso-27001/clause-5-3-organisational-roles-responsibilities-and-authorities/', 'title': 'ISO 27001 Clause 5.3: Roles, Responsibilities and Authorities', 'relevance_score': 0.9951703}), Document(page_content='of measurements. an interesting aspect here would be the degree of implementation as an average across all controls of the isms - for example, as the average of individual values or with appropriate weighting. it is clear that this average/weighted degree of implementation says something about the effectiveness of the isms: information security can only be incomplete if the controls are not fully implemented, i.e. the isms does not provide full performance and is most likely not fully effective.\nof course, there are dependencies between the aspects of the correctness of implementation, effectiveness, and adequacy. a precise separation is difficult. however, it is clear that these aspects are the focus of performance evaluation, as isms-10 also emphasizes.\nin addition to these measurements/monitoring of security objectives, other (extended) objectives are of interest to the organization: adherence to planned budgets or monitoring of overall resource consumption, adherence to deadlines in the establishment and operation of the isms, etc. the degree of goal achievement is also interesting for such objectives and contributes to the performance of the isms and information security. measurements could be carried out by comparing them with the planning (budget, resource, implementation plan).\none final, but central and measurable objective of the organization for this book: the conformity of the isms with iso 27001. the degree of compliance with individual norm requirements can be monitored and measured by', metadata={'source': 'ISO 27001_2022_Kersten_und_Schroeder.pdf', 'title': 'ISO 27001_2022_Kersten_und_Schroeder', 'original_text': '- ""responsibilities for compliance with ISO 27001 and monitoring of the ISMS""\n- ""establishment and operation of the isms""\n- ""degree of goal achievement""\n- ""conformity of the isms with iso 27001""', 'doc_ID': 2666, 'relevance_score': 0.99271095}), Document(page_content='the standard for the first time, it becomes very important to\nlearn and implement best practices.\nthus, management commitment is the driving force of each step you are taking to\nimplement the isms or iso 27001 standard. other stakeholders/members you would\nexpect commitment from are those who are either involved in the decision-making\nprocess or are implementers.\ndecision makers and implementers will spend most of their time implementing the\nisms. hence, getting their commitment is very important. it is also very important to\nhave a balance of commitment levels from management and the other stakeholders. if\nthis is mismatched, it will impact the implementation and the overall results.\nto manage these scenarios, the iso 27001 standard includes clause 5.3,\norganizational roles, responsibilities, and authorities, which states that “top\nmanagement shall ensure that the responsibilities and authorities for roles relevant to\ninformation security are assigned and communicated”\ntop management shall assign the responsibility and authority for:\ne ensuring that the information security management system\nconforms to the requirements of this international standard\ne reporting on the performance of the information security\nmanagement system to top management\nsource: iso/iec 27001 standard second edition\nnote top management may also assign responsibilities for reporting the\nperformance of the information security management system within the organization.\n56\nchapter 3 project kick-off\ncommitment to information', metadata={'doc_ID': 1050, 'original_text': '- management commitment is the driving force of each step you are taking to implement the isms or iso 27001 standard\n- decision makers and implementers will spend most of their time implementing the isms\n- getting their commitment is very important\n- the iso 27001 standard includes clause 5.3, organizational roles, responsibilities, and authorities\n- top management shall ensure that the responsibilities and authorities for roles relevant to information security are assigned and communicated\n- top management shall assign the responsibility and authority for ensuring that the information security management system conforms to the requirements of this international standard\n- top management may also assign responsibilities for reporting the performance of the information security management system within the organization', 'source': 'Chopra, Chaudhary - 2020 - Implementing an Information Security Management System - Security Management Based On ISO 27001.pdf', 'title': 'Implementing an Information Security Management System - Security Management Based On ISO 27001', 'relevance_score': 0.9921233}), Document(page_content=""in isms maintenance\ntrain personnel on common threats facing your organization and how to respond\nestablish disciplinary or sanctions policies or processes for personnel found\nout of compliance with information security requirements\n12\nperform an internal audit\nallocate internal resources with necessary competencies who are independent of\nisms development and maintenance, or engage an independent third party\nverify conformance with requirements from annex a deemed applicable in your\nisms's statement of applicability\nshare internal audit results, including nonconformities, with the isms\ngoverning body and senior management\naddress identified issues before proceeding with the external audit\n13\nundergo external audit of isms to obtain iso 27001 certification\nengage an independent iso 27001 auditor\nconduct stage 1 audit consisting of an extensive documentation review; obtain\nfeedback regarding readiness to move to stage 2 audit\nconduct stage 2 audit consisting of tests performed on the isms to ensure\nproper design, implementation, and ongoing functionality; evaluate fairness,\nsuitability, and effective implementation and operation of controls\n14\naddress any nonconformities\nensure that all requirements of the iso 27001 standard are being addressed\nensure org is following processes that it has specified and documented\nensure org is upholding contractual requirements with third parties\naddress specific nonconformities identified by the iso 27001 auditor\nreceive auditor’s formal validation"", metadata={'description': 'Our ISO 27001 compliance checklist will help simplify your path to compliance.', 'doc_ID': 11, 'language': 'en', 'original_text': ""- establish disciplinary or sanctions policies or processes for personnel found out of compliance with information security requirements\n- perform an internal audit\n- allocate internal resources with necessary competencies who are independent of isms development and maintenance, or engage an independent third party\n- verify conformance with requirements from annex a deemed applicable in your isms's statement of applicability\n- share internal audit results, including nonconformities, with the isms governing body and senior management\n- address identified issues before proceeding with the external audit\n- undergo external audit of isms to obtain iso 27001 certification\n- engage an independent iso 27001 auditor\n- conduct stage 1 audit consisting of an extensive documentation review; obtain feedback regarding readiness to move to stage 2 audit\n- conduct stage 2 audit consisting of tests performed on the isms to ensure proper design, implementation, and ongoing functionality; evaluate fairness, suitability, and effective implementation and operation of controls\n- address any nonconformities\n- ensure that all requirements of the iso 27001 standard are being addressed\n- ensure org is following processes that it has specified and documented\n- ensure org is upholding contractual requirements with third parties\n- address specific nonconformities identified by the iso 27001"", 'source': 'https://www.vanta.com/resources/iso-27001-compliance-checklist', 'title': 'The ISO 27001 compliance checklist', 'relevance_score': 0.99097973})]","To establish responsibilities for compliance with ISO 27001 and monitoring of the ISMS within an organization, the top management should define roles, tasks, and authorities. This should include designating a responsible person for compliance with ISO 27001 and a person for reporting on the performance and effectiveness of the ISMS. Additionally, all roles and responsibilities within the organization should be communicated, for example, through a policy or training events.","Responsibilities for compliance with ISO 27001 and monitoring of the ISMS can be established within an organization by assigning an ISMS owner who is responsible for ensuring compliance with the standard and reporting to top management. This individual should drive the effort forward, identify gaps, implement necessary security controls, and reassess readiness periodically. Top management plays a crucial role in assigning and communicating responsibilities and authorities for information security, ensuring the ISMS conforms to ISO 27001 requirements, and reporting on its performance. Additionally, establishing disciplinary policies for non-compliance, conducting internal audits, engaging independent auditors, and addressing nonconformities are essential steps in achieving ISO 27001 certification and maintaining compliance.",True,0.5280898876404494,0.2045454545454545,0.33707865168539325,0.796943873167038,0.9999666213989258,0.8640050485478143,1.0,0.9509017816318198,1.6330056190490723,3.191534996032715,0.004042625427246094,4.824540615081787
Fine-tuned_finetuned-ISO-27001_1024_l2_All_1536_264_False_Kers,Hybrid_Rerank_Cohere_Compression,8,gpt-3.5-turbo-16k,16385,0,1,What are important components inside an ISMS to manage opportunities and risks according to the topic 6.1 (risk and opportunity management)?,"[Document(page_content=""of these risks and opportunities. * treat the risks and opportunities in a way that is proportionate to the risks involved. * monitor and review the effectiveness of their risk management processes.\nread conducting iso 27001 risk assessment in 7 steps for more information.\n## what does iso 27001 requirement 6.1 cover?\niso 27001 requirement 6.1 covers the following topics:\n * the need to plan for the identification, assessment, and treatment of risks and opportunities to information security. * the need to consider the organisation's context and the needs and expectations of interested parties when planning for risk management. * the need to establish and maintain a risk management process that is appropriate to the organisation's size, complexity, and nature of its activities. * the need to document the risk management process and the results of risk assessments. * the need to review and update the risk management process on a regular basis.\n## how to identify, assess and treat information security risks\nalthough not necessarily common practice — scenario-based risk identification\nand assessment is one of the most effective and well-established ways to\nmanage risks. not only does it consider past occurrences, but it also takes a\npreventive approach to risk management. this is a more holistic approach that\ncovers all potential scenarios.\nstep 1: identify and assess risks\nstep 2: create a treatment plan\nstep 3: review residual risks\n ###"", metadata={'source': 'https://www.dataguard.co.uk/knowledge/iso-27001/clause-6-1-actions-to-address-risks-and-opportunities/', 'title': 'ISO 27001 Clause 6.1: Information security objectives', 'description': ""Understand ISO 27001 clause 6.1: Detailing how security objectives align with an organisation's business goals for robust information protection."", 'language': 'en-gb', 'original_text': ""- the need to plan for the identification, assessment, and treatment of risks and opportunities to information security.\n- the need to consider the organisation's context and the needs and expectations of interested parties when planning for risk management.\n- the need to establish and maintain a risk management process that is appropriate to the organisation's size, complexity, and nature of its activities.\n- the need to document the risk management process and the results of risk assessments.\n- the need to review and update the risk management process on a regular basis.\n- step 1: identify and assess risks\n- step 2: create a treatment plan\n- step 3: review residual risks"", 'doc_ID': 225, 'relevance_score': 0.98054343}), Document(page_content='27001 risk assessment.\n## 6\\. risk management\nrisk management is a core part of any isms. after all, it’s no good\nidentifying and prioritising information security threats if you’re unable to\ndeal with them effectively.\nthis stage isn’t about managing risks themselves but establishing how you’ll\napproach the task. there are several ways you can do this, but most methods\ninvolve looking at risks to specific assets or risks presented in specific\nscenarios.\nhowever you go about the task, the risk assessment process is crucial. after\nidentifying, evaluating and assigning values to your threats, you’ll know\nwhich risks pose the biggest problem.\nyou should take those and determine whether to:\n * treat the risk by applying information security controls laid out in iso 27001; * terminate the risk by avoiding it entirely;\n * share the risk (with an insurance policy or via an agreement with other parties); or\n * accept the risk (if it doesn’t pose a significant threat).\nany risks that you treat should be documented in an soa (statement of\napplicability). this should explain which of the standard’s controls you’ve\nselected and omitted and why you made those choices.\n## 7\\. implement the risk treatment plan\nnow it’s time to implement your risk treatment plan. to ensure these controls\nare effective, you will need to check that staff are able to operate or\ninteract with the controls, and that they are aware of their information\nsecurity obligations.\nyou will also need to develop a process to determine,', metadata={'description': 'ISO 27001 explains the compliance requirements you need to meet, but it doesn’t show you how to implement them.\xa0This blog fills in what you need to know', 'doc_ID': 33, 'language': 'en-GB', 'original_text': '- 6. risk management\n- risk assessment process\n- identifying, evaluating and assigning values to your threats\n- treat the risk by applying information security controls laid out in iso 27001\n- terminate the risk by avoiding it entirely\n- share the risk (with an insurance policy or via an agreement with other parties)\n- accept the risk (if it doesn’t pose a significant threat)\n- any risks that you treat should be documented in an soa (statement of applicability)\n- 7. implement the risk treatment plan', 'source': 'https://www.itgovernance.eu/blog/en/a-9-step-guide-to-implementing-iso-27001', 'title': 'How to Implement ISO 27001: A 9-Step Guide - IT Governance Blog En', 'relevance_score': 0.9769787}), Document(page_content='not a one-off activity\nsolely during implementation.\n3.7 clause 6 planning\nrelevant toolkit documents\ne information security objectives and plan\ne risk assessment and treatment process\n page 27 of 79\niso/iec 27001 implementation guide\ne risk assessment report\ne risk treatment plan\ne isms change process\ne isms change log\ne asset-based risk assessment and treatment tool\ne statement of applicability\ne scenario-based risk assessment and treatment tool\ne opportunity assessment tool\noptional add-on (available at additional cost via our website)\ne {18027001 statement of applicability (full 1so-text version)\nnote: the above option is part of the /so27001 enhanced gap assessment tool.\n3.7.1 clause 6.1 actions to address risks and opportunities\nthe general ethos of the iso/iec 27001 standard is to be proactive in managing information\nsecurity and a central concept to this is risk assessment. this involves considering what\ncould go wrong and then taking steps to do something about it in advance rather than\nwaiting for it to happen. the standard points out that not everything that happens is\nnecessarily negative and that there may be positive “opportunities” along the way too.\nthe whole idea of a risk-based approach is that the amount you spend on controls is\nappropriate to your level of risk and takes account of how much risk you are prepared to\nlive with. risk is very much a spectrum as the wider debate on “privacy versus security”\nshows and your organization will need to take a considered approach to', metadata={'source': 'CERTIKIT_ISO27001_Implementation_Guide_v12.pdf.pdf', 'title': 'CERTIKIT_ISO27001_Implementation_Guide_v12.pdf', 'original_text': '- 3.7 clause 6 planning\n- e risk assessment and treatment process\n- page 27 of 79\n- iso/iec 27001 implementation guide\n- e risk assessment report\n- e risk treatment plan\n- 3.7.1 clause 6.1 actions to address risks and opportunities\n- the general ethos of the iso/iec 27001 standard is to be proactive in managing information security and a central concept to this is risk assessment.\n- the standard points out that not everything that happens is necessarily negative and that there may be positive “opportunities” along the way too.\n- the whole idea of a risk-based approach is that the amount you spend on controls is appropriate to your level of risk and takes account of how much risk you are prepared to live with.', 'doc_ID': 878, 'relevance_score': 0.9687381}), Document(page_content='in its entirety. therefore, the method of announcement should be documented and its execution recorded!\nit is easy to see: the management of responsibilities (roles, authorities, personnel assignment, if necessary further training) is an important process in the isms.\nconclusion on the standard chapter isms-5\nthis standard chapter places requirements on the management level of the organization regarding information security to demonstrate good leadership and to actively participate in the processes of the isms to a significant extent. in other words, without intensive involvement of the management level, an isms is unlikely to be successful.\nthe management of the policy and responsibilities are to be mentioned here as processes of the isms: the requirements from section 1.4 on the keywords processes and isms and scope apply to them.\nachieve, unwanted effects\non the organization can be avoided (at least reduced) - and the isms is continuously\nimproved.\nwhat does the term ""chances"" mean here:\nwhile risks can have negative effects on the organization, chances are factors that can have a positive impact on the organization. in principle, both directions should be considered in all analyses. however, in the further requirements from isms-6.1.2 onwards, only risks are mentioned. this corresponds to common practice. therefore, our explanations in section 1.4 on the topic of risks do not explicitly address chances either. however, if you still want to consider chances explicitly in the analyses - no problem:', metadata={'source': 'ISO 27001_2022_Kersten_und_Schroeder.pdf', 'title': 'ISO 27001_2022_Kersten_und_Schroeder', 'original_text': '- the management of responsibilities (roles, authorities, personnel assignment, if necessary further training) is an important process in the isms.\n- the management of the policy and responsibilities are to be mentioned here as processes of the isms: the requirements from section 1.4 on the keywords processes and isms and scope apply to them.\n- achieve, unwanted effects on the organization can be avoided (at least reduced) - and the isms is continuously improved.\n- while risks can have negative effects on the organization, chances are factors that can have a positive impact on the organization. in principle, both directions should be considered in all analyses.', 'doc_ID': 2617, 'relevance_score': 0.94938856}), Document(page_content='# iso 27001 clause 6.1: actions to address risks and opportunities\nclause 6.1 of iso 27001 is titled ""actions to address risks and\nopportunities"". this clause requires organisations to plan how they will\nidentify, assess, and treat risks and opportunities to their information\nsecurity.\n### iso 27001 clause 6.1. planning general\nwhen planning for the information security management system, the organisation\nshall consider the issues referred to in 4.1 and the requirements referred to\nin 4.2 and determine the risks and opportunities that need to be addressed to:\n * ensure the information security management system can achieve its intended outcome(s);\n * prevent or reduce, undesired effects\n * achieve continual improvement.\nthe organisation shall plan:\n * actions to address these risks and opportunities; and\n * how to * integrate and implement these actions into its information security management system processes; and\n * evaluate the effectiveness of these actions. ## what is the 6.1 clause of iso 27001?\nthe 6.1 clause of iso 27001 is one of the most important clauses in the\nstandard. it requires organisations to:\n * identify the risks and opportunities to their information security. * assess the likelihood and impact of these risks and opportunities. * treat the risks and opportunities in a way that is proportionate to the risks involved. * monitor and review the effectiveness of their risk management processes.\nread conducting iso 27001 risk assessment', metadata={'source': 'https://experta.com/shared-post/cbe4cc65-0d87-4467-a9dd-d7104e073e17', 'title': 'Experta', 'language': 'No language found.', 'original_text': '- Clause 6.1 of ISO 27001 titled ""actions to address risks and opportunities""\n- Planning for the information security management system\n- Risks and opportunities that need to be addressed\n- Actions to address these risks and opportunities\n- How to integrate and implement these actions into its information security management system processes\n- Evaluate the effectiveness of these actions', 'doc_ID': 361, 'relevance_score': 0.9328214}), Document(page_content='certain circumstances so if these don’t\napply to your organization (or your isms scope) then it is acceptable to state that you are\nnot implementing them. examples might be that control! a.6.7 remote working may not\napply if you have no remote workers or control! a.8.28 secure coding may not be relevant if\nno software development takes place.\nthe key point to remember in treating risk is that it is a trade-off. few organizations have\nlimitless funds and so the money spent in treating risk needs to result in a larger benefit\nthan the cost. there are many ways of performing this kind of “quantitative” analysis so that\nthe potential loss from a risk can be expressed in financial terms. the methods used in the\ntoolkit are “qualitative” in that they simply categorize the risks; if your organization wishes\nto use more detailed quantitative methods to assess risk loss against cost of treatment then\nthat is perfectly acceptable within the iso/iec 27001 standard.\ndon’t forget to consider the positive aspects of risk i.e. opportunities. the standard requires\nthat these are considered, so that you’re as ready as possible if some good news comes your\nway. the opportunity assessment tool provides a way to document and assess these, with\nresulting preparation actions.\n3.7.2 clause 6.2 information security objectives and planning to achieve\nthem\nwithin the planning section of the standard we need to set out what the isms is intended to\nachieve and how it will be done. in terms of the isms there are two main levels', metadata={'doc_ID': 883, 'original_text': '- ""treating risk is that it is a trade-off""\n- ""the methods used in the toolkit are “qualitative” in that they simply categorize the risks""\n- ""don’t forget to consider the positive aspects of risk i.e. opportunities""\n- ""the standard requires that these are considered""\n- ""the opportunity assessment tool provides a way to document and assess these, with resulting preparation actions""\n- ""clause 6.2 information security objectives and planning to achieve them""\n- ""within the planning section of the standard we need to set out what the isms is intended to achieve and how it will be done""', 'source': 'CERTIKIT_ISO27001_Implementation_Guide_v12.pdf.pdf', 'title': 'CERTIKIT ISO27001 Implementation Guide_v12', 'relevance_score': 0.93033177}), Document(page_content='figure 7.\ngisk assessmey ,\nri\n. \\%\nes\nsk management and treat\nfigure 7: risk management and the pdca cycle\nmore accurately, we should say that risk assessment always\nfalls totally within the ‘plan’ stage of the isms project cycle,\nand that some of the risk management, — in fact, the majority\nof the decision-making around control objectives and\ncontrols — is also within this stage, as that is what informs the\nrisk treatment plan and the organisation’s statement of\napplicability (soa).”? these, in turn, inform further the\noperational structure and content of the isms, which\n23 iso 27001, clause 6.1.3.\n32\n3: risk management objectives\nimplements and manages the controls that bring the\nidentified risks within an acceptable level.\nthe risk assessment, of course, also provides the\norganisation with a baseline for improvement. the extent to\nwhich this baseline is useful depends on whether you have\nconducted the risk assessment in light of the controls that are\nalready in place, or on the basis that no controls are applied.\nboth approaches have benefits, and we will return to their\npros and cons later.\nrisk assessment is, in conclusion, the key activity required\nduring the planning stage of the isms project — regardless of\nthe process model you adopt and whatever name it assigns to\nthe planning stage. every single control that is to be\nimplemented will be selected on the basis of the risk\nassessment, and the risk assessment must be completed\nbefore any controls are implemented. risk assessment is also\nan', metadata={'doc_ID': 700, 'original_text': '- figure 7: risk management and the pdca cycle\n- iso 27001, clause 6.1.3.\n- 3: risk management objectives\n- the risk assessment, of course, also provides the organisation with a baseline for improvement.\n- risk assessment is, in conclusion, the key activity required during the planning stage of the isms project', 'source': 'Calder - 2019 - Information Security Risk Management for ISO 27001.pdf', 'title': 'Information Security Risk Management for ISO 27001', 'relevance_score': 0.9269676}), Document(page_content='is designed exactly to ensure this level of\ncoordination.\n45\n3: risk management objectives\nmedium\n=\nan\nde\nlikelihood\nvery low low\nimpact\nfigure 5: risk tolerance or acceptance: criteria applied\nconsistently across all activities\ninformation security risk management objectives\nnist’s sp 800-30, guide for conducting risk assessments,\nis consistent with the erm frameworks we have been\ndiscussing and is also reflected, as we shall see, in iso\n27001. it establishes four components of risk management:\nframing risk, assessing risk, responding to risk and\nmonitoring risk. it states that the purpose of framing risk is\nto: “produce a risk management strategy that addresses how\norganizations intend to assess risk, respond to risk, and\nmonitor risk—making explicit and transparent the risk\nperceptions that organizations routinely use in making both\ninvestment and operational decisions. the risk management\nstrategy establishes a foundation for managing risk and\ndelineates the boundaries for risk-based decisions within\norganizations.”\nin essence, one might say that an organisation’s risk\nmanagement objective is to ensure that there is a proper\nbalance of safeguards against the risks of failing to meet\n46\n3: risk management objectives\nbusiness objectives: neither too much nor too little.2* by\nextension, the risk management objective for an isms is to\nlimit risk to an acceptable level across all information assets\nfor all information security risks.\ninformation security controls and return on', metadata={'doc_ID': 693, 'original_text': 'nist’s sp 800-30, guide for conducting risk assessments,\nis consistent with the erm frameworks we have been\ndiscussing and is also reflected, as we shall see, in iso\n27001. it establishes four components of risk management:\nframing risk, assessing risk, responding to risk and\nmonitoring risk. it states that the purpose of framing risk is\nto: “produce a risk management strategy that addresses how\norganizations intend to assess risk, respond to risk, and\nmonitor risk—making explicit and transparent the risk\nperceptions that organizations routinely use in making both\ninvestment and operational decisions. the risk management\nstrategy establishes a foundation for managing risk and\ndelineates the boundaries for risk-based decisions within\norganizations.”\nin essence, one might say that an organisation’s risk\nmanagement objective is to ensure that there is a proper\nbalance of safeguards against the risks of failing to meet\n46\n3: risk management objectives\nbusiness objectives: neither too much nor too little.2* by\nextension, the risk management objective for an isms is to\nlimit risk to an acceptable level across all information assets\nfor all information security risks.', 'source': 'Calder - 2019 - Information Security Risk Management for ISO 27001.pdf', 'title': 'Information Security Risk Management for ISO 27001', 'relevance_score': 0.9159594})]","Important ISMS components for managing opportunities and risks according to Theme 6.1 include:

Compliance Management: Capturing and fulfilling conditions and expectations, including determining measures and regular updates.

Risk management: Identifying, assessing, and treating risks, with repeated steps until acceptance.

Asset management: Capturing and updating the organization's information values.

Process landscape and security analysis: Structuring business activities as a process landscape, securing processes, including IT components.
Continuous improvement: Integrating the goal of continuous improvement, e.g., through the PDCA model.

These components are fundamental to the ISMS and meet the requirements of Section 6.1. Planning often results in documents such as the ISMS guideline or ISMS description.","Important components inside an ISMS to manage opportunities and risks according to the topic 6.1 (risk and opportunity management) include:

1. Establishing a risk management process appropriate to the organization's size, complexity, and nature of activities.
2. Documenting the risk management process and the results of risk assessments.
3. Regularly reviewing and updating the risk management process.
4. Identifying and assessing risks.
5. Creating a treatment plan for identified risks.
6. Reviewing residual risks.
7. Treating risks by applying information security controls outlined in ISO 27001.
8. Terminating risks by avoiding them.
9. Sharing risks through insurance policies or agreements.
10. Accepting risks that do not pose significant threats.
11. Documenting treated risks in a Statement of Applicability (SOA).
12. Implementing",True,0.45689655172413796,0.11304347826086956,0.23275862068965517,0.585879098623991,0.9999665021896362,0.7695601882363146,0.8,0.998618116714614,1.9390432834625244,2.9026236534118652,0.001999378204345703,4.84166693687439
Fine-tuned_finetuned-ISO-27001_1024_l2_All_1536_264_False_Kers,Hybrid_Rerank_Cohere_Compression,8,gpt-3.5-turbo-16k,16385,0,1,How can risks for an ISMS be classified and treated using criteria?,"[Document(page_content='and officially implemented by the top management of the organization.\nin norm point a), the issue of maintenance is addressed: the specified criteria, classes, levels, and rules are to be periodically reviewed for meaningfulness, applicability, and suitability for the organization and, if necessary, adjusted.\nit is evident that the management of criteria for risk assessment is an important subprocess within the isms.\njust to clarify: the requirements of the standard at this point should not be understood as requiring the risk assessment for the organization to be already carried out - rather, it is about defining, announcing, and implementing an appropriate procedure. practical application is only required in nk 8.\nsection 6.1(3) - measures for dealing with risks and opportunities - risk treatment\nsimilar to the previous standard section, the focus here is on the risk treatment process, which needs to be designed, announced, and ultimately implemented.\nrequirements for such a process are specified: initially, a division of risk treatment into options (requirement a) and actions (requirement b) is made.\nthe process should involve selecting a fundamental option for treating each identified risk. typical examples include:\n* acceptance of the risk without further action\n* elimination of the risk, e.g., by modifying or discontinuing the relevant business process\n* transfer of the risk to a service provider\n* securing the risk through insurance\n* reducing the risk by choosing appropriate measures\noptions', metadata={'doc_ID': 3182, 'original_text': '- section 6.1(3) - measures for dealing with risks and opportunities - risk treatment\n- similar to the previous standard section, the focus here is on the risk treatment process, which needs to be designed, announced, and ultimately implemented.\n- requirements for such a process are specified: initially, a division of risk treatment into options (requirement a) and actions (requirement b) is made.\n- the process should involve selecting a fundamental option for treating each identified risk. typical examples include:\n* acceptance of the risk without further action\n* elimination of the risk, e.g., by modifying or discontinuing the relevant business process\n* transfer of the risk to a service provider\n* securing the risk through insurance\n* reducing the risk by choosing appropriate measures\n- options', 'source': 'Kersten et al. - 2020 - IT-Sicherheitsmanagement nach der neuen ISO 27001_removed.pdf', 'title': 'Kersten et al. - 2020 - IT-Sicherheitsmanagement nach der neuen ISO 27001_removed', 'relevance_score': 0.99115264}), Document(page_content='27001 risk assessment.\n## 6\\. risk management\nrisk management is a core part of any isms. after all, it’s no good\nidentifying and prioritising information security threats if you’re unable to\ndeal with them effectively.\nthis stage isn’t about managing risks themselves but establishing how you’ll\napproach the task. there are several ways you can do this, but most methods\ninvolve looking at risks to specific assets or risks presented in specific\nscenarios.\nhowever you go about the task, the risk assessment process is crucial. after\nidentifying, evaluating and assigning values to your threats, you’ll know\nwhich risks pose the biggest problem.\nyou should take those and determine whether to:\n * treat the risk by applying information security controls laid out in iso 27001; * terminate the risk by avoiding it entirely;\n * share the risk (with an insurance policy or via an agreement with other parties); or\n * accept the risk (if it doesn’t pose a significant threat).\nany risks that you treat should be documented in an soa (statement of\napplicability). this should explain which of the standard’s controls you’ve\nselected and omitted and why you made those choices.\n## 7\\. implement the risk treatment plan\nnow it’s time to implement your risk treatment plan. to ensure these controls\nare effective, you will need to check that staff are able to operate or\ninteract with the controls, and that they are aware of their information\nsecurity obligations.\nyou will also need to develop a process to determine,', metadata={'description': 'ISO 27001 explains the compliance requirements you need to meet, but it doesn’t show you how to implement them.\xa0This blog fills in what you need to know', 'doc_ID': 33, 'language': 'en-GB', 'original_text': '- risk management is a core part of any isms\n- this stage isn’t about managing risks themselves but establishing how you’ll approach the task\n- the risk assessment process is crucial\n- identifying, evaluating and assigning values to your threats\n- you’ll know which risks pose the biggest problem\n- treat the risk by applying information security controls laid out in iso 27001\n- terminate the risk by avoiding it entirely\n- share the risk (with an insurance policy or via an agreement with other parties)\n- accept the risk (if it doesn’t pose a significant threat)\n- any risks that you treat should be documented in an soa (statement of applicability)\n- implement your risk treatment plan\n- ensure these controls are effective\n- check that staff are able to operate or interact with the controls\n- develop a process to determine', 'source': 'https://www.itgovernance.eu/blog/en/a-9-step-guide-to-implementing-iso-27001', 'title': 'How to Implement ISO 27001: A 9-Step Guide - IT Governance Blog En', 'relevance_score': 0.9803562}), Document(page_content='of the procedure, its good or easy applicability, the specific definition of criteria, classes, and levels - taking into account previous experiences.\nisms-6.1.3 - information security risk treatment\nnow we come to the question of risk treatment. the standard proposes a structured approach with the following steps (a) to (f).\n(a) for each risk assessed according to isms-6.1, a fundamental treatment option should be selected.\nin section 1.4 (keyword risk treatment), we have discussed the classic examples of such options in more detail, so we will only list them briefly here.\n- acceptance: the risk in question is accepted without any further measures.\n- transfer: a risky activity is transferred to a safer location or, for example, to a qualified service provider.\n- mitigation: the risk is addressed through measures within the organization. the measures can come from all areas (organizational, personnel, infrastructure, technology).\n- restructuring or reconstruction: a risky process is appropriately restructured or reconstructed - with the aim of replacing the questionable components or involved assets with those with lower risks.\n- termination: the decision is made to completely terminate a particularly critical business process.\nin the context of a real isms, of course, additional treatment options may be available. it also happens that one or the other option from our list is excluded by the organization - e.g. outsourcing to a service provider - due to high security concerns or high costs.\ntherefore,', metadata={'doc_ID': 2623, 'original_text': '- isms-6.1.3 - information security risk treatment\n- the standard proposes a structured approach with the following steps (a) to (f).\n- (a) for each risk assessed according to isms-6.1, a fundamental treatment option should be selected.\n- in section 1.4 (keyword risk treatment), we have discussed the classic examples of such options in more detail, so we will only list them briefly here.\n- acceptance: the risk in question is accepted without any further measures.\n- transfer: a risky activity is transferred to a safer location or, for example, to a qualified service provider.\n- mitigation: the risk is addressed through measures within the organization. the measures can come from all areas (organizational, personnel, infrastructure, technology).\n- restructuring or reconstruction: a risky process is appropriately restructured or reconstructed - with the aim of replacing the questionable components or involved assets with those with lower risks.\n- termination: the decision is made to completely terminate a particularly critical business process.', 'source': 'ISO 27001_2022_Kersten_und_Schroeder.pdf', 'title': 'ISO 27001 2022', 'relevance_score': 0.9789956}), Document(page_content='planning is of course also to be documented and usually leads to a document entitled [sms guideline or isms description. the above enumeration points (subprocesses of the isms) basically represent an initial structure of such a document.\nespecially in larger organizations, it should be ensured that the subprocesses to be designed in the isms are aligned with procedures from other areas of the organization to limit costs and effort. for this purpose, the aforementioned topics such as compliance management, asset management, risk management are\nwell-suited; these tasks are usually already performed at other points in the organization for a more general context. it should be considered whether the methods used there can be transferred to and adapted for information processing. there are also opportunities in this...\nthe following norm sections deal with the three central subtasks of risk assessment, risk treatment, and implementation planning.\nna 6.1(2) - measures for dealing with risks and opportunities -\nrisk assessment\nthis section examines the process of risk assessment and refers in norm point a to criteria to be defined. what does that mean?\n1. criteria by which risks can be classified: usually risk classes are introduced for this - hierarchical classes (e.g. ordered by risk level) or non-hierarchical classes (e.g. a distinction based on financial and image damage). such classes serve to group risks and make it easier to assess the risk situation of an organization. at least within hierarchical', metadata={'doc_ID': 3179, 'original_text': '- ""the above enumeration points (subprocesses of the isms) basically represent an initial structure of such a document.""\n- ""the aforementioned topics such as compliance management, asset management, risk management are well-suited; these tasks are usually already performed at other points in the organization for a more general context.""\n- ""the following norm sections deal with the three central subtasks of risk assessment, risk treatment, and implementation planning.""\n- ""this section examines the process of risk assessment and refers in norm point a to criteria to be defined.""\n- ""1. criteria by which risks can be classified: usually risk classes are introduced for this - hierarchical classes (e.g. ordered by risk level) or non-hierarchical classes (e.g. a distinction based on financial and image damage).""', 'source': 'Kersten et al. - 2020 - IT-Sicherheitsmanagement nach der neuen ISO 27001_removed.pdf', 'title': 'Kersten et al. - 2020 - IT-Sicherheitsmanagement nach der neuen ISO 27001_removed', 'relevance_score': 0.9787533}), Document(page_content='are assessed in terms of their impact on the organization.\nthis is usually done in the form of rating levels with descriptive names such as tolerable, moderate, serious, catastrophic. based on the above risk table, a rating of entire risk classes can be made by marking individual fields (see figure 1.8), and the assessment of individual risks can be done in a similar way.\nrisks can be individually adjusted afterwards.\nthe three steps of risk identification, risk analysis, and risk evaluation are summarized in the standard as risk assessment.\nrisk level\n(1 negligible\noo limited\noc critical\ndamage class\ngb catastrophic\nfig.1.8 risk assessment\n24 1 the iso/iec 27000 series of standards and their basic concepts\n18. risk treatment\nrisks must be prioritized for processing and treated with appropriate measures.\nif risks are sorted according to their risk level, a natural order of processing emerges: risks with the highest level are processed first, then those of the second level, etc. at the lowest level, it should be considered whether there is anything to be processed at all: the term tolerable says it all - at least in our example.\nfor the treatment of risks, a treatment option is first requested. the classic options are:\ne acceptance: the risk in question is accepted without further measures. this may be justified by the acceptance criteria according to isms-6.1.2 point (a) - or, for example, the management level has decided to accept the risk in individual cases. such a management decision may also', metadata={'doc_ID': 2570, 'original_text': '- ""risks can be individually adjusted afterwards.""\n- ""the three steps of risk identification, risk analysis, and risk evaluation are summarized in the standard as risk assessment.""\n- ""risks must be prioritized for processing and treated with appropriate measures.""\n- ""if risks are sorted according to their risk level, a natural order of processing emerges: risks with the highest level are processed first, then those of the second level, etc.""\n- ""for the treatment of risks, a treatment option is first requested.""', 'source': 'ISO 27001_2022_Kersten_und_Schroeder.pdf', 'title': 'ISO 27001 2022', 'relevance_score': 0.9565531}), Document(page_content='certain circumstances so if these don’t\napply to your organization (or your isms scope) then it is acceptable to state that you are\nnot implementing them. examples might be that control! a.6.7 remote working may not\napply if you have no remote workers or control! a.8.28 secure coding may not be relevant if\nno software development takes place.\nthe key point to remember in treating risk is that it is a trade-off. few organizations have\nlimitless funds and so the money spent in treating risk needs to result in a larger benefit\nthan the cost. there are many ways of performing this kind of “quantitative” analysis so that\nthe potential loss from a risk can be expressed in financial terms. the methods used in the\ntoolkit are “qualitative” in that they simply categorize the risks; if your organization wishes\nto use more detailed quantitative methods to assess risk loss against cost of treatment then\nthat is perfectly acceptable within the iso/iec 27001 standard.\ndon’t forget to consider the positive aspects of risk i.e. opportunities. the standard requires\nthat these are considered, so that you’re as ready as possible if some good news comes your\nway. the opportunity assessment tool provides a way to document and assess these, with\nresulting preparation actions.\n3.7.2 clause 6.2 information security objectives and planning to achieve\nthem\nwithin the planning section of the standard we need to set out what the isms is intended to\nachieve and how it will be done. in terms of the isms there are two main levels', metadata={'doc_ID': 883, 'original_text': '- the key point to remember in treating risk is that it is a trade-off. few organizations have\nlimitless funds and so the money spent in treating risk needs to result in a larger benefit\nthan the cost.\n- there are many ways of performing this kind of “quantitative” analysis so that\nthe potential loss from a risk can be expressed in financial terms.\n- the methods used in the toolkit are “qualitative” in that they simply categorize the risks; if your organization wishes\nto use more detailed quantitative methods to assess risk loss against cost of treatment then\nthat is perfectly acceptable within the iso/iec 27001 standard.\n- don’t forget to consider the positive aspects of risk i.e. opportunities.\n- the standard requires that these are considered, so that you’re as ready as possible if some good news comes your\nway.\n- the opportunity assessment tool provides a way to document and assess these, with\nresulting preparation actions.\n- 3.7.2 clause 6.2 information security objectives and planning to achieve\nthem\n- within the planning section of the standard we need to set out what the isms is intended to\nachieve and how it will be done.', 'source': 'CERTIKIT_ISO27001_Implementation_Guide_v12.pdf.pdf', 'title': 'CERTIKIT ISO27001 Implementation Guide_v12', 'relevance_score': 0.9494823}), Document(page_content='this evaluation, the standard refers to point (a), which, however, only mentions acceptance criteria. therefore, rating levels should be introduced initially for the evaluation and assign an appropriate level to each analyzed risk in order to characterize its significance for the organization (see also section 1.4).\nfor prioritization, the usual approach is to treat the highest rated risks first - then progressively go lower, at least until the first level where risk acceptance applies. from there, there is nothing more to ""treat,"" so the remaining risks should no longer be considered in the prioritization.\nthe procedure for risk assessment and prioritization must be documented and consistently applied later. if another described procedure is used elsewhere, a reference to the source is sufficient for documentation.\nguidance for implementing isms-6.1\nbefore selecting or even developing specific risk assessment procedures, it should be checked whether there are already corresponding procedures within the organization at another location (e.g. enterprise-wide risk management): in any case, using them for information security would be the best solution. such procedures could possibly be ""improved"" for information security through some extensions or specializations, but would still be compatible with the procedures already used in the organization.\nif one decides to apply the risk assessment procedure outlined in section 1.4, it should be noted that it still has a number of degrees of freedom that can be', metadata={'doc_ID': 2621, 'original_text': '- ""the standard refers to point (a), which, however, only mentions acceptance criteria.""\n- ""rating levels should be introduced initially for the evaluation and assign an appropriate level to each analyzed risk in order to characterize its significance for the organization (see also section 1.4).""\n- ""for prioritization, the usual approach is to treat the highest rated risks first - then progressively go lower, at least until the first level where risk acceptance applies.""\n- ""the procedure for risk assessment and prioritization must be documented and consistently applied later.""\n- ""guidance for implementing isms-6.1""\n- ""before selecting or even developing specific risk assessment procedures, it should be checked whether there are already corresponding procedures within the organization at another location (e.g. enterprise-wide risk management): in any case, using them for information security would be the best solution.""\n- ""if one decides to apply the risk assessment procedure outlined in section 1.4, it should be noted that it still has a number of degrees of freedom that can be""', 'source': 'ISO 27001_2022_Kersten_und_Schroeder.pdf', 'title': 'ISO 27001 2022', 'relevance_score': 0.94035304}), Document(page_content='classes (e.g. ordered by risk level) or non-hierarchical classes (e.g. a distinction based on financial and image damage). such classes serve to group risks and make it easier to assess the risk situation of an organization. at least within hierarchical classes, risks can be sorted by their ""level,"" making them comparable.\n2. criteria for evaluating risks or risk classes: knowing which class a risk belongs to is only the first step. after that, it needs to be assessed what impact a risk has on the organization: is it negligible or tolerable, or - at the other extreme - catastrophic? there will be several more gradations in between. in short: we need (hierarchical) evaluation levels. instead of focusing on individual risks, they can directly relate to a whole risk class. the evaluation levels can also establish a priority for treating risks - first the risks of the highest level, then the second highest level, and so on.\n3. finally, procedural rules are needed: in the lowest evaluation level (type tolerable), one probably does nothing at all, i.e. risks evaluated like this are simply accepted - an example of a risk acceptance rule. for the highest class (type catastrophic), besides informing the management directly, it might be required that the corresponding risks must be reduced by (at least) one level in any case. for the levels between these two extremes, there will be other procedural rules: e.g. options for further risk treatment (shifting risks to a service provider?) or a preference for certain types', metadata={'doc_ID': 3180, 'original_text': '- classes (e.g. ordered by risk level) or non-hierarchical classes (e.g. a distinction based on financial and image damage). such classes serve to group risks and make it easier to assess the risk situation of an organization.\n- criteria for evaluating risks or risk classes: knowing which class a risk belongs to is only the first step.\n- we need (hierarchical) evaluation levels.\n- the evaluation levels can also establish a priority for treating risks - first the risks of the highest level, then the second highest level, and so on.\n- finally, procedural rules are needed.', 'source': 'Kersten et al. - 2020 - IT-Sicherheitsmanagement nach der neuen ISO 27001_removed.pdf', 'title': 'Kersten et al. - 2020 - IT-Sicherheitsmanagement nach der neuen ISO 27001_removed', 'relevance_score': 0.93257624})]","Risks for an ISMS can be classified and addressed according to established criteria. The criteria include:

Classification:
Hierarchical Classes: Risks can be categorized into hierarchical classes, for example, based on the magnitude of the risk.

Non-hierarchical Classes: Alternatively, non-hierarchical classes can be introduced, such as distinguishing between financial and reputation damages.

Evaluation:
After classification, it is crucial to assess the impact of a risk on the organization. This involves introducing hierarchical evaluation levels ranging from negligible or tolerable to catastrophic.

Risk Treatment:
Risk acceptance rules for tolerable risks.
Measures for extreme risks, including direct communication with the leadership.

Options for treating risks between extremes, such as outsourcing to service providers or preferences for specific types of measures.
The specific details of these criteria, classes, levels, and rules are the responsibility of each organization.","Risks for an ISMS can be classified and treated using criteria by initially dividing risk treatment into options and actions. The process involves selecting a fundamental option for treating each identified risk, such as acceptance, elimination, transfer, securing, or reducing the risk. These options should be documented in a Statement of Applicability (SOA). Risks can be prioritized based on their level, with higher risks being treated first. Criteria for evaluating risks or risk classes include hierarchical evaluation levels to establish a priority for treating risks. Procedural rules should be in place to ensure the risk treatment process is consistently applied. It is important to consider both negative risks and positive aspects, such as opportunities, in the risk treatment process. The ISO 27001 standard allows for both qualitative and quantitative methods to assess risk and determine the cost of treatment.",True,0.5036496350364963,0.16176470588235295,0.24817518248175183,0.38300476875156164,0.9999665021896362,0.7856929738406633,1.0,0.8070894378321899,3.449054718017578,3.1963999271392822,0.004002094268798828,6.64545464515686
Fine-tuned_finetuned-ISO-27001_1024_l2_All_1536_264_False_Kers,Hybrid_Rerank_Cohere_Compression,8,gpt-3.5-turbo-16k,16385,0,1,"How is the selection of measures for implementing risk treatment conducted, and what requirements should be considered and documented according to ISO 27001?","[Document(page_content='or to engage a\nconsultant. 3. **involve management properly and early** a management framework defines all the procedures an organization must\nimplement to achieve its iso 27001 implementation goals. accountability,\nspecifying who in management is responsible for the isms, a schedule of all\nactivities, and regular isms reviews for effectiveness are mechanisms\ncyclically ensuring isms improvement. 4. **conduct a risk assessment** while iso 27001 requires a formal risk assessment, it does not prescribe a\nmethodology. ""formal"" implies that the risk assessment approach is planned in\nadvance, and the associated data, analyses, and results are documented. 5. **implement risk treatment measures** it is the organization\'s task to determine how to proceed with the identified\nrisks. should they be avoided, transferred, accepted, or mitigated? all\ndecisions made for risk treatment must be documented. during a registration or\ncertification audit, an auditor will want to see this documentation. if you\nchoose to mitigate risks, it is crucial to implement the measures, based on\niso 27002 controls, for example. 6. **review and update the related documentation** documentation is one of the requirements you cannot bypass with iso 27001. you\nmust document all processes, rules, and procedures related to your isms to\nensure their appropriate implementation. the norm requires documentation of\nthe following aspects: * understanding the organization and its context (e.g.,', metadata={'description': 'Discover the comprehensive guide to ISO 27001: Detailed insight into achieving and maintaining this essential information security standard. Explore its critical role in risk management, compliance and robust security practices, and learn step-by-step implementation techniques.', 'doc_ID': 175, 'language': 'en-gb', 'original_text': 'involve management properly and early, conduct a risk assessment, implement risk treatment measures, review and update the related documentation', 'source': 'https://www.dataguard.co.uk/knowledge/iso-27001/', 'title': 'What is ISO 27001? Key Information at a Glance', 'relevance_score': 0.9977569}), Document(page_content='information security risk treatment is the process of selecting and\nimplementing controls to reduce the likelihood and impact of information\nsecurity risks. it is an essential part of any information security management\nsystem (isms) and is required by the iso 27001 standard.\nclause 8.3 of iso 27001 requires organisations to implement the information\nsecurity risk treatment plan and retain documented information on the results\nof that risk treatment.\nthis means that organisations must have a plan in place for how they will\naddress the risks that have been identified, and they must keep records of how\nthey have implemented that plan.\nhere are some of the things that are involved in requirement 8.3:\n * identifying and assessing risks * developing and implementing risk treatment plans * monitoring and reviewing the effectiveness of risk treatment plans * retaining documented information on the results of risk treatment\norganisations can use a variety of methods to implement requirement 8.3, such\nas:\n * using a risk management framework such as iso 27005 * using a risk management software tool * hiring a consultant to help with risk management\n## what is the information risk treatment plan?\nan information risk treatment plan (irtp) is a document that outlines how an\norganisation will manage and treat the information security risks that have\nbeen identified through its risk assessment process. the irtp should include\nthe following:\n * a list of all identified', metadata={'source': 'https://www.dataguard.co.uk/knowledge/iso-27001/clause-8-3-information-security-risk-treatment/', 'title': 'ISO 27001 Clause 8.3: Information security risk treatment', 'description': 'Learn how to implement the ISO 27001 information security risk treatment plan and reduce the likelihood and impact of information security risks.', 'language': 'en-gb', 'original_text': '- information security risk treatment is the process of selecting and implementing controls to reduce the likelihood and impact of information security risks.\n- it is an essential part of any information security management system (isms) and is required by the iso 27001 standard.\n- clause 8.3 of iso 27001 requires organisations to implement the information security risk treatment plan and retain documented information on the results of that risk treatment.\n- this means that organisations must have a plan in place for how they will address the risks that have been identified, and they must keep records of how they have implemented that plan.\n- here are some of the things that are involved in requirement 8.3:\n  * identifying and assessing risks\n  * developing and implementing risk treatment plans\n  * monitoring and reviewing the effectiveness of risk treatment plans\n  * retaining documented information on the results of risk treatment\n- organisations can use a variety of methods to implement requirement 8.3, such as:\n  * using a risk management framework such as iso 27005\n  * using a risk management software tool\n  * hiring a consultant to help with risk management\n- an information risk treatment plan (irtp) is a document that outlines how an organisation will manage and treat the information security risks', 'doc_ID': 407, 'relevance_score': 0.9977217}), Document(page_content='for the treatment of risks should be identified as well as the selection of the appropriate controls\nshould be identified in accordance with the identified risk treatment options.\ninput\na) output from activity 8.2 conduct risk assessment - the result of risk assessment\nb) iso/iec 27005:2008\nc) isomec 27002:2005\nguidance\nit is important to specify the relation between the risks and the selected options for treating them (e.g. a risk\ntreatment plan), as this will provide a summary of risk treatment. possible options for the treatment of risks are\nenumerated in iso/iec 27001:2005 reference 4.2.1 f).\nthe iso/iec 27001:2005 annex a (normative) “control objectives and controls"" is used to select control\nobjectives and controls for risk treatment. if there are no appropriate control objectives or controls in annex a,\nthe additional control objectives and controls should be specified and used. it is important to demonstrate how\nthe selected controls will mitigate risks as required by the risk treatment plan.\nthe data given in iso/iec 27001:2005 annex a is not meant to be exhaustive. sector-specific controls may\nbe identified to support the specific needs of the business as well as the isms.\nin the case of risk reduction, managing the relationship between each risk and selected control objectives and\ncontrols is beneficial to designing the isms implementation. it could be added to the list that describes the\nrelationship between the risks and the selected options for risk treatment.\nto facilitate audits, the', metadata={'source': 'ISO 27003 2010 (E).pdf', 'title': 'ISO 27003 2010 (E)', 'original_text': '- selection of measures for implementing risk treatment\n- requirements should be considered and documented according to ISO 27001\n- treatment of risks should be identified\n- selection of the appropriate controls should be identified\n- identified risk treatment options\n- output from activity 8.2 conduct risk assessment - the result of risk assessment\n- iso/iec 27005:2008\n- iso/iec 27001:2005 reference 4.2.1 f)\n- iso/iec 27001:2005 annex a (normative) “control objectives and controls""\n- demonstrate how the selected controls will mitigate risks as required by the risk treatment plan\n- sector-specific controls may be identified to support the specific needs of the business as well as the isms\n- managing the relationship between each risk and selected control objectives and controls is beneficial to designing the isms implementation\n- facilitate audits', 'doc_ID': 1476, 'relevance_score': 0.9977128}), Document(page_content='requires the organisation to\n“formulate an information security risk treatment plan”. risk\ntreatment is, as we saw earlier, part of the risk management\nprocess.\nthere is a link to iso 27001 clause 5.1, which is a\nsubstantial clause dealing in detail with management\nresponsibility. clearly, the risk treatment plan needs to be\ndocumented. it should be set within the context of the\norganisation’s information security policy and it should\nclearly identify the organisation’s approach to risk and its\ncriteria for accepting risk, as discussed elsewhere in this\nbook. the risk assessment process must be formally defined,\n165\n16: the gap analysis and risk treatment plan\nand responsibility for carrying it out and reviewing it must\nbe formally allocated. at the heart of this plan is a detailed\nschedule, which shows for each identified risk — linked either\nto an asset-threat-vulnerability combination or to a scenario:\ne the associated risk level (from the risk assessment tool);\ne the gap between the assessed risk and the acceptable\nlevel of risk;\ne how the organisation has decided to treat the risk\n(retain, avoid, modify, share);\ne the control gap analysis:\no what controls are already in place and their nature\n(e.g. detective, preventive, etc.).\no what additional controls are considered necessary,\nand their nature (and details of any supporting cost-\nbenefit analysis).\ne the resources required for the task (financial, technical\nand human); and\ne the timeframe for implementing the controls.\nthe risk treatment', metadata={'source': 'Calder - 2019 - Information Security Risk Management for ISO 27001.pdf', 'title': 'Calder - 2019 - Information Security Risk Management for ISO 27001', 'original_text': '- ""risk treatment is, as we saw earlier, part of the risk management process.""\n- ""there is a link to iso 27001 clause 5.1, which is a substantial clause dealing in detail with management responsibility.""\n- ""clearly, the risk treatment plan needs to be documented.""\n- ""it should be set within the context of the organisation’s information security policy and it should clearly identify the organisation’s approach to risk and its criteria for accepting risk, as discussed elsewhere in this book.""\n- ""the risk assessment process must be formally defined, 165 16: the gap analysis and risk treatment plan and responsibility for carrying it out and reviewing it must be formally allocated.""\n- ""at the heart of this plan is a detailed schedule, which shows for each identified risk — linked either to an asset-threat-vulnerability combination or to a scenario:""\n- ""the associated risk level (from the risk assessment tool);""\n- ""the gap between the assessed risk and the acceptable level of risk;""\n- ""how the organisation has decided to treat the risk (retain, avoid, modify, share);""\n- ""the control gap analysis:""\n- ""what controls are already in place and their nature (e.g. detective, preventive, etc.).""\n- ""', 'doc_ID': 833, 'relevance_score': 0.99712163}), Document(page_content='and document the risk treatment process and its results.\nfinally, the chapter gives instructions on how to apply the prescribed method.\nthe iso/iec 27001 requirement\ndefine and apply\niso/iec 27001 clause 6.1.3 requires organisations to define and apply a risk\ntreatment process that satisfies the requirement detailed in the subsequent five\nbullet points (a) — (f}) and explained below.\nthe reason for saying “define and apply’, has explained in chapter 1 (clauses 6.1\nand 8) and chapter 2, and is because the necessary controls that the organisation\nrequires form part of the isms, but are determined through the process of risk\nassessment and risk treatment.\nrisk treatment options\niso/iec 27001 clause 6.1.3 a) requires organisations to select appropriate options\nfor treating risk, taking account of the risk assessment results. the standard does\nnot prescribe a catalogue of options from which an organisation should choose, and\ntherefore the requirement is perhaps better expressed as “... determine appropriate\noptions...”.\niso 31000 describes seven options, which include risk avoidance, acceptance,\nmodification, and transference. however, that standard mixes up two concepts: the\nmodification of risk and responsibility for the performing the control. in determining\nits options for risk treatment, organisations should consider both concepts.\nmoreover, since risk is only a function of fol and severity, there are only two factors\nthat can be modified. table 3-1 shows the relationship between the seven', metadata={'doc_ID': 606, 'original_text': '- iso/iec 27001 clause 6.1.3 requires organisations to define and apply a risk treatment process\n- the requirement detailed in the subsequent five bullet points (a) — (f}) and explained below\n- iso/iec 27001 clause 6.1.3 a) requires organisations to select appropriate options for treating risk, taking account of the risk assessment results\n- the standard does not prescribe a catalogue of options from which an organisation should choose\n- iso 31000 describes seven options, which include risk avoidance, acceptance, modification, and transference\n- in determining its options for risk treatment, organisations should consider both concepts\n- since risk is only a function of fol and severity, there are only two factors that can be modified', 'source': 'Brewer - 2020 - ISO IEC 27001 Mastering Risk Assessment and the Statement of Applicability.pdf', 'title': 'ISO IEC 27001 Mastering Risk Assessment and the Statement of Applicability', 'relevance_score': 0.9967142}), Document(page_content='reviews the\nrequirements of iso 27001 around control selection, which\nis also known as ‘risk treatment’.\nas we said in chapter 1, there are four risk treatment\ndecisions that can be made:\n1. avoid/reject the risk by deciding not to pursue the\npractices and/or arrangements that give rise to the risk.\n2. retain/take the risk, keeping it under review.\n3. modify/reduce risks to ‘acceptable’ levels through the\napplication of controls.\n4. share the risk with another party, whether through\ncontract or insurance.\nthe criterion that is used in making the decision is simple:\neither the risk is within the risk tolerance level, in which case\nit is accepted, or it is not, in which case it must be avoided,\nmodified or shared. so, in principle (unless the risk is too\ngreat):\nif risk level < risk acceptance criteria, then ‘accept’ risk;\nor\nif risk level > risk acceptance criteria, then ‘modify’ risk\n(which can include share), or if extreme consider avoiding\nit.\nif the risk is too great (i.e. the potential impact 1s off the scale,\nor is greater than the ‘very high’ level chosen in the risk\n147\n14: risk treatment and the selection of controls\nassessment methodology), then the risk must be avoided,\nwhich might involve implementing some form of\n‘workaround’ in order to do so. a simple example of this\nresponse to a risk assessment might be where the potential\nimpact of theft of equipment from the offices of a company\nwould be so great if it moved to a particular neighbourhood\nthat it decided against the move.\ntypes of', metadata={'doc_ID': 811, 'original_text': '- reviews the requirements of iso 27001 around control selection, which is also known as ‘risk treatment’.\n- as we said in chapter 1, there are four risk treatment decisions that can be made:\n- the criterion that is used in making the decision is simple:\n- either the risk is within the risk tolerance level, in which case it is accepted, or it is not, in which case it must be avoided, modified or shared.\n- if the risk is too great (i.e. the potential impact 1s off the scale, or is greater than the ‘very high’ level chosen in the risk assessment methodology), then the risk must be avoided, which might involve implementing some form of ‘workaround’ in order to do so.', 'source': 'Calder - 2019 - Information Security Risk Management for ISO 27001.pdf', 'title': 'Information Security Risk Management for ISO 27001', 'relevance_score': 0.9962783}), Document(page_content='(option 2, above) are then handled in accordance\nwith clause 6.1.3 of iso 27001. clause 9 of iso 27005 and\nclause 8 of bs 7799-3 provide guidance in this regard. in\nparticular, bs 7799-3 states that controls should be selected\non the basis of “the nature and components of the risk(s) that\nare to be mitigated, the identification of the control\nobjectives that are most appropriate to deliver the desired\nmitigation and the controls that contribute to the identified\ncontrol objective(s)”. controls act to reduce likelihood\nand/or impact, and the objective of the control selection\nprocess is to select controls that will bring the identified risk\nbelow the previously defined level of risk tolerance, as\nshown in the risk treatment matrix in figure 8.\nhigh very high\nedium high\nlikelihood\nmedium\n_—\nimpact\nfigure 8: controls reduce impact and/or likelihood to bring\nthe risk down to the level of risk tolerance/acceptance\n92\n7: the iso 27001 risk assessment\nthe final step in the ‘plan’ stage of the initial iso 27001\npdca cycle is the production of an soa and a risk treatment\nplan.\nthe soa is the list of all the controls the organisation has\nselected along with an explanation for their selection and\nwhether or not they have been implemented, and a list of any\ncontrols identified in annex a of iso 27001 that have not\nbeen selected and an explanation why.\nthe risk treatment plan is the documentation that explains\nhow the controls to be implemented are prioritised in order\nto manage risk. iso 27005 advises that', metadata={'doc_ID': 750, 'original_text': 'clause 9 of iso 27005 and clause 8 of bs 7799-3 provide guidance in this regard. in particular, bs 7799-3 states that controls should be selected on the basis of “the nature and components of the risk(s) that are to be mitigated, the identification of the control objectives that are most appropriate to deliver the desired mitigation and the controls that contribute to the identified control objective(s)”. controls act to reduce likelihood and/or impact, and the objective of the control selection process is to select controls that will bring the identified risk below the previously defined level of risk tolerance, as shown in the risk treatment matrix in figure 8. the final step in the ‘plan’ stage of the initial iso 27001 pdca cycle is the production of an soa and a risk treatment plan. the soa is the list of all the controls the organisation has selected along with an explanation for their selection and whether or not they have been implemented, and a list of any controls identified in annex a of iso 27001 that have not been selected and an explanation why. the risk treatment plan is the documentation that explains how the controls to be implemented are prioritised in order to manage risk. iso 27005 advises that', 'source': 'Calder - 2019 - Information Security Risk Management for ISO 27001.pdf', 'title': 'Information Security Risk Management for ISO 27001', 'relevance_score': 0.99592984}), Document(page_content=""way to access risk**. this means considering past occurrences and\nanalysing risky scenarios that may cause an issue.\nthe risk assessment consists of the following:\n 1. identify & assess risk\n 2. treat risks - you decide here how you want to address the risks. e.g., accept, avoid, transfer, mitigate.\n 3. review residual risks.\n# implementing controls and a risk treatment plan to manage risks\nan integral element of your information security program is the **risk\ntreatment plan**. this plan is all-encompassing and is devised to execute\nmeasures to either accept, avoid, transfer, or **mitigate the possibility or\nconsequences of risks**.\nof utmost importance within a risk treatment plan is the aspect of\nimplementation. its significance lies in guaranteeing the actual execution of\nrisk treatment procedures.\n## complete your isms documentation\ndocumentation is the basis of your isms and the most important part of getting\nand maintaining your certification. if it's not documented, it's not relevant.\nyou need to keep track of many things when it comes to documentation, as there\nare many things to consider. to give you a complete overview of the\ndocumentation required for iso 27001 certification, along with information on\npreparing said documentation, we have created a detailed list for the\ndocumentation:\n**definition of the scope of application of the isms (information security\nmanagement system)**\nthe scope of application of the isms is defined in the so-called “scope\ndocument”. this determines which"", metadata={'description': 'No matter if you’re an SMB or an international corporation — getting an ISO 27001 certification should be on your agenda. Here’s the ultimate guide on how.', 'doc_ID': 134, 'language': 'en-gb', 'original_text': '- ""implementing risk treatment""\n- ""requirements should be considered and documented according to ISO 27001""\n- ""the risk assessment consists of the following:""\n- ""treat risks - you decide here how you want to address the risks. e.g., accept, avoid, transfer, mitigate.""\n- ""review residual risks.""\n- ""implementing controls and a risk treatment plan to manage risks""\n- ""an integral element of your information security program is the **risk treatment plan**.""\n- ""this plan is all-encompassing and is devised to execute measures to either accept, avoid, transfer, or **mitigate the possibility or consequences of risks**.""\n- ""of utmost importance within a risk treatment plan is the aspect of implementation.""\n- ""documentation is the basis of your isms and the most important part of getting and maintaining your certification.""\n- ""documentation required for iso 27001 certification""\n- ""definition of the scope of application of the isms (information security management system)""\n- ""the scope of application of the isms is defined in the so-called “scope document”.""', 'source': 'https://www.dataguard.co.uk/knowledge/iso-27001-certification/', 'title': 'ISO 27001 Certification: Your ultimate guide [free guide available]', 'relevance_score': 0.9952448})]","The selection of measures for implementing risk treatment is done in two steps. Firstly, a general treatment option is selected for each identified risk. Then, the measures necessary for implementing this option are selected and determined. Various sources such as ISO 27002, the Basic Security Compendium of BSI, or industry catalogs can be consulted during the selection of measures. A comparison with the controls from Annex A of ISO 27001 is necessary during the selection of measures to avoid overlooking important aspects and measures. All requirements that need to be considered during the selection of measures must be documented accordingly.","The selection of measures for implementing risk treatment according to ISO 27001 involves identifying and assessing risks, developing and implementing risk treatment plans, monitoring and reviewing the effectiveness of risk treatment plans, and retaining documented information on the results of risk treatment. Organizations can use methods such as using a risk management framework like ISO 27005, risk management software tools, or hiring consultants to help with risk management. The risk treatment plan should be documented, set within the context of the organization's information security policy, and clearly identify the organization's approach to risk and criteria for accepting risk. The plan should include a detailed schedule showing identified risks, associated risk levels, control gap analysis, and how the organization has decided to treat the risks (retain, avoid, modify, share). It is essential to demonstrate how the selected controls will mitigate risks as required by the risk treatment",True,0.3629032258064516,0.0975609756097561,0.21774193548387097,0.8519310988485813,0.9998615980148315,0.7805986075095616,1.0,0.861505113946766,2.178252696990967,5.052582502365112,0.0020012855529785156,7.230835199356079
Fine-tuned_finetuned-ISO-27001_1024_l2_All_1536_264_False_Kers,Hybrid_Rerank_Cohere_Compression,8,gpt-3.5-turbo-16k,16385,0,1,"What resources need to be provided to establish the ISMS according to ISO 27001, and what resources are necessary for the implementation of the risk treatment plan?","[Document(page_content='### clause 7.1 of iso 27001: resources\nclause 7.1 of iso 27001 requires organisations to identify and allocate the\nresources needed for the establishment, implementation, maintenance, and\ncontinual improvement of their (isms). this is because the resources available\nto an organisation will have a significant impact on the effectiveness of its\nisms.\nthe resources that need to be considered include:\n * people: the organisation needs to have the right people with the right skills and knowledge to implement and maintain its isms. this includes security professionals, as well as other employees who have a role to play in information security, such as it staff, line managers, and employees with access to sensitive information. * infrastructure: the organisation needs to have the necessary infrastructure, such as it systems and facilities, to support its isms. this includes hardware, software, and physical security measures. * financial resources: the organisation needs to have the financial resources to invest in its isms. this includes the costs of hiring and training staff, purchasing and maintaining infrastructure, and implementing security controls.\nby ensuring that it has the necessary resources, an organisation can improve\nthe effectiveness of its isms and reduce the risk of security incidents.\n### your iso 27001 certification process made simple.\n### get iso 27001 certified in as little as 3 months. download your free guide now\n## why is it important for organisations to have', metadata={'description': 'ISO 27001 clause 7.1 stipulates that organisations must allocate necessary resources for the establishment, maintenance, and enhancement of their ISMS.', 'doc_ID': 378, 'language': 'en-gb', 'original_text': '- clause 7.1 of iso 27001: resources\n- resources needed for the establishment, implementation, maintenance, and continual improvement of their (isms)\n- resources available to an organisation will have a significant impact on the effectiveness of its isms\n- people: the organisation needs to have the right people with the right skills and knowledge to implement and maintain its isms\n- infrastructure: the organisation needs to have the necessary infrastructure, such as it systems and facilities, to support its isms\n- financial resources: the organisation needs to have the financial resources to invest in its isms\n- by ensuring that it has the necessary resources, an organisation can improve the effectiveness of its isms and reduce the risk of security incidents', 'source': 'https://www.dataguard.co.uk/knowledge/iso-27001/clause-7-1-resources-for-isms/', 'title': 'ISO 27001 requirement 7.1: Identify and allocate resources for ISMS', 'relevance_score': 0.9988441}), Document(page_content='hierarchy level, perhaps even measurable in some way. similarly, requirements, risks, intended options, and measures for risk treatment can be broken down to the specific role or level of the organization. it is important to assign each role or level precisely and formally with the implementation, specifying goals, measures, available resources, deadlines, etc. the corresponding (written) assignments are to be kept and used again during later audits or evaluations of the results.\nthe same process applies if requirements, risks, options, or measures are changed.\nbasically, this is about the implementation plan and the decentralized responsibility during its realization.\n2.4 support (nk 7)\nthis nk deals with supporting elements and resources for the isms.\nna 7.1 - resources\nna 7.1 is primarily directed at top management, which must provide adequate resources to establish, operate, monitor, and improve the isms - provided that compliance with iso 27001 is desired. note that behind this requirement, two aspects are ""hidden"":\nfirstly, the necessary resources for the isms (personnel, processes, expertise, training, testing, and verification procedures) must be provided - for its lifecycle (pdca). these resources can already be estimated in the planning phase of the isms.\nfurthermore, the resources required to implement the risk treatment plan, i.e., the measures documented in the soa and not yet implemented, should be considered. the estimation of effort and costs is done after the completion of the soa and', metadata={'doc_ID': 3186, 'original_text': '- na 7.1 - resources\n- na 7.1 is primarily directed at top management, which must provide adequate resources to establish, operate, monitor, and improve the isms - provided that compliance with iso 27001 is desired.\n- the necessary resources for the isms (personnel, processes, expertise, training, testing, and verification procedures) must be provided - for its lifecycle (pdca).\n- the resources required to implement the risk treatment plan, i.e., the measures documented in the soa and not yet implemented, should be considered.', 'source': 'Kersten et al. - 2020 - IT-Sicherheitsmanagement nach der neuen ISO 27001_removed.pdf', 'title': 'Kersten et al. - 2020 - IT-Sicherheitsmanagement nach der neuen ISO 27001_removed', 'relevance_score': 0.99703056}), Document(page_content='with isms risks\niso/iec 27001, clause 6.1.1 specifies a requirement that is common to all mss and\nis intended for the identification and treatment of risks to the intended outcome of\nthe isms that are not information security specific. for example, a lack of resources\ncould result in internal audits being missed. whilst this could represent a\nnonconformity in respect of iso/iec 27001, clause 9.2 (internal audits), its effect on\nexposure to information security is indirect and depends on whether any information\nsecurity controls are in scope of the audits that might be missed. whilst an\norganisation could use the full rigour of clauses 6.1.2 and 6.1.3 to identify and treat\nsuch risk, it does not have to — an informal approach — essentially just following what\nit says in the standard will be sufficient.\nrelevant resources\niso standards\niso/iec 27000 provides an overview of all the standards in the 27000 series,\ntogether the vocabulary of terms that they use. the principal standards are:\nm iso/iec 27000, information technology — security techniques —\ninformation security management systems — overview and vocabulary;\nm iso/iec 27001, information technology — security techniques —\ninformation security management systems — requirements;\nm iso/iec 27002, information technology — security techniques — code of\npractice for information security controls\nm iso/iec 27003, information technology — security techniques —\ninformation security management system implementation guidance.\nthe following standard explores', metadata={'source': 'Brewer - 2020 - ISO IEC 27001 Mastering Risk Assessment and the Statement of Applicability.pdf', 'title': 'Brewer - 2020 - ISO IEC 27001 Mastering Risk Assessment and the Statement of Applicability', 'original_text': 'iso/iec 27001, clause 6.1.1 specifies a requirement that is common to all mss and\nis intended for the identification and treatment of risks to the intended outcome of\nthe isms that are not information security specific. for example, a lack of resources\ncould result in internal audits being missed. whilst this could represent a\nnonconformity in respect of iso/iec 27001, clause 9.2 (internal audits), its effect on\nexposure to information security is indirect and depends on whether any information\nsecurity controls are in scope of the audits that might be missed. whilst an\norganisation could use the full rigour of clauses 6.1.2 and 6.1.3 to identify and treat\nsuch risk, it does not have to — an informal approach — essentially just following what\nit says in the standard will be sufficient.\nrelevant resources\niso standards\niso/iec 27000 provides an overview of all the standards in the 27000 series,\ntogether the vocabulary of terms that they use. the principal standards are:\nm iso/iec 27000, information technology — security techniques —\ninformation security management systems — overview and vocabulary;\nm iso/iec 270', 'doc_ID': 580, 'relevance_score': 0.99317604}), Document(page_content='systems, i.e. if a qm system already exists in the organization, the isms is also set up according to the same pattern and can benefit from already defined processes (example: document management) or simply adopt them.\n- resources: it is clear that our isms will require a significant amount of resources depending on its level of development and scope (e.g. a running budget, sufficient personnel, resources for external expertise such as assessments, certifications, or penetration tests, and finally resources and manpower for the implementation and monitoring of security measures).\non one hand, the available resources will be limited, which will directly impact our isms. should we initially keep the scope small - for example, securing only core business processes - and gradually expand later? or would it be okay to establish a lower level of security than originally planned at the beginning? it is clear: none of these options are recommended, but what can be done?\nwe refer to external aspects as those brought to our organization from the outside. these include:\n2.1. context of the organization (isms-4) 35\n© legal requirements (laws, regulations, decrees) that our organization must comply with. if we operate in more than one country, there may be several requirements to consider. eu requirements in the form of guidelines and regulations (such as the gdpr [1] on data protection or the eidas regulation [2] on electronic trust services) should not be overlooked. an example of a decree is the german vat', metadata={'source': 'ISO 27001_2022_Kersten_und_Schroeder.pdf', 'title': 'ISO 27001_2022_Kersten_und_Schroeder', 'original_text': '- resources: it is clear that our isms will require a significant amount of resources depending on its level of development and scope (e.g. a running budget, sufficient personnel, resources for external expertise such as assessments, certifications, or penetration tests, and finally resources and manpower for the implementation and monitoring of security measures).\n- should we initially keep the scope small - for example, securing only core business processes - and gradually expand later? or would it be okay to establish a lower level of security than originally planned at the beginning?\n- we refer to external aspects as those brought to our organization from the outside. these include:\n2.1. context of the organization (isms-4) 35\n© legal requirements (laws, regulations, decrees) that our organization must comply with. if we operate in more than one country, there may be several requirements to consider. eu requirements in the form of guidelines and regulations (such as the gdpr [1] on data protection or the eidas regulation [2] on electronic trust services) should not be overlooked. an example of a decree is the german vat', 'doc_ID': 2588, 'relevance_score': 0.99184376}), Document(page_content='business processes as column headings and the measures planned for each process below. the specific comparison will be delegated by management - for example, to the security management, an auditor, or a reviewer.\n(c) the resources necessary for planning, operating, and maintaining the isms must be available.\nthis understandable requirement is naturally the sticking point in many organizations: resources are always limited - and who actually determines what is required when and for what purpose? initially, those responsible for information security (security officers, coordinators from the affected departments - perhaps a working group?) should prepare a resource plan for a specific period of time (typically 3 years) and submit it for approval. the plan must include the required personnel, all financial resources for setting up and operating the isms, and all resources necessary to establish and use the planned security measures. for these points, during the establishment phase of the isms, only an estimate can be given.\nin the discussion with management about the allocation of resources, it may be helpful to refer to recommendations from recognized auditors - their advice may carry more weight in such discussions, especially if certification of the isms is later sought.\nnote that the allocation of sufficient resources for the isms is the responsibility of the management level. in other words, if only insufficient resources are provided, the consequences (deficiencies in information security) are', metadata={'source': 'ISO 27001_2022_Kersten_und_Schroeder.pdf', 'title': 'ISO 27001_2022_Kersten_und_Schroeder', 'original_text': '- the resources necessary for planning, operating, and maintaining the isms must be available.\n- resources are always limited - and who actually determines what is required when and for what purpose?\n- initially, those responsible for information security (security officers, coordinators from the affected departments - perhaps a working group?) should prepare a resource plan for a specific period of time (typically 3 years) and submit it for approval.\n- the plan must include the required personnel, all financial resources for setting up and operating the isms, and all resources necessary to establish and use the planned security measures.\n- in the discussion with management about the allocation of resources, it may be helpful to refer to recommendations from recognized auditors - their advice may carry more weight in such discussions, especially if certification of the isms is later sought.\n- note that the allocation of sufficient resources for the isms is the responsibility of the management level.', 'doc_ID': 2602, 'relevance_score': 0.9893063}), Document(page_content=""and hardware components (e.g., an encryption product determined by the organization), and available third-party services (e.g., a cloud provider). the idea is to specify the necessary or available resources for each measure in the implementation plan.\n(k) when should the implementation be completed?\nthis is an element of schedule planning, which will certainly include several additional dates - e.g., for detailed planning, coordination, and review activities.\n(1) how will the correctness of the implementation be checked and evaluated?\nit should already be planned here who, when, and with what method will review the implemented options and controls. the goal is to be able to identify deviations between planning and implementation of measures. experience shows that this usually results in a long list.\n62 2 requirements for the isms\nconclusion on isms-6.2\nthis section of the standard describes the approach to appropriately document the organization's security goals, break them down to all affected units and roles, and measure their achievement. implementation plans need to be created for all organizational units and roles.\nisms-6.3 - planning changes\nwhat changes are meant? examples of this are new contextual information, new organizational units or roles, changes to the scope of the isms, updating a security policy, adjustments to criteria and procedures (e.g., from isms-6), the inclusion of new service providers - but also classic changes to it applications, servers, networks, etc. in short, everything"", metadata={'source': 'ISO 27001_2022_Kersten_und_Schroeder.pdf', 'title': 'ISO 27001_2022_Kersten_und_Schroeder', 'original_text': '- ""resources need to be provided to establish the ISMS according to ISO 27001""\n- ""necessary or available resources for each measure in the implementation plan""\n- ""implementation plan""\n- ""when should the implementation be completed?""\n- ""correctness of the implementation be checked and evaluated""\n- ""who, when, and with what method will review the implemented options and controls""\n- ""requirements for the isms""\n- ""isms-6.2""\n- ""document the organization\'s security goals""\n- ""break them down to all affected units and roles""\n- ""measure their achievement""\n- ""implementation plans need to be created for all organizational units and roles""\n- ""isms-6.3""\n- ""planning changes""\n- ""new contextual information""\n- ""new organizational units or roles""\n- ""changes to the scope of the isms""\n- ""updating a security policy""\n- ""adjustments to criteria and procedures""\n- ""inclusion of new service providers""\n- ""classic changes to it applications, servers, networks, etc.""', 'doc_ID': 2635, 'relevance_score': 0.9857181}), Document(page_content='as a\npandemic, or based on reasonable notice, for example with amended legislation or\nregulation. in both cases, the types of activities required will be similar to those in the\nprevious section — the what, who, when, how etc. and it may be appropriate to add an\nagenda item to the regular meetings you hold so that changes are managed effectively.\n page 30 of 79\niso/iec 27001 implementation guide\n3.8 clause 7 support\nrelevant toolkit documents\ne information security competence development procedure\ne information security communication programme\ne procedure for the control of documented information\ne isms documentation log\ne information security competence development report\ne awareness training presentation\ne competence development questionnaire\ncovering resources, competence, awareness, communication and documented information,\nthis section describes some of the background areas that need to be in place for the isms to\nfunction properly.\n3.8.1 clause 7.1 resources\nthe standard simply requires that adequate resources are provided for the isms to function\neffectively. this is really a test of the level of management commitment as described earlier.\n3.8.2 clause 7.2 competence\nthe toolkit provides a method of defining the competences needed, conducting a survey of\nthe people involved in the implementation and running of the isms, collating the results\nand then reporting on those areas in which further training or knowledge needs to be\ngained. you will need to ensure that appropriate records of', metadata={'source': 'CERTIKIT_ISO27001_Implementation_Guide_v12.pdf.pdf', 'title': 'CERTIKIT_ISO27001_Implementation_Guide_v12.pdf', 'original_text': '- relevant toolkit documents\n- e information security competence development procedure\n- e information security communication programme\n- e procedure for the control of documented information\n- e isms documentation log\n- e information security competence development report\n- e awareness training presentation\n- e competence development questionnaire\n- covering resources, competence, awareness, communication and documented information,\n- 3.8.1 clause 7.1 resources\n- adequate resources are provided for the isms to function effectively\n- 3.8.2 clause 7.2 competence\n- the toolkit provides a method of defining the competences needed, conducting a survey of the people involved in the implementation and running of the isms, collating the results and then reporting on those areas in which further training or knowledge needs to be gained.', 'doc_ID': 885, 'relevance_score': 0.97482115}), Document(page_content='what is iso 27001?\niso 27001 is the international standard that describes best practices for an information security management systems (isms). it’s based on a set of iso 27001 controls and measures, which organizations can use to achieve information security. the iso 27001 standard requires that you have procedures in place to cover aspects of the isms, including:\ninformation security risk management (what are the risks you face and how do you treat those risks?)\nmonitoring, measurement, analysis, and evaluation (how is the effectiveness of the information security management system evaluated?)\nimprovement (how are nonconformities evaluated and corrected?)\nwho needs iso 27001?\nany business experiencing growth in international markets that wants to demonstrate to customers they are preserving the confidentiality, integrity, and availability of information by applying a risk management process can benefit from iso 27001. the primary focus is empowering organizations to establish, implement, maintain, and continually improve their isms.\ncurious about how iso 27001 compares to soc 2? learn more in this article on our blog.\nwhy is iso 27001 important?\nthe iso 27001 standard is an effective way to keep your company’s information secure when you take the right steps to implement it. it provides a structured approach to implementing, integrating, and continuously improving your isms. this helps protect assets from both internal and external threats by making sure you:\nunderstand the organization’s needs,', metadata={'description': ""Starting your journey to ISO 27001 compliance? Here's an easy-to-follow guide to get you on the right track"", 'doc_ID': 70, 'language': 'en', 'original_text': '- iso 27001 is the international standard that describes best practices for an information security management systems (isms).\n- it’s based on a set of iso 27001 controls and measures, which organizations can use to achieve information security.\n- the iso 27001 standard requires that you have procedures in place to cover aspects of the isms, including:\n- information security risk management (what are the risks you face and how do you treat those risks?)\n- improvement (how are nonconformities evaluated and corrected?)\n- any business experiencing growth in international markets that wants to demonstrate to customers they are preserving the confidentiality, integrity, and availability of information by applying a risk management process can benefit from iso 27001.\n- the primary focus is empowering organizations to establish, implement, maintain, and continually improve their isms.\n- the iso 27001 standard is an effective way to keep your company’s information secure when you take the right steps to implement it.\n- it provides a structured approach to implementing, integrating, and continuously improving your isms.\n- this helps protect assets from both internal and external threats by making sure you:\n- understand the organization’s needs.', 'source': 'https://www.drata.com/blog/iso-27001-compliance', 'title': 'ISO 27001: A Beginner’s Guide', 'relevance_score': 0.9701269})]","To establish the ISMS according to ISO 27001, various resources need to be provided. These include staff, processes, expertise, training and education, as well as testing and verification procedures. These resources should already be estimated in the planning phase of the ISMS. In addition, resources are necessary to implement the risk treatment plan. These include staff, knowledge/expertise, organizational resources, infrastructure/technology, as well as a budget for expertise, training and education, tests, and audits. External support may also be considered. The estimation of effort and costs for the implementation of the risk treatment plan should be done after the completion of the Statement of Applicability (SoA) and submitted for approval.","To establish an Information Security Management System (ISMS) according to ISO 27001, an organization needs to provide resources such as personnel with the right skills and knowledge, necessary infrastructure like IT systems, and financial resources for investment. For the implementation of the risk treatment plan, resources required include personnel, processes, expertise, training, testing, and verification procedures. The measures documented in the Statement of Applicability (SoA) that are yet to be implemented should also be considered. It is essential to have a resource plan approved by management, detailing the personnel, financial resources, and other resources needed for setting up and operating the ISMS and security measures. The responsibility for allocating sufficient resources for the ISMS lies with the management level.",True,0.5652173913043478,0.25438596491228066,0.2956521739130435,0.8828072249889374,0.9999648332595825,0.8834698583730249,0.8,0.7471219327084865,1.7860207557678223,3.147141695022583,0.0030012130737304688,4.933162450790405
Fine-tuned_finetuned-ISO-27001_1024_l2_All_1536_264_False_Kers,Hybrid_Rerank_Cohere_Compression,8,gpt-3.5-turbo-16k,16385,0,1,Which three levels are considered when evaluating the security and effectiveness of the ISMS?,"[Document(page_content=""subject to the same planning and documentation rules.\n2.6 performance evaluation (clause 9)\nclause 9 focuses on evaluating the existing security and effectiveness of the isms. this is done on three levels:\n* level 1 — monitoring, measurement, analysis, and evaluation by the security responsible roles within the organization (clause 9.1)\n* level 2 — review and assessment of security by an entity independent of operational security (internal audit) (clause 9.2)\n* level 3 — evaluation of the isms by top management (clause 9.3)\nclause 9.1 - monitoring, measurement, analysis, and evaluation\nthis requirement consists of two work cycles: relevant data for the organization's security and the effectiveness of its isms should be\n* captured through monitoring and measurement and\n* then analyzed and evaluated.\nthese points can be understood through some central questions (and answers).\nwhat needs to be monitored or measured\nwill (normative point a)? the organization can\nat its own discretion determine which facts or parameters it wants to monitor\nand measure, as far as it can analyze and evaluate the security of the organization and the effectiveness\nof the isms. in chapter 4 we provide some examples.\nwhich method is used for monitoring or measurement in each case (normative point b)? here too, the organization can, at its own discretion, decide on specific monitoring or measurement methods. depending on the subject of monitoring\nor measurement, different methods may be used - however,\nit is important to ensure"", metadata={'doc_ID': 3195, 'original_text': '- clause 9 focuses on evaluating the existing security and effectiveness of the isms. this is done on three levels:\n* level 1 — monitoring, measurement, analysis, and evaluation by the security responsible roles within the organization (clause 9.1)\n* level 2 — review and assessment of security by an entity independent of operational security (internal audit) (clause 9.2)\n* level 3 — evaluation of the isms by top management (clause 9.3)', 'source': 'Kersten et al. - 2020 - IT-Sicherheitsmanagement nach der neuen ISO 27001_removed.pdf', 'title': 'Kersten et al. - 2020 - IT-Sicherheitsmanagement nach der neuen ISO 27001_removed', 'relevance_score': 0.997358}), Document(page_content='or refute the effectiveness of the sms as a whole.\nthis reveals three levels of analysis and evaluation:\na. evaluation based on an attribute\nb. evaluation of the object as a whole\nc. evaluation of all objects in relation to the isms\nwho should conduct these evaluations?\nhow the individual results under a. are to be evaluated must already be determined in the measurement schema according to iso 27004 and can therefore be carried out by the personnel conducting or overseeing the measurements.\nthe overarching evaluation of all attributes of an object of measurement under b. could, for example, be carried out by the organizational unit responsible for the object of measurement. if it concerns the effectiveness of an infrastructure measure (e.g., power supply with ups and emergency power system), the department ""building services"" would be responsible accordingly.\nthe performance evaluation of the isms as a whole under c. should be prepared by the security management by compiling the results of all measurements accordingly. a final, formal assessment will then be carried out by the organization\'s management level as part of the management review - refer to the explanations in chapter 2 of this book regarding section 9.3 of the standard!\nin general, it would be a good practice to establish role separations for conducting measurements and analysis and evaluation (at least for b. and c.) to contribute to the ""objectivity"" of the procedures and results.\nhow often should the evaluations be conducted?\nthere is', metadata={'doc_ID': 3259, 'original_text': 'a. evaluation based on an attribute\nb. evaluation of the object as a whole\nc. evaluation of all objects in relation to the isms', 'source': 'Kersten et al. - 2020 - IT-Sicherheitsmanagement nach der neuen ISO 27001_removed.pdf', 'title': 'Kersten et al. - 2020 - IT-Sicherheitsmanagement nach der neuen ISO 27001_removed', 'relevance_score': 0.99608517}), Document(page_content=""information security and the organization's security objectives. the isms is considered\neffective when, after a certain period, it can meet the requirements and achieve the security objectives\nand maintain this situation continuously thereafter.\nthe issue of appropriateness is more challenging: for a larger organization where\ninformation values (assets) can have catastrophic consequences if lost, a minimal approach\nto an isms (a security officer with few procedures and control capabilities) would certainly\nnot be appropriate. on the other hand, if there are few information values with high and very high risks,\nan isms with a lot of personnel, resources, and high organizational structure would be considered excessive\nand therefore also not appropriate.\nthe described negative examples undoubtedly have potential for improvement - here,\nfor example, it must be evident to an auditor that the organization is responding and planning\nfor improvement and implementing this planning progressively. if nothing happens despite\nawareness of the situation, the requirements of norm section 10.2 are not met - nor if there is a plan\nbut it is not implemented within the planned time.\nchecklist\nthe checklist in table 2.1 provides an overview of the isms requirements; it can\nroughly assess the degree of implementation.\nconclusion\nlooking back, one can see that the requirements from the main part of iso 27001\nmostly concern things that are already implemented in an organization. what may be new\nis that these elements are"", metadata={'doc_ID': 3203, 'original_text': '- the isms is considered effective when, after a certain period, it can meet the requirements and achieve the security objectives and maintain this situation continuously thereafter.\n- the issue of appropriateness is more challenging: for a larger organization where information values (assets) can have catastrophic consequences if lost, a minimal approach to an isms (a security officer with few procedures and control capabilities) would certainly not be appropriate.\n- if there are few information values with high and very high risks, an isms with a lot of personnel, resources, and high organizational structure would be considered excessive and therefore also not appropriate.\n- the described negative examples undoubtedly have potential for improvement - here, for example, it must be evident to an auditor that the organization is responding and planning for improvement and implementing this planning progressively.\n- the checklist in table 2.1 provides an overview of the isms requirements; it can roughly assess the degree of implementation.\n- conclusion: looking back, one can see that the requirements from the main part of iso 27001 mostly concern things that are already implemented in an organization.', 'source': 'Kersten et al. - 2020 - IT-Sicherheitsmanagement nach der neuen ISO 27001_removed.pdf', 'title': 'Kersten et al. - 2020 - IT-Sicherheitsmanagement nach der neuen ISO 27001_removed', 'relevance_score': 0.9912886}), Document(page_content='the isms, evaluating against the information security objectives\n * correspondence between the determined controls, the statement of applicability and the results of the information security risk assessment and risk treatment process and the information security policy and objectives\n * implementation of controls (see annex a), taking into account the external and internal context\n * and related risks, the organization’s monitoring, measurement and analysis of information security\n * processes and controls to determine whether controls are implemented and effective and meet their stated information security objectives\n * programmes, processes, procedures, records, internal audits and reviews of the isms effectiveness to ensure that these are traceable to top management decisions and the information security policy and objectives\nonce you have completed stage two and passed the audit — you will receive your\nofficial certification.\n * surveillance/periodic audits: happen between certification and recertification audits focusing on specific areas of the isms. this is done every year.\n * recertification audit: this is necessary to keep your certification and covers all aspects of the standard and must be carried out every 3 years.\n## how long does it take to get ready for an iso 27001 external audit?\ndepending on the size of your company or organisation, you can be audit-ready\nin about 8 weeks. if you decide to go the manual route of building your\ndocumentation from scratch, it can take at least', metadata={'source': 'https://www.dataguard.co.uk/knowledge/iso-27001-certification/', 'title': 'ISO 27001 Certification: Your ultimate guide [free guide available]', 'description': 'No matter if you’re an SMB or an international corporation — getting an ISO 27001 certification should be on your agenda. Here’s the ultimate guide on how.', 'language': 'en-gb', 'original_text': '- implementation of controls (see annex a), taking into account the external and internal context\n- and related risks, the organization’s monitoring, measurement and analysis of information security\n- processes and controls to determine whether controls are implemented and effective and meet their stated information security objectives\n- programmes, processes, procedures, records, internal audits and reviews of the isms effectiveness to ensure that these are traceable to top management decisions and the information security policy and objectives', 'doc_ID': 141, 'relevance_score': 0.9822877}), Document(page_content=""in the iso/iec 27001 standard. the certification body will take the time to gain a sufficient understanding of the isms design in the context of your organization, risk assessment and treatment (including the controls determined), information security policy and objectives. a large emphasis will also be put on your company's preparedness for the audit. this allows planning for stage 2. * **stage 2 audit:** based on documented findings in stage 1's audit report, the certification body will develop an audit plan to conduct stage 2 of the audit. in addition to evaluating the effective implementation of the isms, the aim of stage 2 is to confirm that your company adheres to its own policies, objectives and procedures.\nto do this, the audit will focus on:\n * top management leadership and commitment to information security policy and the information security objectives\n * documentation requirements listed in iso/iec 27001\n * assessment of information security-related risks and that the assessments produce consistent, valid and comparable results if repeated\n * determination of control objectives and controls based on the information security risk assessment risk treatment processes\n * information security performance and the effectiveness of the isms, evaluating against the information security objectives\n * correspondence between the determined controls, the statement of applicability and the results of the information security risk assessment and risk treatment process and the information security"", metadata={'source': 'https://www.dataguard.co.uk/knowledge/iso-27001-certification/', 'title': 'ISO 27001 Certification: Your ultimate guide [free guide available]', 'description': 'No matter if you’re an SMB or an international corporation — getting an ISO 27001 certification should be on your agenda. Here’s the ultimate guide on how.', 'language': 'en-gb', 'original_text': '- documentation requirements listed in iso/iec 27001\n- determination of control objectives and controls based on the information security risk assessment risk treatment processes\n- information security performance and the effectiveness of the isms, evaluating against the information security objectives', 'doc_ID': 140, 'relevance_score': 0.9711291}), Document(page_content='more comprehensive. please refer again to the explanations on the scope in isms-4.3.\n(e) the top management level should ensure the achievement of the isms objectives.\nthis requirement is intended to remind the top management level that it is ultimately their responsibility to ensure a correctly functioning and effective isms. while the operational security responsibility within the organization can be delegated, for example, to the role of an it security officer, the top management level does not absolve itself of the fundamental leadership task and responsibility in terms of information security.\nwhat can the top management level do to ensure the achievement of the objectives?\nespecially in the initial phase, this includes creating an effective organizational structure for the isms, filling necessary roles with qualified personnel in a timely manner, and providing necessary resources for the isms.\nin later phases, it is more about comparing expectations with the results of the isms. an important tool for this is the so-called management review, which should be carried out regularly (e.g. once a year) by the top management level. we will discuss this in detail in connection with isms-10. it assesses the performance and achievement of the isms objectives: if they are not sufficient, corrective measures must be ordered. the evaluation also includes reports on security incidents that have occurred and the resulting consequences.\nthere are generally risks involved in achieving the objectives: what can', metadata={'doc_ID': 2604, 'original_text': '- ""the top management level should ensure the achievement of the isms objectives.""\n- ""this requirement is intended to remind the top management level that it is ultimately their responsibility to ensure a correctly functioning and effective isms.""\n- ""what can the top management level do to ensure the achievement of the objectives?""\n- ""especially in the initial phase, this includes creating an effective organizational structure for the isms, filling necessary roles with qualified personnel in a timely manner, and providing necessary resources for the isms.""\n- ""in later phases, it is more about comparing expectations with the results of the isms.""\n- ""an important tool for this is the so-called management review, which should be carried out regularly (e.g. once a year) by the top management level.""\n- ""it assesses the performance and achievement of the isms objectives: if they are not sufficient, corrective measures must be ordered.""\n- ""the evaluation also includes reports on security incidents that have occurred and the resulting consequences.""', 'source': 'ISO 27001_2022_Kersten_und_Schroeder.pdf', 'title': 'ISO 27001 2022', 'relevance_score': 0.96926606}), Document(page_content='of measurements. an interesting aspect here would be the degree of implementation as an average across all controls of the isms - for example, as the average of individual values or with appropriate weighting. it is clear that this average/weighted degree of implementation says something about the effectiveness of the isms: information security can only be incomplete if the controls are not fully implemented, i.e. the isms does not provide full performance and is most likely not fully effective.\nof course, there are dependencies between the aspects of the correctness of implementation, effectiveness, and adequacy. a precise separation is difficult. however, it is clear that these aspects are the focus of performance evaluation, as isms-10 also emphasizes.\nin addition to these measurements/monitoring of security objectives, other (extended) objectives are of interest to the organization: adherence to planned budgets or monitoring of overall resource consumption, adherence to deadlines in the establishment and operation of the isms, etc. the degree of goal achievement is also interesting for such objectives and contributes to the performance of the isms and information security. measurements could be carried out by comparing them with the planning (budget, resource, implementation plan).\none final, but central and measurable objective of the organization for this book: the conformity of the isms with iso 27001. the degree of compliance with individual norm requirements can be monitored and measured by', metadata={'doc_ID': 2666, 'original_text': '- the degree of implementation as an average across all controls of the isms\n- the effectiveness of the isms\n- dependencies between the aspects of the correctness of implementation, effectiveness, and adequacy\n- the focus of performance evaluation\n- adherence to planned budgets or monitoring of overall resource consumption\n- adherence to deadlines in the establishment and operation of the isms\n- the degree of goal achievement\n- the conformity of the isms with iso 27001\n- the degree of compliance with individual norm requirements', 'source': 'ISO 27001_2022_Kersten_und_Schroeder.pdf', 'title': 'ISO 27001 2022', 'relevance_score': 0.9683214}), Document(page_content='we have already considered these aspects in the measurements/audits of the isms processes and controls. if no objections arise here, an isms generally delivers the expected performance (= the expected result). the question of adequacy can also be asked for the isms as a whole - analogous to the consideration of controls.\nin terms of effectiveness, it must be assessed whether the organization achieves its security objectives according to isms-5.1 (a) overall. to put it differently, it is difficult to imagine achieving security objectives if:\n- security incidents occur frequently and cause damage,\n- security vulnerabilities exist that pose potential risks,\n- other known risks have not been addressed, or\n- the required controls have not been fully implemented.\nlet\'s go through the four points mentioned above.\nregarding security incidents, one could say: the less incidents and the smaller their impact on the organization, the higher or better the effectiveness of the isms. so what should be monitored/measured in this case? we analyze the security incidents recorded in a ticket system and also capture the severity of the incidents or their damage class (alternatively, their processing priority in the ticket system). this way, we have determined the number of security incidents for each damage class defined in the risk analysis during the considered period. since serious incidents should have a greater impact in the assessment than minor ones, it leads to a product formation of ""number x damage class,"" whose', metadata={'doc_ID': 2664, 'original_text': '- the question of adequacy can also be asked for the isms as a whole - analogous to the consideration of controls.\n- in terms of effectiveness, it must be assessed whether the organization achieves its security objectives according to isms-5.1 (a) overall.\n- the less incidents and the smaller their impact on the organization, the higher or better the effectiveness of the isms.\n- we analyze the security incidents recorded in a ticket system and also capture the severity of the incidents or their damage class (alternatively, their processing priority in the ticket system).\n- this way, we have determined the number of security incidents for each damage class defined in the risk analysis during the considered period.', 'source': 'ISO 27001_2022_Kersten_und_Schroeder.pdf', 'title': 'ISO 27001 2022', 'relevance_score': 0.9675945})]","The three levels considered when evaluating the security and effectiveness of the ISMS are:
1. Level - Monitoring, measurement, analysis, and evaluation by the responsible authorities or roles for security (topic 9.1)
2. Level - Review and assessment of security by an independent body separate from operational security (internal audit) (topic 9.2)
3. Level - Evaluation of the ISMS by top management (topic 9.3)","The three levels considered when evaluating the security and effectiveness of the ISMS are as follows:
1. Level 1: Monitoring, measurement, analysis, and evaluation by the security responsible roles within the organization (clause 9.1).
2. Level 2: Review and assessment of security by an entity independent of operational security (internal audit) (clause 9.2).
3. Level 3: Evaluation of the ISMS by top management (clause 9.3).",True,0.8333333333333333,0.6461538461538462,0.8181818181818182,0.45805561169981956,0.9999662637710571,0.9616434107041613,1.0,0.9571218383132315,1.6359987258911133,3.0662879943847656,0.001962900161743164,4.702286720275879
Fine-tuned_finetuned-ISO-27001_1024_l2_All_1536_264_False_Kers,Hybrid_Rerank_Cohere_Compression,8,gpt-3.5-turbo-16k,16385,0,1,What aspects are reviewed in internal audits for ISO 27001 according to NA 9.2 and what information should be specified in the audit program to effectively manage these tasks?,"[Document(page_content=""* the audit must cover all aspects of the isms, including risk assessment, information security controls, isms documentation, awareness and training, and management review. * the audit findings must be documented in a report that is submitted to the organisation's management.\norganisations that are certified according to iso 27001 must also undergo an\nexternal audit by a certification body. there are two kinds of external audit,\none conducted once annually called a surveillance audit where the isms will be\nreviewed as part of ongoing evaluation and the other known as a full external\naudit which is more in-depth and conducted every three years.\nbenefits of iso 27001 audit:\n * improved information security posture * reduced risk of information security incidents * increased compliance with regulations * improved customer confidence * competitive advantage\nif you are considering implementing iso 27001 or if you are already certified,\nit is important to ensure that you are conducting regular internal audits.\ninternal audits are an essential tool for maintaining an effective isms and\nprotecting your organisation from information security threats.\n## where is an internal audit mandatory?\nan internal audit is not required by law or regulation. however, it is a good\npractice for all organisations to conduct regular internal audits of their\ninformation security and other management systems.\nin order to comply with iso 27001, all companies must conduct internal"", metadata={'source': 'https://www.dataguard.co.uk/knowledge/iso-27001/clause-9-2-internal-audit/', 'title': 'ISO 27001 Clause 9.2: Internal Audit', 'description': 'Ensure your ISMS is operating effectively for ISO 27001 compliance. Learn all you need to know about ISO 27001 Clause 9.2 internal audits in our guide.\n', 'language': 'en-gb', 'original_text': '* the audit must cover all aspects of the isms, including risk assessment, information security controls, isms documentation, awareness and training, and management review.\n* if you are considering implementing iso 27001 or if you are already certified, it is important to ensure that you are conducting regular internal audits.\n* internal audits are an essential tool for maintaining an effective isms and protecting your organisation from information security threats.\n* in order to comply with iso 27001, all companies must conduct internal', 'doc_ID': 422, 'relevance_score': 0.9936611}), Document(page_content='findings:** the organisation should follow up on the audit findings and implement any necessary corrective actions.\n## what to look for during an iso 27001 internal audit\nduring an iso 27001 internal audit, the auditor will look for evidence that\nthe isms is conforming to the requirements of iso 27001 and that it is\noperating effectively. the auditor will focus on the following areas and\nevidence that supports them:\n * risk assessment: the auditor will assess whether the organisation has conducted a thorough risk assessment and whether the identified risks have been appropriately addressed. * information security controls: the auditor will assess whether the organisation has implemented and is maintaining appropriate information security controls to mitigate the identified risks. * isms documentation: the auditor will assess whether the isms is adequately documented. you can find a list of the required documentation for the iso 27001 certification here. * awareness and training: the auditor will assess whether staff are aware of their information security responsibilities and have received appropriate training. * management review: the auditor will assess whether the organisation conducts regular management reviews of the isms.\n## how to report on the findings of an iso 27001 internal audit\nthe audit findings should be documented in a report. this report should\ninclude the following:\n * audit objectives: the audit objectives should be clearly stated in the report.', metadata={'description': 'Ensure your ISMS is operating effectively for ISO 27001 compliance. Learn all you need to know about ISO 27001 Clause 9.2 internal audits in our guide.\n', 'doc_ID': 424, 'language': 'en-gb', 'original_text': '- the auditor will focus on the following areas and evidence that supports them:\n- risk assessment: the auditor will assess whether the organisation has conducted a thorough risk assessment and whether the identified risks have been appropriately addressed.\n- information security controls: the auditor will assess whether the organisation has implemented and is maintaining appropriate information security controls to mitigate the identified risks.\n- isms documentation: the auditor will assess whether the isms is adequately documented.\n- awareness and training: the auditor will assess whether staff are aware of their information security responsibilities and have received appropriate training.\n- management review: the auditor will assess whether the organisation conducts regular management reviews of the isms.', 'source': 'https://www.dataguard.co.uk/knowledge/iso-27001/clause-9-2-internal-audit/', 'title': 'ISO 27001 Clause 9.2: Internal Audit', 'relevance_score': 0.9900251}), Document(page_content='meaning that they should generally not be operational in security or the isms themselves.\nin this regard, auditors, employees from other organizational areas, or representatives for other issues (e.g., a qm representative) could be considered. the use of external auditors could also be considered.\nthese audits are specific, but regular and occasion-based inspections. the explanations regarding na 9.1 also apply here accordingly.\nwhat is the subject of these audits now? it should be checked whether the isms has been established according to the plan, operates according to the mandate, is effective, and complies with the requirements of iso 27001.\nto manage these tasks, the organization should establish an audit program\nthat includes different audits, their subject, frequency, responsible personnel, as well as the type of documentation and reporting.\neach audit needs to be planned in terms of schedule, content, and procedure (audit plan), and the actual process, findings, and results need to be documented (audit report). the audit report should list and evaluate any identified deficiencies, provide necessary corrective actions and set deadlines for them; their implementation should be demonstrated afterwards.\nregarding the complex topic of effective planning and implementation of audits, we provide guidance in chapter 5 of this book.\nna 9.3 - management review\nthe top management must regularly review the isms and make decisions on possible improvements and necessary changes. the goal of the management', metadata={'doc_ID': 3198, 'original_text': '- ""these audits are specific, but regular and occasion-based inspections.""\n- ""what is the subject of these audits now?""\n- ""to manage these tasks, the organization should establish an audit program""\n- ""that includes different audits, their subject, frequency, responsible personnel, as well as the type of documentation and reporting.""\n- ""each audit needs to be planned in terms of schedule, content, and procedure (audit plan), and the actual process, findings, and results need to be documented (audit report).""\n- ""regarding the complex topic of effective planning and implementation of audits, we provide guidance in chapter 5 of this book.""', 'source': 'Kersten et al. - 2020 - IT-Sicherheitsmanagement nach der neuen ISO 27001_removed.pdf', 'title': 'Kersten et al. - 2020 - IT-Sicherheitsmanagement nach der neuen ISO 27001_removed', 'relevance_score': 0.9850429}), Document(page_content=""to stakeholders that the isms is operating effectively and that the organisation is taking steps to protect its sensitive information.\n## does iso 27001 require an internal audit?\nyes, iso 27001 requires organisations to conduct regular internal audits of\ntheir information security management system. this is stated in clause 9.2 of\nthe standard, which states that:\nthe organisation shall conduct internal audits at planned intervals to provide\ninformation on whether the isms:\n 1. conforms to the organisation's own requirements for its information security management system; and 2. meets the requirements of this international standard.\nthe standard does not specify how often internal audits should be conducted,\nbut it is recommended that they be conducted at least annually.\ninternal audits are an important part of maintaining an effective isms. they\nhelp organisations to identify and address any weaknesses in their isms before\nthey are exploited by attackers.\n## what are iso 27001 internal audit requirements?\niso 27001 audit requirements:\n * the audit must be conducted by an independent auditor who is qualified to audit iso 27001. * the audit must be planned and conducted in accordance with a documented audit methodology. * the audit must cover all aspects of the isms, including risk assessment, information security controls, isms documentation, awareness and training, and management review. * the audit findings must be documented in a report that is submitted to the"", metadata={'source': 'https://www.dataguard.co.uk/knowledge/iso-27001/clause-9-2-internal-audit/', 'title': 'ISO 27001 Clause 9.2: Internal Audit', 'description': 'Ensure your ISMS is operating effectively for ISO 27001 compliance. Learn all you need to know about ISO 27001 Clause 9.2 internal audits in our guide.\n', 'language': 'en-gb', 'original_text': '- Yes, iso 27001 requires organisations to conduct regular internal audits of their information security management system.\n- The standard does not specify how often internal audits should be conducted, but it is recommended that they be conducted at least annually.\n- Internal audits are an important part of maintaining an effective isms.\n- They help organisations to identify and address any weaknesses in their isms before they are exploited by attackers.\n- The audit must be conducted by an independent auditor who is qualified to audit iso 27001.\n- The audit must be planned and conducted in accordance with a documented audit methodology.\n- The audit must cover all aspects of the isms, including risk assessment, information security controls, isms documentation, awareness and training, and management review.\n- The audit findings must be documented in a report that is submitted to the stakeholders.', 'doc_ID': 421, 'relevance_score': 0.98403233}), Document(page_content='monitoring/measurement program according to isms-9.1, reports from conducted internal audits according to isms-9.2, the degree of fulfillment of security objectives (effectiveness).\n- have new risks been identified during the risk assessment in the past period? what is the status of risk treatment? the goal here is to be able to recognize consistent and prompt risk treatment.\n- are there any ideas and suggestions for improving the isms and its performance? such material can come from customers, partners, own staff or from external sources.\nthis comprehensive package of information must be made available to the management level from the isms and other sources.\nwhat should the output of the management review consist of? the management level should definitively determine what needs to be done for the continuous improvement of the isms and how to deal with recognized change needs in the isms for the next time interval.\nfrom this, specific tasks for individual organizational units and roles can be derived - this should also be associated with the release of corresponding resources, otherwise this action will be ineffective. it should not go unmentioned at this point that the result of the management review can also be ""continue as before"". however, based on all experience, this is likely to be a rare exception.\ndue to the character of the assignment, but also due to the fundamental requirement of traceability of all processes, the results of the management review must be documented information (in writing)', metadata={'source': 'ISO 27001_2022_Kersten_und_Schroeder.pdf', 'title': 'ISO 27001_2022_Kersten_und_Schroeder', 'original_text': '- reports from conducted internal audits according to isms-9.2', 'doc_ID': 2678, 'relevance_score': 0.9806178}), Document(page_content=""shall monitor and measure;\ne) when the results from monitoring and measurement shall be analysed and evaluated; and\nf} who shall analyse and evaluate these results.\nthe organization shall retain appropriate documented information as evidence of the monitoring and\nmeasurement results.\n9.2 internal audit\nthe organization shall conduct internal audits at planned intervals to provide information on whether\nthe information security management system:\na) conforms to\n1) the organization's own requirements for its information security management system; and\n2) the requirements of this international standard;\nb) is effectively implemented and maintained.\nthe organization shall:\nc) plan, establish, implement and maintain an audit programme(s), including the frequency, methods,\nresponsibilities, planning requirements and reporting. the audit programme(s) shall take into\nconsideration the importance of the processes concerned and the results of previous audits;\nd) define the audit criteria and scope for each audit;\ne) select auditors and conduct audits that ensure objectivity and the impartiality of the audit process;\nf) ensure that the results of the audits are reported to relevant management; and\ng) retain documented information as evidence of the audit programme(s) and the audit results.\n9.3 management review\ntop management shall review the organization's information security management system at planned\nintervals to ensure its continuing suitability, adequacy and effectiveness.\nthe management review shall"", metadata={'doc_ID': 3005, 'original_text': ""9.2 internal audit\nthe organization shall conduct internal audits at planned intervals to provide information on whether\nthe information security management system:\na) conforms to\n1) the organization's own requirements for its information security management system; and\n2) the requirements of this international standard;\nb) is effectively implemented and maintained.\nthe organization shall:\nc) plan, establish, implement and maintain an audit programme(s), including the frequency, methods,\nresponsibilities, planning requirements and reporting. the audit programme(s) shall take into\nconsideration the importance of the processes concerned and the results of previous audits;\nd) define the audit criteria and scope for each audit;\ne) select auditors and conduct audits that ensure objectivity and the impartiality of the audit process;\nf) ensure that the results of the audits are reported to relevant management; and\ng) retain documented information as evidence of the audit programme(s) and the audit results."", 'source': 'ISO 27001 2013 (E).pdf', 'title': 'ISO 27001 2013 (E)', 'relevance_score': 0.9559814}), Document(page_content=""to ensure\nvalid results. the methods selected should produce comparable and reproducible results to be\nconsidered valid;\nc) when the monitoring and measuring shall be performed;\nd) who shall monitor and measure;\ne) when the results from monitoring and measurement shall be analysed and evaluated;\nf) who shall analyse and evaluate these results.\ndocumented information shall be available as evidence of the results.\nthe organization shall evaluate the information security performance and the effectiveness of the\ninformation security management system.\n9.2 internal audit\n9.2.1 general\nthe organization shall conduct internal audits at planned intervals to provide information on whether\nthe information security management system:\na) conforms to\n1) the organization's own requirements for its information security management system;\n8 © iso/iec 2022 - all rights reserved\niso/iec 27001:2022(e)\n2) the requirements of this document;\nb) is effectively implemented and maintained.\n9.2.2 internal audit programme\nthe organization shall plan, establish, implement and maintain an audit programme(s), including the\nfrequency, methods, responsibilities, planning requirements and reporting.\nwhen establishing the internal audit programme(s), the organization shall consider the importance of\nthe processes concerned and the results of previous audits.\nthe organization shall:\na) define the audit criteria and scope for each audit;\nb) select auditors and conduct audits that ensure objectivity and the impartiality of the"", metadata={'doc_ID': 1552, 'original_text': ""- 9.2 internal audit\n- 9.2.1 general\n- the organization shall conduct internal audits at planned intervals to provide information on whether the information security management system:\n- a) conforms to\n- 1) the organization's own requirements for its information security management system;\n- 2) the requirements of this document;\n- b) is effectively implemented and maintained.\n- 9.2.2 internal audit programme\n- the organization shall plan, establish, implement and maintain an audit programme(s), including the frequency, methods, responsibilities, planning requirements and reporting.\n- when establishing the internal audit programme(s), the organization shall consider the importance of the processes concerned and the results of previous audits.\n- the organization shall:\n- a) define the audit criteria and scope for each audit;\n- b) select auditors and conduct audits that ensure objectivity and the impartiality of the"", 'source': 'ISO27001-2022_EN.pdf', 'title': 'ISO27001 2022 EN', 'relevance_score': 0.9559814}), Document(page_content='is\nthat you select some basic measurements that are easy to collect and interpret and use\nthose for a while. after some time has passed it will probably become obvious that other\nspecific measurements are needed to be able to assess whether things are going well so\nthese can be added gradually. be careful not to start with a wide range of possibly\nmeaningless, hard to collect measurements that will simply slow everything down and give\nthe isms a bad reputation before it has got going.\nhaving chosen your measurements you need to decide what does “good” look like; what\nnumerical values would mean that performance is in line with expectations? again, the\ndefinition of your objectives may need tweaking over time as you gain experience with\ntaking the measurements and your isms moves from implementation mode into ongoing\noperation mode.\nif you find that your objectives are not being met, then an improvement may be required to\nbring the situation back into line; such improvements should be added to the\nnonconformity and corrective action log provided within the toolkit and tracked through to\ncompletion.\n3.10.2 clause 9.2 internal audit\nthe standard requires that there is an internal auditing programme in place which audits all\naspects of the isms within a reasonable period. if you embrace the idea of internal auditing\nas a useful early warning of any issues at external audit, then you won’t go far wrong.\ninternal audits should ensure that there are no surprises during the annual\n page 33 of 79\niso/iec 27001', metadata={'source': 'CERTIKIT_ISO27001_Implementation_Guide_v12.pdf.pdf', 'title': 'CERTIKIT_ISO27001_Implementation_Guide_v12.pdf', 'original_text': '- 3.10.2 clause 9.2 internal audit\n- the standard requires that there is an internal auditing programme in place which audits all aspects of the isms within a reasonable period.', 'doc_ID': 889, 'relevance_score': 0.95041096})]","The following aspects are reviewed in internal audits according to topic 9.2:
1. The establishment of the ISMS according to the planning
2. The proper functioning of the ISMS
3. The effectiveness of the ISMS
4. Compliance with the requirements of ISO 27001

To effectively manage these tasks, the audit program should specify the following:
1. Different audits with their subject and frequency
2. The responsible personnel for conducting the audits
3. The type of documentation and reporting
4. An audit plan with scheduling, content, and procedural planning
5. Documentation of findings and results in the audit report
6. Inclusion and evaluation of identified deficiencies in the audit report
7. Specification and scheduling of corrective actions
8. Evidence of implementation of corrective actions in the aftermath","In internal audits for ISO 27001 according to NA 9.2, the aspects reviewed include conformity to the organization's own requirements and the requirements of the standard, as well as the effective implementation and maintenance of the information security management system. To effectively manage these tasks, the audit program should specify the frequency, methods, responsibilities, planning requirements, and reporting for the audits. Additionally, the audit program should define the audit criteria and scope for each audit, select auditors ensuring objectivity and impartiality, report results to relevant management, and retain documented information as evidence of the audit program and results. The audit program should consider the importance of the processes concerned and previous audit results when planning, establishing, implementing, and maintaining the audit program.",True,0.5258964143426295,0.2329317269076305,0.38247011952191234,0.5263393297791481,0.9999665021896362,0.8184637820637625,1.0,0.9878241123207143,1.6615509986877441,3.219856023788452,0.0029964447021484375,4.881407022476196
Fine-tuned_finetuned-ISO-27001_1024_l2_All_1536_264_False_Kers,Hybrid_Rerank_Cohere_Compression,8,gpt-3.5-turbo-16k,16385,0,1,What steps need to be taken to address a deviation of the ISMS from the ISO 27001 norm and what measures can be taken to eliminate the causes of the deviation?,"[Document(page_content='the\nrequirements of iso 27001. such a deviation may come to light accidentally,\nhave been specifically identified through a review (e.g., during an internal audit),\nor have been noticed by third parties.\nna 10.1 - non-conformity and corrective actions\nthe most important requirement is to address a deviation (immediately):\nit should be considered whether a more detailed monitoring is necessary (to better\nunderstand the situation), which corrective actions can be taken, whether there\ncould be disadvantages for the organization until implementation, and how to deal\nwith it (norm point a).\nnorm point b requires an evaluation of possible actions to eliminate\nthe causes of a deviation. this should be examined in more detail, an investigation\ninto the causes (how it happened) should be conducted, and an analysis should be\ncarried out to determine if the deviation exists elsewhere or could recur in a similar form.\nfor all actions: they must be appropriate in relation to the negative consequences\nof a persistent deviation: deviations with minor consequences should not lead to\nactions with high costs, for example.\nnorm points c, d, e require that the planned actions are implemented and\ntheir effectiveness is monitored. changes to the isms and its processes may also be necessary.\nas usual, everything must be documented or recorded here: the deviation itself,\nits causes and treatment, the verification of the effectiveness of the actions taken.\nna 10.2 - continuous improvement\nin many preceding sections of the', metadata={'doc_ID': 3201, 'original_text': '- the requirements of iso 27001\n- a deviation (immediately)\n- norm point a\n- norm point b\n- norm points c, d, e\n- na 10.2 - continuous improvement', 'source': 'Kersten et al. - 2020 - IT-Sicherheitsmanagement nach der neuen ISO 27001_removed.pdf', 'title': 'Kersten et al. - 2020 - IT-Sicherheitsmanagement nach der neuen ISO 27001_removed', 'relevance_score': 0.9984988}), Document(page_content='must be observed.\n88 2 requirements for the isms\nisms-10.2 nonconformity and corrective measures\ndeviation from the norm concerns circumstances in an isms that contradict or at least do not fully meet the requirements of iso 27001.\nsuch deviations can be identified in internal audits and certification audits - of course, they can also be discovered by any other form of examination within the framework of the isms. sometimes they are also detected more or less accidentally. however, a corresponding correction is necessary in order to achieve or maintain conformity with the norm. in terms of correction, the following requirements (a) to (g) are made in isms-10.2.\nin clause (a), it is required to react to any occurring (i.e. known) deviation from the norm by initially planning and scheduling a suitable correction (measure).\noften there seems to be a simple correction for a deviation - here a short document, there a quick measure! however, if you analyze it more closely, you will find that this correction ""has wider implications"" - i.e. has consequences for other areas in the isms, perhaps even causes new deviations there. in view of this experience, it is required to first consider the consequences of the planned correction and only then implement it.\nclause (b) essentially asks the following question: how did the deviation in question occur? there must be causes for this. perhaps a certain requirement of the norm was simply overlooked or misunderstood, initially postponed and later forgotten. of course,', metadata={'source': 'ISO 27001_2022_Kersten_und_Schroeder.pdf', 'title': 'ISO 27001_2022_Kersten_und_Schroeder', 'original_text': '- isms-10.2 nonconformity and corrective measures\n- deviation from the norm concerns circumstances in an isms that contradict or at least do not fully meet the requirements of iso 27001.\n- in terms of correction, the following requirements (a) to (g) are made in isms-10.2.\n- in clause (a), it is required to react to any occurring (i.e. known) deviation from the norm by initially planning and scheduling a suitable correction (measure).\n- often there seems to be a simple correction for a deviation - here a short document, there a quick measure! however, if you analyze it more closely, you will find that this correction ""has wider implications"" - i.e. has consequences for other areas in the isms, perhaps even causes new deviations there. in view of this experience, it is required to first consider the consequences of the planned correction and only then implement it.\n- clause (b) essentially asks the following question: how did the deviation in question occur? there must be causes for this. perhaps a certain requirement of the norm was simply overlooked or misunderstood, initially postponed and later forgotten. of course,', 'doc_ID': 2682, 'relevance_score': 0.9975177}), Document(page_content=""a security policy is not up to date. * **major nonconformity:** a firewall is misconfigured, allowing unauthorized access to the organisation's network. * **minor nonconformity:** a user account is not properly disabled when an employee leaves the organisation. * **major nonconformity:** a data breach occurs due to a lack of security controls. * **minor nonconformity:** a security training session is not conducted on time. * **major nonconformity:** employees are not following security procedures, such as using strong passwords and avoiding phishing emails.\norganisations should have a process in place for identifying, reporting, and\nresolving both minor and major nonconformities. this process should be\ndocumented and communicated to all employees.\nby promptly addressing nonconformities, organisations can help to improve the\noverall effectiveness of their isms and protect their information assets.\n### what are corrective actions in iso 27001?\nonce the root cause of a nonconformity has been determined, the organisation\nshould take corrective action to eliminate the cause and prevent it from\nhappening again. corrective action may involve changing policies and\nprocedures, training employees, or implementing new security controls.\n## nonconformity and corrective action process\nthe following is a general overview of the nonconformity and corrective action\nprocess:\n 1. **identify the nonconformity:** this can be done through a variety of means, such as internal audits,"", metadata={'description': 'Identify & address Nonconformities in your ISMS to improve information security, according to ISO 27001 clause 10.2. Explore our Comprehensive Guide Today!', 'doc_ID': 438, 'language': 'en-gb', 'original_text': ""- a security policy is not up to date.\n- a firewall is misconfigured, allowing unauthorized access to the organisation's network.\n- a data breach occurs due to a lack of security controls.\n- employees are not following security procedures, such as using strong passwords and avoiding phishing emails.\n- organisations should have a process in place for identifying, reporting, and resolving both minor and major nonconformities.\n- by promptly addressing nonconformities, organisations can help to improve the overall effectiveness of their isms and protect their information assets.\n- once the root cause of a nonconformity has been determined, the organisation should take corrective action to eliminate the cause and prevent it from happening again.\n- corrective action may involve changing policies and procedures, training employees, or implementing new security controls.\n- the following is a general overview of the nonconformity and corrective action process:\n- identify the nonconformity: this can be done through a variety of means, such as internal audits."", 'source': 'https://www.dataguard.co.uk/knowledge/iso-27001/clause-10-2-nonconformity-and-corrective-action/', 'title': 'ISO 27001 Clause 10.2: Nonconformity and Corrective Action', 'relevance_score': 0.9953544}), Document(page_content=""in isms maintenance\ntrain personnel on common threats facing your organization and how to respond\nestablish disciplinary or sanctions policies or processes for personnel found\nout of compliance with information security requirements\n12\nperform an internal audit\nallocate internal resources with necessary competencies who are independent of\nisms development and maintenance, or engage an independent third party\nverify conformance with requirements from annex a deemed applicable in your\nisms's statement of applicability\nshare internal audit results, including nonconformities, with the isms\ngoverning body and senior management\naddress identified issues before proceeding with the external audit\n13\nundergo external audit of isms to obtain iso 27001 certification\nengage an independent iso 27001 auditor\nconduct stage 1 audit consisting of an extensive documentation review; obtain\nfeedback regarding readiness to move to stage 2 audit\nconduct stage 2 audit consisting of tests performed on the isms to ensure\nproper design, implementation, and ongoing functionality; evaluate fairness,\nsuitability, and effective implementation and operation of controls\n14\naddress any nonconformities\nensure that all requirements of the iso 27001 standard are being addressed\nensure org is following processes that it has specified and documented\nensure org is upholding contractual requirements with third parties\naddress specific nonconformities identified by the iso 27001 auditor\nreceive auditor’s formal validation"", metadata={'description': 'Our ISO 27001 compliance checklist will help simplify your path to compliance.', 'doc_ID': 11, 'language': 'en', 'original_text': '- address any nonconformities\n- ensure that all requirements of the iso 27001 standard are being addressed\n- ensure org is following processes that it has specified and documented\n- ensure org is upholding contractual requirements with third parties\n- address specific nonconformities identified by the iso 27001 auditor', 'source': 'https://www.vanta.com/resources/iso-27001-compliance-checklist', 'title': 'The ISO 27001 compliance checklist', 'relevance_score': 0.9939496}), Document(page_content=""clause 10.2 of iso 27001 requires organisations to identify, investigate, and\nresolve nonconformities. a nonconformity is a departure from the requirements\nof the isms.\nthis article will discuss the requirements of iso 27001 clause 10.2 and\nprovide guidance on how to implement a nonconformity and corrective action\nprocess in order to achieve or maintain an iso 27001 certification.\n### what is a nonconformity in iso 27001?\nnonconformities can be identified through a variety of means, such as internal\naudits, management reviews, and external audits. once a nonconformity has been\nidentified, the organisation should investigate it to determine the root cause\nand any potential impact on information security.\n## what is the difference between minor nonconformities and major\nnonconformities?\nthe difference between minor nonconformities and major nonconformities is the\nseverity of the impact on the organisation's information security management\nsystem.\nminor nonconformities are those that do not have a significant impact on the\neffectiveness of the isms. they may be isolated incidents or one-off\noccurrences. minor nonconformities can be dealt with relatively quickly and\neasily, and they do not necessarily require immediate corrective action.\nmajor nonconformities, on the other hand, are those that have a significant\nimpact on the effectiveness of the isms. they may be systemic problems that\ncould lead to serious information security risks. major nonconformities\nrequire immediate corrective action to mitigate"", metadata={'description': 'Identify & address Nonconformities in your ISMS to improve information security, according to ISO 27001 clause 10.2. Explore our Comprehensive Guide Today!', 'doc_ID': 436, 'language': 'en-gb', 'original_text': ""- clause 10.2 of iso 27001 requires organisations to identify, investigate, and resolve nonconformities.\n- nonconformities can be identified through a variety of means, such as internal audits, management reviews, and external audits.\n- once a nonconformity has been identified, the organisation should investigate it to determine the root cause and any potential impact on information security.\n- the difference between minor nonconformities and major nonconformities is the severity of the impact on the organisation's information security management system.\n- minor nonconformities can be dealt with relatively quickly and easily, and they do not necessarily require immediate corrective action.\n- major nonconformities require immediate corrective action to mitigate."", 'source': 'https://www.dataguard.co.uk/knowledge/iso-27001/clause-10-2-nonconformity-and-corrective-action/', 'title': 'ISO 27001 Clause 10.2: Nonconformity and Corrective Action', 'relevance_score': 0.9913223}), Document(page_content=""it.\nclause (b) essentially asks the following question: how did the deviation in question occur? there must be causes for this. perhaps a certain requirement of the norm was simply overlooked or misunderstood, initially postponed and later forgotten. of course, there can also be deeper causes - such as the use of rather unsuitable isms processes or procedures (e.g. for risk management according to isms-6). it is not without reason that the assumption is made that these causes could have caused further deviations, for example in another area of the isms, which have so far gone unnoticed. this assumption must be dispelled according to (b) - which requires a series of checks.\nafter these preparatory analyses, the correction can now be implemented (c). the effectiveness of the correction must be verified (d). if necessary, further changes in the isms may need to be made (e).\nnow, as usual, the requirement for documented information comes: the type of deviation, the planned activities for determining the causes, the planned correction of the deviation, and the result of the correction (deviation fixed yes/no) must be recorded; these records must be retained (f) and kept available (g).\nimplementation guidance for isms-10.2\nthe overlooking/forgetting of certain requirements of the norm is by no means uncommon in practice. this is also due to the fact that some requirements, which consist of only one sentence, result in many individual requirements when implemented. let's consider the following example from"", metadata={'source': 'ISO 27001_2022_Kersten_und_Schroeder.pdf', 'title': 'ISO 27001_2022_Kersten_und_Schroeder', 'original_text': 'clause (b) essentially asks the following question: how did the deviation in question occur? there must be causes for this. perhaps a certain requirement of the norm was simply overlooked or misunderstood, initially postponed and later forgotten. of course, there can also be deeper causes - such as the use of rather unsuitable isms processes or procedures (e.g. for risk management according to isms-6). it is not without reason that the assumption is made that these causes could have caused further deviations, for example in another area of the isms, which have so far gone unnoticed. this assumption must be dispelled according to (b) - which requires a series of checks.\nafter these preparatory analyses, the correction can now be implemented (c). the effectiveness of the correction must be verified (d). if necessary, further changes in the isms may need to be made (e).\nimplementation guidance for isms-10.2', 'doc_ID': 2683, 'relevance_score': 0.99021614}), Document(page_content='wording of that specific standard itself, and to be\naware of any revisions to it. nonconformity with revisions or corrigendums\nwill jeopardize an existing certification. iso/iec 27001 itself is what any\nisms will be assessed against; where there is any conflict between advice\nprovided in this, in a supporting standard or any other guide to implementa-\ntion of is027001 and iso27001 itself, it is the wording in is027001 that\nshould be heeded.\nan external auditor will be assessing the isms against the published\nstandard, not against the advice provided by this book or any third party.\nit is critical, therefore, that those responsible for the isms should be able\nto refer explicitly to the clauses and intent of is027001 and should on\nthat basis be able to defend any implementation steps they have taken.\n41\n42\nit governance\nan appropriate first step is therefore to obtain and read iso/iec 27001\nitself. note that iso27001 uses the word ‘shall’ to indicate a requirement,\nwhereas the other standards in the family use ‘should’ to indicate good prac-\ntice which is not a requirement.\nthe uk accredited certification scheme was launched in april 1998, and\nthere is an isms users’ group that enables users to exchange information\non best practice and enables members to provide feedback on a regular basis\nto national standards bodies, and through them to the international\norganization for standardization.\niso/iec 27002\nin 1998, when the original bs7799 was revised for the first time, prior to\nbecoming bs7799 part 1,', metadata={'doc_ID': 1945, 'original_text': '- iso/iec 27001 itself is what any isms will be assessed against\n- where there is any conflict between advice provided in this, in a supporting standard or any other guide to implementation of is027001 and iso27001 itself, it is the wording in is027001 that should be heeded\n- an external auditor will be assessing the isms against the published standard, not against the advice provided by this book or any third party\n- it is critical, therefore, that those responsible for the isms should be able to refer explicitly to the clauses and intent of is027001 and should on that basis be able to defend any implementation steps they have taken\n- an appropriate first step is therefore to obtain and read iso/iec 27001 itself\n- iso27001 uses the word ‘shall’ to indicate a requirement, whereas the other standards in the family use ‘should’ to indicate good practice which is not a requirement\n- the uk accredited certification scheme was launched in april 1998, and there is an isms users’ group that enables users to exchange information on best practice and enables members to provide feedback on a regular basis to national standards bodies, and through them to the international organization for standardization\n- iso/iec', 'source': 'Watkins, Calder - 2020 - IT Governance - An International Guide to Data Security and ISO 27001 ISO 27002.pdf', 'title': 'IT Governance - An International Guide to Data Security and ISO 27001 ISO 27002', 'relevance_score': 0.99014014}), Document(page_content='the internal audit will help you find any nonconformities, determine the effectiveness of your isms, and discover any potential opportunities for improvement.\nimplement corrective actions from internal audit\nfrom the findings in your internal audit, implement corrective actions for any nonconformities. your plan should include: the nonconformity identified. how you intend to correct, control, and deal with the consequences of the nonconformity.\nthe root cause of the nonconformity.\nthe effectiveness of your correction. review your isms\nit’s required for senior-level management to continuously review the isms to ensure its effectiveness and that it meets your organization’s objectives. schedule recurring review meetings that go over: internal or external changes that impact the isms. status updates on past isms reviews.\nfeedback from internal audits, risk assessments, and interested parties.\nany updates or improvements. be sure to document the results and actions from your reviews. engage an accredited certification body\nonce you’re ready to go for iso 27001 certification, you’ll need to choose an accredited certification body to perform the audit—stage 1 and stage 2 audits. a stage 1 audit primarily reviews your documentation and determines your readiness for stage 2. stage 2 is a full review of your isms to ensure conformance with the requirements, that applicable controls are implemented and effective, and that you meet your internal policies and procedures. implement corrective', metadata={'description': ""Starting your journey to ISO 27001 compliance? Here's an easy-to-follow guide to get you on the right track"", 'doc_ID': 76, 'language': 'en', 'original_text': '- implement corrective actions from internal audit\n- from the findings in your internal audit, implement corrective actions for any nonconformities. your plan should include: the nonconformity identified. how you intend to correct, control, and deal with the consequences of the nonconformity.\n- the root cause of the nonconformity.\n- the effectiveness of your correction. review your isms\n- it’s required for senior-level management to continuously review the isms to ensure its effectiveness and that it meets your organization’s objectives. schedule recurring review meetings that go over: internal or external changes that impact the isms. status updates on past isms reviews.\n- feedback from internal audits, risk assessments, and interested parties.\n- any updates or improvements. be sure to document the results and actions from your reviews. engage an accredited certification body\n- once you’re ready to go for iso 27001 certification, you’ll need to choose an accredited certification body to perform the audit—stage 1 and stage 2 audits. a stage 1 audit primarily reviews your documentation and determines your readiness for stage 2. stage 2 is a full review of your isms to ensure conformance with the requirements, that applicable controls are implemented and effective, and', 'source': 'https://www.drata.com/blog/iso-27001-compliance', 'title': 'ISO 27001: A Beginner’s Guide', 'relevance_score': 0.99014014})]","Treating a deviation in the ISMS requires several steps. Firstly, detailed monitoring should be conducted to accurately capture the situation. Then corrective actions can be taken to eliminate the deviation. It is important to evaluate which measures are suitable for identifying and eliminating the causes of the deviation. A root cause analysis should be conducted to determine if the deviation exists elsewhere or can reoccur. All measures should be appropriate and weighed against the negative consequences of a persisting deviation. The implementation and effectiveness of the measures should be reviewed, and changes to the ISMS may be necessary. It is important to document all steps and outcomes.","To address a deviation of the ISMS from the ISO 27001 norm, the organization should follow the requirements outlined in ISMS-10.2. This includes promptly identifying the nonconformity, investigating the root cause, and determining the potential impact on information security. Once the root cause is identified, corrective action should be taken to eliminate the cause and prevent recurrence. This may involve changing policies, procedures, training employees, or implementing new security controls. The effectiveness of the correction should be verified, and further changes in the ISMS may be necessary. It is essential to continuously review the ISMS to ensure its effectiveness and meet organizational objectives. Engage an accredited certification body for ISO 27001 certification audits to validate conformance with the standard's requirements.",True,0.4608695652173913,0.18421052631578946,0.2956521739130435,0.619989424943924,0.9999140501022339,0.7446788280799432,1.0,0.932334477626378,1.8009977340698242,3.0339951515197754,0.002001523971557617,4.8349928855896
Fine-tuned_finetuned-ISO-27001_1024_l2_All_1536_264_False_Kers,Hybrid_Rerank_Cohere_Compression,8,gpt-3.5-turbo-16k,16385,0,1,"What purpose does a self-assessment play in evaluating the effectiveness of protective measures for an ISMS, and what consequences can deviations have?","[Document(page_content='objectives: if they are not sufficient, corrective measures must be ordered. the evaluation also includes reports on security incidents that have occurred and the resulting consequences.\nthere are generally risks involved in achieving the objectives: what can happen on the way to achieving the objectives and what are the consequences for the organization? conclusion: an isms requires qualified risk management, which should be established by the top management level as early as possible.\n(f) it must be ensured that all individuals in the target group contribute to the effectiveness of the isms.\nthe individuals mentioned must take responsibility for security in their work area or work processes so that the isms can fulfill its task. what does this mean specifically? each person in the target group must first know what security requirements apply to their own work area, what this means in practice, how deviations are identified, and that these deviations must be reported.\nas an example for such reports, let\'s take the ""ordinary"" user in the organization who uses an it application and suddenly notices long response times or incorrect data. the security management must be informed about this immediately. if this is not done, these error conditions could escalate, spread, and possibly be repairable only with great effort or reputation loss - scenarios that would contradict the organization\'s goals.\nit is important to realize that the individuals mentioned initially need to be sensitized and trained before they', metadata={'source': 'ISO 27001_2022_Kersten_und_Schroeder.pdf', 'title': 'ISO 27001_2022_Kersten_und_Schroeder', 'original_text': '- ""the evaluation also includes reports on security incidents that have occurred and the resulting consequences.""\n- ""conclusion: an isms requires qualified risk management""\n- ""it must be ensured that all individuals in the target group contribute to the effectiveness of the isms.""\n- ""each person in the target group must first know what security requirements apply to their own work area, what this means in practice, how deviations are identified, and that these deviations must be reported.""\n- ""the security management must be informed about this immediately.""\n- ""it is important to realize that the individuals mentioned initially need to be sensitized and trained before they""', 'doc_ID': 2605, 'relevance_score': 0.95318794}), Document(page_content='(normative point b), to the extent that they could have an impact on the isms.\n* normative point c) requires all findings (""feedback"") about the si\n-\nincluding: this could involve deviations from the requirements of iso 27001\nor insufficient rectification of the same, results of monitoring, measurements,\nand audits - of course also information about existing vulnerabilities and risks,\ntheir treatment (norm point e), and occurred security incidents.\n* here, not only one\'s own insights are relevant, but also feedback from interested\nparties - especially from supervisory authorities, customers, and service providers -\nshould be considered (norm point d).\nan analysis and evaluation of these insights will either lead to a kind of exoneration\n(""carry on!"") or to a list of planned changes and improvements to the isms\nand security measures. it is important to set deadlines for the planned changes\nand provide the necessary resources in a timely manner -\n\'see explanations on norm point 4.\n2 requirements for an isms\notherwise, the management review will fail its purpose, especially it will not lead\nto continuous improvement (norm point f).\n2.7 improvement (norm point 10)\nnorm point 10 initially addresses the issue of non-conformity of the isms to the\nrequirements of iso 27001. such a deviation may come to light accidentally,\nhave been specifically identified through a review (e.g., during an internal audit),\nor have been noticed by third parties.\nna 10.1 - non-conformity and corrective actions\nthe most', metadata={'doc_ID': 3200, 'original_text': 'normative point c) requires all findings (""feedback"") about the si\n-\nincluding: this could involve deviations from the requirements of iso 27001\nor insufficient rectification of the same, results of monitoring, measurements,\nand audits - of course also information about existing vulnerabilities and risks,\ntheir treatment (norm point e), and occurred security incidents.\n* here, not only one\'s own insights are relevant, but also feedback from interested\nparties - especially from supervisory authorities, customers, and service providers -\nshould be considered (norm point d).\nan analysis and evaluation of these insights will either lead to a kind of exoneration\n(""carry on!"") or to a list of planned changes and improvements to the isms\nand security measures. it is important to set deadlines for the planned changes\nand provide the necessary resources in a timely manner -\n\'see explanations on norm point 4.\n2 requirements for an isms\notherwise, the management review will fail its purpose, especially it will not lead\nto continuous improvement (norm point f).\n2.7 improvement (norm point 10)\nnorm point 10 initially addresses the issue of non-conformity of the isms to the\nrequirements of iso 27001. such a deviation may come to light', 'source': 'Kersten et al. - 2020 - IT-Sicherheitsmanagement nach der neuen ISO 27001_removed.pdf', 'title': 'Kersten et al. - 2020 - IT-Sicherheitsmanagement nach der neuen ISO 27001_removed', 'relevance_score': 0.9417614}), Document(page_content='we have already considered these aspects in the measurements/audits of the isms processes and controls. if no objections arise here, an isms generally delivers the expected performance (= the expected result). the question of adequacy can also be asked for the isms as a whole - analogous to the consideration of controls.\nin terms of effectiveness, it must be assessed whether the organization achieves its security objectives according to isms-5.1 (a) overall. to put it differently, it is difficult to imagine achieving security objectives if:\n- security incidents occur frequently and cause damage,\n- security vulnerabilities exist that pose potential risks,\n- other known risks have not been addressed, or\n- the required controls have not been fully implemented.\nlet\'s go through the four points mentioned above.\nregarding security incidents, one could say: the less incidents and the smaller their impact on the organization, the higher or better the effectiveness of the isms. so what should be monitored/measured in this case? we analyze the security incidents recorded in a ticket system and also capture the severity of the incidents or their damage class (alternatively, their processing priority in the ticket system). this way, we have determined the number of security incidents for each damage class defined in the risk analysis during the considered period. since serious incidents should have a greater impact in the assessment than minor ones, it leads to a product formation of ""number x damage class,"" whose', metadata={'doc_ID': 2664, 'original_text': '- ""we have already considered these aspects in the measurements/audits of the isms processes and controls.""\n- ""the question of adequacy can also be asked for the isms as a whole - analogous to the consideration of controls.""\n- ""in terms of effectiveness, it must be assessed whether the organization achieves its security objectives according to isms-5.1 (a) overall.""\n- ""the less incidents and the smaller their impact on the organization, the higher or better the effectiveness of the isms.""\n- ""we analyze the security incidents recorded in a ticket system and also capture the severity of the incidents or their damage class (alternatively, their processing priority in the ticket system).""\n- ""since serious incidents should have a greater impact in the assessment than minor ones, it leads to a product formation of ""number x damage class,"" whose""', 'source': 'ISO 27001_2022_Kersten_und_Schroeder.pdf', 'title': 'ISO 27001 2022', 'relevance_score': 0.9046505}), Document(page_content='the perspective of the management of an organization, the rational use of resources is an important criterion: for example, does the use and operation of expensive security technology make sense in a specific case? are risks and investment costs in a reasonable proportion? this can be the subject of discussion before the procurement of technology, but also during its use.\n© springer fachmedien wiesbaden gmbh, part of springer nature 2020 63 h. kersten et al., it security management according to the new iso 27001, edition <kes>, https://doi-org/10.1007/978-3-658-27692-8_4\nin the operational it operation, it is also about deviations from target values that can lead to error conditions, failures, and losses. they should be detected as early as possible in order to be able to counteract them in a targeted manner.\nit is evident that the objectives for measurements can be very different.\nhowever, here we want to refer to chapter 9 of iso 27001, which requires a performance evaluation of the isms. this is primarily about the effectiveness of the isms - which also includes the effectiveness of existing security measures.\nthe evaluation should of course be based on collected or measured data: in practice, a distinction must be made between the measurement and the subsequent evaluation of the ""measurement results.""\n4.2 monitoring and measuring\nfrom the isms, the mandate must be given to monitor or measure certain objects and their attributes. what does that mean?\nan example: it could be about the effectiveness', metadata={'doc_ID': 3241, 'original_text': '- ""the effectiveness of the isms - which also includes the effectiveness of existing security measures.""\n- ""the evaluation should of course be based on collected or measured data""\n- ""a distinction must be made between the measurement and the subsequent evaluation of the ""measurement results.""""\n- ""4.2 monitoring and measuring""\n- ""from the isms, the mandate must be given to monitor or measure certain objects and their attributes.""', 'source': 'Kersten et al. - 2020 - IT-Sicherheitsmanagement nach der neuen ISO 27001_removed.pdf', 'title': 'Kersten et al. - 2020 - IT-Sicherheitsmanagement nach der neuen ISO 27001_removed', 'relevance_score': 0.8710367}), Document(page_content='number of security incidents for each damage class defined in the risk analysis during the considered period. since serious incidents should have a greater impact in the assessment than minor ones, it leads to a product formation of ""number x damage class,"" whose distribution then becomes the indicator ""security incidents in the isms.""\nduring audit activities in the isms, security vulnerabilities or weaknesses are often identified or knowledge of possible vulnerabilities and new risks is obtained from various sources. an effective isms is characterized by promptly responding to such insights: recording the insights, analyzing the resulting risks, fixing deficits/weaknesses if necessary, documenting solutions.\nin this context, the efficiency of handling such insights is a notable indicator for the performance of the isms. an organization could proceed with the motto: if we have no deficits or weaknesses, or at least quickly eliminate them, we have largely achieved our goal of secure information processing.\nsecurity objectives have been assigned controls according to isms-6.2. we have already discussed step-by-step plans for the implementation of controls above for each individual control.\nsome things have been implemented, including the possibility of measurements. an interesting aspect here would be the degree of implementation as an average across all controls of the isms - for example, as the average of individual values or with appropriate weighting. it is clear that this average/weighted degree of', metadata={'doc_ID': 2665, 'original_text': '- ""since serious incidents should have a greater impact in the assessment than minor ones, it leads to a product formation of ""number x damage class,"" whose distribution then becomes the indicator ""security incidents in the isms.""""\n- ""an effective isms is characterized by promptly responding to such insights: recording the insights, analyzing the resulting risks, fixing deficits/weaknesses if necessary, documenting solutions.""\n- ""in this context, the efficiency of handling such insights is a notable indicator for the performance of the isms.""\n- ""security objectives have been assigned controls according to isms-6.2.""\n- ""we have already discussed step-by-step plans for the implementation of controls above for each individual control.""\n- ""some things have been implemented, including the possibility of measurements.""\n- ""an interesting aspect here would be the degree of implementation as an average across all controls of the isms - for example, as the average of individual values or with appropriate weighting.""\n- ""it is clear that this average/weighted degree of""', 'source': 'ISO 27001_2022_Kersten_und_Schroeder.pdf', 'title': 'ISO 27001 2022', 'relevance_score': 0.8640812}), Document(page_content=""includes the regular review of the organization's own isms to identify any deviations or potential for improvement and to initiate their implementation.\nthis immediately brings to mind roles such as auditor, compliance manager, internal auditor, whereas the it security officer, if present, is less suitable for this purpose: reviewing and evaluating one's own activities leads to a typical conflict of interest.\nthe role under 2. must be seen in conjunction with the so-called performance evaluation of the isms as required in section isms-10. we will provide further explanation on this in the corresponding section at the end of this chapter. reporting to the management level is the minimum requirement: of course, corresponding reports can also be made available to other entities and individuals - by the same role under 2. or by another.\nin iso 27001, the information security officer is only mentioned as an example of a role within the isms, see control a-5.2 in chapter 3.\nthis includes, for example, compliance with data protection requirements (ds-gvo [1] and bdsg [3] and others) and thus also the role of the data protection officer.\nappendix a of iso 27001 lists a number of security-related activities that should be assigned to a role within the isms - however, appendix a is not binding. for more details, see chapter 3 in this book.\n2.2 leadership (isms-5) 49\nonce agreement has been reached on all necessary and desired roles, their tasks and authorities should be documented in writing, for example in a"", metadata={'source': 'ISO 27001_2022_Kersten_und_Schroeder.pdf', 'title': 'ISO 27001_2022_Kersten_und_Schroeder', 'original_text': ""- includes the regular review of the organization's own isms to identify any deviations or potential for improvement and to initiate their implementation.\n- the role under 2. must be seen in conjunction with the so-called performance evaluation of the isms as required in section isms-10.\n- reporting to the management level is the minimum requirement: of course, corresponding reports can also be made available to other entities and individuals - by the same role under 2. or by another.\n- in iso 27001, the information security officer is only mentioned as an example of a role within the isms, see control a-5.2 in chapter 3.\n- this includes, for example, compliance with data protection requirements (ds-gvo [1] and bdsg [3] and others) and thus also the role of the data protection officer.\n- appendix a of iso 27001 lists a number of security-related activities that should be assigned to a role within the isms - however, appendix a is not binding. for more details, see chapter 3 in this book."", 'doc_ID': 2615, 'relevance_score': 0.84156543}), Document(page_content='of the processed data: using a highly complex, expensive measure for minimal security requirements does not make sense, whereas a weak, cost-saving measure would be inappropriate for high security requirements. inadequate security can have a negative impact on staff motivation, leading to errors and negligence, and thus affecting overall information security. however, these aspects should already be taken into account in the planning of the isms and therefore are not really subject to measurement/monitoring during operation.\ntherefore, we focus more on the effectiveness of a measure. here, one must differentiate: is it generally effective enough against the considered risks? this question is answered positively during risk treatment and determination of the remaining risk, otherwise the measure would not be chosen - thus not suitable for ongoing measurements/monitoring.\nhowever, it is different regarding the effectiveness during the application of the measure. here are some examples:\n- if a complex, elaborate measure has a step-by-step plan for implementation, it must be assumed that the effectiveness of the measure during operation depends on the current level of implementation progress. this could be determined or measured by comparing it with the planning.\n- the correct application of a measure in practice can be measured/monitored based on records, provided that such records have been established and activated for the measure (or the overarching control). deviations between planning and records can be', metadata={'source': 'ISO 27001_2022_Kersten_und_Schroeder.pdf', 'title': 'ISO 27001_2022_Kersten_und_Schroeder', 'original_text': '- inadequate security can have a negative impact on staff motivation, leading to errors and negligence, and thus affecting overall information security.\n- we focus more on the effectiveness of a measure.\n- is it generally effective enough against the considered risks?\n- if a complex, elaborate measure has a step-by-step plan for implementation, it must be assumed that the effectiveness of the measure during operation depends on the current level of implementation progress.\n- the correct application of a measure in practice can be measured/monitored based on records, provided that such records have been established and activated for the measure (or the overarching control).', 'doc_ID': 2662, 'relevance_score': 0.8059378}), Document(page_content='analysis and evaluation\nscope: this document provides guidelines intended to assist organizations to evaluate the information\nsecurity performance and the effectiveness of the isms in order to fulfil the requirements of\niso/iec 27001:2013, 9.1. it addresses:\na) the monitoring and measurement of information security performance;\nb) the monitoring and measurement of the effectiveness of an information security management\nsystem (isms) including its processes and controls;\nc) the analysing and the evaluating of the results of monitoring and measurement.\npurpose: iso/iec 27004 provides a framework allowing an assessment of isms effectiveness to be\nmeasured and evaluated in accordance with iso/iec 27001.\n5.4.4 iso/iec 27005\ninformation technology — security techniques — information security risk management\nscope: this document provides guidelines for information security risk management. the approach\ndescribed within this document supports the general concepts specified in iso/iec 27001.\npurpose: iso/iec 27005 provides guidance on implementing a process-oriented risk management\napproach to assist in satisfactorily implementing and fulfilling the information security risk\nmanagement requirements of iso/iec 27001.\n5.4.5 iso/iec 27007\ninformation technology — security techniques — guidelines for information security management systems\nauditing\nscope: this document provides guidance on conducting isms audits, as well as guidance on the\ncompetence of information security management system auditors, in', metadata={'doc_ID': 1396, 'original_text': '- Purpose: iso/iec 27004 provides a framework allowing an assessment of isms effectiveness to be measured and evaluated in accordance with iso/iec 27001.\n- Purpose: iso/iec 27005 provides guidance on implementing a process-oriented risk management approach to assist in satisfactorily implementing and fulfilling the information security risk management requirements of iso/iec 27001.\n- Purpose: iso/iec 27007 provides guidance on conducting isms audits, as well as guidance on the competence of information security management system auditors.', 'source': 'ISO 27000 2018 (E).pdf', 'title': 'ISO 27000 2018 (E)', 'relevance_score': 0.7975568})]","Self-assessment plays an significant role in evaluating the effectiveness of protective measures. It involves a self-assessment by management, which is then reviewed by auditors or inspectors for completeness, correctness, and validity. Deviations are documented as issues and classified as minor or major issues depending on their magnitude. For compliance with laws and regulations, even a significant deviation or multiple minor deviations can indicate non-compliance.","A self-assessment plays a crucial role in evaluating the effectiveness of protective measures for an ISMS by providing insights into the organization's security posture. Deviations identified during the self-assessment can have significant consequences, such as non-conformities with ISO 27001 requirements, inadequate rectification of identified issues, and potential vulnerabilities remaining untreated. These deviations can impact the overall security of the organization, leading to increased risks, security incidents, and potential non-compliance with regulatory requirements. It is essential to address deviations promptly, implement necessary improvements, and allocate resources effectively to ensure the continuous improvement of the ISMS and its security measures. Regular self-assessments help in identifying areas for enhancement, strengthening the ISMS, and maintaining a robust security posture in line with ISO 27001 standards.",True,0.35051546391752575,0.15624999999999997,0.20618556701030927,0.973266065120697,0.9999380111694336,0.7271716626580685,0.25,0.9371191629816337,1.6620054244995117,3.3601226806640625,0.002039670944213867,5.022128105163574
Fine-tuned_finetuned-ISO-27001_1024_l2_All_1536_264_False_Kers,Hybrid_Rerank_Cohere_Compression,8,gpt-3.5-turbo-16k,16385,0,1,What tasks does the role of the risk manager have and why is it important?,"[Document(page_content='and transferring the necessary competencies, is to be communicated by the management of the company.\nthe role of the risk manager places high demands on the role holder - not only in terms of expertise. the role holder must identify with the security objectives of the company to a high degree. the risk manager knows in detail the weaknesses of the company and the possible impacts of a corresponding attack exploiting these weaknesses. entrusting an unsuitable candidate with this task can and will have disastrous consequences. candidates with a certain ""attention to detail"" are also unsuitable. only through meticulous and precise analysis of possible practical risks is efficient risk management possible.\nlastly, it should be noted that the role of the risk manager can also be filled by an external party. there are numerous security companies on the market that offer appropriate services and experts. however, it should be considered that an external party, who may also serve competitors, will gain deep insights into the ""intimate life"" of the organization. the risk of information leakage is significant here.\nskills and tasks\nnow let\'s summarize the tasks and associated skills of the risk manager. the following list does not claim to be exhaustive; depending on the type of company, listed tasks may be obsolete or additional tasks may be added. the main tasks of the risk manager are:\n* in coordination with and according to the guidelines of the management, to develop and implement the risk strategy of the', metadata={'doc_ID': 3216, 'original_text': '- the role of the risk manager places high demands on the role holder - not only in terms of expertise. the role holder must identify with the security objectives of the company to a high degree.\n- the risk manager knows in detail the weaknesses of the company and the possible impacts of a corresponding attack exploiting these weaknesses.\n- entrusting an unsuitable candidate with this task can and will have disastrous consequences.\n- candidates with a certain ""attention to detail"" are also unsuitable.\n- only through meticulous and precise analysis of possible practical risks is efficient risk management possible.\n- the role of the risk manager can also be filled by an external party.\n- there are numerous security companies on the market that offer appropriate services and experts.\n- however, it should be considered that an external party, who may also serve competitors, will gain deep insights into the ""intimate life"" of the organization.\n- the risk of information leakage is significant here.\n- the following list does not claim to be exhaustive; depending on the type of company, listed tasks may be obsolete or additional tasks may be added.\n- the main tasks of the risk manager are:\n* in coordination with and according to the guidelines of the management, to develop and implement the risk strategy of the', 'source': 'Kersten et al. - 2020 - IT-Sicherheitsmanagement nach der neuen ISO 27001_removed.pdf', 'title': 'Kersten et al. - 2020 - IT-Sicherheitsmanagement nach der neuen ISO 27001_removed', 'relevance_score': 0.9961755}), Document(page_content='depending on the type of company, listed tasks may be obsolete or additional tasks may be added. the main tasks of the risk manager are:\n* in coordination with and according to the guidelines of the management, to develop and implement the risk strategy of the company.\n* from the risk strategy and the guidelines from compliance management, to develop the risk management process and all related documents, to align them within the company, and to implement them.\n* to plan and implement the risk awareness theme.\n* to establish and maintain an central risk information system.\n* to conduct a detailed risk analysis as per guidelines and to make a meaningful risk assessment.\n* to create action catalogs, implement the corresponding actions - in line with the residual risk still accepted by the management.\n* to monitor the identified risks and request appropriate reports from the dedicated risk officers and the risk coordinator.\n* to establish and operate reporting, including procedures for generating evidence of the effective functioning of implemented measures for risk reduction.\n* to plan and carry out maintenance of all elements of risk management (documentation, measures, processes).\n* to fulfill these tasks, the risk manager needs - in addition to the corresponding access rights and possibly access permissions - authority over the risk coordinator and the individual risk officers.\nregarding the latter: the risk manager must be empowered to issue instructions for the implementation and monitoring of', metadata={'doc_ID': 3217, 'original_text': '* the main tasks of the risk manager are:\n* in coordination with and according to the guidelines of the management, to develop and implement the risk strategy of the company.\n* from the risk strategy and the guidelines from compliance management, to develop the risk management process and all related documents, to align them within the company, and to implement them.\n* to plan and implement the risk awareness theme.\n* to establish and maintain an central risk information system.\n* to conduct a detailed risk analysis as per guidelines and to make a meaningful risk assessment.\n* to create action catalogs, implement the corresponding actions - in line with the residual risk still accepted by the management.\n* to monitor the identified risks and request appropriate reports from the dedicated risk officers and the risk coordinator.\n* to establish and operate reporting, including procedures for generating evidence of the effective functioning of implemented measures for risk reduction.\n* to plan and carry out maintenance of all elements of risk management (documentation, measures, processes).\n* to fulfill these tasks, the risk manager needs - in addition to the corresponding access rights and possibly access permissions - authority over the risk coordinator and the individual risk officers.', 'source': 'Kersten et al. - 2020 - IT-Sicherheitsmanagement nach der neuen ISO 27001_removed.pdf', 'title': 'Kersten et al. - 2020 - IT-Sicherheitsmanagement nach der neuen ISO 27001_removed', 'relevance_score': 0.9961155}), Document(page_content='threat occurring,\n* a description of how the effectiveness of the measure can be tested,\n* the person responsible for the effectiveness of the measure.\nrisk monitoring\nanother task in risk management is monitoring the identified risks in terms of their development and trends. risks are subject to changes over time, their weighting changes, they can completely disappear or suddenly emerge. an example of the latter would be the threat of ransomware.\nalso important in risk monitoring is verifying the effectiveness of the measures implemented to minimize risks. if the measures taken prove to be inadequate or, worst-case scenario, non-functional, or if vulnerabilities become known, the associated risks naturally change as well.\nroles\nthe roles of risk manager, risk coordinator, and risk officer can be assigned to the same person in smaller organizations. however, in more extensive risk assessments planned in the risk strategy, one quickly reaches personnel limits.\noperational risk management is a part of corporate management that has gained significant importance. reasons for this include the rapidly changing and inherently risky global economic environment of a company and the increasingly complex internal relationships with their growing vulnerability to errors.\nto ensure sustainable business success, integrated risk management in corporate management must reduce risks and uncertainties as well as potential errors. furthermore, it is important for external stakeholders—especially shareholders—to be able', metadata={'doc_ID': 3210, 'original_text': '- roles\n- the roles of risk manager, risk coordinator, and risk officer can be assigned to the same person in smaller organizations. however, in more extensive risk assessments planned in the risk strategy, one quickly reaches personnel limits.\n- operational risk management is a part of corporate management that has gained significant importance. reasons for this include the rapidly changing and inherently risky global economic environment of a company and the increasingly complex internal relationships with their growing vulnerability to errors.\n- to ensure sustainable business success, integrated risk management in corporate management must reduce risks and uncertainties as well as potential errors. furthermore, it is important for external stakeholders—especially shareholders—to be able', 'source': 'Kersten et al. - 2020 - IT-Sicherheitsmanagement nach der neuen ISO 27001_removed.pdf', 'title': 'Kersten et al. - 2020 - IT-Sicherheitsmanagement nach der neuen ISO 27001_removed', 'relevance_score': 0.98884195}), Document(page_content='resources for the development, implementation, operation, and maintenance of risk management,\n* make decisions on accepted residual risks and lead the review of risk management.\nin particular, the management establishes the risk manager and equips them with the necessary competencies.\nwithin resource management, management must ensure that:\n* adequate resources are made available for the establishment, implementation, operation, and maintenance of risk management,\n* processes and procedures of risk management meet business requirements,\n* laws and contractual obligations are complied with,\n* adequate security is maintained through the correct application of implemented measures,\n* (if necessary) audits are conducted, responses are made based on audit results, and the effectiveness of risk management is improved.\nthese tasks are predominantly delegated to the risk manager in practice, who reports either directly to the management or to a corresponding department in larger companies, depending on the organizational structure.\nthe risk manager usually has directive authority over the risk coordinator, whose main task is to conduct and coordinate risk analysis with the risk officers of the departments.\nin terms of training, awareness, and competencies, it must be ensured that:\n* personnel responsible for risk management possess the necessary technical competencies,\n* these competencies are built through appropriate training or hiring of personnel,\n* the effectiveness of training is assessed,\n* records are', metadata={'doc_ID': 3212, 'original_text': '- make decisions on accepted residual risks and lead the review of risk management.\n- the management establishes the risk manager and equips them with the necessary competencies.\n- within resource management, management must ensure that:\n  * adequate resources are made available for the establishment, implementation, operation, and maintenance of risk management,\n  * processes and procedures of risk management meet business requirements,\n  * laws and contractual obligations are complied with,\n  * adequate security is maintained through the correct application of implemented measures,\n  * (if necessary) audits are conducted, responses are made based on audit results, and the effectiveness of risk management is improved.\n- these tasks are predominantly delegated to the risk manager in practice, who reports either directly to the management or to a corresponding department in larger companies, depending on the organizational structure.\n- the risk manager usually has directive authority over the risk coordinator, whose main task is to conduct and coordinate risk analysis with the risk officers of the departments.\n- in terms of training, awareness, and competencies, it must be ensured that:\n  * personnel responsible for risk management possess the necessary technical competencies,\n  * these competencies are built through appropriate training or hiring of personnel,\n  * the effectiveness of training is assessed,\n  * records are', 'source': 'Kersten et al. - 2020 - IT-Sicherheitsmanagement nach der neuen ISO 27001_removed.pdf', 'title': 'Kersten et al. - 2020 - IT-Sicherheitsmanagement nach der neuen ISO 27001_removed', 'relevance_score': 0.9852714}), Document(page_content='departments to be entrusted with this task. the reason for this is the almost inevitable conflict of interest that arises when the organization objectively analyzes perceived weaknesses and likely vulnerabilities.\nsmall and medium-sized enterprises (smes) usually do not have corporate risk management. in these cases, this task is often additionally assigned to the security officer. if the security officer is located in the it department, it is highly likely that the aforementioned conflict of interest will also arise. additionally, the security officer, who often also takes on the role of data protection officer, has little time to dedicate to risk management with the necessary care.\nit is better to establish risk management within quality assurance or controlling. as we saw in the earlier sections, risk management has a direct relation to compliance within quality assurance, where the independence necessary for objective risk management from the specialist departments is provided.\nappointment of the risk manager\nthe appointment of the risk manager is made by the company management, who is responsible for effective risk management within the compliance framework.\nthe appointment, i.e., filling the role of the risk manager with a suitable candidate and transferring the necessary competencies, is to be communicated by the management of the company.\nthe role of the risk manager places high demands on the role holder - not only in terms of expertise. the role holder must identify with the security objectives', metadata={'doc_ID': 3215, 'original_text': '- ""the role of the risk manager""\n- ""tasks does the role of the risk manager have""\n- ""why is it important""\n- ""the almost inevitable conflict of interest that arises when the organization objectively analyzes perceived weaknesses and likely vulnerabilities""\n- ""if the security officer is located in the it department, it is highly likely that the aforementioned conflict of interest will also arise""\n- ""the security officer, who often also takes on the role of data protection officer, has little time to dedicate to risk management with the necessary care""\n- ""it is better to establish risk management within quality assurance or controlling""\n- ""risk management has a direct relation to compliance within quality assurance""\n- ""the independence necessary for objective risk management from the specialist departments is provided""\n- ""the appointment of the risk manager""\n- ""the appointment of the risk manager is made by the company management""\n- ""effective risk management within the compliance framework""\n- ""the appointment, i.e., filling the role of the risk manager with a suitable candidate and transferring the necessary competencies, is to be communicated by the management of the company""\n- ""the role of the risk manager places high demands on the role holder - not only in terms of expertise""\n- ""the role holder must identify with the', 'source': 'Kersten et al. - 2020 - IT-Sicherheitsmanagement nach der neuen ISO 27001_removed.pdf', 'title': 'Kersten et al. - 2020 - IT-Sicherheitsmanagement nach der neuen ISO 27001_removed', 'relevance_score': 0.9703525}), Document(page_content='point ""roles and responsibilities"" can be found in numerous laws and regulations.\nwhat tasks are now important for risk management?\nrisk planning\nat the very beginning, as a ""cornerstone"" for efficient risk management, is the planning of the risk management process. the process steps must be clearly defined with responsibilities, documentation format, and reporting. these tasks are often summarized in practice under the term risk planning - which is somewhat misleading: it is not the risk that is planned, but rather their analysis, how to handle them, and their monitoring.\nrisk analysis\nthe next task after planning is to conduct a comprehensive analysis of all relevant risks and their causes. the emphasis here is on ""relevant."" experience shows that it is easy to get lost in minor details and overlook important danger zones. the standard distinguishes between risk identification (naming and describing risks) and actual risk analysis (estimating risks).\nrisk assessment\nfollowing the analysis of risks, another task of risk management is to assess the risks regarding their potential impacts on the organization. for prioritized processing, it is useful to create a weighted list of identified risks. as we will see, risk indicators derived, among other things, from expected damages are used for weighting.\n> in the new german standard version, risk identification, risk analysis, and risk assessment are collectively referred to as risk assessment.\nrisk strategy and risk treatment\nthe next task in risk', metadata={'doc_ID': 3208, 'original_text': '- ""what tasks are now important for risk management?""\n- ""risk planning""\n- ""the process steps must be clearly defined with responsibilities, documentation format, and reporting.""\n- ""risk analysis""\n- ""the next task after planning is to conduct a comprehensive analysis of all relevant risks and their causes.""\n- ""the emphasis here is on ""relevant.""""\n- ""the standard distinguishes between risk identification (naming and describing risks) and actual risk analysis (estimating risks).""\n- ""risk assessment""\n- ""following the analysis of risks, another task of risk management is to assess the risks regarding their potential impacts on the organization.""\n- ""for prioritized processing, it is useful to create a weighted list of identified risks.""\n- ""risk indicators derived, among other things, from expected damages are used for weighting.""\n- ""risk strategy and risk treatment""', 'source': 'Kersten et al. - 2020 - IT-Sicherheitsmanagement nach der neuen ISO 27001_removed.pdf', 'title': 'Kersten et al. - 2020 - IT-Sicherheitsmanagement nach der neuen ISO 27001_removed', 'relevance_score': 0.95177364}), Document(page_content='to errors.\nto ensure sustainable business success, integrated risk management in corporate management must reduce risks and uncertainties as well as potential errors. furthermore, it is important for external stakeholders—especially shareholders—to be able to assess the current economic situation in the company accurately and base their investment decisions on this.\nto address the escalating risk situation, various legal regulations have been introduced in recent years, falling under the term corporate governance. corporate governance generally refers to ""good"" corporate management and fair dealings with all stakeholders, such as shareholders and stakeholders.\nwithin general risk management, it risk management is a crucial component and should not be understood simply as a measure of building security, internet security, etc.\nmanagement\'s responsibility extends to three areas:\n* management commitments,\n* resource management, and\n* training, awareness, and competencies,\nwhich we will now focus on.\nas part of management commitments, management must:\n* ensure that goals and plans are defined,\n* ensure that necessary roles and responsibilities are established,\n* communicate the importance of risk management to all stakeholders,\n* provide sufficient resources for the development, implementation, operation, and maintenance of risk management,\n* make decisions on accepted residual risks and lead the review of risk management.\nin particular, the management establishes the risk manager and equips them with the', metadata={'doc_ID': 3211, 'original_text': '- ""management\'s responsibility extends to three areas:""\n- ""* management commitments,""\n- ""* resource management, and""\n- ""* training, awareness, and competencies,""\n- ""as part of management commitments, management must:""\n- ""* ensure that goals and plans are defined,""\n- ""* ensure that necessary roles and responsibilities are established,""\n- ""* communicate the importance of risk management to all stakeholders,""\n- ""* provide sufficient resources for the development, implementation, operation, and maintenance of risk management,""\n- ""* make decisions on accepted residual risks and lead the review of risk management.""\n- ""in particular, the management establishes the risk manager and equips them with the""', 'source': 'Kersten et al. - 2020 - IT-Sicherheitsmanagement nach der neuen ISO 27001_removed.pdf', 'title': 'Kersten et al. - 2020 - IT-Sicherheitsmanagement nach der neuen ISO 27001_removed', 'relevance_score': 0.9224824}), Document(page_content='to a role. it is advisable to create a list of functions or roles in the company that are essential for risk management. this includes the risk manager, the it risk analyst or risk coordinator, as well as risk officers in the form of experts and specialists for individual units in our organization. for each element on this list, it is useful to create a role description containing the following information:\n- an overview of the tasks and responsibilities assigned to the role,\n- the necessary requirements for education, professional experience, and specialized knowledge of a role holder (profile of requirements),\n- information on maintaining these qualifications in terms of training and further education,\n- references to work instructions and checklists for the respective role.\nfor each role in the role directory, a corresponding work instruction is required, detailing the tasks step by step to the extent that a correct and traceable execution of the activities is ensured. it is useful to maintain a list of the current names of role holders and their deputies in the role directory, as well as the names of those approving the role assignment, and to keep these entries up to date. these entries are often requested by auditors and inspectors, as the audit point ""roles and responsibilities"" can be found in numerous laws and regulations.\nwhat tasks are now important for risk management?\nrisk planning\nat the very beginning, as a ""cornerstone"" for efficient risk management, is the planning of the risk management', metadata={'doc_ID': 3207, 'original_text': '- an overview of the tasks and responsibilities assigned to the role,\n- references to work instructions and checklists for the respective role.\n- what tasks are now important for risk management?', 'source': 'Kersten et al. - 2020 - IT-Sicherheitsmanagement nach der neuen ISO 27001_removed.pdf', 'title': 'Kersten et al. - 2020 - IT-Sicherheitsmanagement nach der neuen ISO 27001_removed', 'relevance_score': 0.91804045})]","The role of the risk manager encompasses crucial tasks in risk management:

1. Introduction and Implementation:
Responsible for the introduction, implementation, and maintenance of risk management with adequate resources.
2. Ensuring Compliance:
Ensuring that processes align with business requirements and comply with legal and contractual obligations.
3. Maintenance of Security:
Correct application of measures to maintain appropriate security.
4. Audits and Improvements:
Leading audits, responding to results, and continuously improving risk management.
5. Delegation of Tasks:
Delegating tasks, especially to the risk coordinator for risk analysis with departments.
6. Training and Competence Development:
Ensuring that risk management personnel possess necessary competencies through training planning and coordination.

This role is important for effectively managing risks, complying with laws, implementing appropriate security measures, and training personnel, contributing to overall performance improvement in risk management.","The main tasks of the risk manager include developing and implementing the risk strategy of the company, creating and aligning risk management processes and related documents, planning and implementing risk awareness, establishing a central risk information system, conducting detailed risk analysis and assessment, creating action plans, monitoring risks, establishing reporting procedures, and maintaining all elements of risk management. The risk manager needs authority over the risk coordinator and risk officers. It is crucial for sustainable business success to have integrated risk management that reduces risks and uncertainties. The risk manager plays a vital role in ensuring compliance, resource management, and effective risk management within the organization. The appointment of a suitable risk manager with the necessary competencies is essential and is typically communicated by company management.",True,0.4496124031007752,0.1328125,0.2558139534883721,0.7162124551832676,0.9995729327201843,0.8210839718494833,1.0,0.8163713327434378,1.6340038776397705,3.2596511840820312,0.003006458282470703,4.893655061721802
Fine-tuned_finetuned-ISO-27001_1024_l2_All_1536_264_False_Kers,Hybrid_Rerank_Cohere_Compression,8,gpt-3.5-turbo-16k,16385,0,1,"What does it mean to monitor or measure objects and their attributes within the framework of the ISMS, and can you give an example for that related to awareness?","[Document(page_content='and the subsequent evaluation of the ""measurement results.""\n4.2 monitoring and measuring\nfrom the isms, the mandate must be given to monitor or measure certain objects and their attributes. what does that mean?\nan example: it could be about the effectiveness of a specific organizational measure. this would be the (measurement) object. the effectiveness of the measure can be measured in many aspects: the measure must first be known to those affected; its compliance could be assessed based on records or logs; incidents resulting from the non-observance of the measure could be evaluated, etc. each of these aspects listed represents an attribute of the object.\nas an example, consider the attribute of the awareness of this measure. through interviews, it is checked whether the affected persons are aware of the organizational measure: in relation to the entirety of those affected, the percentage of people who are aware of the measure will be an interesting figure, the evaluation of which can lead to follow-up actions (e.g. more intensive training) that will hopefully improve the effectiveness of the organizational measure.\nthe mentioned interviews can also be carried out within the framework of (management) audits, which are conducted by an entity independent of operational security.\nin connection with the requirements of the standard, there are some important findings:\n* the organization can determine at its discretion which objects and attributes it wants to monitor or measure, as long as they contribute', metadata={'doc_ID': 3242, 'original_text': '- the mandate must be given to monitor or measure certain objects and their attributes\n- an example: it could be about the effectiveness of a specific organizational measure\n- each of these aspects listed represents an attribute of the object\n- as an example, consider the attribute of the awareness of this measure\n- through interviews, it is checked whether the affected persons are aware of the organizational measure\n- the mentioned interviews can also be carried out within the framework of (management) audits\n- the organization can determine at its discretion which objects and attributes it wants to monitor or measure', 'source': 'Kersten et al. - 2020 - IT-Sicherheitsmanagement nach der neuen ISO 27001_removed.pdf', 'title': 'Kersten et al. - 2020 - IT-Sicherheitsmanagement nach der neuen ISO 27001_removed', 'relevance_score': 0.999685}), Document(page_content='the perspective of the management of an organization, the rational use of resources is an important criterion: for example, does the use and operation of expensive security technology make sense in a specific case? are risks and investment costs in a reasonable proportion? this can be the subject of discussion before the procurement of technology, but also during its use.\n© springer fachmedien wiesbaden gmbh, part of springer nature 2020 63 h. kersten et al., it security management according to the new iso 27001, edition <kes>, https://doi-org/10.1007/978-3-658-27692-8_4\nin the operational it operation, it is also about deviations from target values that can lead to error conditions, failures, and losses. they should be detected as early as possible in order to be able to counteract them in a targeted manner.\nit is evident that the objectives for measurements can be very different.\nhowever, here we want to refer to chapter 9 of iso 27001, which requires a performance evaluation of the isms. this is primarily about the effectiveness of the isms - which also includes the effectiveness of existing security measures.\nthe evaluation should of course be based on collected or measured data: in practice, a distinction must be made between the measurement and the subsequent evaluation of the ""measurement results.""\n4.2 monitoring and measuring\nfrom the isms, the mandate must be given to monitor or measure certain objects and their attributes. what does that mean?\nan example: it could be about the effectiveness', metadata={'doc_ID': 3241, 'original_text': '- ""the objectives for measurements can be very different.""\n- ""here we want to refer to chapter 9 of iso 27001, which requires a performance evaluation of the isms.""\n- ""the evaluation should of course be based on collected or measured data.""\n- ""a distinction must be made between the measurement and the subsequent evaluation of the ""measurement results.""""\n- ""4.2 monitoring and measuring""\n- ""from the isms, the mandate must be given to monitor or measure certain objects and their attributes.""', 'source': 'Kersten et al. - 2020 - IT-Sicherheitsmanagement nach der neuen ISO 27001_removed.pdf', 'title': 'Kersten et al. - 2020 - IT-Sicherheitsmanagement nach der neuen ISO 27001_removed', 'relevance_score': 0.9981827}), Document(page_content='of operational security.\nin connection with the requirements of the standard, there are some important findings:\n* the organization can determine at its discretion which objects and attributes it wants to monitor or measure, as long as they contribute sufficiently to the analysis and evaluation of the effectiveness of the isms.\n* the method of measurement is also selectable by the organization. however, some framework conditions must be observed: the measurements must lead to the same results when repeated and must be independent of who carries them out.\nhere is the translation of the text:\nif the circumstances have not changed over time.\n4.2 monitoring and measuring 65\n* measurements must be carried out continuously or at least regularly repeated.\n* measurements can be carried out by internal security personnel - but of course can also be delegated.\n* measurements must be recorded (procedure and results), the records must be kept for a specified period of time - at least until all evaluations of the results are completed, probably longer.\nregarding the types of measurements, it can involve:\n* measurement of technical-physical parameters (e.g. temperature, current voltage, bandwidth of transmission cables) as well as\n* data collection from management-oriented and technical audits.\nmanagement audits regarding security are covered in chapter 5. we provide some examples for technical audits:\n* inspection of filter rules in firewalls/routers and comparison with the planned settings (measurement: degree', metadata={'doc_ID': 3243, 'original_text': '- the organization can determine at its discretion which objects and attributes it wants to monitor or measure, as long as they contribute sufficiently to the analysis and evaluation of the effectiveness of the isms.\n- the method of measurement is also selectable by the organization. however, some framework conditions must be observed: the measurements must lead to the same results when repeated and must be independent of who carries them out.\n- measurements must be carried out continuously or at least regularly repeated.\n- measurements can be carried out by internal security personnel - but of course can also be delegated.\n- measurements must be recorded (procedure and results), the records must be kept for a specified period of time - at least until all evaluations of the results are completed, probably longer.\n- regarding the types of measurements, it can involve:\n  - measurement of technical-physical parameters (e.g. temperature, current voltage, bandwidth of transmission cables) as well as\n  - data collection from management-oriented and technical audits.', 'source': 'Kersten et al. - 2020 - IT-Sicherheitsmanagement nach der neuen ISO 27001_removed.pdf', 'title': 'Kersten et al. - 2020 - IT-Sicherheitsmanagement nach der neuen ISO 27001_removed', 'relevance_score': 0.99787605}), Document(page_content='evaluated with regard to the defined purpose. the question then arises as to what can be derived from the analysis/evaluation for the organization: an assessment of the results.\nin the context of the isms, it is primarily about monitoring the performance of the isms. for this purpose, data is collected during operation that can provide information on:\ne whether the isms is generally able to achieve and maintain the security objectives of the organization (suitability),\ne whether the isms actually achieves the security objectives of the organization with its processes, rules, controls/measures (effectiveness),\ne to what extent the isms in terms of structure, equipment, and operations is appropriate compared to the desired level of security (adequacy).\n26 1 the iso/iec 27000 series of standards and their basic concepts\nfor the organization\'s extended goals (see the keyword ""goals"" in this section), monitoring/measurements can also be established.\nfor all relevant monitoring/measurements, an appropriate program (referred to as a measurement program) should be established within the isms. what is required for this and how the program can be designed will be discussed in chapter 2 in the section on isms-9.1 of the standard.\nto organize the measurement program in the isms properly, especially in a consistent manner, iso 27004 proposes a standardized model for measurements. we will explain it using a simple example and take the incident management process of the isms as an example.\nincident management is the', metadata={'doc_ID': 2574, 'original_text': '- ""in the context of the isms, it is primarily about monitoring the performance of the isms.""\n- ""for this purpose, data is collected during operation that can provide information on:""\n- ""e whether the isms is generally able to achieve and maintain the security objectives of the organization (suitability),""\n- ""e whether the isms actually achieves the security objectives of the organization with its processes, rules, controls/measures (effectiveness),""\n- ""e to what extent the isms in terms of structure, equipment, and operations is appropriate compared to the desired level of security (adequacy).""\n- ""for all relevant monitoring/measurements, an appropriate program (referred to as a measurement program) should be established within the isms.""\n- ""what is required for this and how the program can be designed will be discussed in chapter 2 in the section on isms-9.1 of the standard.""\n- ""to organize the measurement program in the isms properly, especially in a consistent manner, iso 27004 proposes a standardized model for measurements.""\n- ""we will explain it using a simple example and take the incident management process of the isms as an example.""', 'source': 'ISO 27001_2022_Kersten_und_Schroeder.pdf', 'title': 'ISO 27001 2022', 'relevance_score': 0.9951136}), Document(page_content='actual objects that should be measured. this defining process could be exemplified by the following\nexample: the organization is the overall object — organization process a/or it system x is a part of that\nobject and constitutes an object in itself— objects within that process that affect information security (people,\nrules, network, applications, facilities etc.) are generally the objects of measure in order to see the\neffectiveness of protecting information.\nwhen implementing an information security measurement program, care should be taken to consider that the\nobjects of measure may serve many organization processes within the isms scope, and may therefore have a\nlarger impact on the effectiveness of the isms and control objectives. such objects should generally be\nprioritized with the scope of the program, such as the security organization and linked process, computer\nhall, co-workers regarding information security, etc.\nthe measurement interval may vary, but is preferable that the measurement is done or summarized at certain\nintervals in order to fit into the management review and the continual improvement process and ambitions of\nthe isms. the design of the program should state this.\nthe reporting of the results should be designed so that communication is assured according to\niso/iec 27004:2009.\n© iso/iec 2010 — all rights reserved 65\niso/iec 27003:2010(e)\nthe design of the information security measurement program should be concluded in a document stipulating\nthe procedure, which should be approved', metadata={'source': 'ISO 27003 2010 (E).pdf', 'title': 'ISO 27003 2010 (E)', 'original_text': '- objects within that process that affect information security (people, rules, network, applications, facilities etc.) are generally the objects of measure in order to see the effectiveness of protecting information.\n- when implementing an information security measurement program, care should be taken to consider that the objects of measure may serve many organization processes within the isms scope, and may therefore have a larger impact on the effectiveness of the isms and control objectives.\n- the measurement interval may vary, but is preferable that the measurement is done or summarized at certain intervals in order to fit into the management review and the continual improvement process and ambitions of the isms.\n- the reporting of the results should be designed so that communication is assured according to iso/iec 27004:2009.\n- the design of the information security measurement program should be concluded in a document stipulating the procedure, which should be approved.', 'doc_ID': 1534, 'relevance_score': 0.9929336}), Document(page_content='isms-9.1, there is only a hint to include the isms processes and controls when determining the monitoring/measurement subject. how should this hint be understood?\nisms processes are, of course, part of the isms and therefore indirect influencing factors for the overall performance of the isms - but they also usually have their own measurable performance. under isms-8.1, monitoring of isms processes - during operation or their application - is required according to criteria defined by the organization.\nwe will consider some examples below, but we want to anticipate that a crucial prerequisite for the performance of an isms process is its correct implementation according to the planning. however, this cannot be verified through monitoring/measurement as defined in isms-9.1, but should be subject to inspection or internal audits beforehand. therefore, we assume correct implementation for the following.\n- in complex isms processes that are built or expanded step by step, the current degree of implementation could be an important indicator. a process that is still under development may only partially achieve its planned performance, if at all. the degree of implementation can be determined or measured based on the implementation plan.\n- an isms process could be supplied with insufficient/unsuitable resources during operation or its application. if the necessary resources are specified in the process description, the comparison needed/available can be carried out, recorded, and evaluated after a certain', metadata={'doc_ID': 2660, 'original_text': '- isms-9.1, there is only a hint to include the isms processes and controls when determining the monitoring/measurement subject.\n- isms processes are, of course, part of the isms and therefore indirect influencing factors for the overall performance of the isms - but they also usually have their own measurable performance.\n- under isms-8.1, monitoring of isms processes - during operation or their application - is required according to criteria defined by the organization.\n- in complex isms processes that are built or expanded step by step, the current degree of implementation could be an important indicator.\n- a process that is still under development may only partially achieve its planned performance, if at all.\n- the degree of implementation can be determined or measured based on the implementation plan.\n- an isms process could be supplied with insufficient/unsuitable resources during operation or its application.\n- if the necessary resources are specified in the process description, the comparison needed/available can be carried out, recorded, and evaluated after a certain.', 'source': 'ISO 27001_2022_Kersten_und_Schroeder.pdf', 'title': 'ISO 27001 2022', 'relevance_score': 0.9905874}), Document(page_content='program in the isms properly, especially in a consistent manner, iso 27004 proposes a standardized model for measurements. we will explain it using a simple example and take the incident management process of the isms as an example.\nincident management is the area to which the measurement belongs.\nthe attribute is the average processing time of vulnerability reports. the attribute selects a specific aspect of incident management. other aspects are also conceivable and can be used as attributes for measurement.\nmethod: calculate processing time based on data from the ticket system, and determine average values for tickets from a specified period. the method should be described in more detail at this point, in a level of detail that enables comparable measurements.\nraw data: e = date/time of receipt of the report, a = date/time of completion of processing. these are the available data on which our calculation is based.\nderived measure: duration of processing (difference between a and e), expressed in hours. calculation is very simple here, but in other cases it may also involve complex statistical analyses.\nindicator value: average processing time within the specified period. what to do with this indicator value? before starting the measurements, evaluatable ranges are defined, e.g. indicator value below 24 hours - good result, between 24 and 72 hours - unsatisfactory result, above 72 hours - unacceptable result. of course, more or fewer intervals can be defined and the thresholds can also be changed. for', metadata={'doc_ID': 2575, 'original_text': 'ISO 27004 proposes a standardized model for measurements. We will explain it using a simple example and take the incident management process of the ISMS as an example. Incident management is the area to which the measurement belongs. The attribute is the average processing time of vulnerability reports. The attribute selects a specific aspect of incident management. Other aspects are also conceivable and can be used as attributes for measurement. Method: calculate processing time based on data from the ticket system, and determine average values for tickets from a specified period. The method should be described in more detail at this point, in a level of detail that enables comparable measurements. Raw data: e = date/time of receipt of the report, a = date/time of completion of processing. These are the available data on which our calculation is based. Derived measure: duration of processing (difference between a and e), expressed in hours. Calculation is very simple here, but in other cases it may also involve complex statistical analyses. Indicator value: average processing time within the specified period.', 'source': 'ISO 27001_2022_Kersten_und_Schroeder.pdf', 'title': 'ISO 27001 2022', 'relevance_score': 0.9899476}), Document(page_content='a baseline of controls, that can be used to identify gaps in\nsystems designs and implementations; and\ne risk treatment by supporting identification of treatments for identified vulnerabilities and\nthreats.\nrisk identification and risk treatment are both processes defined under principles section of the policy. refer\nto the isms policy for details.\n© isonec 2010 — all rights reserved 61\niso/iec 27003:2010(e)\nannex e\n(informative)\nmonitoring and measuring\nthis annex provides additional guidance to support the planning and designing monitoring and measuring.\ninformation on setting up monitoring and measuring\nthe design of the isms specific requirements includes security monitoring and measurement program for the\nisms that supports management review\ndesigning monitoring\nreview of incident\nresponse reports\nrecords of\npreparation and monitoring monitoring activities\ncoordination of regular checks performance of\nmonitoring activities isms\nmanagement\nverification and reporting\nof security control\nimplementation\nfigure e.1 — the monitoring process flow\npreparation and coordination: identification of relevant assets for monitoring\nit should be noted that monitoring is a continuous process and, as such, the design should take into\nconsideration the set-up of the monitoring process as well as designing the actual monitoring needs and\nactivities. these activities need to be coordinated, which is part of the design.\nbased on previous information set by the scope and the assets defined, in combination with', metadata={'doc_ID': 1526, 'original_text': '- monitoring and measuring\n- the design of the isms specific requirements includes security monitoring and measurement program for the isms that supports management review\n- designing monitoring\n- review of incident response reports\n- records of preparation and monitoring monitoring activities\n- coordination of regular checks performance of monitoring activities isms management\n- verification and reporting of security control implementation\n- figure e.1 — the monitoring process flow\n- preparation and coordination: identification of relevant assets for monitoring\n- it should be noted that monitoring is a continuous process and, as such, the design should take into consideration the set-up of the monitoring process as well as designing the actual monitoring needs and activities. these activities need to be coordinated, which is part of the design.\n- based on previous information set by the scope and the assets defined, in combination with', 'source': 'ISO 27003 2010 (E).pdf', 'title': 'ISO 27003 2010 (E)', 'relevance_score': 0.98849183})]","Within the framework of the ISMS (Information Security Management System), it means to monitor or measure objects and their attributes to analyze and evaluate the effectiveness of the ISMS. An example of this is verifying the effectiveness of organizational measures. The attributes of the objects can include various aspects, such as awareness of a measure. Through interviews, it can be measured how many people are aware of the measure. The results of these measurements can be used to take follow-up actions, such as more intensive training, to improve the effectiveness of the measure. The organization can determine the method of measurement, but certain conditions must be met, such as consistency of measurement results when repeated and regular conduct of the measurements.","Monitoring or measuring objects and their attributes within the framework of the ISMS involves assessing specific aspects to evaluate the effectiveness of organizational measures. For example, in the context of awareness, interviews can be conducted to determine if individuals are aware of security measures. This monitoring can be part of management audits and should be carried out continuously or regularly. The organization can choose which objects and attributes to monitor, as long as they contribute to analyzing the ISMS's effectiveness. The method of measurement is flexible but must be consistent and independent of the executor. Results should be recorded and kept for a specified period. Monitoring performance is crucial for evaluating the ISMS's ability to achieve security objectives. ISO 27001 recommends establishing a measurement program to organize monitoring activities effectively. The program should be designed to ensure consistent and standardized measurements, such as measuring the average processing time of vulnerability reports",True,0.5745454545454546,0.24908424908424912,0.33454545454545453,0.7282690219581127,0.9996397495269775,0.8668929681881006,0.875,0.8510606576259111,2.1429953575134277,3.31122088432312,0.004998683929443359,5.454216241836548
Fine-tuned_finetuned-ISO-27001_1024_l2_All_1536_264_False_Kers,Hybrid_Rerank_Cohere_Compression,8,gpt-3.5-turbo-16k,16385,0,1,Why can conformity to ISO 27001 be important and what benefits does it offer to an organization?,"[Document(page_content='to any organisation.\nthe iso 27001 controls help to clearly categorise potential risks. but what\nare the tangible benefits of mitigating risks?\nnot all organisations choose to adopt iso 27001 certification, but many use it\nas a framework to keep their isms safe from the risk of information security\nbreaches.\niso 27001 compliance demonstrates to stakeholders (such as customers and\nshareholders) that an organisation has prioritised the implementation of\ninformation security best practices. this can lead to the following benefits:\n * improved competitiveness * reduced risks of fines and losses due to data protection breaches * improved brand perception * compliance with relevant business, legal, economic and statutory requirements * improved structure and focus * reduced number of required audits * unbiased assessment of the organisation’s security posture\nin short, iso 27001 certification makes it easier to satisfy regulatory\nobligations, demonstrates your organisation’s reliability to partners, and\nshows your dedication to maintaining the highest standards of information\nsecurity. it also increases the value of your brand, resulting in a win-win\nsituations.\n## our checklist: how to achieve iso 27001 compliance even if they are not seeking official certification, there is always the\noption for organisations to pursue compliance with the iso 27001 standard\nrequirements. the following list shows the best practices you can implement to\nachieve this and can be', metadata={'description': 'ISO 27001 Controls are all 93 measures from Annex A of the new ISO 27001:2022. Explore our Guide and learn everything about the ISO 27001 Annex A controls.', 'doc_ID': 191, 'language': 'en-gb', 'original_text': '- iso 27001 compliance demonstrates to stakeholders (such as customers and shareholders) that an organisation has prioritised the implementation of information security best practices. this can lead to the following benefits:\n * improved competitiveness * reduced risks of fines and losses due to data protection breaches * improved brand perception * compliance with relevant business, legal, economic and statutory requirements * improved structure and focus * reduced number of required audits * unbiased assessment of the organisation’s security posture\n- in short, iso 27001 certification makes it easier to satisfy regulatory obligations, demonstrates your organisation’s reliability to partners, and shows your dedication to maintaining the highest standards of information security. it also increases the value of your brand, resulting in a win-win situations.\n- our checklist: how to achieve iso 27001 compliance even if they are not seeking official certification, there is always the option for organisations to pursue compliance with the iso 27001 standard requirements. the following list shows the best practices you can implement to achieve this and can be', 'source': 'https://www.dataguard.co.uk/knowledge/iso-27001-controls-annex-a/', 'title': 'ISO 27001 Controls: Overview of all measures from Annex A', 'relevance_score': 0.9990073}), Document(page_content='for certification can be resource-intensive and time-consuming,\noften taking up to 18 months from the start of the initial certification process in addition to the baseline iso\n27001 certification cost. despite these requirements, iso 27001 certification comes with many benefits that\nset your organization apart from the competition.\nstrongcm 5\nfor example, as the only internationally recognized security standard for isms management, some\norganizations require the companies they work with to demonstrate iso 27001 compliance or certification.\nthus, certification can help you attract and retain clients.\nthis gives organizations of all sizes a clear business advantage and a strong reputation within the international\nmarketplace. plus, even before your organization is officially certified, external audits showing your alignment\nwith iso 27001 isms standards can offer peace of mind to new customers or clients.\nthe regular auditing schedule required for compliance also helps improve your security posture, streamline\nregulatory and compliance reporting, and present new opportunities to strengthen your isms as your\norganization grows and new risks emerge. this is a clear benefit of iso 27001 for startups.\nan iso 27001 audit conducted by an auditing firm or certifying body also provides valuable insight that can\nhelp your organization create more efficient policies or procedures, close security gaps, and improve controls.\nstronger security practices reduce the likelihood of a successful breach, so your organization', metadata={'doc_ID': 1337, 'original_text': '- ""iso 27001 certification comes with many benefits""\n- ""certification can help you attract and retain clients""\n- ""a clear business advantage and a strong reputation within the international marketplace""\n- ""external audits showing your alignment with iso 27001 isms standards can offer peace of mind to new customers or clients""\n- ""the regular auditing schedule required for compliance also helps improve your security posture, streamline regulatory and compliance reporting, and present new opportunities to strengthen your isms as your organization grows and new risks emerge""\n- ""an iso 27001 audit conducted by an auditing firm or certifying body also provides valuable insight that can help your organization create more efficient policies or procedures, close security gaps, and improve controls""\n- ""stronger security practices reduce the likelihood of a successful breach""', 'source': 'complete-guide-iso-27001-compliance.pdf', 'title': 'complete guide iso 27001 compliance', 'relevance_score': 0.9986276}), Document(page_content=""27001\nclearly, identifying and addressing security risks is beneficial for any\nbusiness. the iso 27001 controls play an important role in the clear\ncategorization of potential risks. but what are the specific benefits of\nmitigating risks?\nbuild trust with all stakeholders\niso 27001 equips organizations with the information they need to protect\nvaluable data by applying good information security practices. iso 27001\ncompliance gives customers, partners, and key stakeholders the assurance that\nthe organization has taken the necessary security measures to treat valuable\ninformation and sensitive data appropriately.\nprotect organizations from data breaches\nthe iso 27001 standard defines policies and procedures for security measures\nthat, when implemented, protect an organization from unauthorized access to\nits data and from complete data loss.\nby implementing the proposed measures, the risk of data breaches or fines for\nsuch incidents is also reduced. the guidelines cover information security\nacross all areas. however, it is important to note that iso 27001 does not offer an absolute\nguarantee against security incidents or data breaches. but it creates a\nframework to reduce the likelihood of such incidents and strengthen an\norganization's ability to respond to them appropriately. the precise\nimplementation and effectiveness of the measures depend on the individual\norganization and its environment.\nif data is compromised in any way, the iso 27001 standard sets out procedures\nfor responsible and effective"", metadata={'source': 'https://experta.com/shared-post/367d5f2c-e60f-4187-9faf-cb44fb209cdc', 'title': 'Experta', 'language': 'No language found.', 'original_text': '- ""the iso 27001 controls play an important role in the clear categorization of potential risks.""\n- ""iso 27001 equips organizations with the information they need to protect valuable data by applying good information security practices.""\n- ""iso 27001 compliance gives customers, partners, and key stakeholders the assurance that the organization has taken the necessary security measures to treat valuable information and sensitive data appropriately.""\n- ""the iso 27001 standard defines policies and procedures for security measures that, when implemented, protect an organization from unauthorized access to its data and from complete data loss.""\n- ""by implementing the proposed measures, the risk of data breaches or fines for such incidents is also reduced.""\n- ""iso 27001 does not offer an absolute guarantee against security incidents or data breaches.""\n- ""the precise implementation and effectiveness of the measures depend on the individual organization and its environment.""\n- ""if data is compromised in any way, the iso 27001 standard sets out procedures for responsible and effective""', 'doc_ID': 296, 'relevance_score': 0.99856186}), Document(page_content='the iso 27001 information security standards involve\ninformation and data to protecting information assets across the organization. that means\nmaintain hig h com pliance multiple teams are trained and committed to proactively protecting\nstandards."" company information and data to maintain high compliance\nstandards.\nthe documentation required for iso 27001 certification requires businesses to clearly define the business\nprocesses and procedures designed to maintain, monitor, and improve the isms for exceptional asset security.\nit also defines who is responsible for managing these processes. this can improve operational efficiency, reduce\nhuman error, improve identity and access management practices, and ultimately provide a more cost-effective\nway to handle security management.\nsince improvement is built into the certification and recertification process, your organization can proactively\nprevent security breaches and unexpected security gaps, too. achieving and maintaining iso 27001 compliance\ninvolves regular internal and external audits to find nonconformities and improvements. plus, management\naudits ensure that teams successfully complete recommended implementations.\no04\nbenefits of iso 27001 certification\nmeeting the rigorous iso 27001 standards for certification can be resource-intensive and time-consuming,\noften taking up to 18 months from the start of the initial certification process in addition to the baseline iso\n27001 certification cost. despite these requirements, iso 27001 certification', metadata={'doc_ID': 1336, 'original_text': '- the iso 27001 information security standards involve information and data to protecting information assets across the organization.\n- maintain hig h com pliance multiple teams are trained and committed to proactively protecting standards."" company information and data to maintain high compliance standards.\n- the documentation required for iso 27001 certification requires businesses to clearly define the business processes and procedures designed to maintain, monitor, and improve the isms for exceptional asset security.\n- it also defines who is responsible for managing these processes.\n- this can improve operational efficiency, reduce human error, improve identity and access management practices, and ultimately provide a more cost-effective way to handle security management.\n- achieving and maintaining iso 27001 compliance involves regular internal and external audits to find nonconformities and improvements.\n- plus, management audits ensure that teams successfully complete recommended implementations.\n- benefits of iso 27001 certification\n- meeting the rigorous iso 27001 standards for certification can be resource-intensive and time-consuming, often taking up to 18 months from the start of the initial certification process in addition to the baseline iso 27001 certification cost.\n- despite these requirements, iso 27001 certification', 'source': 'complete-guide-iso-27001-compliance.pdf', 'title': 'complete guide iso 27001 compliance', 'relevance_score': 0.9983515}), Document(page_content='# 5 benefits of iso 27001 certification\n## **1\\. it will protect your reputation from security threats**\nthe most obvious reason to certify to iso 27001 is that it will help you avoid\nsecurity threats. this includes both cyber criminals breaking into your\norganisation and data breaches caused by internal actors making mistakes.\niso 27001’s framework ensures that you have the tools in place to strengthen\nyour organisation across the three pillars of cyber security: people,\nprocesses and technology.\nyou can use the standard to identify the relevant policies you need to\ndocument, the technologies to protect you and the staff training to avoid\nmistakes.\n## **2\\. you’ll avoid regulatory fines**\niso 27001 helps organisations to avoid the costly penalties associated with\nnon-compliance with data protection requirements such as the gdpr (general\ndata protection regulation).\nindeed, the standard’s framework has much in common with the gdpr, and\norganisations can use its guidelines to achieve and maintain compliance.\nbut the gdpr isn’t the only framework that iso 27001 can help you with. its\nbest-practice approach to information security means it is a suitable starting\npoint for any number of regulations.\n## **3\\. it will protect your reputation**\nby achieving iso 27001 compliance, you can demonstrate to stakeholders that\nyou take information security seriously.\nthis will help you win new business and enhance your reputation with existing\nclients and customers. in fact, some organisations will only work', metadata={'description': 'The benefits of ISO 27001 certification demonstrates to customers that you have taken the necessary steps to protect your business.', 'doc_ID': 36, 'language': 'en-GB', 'original_text': '- 5 benefits of iso 27001 certification\n- it will protect your reputation from security threats\n- the most obvious reason to certify to iso 27001 is that it will help you avoid security threats.\n- iso 27001’s framework ensures that you have the tools in place to strengthen your organisation across the three pillars of cyber security: people, processes and technology.\n- you can use the standard to identify the relevant policies you need to document, the technologies to protect you and the staff training to avoid mistakes.\n- you’ll avoid regulatory fines\n- iso 27001 helps organisations to avoid the costly penalties associated with non-compliance with data protection requirements such as the gdpr (general data protection regulation).\n- indeed, the standard’s framework has much in common with the gdpr, and organisations can use its guidelines to achieve and maintain compliance.\n- but the gdpr isn’t the only framework that iso 27001 can help you with. its best-practice approach to information security means it is a suitable starting point for any number of regulations.\n- it will protect your reputation\n- by achieving iso 27001 compliance, you can demonstrate to stakeholders that you take information security seriously.\n- this will help you win new business and enhance your reputation with existing', 'source': 'https://www.itgovernance.eu/blog/en/benefits-of-iso-27001-certification', 'title': '5 Benefits of ISO 27001 Certification - IT Governance Blog En', 'relevance_score': 0.9982926}), Document(page_content=""or organisation can avoid significant financial losses caused by ransomware attacks.\n * win more deals; having a certified information security system can set you apart from the competition and win trust among potential customers.\n * you may be able to secure investment more easily; investors are becoming more and more aware of the threats ransomware attacks have.\n * by getting certified, you can experience increased customer trust because, nowadays, tech-savvy customers want to know how you handle data safely.\n * promising to keep your customer's data safe can become your brand's unique selling point.\n * reduced risk of data breaches: by having the proper measures in place — you can avoid the risk of a breach before it even happens.\n * setting up processes and procedures when it comes to how you handle data can also mean increased operational efficiency. because now you have a standard process instead of different methods.\n * enhanced brand reputation: customers want to know how you handle their information, and getting iso 27001 certified is the ultimate promise that you take information security seriously.\n### is iso 27001 compliance sufficient?\nif you’re looking to establish an information security management system — iso\n27001 is the ultimate baseline that will cover most businesses' compliance and\ninformation security needs.\nwhat your customers and suppliers require will depend on where your business\noperates. iso 27001 is an internationally recognised standard known as the\ngold standard,"", metadata={'description': 'No matter if you’re an SMB or an international corporation — getting an ISO 27001 certification should be on your agenda. Here’s the ultimate guide on how.', 'doc_ID': 131, 'language': 'en-gb', 'original_text': ""- Why can conformity to ISO 27001 be important and what benefits does it offer to an organization?\n- by getting certified, you can experience increased customer trust because, nowadays, tech-savvy customers want to know how you handle data safely.\n- promising to keep your customer's data safe can become your brand's unique selling point.\n- enhanced brand reputation: customers want to know how you handle their information, and getting iso 27001 certified is the ultimate promise that you take information security seriously.\n- is iso 27001 compliance sufficient?\n- if you’re looking to establish an information security management system — iso 27001 is the ultimate baseline that will cover most businesses' compliance and information security needs."", 'source': 'https://www.dataguard.co.uk/knowledge/iso-27001-certification/', 'title': 'ISO 27001 Certification: Your ultimate guide [free guide available]', 'relevance_score': 0.9979967}), Document(page_content='# why are so many organisations certifying to iso 27001?\ndata breaches and cyber attacks are, unfortunately, becoming a regular\noccurrence. according to research from the identify theft resource center,\nthere were 1,864 security incidents in 2021.\nthat’s a 68% increase over the previous year, and as organisations become\nincreasingly reliant on technology, the number of incidents will continue to\nrise unless information security is sufficiently prioritised.\norganisations that have already certified to iso 27001 understand the benefits\nof the framework, but for everyone else, it’s true potential is yet to be\nseen.\n### **how iso 27001 helps**\niso 27001 sets out a best-practice approach to cyber risk management that can\nbe adopted by all businesses, large or small.\nthe standard outlines three essential aspects or ‘pillars’ of effective\ninformation security: people, processes and technology.\nthis three-pronged approach helps organisations defend themselves from both\nhighly organised attacks and common internal threats, such as accidental\nbreaches and human error.\niso 27001 certification brings a wealth of benefits. for example, it helps\norganisations:\n * avoid penalties and financial losses due to data breaches.\n * meet increasing client demands for greater data security.\n * protect and enhance your reputation.\n * get independently audited proof that your data is secure.\nplus, as organisations look to address their wider information security\nrequirements, there is the small matter of the gdpr (general', metadata={'doc_ID': 38, 'language': 'en-GB', 'original_text': '- ""Why are so many organisations certifying to iso 27001?""\n- ""Data breaches and cyber attacks are, unfortunately, becoming a regular occurrence.""\n- ""According to research from the identify theft resource center, there were 1,864 security incidents in 2021.""\n- ""Organisations that have already certified to iso 27001 understand the benefits of the framework, but for everyone else, it’s true potential is yet to be seen.""\n- ""How iso 27001 helps""\n- ""Iso 27001 sets out a best-practice approach to cyber risk management that can be adopted by all businesses, large or small.""\n- ""The standard outlines three essential aspects or ‘pillars’ of effective information security: people, processes and technology.""\n- ""This three-pronged approach helps organisations defend themselves from both highly organised attacks and common internal threats, such as accidental breaches and human error.""\n- ""Iso 27001 certification brings a wealth of benefits.""\n- ""For example, it helps organisations:""\n- ""Avoid penalties and financial losses due to data breaches.""\n- ""Meet increasing client demands for greater data security.""\n- ""Protect and enhance your reputation.""\n- ""Get independently audited proof that your data is secure.""\n- ""Plus, as organisations', 'source': 'https://www.itgovernance.eu/blog/en/why-are-so-many-organisations-getting-certified-to-iso-27001', 'title': 'Why Are So Many Organisations Certifying to ISO 27001? - IT Governance Blog En', 'relevance_score': 0.9979572}), Document(page_content='what is iso 27001?\niso 27001 is the international standard that describes best practices for an information security management systems (isms). it’s based on a set of iso 27001 controls and measures, which organizations can use to achieve information security. the iso 27001 standard requires that you have procedures in place to cover aspects of the isms, including:\ninformation security risk management (what are the risks you face and how do you treat those risks?)\nmonitoring, measurement, analysis, and evaluation (how is the effectiveness of the information security management system evaluated?)\nimprovement (how are nonconformities evaluated and corrected?)\nwho needs iso 27001?\nany business experiencing growth in international markets that wants to demonstrate to customers they are preserving the confidentiality, integrity, and availability of information by applying a risk management process can benefit from iso 27001. the primary focus is empowering organizations to establish, implement, maintain, and continually improve their isms.\ncurious about how iso 27001 compares to soc 2? learn more in this article on our blog.\nwhy is iso 27001 important?\nthe iso 27001 standard is an effective way to keep your company’s information secure when you take the right steps to implement it. it provides a structured approach to implementing, integrating, and continuously improving your isms. this helps protect assets from both internal and external threats by making sure you:\nunderstand the organization’s needs,', metadata={'description': ""Starting your journey to ISO 27001 compliance? Here's an easy-to-follow guide to get you on the right track"", 'doc_ID': 70, 'language': 'en', 'original_text': '- iso 27001 is the international standard that describes best practices for an information security management systems (isms).\n- the iso 27001 standard requires that you have procedures in place to cover aspects of the isms, including:\n- information security risk management (what are the risks you face and how do you treat those risks?)\n- monitoring, measurement, analysis, and evaluation (how is the effectiveness of the information security management system evaluated?)\n- improvement (how are nonconformities evaluated and corrected?)\n- any business experiencing growth in international markets that wants to demonstrate to customers they are preserving the confidentiality, integrity, and availability of information by applying a risk management process can benefit from iso 27001.\n- the primary focus is empowering organizations to establish, implement, maintain, and continually improve their isms.\n- why is iso 27001 important?\n- the iso 27001 standard is an effective way to keep your company’s information secure when you take the right steps to implement it.\n- it provides a structured approach to implementing, integrating, and continuously improving your isms.\n- this helps protect assets from both internal and external threats by making sure you:\n- understand the organization’s needs,', 'source': 'https://www.drata.com/blog/iso-27001-compliance', 'title': 'ISO 27001: A Beginner’s Guide', 'relevance_score': 0.9979089})]","Conformity to ISO 27001 can be important for an organization to meet legal requirements, fulfill external regulations, and be able to participate in bidding processes. Conforming to the standard indicates the organization's competence in information security and can serve as a reference when selecting partners. Additionally, certification provides the advantage of independent experts confirming that information security is in order. A successful audit and certification allow the organization to demonstrate its conformity to third parties and fulfill external regulations.","Conformity to ISO 27001 is important as it demonstrates an organization's commitment to implementing information security best practices. This certification can lead to benefits such as improved competitiveness, reduced risks of fines and losses due to data breaches, enhanced brand perception, compliance with relevant requirements, improved structure and focus, reduced number of audits, and unbiased assessment of security posture. ISO 27001 certification makes it easier to meet regulatory obligations, shows reliability to partners, and highlights dedication to high information security standards, ultimately increasing the organization's brand value. By adhering to ISO 27001, organizations can attract and retain clients, gain a competitive advantage, ensure alignment with international standards, improve security posture, and receive valuable insights to enhance security practices.",True,0.39,0.10101010101010102,0.21999999999999997,0.9831258356571198,0.9998807907104492,0.7868659124579054,1.0,0.7969792449161729,2.073000907897949,3.4521446228027344,0.003995656967163086,5.525145530700684
Fine-tuned_finetuned-ISO-27001_1024_l2_All_1536_264_False_Kers,Hybrid_Rerank_Cohere_Compression,8,gpt-3.5-turbo-16k,16385,0,1,What role do audits and certifications play in providing evidence of compliance with ISO 27001?,"[Document(page_content=""comes to the iso 27001 certification are:\ndocumentation, undergoing audits and ensuring your employees adopt the\nprocesses.\n**documentation** includes the creation and maintenance of necessary\ndocumentation for your information security management system (isms), such as\npolicies, procedures, risk assessments, and controls.\n**undergoing audits** includes both the stage 1 audit, which reviews\ndocumentation and readiness, and the stage 2 audit, which assesses the\npractical implementation of your isms. successful completion of these audits\nis necessary to achieve iso 27001 certification. you will also be required to\nundergo internal audits and management reviews.\nit's also crucial to **communicate the processes effectively** this is to\nensure that your organization's information security practices align with the\niso 27001 standards. you will need to have the documentation in place but also\nput the processes into action by ensuring employees are aware of and follow\nthem.\nthe mandatory documents required for the iso 27001 standard are listed below.\nall criteria must be followed and documented accordingly for an organisation\nto present during external audits. the standard requires you to undergo an\ninternal audit before an external one. this will expose any gaps in your isms.\nonce you have prepared the documentation and undergone an internal audit as\nwell as a management review, you need to undergo an external audit by a\ncertified body such as the ukas.\nthe mandatory documents required for iso 27001 are:\n *"", metadata={'description': 'No matter if you’re an SMB or an international corporation — getting an ISO 27001 certification should be on your agenda. Here’s the ultimate guide on how.', 'doc_ID': 146, 'language': 'en-gb', 'original_text': '- undergoing audits\n- documentation\n- internal audits\n- management reviews\n- external audit\n- certified body', 'source': 'https://www.dataguard.co.uk/knowledge/iso-27001-certification/', 'title': 'ISO 27001 Certification: Your ultimate guide [free guide available]', 'relevance_score': 0.99090964}), Document(page_content='you may choose to engage a third-\nparty consultant to perform the internal audit, or a member of your\norganization, who is qualified and independent of the control owners, may\nperform the audit.\n\u200d\n **7\\. complete a full certification audit**\nthis is the key piece of your iso 27001 certification: the full audit. your\ncertification organization will conduct an in-depth investigation of your isms\nto evaluate your iso 27001 compliance. this can be an extensive on-site\nprocess.\n keep in mind, though, that compliance automation software like vanta can make\nthis process simpler. as it scans your system, vanta compiles and documents\nevidence of your compliance, so your auditor will have all this documentation\nin one convenient place.\n\u200d\n **8\\. receive your certification**\nif your auditor determines that you adhere to all the necessary components of\niso 27001, you will officially receive your certification.\n\u200d\n\u200d\n## maintain your iso 27001 certification\n\u200d\nit’s important to understand that iso 27001 certification is not a one-time\nprocess. your certification will need to be renewed to some degree every year.\n these certificates use a three-year cycle. one year after your first\ncertification, your certification organization will conduct a less extensive\naudit to check a few key controls. if you pass this, you’ll retain your\ncertification. if not, the organization will conduct a full, intensive audit\nas they did in the first year.\n the same is true for the second year after your initial certification:', metadata={'description': 'Need to get ISO 27001 certified? Find out what you can expect from the ISO 27001 certification process from security compliance experts.', 'doc_ID': 16, 'language': 'en', 'original_text': '- complete a full certification audit\n- receive your certification\n- maintain your iso 27001 certification', 'source': 'https://www.vanta.com/resources/how-long-does-it-take-to-get-iso-certified', 'title': 'What is the ISO certification timeline?', 'relevance_score': 0.9906238}), Document(page_content='to work with experts such as dataguard or an external\nconsultant, you may receive documentation templates that will help cut down on\nyour manual work significantly compared to creating them from scratch.\n## what is an audit, and why is it important?\nan audit is basically the process of checking that your isms meets the\nrequirements and criteria of a standard. if you are certifying against iso\n27001, it will be the requirements of the iso 27001 standard.\naudits ensure the success of your isms by identifying information security\nnon-conformities and can be either internal or external. internal audits can\nbe carried out using the organisations’ own resources — whether that’s\ninternal employees of the company or contracted independent consultants (2nd\nparty auditors).\nexternal audits are carried out by a certification body, external partners or\ncustomers who want to assess the isms on their own terms. the latter is rather\nthe exception than the rule — when referring to an external audit, a\ncertification body is meant in most cases.\naudits are incredibly important not only because they are:\n * **a concrete **requirement** of the iso 27001 standard.**\n * the only way of **verifying whether you comply** with the standard.\n * necessary to **obtain your iso 27001 certification.**\n## conducting internal audits: how to go about it\ninternal audits are vital for long-term success in earning and keeping your\niso 27001 certification. they should be carried out on a regular basis by\nemployees within the company,', metadata={'description': 'No matter if you’re an SMB or an international corporation — getting an ISO 27001 certification should be on your agenda. Here’s the ultimate guide on how.', 'doc_ID': 137, 'language': 'en-gb', 'original_text': '- What role do audits and certifications play in providing evidence of compliance with ISO 27001?\n- An audit is basically the process of checking that your isms meets the requirements and criteria of a standard.\n- Audits ensure the success of your isms by identifying information security non-conformities and can be either internal or external.\n- Audits are incredibly important not only because they are a concrete requirement of the iso 27001 standard, the only way of verifying whether you comply with the standard, and necessary to obtain your iso 27001 certification.\n- Conducting internal audits: how to go about it\n- Internal audits are vital for long-term success in earning and keeping your iso 27001 certification.', 'source': 'https://www.dataguard.co.uk/knowledge/iso-27001-certification/', 'title': 'ISO 27001 Certification: Your ultimate guide [free guide available]', 'relevance_score': 0.9881766}), Document(page_content='and for demonstrating compliance with external requirements. for reasons of recognition and comparability, an accredited certification body should always be selected.\nwe have found that companies operating in certain industries, e.g. financial services, must undergo a series of external audits throughout a year. all of these audits deal with similar topics but are conducted by auditors recognized for different audit areas. from the perspective of the companies involved, the reusability of audit results brings time and cost advantages. how a general standardization and industry-specific requirements can be combined in a standardization can also be seen in the example of the iso 27000 series. in addition to the base standard iso 27001, there are a number of industry-specific specialized standards specifying particular requirements that an isms in an organization active in that industry should meet. during the audit, both standards can be used as a basis. the advantage is that the specialized standard only contains additions and clarifications to iso 27001, allowing everything necessary to be checked with a single audit effort. a certificate issued then demonstrates both conformity to iso 27001 and conformity to the specialized standard.\nisms certification is almost routine in certain regions (e.g. in asia) by now. this can be seen when examining the evaluations of the iso 27001 standard and noting that most certificates were issued in countries like japan, china, great britain, and india—followed at a distance', metadata={'doc_ID': 3269, 'original_text': '- ""certification body""\n- ""companies operating in certain industries""\n- ""external audits""\n- ""similar topics""\n- ""auditors recognized for different audit areas""\n- ""reusability of audit results""\n- ""time and cost advantages""\n- ""general standardization""\n- ""industry-specific requirements""\n- ""iso 27000 series""\n- ""base standard iso 27001""\n- ""industry-specific specialized standards""\n- ""single audit effort""\n- ""certificate issued""\n- ""conformity to iso 27001""\n- ""conformity to the specialized standard""\n- ""isms certification""\n- ""certain regions (e.g. in asia)""\n- ""evaluations of the iso 27001 standard""\n- ""most certificates were issued in countries like japan, china, great britain, and india""', 'source': 'Kersten et al. - 2020 - IT-Sicherheitsmanagement nach der neuen ISO 27001_removed.pdf', 'title': 'Kersten et al. - 2020 - IT-Sicherheitsmanagement nach der neuen ISO 27001_removed', 'relevance_score': 0.98780584}), Document(page_content='one of the key requirements to obtain an iso 27001 certification is to conduct\nregular internal audits of the information security management system (isms).\ninternal audits help organisations to identify and address any weaknesses in\ntheir isms and to ensure that it is operating effectively.\n## what is an iso 27001 internal audit?\nan iso 27001 internal audit is an independent assessment of the isms to\ndetermine whether it is conforming to the requirements of iso 27001 and\nwhether it is operating effectively. the audit is conducted by an internal\nauditor who is independent of the isms being audited.\n## why are iso 27001 internal audits important?\niso 27001 internal audits are important for a number of reasons:\n * to comply with iso 27001: iso 27001 requires organisations to conduct regular internal audits of their isms. * to identify and address weaknesses in the isms: internal audits can help organisations identify weaknesses in their information security management system (isms) before they are exploited by attackers. * to improve the effectiveness of the isms: internal audits can help organisations identify areas where the isms can be improved. * to provide assurance to stakeholders: internal audits can provide assurance to stakeholders that the isms is operating effectively and that the organisation is taking steps to protect its sensitive information.\n## does iso 27001 require an internal audit?\nyes, iso 27001 requires organisations to conduct regular internal audits', metadata={'description': 'Ensure your ISMS is operating effectively for ISO 27001 compliance. Learn all you need to know about ISO 27001 Clause 9.2 internal audits in our guide.\n', 'doc_ID': 420, 'language': 'en-gb', 'original_text': '- one of the key requirements to obtain an iso 27001 certification is to conduct regular internal audits of the information security management system (isms).\n- internal audits help organisations to identify and address any weaknesses in their isms and to ensure that it is operating effectively.\n- an iso 27001 internal audit is an independent assessment of the isms to determine whether it is conforming to the requirements of iso 27001 and whether it is operating effectively.\n- iso 27001 internal audits are important for a number of reasons:\n  * to comply with iso 27001: iso 27001 requires organisations to conduct regular internal audits of their isms.\n  * to identify and address weaknesses in the isms: internal audits can help organisations identify weaknesses in their information security management system (isms) before they are exploited by attackers.\n  * to improve the effectiveness of the isms: internal audits can help organisations identify areas where the isms can be improved.\n  * to provide assurance to stakeholders: internal audits can provide assurance to stakeholders that the isms is operating effectively and that the organisation is taking steps to protect its sensitive information.\n- yes, iso 27001 requires organisations to conduct regular internal audits', 'source': 'https://www.dataguard.co.uk/knowledge/iso-27001/clause-9-2-internal-audit/', 'title': 'ISO 27001 Clause 9.2: Internal Audit', 'relevance_score': 0.9827572}), Document(page_content='audit.\nthe external audit is composed of two stages. stage 1 audit consists of an\nextensive documentation review, during which an external iso 27001 auditor\nreviews an organization’s policies and procedures to ensure they meet the\nrequirements of the iso standard and the organization’s isms.\nstage 2 audit consists of the auditor performing tests to ensure that an\norganization’s isms was properly designed and implemented and is functioning\nappropriately.\nan iso 27001 certification is valid for three years, however, iso requires\nthat surveillance audits be performed each year to ensure that the isms and\nits implemented controls continue to operate effectively. this means that\nevery 12 months during the 3-year cycle, an organization’s isms must undergo\nan iso 27001 external audit, where an auditor will assess portions of the\nisms.\n\u200d\n\u200d\n## who benefits from iso 27001 compliance?\n\u200d\niso 27001 compliance offers a win-win-win situation: it benefits you, your\nstaff, and your customers in various ways.\nthe iso 27001 certification benefits for your business include:\n * positioning your business as a stronger competitor so you can win more customers\n * protection for your intellectual property, brand, and professional reputation\n * retaining more of your customers\n * time savings and cost savings due to having more efficient processes\n * better security against a data breach and the associated costs like investigative costs and lawsuits\n * adherence to security and privacy regulations like gdpr and hipaa,', metadata={'description': ""Read our blog to learn more about what is ISO 27001 certification and who needs ISO 27001. We're here to help make the process simple and straightforward."", 'doc_ID': 6, 'language': 'en', 'original_text': '- audit\n- external audit\n- stage 1 audit\n- stage 2 audit\n- iso 27001 certification\n- surveillance audits\n- iso 27001 external audit\n- auditor\n- iso standard\n- isms\n- iso 27001 compliance\n- iso 27001 certification benefits', 'source': 'https://www.vanta.com/resources/who-needs-iso-27001-certification', 'title': 'What is ISO 27001 Certification and Who Needs it? | Vanta', 'relevance_score': 0.9758546}), Document(page_content='for certification can be resource-intensive and time-consuming,\noften taking up to 18 months from the start of the initial certification process in addition to the baseline iso\n27001 certification cost. despite these requirements, iso 27001 certification comes with many benefits that\nset your organization apart from the competition.\nstrongcm 5\nfor example, as the only internationally recognized security standard for isms management, some\norganizations require the companies they work with to demonstrate iso 27001 compliance or certification.\nthus, certification can help you attract and retain clients.\nthis gives organizations of all sizes a clear business advantage and a strong reputation within the international\nmarketplace. plus, even before your organization is officially certified, external audits showing your alignment\nwith iso 27001 isms standards can offer peace of mind to new customers or clients.\nthe regular auditing schedule required for compliance also helps improve your security posture, streamline\nregulatory and compliance reporting, and present new opportunities to strengthen your isms as your\norganization grows and new risks emerge. this is a clear benefit of iso 27001 for startups.\nan iso 27001 audit conducted by an auditing firm or certifying body also provides valuable insight that can\nhelp your organization create more efficient policies or procedures, close security gaps, and improve controls.\nstronger security practices reduce the likelihood of a successful breach, so your organization', metadata={'doc_ID': 1337, 'original_text': '- ""iso 27001 certification cost""\n- ""iso 27001 compliance or certification""\n- ""certification can help you attract and retain clients""\n- ""external audits showing your alignment with iso 27001 isms standards""\n- ""regular auditing schedule required for compliance""\n- ""improve your security posture""\n- ""streamline regulatory and compliance reporting""\n- ""strengthen your isms""\n- ""iso 27001 audit conducted by an auditing firm or certifying body""\n- ""valuable insight""\n- ""create more efficient policies or procedures""\n- ""close security gaps""\n- ""improve controls""\n- ""stronger security practices reduce the likelihood of a successful breach""', 'source': 'complete-guide-iso-27001-compliance.pdf', 'title': 'complete guide iso 27001 compliance', 'relevance_score': 0.97520185}), Document(page_content='visitors to inform them for capturing their\ncookies information and providing them with the options to either\naccept or reject this request. also, for any form that’s filled in online\non your organization website and is storing personal information,\nyou must get consent.\ne« get consent from clients and suppliers via contracts/agreements.\ne« put controls to protect this stored information.\ne define how users make requests to your organization to delete their\npersonal information.\ne after the data retention period is over, define how you dispose of the\npersonal information.\nevidence that can be prepared: protection of personally identifiable information\npolicy and procedures, consent evidence i.e. via paper forms signed or online\napplication acceptances, list of people with access to the information, review of access\npermissions, users request records to delete their personal information, and information\ndisposal evidence\nwho prepares it: department heads/managers along with the information security\nteam will identify and document evidence.\nfor external audit: the external auditor conducting the iso 27001 certification\naudit will check the evidence in order to verify how the organization identified and\nimplemented security controls for the privacy and protection of personal identifiable\ninformation.\n217\nchapter 6 execution\na.18.1.5 regulation of cryptography controls (iso 27001 control)\ncryptographic controls should be used in compliance with all relevant agreements,\nlegislation, and', metadata={'source': 'Chopra, Chaudhary - 2020 - Implementing an Information Security Management System - Security Management Based On ISO 27001.pdf', 'title': 'Chopra, Chaudhary - 2020 - Implementing an Information Security Management System - Security Management Based On ISO 27001', 'original_text': '- evidence that can be prepared: protection of personally identifiable information policy and procedures, consent evidence i.e. via paper forms signed or online application acceptances, list of people with access to the information, review of access permissions, users request records to delete their personal information, and information disposal evidence\n- who prepares it: department heads/managers along with the information security team will identify and document evidence.\n- for external audit: the external auditor conducting the iso 27001 certification audit will check the evidence in order to verify how the organization identified and implemented security controls for the privacy and protection of personal identifiable information.\n- a.18.1.5 regulation of cryptography controls (iso 27001 control)\n- cryptographic controls should be used in compliance with all relevant agreements, legislation, and', 'doc_ID': 1274, 'relevance_score': 0.9711838})]","Audits and certifications play a crucial role in demonstrating conformity to ISO 27001. During and as a result of an audit, deficiencies or deviations from the standard may be identified. Rather than being seen as negative, these findings serve as clear indications of improvement potential that will be further addressed. Following a successful external audit and potential certification, it is confirmed that the Information Security Management System (ISMS) is practical, effective, and well-established.

The audit report, documenting the results, is essential and must comply with the requirements of ISO 19011. To demonstrate conformity to third parties, the audit report can be presented to an independent and trustworthy certification body. This body can issue a recognized certificate of conformity that does not contain critical internal information, making it suitable for dissemination to third parties and for proving compliance with external requirements.

Choosing an accredited certification body is recommended to ensure recognition and comparability. In industries with specific requirements, there may be industry-specific standards in addition to ISO 27001. The audit can be based on both standards, allowing a single assessment to demonstrate conformity. The resulting certificate then attests conformity to both ISO 27001 and, if applicable, the industry-specific standard.","Audits and certifications play a crucial role in providing evidence of compliance with ISO 27001. Audits, whether internal or external, are essential for verifying if an organization's Information Security Management System (ISMS) meets the requirements of the standard. Internal audits help identify non-conformities and weaknesses within the ISMS, ensuring it operates effectively. External audits conducted by a certified body are necessary to obtain ISO 27001 certification. Certification serves as tangible proof of conformity to ISO 27001 standards, providing assurance to stakeholders and demonstrating a commitment to information security. Regular audits, including surveillance audits, are required to maintain ISO 27001 certification. Overall, audits and certifications are fundamental in validating compliance with ISO 27001 and enhancing an organization's security posture.",True,0.45962732919254656,0.15625,0.2546583850931677,0.9931185096502304,0.999879002571106,0.8580244529104185,0.8888888888888888,0.8989252402576877,1.7020392417907715,3.0128934383392334,0.0039997100830078125,4.714932680130005
Fine-tuned_finetuned-ISO-27001_1024_l2_All_1536_264_False_Kers,Hybrid_Rerank_Cohere_Compression,8,gpt-3.5-turbo-16k,16385,0,1,Is the audit of the ISMS a one-time thing?,"[Document(page_content=""* the audit must cover all aspects of the isms, including risk assessment, information security controls, isms documentation, awareness and training, and management review. * the audit findings must be documented in a report that is submitted to the organisation's management.\norganisations that are certified according to iso 27001 must also undergo an\nexternal audit by a certification body. there are two kinds of external audit,\none conducted once annually called a surveillance audit where the isms will be\nreviewed as part of ongoing evaluation and the other known as a full external\naudit which is more in-depth and conducted every three years.\nbenefits of iso 27001 audit:\n * improved information security posture * reduced risk of information security incidents * increased compliance with regulations * improved customer confidence * competitive advantage\nif you are considering implementing iso 27001 or if you are already certified,\nit is important to ensure that you are conducting regular internal audits.\ninternal audits are an essential tool for maintaining an effective isms and\nprotecting your organisation from information security threats.\n## where is an internal audit mandatory?\nan internal audit is not required by law or regulation. however, it is a good\npractice for all organisations to conduct regular internal audits of their\ninformation security and other management systems.\nin order to comply with iso 27001, all companies must conduct internal"", metadata={'source': 'https://www.dataguard.co.uk/knowledge/iso-27001/clause-9-2-internal-audit/', 'title': 'ISO 27001 Clause 9.2: Internal Audit', 'description': 'Ensure your ISMS is operating effectively for ISO 27001 compliance. Learn all you need to know about ISO 27001 Clause 9.2 internal audits in our guide.\n', 'language': 'en-gb', 'original_text': '* the audit must cover all aspects of the isms, including risk assessment, information security controls, isms documentation, awareness and training, and management review.\n* organisations that are certified according to iso 27001 must also undergo an external audit by a certification body.\n* there are two kinds of external audit, one conducted once annually called a surveillance audit where the isms will be reviewed as part of ongoing evaluation and the other known as a full external audit which is more in-depth and conducted every three years.\n* if you are considering implementing iso 27001 or if you are already certified, it is important to ensure that you are conducting regular internal audits.\n* internal audits are an essential tool for maintaining an effective isms and protecting your organisation from information security threats.\n* an internal audit is not required by law or regulation. however, it is a good practice for all organisations to conduct regular internal audits of their information security and other management systems.\n* in order to comply with iso 27001, all companies must conduct internal', 'doc_ID': 422, 'relevance_score': 0.996503}), Document(page_content='be seen as part of a more comprehensive monitoring/measurement plan to be determined by the organization itself.\nisms-9.2 - internal audit\nsuch an audit compares the existing reality with the existing requirements. this comparison takes place at specific points in time - practically a snapshot of the conditions. while a one-time audit may be helpful, this procedure only achieves its full effect through regular repetition.\nthe general requirement under isms-9.2 is to conduct internal audits at planned intervals to gain insights into whether the isms:\n- meets the organization\'s own requirements and the requirements of the standard,\n- is effectively established and continuously developed.\n""internal"" means that such an audit is conducted under the control of the organization itself and is carried out by its own personnel - or by external personnel commissioned by the organization. depending on the size and complexity of the organization, an internal audit is more likely to be conducted by an audit team.\nthe planned intervals suggest that a schedule - e.g. annually - is created in which the preparation phase, the audit itself, and the necessary follow-up work - e.g. addressing identified deficiencies - as well as reporting to the management level are pre-planned.\nthe first point mentioned above indicates that the required audit should compare the actual isms with the organization\'s own requirements. a second comparison should reflect the actual isms against the requirements of the standard. the wording also', metadata={'source': 'ISO 27001_2022_Kersten_und_Schroeder.pdf', 'title': 'ISO 27001_2022_Kersten_und_Schroeder', 'original_text': ""- the general requirement under isms-9.2 is to conduct internal audits at planned intervals to gain insights into whether the isms:\n- meets the organization's own requirements and the requirements of the standard,\n- is effectively established and continuously developed.\n- the planned intervals suggest that a schedule - e.g. annually - is created in which the preparation phase, the audit itself, and the necessary follow-up work - e.g. addressing identified deficiencies - as well as reporting to the management level are pre-planned.\n- the first point mentioned above indicates that the required audit should compare the actual isms with the organization's own requirements. a second comparison should reflect the actual isms against the requirements of the standard."", 'doc_ID': 2672, 'relevance_score': 0.9954261}), Document(page_content='as audits coordinated in terms of time\nwithout major problems to be feared. by now\nthere is several years of experience in operating the isms, and one is already familiar with the\npeculiarities of the audit situation. since all aspects of the standard are audited here as well,\nthere is sufficient clarity in terms of content.\nfor the implementation as a ""surprise audit,"" internal audits are most suitable\nin our opinion, if some experience with the isms has already been gained.\nin areas where a high level of security awareness and significantly\nhigh level of security are required, internal audits should always be conducted as surprise\naudits.\nfurther general guidance for conducting internal and external audits can be found in iso 27007 and iso 19011. auditors should familiarize themselves with these documents.\nin recent years, another differentiating feature for\nthe type of audit has emerged. in particular, larger organizations whose isms\nis operated relatively uniformly at multiple locations internally utilize\nthe opportunities that video conferences offer for coordination, when on one hand employees\nfrom different locations are to be involved, but on the other hand as little\ntime as possible should be spent on travel activities. the desire arises\nto be able to use video conferences within the scope of audits as well. for this purpose, the term tele-audit was coined. indeed, it is possible to use video conferences, web meetings,\nand remote access, e.g., to documents, also within the context of isms audits.', metadata={'doc_ID': 3276, 'original_text': '- ""as audits coordinated in terms of time""\n- ""there is several years of experience in operating the isms""\n- ""since all aspects of the standard are audited here as well""\n- ""internal audits are most suitable""\n- ""in areas where a high level of security awareness and significantly high level of security are required""\n- ""internal audits should always be conducted as surprise audits""\n- ""further general guidance for conducting internal and external audits can be found in iso 27007 and iso 19011""\n- ""in recent years, another differentiating feature for the type of audit has emerged""\n- ""larger organizations whose isms is operated relatively uniformly at multiple locations internally utilize the opportunities that video conferences offer for coordination""\n- ""to be able to use video conferences within the scope of audits as well""\n- ""the term tele-audit was coined""\n- ""it is possible to use video conferences, web meetings, and remote access, e.g., to documents, also within the context of isms audits""', 'source': 'Kersten et al. - 2020 - IT-Sicherheitsmanagement nach der neuen ISO 27001_removed.pdf', 'title': 'Kersten et al. - 2020 - IT-Sicherheitsmanagement nach der neuen ISO 27001_removed', 'relevance_score': 0.99343574}), Document(page_content='pre-planned.\nthe first point mentioned above indicates that the required audit should compare the actual isms with the organization\'s own requirements. a second comparison should reflect the actual isms against the requirements of the standard. the wording also suggests again that the organization\'s goals should not solely be to comply with the standard.\naccording to the list above, another task of the audit team is to assess the effectiveness of the isms. we have already provided many hints on this under isms-9.1. the audit team should also examine whether the isms is being ""reasonably"" developed. for this purpose, the team examines the (hopefully existing) records of how the organization has responded to new external and internal requirements (changes in context), how new technological capabilities have been incorporated into the isms, whether the process of continuous improvement is functioning, and how the results of previous audits have been dealt with. overall, a (positive) development of the organization must be recognizable.\nconducting internal audits is an important isms process according to the standard. therefore, it should be documented like any other process (process description), applied regularly, monitored, and adjusted or improved if necessary. when planning, it should be taken into account that the parts of the isms that are of high importance for information security receive correspondingly high attention - assuming that such differentiation based on importance is possible and', metadata={'source': 'ISO 27001_2022_Kersten_und_Schroeder.pdf', 'title': 'ISO 27001_2022_Kersten_und_Schroeder', 'original_text': '- according to the list above, another task of the audit team is to assess the effectiveness of the isms.\n- conducting internal audits is an important isms process according to the standard.', 'doc_ID': 2673, 'relevance_score': 0.9864156}), Document(page_content='an annual repetition is planned or, for example, one could follow the pdca process: after completing a pdca cycle in (information) security management - i.e. after the act phase - a management review always takes place. the latter could have the advantage that really up-to-date new information is available, but the disadvantage is that one becomes dependent on another isms process and its regular implementation.\nthe minimum information that must be available as input for the management review is specified in isms-9.3. we formulate the information in question form:\n- have all tasks from the last management review been completed or what is the current status? deficiencies or improvement opportunities may have been specified and delegated to the staff during the last implementation. the correct resolution must be verified.\n- have there been any changes in the organizational context that could be relevant to the isms? this concerns internal and external requirements and expectations, especially also requirements and expectations of interested parties (isms-4.2).\n- are there any information about the performance of the isms? the following points are mentioned: known deviations from the standard and corresponding corrective measures, results from the monitoring/measurement program according to isms-9.1, reports from conducted internal audits according to isms-9.2, the degree of fulfillment of security objectives (effectiveness).\n- have new risks been identified during the risk assessment in the past period?', metadata={'doc_ID': 2677, 'original_text': '- an annual repetition is planned or, for example, one could follow the pdca process: after completing a pdca cycle in (information) security management - i.e. after the act phase - a management review always takes place.\n- the minimum information that must be available as input for the management review is specified in isms-9.3.\n- have all tasks from the last management review been completed or what is the current status?\n- have there been any changes in the organizational context that could be relevant to the isms?\n- are there any information about the performance of the isms?\n- have new risks been identified during the risk assessment in the past period?', 'source': 'ISO 27001_2022_Kersten_und_Schroeder.pdf', 'title': 'ISO 27001 2022', 'relevance_score': 0.9858821}), Document(page_content='you may choose to engage a third-\nparty consultant to perform the internal audit, or a member of your\norganization, who is qualified and independent of the control owners, may\nperform the audit.\n\u200d\n **7\\. complete a full certification audit**\nthis is the key piece of your iso 27001 certification: the full audit. your\ncertification organization will conduct an in-depth investigation of your isms\nto evaluate your iso 27001 compliance. this can be an extensive on-site\nprocess.\n keep in mind, though, that compliance automation software like vanta can make\nthis process simpler. as it scans your system, vanta compiles and documents\nevidence of your compliance, so your auditor will have all this documentation\nin one convenient place.\n\u200d\n **8\\. receive your certification**\nif your auditor determines that you adhere to all the necessary components of\niso 27001, you will officially receive your certification.\n\u200d\n\u200d\n## maintain your iso 27001 certification\n\u200d\nit’s important to understand that iso 27001 certification is not a one-time\nprocess. your certification will need to be renewed to some degree every year.\n these certificates use a three-year cycle. one year after your first\ncertification, your certification organization will conduct a less extensive\naudit to check a few key controls. if you pass this, you’ll retain your\ncertification. if not, the organization will conduct a full, intensive audit\nas they did in the first year.\n the same is true for the second year after your initial certification:', metadata={'source': 'https://www.vanta.com/resources/how-long-does-it-take-to-get-iso-certified', 'title': 'What is the ISO certification timeline?', 'description': 'Need to get ISO 27001 certified? Find out what you can expect from the ISO 27001 certification process from security compliance experts.', 'language': 'en', 'original_text': '- **7\\. complete a full certification audit**\n- **8\\. receive your certification**\n- **maintain your iso 27001 certification**\n- ""iso 27001 certification is not a one-time process""\n- ""your certification will need to be renewed to some degree every year""\n- ""these certificates use a three-year cycle""\n- ""one year after your first certification, your certification organization will conduct a less extensive audit to check a few key controls""\n- ""if you pass this, you’ll retain your certification""\n- ""if not, the organization will conduct a full, intensive audit as they did in the first year""\n- ""the same is true for the second year after your initial certification""', 'doc_ID': 16, 'relevance_score': 0.9830851}), Document(page_content='annual verification audits to be conducted within this timeframe. other bodies limit the validity to one year from the outset and require a new audit to be conducted each year for certificate renewal. regardless of these procedures, the important rule is that any security-related changes to the isms must be communicated to the certification body and may trigger a so-called event-driven audit.\nin this context, it is strongly recommended to plan audits in the long term. for periodic audits, for example, one might schedule them for the same month each year, preferably choosing a month with lower workload from other activities. if internal and external audits are chosen, the scheduling should start from the external audit date and plan backwards, as indicated in table 5.1. we will delve into these steps further in section 5.3.\naudit subject\nthe planning continues with determining the audit subject. this could be a single organizational unit, a business process, or a particularly important security objective. however, it is usually advisable to select the entire organization and its isms. this is especially true for the first internal audit, where breadth examination is more important than in-depth scrutiny. the audit subject may also be determined by industry-specific standards, such as iso 27017 for cloud service providers or iso 27019 for the energy sector.\nthe determination of the audit subject is closely related to the type of audit being planned.\ntypes of audits\naudits can be classified under two', metadata={'doc_ID': 3273, 'original_text': 'annual verification audits to be conducted within this timeframe. other bodies limit the validity to one year from the outset and require a new audit to be conducted each year for certificate renewal. regardless of these procedures, the important rule is that any security-related changes to the isms must be communicated to the certification body and may trigger a so-called event-driven audit.', 'source': 'Kersten et al. - 2020 - IT-Sicherheitsmanagement nach der neuen ISO 27001_removed.pdf', 'title': 'Kersten et al. - 2020 - IT-Sicherheitsmanagement nach der neuen ISO 27001_removed', 'relevance_score': 0.9793541}), Document(page_content='audit can take place until sufficient time has passed for the organization\nto have in place a working internal audit and management review pro-\ncess and to demonstrate compliance with clause 10, the requirement for\nthe 18027001 audit\nimprovement. in other words, auditors will be looking for evidence that the\nisms is continuing to improve, not merely that it has been implemented.\nthis means that a period of time will have to elapse between completion of\nthe implementation and commencement of audit. how long will depend on\nthe complexity of the organization and its isms, but one should assume that\nthere will need to be good progress with the first cycle of internal audits for\nall of the key processes and arrangements. (it is for the certification body to\ndetermine exactly what it requires in order to be convinced of the establish-\nment, effectiveness and ongoing arrangements for internal isms audit and\nmanagement review, aspects it is required to confirm prior to issuing a certif-\nicate, and hence possibly something worth asking when selecting your\ncertification body.)\nthe level of preparedness for an audit should then be assessed by carry-\ning out a comprehensive review. the detailed work should be carried out by\nthe information security adviser and by the quality function, and this should\nall be reviewed by the management information security forum. a compre-\nhensive review could use this book, starting with chapter 4, and question\nthe extent to which adequate steps have been taken to implement the', metadata={'source': 'Watkins, Calder - 2020 - IT Governance - An International Guide to Data Security and ISO 27001 ISO 27002.pdf', 'title': 'Watkins, Calder - 2020 - IT Governance - An International Guide to Data Security and ISO 27001 ISO 27002', 'original_text': '- ""auditors will be looking for evidence that the isms is continuing to improve""\n- ""a period of time will have to elapse between completion of the implementation and commencement of audit""\n- ""good progress with the first cycle of internal audits for all of the key processes and arrangements""\n- ""the level of preparedness for an audit should then be assessed by carrying out a comprehensive review""\n- ""the detailed work should be carried out by the information security adviser and by the quality function""\n- ""a comprehensive review could use this book, starting with chapter 4, and question the extent to which adequate steps have been taken to implement the""', 'doc_ID': 2528, 'relevance_score': 0.9778834})]","No, the audit of the ISMS is not a one-time thing. It is advisable to conduct regular reviews to enable continuous improvements. The certification of the ISMS has a time limit and can only be maintained or extended through repeated audits. The duration of validity of a certificate varies depending on the certification body, but in most cases, annual review audits are required. Additionally, security-related changes must be communicated to the certification board, which can lead to a cause-based examination. It is strongly recommended to plan audits in the long term and conduct external audits as a complement to internal audits.","No, the audit of the ISMS is not a one-time thing. Organizations certified according to ISO 27001 must undergo regular external audits by a certification body. There are two types of external audits: surveillance audits conducted annually and full external audits conducted every three years. Additionally, internal audits must be conducted at planned intervals to ensure the ISMS meets the organization's requirements and the standard's requirements, is effectively established, and continuously developed. Internal audits are an essential tool for maintaining an effective ISMS and protecting the organization from information security threats. ISO 27001 certification is not a one-time process; it requires renewal to some degree every year, typically following a three-year cycle with annual verification audits.",True,0.4711111111111111,0.16143497757847533,0.27555555555555555,0.9160114303231239,0.9996829032897949,0.8454465196074017,0.8571428571428571,0.8013748475854939,1.6577155590057373,2.760349988937378,0.0019922256469726562,4.418065547943115
Fine-tuned_finetuned-ISO-27001_1024_l2_All_1536_264_False_Kers,Hybrid_Rerank_Cohere_Compression,8,gpt-3.5-turbo-16k,16385,0,1,What are the different types of audits regarding ISO 27001?,"[Document(page_content=""* the audit must cover all aspects of the isms, including risk assessment, information security controls, isms documentation, awareness and training, and management review. * the audit findings must be documented in a report that is submitted to the organisation's management.\norganisations that are certified according to iso 27001 must also undergo an\nexternal audit by a certification body. there are two kinds of external audit,\none conducted once annually called a surveillance audit where the isms will be\nreviewed as part of ongoing evaluation and the other known as a full external\naudit which is more in-depth and conducted every three years.\nbenefits of iso 27001 audit:\n * improved information security posture * reduced risk of information security incidents * increased compliance with regulations * improved customer confidence * competitive advantage\nif you are considering implementing iso 27001 or if you are already certified,\nit is important to ensure that you are conducting regular internal audits.\ninternal audits are an essential tool for maintaining an effective isms and\nprotecting your organisation from information security threats.\n## where is an internal audit mandatory?\nan internal audit is not required by law or regulation. however, it is a good\npractice for all organisations to conduct regular internal audits of their\ninformation security and other management systems.\nin order to comply with iso 27001, all companies must conduct internal"", metadata={'description': 'Ensure your ISMS is operating effectively for ISO 27001 compliance. Learn all you need to know about ISO 27001 Clause 9.2 internal audits in our guide.\n', 'doc_ID': 422, 'language': 'en-gb', 'original_text': '- there are two kinds of external audit,\none conducted once annually called a surveillance audit where the isms will be\nreviewed as part of ongoing evaluation and the other known as a full external\naudit which is more in-depth and conducted every three years.\n- if you are considering implementing iso 27001 or if you are already certified,\nit is important to ensure that you are conducting regular internal audits.\n- internal audits are an essential tool for maintaining an effective isms and\nprotecting your organisation from information security threats.\n- an internal audit is not required by law or regulation. however, it is a good\npractice for all organisations to conduct regular internal audits of their\ninformation security and other management systems.\n- in order to comply with iso 27001, all companies must conduct internal', 'source': 'https://www.dataguard.co.uk/knowledge/iso-27001/clause-9-2-internal-audit/', 'title': 'ISO 27001 Clause 9.2: Internal Audit', 'relevance_score': 0.99520767}), Document(page_content=""an external auditor, your company will\nfirst be required to perform an internal audit. an internal audit involves a\nthorough examination of your organization’s isms and is one of the best ways\nto ensure that your organization’s isms is operating effectively and is in\nalignment with the iso 27001 standard. specifically, organizations are\nrequired to self-verify conformance with the requirements from annex a of iso\n27001 deemed applicable in the isms's documented statement of applicability.\nthe internal audit is intended to help identify any gaps or deficiencies that\ncould affect your isms and impact your organization’s ability to meet its\nintended objectives, as well as to successfully complete an initial or annual\niso 27001 certification audit and maintain the certification.\n **the internal audit function is a requirement under the iso 27001 standard**\nand can be challenging to implement in a way that meets each of the\nrequirements set forth in the standard, especially for smaller organizations.\nthis is because of the prescriptive nature outlined in the standard, and the\nneed for allocated resources that are both independent of the development and\nmaintenance of the isms, while still possessing the necessary competencies to\nperform the internal audit function.\n**unlike a certification review where you must use an external third-party to\nconduct the audit, the internal audit can be conducted either by staff within\nyour organization or by an independent third party, such as a consulting\nfirm.** when"", metadata={'description': 'In this guide, we share the recommended approach to successful implementation of an Information Security Management System (ISMS) according to the ISO 27001 standard to help prepare your organization to undergo an independent evaluation of your ISMS in order to obtain your ISO 27001 certification.', 'doc_ID': 60, 'language': 'en', 'original_text': '- ""an internal audit involves a thorough examination of your organization’s isms""\n- ""specifically, organizations are required to self-verify conformance with the requirements from annex a of iso 27001 deemed applicable in the isms\'s documented statement of applicability.""\n- ""the internal audit is intended to help identify any gaps or deficiencies that could affect your isms and impact your organization’s ability to meet its intended objectives""\n- ""the internal audit function is a requirement under the iso 27001 standard""\n- ""unlike a certification review where you must use an external third-party to conduct the audit, the internal audit can be conducted either by staff within your organization or by an independent third party, such as a consulting firm.""', 'source': 'https://www.vanta.com/resources/the-ultimate-iso-27001-guide-powered-by-vanta-and-aprio', 'title': 'The ultimate ISO 27001 guide', 'relevance_score': 0.9937345}), Document(page_content='audit should follow the requirements of iso 27007, including topics such as personnel selection, planning, implementation, and reporting of results. it is important to note that these audits primarily focus on the management system (isms).\nin contrast, iso 27008 focuses on audits regarding the controls and their implementation - in short, it primarily focuses on technical audits. however, it should be noted that the performance of such (technical) audits is not generally required by iso 27001 or within the scope of certification. however, in practice, during management audits, the controls and their implementation are often reviewed on a sampling basis. the correct implementation of relevant controls and their effectiveness are the main focus.\nthe requirements of iso 27006-1 are not exhaustive: the mentioned institutions must also comply with iso 17021-1 [1] and iso 19011 [2].\nprivacy information management system (pims).\nthe iso/iec 27000 series and its fundamental concepts\ntable 1.1 basic standards\nstandard parts stand-e stand-d\n27000 2018-02 2020-06\n27001 2022-10 2023-04 (draft)\n27002 2022-02 2022-08 (draft)\n27003 2017-03 -\n27004 2016-12 -\n27005 2022-10\n27006 iso 27006-1 2015-10 + correction 2020 2023-05 (draft)\niso 27006-2 2021-02 -\n27007 2020-01 2022-10?\n27008 2019-01 -\n27009 2020-04 2022-09\nsince almost all basic standards in the series are kept at a relatively abstract level, there is often a need to interpret, refine, or supplement the requirements of iso 27001 for specific topics,', metadata={'source': 'ISO 27001_2022_Kersten_und_Schroeder.pdf', 'title': 'ISO 27001_2022_Kersten_und_Schroeder', 'original_text': '- iso 27007\n- iso 27008', 'doc_ID': 2538, 'relevance_score': 0.9906961}), Document(page_content='you may choose to engage a third-\nparty consultant to perform the internal audit, or a member of your\norganization, who is qualified and independent of the control owners, may\nperform the audit.\n\u200d\n **7\\. complete a full certification audit**\nthis is the key piece of your iso 27001 certification: the full audit. your\ncertification organization will conduct an in-depth investigation of your isms\nto evaluate your iso 27001 compliance. this can be an extensive on-site\nprocess.\n keep in mind, though, that compliance automation software like vanta can make\nthis process simpler. as it scans your system, vanta compiles and documents\nevidence of your compliance, so your auditor will have all this documentation\nin one convenient place.\n\u200d\n **8\\. receive your certification**\nif your auditor determines that you adhere to all the necessary components of\niso 27001, you will officially receive your certification.\n\u200d\n\u200d\n## maintain your iso 27001 certification\n\u200d\nit’s important to understand that iso 27001 certification is not a one-time\nprocess. your certification will need to be renewed to some degree every year.\n these certificates use a three-year cycle. one year after your first\ncertification, your certification organization will conduct a less extensive\naudit to check a few key controls. if you pass this, you’ll retain your\ncertification. if not, the organization will conduct a full, intensive audit\nas they did in the first year.\n the same is true for the second year after your initial certification:', metadata={'description': 'Need to get ISO 27001 certified? Find out what you can expect from the ISO 27001 certification process from security compliance experts.', 'doc_ID': 16, 'language': 'en', 'original_text': '- complete a full certification audit\n- receive your certification\n- maintain your iso 27001 certification', 'source': 'https://www.vanta.com/resources/how-long-does-it-take-to-get-iso-certified', 'title': 'What is the ISO certification timeline?', 'relevance_score': 0.9878996}), Document(page_content=""procedure for management review * evidence of the audit program and its results * evidence of the results of management reviews * evidence of the type of identified non-conformities and all subsequent actions * evidence of the results of all corrective and improvement actions taken 7. **evaluate yourself – measure, track, and assess** continuous improvement is one of the cornerstones of iso 27001. to achieve\nthis, you must understand how effective your isms measures are and how isms-\ncompliant your organization operates. ongoing monitoring and analyses reveal\nwhich of the existing processes and measures require changes. 8. **conduct an internal audit** internal audits of your isms are to be regularly conducted according to iso\n27001. the internal auditor conducting the audit of iso 27001 compliance needs\npractical knowledge of the approach as a lead auditor, ensuring objectivity\nand impartiality. at this point, iso 27001 certification is also a viable option if your\norganization has already achieved full compliance—especially if you have\nadhered to best practices and your organization's information security\nprocedures already align with the norm's requirements.\n## what does an iso 27001 certification cost?\nthe cost question regarding iso 27001 certification cannot be answered\nuniversally. it holds true: the more complex the requirements, the more\nelaborate the preparation. costs vary based on needs and the level of\nimplementation."", metadata={'source': 'https://www.dataguard.co.uk/knowledge/iso-27001/', 'title': 'What is ISO 27001? Key Information at a Glance', 'description': 'Discover the comprehensive guide to ISO 27001: Detailed insight into achieving and maintaining this essential information security standard. Explore its critical role in risk management, compliance and robust security practices, and learn step-by-step implementation techniques.', 'language': 'en-gb', 'original_text': ""- evidence of the type of identified non-conformities and all subsequent actions\n- **evaluate yourself – measure, track, and assess**\n- **conduct an internal audit**\n- internal audits of your isms are to be regularly conducted according to iso 27001.\n- the internal auditor conducting the audit of iso 27001 compliance needs practical knowledge of the approach as a lead auditor, ensuring objectivity and impartiality.\n- at this point, iso 27001 certification is also a viable option if your organization has already achieved full compliance—especially if you have adhered to best practices and your organization's information security procedures already align with the norm's requirements."", 'doc_ID': 177, 'relevance_score': 0.98269093}), Document(page_content='they are performing the review.\n * the documentation should be examined for completeness, accuracy, consistency, and suitability for its intended purpose.\n * the auditor will then check to see if you have the required documents and that it complies with the standards.\n 2. **management review**\n * the management review team should go through the documentation again to make sure that all relevant information has been recorded and that there are no omissions or missing information in any of the documents.\n * finally, management needs to look over the report and take the audit results into account. make sure that any essential changes and corrective measures are put into place.\nget a full breakdown of how to conduct an internal audit.\n## undergoing external audits: what to expect\nyou will be in touch with your auditor before the external audit takes place\nto agree on an audit that includes resources and timelines for the audit.\nin general, there are four types of external audits:\n * **stage 1 audit:** this is the documentation review audit, whereby the external auditor analyses if your organisation has all the necessary documentation in place for a fully functioning isms. your documents need to cover the documentation required in the iso/iec 27001 standard. the certification body will take the time to gain a sufficient understanding of the isms design in the context of your organization, risk assessment and treatment (including the controls determined), information security policy and', metadata={'description': 'No matter if you’re an SMB or an international corporation — getting an ISO 27001 certification should be on your agenda. Here’s the ultimate guide on how.', 'doc_ID': 139, 'language': 'en-gb', 'original_text': '* **stage 1 audit:** this is the documentation review audit, whereby the external auditor analyses if your organisation has all the necessary documentation in place for a fully functioning isms. your documents need to cover the documentation required in the iso/iec 27001 standard.', 'source': 'https://www.dataguard.co.uk/knowledge/iso-27001-certification/', 'title': 'ISO 27001 Certification: Your ultimate guide [free guide available]', 'relevance_score': 0.98091257}), Document(page_content='to work with experts such as dataguard or an external\nconsultant, you may receive documentation templates that will help cut down on\nyour manual work significantly compared to creating them from scratch.\n## what is an audit, and why is it important?\nan audit is basically the process of checking that your isms meets the\nrequirements and criteria of a standard. if you are certifying against iso\n27001, it will be the requirements of the iso 27001 standard.\naudits ensure the success of your isms by identifying information security\nnon-conformities and can be either internal or external. internal audits can\nbe carried out using the organisations’ own resources — whether that’s\ninternal employees of the company or contracted independent consultants (2nd\nparty auditors).\nexternal audits are carried out by a certification body, external partners or\ncustomers who want to assess the isms on their own terms. the latter is rather\nthe exception than the rule — when referring to an external audit, a\ncertification body is meant in most cases.\naudits are incredibly important not only because they are:\n * **a concrete **requirement** of the iso 27001 standard.**\n * the only way of **verifying whether you comply** with the standard.\n * necessary to **obtain your iso 27001 certification.**\n## conducting internal audits: how to go about it\ninternal audits are vital for long-term success in earning and keeping your\niso 27001 certification. they should be carried out on a regular basis by\nemployees within the company,', metadata={'source': 'https://experta.com/shared-post/a73a0b00-a398-4e8a-afcf-632f9631cb69', 'title': 'Experta', 'language': 'No language found.', 'original_text': '- Audits ensure the success of your isms by identifying information security non-conformities and can be either internal or external.\n- Internal audits can be carried out using the organisations’ own resources — whether that’s internal employees of the company or contracted independent consultants (2nd party auditors).\n- Audits are incredibly important not only because they are:\n  * **a concrete **requirement** of the iso 27001 standard.**\n  * the only way of **verifying whether you comply** with the standard.\n  * necessary to **obtain your iso 27001 certification.**', 'doc_ID': 274, 'relevance_score': 0.97680235}), Document(page_content='iso 27001 certification.**\n## conducting internal audits: how to go about it\ninternal audits are vital for long-term success in earning and keeping your\niso 27001 certification. they should be carried out on a regular basis by\nemployees within the company, as opposed to external auditors coming into your\ncompany to assess your isms.\nhowever, independency and qualification are a must for being an internal\nauditor. another option is to perform internal audits with external\nconsultants, like the experts at dataguard, who also offer regular audits.\ninternal audits are your best bet for catching gaps in your documentation and\nimproving it.\nwhen you are getting certified for the first time, the internal audit ensures\nyou have everything you need in place to pass your certification on the first\ntry.\nan internal audit checklist will help you keeping an overview of the necessary\nsteps in that process. here is an overview of the steps in an internal audit:\n 1. **documentation review**\n * all documentation from the management and control system should be reviewed to ensure that it is complete, accurate, and up-to-date.\n * a team should be assigned to perform this task.\n * the team should be given a clear set of instructions to follow while they are performing the review.\n * the documentation should be examined for completeness, accuracy, consistency, and suitability for its intended purpose.\n * the auditor will then check to see if you have the required documents and that it complies with the', metadata={'doc_ID': 275, 'language': 'No language found.', 'original_text': '- internal audits are vital for long-term success in earning and keeping your iso 27001 certification.\n- internal audits are your best bet for catching gaps in your documentation and improving it.\n- when you are getting certified for the first time, the internal audit ensures you have everything you need in place to pass your certification on the first try.\n- an internal audit checklist will help you keeping an overview of the necessary steps in that process.\n- documentation review\n- all documentation from the management and control system should be reviewed to ensure that it is complete, accurate, and up-to-date.\n- the documentation should be examined for completeness, accuracy, consistency, and suitability for its intended purpose.\n- the auditor will then check to see if you have the required documents and that it complies with the', 'source': 'https://experta.com/shared-post/a73a0b00-a398-4e8a-afcf-632f9631cb69', 'title': 'Experta', 'relevance_score': 0.97090924})]","There are different types of audits regarding ISO 27001. The first aspect under which audits can be classified is the maturity level of the ISMS being audited. Pre-audits, internal audits, certification audits, surveillance audits, and recertification audits differ in this regard. The second aspect relates to the scope and preparation of the audit. There are audits that are scheduled both in terms of timing and content, audits that are only scheduled in terms of timing and content, and unannounced audits. Each of these types of audits serves its own purpose and is used at different times and in different situations.","There are two main types of audits regarding ISO 27001: internal audits and external audits. Internal audits are conducted by the organization itself or by an independent third party to verify conformance with the requirements of ISO 27001 and to identify any gaps or deficiencies in the Information Security Management System (ISMS). Internal audits are an essential tool for maintaining an effective ISMS and protecting the organization from information security threats. On the other hand, external audits are conducted by a certification body to assess the organization's ISMS against the requirements of ISO 27001. There are two kinds of external audits: surveillance audits, which are conducted annually to review the ISMS as part of ongoing evaluation, and full external audits, which are more in-depth and conducted every three years. Both internal and external audits are crucial for ensuring compliance with ISO 27001 and",True,0.3821138211382114,0.10655737704918034,0.26829268292682923,0.9312719404697418,0.9913057684898376,0.7760635521312337,0.5,0.9292685222218319,1.6354079246520996,3.622649669647217,0.0019996166229248047,5.258057594299316
Fine-tuned_finetuned-ISO-27001_1024_l2_All_1536_264_False_Kers,Hybrid_Rerank_Cohere_Compression,8,gpt-3.5-turbo-16k,16385,0,1,What requirements must be met to qualify as an (internal/external) auditor for an ISMS?,"[Document(page_content=""be able to use video conferences within the scope of audits as well. for this purpose, the term tele-audit was coined. indeed, it is possible to use video conferences, web meetings,\nand remote access, e.g., to documents, also within the context of isms audits. however, there are also normatively specified restrictions, the most\nimportant of which is that tele-audits may not make up more than 30% of the total duration\nprovided for on-site audits. this regulation is already anchored in iso 27006.\nselecting auditors\nwho is eligible as an auditor for an isms?\nfirst, let's consider internal audits. due to the principles of neutrality\nand objectivity, it is clear that security officials should not conduct the audit. likewise,\nemployees from departments involved in implementing information security should not be\nused. this is particularly true for the\nit department or the data center.\nin principle, suitable candidates — with relevant experience in information\nsecurity — could be employees from the audit, quality management, or similar cross-functional\nor staff functions. it can be useful to have an it specialist in the audit team\nas well, who can precisely assess technical security aspects.\nit is always important to select individuals with the appropriate knowledge and skills.\npersonal qualifications also play a role. auditors should be able to conduct audits objectively\nand impartially. as auditors\nhave a monitoring and evaluation task, they should act politely, correctly, and\ndecisively, without appearing"", metadata={'doc_ID': 3277, 'original_text': '- ""who is eligible as an auditor for an isms?""\n- ""first, let\'s consider internal audits.""\n- ""due to the principles of neutrality and objectivity, it is clear that security officials should not conduct the audit.""\n- ""employees from departments involved in implementing information security should not be used.""\n- ""in principle, suitable candidates — with relevant experience in information security — could be employees from the audit, quality management, or similar cross-functional or staff functions.""\n- ""it can be useful to have an it specialist in the audit team as well, who can precisely assess technical security aspects.""\n- ""it is always important to select individuals with the appropriate knowledge and skills.""\n- ""personal qualifications also play a role.""\n- ""auditors should be able to conduct audits objectively and impartially.""\n- ""as auditors have a monitoring and evaluation task, they should act politely, correctly, and decisively, without appearing.""', 'source': 'Kersten et al. - 2020 - IT-Sicherheitsmanagement nach der neuen ISO 27001_removed.pdf', 'title': 'Kersten et al. - 2020 - IT-Sicherheitsmanagement nach der neuen ISO 27001_removed', 'relevance_score': 0.9981898}), Document(page_content=""an external auditor, your company will\nfirst be required to perform an internal audit. an internal audit involves a\nthorough examination of your organization’s isms and is one of the best ways\nto ensure that your organization’s isms is operating effectively and is in\nalignment with the iso 27001 standard. specifically, organizations are\nrequired to self-verify conformance with the requirements from annex a of iso\n27001 deemed applicable in the isms's documented statement of applicability.\nthe internal audit is intended to help identify any gaps or deficiencies that\ncould affect your isms and impact your organization’s ability to meet its\nintended objectives, as well as to successfully complete an initial or annual\niso 27001 certification audit and maintain the certification.\n **the internal audit function is a requirement under the iso 27001 standard**\nand can be challenging to implement in a way that meets each of the\nrequirements set forth in the standard, especially for smaller organizations.\nthis is because of the prescriptive nature outlined in the standard, and the\nneed for allocated resources that are both independent of the development and\nmaintenance of the isms, while still possessing the necessary competencies to\nperform the internal audit function.\n**unlike a certification review where you must use an external third-party to\nconduct the audit, the internal audit can be conducted either by staff within\nyour organization or by an independent third party, such as a consulting\nfirm.** when"", metadata={'description': 'In this guide, we share the recommended approach to successful implementation of an Information Security Management System (ISMS) according to the ISO 27001 standard to help prepare your organization to undergo an independent evaluation of your ISMS in order to obtain your ISO 27001 certification.', 'doc_ID': 60, 'language': 'en', 'original_text': '- ""an internal audit involves a thorough examination of your organization’s isms""\n- ""specifically, organizations are required to self-verify conformance with the requirements from annex a of iso 27001 deemed applicable in the isms\'s documented statement of applicability.""\n- ""the internal audit is intended to help identify any gaps or deficiencies that could affect your isms and impact your organization’s ability to meet its intended objectives""\n- ""the internal audit function is a requirement under the iso 27001 standard""\n- ""unlike a certification review where you must use an external third-party to conduct the audit, the internal audit can be conducted either by staff within your organization or by an independent third party, such as a consulting firm.""', 'source': 'https://www.vanta.com/resources/the-ultimate-iso-27001-guide-powered-by-vanta-and-aprio', 'title': 'The ultimate ISO 27001 guide', 'relevance_score': 0.9976495}), Document(page_content='the identified information security requirements, and are\neffectively implemented and maintained.\nhowever, selecting the internal isms auditors may be difficult for small companies. if not enough resources\nare available to have these kinds of audits performed by experienced internal members of staff, external\nexperts should instead be charged with carrying out auditing activities.\\when organizations use external\nauditors, the following should be considered: external auditors are themselves familiar with the internal isms\naudits; however they may not have enough knowledge about the organizational environment of the\norganization. this information should be supplied by internal staff. on the other hand, internal auditors may be\nable to perform detailed audits considering the organization’s organizational environment, but may not have\nenough knowledge about performing isms audits. organizations should recognize the characteristics and\npotential shortcomings of internal vs. external auditors carrying out the internal isms audits.\nthe effectiveness and efficiency of the implemented controls (see iso/iec 27004:2009) should be examined\nwithin the scope of internal audits.\nit is important that none of the audits are carried out by those individuals who were involved in the planning\nand design of the security objectives, because it is difficult to find one’s own mistakes. therefore, organization\nunits or individuals that are outside the scope of internal isms audits should be selected as the auditors by\nmanagement.', metadata={'doc_ID': 1516, 'original_text': '- ""internal isms auditors may be difficult for small companies""\n- ""external experts should instead be charged with carrying out auditing activities""\n- ""external auditors are themselves familiar with the internal isms audits""\n- ""internal auditors may be able to perform detailed audits considering the organization’s organizational environment""\n- ""organizations should recognize the characteristics and potential shortcomings of internal vs. external auditors carrying out the internal isms audits""\n- ""the effectiveness and efficiency of the implemented controls (see iso/iec 27004:2009) should be examined within the scope of internal audits""\n- ""none of the audits are carried out by those individuals who were involved in the planning and design of the security objectives""\n- ""organization units or individuals that are outside the scope of internal isms audits should be selected as the auditors by management""', 'source': 'ISO 27003 2010 (E).pdf', 'title': 'ISO 27003 2010 (E)', 'relevance_score': 0.99732697}), Document(page_content=""knowledge and skills.\npersonal qualifications also play a role. auditors should be able to conduct audits objectively\nand impartially. as auditors\nhave a monitoring and evaluation task, they should act politely, correctly, and\ndecisively, without appearing arrogant.\nsince the actions of superiors could potentially be subject to scrutiny,\nauditors should not be under the authority of these superiors. management should also ensure that\ninternal auditors can carry out their auditing activities independently within the framework of the\naudit plan.\nif certification is intended or the isms is already certified, the\nexternal auditor in the certification or surveillance audit will ask for objective evidence\nas to how and why the internal auditors were chosen. it is therefore advisable to document the\nprocedure and selection criteria.\nit goes without saying that only qualified auditors should be used for external audits.\nhow can such qualification be recognized? ask for qualifications to be presented, such as\n- training or degrees from recognized institutions,\n- accreditations from relevant institutions or certification bodies, or\n- completed reference projects.\neven with auditors listed by accreditation bodies of relevant institutions or\ncertification bodies, it may be of interest to inquire whether audits have already been conducted\nin the organization's specific industry. each auditor should also be able to provide a procedural description (or similar material) in which they describe their approach.\nas"", metadata={'doc_ID': 3278, 'original_text': ""- personal qualifications also play a role.\n- auditors should be able to conduct audits objectively and impartially.\n- auditors have a monitoring and evaluation task.\n- auditors should act politely, correctly, and decisively, without appearing arrogant.\n- auditors should not be under the authority of superiors.\n- management should ensure that internal auditors can carry out their auditing activities independently.\n- external auditor in the certification or surveillance audit will ask for objective evidence as to how and why the internal auditors were chosen.\n- it is advisable to document the procedure and selection criteria.\n- only qualified auditors should be used for external audits.\n- ask for qualifications to be presented.\n- training or degrees from recognized institutions.\n- accreditations from relevant institutions or certification bodies.\n- completed reference projects.\n- it may be of interest to inquire whether audits have already been conducted in the organization's specific industry.\n- each auditor should be able to provide a procedural description (or similar material) in which they describe their approach."", 'source': 'Kersten et al. - 2020 - IT-Sicherheitsmanagement nach der neuen ISO 27001_removed.pdf', 'title': 'Kersten et al. - 2020 - IT-Sicherheitsmanagement nach der neuen ISO 27001_removed', 'relevance_score': 0.99703056}), Document(page_content='organization should have its implementation of its\ninformation security policy independently reviewed. iss027002 makes it\nclear that this can include bringing in outside auditors to review the isms or\nbringing in independent third-party certification auditors to certify it; the\naccredited certification audit meets this control requirement of the standard.\nit does, however, recognize (as does any quality management system) that\nan organization ought to have its implementation of any key system or\nprocess reviewed by someone other than the person responsible for imple-\nmenting it. this is a standard principle of an iso9001-certificated\nmanagement system, and any company that has such a management system\nin place can simply graft an extra responsibility on to those who have the\nexisting ones.\nan internal audit function that only has experience in financial audit will\nnot, however, be adequately trained to carry out a quality management\nsystem audit. equally, an audit function that already deals with internal\naudit of another management system will not be automatically capable of\ncompetently conducting an iso27001 audit.\nthere is an ibitgq internal audit qualification, and most third-party\ncertification bodies are likely to provide training courses for internal audit\nteams. quality system auditing is a necessary basis for isms auditing, but\nis not sufficient. at the very least, the internal auditor should attend a\nfoundations of information security management course described earlier\nin this chapter — a', metadata={'doc_ID': 2007, 'original_text': '- ""iss027002 makes it clear that this can include bringing in outside auditors to review the isms or bringing in independent third-party certification auditors to certify it""\n- ""an organization ought to have its implementation of any key system or process reviewed by someone other than the person responsible for implementing it""\n- ""an internal audit function that only has experience in financial audit will not, however, be adequately trained to carry out a quality management system audit""\n- ""an audit function that already deals with internal audit of another management system will not be automatically capable of competently conducting an iso27001 audit""\n- ""there is an ibitgq internal audit qualification, and most third-party certification bodies are likely to provide training courses for internal audit teams""\n- ""quality system auditing is a necessary basis for isms auditing, but is not sufficient""\n- ""the internal auditor should attend a foundations of information security management course described earlier in this chapter""', 'source': 'Watkins, Calder - 2020 - IT Governance - An International Guide to Data Security and ISO 27001 ISO 27002.pdf', 'title': 'IT Governance - An International Guide to Data Security and ISO 27001 ISO 27002', 'relevance_score': 0.9966234}), Document(page_content='an identity\nbadge prepared and reserve a parking space. book a room for the auditor’s use (more if\nthere is a team) and ensure that refreshments will be available, including lunch if possible.\nyou will be needing to show documents and discuss them, so some form of large screen or\nprojector will be useful.\nfor a remote audit, ensure that the online meeting tool you are going to use is agreed and\nthat everyone involved knows how to use it, including how to share the screen to show the\nauditor some documented information. check that microphones and cameras work and that\nthe area behind each participant (in view of the camera) is appropriate. if technology such\nas a mobile phone is going to be used to perform a virtual walkaround of the offices, then\ntest that first too.\nonce the basic arrangements are in place you need to ensure that whoever is going to act as\nthe auditor’s guide around the isms is ready. this means knowing where all the relevant\ndocuments are and how each of the requirements is met within the documents. supporting\ninformation such as hr and training records should also be available if required. anyone\nwho might be able to help the auditor such as managers and support staff should be on\nstandby and everyone who is planned to talk to the auditor should be prepared.\nthere is no substitute for practice so conduct a mock audit beforehand if you can and\nidentify any improvements needed before the day. having obvious signs of information\nsecurity-related activity on display at your location does no', metadata={'source': 'CERTIKIT_ISO27001_Implementation_Guide_v12.pdf.pdf', 'title': 'CERTIKIT_ISO27001_Implementation_Guide_v12.pdf', 'original_text': 'an identity\nbadge prepared and reserve a parking space. Book a room for the auditor’s use (more if\nthere is a team) and ensure that refreshments will be available, including lunch if possible.\nYou will be needing to show documents and discuss them, so some form of large screen or\nprojector will be useful.\nFor a remote audit, ensure that the online meeting tool you are going to use is agreed and\nthat everyone involved knows how to use it, including how to share the screen to show the\nauditor some documented information. Check that microphones and cameras work and that\nthe area behind each participant (in view of the camera) is appropriate. If technology such\nas a mobile phone is going to be used to perform a virtual walkaround of the offices, then\ntest that first too.\nOnce the basic arrangements are in place you need to ensure that whoever is going to act as\nthe auditor’s guide around the ISMS is ready. This means knowing where all the relevant\ndocuments are and how each of the requirements is met within the documents. Supporting\ninformation such as HR and training records should also be available if required. Anyone\nwho might be able to help the auditor such as managers and support staff should be on\nstandby and everyone who is planned to talk to the auditor should be prepared.\nThere is no substitute for practice so conduct a mock audit beforehand if you can and\nidentify any improvements needed before the day. Having obvious signs of information\nsecurity-related activity on display at your location does no', 'doc_ID': 962, 'relevance_score': 0.99630713}), Document(page_content=""to stakeholders that the isms is operating effectively and that the organisation is taking steps to protect its sensitive information.\n## does iso 27001 require an internal audit?\nyes, iso 27001 requires organisations to conduct regular internal audits of\ntheir information security management system. this is stated in clause 9.2 of\nthe standard, which states that:\nthe organisation shall conduct internal audits at planned intervals to provide\ninformation on whether the isms:\n 1. conforms to the organisation's own requirements for its information security management system; and 2. meets the requirements of this international standard.\nthe standard does not specify how often internal audits should be conducted,\nbut it is recommended that they be conducted at least annually.\ninternal audits are an important part of maintaining an effective isms. they\nhelp organisations to identify and address any weaknesses in their isms before\nthey are exploited by attackers.\n## what are iso 27001 internal audit requirements?\niso 27001 audit requirements:\n * the audit must be conducted by an independent auditor who is qualified to audit iso 27001. * the audit must be planned and conducted in accordance with a documented audit methodology. * the audit must cover all aspects of the isms, including risk assessment, information security controls, isms documentation, awareness and training, and management review. * the audit findings must be documented in a report that is submitted to the"", metadata={'description': 'Ensure your ISMS is operating effectively for ISO 27001 compliance. Learn all you need to know about ISO 27001 Clause 9.2 internal audits in our guide.\n', 'doc_ID': 421, 'language': 'en-gb', 'original_text': '- Yes, iso 27001 requires organisations to conduct regular internal audits of their information security management system.\n- The standard does not specify how often internal audits should be conducted, but it is recommended that they be conducted at least annually.\n- Internal audits are an important part of maintaining an effective isms.\n- The audit must be conducted by an independent auditor who is qualified to audit iso 27001.\n- The audit must be planned and conducted in accordance with a documented audit methodology.\n- The audit must cover all aspects of the isms, including risk assessment, information security controls, isms documentation, awareness and training, and management review.\n- The audit findings must be documented in a report that is submitted to the stakeholders.', 'source': 'https://www.dataguard.co.uk/knowledge/iso-27001/clause-9-2-internal-audit/', 'title': 'ISO 27001 Clause 9.2: Internal Audit', 'relevance_score': 0.99549675}), Document(page_content='4 to 10 set out the requirements of the standard. requirements are often referred\nto as the “shalls” of the standard because that is the word usually used by iso to show that\nwhat is being stated is compulsory if an organization is to be compliant. the (internal and\nexternal) auditing process is basically an exercise to check whether all the requirements are\nbeing met by the organization. requirements are not optional and, if they are not being\nmet, then a “nonconformity” will be raised by the auditor and the organization will need to\n page 12 of 79\niso/iec 27001 implementation guide\naddress it to gain or keep their certification to the standard (see the section on auditing\nlater in this guide).\nin order to show that the requirements are being met the auditor will need to see some\nevidence. this can take many forms and until recently was defined as a combination of\n“documents” (evidence of intention such as policies, processes and procedures) and\n“records” (evidence that something has been done). in the new version of the standard the\nterm “documented information” is generally used instead to cover anything that is recorded\n(the official iso definition is “information required to be controlled and maintained by an\norganization and the medium on which it is contained”). but the point is you need to have\nsomething to show the auditor.\nthis is often a major culture change in many organizations. just doing something is no\nlonger enough; you must be able to prove that you did something. this means', metadata={'source': 'CERTIKIT_ISO27001_Implementation_Guide_v12.pdf.pdf', 'title': 'CERTIKIT_ISO27001_Implementation_Guide_v12.pdf', 'original_text': '- 4 to 10 set out the requirements of the standard.\n- the (internal and external) auditing process is basically an exercise to check whether all the requirements are being met by the organization.\n- requirements are not optional and, if they are not being met, then a “nonconformity” will be raised by the auditor and the organization will need to page 12 of 79 iso/iec 27001 implementation guide address it to gain or keep their certification to the standard (see the section on auditing later in this guide).\n- in order to show that the requirements are being met the auditor will need to see some evidence.\n- this can take many forms and until recently was defined as a combination of “documents” (evidence of intention such as policies, processes and procedures) and “records” (evidence that something has been done).\n- in the new version of the standard the term “documented information” is generally used instead to cover anything that is recorded (the official iso definition is “information required to be controlled and maintained by an organization and the medium on which it is contained”).\n- but the point is you need to have something to show the auditor.\n- this is often a major culture change in many organizations.\n- just', 'doc_ID': 848, 'relevance_score': 0.99505633})]","To qualify as an auditor for an ISMS, several requirements must be met. First, employees from departments involved in the implementation of information security should not be assigned as auditors. Suitable candidates, however, would be employees from the auditing, quality management, or similar cross-functional or staff functions, provided they have experience in the field of information security. It may also be useful to have an IT specialist on the audit team who can assess technical security aspects. Personal requirements are also important, as auditors should be objective, impartial, polite, and correct in their conduct. Furthermore, auditors should not be subordinate to the superiors to ensure independent verification. If certification is sought, it is advisable to document the selection of internal auditors and provide qualification evidence such as training, degrees, or reference projects. External auditors should be qualified and have proof of qualification. It is important that the external audit is conducted separately from any form of consulting to ensure neutrality and objectivity.","To qualify as an internal or external auditor for an Information Security Management System (ISMS), individuals should have relevant experience in information security. They should not be security officials or employees from departments involved in implementing information security. Suitable candidates could be from audit, quality management, or similar cross-functional roles. Additionally, having an IT specialist in the audit team to assess technical security aspects is beneficial. Auditors must possess appropriate knowledge, skills, and personal qualifications to conduct audits objectively, impartially, and professionally. For internal audits, auditors should be independent of the areas they are auditing, and for external audits, they should be qualified, with relevant training, certifications, and experience. The selection process should be documented, and auditors should be able to provide evidence of their qualifications and past audit projects.",True,0.6394557823129252,0.26712328767123283,0.38775510204081637,0.5899198651313782,0.9995555281639099,0.9147221337181277,0.8888888888888888,0.8933097059458799,1.6929974555969238,2.5722126960754395,0.0029616355895996094,4.265210151672363
Fine-tuned_finetuned-ISO-27001_1024_l2_All_1536_264_False_Kers,Hybrid_Rerank_Cohere_Compression,8,gpt-3.5-turbo-16k,16385,0,1,What preparations can be made before an initial audit for the ISO 27001 certification to ensure that the existing documentation meets the requirements of the standard?,"[Document(page_content='regularly check it. it is strongly recommended to send this information in an email to everyone - we assume an office environment where the email medium is available to everyone. in a production environment, an alternative appropriate communication medium may need to be chosen.\nbefore each step of the schedule, there will be a reminder email, for example, before the trial run or before the internal event. the announcement of the date also serves to inform all those employees who have taken on a deputy function in the isms for a task.\npreparing for an audit\ncreating and updating documents\nespecially during the initial audit, there is often uncertainty whether the existing documentation meets the requirements of the standard or the auditors.\n> tip: to prepare for an initial audit, it can be useful to seek advice and support, i.e., involve external consultants who have experience with the relevant standard. this is where you can ask questions about understanding the requirements of the standard, write critical documents, or (better yet) get support, have existing documents subjected to a pre-check, and receive an assessment of how far you are from compliance. taking advantage of such services helps to avoid unnecessary effort and resolve uncertainties.\nin terms of documentation, it is important to check:\n* what documents and evidence are needed and whether they are available (if necessary, provide any missing documents at short notice),\n* whether they are up-to-date in content,\n* whether they are formally', metadata={'doc_ID': 3289, 'original_text': '- preparing for an audit\n- creating and updating documents\n- especially during the initial audit, there is often uncertainty whether the existing documentation meets the requirements of the standard or the auditors.\n- tip: to prepare for an initial audit, it can be useful to seek advice and support, i.e., involve external consultants who have experience with the relevant standard. this is where you can ask questions about understanding the requirements of the standard, write critical documents, or (better yet) get support, have existing documents subjected to a pre-check, and receive an assessment of how far you are from compliance. taking advantage of such services helps to avoid unnecessary effort and resolve uncertainties.\n- in terms of documentation, it is important to check:\n* what documents and evidence are needed and whether they are available (if necessary, provide any missing documents at short notice),\n* whether they are up-to-date in content,\n* whether they are formally', 'source': 'Kersten et al. - 2020 - IT-Sicherheitsmanagement nach der neuen ISO 27001_removed.pdf', 'title': 'Kersten et al. - 2020 - IT-Sicherheitsmanagement nach der neuen ISO 27001_removed', 'relevance_score': 0.9982658}), Document(page_content='auditor should be prepared.\nthere is no substitute for practice so conduct a mock audit beforehand if you can and\nidentify any improvements needed before the day. having obvious signs of information\nsecurity-related activity on display at your location does no harm; this could be performance\ncharts or posters for raising awareness on the walls.\nit’s all about showing the auditor that you are a professional organization that is in control;\nyou may be surprised how little the auditor feels they need to look at if the overall\nimpression they are getting is very positive.\n5.4 during the audit\nthe auditor should have provided an audit plan which will set out the structure of the audit,\nincluding areas to be reviewed, people to be met and timings (this often doesn’t happen so\n page 76 of 79\niso/iec 27001 implementation guide\ndon’t worry if you don’t get one). despite the appearance of power, auditing is quite strictly\nregulated so the auditor will have specific things they need to do, in a specific format,\nstarting with an opening meeting and ending with a closing meeting. do what you can to\nmake it easy for them by providing access to the relevant documents and resources as\nquickly and smoothly as possible.\nbasically, all the auditor is doing is the same exercise as you did yourself when you\nperformed (and repeated) the gap assessment. it’s purely a matter of going through the\nrequirements of the iso/iec 27001 standard and asking to be shown how you meet them.\nthe auditor will need to record the evidence', metadata={'doc_ID': 963, 'original_text': '- ""conduct a mock audit beforehand if you can and identify any improvements needed before the day""\n- ""having obvious signs of information security-related activity on display at your location does no harm""\n- ""showing the auditor that you are a professional organization that is in control""\n- ""the auditor should have provided an audit plan which will set out the structure of the audit""\n- ""the auditor will have specific things they need to do, in a specific format""\n- ""starting with an opening meeting and ending with a closing meeting""\n- ""do what you can to make it easy for them by providing access to the relevant documents and resources as quickly and smoothly as possible""\n- ""all the auditor is doing is the same exercise as you did yourself when you performed (and repeated) the gap assessment""\n- ""going through the requirements of the iso/iec 27001 standard and asking to be shown how you meet them""\n- ""the auditor will need to record the evidence""', 'source': 'CERTIKIT_ISO27001_Implementation_Guide_v12.pdf.pdf', 'title': 'CERTIKIT ISO27001 Implementation Guide_v12', 'relevance_score': 0.9939964}), Document(page_content='defines the boundaries\nof your organization’s isms, what elements of your\nisms are reviewed for certification, and which\ncontrols are relevant to the scope of your project.\nled\ncc\ncc]\nplanning\nthis section helps organizations to create objectives\nbased on risks and opportunities. organizations use\nthis information to establish a plan to maintain a\nrisk-based approach to isms management and\ndetermine how they will monitor and measure\ntheir objectives.\nperformance evaluation\nthis section guides organizations to define\nprocedures for measuring, monitoring, and main-\ntaining isms records. it also includes information\non establishing an internal audit schedule and\nmanagement reviews to address remediation\nactions for issues discovered during audits.\nimprovement\nhelps organizations create a process for recording\nand managing recommendations for improvement\nand non-conformities discovered during audits.\nthe initial certification process for iso 27001 certificate eligibility comprises two stages: a documentation\nreview audit and an evidential audit. the clauses detailed in part 1 of the iso 27001 structure help organizations\nprepare written documentation, processes, procedures, and guidelines that explain your isms implementation\nand the business processes that support it.\nthese documents are then reviewed by an approved, objective auditor during the stage 1 documentation\nreview. during this first stage, the auditor ensures that a company’s documentation aligns with iso 27001\nstandards and may recommend them', metadata={'doc_ID': 1340, 'original_text': '- defines the boundaries of your organization’s isms, what elements of your isms are reviewed for certification, and which controls are relevant to the scope of your project.\n- this section helps organizations to create objectives based on risks and opportunities.\n- organizations use this information to establish a plan to maintain a risk-based approach to isms management and determine how they will monitor and measure their objectives.\n- performance evaluation\n- this section guides organizations to define procedures for measuring, monitoring, and maintaining isms records.\n- it also includes information on establishing an internal audit schedule and management reviews to address remediation actions for issues discovered during audits.\n- improvement\n- helps organizations create a process for recording and managing recommendations for improvement and non-conformities discovered during audits.\n- the initial certification process for iso 27001 certificate eligibility comprises two stages: a documentation review audit and an evidential audit.\n- the clauses detailed in part 1 of the iso 27001 structure help organizations prepare written documentation, processes, procedures, and guidelines that explain your isms implementation and the business processes that support it.\n- these documents are then reviewed by an approved, objective auditor during the stage 1 documentation review.\n- during this first stage, the auditor ensures that a company’s documentation aligns with', 'source': 'complete-guide-iso-27001-compliance.pdf', 'title': 'complete guide iso 27001 compliance', 'relevance_score': 0.9918121}), Document(page_content='of these issues.\nsteve also warns against these things when preparing for iso 27001:\nimproperly defining the isms scope\ninadequate employee security training\nimproperly performed risk assessments\nmetrics and implementation plans for info sec don’t align with company objectives\nimproper record keeping—iso is really big on having evidence\ninadequate access controls and access management—especially in devops how do i know my organization is ready for an iso 27001 audit?\nif you’re in a mature organization with several infosec controls, it could merely be putting those policies into place. for those starting from scratch, it could be a heavier lift. once you have everything in place (internal audit, pre-certification readiness assessment), steve recommends conducting a management review to make sure upper management is aware of the entire isms. these reviews go over every single part of the isms—including policies, metrics, operations, and any deficiencies in the internal audit.\nbefore undergoing an audit, steve suggests you have:\nall the basic documentation in place, including running the system for a period of three to six months.\na trained team that promotes a cyber aware culture.\nrisk assessment and risk treatment plans in place.\na connection with your certification body—they can offer specific advice as to what you need to do to get ready and what you should be on the lookout for.\nat least 75% passing tests and controls in your compliance automation system.\n“you’ll know if you’re ready. do', metadata={'description': 'Achieving ISO 27001 can come with a lot of questions. Lead Auditor at ARORA Solutions, Steve Cullen, breaks down how to set your organization up for a successful ISO 27001 audit.', 'doc_ID': 91, 'language': 'en', 'original_text': '- steve also warns against these things when preparing for iso 27001:\nimproperly defining the isms scope\ninadequate employee security training\nimproperly performed risk assessments\nmetrics and implementation plans for info sec don’t align with company objectives\nimproper record keeping—iso is really big on having evidence\ninadequate access controls and access management—especially in devops\n- before undergoing an audit, steve suggests you have:\nall the basic documentation in place, including running the system for a period of three to six months.\na trained team that promotes a cyber aware culture.\nrisk assessment and risk treatment plans in place.\na connection with your certification body—they can offer specific advice as to what you need to do to get ready and what you should be on the lookout for.\nat least 75% passing tests and controls in your compliance automation system.', 'source': 'https://www.drata.com/blog/ask-an-auditor-demystifying-iso-27001', 'title': 'Ask an Auditor: Demystifying the ISO 27001 Certification Process With Steve Cullen From ARORA Solutions', 'relevance_score': 0.9891816}), Document(page_content=""plan will vary from company to company, depending on how\ncomplex it is and its various roles and responsibilities.\nstep 4: complete the documentation\nduring this step, you need to define and implement the policies, procedures, and other\nrecord documents, such as review logs, network logs, and training records that are\nmandatory, as per the iso 27001 standard guideline.\nstep 5: schedule your stage 1 audit\nat this point, you should have all the documents ready and the preparation complete.\nit’s time to schedule the stage 1 audits with the external agency or auditor. you can get\nguidance from the auditor and clarify any doubts. this is your best chance to improve.\n250\nchapter 9 external audit\nstep 6: prepare your team\nnow it’s time to prepare your team for the audit. discuss with the team and send an\nemail if required about what they should expect to be asked and how to reply. the best\nway to reply to an auditor is to give real-life examples when you're asked for evidence.\nstep 7: close the gaps\nduring this step, you need to close all the gaps or issues shared by the auditor during the\nstage 1 audit. by this time, the team will have confidence and will understand the audit\ncycle, as they already went through a stage 1 audit. once the gaps are closed, they need\nto be sent back to the auditor for review. you need to obtain the auditor’s approval that\nthe issues have been resolved.\nstep 8: schedule stage 2 audit\nthis is the final step before receiving the iso 27001 certificate. schedule your stage"", metadata={'doc_ID': 1312, 'original_text': '- step 4: complete the documentation\n- during this step, you need to define and implement the policies, procedures, and other record documents, such as review logs, network logs, and training records that are mandatory, as per the iso 27001 standard guideline.\n- step 5: schedule your stage 1 audit\n- at this point, you should have all the documents ready and the preparation complete.\n- it’s time to schedule the stage 1 audits with the external agency or auditor.\n- step 6: prepare your team\n- now it’s time to prepare your team for the audit.\n- step 7: close the gaps\n- during this step, you need to close all the gaps or issues shared by the auditor during the stage 1 audit.\n- step 8: schedule stage 2 audit', 'source': 'Chopra, Chaudhary - 2020 - Implementing an Information Security Management System - Security Management Based On ISO 27001.pdf', 'title': 'Implementing an Information Security Management System - Security Management Based On ISO 27001', 'relevance_score': 0.9870795}), Document(page_content=""comes to the iso 27001 certification are:\ndocumentation, undergoing audits and ensuring your employees adopt the\nprocesses.\n**documentation** includes the creation and maintenance of necessary\ndocumentation for your information security management system (isms), such as\npolicies, procedures, risk assessments, and controls.\n**undergoing audits** includes both the stage 1 audit, which reviews\ndocumentation and readiness, and the stage 2 audit, which assesses the\npractical implementation of your isms. successful completion of these audits\nis necessary to achieve iso 27001 certification. you will also be required to\nundergo internal audits and management reviews.\nit's also crucial to **communicate the processes effectively** this is to\nensure that your organization's information security practices align with the\niso 27001 standards. you will need to have the documentation in place but also\nput the processes into action by ensuring employees are aware of and follow\nthem.\nthe mandatory documents required for the iso 27001 standard are listed below.\nall criteria must be followed and documented accordingly for an organisation\nto present during external audits. the standard requires you to undergo an\ninternal audit before an external one. this will expose any gaps in your isms.\nonce you have prepared the documentation and undergone an internal audit as\nwell as a management review, you need to undergo an external audit by a\ncertified body such as the ukas.\nthe mandatory documents required for iso 27001 are:\n *"", metadata={'source': 'https://experta.com/shared-post/a73a0b00-a398-4e8a-afcf-632f9631cb69', 'title': 'Experta', 'language': 'No language found.', 'original_text': '- Documentation\n- Undergoing audits\n- Communicate the processes effectively', 'doc_ID': 283, 'relevance_score': 0.98415464}), Document(page_content='4 to 10 set out the requirements of the standard. requirements are often referred\nto as the “shalls” of the standard because that is the word usually used by iso to show that\nwhat is being stated is compulsory if an organization is to be compliant. the (internal and\nexternal) auditing process is basically an exercise to check whether all the requirements are\nbeing met by the organization. requirements are not optional and, if they are not being\nmet, then a “nonconformity” will be raised by the auditor and the organization will need to\n page 12 of 79\niso/iec 27001 implementation guide\naddress it to gain or keep their certification to the standard (see the section on auditing\nlater in this guide).\nin order to show that the requirements are being met the auditor will need to see some\nevidence. this can take many forms and until recently was defined as a combination of\n“documents” (evidence of intention such as policies, processes and procedures) and\n“records” (evidence that something has been done). in the new version of the standard the\nterm “documented information” is generally used instead to cover anything that is recorded\n(the official iso definition is “information required to be controlled and maintained by an\norganization and the medium on which it is contained”). but the point is you need to have\nsomething to show the auditor.\nthis is often a major culture change in many organizations. just doing something is no\nlonger enough; you must be able to prove that you did something. this means', metadata={'doc_ID': 848, 'original_text': '- 4 to 10 set out the requirements of the standard.\n- Requirements are often referred to as the “shalls” of the standard because that is the word usually used by iso to show that what is being stated is compulsory if an organization is to be compliant.\n- The (internal and external) auditing process is basically an exercise to check whether all the requirements are being met by the organization.\n- Requirements are not optional and, if they are not being met, then a “nonconformity” will be raised by the auditor and the organization will need to address it to gain or keep their certification to the standard (see the section on auditing later in this guide).\n- In order to show that the requirements are being met the auditor will need to see some evidence.\n- This can take many forms and until recently was defined as a combination of “documents” (evidence of intention such as policies, processes and procedures) and “records” (evidence that something has been done).\n- In the new version of the standard the term “documented information” is generally used instead to cover anything that is recorded (the official iso definition is “information required to be controlled and maintained by an organization and the medium on which it is contained”).\n- But', 'source': 'CERTIKIT_ISO27001_Implementation_Guide_v12.pdf.pdf', 'title': 'CERTIKIT ISO27001 Implementation Guide_v12', 'relevance_score': 0.9806549}), Document(page_content='advice to those that\nare likely to be interviewed by an auditor. 5027007 and iso27008 set out\nguidelines for the is027001 auditor on how to conduct an audit. they are\nvaluable both to the organization’s internal audit teams as part of their\ntraining and to the management information security forum so that they\nunderstand the approach that the auditors will take and can ensure that the\norganization is adequately prepared for the audit. the latter provides\ndetailed guidance on auditing annex a controls.\nthe outcome of the initial audit should, if the organization has diligently\nfollowed all the recommendations contained in this manual, be a positive\nrecommendation for certification of the isms to is027001 and the issue of\na certificate setting this out. the certificate should be appropriately displayed\nand the organization should start preparing for its first surveillance visit,\nwhich will take place about six to twelve months later. any minor noncon-\nformities should be capable of being closed out by mail, and any certificate\nissued will be dependent on this happening within an agreed timescale.\nthe certificate will refer to the latest version of the soa and auditors will\ncheck for updates at their subsequent visits. therefore, when supplying a\ncopy of the certificate to clients, stakeholders or other parties, the organiza-\ntion should be prepared to provide a copy of the most recent soa (whether\ncontrolled or otherwise). while the soa is a living document, updated as\nand when necessary, the organization', metadata={'doc_ID': 2531, 'original_text': '- guidelines for the is027001 auditor on how to conduct an audit\n- valuable both to the organization’s internal audit teams as part of their training and to the management information security forum\n- understand the approach that the auditors will take\n- detailed guidance on auditing annex a controls\n- outcome of the initial audit should be a positive recommendation for certification of the isms to is027001 and the issue of a certificate\n- certificate should be appropriately displayed\n- start preparing for its first surveillance visit\n- minor nonconformities should be capable of being closed out by mail\n- certificate will refer to the latest version of the soa\n- auditors will check for updates at their subsequent visits\n- when supplying a copy of the certificate to clients, stakeholders or other parties, the organization should be prepared to provide a copy of the most recent soa', 'source': 'Watkins, Calder - 2020 - IT Governance - An International Guide to Data Security and ISO 27001 ISO 27002.pdf', 'title': 'IT Governance - An International Guide to Data Security and ISO 27001 ISO 27002', 'relevance_score': 0.9805806})]","To ensure that the existing documentation meets the requirements of the standard, various preparations can be made before an initial audit. One option is to engage external consultants with experience in dealing with the relevant standard. They can assist in writing critical documents or examining existing records to assess conformity. Additionally, contractual agreements with the certification body should be checked to determine which documents and evidence are required and whether they are available, up-to-date, and formally correct. Furthermore, it is important to ensure that the documentation is consistent and coherent and meets the requirements of the standard. Additionally, any agreed-upon corrective and preventive actions from previous audits should be implemented and documented in writing.","Before an initial audit for ISO 27001 certification, it is crucial to ensure that existing documentation meets the standard's requirements. To prepare effectively, consider the following steps:

1. Seek advice and support from external consultants with experience in the ISO 27001 standard to clarify requirements and assess existing documentation.
2. Conduct a mock audit to identify areas for improvement.
3. Display visible signs of information security-related activities at your location.
4. Ensure all necessary documents and evidence are available, up-to-date, and formally documented.
5. Conduct regular internal audits to identify and address any non-conformities.
6. Establish procedures for measuring, monitoring, and maintaining ISMS records.
7. Have a trained team that promotes a cyber-aware culture.
8. Maintain proper record-keeping and evidence of compliance.
9. Close any gaps or issues identified during",True,0.4645669291338582,0.19047619047619047,0.2677165354330709,0.9206134751439095,0.9999450445175171,0.8085973469157841,0.8571428571428571,0.871379985855429,1.6340022087097168,3.2599997520446777,0.0019600391387939453,4.8940019607543945
Fine-tuned_finetuned-ISO-27001_1024_l2_All_1536_264_False_Kers,Hybrid_Rerank_Cohere_Compression,8,gpt-3.5-turbo-16k,16385,0,1,What would be useful to do just before an external audit for the ISO 27001 certification to become more confident?,"[Document(page_content=""comes to the iso 27001 certification are:\ndocumentation, undergoing audits and ensuring your employees adopt the\nprocesses.\n**documentation** includes the creation and maintenance of necessary\ndocumentation for your information security management system (isms), such as\npolicies, procedures, risk assessments, and controls.\n**undergoing audits** includes both the stage 1 audit, which reviews\ndocumentation and readiness, and the stage 2 audit, which assesses the\npractical implementation of your isms. successful completion of these audits\nis necessary to achieve iso 27001 certification. you will also be required to\nundergo internal audits and management reviews.\nit's also crucial to **communicate the processes effectively** this is to\nensure that your organization's information security practices align with the\niso 27001 standards. you will need to have the documentation in place but also\nput the processes into action by ensuring employees are aware of and follow\nthem.\nthe mandatory documents required for the iso 27001 standard are listed below.\nall criteria must be followed and documented accordingly for an organisation\nto present during external audits. the standard requires you to undergo an\ninternal audit before an external one. this will expose any gaps in your isms.\nonce you have prepared the documentation and undergone an internal audit as\nwell as a management review, you need to undergo an external audit by a\ncertified body such as the ukas.\nthe mandatory documents required for iso 27001 are:\n *"", metadata={'source': 'https://experta.com/shared-post/a73a0b00-a398-4e8a-afcf-632f9631cb69', 'title': 'Experta', 'language': 'No language found.', 'original_text': '- undergoing audits\n- documentation\n- communicate the processes effectively\n- internal audits\n- management review\n- external audit', 'doc_ID': 283, 'relevance_score': 0.9915544}), Document(page_content='auditor should be prepared.\nthere is no substitute for practice so conduct a mock audit beforehand if you can and\nidentify any improvements needed before the day. having obvious signs of information\nsecurity-related activity on display at your location does no harm; this could be performance\ncharts or posters for raising awareness on the walls.\nit’s all about showing the auditor that you are a professional organization that is in control;\nyou may be surprised how little the auditor feels they need to look at if the overall\nimpression they are getting is very positive.\n5.4 during the audit\nthe auditor should have provided an audit plan which will set out the structure of the audit,\nincluding areas to be reviewed, people to be met and timings (this often doesn’t happen so\n page 76 of 79\niso/iec 27001 implementation guide\ndon’t worry if you don’t get one). despite the appearance of power, auditing is quite strictly\nregulated so the auditor will have specific things they need to do, in a specific format,\nstarting with an opening meeting and ending with a closing meeting. do what you can to\nmake it easy for them by providing access to the relevant documents and resources as\nquickly and smoothly as possible.\nbasically, all the auditor is doing is the same exercise as you did yourself when you\nperformed (and repeated) the gap assessment. it’s purely a matter of going through the\nrequirements of the iso/iec 27001 standard and asking to be shown how you meet them.\nthe auditor will need to record the evidence', metadata={'doc_ID': 963, 'original_text': '- conduct a mock audit beforehand if you can and identify any improvements needed before the day.\n- having obvious signs of information security-related activity on display at your location does no harm; this could be performance charts or posters for raising awareness on the walls.\n- it’s all about showing the auditor that you are a professional organization that is in control;\n- the auditor should have provided an audit plan which will set out the structure of the audit, including areas to be reviewed, people to be met and timings (this often doesn’t happen so don’t worry if you don’t get one).\n- the auditor will have specific things they need to do, in a specific format, starting with an opening meeting and ending with a closing meeting.\n- do what you can to make it easy for them by providing access to the relevant documents and resources as quickly and smoothly as possible.\n- basically, all the auditor is doing is the same exercise as you did yourself when you performed (and repeated) the gap assessment.\n- it’s purely a matter of going through the requirements of the iso/iec 27001 standard and asking to be shown how you meet them.\n- the auditor will need to record the evidence', 'source': 'CERTIKIT_ISO27001_Implementation_Guide_v12.pdf.pdf', 'title': 'CERTIKIT ISO27001 Implementation Guide_v12', 'relevance_score': 0.9861514}), Document(page_content='is\nthat you select some basic measurements that are easy to collect and interpret and use\nthose for a while. after some time has passed it will probably become obvious that other\nspecific measurements are needed to be able to assess whether things are going well so\nthese can be added gradually. be careful not to start with a wide range of possibly\nmeaningless, hard to collect measurements that will simply slow everything down and give\nthe isms a bad reputation before it has got going.\nhaving chosen your measurements you need to decide what does “good” look like; what\nnumerical values would mean that performance is in line with expectations? again, the\ndefinition of your objectives may need tweaking over time as you gain experience with\ntaking the measurements and your isms moves from implementation mode into ongoing\noperation mode.\nif you find that your objectives are not being met, then an improvement may be required to\nbring the situation back into line; such improvements should be added to the\nnonconformity and corrective action log provided within the toolkit and tracked through to\ncompletion.\n3.10.2 clause 9.2 internal audit\nthe standard requires that there is an internal auditing programme in place which audits all\naspects of the isms within a reasonable period. if you embrace the idea of internal auditing\nas a useful early warning of any issues at external audit, then you won’t go far wrong.\ninternal audits should ensure that there are no surprises during the annual\n page 33 of 79\niso/iec 27001', metadata={'source': 'CERTIKIT_ISO27001_Implementation_Guide_v12.pdf.pdf', 'title': 'CERTIKIT_ISO27001_Implementation_Guide_v12.pdf', 'original_text': '- ""just before an external audit for the ISO 27001 certification""\n- ""to become more confident""\n- ""internal auditing as a useful early warning of any issues at external audit""', 'doc_ID': 889, 'relevance_score': 0.9859904}), Document(page_content='tool and the certification readiness checklist within the toolkit as a guide to\nyour readiness, but don’t expect to be 100% compliant before going for stage one. a more\nappropriate figure is probably 90% or so but it does depend on which areas are not yet\ncomplete.\nbefore arranging the stage one you should have completed the following:\ne information security policy\ne risk assessment and treatment plan\ne implemented most (but not necessarily all) of your information security controls\ne conducted user awareness training\ne internal audits of all areas of the standard\n page 75 of 79\niso/iec 27001 implementation guide\ne atleast one management review (ideally more)\nnot having any of the above available would probably mean that the stage one visit is\ninconclusive in terms of judging your readiness for the stage two i.e. the auditor would tell\nyou just weren’t ready yet.\n5.3 preparing for audit day\nonce you feel you’re ready to be visited by the auditor for either the stage one or stage\ntwo, there are sensible preparations to take to make the best impression from the start.\nfirstly, make sure that the visit is confirmed, provide directions and check the time of arrival\nof the auditor(s). if appropriate, inform reception that they will be coming, get an identity\nbadge prepared and reserve a parking space. book a room for the auditor’s use (more if\nthere is a team) and ensure that refreshments will be available, including lunch if possible.\nyou will be needing to show documents and discuss them, so some form', metadata={'source': 'CERTIKIT_ISO27001_Implementation_Guide_v12.pdf.pdf', 'title': 'CERTIKIT_ISO27001_Implementation_Guide_v12.pdf', 'original_text': '- before arranging the stage one you should have completed the following:\n  - e information security policy\n  - e risk assessment and treatment plan\n  - e implemented most (but not necessarily all) of your information security controls\n  - e conducted user awareness training\n  - e internal audits of all areas of the standard\n  - page 75 of 79\n  - iso/iec 27001 implementation guide\n  - e atleast one management review (ideally more)\n- not having any of the above available would probably mean that the stage one visit is\n  inconclusive in terms of judging your readiness for the stage two i.e. the auditor would tell\n  you just weren’t ready yet.\n- 5.3 preparing for audit day\n- once you feel you’re ready to be visited by the auditor for either the stage one or stage\n  two, there are sensible preparations to take to make the best impression from the start.\n- firstly, make sure that the visit is confirmed, provide directions and check the time of arrival\n  of the auditor(s). if appropriate, inform reception that they will be coming, get an identity\n  badge prepared and reserve a parking space. book a room for the auditor’s use (more if', 'doc_ID': 961, 'relevance_score': 0.9802809}), Document(page_content='iso 27001 certification\naudit will check the evidence in order to verify how the organization has defined and\nimplemented user registration and de-registration procedure. they might also check\nwhen user/employees left the organization and see whether user ids are disabled\nimmediately or not.\n146\nchapter 6 execution\na.9.2.2 user access provisioning (iso 27001 control)\na formal user access provisioning process should be implemented to assign or revoke\naccess rights for all user types to all systems and services.\nexplanation/what is required: the following points could be covered, based on\norganization business needs.\nbefore providing user access to the organization system and services, appropriate\napprovals must be taken from the owner of those system and services. it must be\nensured that access rights are granted as per the defined policy and the roles defined\nfor each user/designation. ids of users whose roles have changed or have left the\norganization must be disabled immediately. maintain the list of active and disabled\nuser ids.\nevidence that can be prepared: access control policy, requests raised for the users\nfor granting/revoking access, evidence for granting/revoking access for the users, list of\nactive and disabled user ids, monitoring records of user ids at regular intervals\nwho prepares it: the it helpdesk team along with the information security team\nwould prepare the evidence.\nfor external audit: an external auditor conducting the iso 27001 certification audit\nwill check the evidence in', metadata={'source': 'Chopra, Chaudhary - 2020 - Implementing an Information Security Management System - Security Management Based On ISO 27001.pdf', 'title': 'Chopra, Chaudhary - 2020 - Implementing an Information Security Management System - Security Management Based On ISO 27001', 'original_text': 'audit will check the evidence in order to verify how the organization has defined and\nimplemented user registration and de-registration procedure. they might also check\nwhen user/employees left the organization and see whether user ids are disabled\nimmediately or not.\n146\nchapter 6 execution\na.9.2.2 user access provisioning (iso 27001 control)\na formal user access provisioning process should be implemented to assign or revoke\naccess rights for all user types to all systems and services.\nexplanation/what is required: the following points could be covered, based on\norganization business needs.\nbefore providing user access to the organization system and services, appropriate\napprovals must be taken from the owner of those system and services. it must be\nensured that access rights are granted as per the defined policy and the roles defined\nfor each user/designation. ids of users whose roles have changed or have left the\norganization must be disabled immediately. maintain the list of active and disabled\nuser ids.\nevidence that can be prepared: access control policy, requests raised for the users\nfor granting/revoking access, evidence for granting/revoking access for the users, list of\nactive and disabled user ids, monitoring records of user ids at regular intervals', 'doc_ID': 1170, 'relevance_score': 0.97467697}), Document(page_content='to work with experts such as dataguard or an external\nconsultant, you may receive documentation templates that will help cut down on\nyour manual work significantly compared to creating them from scratch.\n## what is an audit, and why is it important?\nan audit is basically the process of checking that your isms meets the\nrequirements and criteria of a standard. if you are certifying against iso\n27001, it will be the requirements of the iso 27001 standard.\naudits ensure the success of your isms by identifying information security\nnon-conformities and can be either internal or external. internal audits can\nbe carried out using the organisations’ own resources — whether that’s\ninternal employees of the company or contracted independent consultants (2nd\nparty auditors).\nexternal audits are carried out by a certification body, external partners or\ncustomers who want to assess the isms on their own terms. the latter is rather\nthe exception than the rule — when referring to an external audit, a\ncertification body is meant in most cases.\naudits are incredibly important not only because they are:\n * **a concrete **requirement** of the iso 27001 standard.**\n * the only way of **verifying whether you comply** with the standard.\n * necessary to **obtain your iso 27001 certification.**\n## conducting internal audits: how to go about it\ninternal audits are vital for long-term success in earning and keeping your\niso 27001 certification. they should be carried out on a regular basis by\nemployees within the company,', metadata={'description': 'No matter if you’re an SMB or an international corporation — getting an ISO 27001 certification should be on your agenda. Here’s the ultimate guide on how.', 'doc_ID': 137, 'language': 'en-gb', 'original_text': '- Audits ensure the success of your isms by identifying information security non-conformities and can be either internal or external.\n- Internal audits can be carried out using the organisations’ own resources — whether that’s internal employees of the company or contracted independent consultants (2nd party auditors).\n- Audits are incredibly important not only because they are a concrete requirement of the iso 27001 standard, the only way of verifying whether you comply with the standard, and necessary to obtain your iso 27001 certification.\n- Conducting internal audits: how to go about it internal audits are vital for long-term success in earning and keeping your iso 27001 certification.', 'source': 'https://www.dataguard.co.uk/knowledge/iso-27001-certification/', 'title': 'ISO 27001 Certification: Your ultimate guide [free guide available]', 'relevance_score': 0.9725193}), Document(page_content=""an external auditor, your company will\nfirst be required to perform an internal audit. an internal audit involves a\nthorough examination of your organization’s isms and is one of the best ways\nto ensure that your organization’s isms is operating effectively and is in\nalignment with the iso 27001 standard. specifically, organizations are\nrequired to self-verify conformance with the requirements from annex a of iso\n27001 deemed applicable in the isms's documented statement of applicability.\nthe internal audit is intended to help identify any gaps or deficiencies that\ncould affect your isms and impact your organization’s ability to meet its\nintended objectives, as well as to successfully complete an initial or annual\niso 27001 certification audit and maintain the certification.\n **the internal audit function is a requirement under the iso 27001 standard**\nand can be challenging to implement in a way that meets each of the\nrequirements set forth in the standard, especially for smaller organizations.\nthis is because of the prescriptive nature outlined in the standard, and the\nneed for allocated resources that are both independent of the development and\nmaintenance of the isms, while still possessing the necessary competencies to\nperform the internal audit function.\n**unlike a certification review where you must use an external third-party to\nconduct the audit, the internal audit can be conducted either by staff within\nyour organization or by an independent third party, such as a consulting\nfirm.** when"", metadata={'description': 'In this guide, we share the recommended approach to successful implementation of an Information Security Management System (ISMS) according to the ISO 27001 standard to help prepare your organization to undergo an independent evaluation of your ISMS in order to obtain your ISO 27001 certification.', 'doc_ID': 60, 'language': 'en', 'original_text': '- the internal audit function is a requirement under the iso 27001 standard\n- unlike a certification review where you must use an external third-party to conduct the audit, the internal audit can be conducted either by staff within your organization or by an independent third party, such as a consulting firm.', 'source': 'https://www.vanta.com/resources/the-ultimate-iso-27001-guide-powered-by-vanta-and-aprio', 'title': 'The ultimate ISO 27001 guide', 'relevance_score': 0.96944016}), Document(page_content='how do you begin your journey for iso 27001?\ninitiating the project usually involves a few steps. before conducting a readiness assessment or an internal audit, getting management buy-in for the project will be at the top of your list. steve recommends clearly defining the benefits of iso 27001, including ways strong cyber and information security can strengthen the brand, increase client trust, and save the organization millions of dollars by preventing data breaches.\nonce management signs off, it’s always best to perform a readiness assessment or an internal audit to see which areas of your organization need improvement.\nwhat is the biggest mistake companies make when preparing for iso 27001?\nnot conducting a readiness assessment or internal audit beforehand can bring up a lot of problems down the road. steve points out that it’s common for businesses to move forward with a project without actually assessing their implementation or usage of the controls they’ve put in place. certification bodies want to see companies that fully understand and apply the measures they’ve set, so it’s important to keep your employees educated and accountable. it’s also wise to conduct a gap assessment once you’ve started to put controls in place to catch any of these issues.\nsteve also warns against these things when preparing for iso 27001:\nimproperly defining the isms scope\ninadequate employee security training\nimproperly performed risk assessments\nmetrics and implementation plans for info sec don’t align with', metadata={'description': 'Achieving ISO 27001 can come with a lot of questions. Lead Auditor at ARORA Solutions, Steve Cullen, breaks down how to set your organization up for a successful ISO 27001 audit.', 'doc_ID': 90, 'language': 'en', 'original_text': '- before conducting a readiness assessment or an internal audit, getting management buy-in for the project will be at the top of your list.\n- once management signs off, it’s always best to perform a readiness assessment or an internal audit to see which areas of your organization need improvement.\n- not conducting a readiness assessment or internal audit beforehand can bring up a lot of problems down the road.\n- it’s common for businesses to move forward with a project without actually assessing their implementation or usage of the controls they’ve put in place.\n- certification bodies want to see companies that fully understand and apply the measures they’ve set, so it’s important to keep your employees educated and accountable.\n- it’s also wise to conduct a gap assessment once you’ve started to put controls in place to catch any of these issues.\n- steve also warns against these things when preparing for iso 27001:\n  - improperly defining the isms scope\n  - inadequate employee security training\n  - improperly performed risk assessments\n  - metrics and implementation plans for info sec don’t align with', 'source': 'https://www.drata.com/blog/ask-an-auditor-demystifying-iso-27001', 'title': 'Ask an Auditor: Demystifying the ISO 27001 Certification Process With Steve Cullen From ARORA Solutions', 'relevance_score': 0.9620363})]","To feel more confident before an external audit, it would be advisable to conduct a pre-audit shortly beforehand. This pre-audit can be considered as an internal audit carried out in accordance with the requirements of ISO 27001. It is important that a stress test is conducted during this trial run, where the audit subjects and the exact date are not communicated, thus surprising all employees. A favorable time for the pre-audit is about 4 weeks before the official audit, to allow time for any identified deficiencies to be addressed. It is also important to create an audit report listing all identified deficiencies. It is not a problem to identify shortcomings if appropriate measures are derived from them.","To become more confident just before an external audit for ISO 27001 certification, it would be useful to conduct a mock audit to identify any improvements needed. Additionally, displaying signs of information security-related activities at your location, such as performance charts or awareness posters, can help demonstrate professionalism and control to the auditor. Ensuring that the auditor has provided an audit plan outlining the structure of the audit can also help in preparation. Providing quick and easy access to relevant documents and resources during the audit can facilitate the process. Ultimately, being well-prepared by following the ISO/IEC 27001 standard requirements and having evidence readily available can boost confidence before the external audit.",True,0.3659574468085106,0.13733905579399142,0.2297872340425532,0.8313934430480003,0.9999657869338989,0.7261146202664631,0.3333333333333333,0.9404629829863667,1.5950417518615723,2.597909927368164,0.002957582473754883,4.192951679229736
Fine-tuned_finetuned-ISO-27001_1024_l2_All_1536_264_False_Kers,Hybrid_Rerank_Cohere_Compression,8,gpt-3.5-turbo-16k,16385,0,1,How is the process of an ISO 27001 audit determined in the planning phase and what steps are involved?,"[Document(page_content='audit is not required by law or regulation. however, it is a good\npractice for all organisations to conduct regular internal audits of their\ninformation security and other management systems.\nin order to comply with iso 27001, all companies must conduct internal audits,\nno matter their country or industry.\n## how to plan and conduct an iso 27001 internal audit\nto plan and conduct an iso 27001 internal audit, organisations should follow\nthe following steps:\n 1. **define the scope of the audit:** the first step is to define the scope of the audit. this includes identifying the isms processes and controls that will be audited. 2. **develop an audit plan:** the next step is to develop an audit plan. this plan should identify the audit objectives, the audit methodology, and the audit resources required. 3. **conduct the audit:** the audit should be conducted in accordance with the audit plan. this involves interviewing staff, reviewing documentation, and observing processes. 4. **document the audit findings:** the audit findings should be documented in a report. this report should include the audit objectives, the audit methodology, the audit findings, and any recommendations for improvement. 5. **follow up on the audit findings:** the organisation should follow up on the audit findings and implement any necessary corrective actions.\n## what to look for during an iso 27001 internal audit\nduring an iso 27001 internal audit, the auditor will look for evidence that\nthe isms is', metadata={'description': 'Ensure your ISMS is operating effectively for ISO 27001 compliance. Learn all you need to know about ISO 27001 Clause 9.2 internal audits in our guide.\n', 'doc_ID': 423, 'language': 'en-gb', 'original_text': '1. define the scope of the audit\n2. develop an audit plan\n3. conduct the audit\n4. document the audit findings\n5. follow up on the audit findings', 'source': 'https://www.dataguard.co.uk/knowledge/iso-27001/clause-9-2-internal-audit/', 'title': 'ISO 27001 Clause 9.2: Internal Audit', 'relevance_score': 0.98813087}), Document(page_content='defines the boundaries\nof your organization’s isms, what elements of your\nisms are reviewed for certification, and which\ncontrols are relevant to the scope of your project.\nled\ncc\ncc]\nplanning\nthis section helps organizations to create objectives\nbased on risks and opportunities. organizations use\nthis information to establish a plan to maintain a\nrisk-based approach to isms management and\ndetermine how they will monitor and measure\ntheir objectives.\nperformance evaluation\nthis section guides organizations to define\nprocedures for measuring, monitoring, and main-\ntaining isms records. it also includes information\non establishing an internal audit schedule and\nmanagement reviews to address remediation\nactions for issues discovered during audits.\nimprovement\nhelps organizations create a process for recording\nand managing recommendations for improvement\nand non-conformities discovered during audits.\nthe initial certification process for iso 27001 certificate eligibility comprises two stages: a documentation\nreview audit and an evidential audit. the clauses detailed in part 1 of the iso 27001 structure help organizations\nprepare written documentation, processes, procedures, and guidelines that explain your isms implementation\nand the business processes that support it.\nthese documents are then reviewed by an approved, objective auditor during the stage 1 documentation\nreview. during this first stage, the auditor ensures that a company’s documentation aligns with iso 27001\nstandards and may recommend them', metadata={'doc_ID': 1340, 'original_text': '- planning phase\n- process for measuring, monitoring, and maintaining isms records\n- establishing an internal audit schedule and management reviews\n- remediation actions for issues discovered during audits\n- process for recording and managing recommendations for improvement and non-conformities discovered during audits\n- initial certification process for iso 27001 certificate eligibility\n- documentation review audit\n- evidential audit\n- clauses detailed in part 1 of the iso 27001 structure\n- written documentation, processes, procedures, and guidelines\n- documentation aligns with iso 27001 standards', 'source': 'complete-guide-iso-27001-compliance.pdf', 'title': 'complete guide iso 27001 compliance', 'relevance_score': 0.98667485}), Document(page_content=""in the iso/iec 27001 standard. the certification body will take the time to gain a sufficient understanding of the isms design in the context of your organization, risk assessment and treatment (including the controls determined), information security policy and objectives. a large emphasis will also be put on your company's preparedness for the audit. this allows planning for stage 2. * **stage 2 audit:** based on documented findings in stage 1's audit report, the certification body will develop an audit plan to conduct stage 2 of the audit. in addition to evaluating the effective implementation of the isms, the aim of stage 2 is to confirm that your company adheres to its own policies, objectives and procedures.\nto do this, the audit will focus on:\n * top management leadership and commitment to information security policy and the information security objectives\n * documentation requirements listed in iso/iec 27001\n * assessment of information security-related risks and that the assessments produce consistent, valid and comparable results if repeated\n * determination of control objectives and controls based on the information security risk assessment risk treatment processes\n * information security performance and the effectiveness of the isms, evaluating against the information security objectives\n * correspondence between the determined controls, the statement of applicability and the results of the information security risk assessment and risk treatment process and the information security"", metadata={'description': 'No matter if you’re an SMB or an international corporation — getting an ISO 27001 certification should be on your agenda. Here’s the ultimate guide on how.', 'doc_ID': 140, 'language': 'en-gb', 'original_text': '- ""the certification body will take the time to gain a sufficient understanding of the isms design in the context of your organization, risk assessment and treatment (including the controls determined), information security policy and objectives.""\n- ""this allows planning for stage 2.""\n- ""stage 2 audit: based on documented findings in stage 1\'s audit report, the certification body will develop an audit plan to conduct stage 2 of the audit.""\n- ""in addition to evaluating the effective implementation of the isms, the aim of stage 2 is to confirm that your company adheres to its own policies, objectives and procedures.""\n- ""to do this, the audit will focus on:""\n- ""top management leadership and commitment to information security policy and the information security objectives""\n- ""documentation requirements listed in iso/iec 27001""\n- ""assessment of information security-related risks and that the assessments produce consistent, valid and comparable results if repeated""\n- ""determination of control objectives and controls based on the information security risk assessment risk treatment processes""\n- ""information security performance and the effectiveness of the isms, evaluating against the information security objectives""\n- ""correspondence between the determined controls, the statement of applicability and the results of the information security risk assessment and risk', 'source': 'https://www.dataguard.co.uk/knowledge/iso-27001-certification/', 'title': 'ISO 27001 Certification: Your ultimate guide [free guide available]', 'relevance_score': 0.98109454}), Document(page_content='when you go on vacation, you plan the travel, and then plan for\nthe stay. why do we plan in this manner? the answer is to avoid any risk during your\nvacation or trip.\nsimilarly, when you audit your organization, planning is a must. before initializing\nthe internal audit, the organization must develop an audit plan that defines the audit’s\nobjectives, scope, and criteria. the following key items cover what you should take care\nof when planning for an iso 27001 internal audit:\n224\n1.\nnote\nchapter 7 — internal audit\nobjective and scope of audit plan: the client should define the\nobjectives and scope of the audit. here are some examples of good\nobjectives:\ne toassess the implementation and effectiveness of the iso 27001\ncontrols.\ne to assess compliance with the applicable laws and regulations.\ne to assess compliance with internal policies and procedures.\nsimilarly, the scope should also be covered in the audit plan. for\nexample; the scope of work for internal audit can be:\ne toreview the policies and procedures of the organization.\ne toreview the means of safeguarding assets of the organization.\ne toreview the laws and regulations that impact the business.\nthe scope of the audit should include a description of the physical\nlocation of the organization, units, support functions, and any\nexclusions.\naudit schedule: once the scope of the audit is clear, the next\nthing to do is to prepare the audit schedule. the audit schedule\nwill cover all the projects/departments that will be audited as\npart of the new', metadata={'source': 'Chopra, Chaudhary - 2020 - Implementing an Information Security Management System - Security Management Based On ISO 27001.pdf', 'title': 'Chopra, Chaudhary - 2020 - Implementing an Information Security Management System - Security Management Based On ISO 27001', 'original_text': '- when you audit your organization, planning is a must. before initializing\nthe internal audit, the organization must develop an audit plan that defines the audit’s\nobjectives, scope, and criteria.\n- the following key items cover what you should take care\nof when planning for an iso 27001 internal audit:\n- objective and scope of audit plan: the client should define the\nobjectives and scope of the audit.\n- the scope should also be covered in the audit plan.\n- the scope of the audit should include a description of the physical\nlocation of the organization, units, support functions, and any\nexclusions.\n- audit schedule: once the scope of the audit is clear, the next\nthing to do is to prepare the audit schedule.', 'doc_ID': 1283, 'relevance_score': 0.9788344}), Document(page_content='involved in the planning\nand design of the security objectives, because it is difficult to find one’s own mistakes. therefore, organization\nunits or individuals that are outside the scope of internal isms audits should be selected as the auditors by\nmanagement. these auditors should plan, carry out and make reports and follow-up of the internal isms\naudits to acquire the commitment of management. depending on the size of the organization, it might be\nuseful to call in external auditors to avoid the situation in which staff members become blinkered to their own\nwork.\nin an internal isms audit, it should be checked that the isms is being operated effectively and maintained and\nas expected. auditors should take the status and importance of management goals, controls, processes and\nprocedures to be audited into account when planning an audit program, as well as the results of previous\naudits.\nin carrying out an audit, the criteria, applicable scope, frequency and method of the audit should be\ndocumented.\nthe objectivity and fairness of the audit process should be ensured when auditors are selected. an auditor is\nrequired to have the following competences when carrying out the series of processes in the audit:\na) planning and carrying out the audit\nb) reporting the results\nc) proposing corrective and preventive action, etc.\n© iso/iec 2010 - all rights reserved 55\niso/iec 27003:2010(e)\nin addition, the organization is required to define the responsibilities of auditors and the series of processes for\nthe', metadata={'source': 'ISO 27003 2010 (E).pdf', 'title': 'ISO 27003 2010 (E)', 'original_text': '- ""involved in the planning and design of the security objectives""\n- ""auditors should plan, carry out and make reports and follow-up of the internal isms audits""\n- ""should take the status and importance of management goals, controls, processes and procedures to be audited into account when planning an audit program""\n- ""the criteria, applicable scope, frequency and method of the audit should be documented""\n- ""the objectivity and fairness of the audit process should be ensured when auditors are selected""\n- ""an auditor is required to have the following competences when carrying out the series of processes in the audit: a) planning and carrying out the audit b) reporting the results c) proposing corrective and preventive action, etc.""\n- ""the organization is required to define the responsibilities of auditors and the series of processes for the""', 'doc_ID': 1517, 'relevance_score': 0.9775858}), Document(page_content='annual verification audits to be conducted within this timeframe. other bodies limit the validity to one year from the outset and require a new audit to be conducted each year for certificate renewal. regardless of these procedures, the important rule is that any security-related changes to the isms must be communicated to the certification body and may trigger a so-called event-driven audit.\nin this context, it is strongly recommended to plan audits in the long term. for periodic audits, for example, one might schedule them for the same month each year, preferably choosing a month with lower workload from other activities. if internal and external audits are chosen, the scheduling should start from the external audit date and plan backwards, as indicated in table 5.1. we will delve into these steps further in section 5.3.\naudit subject\nthe planning continues with determining the audit subject. this could be a single organizational unit, a business process, or a particularly important security objective. however, it is usually advisable to select the entire organization and its isms. this is especially true for the first internal audit, where breadth examination is more important than in-depth scrutiny. the audit subject may also be determined by industry-specific standards, such as iso 27017 for cloud service providers or iso 27019 for the energy sector.\nthe determination of the audit subject is closely related to the type of audit being planned.\ntypes of audits\naudits can be classified under two', metadata={'doc_ID': 3273, 'original_text': '- ""in this context, it is strongly recommended to plan audits in the long term.""\n- ""if internal and external audits are chosen, the scheduling should start from the external audit date and plan backwards, as indicated in table 5.1.""\n- ""the planning continues with determining the audit subject.""\n- ""the audit subject may also be determined by industry-specific standards, such as iso 27017 for cloud service providers or iso 27019 for the energy sector.""\n- ""the determination of the audit subject is closely related to the type of audit being planned.""', 'source': 'Kersten et al. - 2020 - IT-Sicherheitsmanagement nach der neuen ISO 27001_removed.pdf', 'title': 'Kersten et al. - 2020 - IT-Sicherheitsmanagement nach der neuen ISO 27001_removed', 'relevance_score': 0.97505975}), Document(page_content='but also to have a unified\nstandard that tells them other governments are thoroughly secure.\n\u200d\n\u200d\n## iso 27001 certification process and requirements overview\n\u200d\nthe 27001 certification process involves:\n\u200d\n 1. scoping and effectively implementing an information security management system (isms)\n 2. establishing an isms governing body composed of senior management and key stakeholders from throughout the company\n 3. performing an internal audit to assess the organization’s isms and its implementation\n 4. undergoing an iso audit with an external third-party auditor\nthe internal audit is one of the best ways to ensure that your organization’s\nisms is operating effectively and in alignment with the iso 27001 standard.\nthe internal audit is required under the iso 27001 standard and internal\nauditors must be objective and impartial. in order to make sure your iso 27001\ncertification is up to industry standards, auditors should not be responsible\nfor implementing, operating, or monitoring any of the controls under audit.\nonce the internal audit is complete, results should be shared with the\ncompany’s isms governing body and senior management to address any issues\nbefore proceeding to the next step of the iso 27001 certification process—the\nexternal audit.\nthe external audit is composed of two stages. stage 1 audit consists of an\nextensive documentation review, during which an external iso 27001 auditor\nreviews an organization’s policies and procedures to ensure they meet the\nrequirements of the iso', metadata={'source': 'https://www.vanta.com/resources/who-needs-iso-27001-certification', 'title': 'What is ISO 27001 Certification and Who Needs it? | Vanta', 'description': ""Read our blog to learn more about what is ISO 27001 certification and who needs ISO 27001. We're here to help make the process simple and straightforward."", 'language': 'en', 'original_text': '- the 27001 certification process involves:\n\u200d\n 1. scoping and effectively implementing an information security management system (isms)\n 2. establishing an isms governing body composed of senior management and key stakeholders from throughout the company\n 3. performing an internal audit to assess the organization’s isms and its implementation\n 4. undergoing an iso audit with an external third-party auditor\n- the internal audit is one of the best ways to ensure that your organization’s\nisms is operating effectively and in alignment with the iso 27001 standard.\n- the internal audit is required under the iso 27001 standard and internal\nauditors must be objective and impartial. in order to make sure your iso 27001\ncertification is up to industry standards, auditors should not be responsible\nfor implementing, operating, or monitoring any of the controls under audit.\n- once the internal audit is complete, results should be shared with the\ncompany’s isms governing body and senior management to address any issues\nbefore proceeding to the next step of the iso 27001 certification process—the\nexternal audit.\n- the external audit is composed of two stages. stage 1 audit consists of an\nextensive documentation review, during which an external iso 270', 'doc_ID': 5, 'relevance_score': 0.95695716}), Document(page_content='and whatever name it assigns to\nthe planning stage. every single control that is to be\nimplemented will be selected on the basis of the risk\nassessment, and the risk assessment must be completed\nbefore any controls are implemented. risk assessment is also\nan ongoing activity of the isms; whenever there is a change\nin the risk environment, or of business requirements, or to\nthe asset — indeed, whenever there is any change that might\naffect the risk profile of the asset — a new risk assessment\nwill be required.\nin fact, risk assessment is so central to information security\nmanagement that we see it as the core competence of the\nisms.\npdca and the risk acceptance criteria\nwhile iso 27001 expects the board to finalise its risk\nacceptance criteria and risk assessment methodology before\nthe risk acceptance process itself is started, experience\nteaches that most organisations need to apply the pdca (or\nother process model) principle to this aspect of their isms\nas well.\n33\n3: risk management objectives\nin other words, senior management and the board should\ndetermine, initially, what the acceptance criteria and\nmethodology should be. it is not unusual for either excessive\ncaution or unexpected bravado to underpin this initial phase\nof development work — not least because the total value or\nfull nature of the organisation’s information assets is not\nalways fully appreciated at this early stage.\nthe initial methodology and risk acceptance criteria should\nthen be applied in a test environment (the ‘do’ phase of', metadata={'source': 'Calder - 2019 - Information Security Risk Management for ISO 27001.pdf', 'title': 'Calder - 2019 - Information Security Risk Management for ISO 27001', 'original_text': '- ""the planning stage""\n- ""risk assessment""\n- ""risk environment""\n- ""business requirements""\n- ""asset""\n- ""risk profile""\n- ""risk assessment""\n- ""information security management""\n- ""core competence""\n- ""pdca""\n- ""risk acceptance criteria""\n- ""risk assessment methodology""\n- ""senior management""\n- ""board""\n- ""initially""\n- ""acceptance criteria""\n- ""methodology""\n- ""development work""\n- ""information assets""\n- ""test environment""\n- ""do phase""', 'doc_ID': 701, 'relevance_score': 0.9553191})]","The process of an audit in the planning phase is determined in a joint meeting of the parties involved. The audit subject, objective, and procedure, as well as the necessary personnel, are discussed and consensus is reached. Prior to the actual audit, auditors can create checklists to serve as a guide for the process. During the planning phase, there are technical discussions where the organization presents any changes compared to the previous audit, and the auditors ask questions and express any correction requests.","In the planning phase of an ISO 27001 audit, the process is determined by defining the scope of the audit, developing an audit plan, conducting the audit, documenting the audit findings, and following up on the audit findings. Steps involved include scoping and implementing an Information Security Management System (ISMS), establishing an ISMS governing body, performing an internal audit, and undergoing an ISO audit with an external third-party auditor. The audit plan should cover objectives, scope, criteria, audit schedule, and documentation review. Auditors should plan, carry out, report, and follow up on internal ISMS audits, ensuring objectivity and fairness. Long-term audit planning is recommended, considering industry-specific standards like ISO 27017 or ISO 27019. The audit subject should be determined based on the type of audit being planned. The planning stage also",True,0.33179723502304154,0.12093023255813955,0.20276497695852536,0.6949964761734009,0.9999659061431885,0.7251387604347785,0.75,0.8811893350533535,1.6550307273864746,2.6512153148651123,0.001968860626220703,4.306246042251587
