index_name,retriever_method,number_retrieved_docs,llm_name,max_context_size,temperature,prompt_version,question,retrieved_contexts,golden_answer,generated_answer,context_size_valid,rouge1,rouge2,rougeL,bleurt,hallucination,answer_relevancy,answer_similarity,context_recall,RAGAS_relevancy,duration_retrieval,duration_generation,duration_context_size,duration_total
Fine-tuned_finetuned-ISO-27001_1024_l2_All_1536_264_False,Hybrid_Rerank_Cohere,4,mixtral-8x7B-v0.1,16000,0,1,"What does the term ""asset"" mean in ISO-27001 and what requirement does the standard have regarding the identification and inventory of information assets?","[Document(page_content='asset valuation\nthe whole risk assessment process should consider the\norganisation’s context and the needs and expectations of\ninterested parties.\nfurthermore, iso 27001 provides no guidance as to the basis\non which control selection decisions should be made, other\nthan to say that they should be selected “taking account of\nthe risk assessment results” (6.1.3 a), which will necessarily\ntake into account how the organisation prioritises the risks\nfor treatment (6.1.2 ¢.2).\nfinally, the iso 27001 management system clauses have no\nrequirement in terms of your methodology for the\nidentification or valuation of information assets.\nhow you value an asset in an asset-based methodology is,\nhowever, going to be fundamental to how much you will be\nprepared to invest in protecting it. iso 27000 doesn’t offer a\ndefinition for an asset, although it is reasonable to simply\ndefine it as ‘anything that has value to the organisation’. the\norganisation’s fixed-asset register is unlikely to provide\npractical help in this regard: many critical assets may already\n(through application of the financial depreciation policy, or\nof the accounting convention that assets should be shown on\nthe balance sheet at the /ower of historic cost — less\ndepreciation — or current market value) have been written\ndown below their actual useful value to the organisation.\nmany other, even more critical, assets (such as brand value,\nkey supplier and customer contracts, staff know-how,\nintellectual property and databases) may not even be on', metadata={'doc_ID': 784, 'original_text': 'asset valuation\nthe whole risk assessment process should consider the\norganisation’s context and the needs and expectations of\ninterested parties.\nFurthermore, ISO 27001 provides no guidance as to the basis\non which control selection decisions should be made, other\nthan to say that they should be selected “taking account of\nthe risk assessment results” (6.1.3 a), which will necessarily\ntake into account how the organisation prioritises the risks\nfor treatment (6.1.2 ¢.2).\nFinally, the ISO 27001 management system clauses have no\nrequirement in terms of your methodology for the\nidentification or valuation of information assets.\nHow you value an asset in an asset-based methodology is,\nhowever, going to be fundamental to how much you will be\nprepared to invest in protecting it. ISO 27000 doesn’t offer a\ndefinition for an asset, although it is reasonable to simply\ndefine it as ‘anything that has value to the organisation’. The\norganisation’s fixed-asset register is unlikely to provide\npractical help in this regard: many critical assets may already\n(through application of the financial depreciation policy, or\nof the accounting convention that assets should be shown on\nthe balance sheet at the /ower of historic cost — less\ndepreciation — or current market value) have been written\ndown below their actual useful value to the organisation.\nMany other, even more critical, assets (such as brand value,\nkey supplier and customer contracts, staff know-how,\nintellectual property and databases) may not even be on', 'source': 'Calder - 2019 - Information Security Risk Management for ISO 27001.pdf', 'title': 'Calder - 2019 - Information Security Risk Management for ISO 27001', 'relevance_score': 0.9960392}), Document(page_content='or home office.\n- information about systems in a demilitarized zone, as part of a security/network concept.\nsuch lists or plans are a good starting point for an inventory list according to a-5.9.\nit is worth noting that not all data is contained in a single directory. often, it is spread across multiple subdirectories that are under the responsibility of different entities. the iso 27002 explicitly allows this, but it requires clear organizational guidelines to avoid duplicate or inconsistent entries, different names, etc. in practice, due to expected challenges, it is often concluded that it is better to have a single central inventory list of information assets.\nif existing (older) inventories of the organization are discovered, it is necessary to check whether they meet all the requirements described in a-5.9 before incorporating them into the isms. if necessary, updates or revisions should be made.\nfor each asset, the inventory list should include at least the following information: a unique identifier, asset owner, and asset location.\nbefore explaining these three data fields, it is advisable to maintain the inventory list not only because the standard requires it but also as a basis for further work in the isms.\nuse:\n¢ as part of the risk assessment (isms-6.1), information about security objectives, specific risks, and references to action lists may be listed for each asset in the directory.\ne similarly, for certain types of assets, information about suppliers, procurement costs, maintenance work,', metadata={'doc_ID': 2709, 'original_text': 'or home office.\n- Information about systems in a demilitarized zone, as part of a security/network concept.\nSuch lists or plans are a good starting point for an inventory list according to A-5.9.\nIt is worth noting that not all data is contained in a single directory. Often, it is spread across multiple subdirectories that are under the responsibility of different entities. The ISO 27002 explicitly allows this, but it requires clear organizational guidelines to avoid duplicate or inconsistent entries, different names, etc. In practice, due to expected challenges, it is often concluded that it is better to have a single central inventory list of information assets.\nIf existing (older) inventories of the organization are discovered, it is necessary to check whether they meet all the requirements described in A-5.9 before incorporating them into the ISMS. If necessary, updates or revisions should be made.\nFor each asset, the inventory list should include at least the following information: a unique identifier, asset owner, and asset location.\nBefore explaining these three data fields, it is advisable to maintain the inventory list not only because the standard requires it but also as a basis for further work in the ISMS.\nuse:\n¢ As part of the risk assessment (ISMS-6.1), information about security objectives, specific risks, and references to action lists may be listed for each asset in the directory.\ne Similarly, for certain types of assets, information about suppliers, procurement costs, maintenance work,', 'source': 'ISO 27001_2022_Kersten_und_Schroeder.pdf', 'title': 'ISO 27001_2022_Kersten_und_Schroeder', 'relevance_score': 0.9950371}), Document(page_content='the guidelines and any related asset\nlabelling scheme developed to meet the requirements of\ncontrol a.8.2.2 (labelling of information) or similar\ncontrols.\nare vendors assets?\nwe identified one of the classes of information assets as\n“services on which computer systems depend: computing\nand communications services, and general utilities such as\nheating, lighting, power and air-conditioning”. this gives\nrise to a simple question: are the suppliers/vendors of these\nessential services also assets?\nthere are two practical answers to this question. the best\nsolution is probably to use a mix of the two, but in doing so\n*” see, specifically, chapter 9 of it governance: an international guide\nto data security and iso27001/tso27002, alan calder and steve g\nwatkins (kogan page, 2019).\n101\n8: information assets\nit is essential that the exact approach to be used in each\nspecific case is determined by a common set of rules. these\nshould be defined in the risk assessment documentation.\none option is to decide that the vendor itself is not an asset —\nthe organisation that is within the scope of the isms does not\nown the vendors — but that the services provided by the\nvendor and, possibly, the relationship with the vendor are\nboth assets within the scope of the isms. the logic behind\nthis option is that a relationship with a vendor can be an asset\nif it is a key supplier in terms of the information aspects of\nwhatever it is they supply.\nfor example, a stationery supplier would not, we suggest, be\na key relationship', metadata={'source': 'Calder - 2019 - Information Security Risk Management for ISO 27001.pdf', 'title': 'Calder - 2019 - Information Security Risk Management for ISO 27001', 'original_text': 'the guidelines and any related asset\nlabelling scheme developed to meet the requirements of\ncontrol A.8.2.2 (Labelling of information) or similar\ncontrols.\nAre vendors assets?\nWe identified one of the classes of information assets as\n“Services on which computer systems depend: computing\nand communications services, and general utilities such as\nheating, lighting, power and air-conditioning”. This gives\nrise to a simple question: are the suppliers/vendors of these\nessential services also assets?\nThere are two practical answers to this question. The best\nsolution is probably to use a mix of the two, but in doing so\n*” See, specifically, chapter 9 of IT Governance: An International Guide\nto Data Security and ISO27001/TSO27002, Alan Calder and Steve G\nWatkins (Kogan Page, 2019).\n101\n8: Information assets\nit is essential that the exact approach to be used in each\nspecific case is determined by a common set of rules. These\nshould be defined in the risk assessment documentation.\nOne option is to decide that the vendor itself is not an asset —\nthe organisation that is within the scope of the ISMS does not\nown the vendors — but that the services provided by the\nvendor and, possibly, the relationship with the vendor are\nboth assets within the scope of the ISMS. The logic behind\nthis option is that a relationship with a vendor can be an asset\nif it is a key supplier in terms of the information aspects of\nwhatever it is they supply.\nFor example, a stationery supplier would not, we suggest, be\na key relationship', 'doc_ID': 761, 'relevance_score': 0.9918753}), Document(page_content='that can actually lead to a security incident.\nproblems related to information assets\nit is a norm requirement to maintain and manage a list of information assets for the scope of application. for example, this list was incomplete, with entire groups of assets missing. this naturally resulted in no risk analysis and treatment being available for the assets. it also happened that either information about the location or the asset owner was missing.\nhowever, these gaps did not affect the actual remote control technology. the control system itself already has information about each individual remote control module, and it is usually up to date. however, gaps occurred when it came to proper backups, for example, of parameterization data. the facilities used for backups also belong in the inventory directory.\nthe current iso 27002 provides a welcome clarification regarding information assets, which was not present in earlier editions and was also missing in iso 27000: the information assets are classified into primary and secondary (or related) assets. primary assets include not only information, but also business processes and activities. this clarification is helpful because organizations sometimes believe that business processes are not part of the scope of their isms.\nalthough the incompleteness of the asset inventory was a relatively common problem, no general cause could be found for it, so it can only be pointed out here that the completeness and currency of the inventory for the scope of application', metadata={'source': 'ISO 27001_2022_Kersten_und_Schroeder.pdf', 'title': 'ISO 27001_2022_Kersten_und_Schroeder', 'original_text': 'that can actually lead to a security incident.\nProblems related to information assets\nIt is a norm requirement to maintain and manage a list of information assets for the scope of application. For example, this list was incomplete, with entire groups of assets missing. This naturally resulted in no risk analysis and treatment being available for the assets. It also happened that either information about the location or the asset owner was missing.\nHowever, these gaps did not affect the actual remote control technology. The control system itself already has information about each individual remote control module, and it is usually up to date. However, gaps occurred when it came to proper backups, for example, of parameterization data. The facilities used for backups also belong in the inventory directory.\nThe current ISO 27002 provides a welcome clarification regarding information assets, which was not present in earlier editions and was also missing in ISO 27000: The information assets are classified into primary and secondary (or related) assets. Primary assets include not only information, but also business processes and activities. This clarification is helpful because organizations sometimes believe that business processes are not part of the scope of their ISMS.\nAlthough the incompleteness of the asset inventory was a relatively common problem, no general cause could be found for it, so it can only be pointed out here that the completeness and currency of the inventory for the scope of application', 'doc_ID': 2974, 'relevance_score': 0.9858821})]","The term ""asset"" in ISO-27001 refers to anything that holds value for an organization. This includes properties, buildings, machinery, facilities, business processes, as well as information assets such as data, systems, and IT services. One requirement of the standard is that all relevant information assets must be identified and inventoried. This is typically done by recording information such as asset location, classification and the asset owner in a table or database. Inventorying can be facilitated by grouping similar assets or implementing a hierarchy.","In ISO 27001, an ""asset"" refers to anything that has value to the organization. This can include tangible assets like buildings and equipment, as well as intangible assets like information, intellectual property, and relationships with customers and suppliers.

ISO 27001 requires organizations to identify and inventory their information assets as part of the risk assessment process. This inventory should include at least a unique identifier, asset owner, and asset location for each asset. The inventory is used as a basis for further work in the ISMS, such as setting security objectives, identifying specific risks, and creating action lists for each asset.

The standard does not provide specific guidance on how to value assets, but the value of an asset is a fundamental consideration in determining how much to invest in protecting it. Assets should be valued based on their importance to the organization, taking into account factors like their potential impact on business operations, legal and regulatory compliance, and reputation.

In the context of information security, vendors can be considered assets if they provide essential services that support the organization's computer systems, such as computing and communications services, or general utilities like heating, lighting, power, and air-conditioning. The relationship with the vendor can also",True,0.42068965517241375,0.125,0.23448275862068965,0.451723575592041,0.5465316101908684,0.9980236291885376,0.8304266730143328,0,0,10.76900839805603,3.869995594024658,0.9890005588531494,14.639003992080688
Fine-tuned_finetuned-ISO-27001_1024_l2_All_1536_264_False,Hybrid_Rerank_Cohere,4,mixtral-8x7B-v0.1,16000,0,1,What information and documents should be collected in an organization to determine the context as part of ISO 27001?,"[Document(page_content='documents which provide further information and\nare very useful if not essential in using the standard itself. for iso/iec 27001 the one quoted\nhere is iso/iec 27000 which sets out the overview and vocabulary for an isms.\nthere are no requirements to be met in this section.\n3.4 clause 3 terms and definitions\nunlike many other standards, iso/iec 27001 doesn’t list any definitions at all, simply\nreferring the reader to iso/iec 27000. if you feel you need to know the exact definitions of\nsome of the terms used in iso/iec 27001 then this is the place to look, although in many\ncases you may not feel much more enlightened after reading the definition.\nthere are no requirements to be met in this section.\n page 24 of 79\niso/iec 27001 implementation guide\n3.5 clause 4 context of the organization\nrelevant toolkit documents\ne information security context, requirements and scope\nthis clause is about understanding as much as possible about the organization itself and the\nenvironment in which it operates. the key point about the isms is that it should be\nappropriate and relevant to the specifics of the business it is protecting. to ensure this, the\npeople implementing and running the isms must be able to answer questions about what\nthe organization does, where, how and who for (plus many others).\nthe isms will also be affected by the situation within the organization (internal issues) and\noutside the organization (external issues). internal issues are factors such as the culture,\nmanagement structure, locations,', metadata={'doc_ID': 871, 'original_text': 'documents which provide further information and\nare very useful if not essential in using the standard itself. For ISO/IEC 27001 the one quoted\nhere is ISO/IEC 27000 which sets out the overview and vocabulary for an ISMS.\nThere are no requirements to be met in this section.\n3.4 Clause 3 Terms and definitions\nUnlike many other standards, ISO/IEC 27001 doesn’t list any definitions at all, simply\nreferring the reader to ISO/IEC 27000. If you feel you need to know the exact definitions of\nsome of the terms used in ISO/IEC 27001 then this is the place to look, although in many\ncases you may not feel much more enlightened after reading the definition.\nThere are no requirements to be met in this section.\n Page 24 of 79\nISO/IEC 27001 Implementation Guide\n3.5 Clause 4 Context of the organization\nRelevant Toolkit documents\ne Information security Context, Requirements and Scope\nThis clause is about understanding as much as possible about the organization itself and the\nenvironment in which it operates. The key point about the ISMS is that it should be\nappropriate and relevant to the specifics of the business it is protecting. To ensure this, the\npeople implementing and running the ISMS must be able to answer questions about what\nthe organization does, where, how and who for (plus many others).\nThe ISMS will also be affected by the situation within the organization (internal issues) and\noutside the organization (external issues). Internal issues are factors such as the culture,\nmanagement structure, locations,', 'source': 'CERTIKIT_ISO27001_Implementation_Guide_v12.pdf.pdf', 'title': 'CERTIKIT_ISO27001_Implementation_Guide_v12.pdf', 'relevance_score': 0.9937101}), Document(page_content=""with iso 27001. you\nmust document all processes, rules, and procedures related to your isms to\nensure their appropriate implementation. the norm requires documentation of\nthe following aspects: * understanding the organization and its context (e.g., through an environmental analysis) * identification of interested parties * isms scope * communicated management commitment * roles and responsibilities within the isms * risk and opportunity management * change management planning * resource planning * decision logs related to risk management * training * communication matrix * documentation management planning/policy * framework with information security policies and information security guidelines * procedure for information security risk management * statement of applicability (soa) * information security objectives * evidence of competence * information necessary for the organization's isms effectiveness * control and planning of activities * evidence of monitoring and measurement results and evaluation * procedure for internal audits * procedure for management review * evidence of the audit program and its results * evidence of the results of management reviews * evidence of the type of identified non-conformities and all subsequent actions * evidence of"", metadata={'description': 'Discover the comprehensive guide to ISO 27001: Detailed insight into achieving and maintaining this essential information security standard. Explore its critical role in risk management, compliance and robust security practices, and learn step-by-step implementation techniques.', 'doc_ID': 176, 'language': 'en-gb', 'original_text': ""with ISO 27001. You\nmust document all processes, rules, and procedures related to your ISMS to\nensure their appropriate implementation. The norm requires documentation of\nthe following aspects: * Understanding the organization and its context (e.g., through an environmental analysis) * Identification of interested parties * ISMS scope * Communicated management commitment * Roles and responsibilities within the ISMS * Risk and opportunity management * Change management planning * Resource planning * Decision logs related to risk management * Training * Communication matrix * Documentation management planning/policy * Framework with information security policies and information security guidelines * Procedure for information security risk management * Statement of Applicability (SoA) * Information security objectives * Evidence of competence * Information necessary for the organization's ISMS effectiveness * Control and planning of activities * Evidence of monitoring and measurement results and evaluation * Procedure for internal audits * Procedure for management review * Evidence of the audit program and its results * Evidence of the results of management reviews * Evidence of the type of identified non-conformities and all subsequent actions * Evidence of"", 'source': 'https://www.dataguard.co.uk/knowledge/iso-27001/', 'title': 'What is ISO 27001? Key Information at a Glance', 'relevance_score': 0.99256825}), Document(page_content='any gaps in your isms.\nonce you have prepared the documentation and undergone an internal audit as\nwell as a management review, you need to undergo an external audit by a\ncertified body such as the ukas.\nthe mandatory documents required for iso 27001 are:\n * 4.1 understanding the organization and its context\n * 4.2 understanding the needs and expectations of interested parties\n * 4.3 the scope of the isms\n * 4.4 information security management system process\n * 5.1 commitment of the isms\n * 5.2 information security policy\n * 5.3 roles and their responsibilities (raci/rasci)\n * 6.1.2 information security risk assessment and treatment process\n * 6.1.3 information security risk treatment and assessment plan\n * 6.1.3 the statement of applicability\n * 6.2 information security objectives\n * 6.3 change management for the isms\n * 7.1 ressource planning\n * 7.3 awareness plan\n * 7.4 communication plan\n * 7.2 evidence of competence\n * 7.5 document control policy\n * 5.5.1 documented information determined by the organisation as being necessary for the effectiveness of the isms\n * 8.1 operational planning and control\n * 8.2 results of the information security risk assessment\n * 8.3 results of the information security risk treatment\n * 9.1 evidence of the monitoring and measurement of results\n * 9.2 a documented internal audit process\n * 9.2 evidence of the audit programmes and the audit results\n * 9.3 evidence of the results of management reviews\n * 10.1 evidence of the nature of the', metadata={'description': 'No matter if you’re an SMB or an international corporation — getting an ISO 27001 certification should be on your agenda. Here’s the ultimate guide on how.', 'doc_ID': 147, 'language': 'en-gb', 'original_text': 'any gaps in your ISMS.\nOnce you have prepared the documentation and undergone an internal audit as\nwell as a management review, you need to undergo an external audit by a\ncertified body such as the UKAS.\nThe mandatory documents required for ISO 27001 are:\n * 4.1 Understanding the organization and its context\n * 4.2 Understanding the needs and expectations of interested parties\n * 4.3 The scope of the ISMS\n * 4.4 Information Security Management System process\n * 5.1 Commitment of the ISMS\n * 5.2 Information security policy\n * 5.3 Roles and their responsibilities (RACI/RASCI)\n * 6.1.2 Information security risk assessment and treatment process\n * 6.1.3 Information security risk treatment and assessment plan\n * 6.1.3 The Statement of Applicability\n * 6.2 Information security objectives\n * 6.3 Change Management for the ISMS\n * 7.1 Ressource planning\n * 7.3 Awareness plan\n * 7.4 Communication Plan\n * 7.2 Evidence of competence\n * 7.5 Document control policy\n * 5.5.1 Documented information determined by the organisation as being necessary for the effectiveness of the ISMS\n * 8.1 Operational planning and control\n * 8.2 Results of the information security risk assessment\n * 8.3 Results of the information security risk treatment\n * 9.1 Evidence of the monitoring and measurement of results\n * 9.2 A documented internal audit process\n * 9.2 Evidence of the audit programmes and the audit results\n * 9.3 Evidence of the results of management reviews\n * 10.1 Evidence of the nature of the', 'source': 'https://www.dataguard.co.uk/knowledge/iso-27001-certification/', 'title': 'ISO 27001 Certification: Your ultimate guide [free guide available]', 'relevance_score': 0.99135584}), Document(page_content='specific pieces of documentation you need to get iso 27001 certification, which will require additional time and resources.\nsome of the requirements include:\n4.3 the scope of the isms\n5.2 information security policy\n6.1.2 information security risk assessment process\n6.1.3 information security risk treatment plan\n6.1.3 the statement of applicability\n6.2 information security objectives\n7.5.3 control of documented information\n8.1 operational planning and control\n8.2 results of the information security risk assessment\n8.3 results of the information security risk treatment\n9.1 evidence of the monitoring and measurement of results\n9.2 an internal audit process\n9.2 evidence of the audit programs and the audit results\n9.3 evidence of the results of management reviews\n10.1 evidence of any non-conformities and corrective actions taken\nthink through the time it will take for your company to collect and organize all this information. every organization will be in a different place when it comes to managing and collecting these details.\ntraining\nas you take on this initiative, you’ll need to provide security awareness training to the people in your organization. in addition to the upfront cost of the training program, you’ll also need to factor in the time spent by your employees to complete their training and any downturn in productivity.\nestablishing new processes\nnew processes and controls will need to be implemented, some of which may be corrective actions that are critical to meet compliance. they', metadata={'description': 'Considering ISO 27001? Learn what you need to know about ISO 27001 certification costs and how they may vary for your organization.', 'doc_ID': 106, 'language': 'en', 'original_text': 'specific pieces of documentation you need to get ISO 27001 certification, which will require additional time and resources.\nSome of the requirements include:\n4.3 The scope of the ISMS\n5.2 Information security policy\n6.1.2 Information security risk assessment process\n6.1.3 Information security risk treatment plan\n6.1.3 The Statement of Applicability\n6.2 Information security objectives\n7.5.3 Control of documented information\n8.1 Operational planning and control\n8.2 Results of the information security risk assessment\n8.3 Results of the information security risk treatment\n9.1 Evidence of the monitoring and measurement of results\n9.2 An internal audit process\n9.2 Evidence of the audit programs and the audit results\n9.3 Evidence of the results of management reviews\n10.1 Evidence of any non-conformities and corrective actions taken\nThink through the time it will take for your company to collect and organize all this information. Every organization will be in a different place when it comes to managing and collecting these details.\nTraining\nAs you take on this initiative, you’ll need to provide security awareness training to the people in your organization. In addition to the upfront cost of the training program, you’ll also need to factor in the time spent by your employees to complete their training and any downturn in productivity.\nEstablishing New Processes\nNew processes and controls will need to be implemented, some of which may be corrective actions that are critical to meet compliance. They', 'source': 'https://www.drata.com/blog/iso-27001-certification-cost', 'title': 'Budgeting for ISO 27001: How Much Does Certification Cost?', 'relevance_score': 0.9879462})]","To determine the context within an organization as part of ISO 27001, the following information and documents should be collected:

1. External factors: This includes the operational environment, legal framework, financial aspects, technology usage and dependencies, suppliers and service providers, as well as social and cultural aspects, especially for internationally operating organizations. Competitive aspects such as the scope of activities, key success factors, image considerations, and relationships with clients, customers, and partners should also be considered.

2. Internal factors: This includes the organizational structure and processes, the purpose and scope of IT implementation, already implemented standards and other requirements such as management systems, documentation and results from previous security activities, available resources for the establishment of an ISMS, approaches to risk management (including other topics), as well as existing internal regulations on security topics and other areas such as quality management and project management.

It is important to compile all relevant information and documentation (in writing or electronically) on the topic of security in order to understand the organization's context.","To determine the context as part of ISO 27001 certification, an organization should collect information and documents related to its operations, environment, and stakeholders. This includes understanding the organization's business operations, management structure, locations, culture, and the situation within and outside the organization. Specific documents to be collected include those related to the organization's information security context, requirements, and scope, as well as the ISMS scope, management commitment, roles and responsibilities, risk and opportunity management, change management planning, resource planning, training, communication matrix, documentation management planning/policy, information security policies and guidelines, risk management procedure, Statement of Applicability (SoA), information security objectives, evidence of competence, and evidence of the organization's ISMS effectiveness. Mandatory documents required for ISO 27001 certification include those related to understanding the organization and its context, interested parties, the scope of the ISMS, information security management system process, management commitment, information security policy, roles and responsibilities, risk assessment and treatment process, risk treatment and assessment plan, Statement of Applicability, information security objectives, change management for the ISMS, resource planning, awareness plan, communication plan, evidence of competence, document control policy, operational",True,0.4593837535014006,0.14647887323943665,0.2352941176470588,0.45093733072280884,0.6804258897900581,0.9999370574951172,0.7620123498763365,0,0,2.4163413047790527,3.612044095993042,0.8149611949920654,6.028385400772095
Fine-tuned_finetuned-ISO-27001_1024_l2_All_1536_264_False,Hybrid_Rerank_Cohere,4,mixtral-8x7B-v0.1,16000,0,1,How can responsibilities for compliance with ISO 27001 and monitoring of the ISMS be established within an organization?,"[Document(page_content=""/ management demonstrating leadership and commitment to information\nsecurity.\nthis is because senior management is ultimately responsible for the\norganisation's information security.\nby demonstrating leadership and commitment, senior management can help to\ncreate a culture of information security within the organisation and ensure\nthat everyone is committed to protecting the organisation's information\nassets.\nhere are some of the specific reasons why iso 27001 clause 5.1 is important\nand what it can help with:\n * ensure that the organisation has an effective information security management system (isms) in place. * help to protect the organisation's information assets from unauthorized access, use, disclosure, modification, or destruction. * aid in how to comply with legal and regulatory requirements. * to reduce the risk of financial losses, reputational damage, and business disruption. * improve the organisation's overall security posture.\n## who is responsible for iso 27001 clause 5.1?\nthe responsibility for iso 27001 clause 5.1 ultimately lies with top\nmanagement. however, all employees in the organisation have a role to play in\nensuring the organisation's information security.\nspecifically, top management is responsible for:\n * taking accountability for the effectiveness of the isms. * ensuring that the isms policy and objectives are established and are compatible with the organisation's context and strategic direction. * integrating the isms into"", metadata={'description': 'Learn how to demonstrate leadership and commitment to information security in accordance with ISO 27001:2022 Clause 5.1.', 'doc_ID': 215, 'language': 'en-gb', 'original_text': ""/ management demonstrating leadership and commitment to information\nsecurity.\nThis is because senior management is ultimately responsible for the\norganisation's information security.\nBy demonstrating leadership and commitment, senior management can help to\ncreate a culture of information security within the organisation and ensure\nthat everyone is committed to protecting the organisation's information\nassets.\nHere are some of the specific reasons why ISO 27001 Clause 5.1 is important\nand what it can help with:\n * Ensure that the organisation has an effective information security management system (ISMS) in place. * Help to protect the organisation's information assets from unauthorized access, use, disclosure, modification, or destruction. * Aid in how to comply with legal and regulatory requirements. * To reduce the risk of financial losses, reputational damage, and business disruption. * Improve the organisation's overall security posture.\n## Who is responsible for ISO 27001 Clause 5.1?\nThe responsibility for ISO 27001 Clause 5.1 ultimately lies with top\nmanagement. However, all employees in the organisation have a role to play in\nensuring the organisation's information security.\nSpecifically, top management is responsible for:\n * Taking accountability for the effectiveness of the ISMS. * Ensuring that the ISMS policy and objectives are established and are compatible with the organisation's context and strategic direction. * Integrating the ISMS into"", 'source': 'https://www.dataguard.co.uk/knowledge/iso-27001/clause-5-1-leadership-and-commitment/', 'title': 'ISO 27001 Clause 5.1: Leadership and Commitment', 'relevance_score': 0.99610037}), Document(page_content='# iso 27001 compliance checklist\n **\u200d** iso 27001 is the global gold standard for ensuring the security of\ninformation and its supporting assets. obtaining iso 27001 certification can\nhelp an organization prove its security practices to potential customers\nanywhere in the world. \u200d our iso 27001 checklist:\n1\ndevelop a roadmap for successful implementation of an isms and iso 27001\ncertification\nimplement plan, do, check, act (pdca) process to recognize challenges and\nidentify gaps for remediation\nconsider iso 27001 certification costs relative to org size and number of\nemployees\nclearly define scope of work to plan certification time to completion\nselect an iso 27001 auditor\n2\nset the scope of your organization’s isms\ndecide which business areas are covered by the isms and which are out of scope\nconsider additional security controls for business processes that are required\nto pass isms-protected information across the trust boundary\ninform stakeholders regarding scope of the isms\n3\nestablish an isms governing body\nbuild a governance team with management oversight\nincorporate key members of top management, e.g. senior leadership and\nexecutive management with responsibility for strategy and resource allocation\n4\nconduct an inventory of information assets\nconsider all assets where information is stored, processed, and accessible\n\u200d\n * record information assets: data and people\n * record physical assets: laptops, servers, and physical building locations\n * record intangible assets:', metadata={'description': 'Our ISO 27001 compliance checklist will help simplify your path to compliance.', 'doc_ID': 8, 'language': 'en', 'original_text': '# ISO 27001 compliance checklist\n **\u200d** ISO 27001 is the global gold standard for ensuring the security of\ninformation and its supporting assets. Obtaining ISO 27001 certification can\nhelp an organization prove its security practices to potential customers\nanywhere in the world. \u200d Our ISO 27001 checklist:\n1\nDevelop a roadmap for successful implementation of an ISMS and ISO 27001\ncertification\nImplement Plan, Do, Check, Act (PDCA) process to recognize challenges and\nidentify gaps for remediation\nConsider ISO 27001 certification costs relative to org size and number of\nemployees\nClearly define scope of work to plan certification time to completion\nSelect an ISO 27001 auditor\n2\nSet the scope of your organization’s ISMS\nDecide which business areas are covered by the ISMS and which are out of scope\nConsider additional security controls for business processes that are required\nto pass ISMS-protected information across the trust boundary\nInform stakeholders regarding scope of the ISMS\n3\nEstablish an ISMS governing body\nBuild a governance team with management oversight\nIncorporate key members of top management, e.g. senior leadership and\nexecutive management with responsibility for strategy and resource allocation\n4\nConduct an inventory of information assets\nConsider all assets where information is stored, processed, and accessible\n\u200d\n * Record information assets: data and people\n * Record physical assets: laptops, servers, and physical building locations\n * Record intangible assets:', 'source': 'https://www.vanta.com/resources/iso-27001-compliance-checklist', 'title': 'The ISO 27001 compliance checklist', 'relevance_score': 0.9960083}), Document(page_content='of iso 27001 is assigning responsibility\nto an isms owner who is responsible for ensuring compliance with the standard\nand reporting to top management. identify the owner and assign responsibility\nin order to drive the effort forward.\n\u200d\n **2\\. determine where you stand**\nbefore you can start updating and fortifying your security system to meet iso\n27001 compliance, you need to know which boxes you already check and which\nones you need to address. while some companies do this with a time-consuming\nmanual assessment, a more thorough and time-saving way is to use a compliance\nautomation software like vanta.\n vanta scans and evaluates your isms, comparing it against the iso 27001\ncontrols. it gives you a clear picture of the standards you’ve already met\nand, most importantly, a clear list of the controls and policies you need to\nimplement to reach the compliance level you need.\n\u200d\n **3\\. implement the needed security controls and protocols**\nusing your vanta report as a guide, your team can now begin implementing all\nthe controls and protocols you’re missing one by one. some of these may be\nquick while others may require a project of their own, like developing\nsecurity protocols for staff to follow and training all staff members on those\nprotocols.\n\u200d\n **4\\. re-assess your readiness**\nafter you’ve followed vanta’s guide and implemented the security controls you\nwere missing, it’s time to check your work. run a vanta scan again to assess\nwhere you now stand with your compliance readiness. ideally, it', metadata={'description': 'Need to get ISO 27001 certified? Find out what you can expect from the ISO 27001 certification process from security compliance experts.', 'doc_ID': 14, 'language': 'en', 'original_text': 'of ISO 27001 is assigning responsibility\nto an ISMS owner who is responsible for ensuring compliance with the standard\nand reporting to top management. Identify the owner and assign responsibility\nin order to drive the effort forward.\n\u200d\n **2\\. Determine where you stand**\nBefore you can start updating and fortifying your security system to meet ISO\n27001 compliance, you need to know which boxes you already check and which\nones you need to address. While some companies do this with a time-consuming\nmanual assessment, a more thorough and time-saving way is to use a compliance\nautomation software like Vanta.\n Vanta scans and evaluates your ISMS, comparing it against the ISO 27001\ncontrols. It gives you a clear picture of the standards you’ve already met\nand, most importantly, a clear list of the controls and policies you need to\nimplement to reach the compliance level you need.\n\u200d\n **3\\. Implement the needed security controls and protocols**\nUsing your Vanta report as a guide, your team can now begin implementing all\nthe controls and protocols you’re missing one by one. Some of these may be\nquick while others may require a project of their own, like developing\nsecurity protocols for staff to follow and training all staff members on those\nprotocols.\n\u200d\n **4\\. Re-assess your readiness**\nAfter you’ve followed Vanta’s guide and implemented the security controls you\nwere missing, it’s time to check your work. Run a Vanta scan again to assess\nwhere you now stand with your compliance readiness. Ideally, it', 'source': 'https://www.vanta.com/resources/how-long-does-it-take-to-get-iso-certified', 'title': 'What is the ISO certification timeline?', 'relevance_score': 0.9954616}), Document(page_content='# iso 27001 clause 5.3: organisational roles, responsibilities and authorities\nclause 5.3 of iso 27001 addresses the organisational roles, responsibilities,\nand authorities (or&as) for information security. this clause requires\norganisations to define and assign the or&as for all aspects of their isms.\n### iso 27001:2022 clause 5.3 organisational roles, responsibilities and\nauthorities top management shall ensure that the responsibilities and authorities for\nroles relevant to information security are assigned and communicated within\nthe organisation.\n### top management shall assign the responsibility and authority for:\n * ensuring that the information security management system conforms to the requirements of this document. * reporting on the performance of the information security management system to top management. ## what is the 5th clause of iso 27001?\nthe 5th clause of iso 27001 is titled ""management responsibility"". this clause\nrequires organisations to demonstrate leadership and commitment to information\nsecurity. it also requires organisations to appoint a management\nrepresentative to oversee the implementation and maintenance of the isms.\n### get iso 27001 certified in as little as 3 months.\n### your iso 27001 certification process made simple.\n* * *\n download your free guide to fast & sustainable certification\ndownload your free guide\n## what are the requirements of iso 27001 clause 5.3?\nthe specific requirements of iso 27001 clause 5.3 are as follows:\n * top', metadata={'description': 'ISO 27001 Clause 5.3 defines the requirements for defining and assigning organisational roles, responsibilities, and authorities for information security.', 'doc_ID': 221, 'language': 'en-gb', 'original_text': '# ISO 27001 Clause 5.3: Organisational roles, responsibilities and authorities\nClause 5.3 of ISO 27001 addresses the organisational roles, responsibilities,\nand authorities (OR&As) for information security. This clause requires\norganisations to define and assign the OR&As for all aspects of their ISMS.\n### ISO 27001:2022 Clause 5.3 Organisational roles, responsibilities and\nauthorities Top management shall ensure that the responsibilities and authorities for\nroles relevant to information security are assigned and communicated within\nthe organisation.\n### Top management shall assign the responsibility and authority for:\n * Ensuring that the information security management system conforms to the requirements of this document. * Reporting on the performance of the information security management system to top management. ## What is the 5th clause of ISO 27001?\nThe 5th clause of ISO 27001 is titled ""Management Responsibility"". This clause\nrequires organisations to demonstrate leadership and commitment to information\nsecurity. It also requires organisations to appoint a management\nrepresentative to oversee the implementation and maintenance of the ISMS.\n### Get ISO 27001 certified in as little as 3 months.\n### Your ISO 27001 certification process made simple.\n* * *\n Download your free guide to fast & sustainable certification\nDownload your free guide\n## What are the requirements of ISO 27001 Clause 5.3?\nThe specific requirements of ISO 27001 Clause 5.3 are as follows:\n * Top', 'source': 'https://www.dataguard.co.uk/knowledge/iso-27001/clause-5-3-organisational-roles-responsibilities-and-authorities/', 'title': 'ISO 27001 Clause 5.3: Roles, Responsibilities and Authorities', 'relevance_score': 0.9951703})]","To establish responsibilities for compliance with ISO 27001 and monitoring of the ISMS within an organization, the top management should define roles, tasks, and authorities. This should include designating a responsible person for compliance with ISO 27001 and a person for reporting on the performance and effectiveness of the ISMS. Additionally, all roles and responsibilities within the organization should be communicated, for example, through a policy or training events.","ISO 27001 Clause 5.1 emphasizes the responsibility of top management in establishing, implementing, maintaining, and continually improving an organization's Information Security Management System (ISMS). To comply with this clause, an organization should:

1. Define the ISMS scope and context, considering legal, regulatory, and contractual requirements.
2. Establish an ISMS governing body with top management oversight, including key members responsible for strategy and resource allocation.
3. Assign an ISMS owner responsible for ensuring compliance with the standard and reporting to top management.
4. Communicate roles, responsibilities, and authorities for information security to all relevant personnel.
5. Define and document ISMS policies and objectives that align with the organization's strategic direction.

To monitor the ISMS, organizations can establish key performance indicators (KPIs) and key risk indicators (KRIs) to track and evaluate the effectiveness of the ISMS. Regular internal audits and management reviews can also help ensure that the ISMS remains relevant and effective.

In summary, ISO 27001 Clause 5.1 requires top management to take accountability for the ISMS and ensure that information security is integrated",True,0.3902439024390244,0.11475409836065574,0.21138211382113822,0.5082114934921265,0.8775224685668945,0.9984713196754456,0.7512843445469221,0,0,2.1893198490142822,3.655761241912842,0.7715542316436768,5.845081090927124
Fine-tuned_finetuned-ISO-27001_1024_l2_All_1536_264_False,Hybrid_Rerank_Cohere,4,mixtral-8x7B-v0.1,16000,0,1,What are important components inside an ISMS to manage opportunities and risks according to the topic 6.1 (risk and opportunity management)?,"[Document(page_content=""of these risks and opportunities. * treat the risks and opportunities in a way that is proportionate to the risks involved. * monitor and review the effectiveness of their risk management processes.\nread conducting iso 27001 risk assessment in 7 steps for more information.\n## what does iso 27001 requirement 6.1 cover?\niso 27001 requirement 6.1 covers the following topics:\n * the need to plan for the identification, assessment, and treatment of risks and opportunities to information security. * the need to consider the organisation's context and the needs and expectations of interested parties when planning for risk management. * the need to establish and maintain a risk management process that is appropriate to the organisation's size, complexity, and nature of its activities. * the need to document the risk management process and the results of risk assessments. * the need to review and update the risk management process on a regular basis.\n## how to identify, assess and treat information security risks\nalthough not necessarily common practice — scenario-based risk identification\nand assessment is one of the most effective and well-established ways to\nmanage risks. not only does it consider past occurrences, but it also takes a\npreventive approach to risk management. this is a more holistic approach that\ncovers all potential scenarios.\nstep 1: identify and assess risks\nstep 2: create a treatment plan\nstep 3: review residual risks\n ###"", metadata={'source': 'https://www.dataguard.co.uk/knowledge/iso-27001/clause-6-1-actions-to-address-risks-and-opportunities/', 'title': 'ISO 27001 Clause 6.1: Information security objectives', 'description': ""Understand ISO 27001 clause 6.1: Detailing how security objectives align with an organisation's business goals for robust information protection."", 'language': 'en-gb', 'original_text': ""of these risks and opportunities. * Treat the risks and opportunities in a way that is proportionate to the risks involved. * Monitor and review the effectiveness of their risk management processes.\nRead Conducting ISO 27001 risk assessment in 7 steps for more information.\n## What does ISO 27001 requirement 6.1 cover?\nISO 27001 requirement 6.1 covers the following topics:\n * The need to plan for the identification, assessment, and treatment of risks and opportunities to information security. * The need to consider the organisation's context and the needs and expectations of interested parties when planning for risk management. * The need to establish and maintain a risk management process that is appropriate to the organisation's size, complexity, and nature of its activities. * The need to document the risk management process and the results of risk assessments. * The need to review and update the risk management process on a regular basis.\n## How to identify, assess and treat information security risks\nAlthough not necessarily common practice — scenario-based risk identification\nand assessment is one of the most effective and well-established ways to\nmanage risks. Not only does it consider past occurrences, but it also takes a\npreventive approach to risk management. This is a more holistic approach that\ncovers all potential scenarios.\nStep 1: Identify and assess risks\nStep 2: Create a treatment plan\nStep 3: Review residual risks\n ###"", 'doc_ID': 225, 'relevance_score': 0.98054343}), Document(page_content='27001 risk assessment.\n## 6\\. risk management\nrisk management is a core part of any isms. after all, it’s no good\nidentifying and prioritising information security threats if you’re unable to\ndeal with them effectively.\nthis stage isn’t about managing risks themselves but establishing how you’ll\napproach the task. there are several ways you can do this, but most methods\ninvolve looking at risks to specific assets or risks presented in specific\nscenarios.\nhowever you go about the task, the risk assessment process is crucial. after\nidentifying, evaluating and assigning values to your threats, you’ll know\nwhich risks pose the biggest problem.\nyou should take those and determine whether to:\n * treat the risk by applying information security controls laid out in iso 27001; * terminate the risk by avoiding it entirely;\n * share the risk (with an insurance policy or via an agreement with other parties); or\n * accept the risk (if it doesn’t pose a significant threat).\nany risks that you treat should be documented in an soa (statement of\napplicability). this should explain which of the standard’s controls you’ve\nselected and omitted and why you made those choices.\n## 7\\. implement the risk treatment plan\nnow it’s time to implement your risk treatment plan. to ensure these controls\nare effective, you will need to check that staff are able to operate or\ninteract with the controls, and that they are aware of their information\nsecurity obligations.\nyou will also need to develop a process to determine,', metadata={'description': 'ISO 27001 explains the compliance requirements you need to meet, but it doesn’t show you how to implement them.\xa0This blog fills in what you need to know', 'doc_ID': 33, 'language': 'en-GB', 'original_text': '27001 risk assessment.\n## 6\\. Risk management\nRisk management is a core part of any ISMS. After all, it’s no good\nidentifying and prioritising information security threats if you’re unable to\ndeal with them effectively.\nThis stage isn’t about managing risks themselves but establishing how you’ll\napproach the task. There are several ways you can do this, but most methods\ninvolve looking at risks to specific assets or risks presented in specific\nscenarios.\nHowever you go about the task, the risk assessment process is crucial. After\nidentifying, evaluating and assigning values to your threats, you’ll know\nwhich risks pose the biggest problem.\nYou should take those and determine whether to:\n * Treat the risk by applying information security controls laid out in ISO 27001; * Terminate the risk by avoiding it entirely;\n * Share the risk (with an insurance policy or via an agreement with other parties); or\n * Accept the risk (if it doesn’t pose a significant threat).\nAny risks that you treat should be documented in an SoA (Statement of\nApplicability). This should explain which of the Standard’s controls you’ve\nselected and omitted and why you made those choices.\n## 7\\. Implement the risk treatment plan\nNow it’s time to implement your risk treatment plan. To ensure these controls\nare effective, you will need to check that staff are able to operate or\ninteract with the controls, and that they are aware of their information\nsecurity obligations.\nYou will also need to develop a process to determine,', 'source': 'https://www.itgovernance.eu/blog/en/a-9-step-guide-to-implementing-iso-27001', 'title': 'How to Implement ISO 27001: A 9-Step Guide - IT Governance Blog En', 'relevance_score': 0.9769787}), Document(page_content='not a one-off activity\nsolely during implementation.\n3.7 clause 6 planning\nrelevant toolkit documents\ne information security objectives and plan\ne risk assessment and treatment process\n page 27 of 79\niso/iec 27001 implementation guide\ne risk assessment report\ne risk treatment plan\ne isms change process\ne isms change log\ne asset-based risk assessment and treatment tool\ne statement of applicability\ne scenario-based risk assessment and treatment tool\ne opportunity assessment tool\noptional add-on (available at additional cost via our website)\ne {18027001 statement of applicability (full 1so-text version)\nnote: the above option is part of the /so27001 enhanced gap assessment tool.\n3.7.1 clause 6.1 actions to address risks and opportunities\nthe general ethos of the iso/iec 27001 standard is to be proactive in managing information\nsecurity and a central concept to this is risk assessment. this involves considering what\ncould go wrong and then taking steps to do something about it in advance rather than\nwaiting for it to happen. the standard points out that not everything that happens is\nnecessarily negative and that there may be positive “opportunities” along the way too.\nthe whole idea of a risk-based approach is that the amount you spend on controls is\nappropriate to your level of risk and takes account of how much risk you are prepared to\nlive with. risk is very much a spectrum as the wider debate on “privacy versus security”\nshows and your organization will need to take a considered approach to', metadata={'source': 'CERTIKIT_ISO27001_Implementation_Guide_v12.pdf.pdf', 'title': 'CERTIKIT_ISO27001_Implementation_Guide_v12.pdf', 'original_text': 'not a one-off activity\nsolely during implementation.\n3.7 Clause 6 Planning\nRelevant Toolkit documents\ne Information Security Objectives and Plan\ne Risk Assessment and Treatment Process\n Page 27 of 79\nISO/IEC 27001 Implementation Guide\ne Risk Assessment Report\ne Risk Treatment Plan\ne ISMS Change Process\ne ISMS Change Log\ne Asset-Based Risk Assessment and Treatment Tool\ne Statement of Applicability\ne Scenario-Based Risk Assessment and Treatment Tool\ne Opportunity Assessment Tool\nOptional Add-On (available at additional cost via our website)\ne {18027001 Statement of Applicability (Full 1SO-text version)\nNote: The above option is part of the /SO27001 Enhanced Gap Assessment Tool.\n3.7.1 Clause 6.1 Actions to address risks and opportunities\nThe general ethos of the ISO/IEC 27001 standard is to be proactive in managing information\nsecurity and a central concept to this is risk assessment. This involves considering what\ncould go wrong and then taking steps to do something about it in advance rather than\nwaiting for it to happen. The standard points out that not everything that happens is\nnecessarily negative and that there may be positive “opportunities” along the way too.\nThe whole idea of a risk-based approach is that the amount you spend on controls is\nappropriate to your level of risk and takes account of how much risk you are prepared to\nlive with. Risk is very much a spectrum as the wider debate on “privacy versus security”\nshows and your organization will need to take a considered approach to', 'doc_ID': 878, 'relevance_score': 0.9687381}), Document(page_content='in its entirety. therefore, the method of announcement should be documented and its execution recorded!\nit is easy to see: the management of responsibilities (roles, authorities, personnel assignment, if necessary further training) is an important process in the isms.\nconclusion on the standard chapter isms-5\nthis standard chapter places requirements on the management level of the organization regarding information security to demonstrate good leadership and to actively participate in the processes of the isms to a significant extent. in other words, without intensive involvement of the management level, an isms is unlikely to be successful.\nthe management of the policy and responsibilities are to be mentioned here as processes of the isms: the requirements from section 1.4 on the keywords processes and isms and scope apply to them.\nachieve, unwanted effects\non the organization can be avoided (at least reduced) - and the isms is continuously\nimproved.\nwhat does the term ""chances"" mean here:\nwhile risks can have negative effects on the organization, chances are factors that can have a positive impact on the organization. in principle, both directions should be considered in all analyses. however, in the further requirements from isms-6.1.2 onwards, only risks are mentioned. this corresponds to common practice. therefore, our explanations in section 1.4 on the topic of risks do not explicitly address chances either. however, if you still want to consider chances explicitly in the analyses - no problem:', metadata={'source': 'ISO 27001_2022_Kersten_und_Schroeder.pdf', 'title': 'ISO 27001_2022_Kersten_und_Schroeder', 'original_text': 'in its entirety. Therefore, the method of announcement should be documented and its execution recorded!\nIt is easy to see: The management of responsibilities (roles, authorities, personnel assignment, if necessary further training) is an important process in the ISMS.\nConclusion on the standard chapter ISMS-5\nThis standard chapter places requirements on the management level of the organization regarding information security to demonstrate good leadership and to actively participate in the processes of the ISMS to a significant extent. In other words, without intensive involvement of the management level, an ISMS is unlikely to be successful.\nThe management of the policy and responsibilities are to be mentioned here as processes of the ISMS: The requirements from section 1.4 on the keywords processes and ISMS and scope apply to them.\nachieve, unwanted effects\non the organization can be avoided (at least reduced) - and the ISMS is continuously\nimproved.\nWhat does the term ""chances"" mean here:\nWhile risks can have negative effects on the organization, chances are factors that can have a positive impact on the organization. In principle, both directions should be considered in all analyses. However, in the further requirements from ISMS-6.1.2 onwards, only risks are mentioned. This corresponds to common practice. Therefore, our explanations in section 1.4 on the topic of risks do not explicitly address chances either. However, if you still want to consider chances explicitly in the analyses - no problem:', 'doc_ID': 2617, 'relevance_score': 0.94938856})]","Important ISMS components for managing opportunities and risks according to Theme 6.1 include:

Compliance Management: Capturing and fulfilling conditions and expectations, including determining measures and regular updates.

Risk management: Identifying, assessing, and treating risks, with repeated steps until acceptance.

Asset management: Capturing and updating the organization's information values.

Process landscape and security analysis: Structuring business activities as a process landscape, securing processes, including IT components.
Continuous improvement: Integrating the goal of continuous improvement, e.g., through the PDCA model.

These components are fundamental to the ISMS and meet the requirements of Section 6.1. Planning often results in documents such as the ISMS guideline or ISMS description.","ISO 27001 requirement 6.1, which covers risk and opportunity management, is a crucial part of an Information Security Management System (ISMS). The process involves identifying, assessing, and treating information security risks in a way that is proportionate to the risks involved. This is achieved by planning for the identification, assessment, and treatment of risks and opportunities, considering the organization's context and the needs and expectations of interested parties.

The risk management process should be established and maintained, and it should be appropriate to the organization's size, complexity, and nature of its activities. The results of risk assessments should be documented, and the risk management process should be reviewed and updated on a regular basis.

To identify and assess information security risks, a scenario-based risk identification and assessment approach is recommended. This approach considers past occurrences and takes a preventive approach to risk management, covering all potential scenarios. The risk assessment process is crucial as it helps to determine which risks pose the biggest problem. Once the risks have been identified, evaluated, and assigned values, a treatment plan should be created. The risks can then be treated, terminated, shared, or accepted, depending on their significance.

Risk treatment should be documented in",True,0.36421725239616615,0.06430868167202572,0.17252396166134185,0.41107022762298584,0.6945528388023376,0.9985337257385254,0.681584707257431,0,0,2.1662447452545166,3.76399827003479,0.735004186630249,5.930243015289307
Fine-tuned_finetuned-ISO-27001_1024_l2_All_1536_264_False,Hybrid_Rerank_Cohere,4,mixtral-8x7B-v0.1,16000,0,1,How can risks for an ISMS be classified and treated using criteria?,"[Document(page_content='27001 risk assessment.\n## 6\\. risk management\nrisk management is a core part of any isms. after all, it’s no good\nidentifying and prioritising information security threats if you’re unable to\ndeal with them effectively.\nthis stage isn’t about managing risks themselves but establishing how you’ll\napproach the task. there are several ways you can do this, but most methods\ninvolve looking at risks to specific assets or risks presented in specific\nscenarios.\nhowever you go about the task, the risk assessment process is crucial. after\nidentifying, evaluating and assigning values to your threats, you’ll know\nwhich risks pose the biggest problem.\nyou should take those and determine whether to:\n * treat the risk by applying information security controls laid out in iso 27001; * terminate the risk by avoiding it entirely;\n * share the risk (with an insurance policy or via an agreement with other parties); or\n * accept the risk (if it doesn’t pose a significant threat).\nany risks that you treat should be documented in an soa (statement of\napplicability). this should explain which of the standard’s controls you’ve\nselected and omitted and why you made those choices.\n## 7\\. implement the risk treatment plan\nnow it’s time to implement your risk treatment plan. to ensure these controls\nare effective, you will need to check that staff are able to operate or\ninteract with the controls, and that they are aware of their information\nsecurity obligations.\nyou will also need to develop a process to determine,', metadata={'description': 'ISO 27001 explains the compliance requirements you need to meet, but it doesn’t show you how to implement them.\xa0This blog fills in what you need to know', 'doc_ID': 33, 'language': 'en-GB', 'original_text': '27001 risk assessment.\n## 6\\. Risk management\nRisk management is a core part of any ISMS. After all, it’s no good\nidentifying and prioritising information security threats if you’re unable to\ndeal with them effectively.\nThis stage isn’t about managing risks themselves but establishing how you’ll\napproach the task. There are several ways you can do this, but most methods\ninvolve looking at risks to specific assets or risks presented in specific\nscenarios.\nHowever you go about the task, the risk assessment process is crucial. After\nidentifying, evaluating and assigning values to your threats, you’ll know\nwhich risks pose the biggest problem.\nYou should take those and determine whether to:\n * Treat the risk by applying information security controls laid out in ISO 27001; * Terminate the risk by avoiding it entirely;\n * Share the risk (with an insurance policy or via an agreement with other parties); or\n * Accept the risk (if it doesn’t pose a significant threat).\nAny risks that you treat should be documented in an SoA (Statement of\nApplicability). This should explain which of the Standard’s controls you’ve\nselected and omitted and why you made those choices.\n## 7\\. Implement the risk treatment plan\nNow it’s time to implement your risk treatment plan. To ensure these controls\nare effective, you will need to check that staff are able to operate or\ninteract with the controls, and that they are aware of their information\nsecurity obligations.\nYou will also need to develop a process to determine,', 'source': 'https://www.itgovernance.eu/blog/en/a-9-step-guide-to-implementing-iso-27001', 'title': 'How to Implement ISO 27001: A 9-Step Guide - IT Governance Blog En', 'relevance_score': 0.9803562}), Document(page_content='of the procedure, its good or easy applicability, the specific definition of criteria, classes, and levels - taking into account previous experiences.\nisms-6.1.3 - information security risk treatment\nnow we come to the question of risk treatment. the standard proposes a structured approach with the following steps (a) to (f).\n(a) for each risk assessed according to isms-6.1, a fundamental treatment option should be selected.\nin section 1.4 (keyword risk treatment), we have discussed the classic examples of such options in more detail, so we will only list them briefly here.\n- acceptance: the risk in question is accepted without any further measures.\n- transfer: a risky activity is transferred to a safer location or, for example, to a qualified service provider.\n- mitigation: the risk is addressed through measures within the organization. the measures can come from all areas (organizational, personnel, infrastructure, technology).\n- restructuring or reconstruction: a risky process is appropriately restructured or reconstructed - with the aim of replacing the questionable components or involved assets with those with lower risks.\n- termination: the decision is made to completely terminate a particularly critical business process.\nin the context of a real isms, of course, additional treatment options may be available. it also happens that one or the other option from our list is excluded by the organization - e.g. outsourcing to a service provider - due to high security concerns or high costs.\ntherefore,', metadata={'doc_ID': 2623, 'original_text': 'of the procedure, its good or easy applicability, the specific definition of criteria, classes, and levels - taking into account previous experiences.\nISMS-6.1.3 - Information Security Risk Treatment\nNow we come to the question of risk treatment. The standard proposes a structured approach with the following steps (a) to (f).\n(a) For each risk assessed according to ISMS-6.1, a fundamental treatment option should be selected.\nIn section 1.4 (keyword risk treatment), we have discussed the classic examples of such options in more detail, so we will only list them briefly here.\n- Acceptance: The risk in question is accepted without any further measures.\n- Transfer: A risky activity is transferred to a safer location or, for example, to a qualified service provider.\n- Mitigation: The risk is addressed through measures within the organization. The measures can come from all areas (organizational, personnel, infrastructure, technology).\n- Restructuring or reconstruction: A risky process is appropriately restructured or reconstructed - with the aim of replacing the questionable components or involved assets with those with lower risks.\n- Termination: The decision is made to completely terminate a particularly critical business process.\nIn the context of a real ISMS, of course, additional treatment options may be available. It also happens that one or the other option from our list is excluded by the organization - e.g. outsourcing to a service provider - due to high security concerns or high costs.\nTherefore,', 'source': 'ISO 27001_2022_Kersten_und_Schroeder.pdf', 'title': 'ISO 27001_2022_Kersten_und_Schroeder', 'relevance_score': 0.9789956}), Document(page_content='are assessed in terms of their impact on the organization.\nthis is usually done in the form of rating levels with descriptive names such as tolerable, moderate, serious, catastrophic. based on the above risk table, a rating of entire risk classes can be made by marking individual fields (see figure 1.8), and the assessment of individual risks can be done in a similar way.\nrisks can be individually adjusted afterwards.\nthe three steps of risk identification, risk analysis, and risk evaluation are summarized in the standard as risk assessment.\nrisk level\n(1 negligible\noo limited\noc critical\ndamage class\ngb catastrophic\nfig.1.8 risk assessment\n24 1 the iso/iec 27000 series of standards and their basic concepts\n18. risk treatment\nrisks must be prioritized for processing and treated with appropriate measures.\nif risks are sorted according to their risk level, a natural order of processing emerges: risks with the highest level are processed first, then those of the second level, etc. at the lowest level, it should be considered whether there is anything to be processed at all: the term tolerable says it all - at least in our example.\nfor the treatment of risks, a treatment option is first requested. the classic options are:\ne acceptance: the risk in question is accepted without further measures. this may be justified by the acceptance criteria according to isms-6.1.2 point (a) - or, for example, the management level has decided to accept the risk in individual cases. such a management decision may also', metadata={'doc_ID': 2570, 'original_text': 'are assessed in terms of their impact on the organization.\nThis is usually done in the form of rating levels with descriptive names such as TOLERABLE, MODERATE, SERIOUS, CATASTROPHIC. Based on the above risk table, a rating of entire risk classes can be made by marking individual fields (see Figure 1.8), and the assessment of individual risks can be done in a similar way.\nRisks can be individually adjusted afterwards.\nThe three steps of risk identification, risk analysis, and risk evaluation are summarized in the standard as risk assessment.\nRisk level\n(1 negligible\nOO limited\nOC critical\nDamage class\nGB catastrophic\nFig.1.8 Risk assessment\n24 1 The ISO/IEC 27000 series of standards and their basic concepts\n18. Risk treatment\nRisks must be prioritized for processing and treated with appropriate measures.\nIf risks are sorted according to their risk level, a natural order of processing emerges: risks with the highest level are processed first, then those of the second level, etc. At the lowest level, it should be considered whether there is anything to be processed at all: the term TOLERABLE says it all - at least in our example.\nFor the treatment of risks, a treatment option is first requested. The classic options are:\ne Acceptance: The risk in question is accepted without further measures. This may be justified by the acceptance criteria according to ISMS-6.1.2 point (a) - or, for example, the management level has decided to accept the risk in individual cases. Such a management decision may also', 'source': 'ISO 27001_2022_Kersten_und_Schroeder.pdf', 'title': 'ISO 27001_2022_Kersten_und_Schroeder', 'relevance_score': 0.9565531}), Document(page_content='certain circumstances so if these don’t\napply to your organization (or your isms scope) then it is acceptable to state that you are\nnot implementing them. examples might be that control! a.6.7 remote working may not\napply if you have no remote workers or control! a.8.28 secure coding may not be relevant if\nno software development takes place.\nthe key point to remember in treating risk is that it is a trade-off. few organizations have\nlimitless funds and so the money spent in treating risk needs to result in a larger benefit\nthan the cost. there are many ways of performing this kind of “quantitative” analysis so that\nthe potential loss from a risk can be expressed in financial terms. the methods used in the\ntoolkit are “qualitative” in that they simply categorize the risks; if your organization wishes\nto use more detailed quantitative methods to assess risk loss against cost of treatment then\nthat is perfectly acceptable within the iso/iec 27001 standard.\ndon’t forget to consider the positive aspects of risk i.e. opportunities. the standard requires\nthat these are considered, so that you’re as ready as possible if some good news comes your\nway. the opportunity assessment tool provides a way to document and assess these, with\nresulting preparation actions.\n3.7.2 clause 6.2 information security objectives and planning to achieve\nthem\nwithin the planning section of the standard we need to set out what the isms is intended to\nachieve and how it will be done. in terms of the isms there are two main levels', metadata={'doc_ID': 883, 'original_text': 'certain circumstances so if these don’t\napply to your organization (or your ISMS scope) then it is acceptable to state that you are\nnot implementing them. Examples might be that Control! A.6.7 Remote working may not\napply if you have no remote workers or Control! A.8.28 Secure coding may not be relevant if\nno software development takes place.\nThe key point to remember in treating risk is that it is a trade-off. Few organizations have\nlimitless funds and so the money spent in treating risk needs to result in a larger benefit\nthan the cost. There are many ways of performing this kind of “quantitative” analysis so that\nthe potential loss from a risk can be expressed in financial terms. The methods used in the\nToolkit are “qualitative” in that they simply categorize the risks; if your organization wishes\nto use more detailed quantitative methods to assess risk loss against cost of treatment then\nthat is perfectly acceptable within the ISO/IEC 27001 standard.\nDon’t forget to consider the positive aspects of risk i.e. opportunities. The standard requires\nthat these are considered, so that you’re as ready as possible if some good news comes your\nway. The Opportunity Assessment Tool provides a way to document and assess these, with\nresulting preparation actions.\n3.7.2 Clause 6.2 Information security objectives and planning to achieve\nthem\nWithin the planning section of the standard we need to set out what the ISMS is intended to\nachieve and how it will be done. In terms of the ISMS there are two main levels', 'source': 'CERTIKIT_ISO27001_Implementation_Guide_v12.pdf.pdf', 'title': 'CERTIKIT_ISO27001_Implementation_Guide_v12.pdf', 'relevance_score': 0.9494823})]","Risks for an ISMS can be classified and addressed according to established criteria. The criteria include:

Classification:
Hierarchical Classes: Risks can be categorized into hierarchical classes, for example, based on the magnitude of the risk.

Non-hierarchical Classes: Alternatively, non-hierarchical classes can be introduced, such as distinguishing between financial and reputation damages.

Evaluation:
After classification, it is crucial to assess the impact of a risk on the organization. This involves introducing hierarchical evaluation levels ranging from negligible or tolerable to catastrophic.

Risk Treatment:
Risk acceptance rules for tolerable risks.
Measures for extreme risks, including direct communication with the leadership.

Options for treating risks between extremes, such as outsourcing to service providers or preferences for specific types of measures.
The specific details of these criteria, classes, levels, and rules are the responsibility of each organization.",In ISO 2,True,0.0,0.0,0.0,0.05740348994731903,0.058900884352624416,0.00011249392264289781,0.32603823444789487,0,0,2.433995485305786,0.9650030136108398,1.148998737335205,3.398998498916626
Fine-tuned_finetuned-ISO-27001_1024_l2_All_1536_264_False,Hybrid_Rerank_Cohere,4,mixtral-8x7B-v0.1,16000,0,1,"How is the selection of measures for implementing risk treatment conducted, and what requirements should be considered and documented according to ISO 27001?","[Document(page_content='or to engage a\nconsultant. 3. **involve management properly and early** a management framework defines all the procedures an organization must\nimplement to achieve its iso 27001 implementation goals. accountability,\nspecifying who in management is responsible for the isms, a schedule of all\nactivities, and regular isms reviews for effectiveness are mechanisms\ncyclically ensuring isms improvement. 4. **conduct a risk assessment** while iso 27001 requires a formal risk assessment, it does not prescribe a\nmethodology. ""formal"" implies that the risk assessment approach is planned in\nadvance, and the associated data, analyses, and results are documented. 5. **implement risk treatment measures** it is the organization\'s task to determine how to proceed with the identified\nrisks. should they be avoided, transferred, accepted, or mitigated? all\ndecisions made for risk treatment must be documented. during a registration or\ncertification audit, an auditor will want to see this documentation. if you\nchoose to mitigate risks, it is crucial to implement the measures, based on\niso 27002 controls, for example. 6. **review and update the related documentation** documentation is one of the requirements you cannot bypass with iso 27001. you\nmust document all processes, rules, and procedures related to your isms to\nensure their appropriate implementation. the norm requires documentation of\nthe following aspects: * understanding the organization and its context (e.g.,', metadata={'description': 'Discover the comprehensive guide to ISO 27001: Detailed insight into achieving and maintaining this essential information security standard. Explore its critical role in risk management, compliance and robust security practices, and learn step-by-step implementation techniques.', 'doc_ID': 175, 'language': 'en-gb', 'original_text': 'or to engage a\nconsultant. 3. **Involve Management Properly and Early** A management framework defines all the procedures an organization must\nimplement to achieve its ISO 27001 implementation goals. Accountability,\nspecifying who in management is responsible for the ISMS, a schedule of all\nactivities, and regular ISMS reviews for effectiveness are mechanisms\ncyclically ensuring ISMS improvement. 4. **Conduct a Risk Assessment** While ISO 27001 requires a formal risk assessment, it does not prescribe a\nmethodology. ""Formal"" implies that the risk assessment approach is planned in\nadvance, and the associated data, analyses, and results are documented. 5. **Implement Risk Treatment Measures** It is the organization\'s task to determine how to proceed with the identified\nrisks. Should they be avoided, transferred, accepted, or mitigated? All\ndecisions made for risk treatment must be documented. During a registration or\ncertification audit, an auditor will want to see this documentation. If you\nchoose to mitigate risks, it is crucial to implement the measures, based on\nISO 27002 controls, for example. 6. **Review and Update the Related Documentation** Documentation is one of the requirements you cannot bypass with ISO 27001. You\nmust document all processes, rules, and procedures related to your ISMS to\nensure their appropriate implementation. The norm requires documentation of\nthe following aspects: * Understanding the organization and its context (e.g.,', 'source': 'https://www.dataguard.co.uk/knowledge/iso-27001/', 'title': 'What is ISO 27001? Key Information at a Glance', 'relevance_score': 0.9977569}), Document(page_content='information security risk treatment is the process of selecting and\nimplementing controls to reduce the likelihood and impact of information\nsecurity risks. it is an essential part of any information security management\nsystem (isms) and is required by the iso 27001 standard.\nclause 8.3 of iso 27001 requires organisations to implement the information\nsecurity risk treatment plan and retain documented information on the results\nof that risk treatment.\nthis means that organisations must have a plan in place for how they will\naddress the risks that have been identified, and they must keep records of how\nthey have implemented that plan.\nhere are some of the things that are involved in requirement 8.3:\n * identifying and assessing risks * developing and implementing risk treatment plans * monitoring and reviewing the effectiveness of risk treatment plans * retaining documented information on the results of risk treatment\norganisations can use a variety of methods to implement requirement 8.3, such\nas:\n * using a risk management framework such as iso 27005 * using a risk management software tool * hiring a consultant to help with risk management\n## what is the information risk treatment plan?\nan information risk treatment plan (irtp) is a document that outlines how an\norganisation will manage and treat the information security risks that have\nbeen identified through its risk assessment process. the irtp should include\nthe following:\n * a list of all identified', metadata={'source': 'https://www.dataguard.co.uk/knowledge/iso-27001/clause-8-3-information-security-risk-treatment/', 'title': 'ISO 27001 Clause 8.3: Information security risk treatment', 'description': 'Learn how to implement the ISO 27001 information security risk treatment plan and reduce the likelihood and impact of information security risks.', 'language': 'en-gb', 'original_text': 'Information security risk treatment is the process of selecting and\nimplementing controls to reduce the likelihood and impact of information\nsecurity risks. It is an essential part of any information security management\nsystem (ISMS) and is required by the ISO 27001 standard.\nClause 8.3 of ISO 27001 requires organisations to implement the information\nsecurity risk treatment plan and retain documented information on the results\nof that risk treatment.\nThis means that organisations must have a plan in place for how they will\naddress the risks that have been identified, and they must keep records of how\nthey have implemented that plan.\nHere are some of the things that are involved in requirement 8.3:\n * Identifying and assessing risks * Developing and implementing risk treatment plans * Monitoring and reviewing the effectiveness of risk treatment plans * Retaining documented information on the results of risk treatment\nOrganisations can use a variety of methods to implement requirement 8.3, such\nas:\n * Using a risk management framework such as ISO 27005 * Using a risk management software tool * Hiring a consultant to help with risk management\n## What is the information risk treatment plan?\nAn information risk treatment plan (IRTP) is a document that outlines how an\norganisation will manage and treat the information security risks that have\nbeen identified through its risk assessment process. The IRTP should include\nthe following:\n * A list of all identified', 'doc_ID': 407, 'relevance_score': 0.9977217}), Document(page_content='for the treatment of risks should be identified as well as the selection of the appropriate controls\nshould be identified in accordance with the identified risk treatment options.\ninput\na) output from activity 8.2 conduct risk assessment - the result of risk assessment\nb) iso/iec 27005:2008\nc) isomec 27002:2005\nguidance\nit is important to specify the relation between the risks and the selected options for treating them (e.g. a risk\ntreatment plan), as this will provide a summary of risk treatment. possible options for the treatment of risks are\nenumerated in iso/iec 27001:2005 reference 4.2.1 f).\nthe iso/iec 27001:2005 annex a (normative) “control objectives and controls"" is used to select control\nobjectives and controls for risk treatment. if there are no appropriate control objectives or controls in annex a,\nthe additional control objectives and controls should be specified and used. it is important to demonstrate how\nthe selected controls will mitigate risks as required by the risk treatment plan.\nthe data given in iso/iec 27001:2005 annex a is not meant to be exhaustive. sector-specific controls may\nbe identified to support the specific needs of the business as well as the isms.\nin the case of risk reduction, managing the relationship between each risk and selected control objectives and\ncontrols is beneficial to designing the isms implementation. it could be added to the list that describes the\nrelationship between the risks and the selected options for risk treatment.\nto facilitate audits, the', metadata={'source': 'ISO 27003 2010 (E).pdf', 'title': 'ISO 27003 2010 (E)', 'original_text': 'for the treatment of risks should be identified as well as the selection of the appropriate controls\nshould be identified in accordance with the identified risk treatment options.\nInput\na) output from Activity 8.2 Conduct risk assessment - The result of risk assessment\nb) ISO/IEC 27005:2008\nc) ISOMEC 27002:2005\nGuidance\nIt is important to specify the relation between the risks and the selected options for treating them (e.g. a risk\ntreatment plan), as this will provide a summary of risk treatment. Possible options for the treatment of risks are\nenumerated in ISO/IEC 27001:2005 reference 4.2.1 f).\nThe ISO/IEC 27001:2005 Annex A (normative) “Control objectives and controls"" is used to select control\nobjectives and controls for risk treatment. If there are no appropriate control objectives or controls in Annex A,\nthe additional control objectives and controls should be specified and used. It is important to demonstrate how\nthe selected controls will mitigate risks as required by the risk treatment plan.\nThe data given in ISO/IEC 27001:2005 Annex A is not meant to be exhaustive. Sector-specific controls may\nbe identified to support the specific needs of the business as well as the ISMS.\nIn the case of risk reduction, managing the relationship between each risk and selected control objectives and\ncontrols is beneficial to designing the ISMS implementation. It could be added to the list that describes the\nrelationship between the risks and the selected options for risk treatment.\nTo facilitate audits, the', 'doc_ID': 1476, 'relevance_score': 0.9977128}), Document(page_content='requires the organisation to\n“formulate an information security risk treatment plan”. risk\ntreatment is, as we saw earlier, part of the risk management\nprocess.\nthere is a link to iso 27001 clause 5.1, which is a\nsubstantial clause dealing in detail with management\nresponsibility. clearly, the risk treatment plan needs to be\ndocumented. it should be set within the context of the\norganisation’s information security policy and it should\nclearly identify the organisation’s approach to risk and its\ncriteria for accepting risk, as discussed elsewhere in this\nbook. the risk assessment process must be formally defined,\n165\n16: the gap analysis and risk treatment plan\nand responsibility for carrying it out and reviewing it must\nbe formally allocated. at the heart of this plan is a detailed\nschedule, which shows for each identified risk — linked either\nto an asset-threat-vulnerability combination or to a scenario:\ne the associated risk level (from the risk assessment tool);\ne the gap between the assessed risk and the acceptable\nlevel of risk;\ne how the organisation has decided to treat the risk\n(retain, avoid, modify, share);\ne the control gap analysis:\no what controls are already in place and their nature\n(e.g. detective, preventive, etc.).\no what additional controls are considered necessary,\nand their nature (and details of any supporting cost-\nbenefit analysis).\ne the resources required for the task (financial, technical\nand human); and\ne the timeframe for implementing the controls.\nthe risk treatment', metadata={'source': 'Calder - 2019 - Information Security Risk Management for ISO 27001.pdf', 'title': 'Calder - 2019 - Information Security Risk Management for ISO 27001', 'original_text': 'requires the organisation to\n“formulate an information security risk treatment plan”. Risk\ntreatment is, aS we saw earlier, part of the risk management\nprocess.\nThere is a link to ISO 27001 Clause 5.1, which is a\nsubstantial clause dealing in detail with management\nresponsibility. Clearly, the risk treatment plan needs to be\ndocumented. It should be set within the context of the\norganisation’s information security policy and it should\nclearly identify the organisation’s approach to risk and its\ncriteria for accepting risk, as discussed elsewhere in this\nbook. The risk assessment process must be formally defined,\n165\n16: The gap analysis and risk treatment plan\nand responsibility for carrying it out and reviewing it must\nbe formally allocated. At the heart of this plan is a detailed\nschedule, which shows for each identified risk — linked either\nto an asset-threat-vulnerability combination or to a scenario:\ne The associated risk level (from the risk assessment tool);\ne The gap between the assessed risk and the acceptable\nlevel of risk;\ne How the organisation has decided to treat the risk\n(retain, avoid, modify, share);\ne The control gap analysis:\no What controls are already in place and their nature\n(e.g. detective, preventive, etc.).\no What additional controls are considered necessary,\nand their nature (and details of any supporting cost-\nbenefit analysis).\ne The resources required for the task (financial, technical\nand human); and\ne The timeframe for implementing the controls.\nThe risk treatment', 'doc_ID': 833, 'relevance_score': 0.99712163})]","The selection of measures for implementing risk treatment is done in two steps. Firstly, a general treatment option is selected for each identified risk. Then, the measures necessary for implementing this option are selected and determined. Various sources such as ISO 27002, the Basic Security Compendium of BSI, or industry catalogs can be consulted during the selection of measures. A comparison with the controls from Annex A of ISO 27001 is necessary during the selection of measures to avoid overlooking important aspects and measures. All requirements that need to be considered during the selection of measures must be documented accordingly.","The selection of measures for implementing risk treatment in ISO 27001 is conducted by identifying and assessing risks, developing and implementing risk treatment plans, and monitoring and reviewing their effectiveness. The risk treatment plan should be documented and include a list of identified risks, the selected options for treating them, and the relation between the risks and the selected treatment options. The treatment options can include avoiding, transferring, accepting, or mitigating risks, and the decisions made for risk treatment must be documented.

When mitigating risks, measures should be implemented based on ISO 27002 controls. The risk treatment plan should be formulated as part of the risk management process, and the plan needs to be documented and set within the context of the organization's information security policy. The plan should identify the organization's approach to risk and its criteria for accepting risk.

The risk assessment process must be formally defined, and responsibility for carrying it out and reviewing it must be formally allocated. The risk treatment plan should include a detailed schedule, showing for each identified risk: the associated risk level, the gap between the assessed risk and the acceptable level of risk, how the organization has decided to treat the risk, the control gap analysis, the resources required",True,0.3548387096774194,0.13636363636363638,0.2,0.4914008378982544,0.8331670016050339,0.9999645948410034,0.7979659594286141,0,0,2.164693593978882,3.9993700981140137,0.2319960594177246,6.1640636920928955
Fine-tuned_finetuned-ISO-27001_1024_l2_All_1536_264_False,Hybrid_Rerank_Cohere,4,mixtral-8x7B-v0.1,16000,0,1,"What resources need to be provided to establish the ISMS according to ISO 27001, and what resources are necessary for the implementation of the risk treatment plan?","[Document(page_content='### clause 7.1 of iso 27001: resources\nclause 7.1 of iso 27001 requires organisations to identify and allocate the\nresources needed for the establishment, implementation, maintenance, and\ncontinual improvement of their (isms). this is because the resources available\nto an organisation will have a significant impact on the effectiveness of its\nisms.\nthe resources that need to be considered include:\n * people: the organisation needs to have the right people with the right skills and knowledge to implement and maintain its isms. this includes security professionals, as well as other employees who have a role to play in information security, such as it staff, line managers, and employees with access to sensitive information. * infrastructure: the organisation needs to have the necessary infrastructure, such as it systems and facilities, to support its isms. this includes hardware, software, and physical security measures. * financial resources: the organisation needs to have the financial resources to invest in its isms. this includes the costs of hiring and training staff, purchasing and maintaining infrastructure, and implementing security controls.\nby ensuring that it has the necessary resources, an organisation can improve\nthe effectiveness of its isms and reduce the risk of security incidents.\n### your iso 27001 certification process made simple.\n### get iso 27001 certified in as little as 3 months. download your free guide now\n## why is it important for organisations to have', metadata={'description': 'ISO 27001 clause 7.1 stipulates that organisations must allocate necessary resources for the establishment, maintenance, and enhancement of their ISMS.', 'doc_ID': 378, 'language': 'en-gb', 'original_text': '### Clause 7.1 of ISO 27001: Resources\nClause 7.1 of ISO 27001 requires organisations to identify and allocate the\nresources needed for the establishment, implementation, maintenance, and\ncontinual improvement of their (ISMS). This is because the resources available\nto an organisation will have a significant impact on the effectiveness of its\nISMS.\nThe resources that need to be considered include:\n * People: The organisation needs to have the right people with the right skills and knowledge to implement and maintain its ISMS. This includes security professionals, as well as other employees who have a role to play in information security, such as IT staff, line managers, and employees with access to sensitive information. * Infrastructure: The organisation needs to have the necessary infrastructure, such as IT systems and facilities, to support its ISMS. This includes hardware, software, and physical security measures. * Financial resources: The organisation needs to have the financial resources to invest in its ISMS. This includes the costs of hiring and training staff, purchasing and maintaining infrastructure, and implementing security controls.\nBy ensuring that it has the necessary resources, an organisation can improve\nthe effectiveness of its ISMS and reduce the risk of security incidents.\n### Your ISO 27001 certification process made simple.\n### Get ISO 27001 certified in as little as 3 months. Download your free guide now\n## Why is it important for organisations to have', 'source': 'https://www.dataguard.co.uk/knowledge/iso-27001/clause-7-1-resources-for-isms/', 'title': 'ISO 27001 requirement 7.1: Identify and allocate resources for ISMS', 'relevance_score': 0.9988441}), Document(page_content='with isms risks\niso/iec 27001, clause 6.1.1 specifies a requirement that is common to all mss and\nis intended for the identification and treatment of risks to the intended outcome of\nthe isms that are not information security specific. for example, a lack of resources\ncould result in internal audits being missed. whilst this could represent a\nnonconformity in respect of iso/iec 27001, clause 9.2 (internal audits), its effect on\nexposure to information security is indirect and depends on whether any information\nsecurity controls are in scope of the audits that might be missed. whilst an\norganisation could use the full rigour of clauses 6.1.2 and 6.1.3 to identify and treat\nsuch risk, it does not have to — an informal approach — essentially just following what\nit says in the standard will be sufficient.\nrelevant resources\niso standards\niso/iec 27000 provides an overview of all the standards in the 27000 series,\ntogether the vocabulary of terms that they use. the principal standards are:\nm iso/iec 27000, information technology — security techniques —\ninformation security management systems — overview and vocabulary;\nm iso/iec 27001, information technology — security techniques —\ninformation security management systems — requirements;\nm iso/iec 27002, information technology — security techniques — code of\npractice for information security controls\nm iso/iec 27003, information technology — security techniques —\ninformation security management system implementation guidance.\nthe following standard explores', metadata={'source': 'Brewer - 2020 - ISO IEC 27001 Mastering Risk Assessment and the Statement of Applicability.pdf', 'title': 'Brewer - 2020 - ISO IEC 27001 Mastering Risk Assessment and the Statement of Applicability', 'original_text': 'with ISMS risks\nISO/IEC 27001, Clause 6.1.1 specifies a requirement that is common to all MSS and\nis intended for the identification and treatment of risks to the intended outcome of\nthe ISMS that are not information security specific. For example, a lack of resources\ncould result in internal audits being missed. Whilst this could represent a\nnonconformity in respect of ISO/IEC 27001, Clause 9.2 (Internal audits), its effect on\nexposure to information security is indirect and depends on whether any information\nsecurity controls are in scope of the audits that might be missed. Whilst an\norganisation could use the full rigour of Clauses 6.1.2 and 6.1.3 to identify and treat\nsuch risk, it does not have to — an informal approach — essentially just following what\nit says in the standard will be sufficient.\nRelevant resources\nISO standards\nISO/IEC 27000 provides an overview of all the standards in the 27000 series,\ntogether the vocabulary of terms that they use. The principal standards are:\nm ISO/IEC 27000, Information technology — Security techniques —\nInformation security management systems — Overview and vocabulary;\nm ISO/IEC 27001, Information technology — Security techniques —\nInformation security management systems — Requirements;\nm ISO/IEC 27002, Information technology — Security techniques — Code of\npractice for information security controls\nm ISO/IEC 27003, Information technology — Security techniques —\nInformation security management system implementation guidance.\nThe following standard explores', 'doc_ID': 580, 'relevance_score': 0.99317604}), Document(page_content='systems, i.e. if a qm system already exists in the organization, the isms is also set up according to the same pattern and can benefit from already defined processes (example: document management) or simply adopt them.\n- resources: it is clear that our isms will require a significant amount of resources depending on its level of development and scope (e.g. a running budget, sufficient personnel, resources for external expertise such as assessments, certifications, or penetration tests, and finally resources and manpower for the implementation and monitoring of security measures).\non one hand, the available resources will be limited, which will directly impact our isms. should we initially keep the scope small - for example, securing only core business processes - and gradually expand later? or would it be okay to establish a lower level of security than originally planned at the beginning? it is clear: none of these options are recommended, but what can be done?\nwe refer to external aspects as those brought to our organization from the outside. these include:\n2.1. context of the organization (isms-4) 35\n© legal requirements (laws, regulations, decrees) that our organization must comply with. if we operate in more than one country, there may be several requirements to consider. eu requirements in the form of guidelines and regulations (such as the gdpr [1] on data protection or the eidas regulation [2] on electronic trust services) should not be overlooked. an example of a decree is the german vat', metadata={'source': 'ISO 27001_2022_Kersten_und_Schroeder.pdf', 'title': 'ISO 27001_2022_Kersten_und_Schroeder', 'original_text': 'systems, i.e. if a QM system already exists in the organization, the ISMS is also set up according to the same pattern and can benefit from already defined processes (example: document management) or simply adopt them.\n- Resources: It is clear that our ISMS will require a significant amount of resources depending on its level of development and scope (e.g. a running budget, sufficient personnel, resources for external expertise such as assessments, certifications, or penetration tests, and finally resources and manpower for the implementation and monitoring of security measures).\nOn one hand, the available resources will be limited, which will directly impact our ISMS. Should we initially keep the scope small - for example, securing only core business processes - and gradually expand later? Or would it be okay to establish a lower level of security than originally planned at the beginning? It is clear: none of these options are recommended, but what can be done?\nWe refer to external aspects as those brought to our organization from the outside. These include:\n2.1. Context of the organization (ISMS-4) 35\n© Legal requirements (laws, regulations, decrees) that our organization must comply with. If we operate in more than one country, there may be several requirements to consider. EU requirements in the form of guidelines and regulations (such as the GDPR [1] on data protection or the eIDAS regulation [2] on electronic trust services) should not be overlooked. An example of a decree is the German VAT', 'doc_ID': 2588, 'relevance_score': 0.99184376}), Document(page_content='business processes as column headings and the measures planned for each process below. the specific comparison will be delegated by management - for example, to the security management, an auditor, or a reviewer.\n(c) the resources necessary for planning, operating, and maintaining the isms must be available.\nthis understandable requirement is naturally the sticking point in many organizations: resources are always limited - and who actually determines what is required when and for what purpose? initially, those responsible for information security (security officers, coordinators from the affected departments - perhaps a working group?) should prepare a resource plan for a specific period of time (typically 3 years) and submit it for approval. the plan must include the required personnel, all financial resources for setting up and operating the isms, and all resources necessary to establish and use the planned security measures. for these points, during the establishment phase of the isms, only an estimate can be given.\nin the discussion with management about the allocation of resources, it may be helpful to refer to recommendations from recognized auditors - their advice may carry more weight in such discussions, especially if certification of the isms is later sought.\nnote that the allocation of sufficient resources for the isms is the responsibility of the management level. in other words, if only insufficient resources are provided, the consequences (deficiencies in information security) are', metadata={'source': 'ISO 27001_2022_Kersten_und_Schroeder.pdf', 'title': 'ISO 27001_2022_Kersten_und_Schroeder', 'original_text': 'business processes as column headings and the measures planned for each process below. The specific comparison will be delegated by management - for example, to the security management, an auditor, or a reviewer.\n(c) The resources necessary for planning, operating, and maintaining the ISMS must be available.\nThis understandable requirement is naturally the sticking point in many organizations: Resources are always limited - and who actually determines what is required when and for what purpose? Initially, those responsible for information security (security officers, coordinators from the affected departments - perhaps a working group?) should prepare a resource plan for a specific period of time (typically 3 years) and submit it for approval. The plan must include the required personnel, all financial resources for setting up and operating the ISMS, and all resources necessary to establish and use the planned security measures. For these points, during the establishment phase of the ISMS, only an estimate can be given.\nIn the discussion with management about the allocation of resources, it may be helpful to refer to recommendations from recognized auditors - their advice may carry more weight in such discussions, especially if certification of the ISMS is later sought.\nNote that the allocation of sufficient resources for the ISMS is the responsibility of the management level. In other words, if only insufficient resources are provided, the consequences (deficiencies in information security) are', 'doc_ID': 2602, 'relevance_score': 0.9893063})]","To establish the ISMS according to ISO 27001, various resources need to be provided. These include staff, processes, expertise, training and education, as well as testing and verification procedures. These resources should already be estimated in the planning phase of the ISMS. In addition, resources are necessary to implement the risk treatment plan. These include staff, knowledge/expertise, organizational resources, infrastructure/technology, as well as a budget for expertise, training and education, tests, and audits. External support may also be considered. The estimation of effort and costs for the implementation of the risk treatment plan should be done after the completion of the Statement of Applicability (SoA) and submitted for approval.","To establish an Information Security Management System (ISMS) according to ISO 27001, an organization needs to identify and allocate resources in the areas of people, infrastructure, and financial resources. People resources involve having the right staff with the necessary skills and knowledge to implement and maintain the ISMS. Infrastructure resources include hardware, software, and physical security measures. Financial resources are required for hiring and training staff, purchasing and maintaining infrastructure, and implementing security controls.

For the implementation of the risk treatment plan, the organization needs to ensure that the necessary resources are available to address the identified risks. This includes resources for the implementation and monitoring of security measures to treat the risks. The allocation of resources for the ISMS is the responsibility of the management level, and it is recommended to prepare a resource plan for a specific period, typically 3 years.

It is important to note that the resources available to an organization will have a significant impact on the effectiveness of its ISMS, and a lack of resources could result in internal audits being missed, representing a nonconformity in respect of ISO/IEC 27001, Clause 9.2 (Internal audits). While an organization could use a formal approach to identify and treat such risks",True,0.37223974763406936,0.12698412698412698,0.24605678233438485,0.49968934059143066,0.943413496017456,0.9998602867126465,0.8005869136551619,0,0,2.293386936187744,3.4800057411193848,0.41599392890930176,5.773392677307129
Fine-tuned_finetuned-ISO-27001_1024_l2_All_1536_264_False,Hybrid_Rerank_Cohere,4,mixtral-8x7B-v0.1,16000,0,1,Which three levels are considered when evaluating the security and effectiveness of the ISMS?,"[Document(page_content='the isms, evaluating against the information security objectives\n * correspondence between the determined controls, the statement of applicability and the results of the information security risk assessment and risk treatment process and the information security policy and objectives\n * implementation of controls (see annex a), taking into account the external and internal context\n * and related risks, the organization’s monitoring, measurement and analysis of information security\n * processes and controls to determine whether controls are implemented and effective and meet their stated information security objectives\n * programmes, processes, procedures, records, internal audits and reviews of the isms effectiveness to ensure that these are traceable to top management decisions and the information security policy and objectives\nonce you have completed stage two and passed the audit — you will receive your\nofficial certification.\n * surveillance/periodic audits: happen between certification and recertification audits focusing on specific areas of the isms. this is done every year.\n * recertification audit: this is necessary to keep your certification and covers all aspects of the standard and must be carried out every 3 years.\n## how long does it take to get ready for an iso 27001 external audit?\ndepending on the size of your company or organisation, you can be audit-ready\nin about 8 weeks. if you decide to go the manual route of building your\ndocumentation from scratch, it can take at least', metadata={'source': 'https://www.dataguard.co.uk/knowledge/iso-27001-certification/', 'title': 'ISO 27001 Certification: Your ultimate guide [free guide available]', 'description': 'No matter if you’re an SMB or an international corporation — getting an ISO 27001 certification should be on your agenda. Here’s the ultimate guide on how.', 'language': 'en-gb', 'original_text': 'the ISMS, evaluating against the information security objectives\n * Correspondence between the determined controls, the Statement of Applicability and the results of the information security risk assessment and risk treatment process and the information security policy and objectives\n * Implementation of controls (see Annex A), taking into account the external and internal context\n * And related risks, the organization’s monitoring, measurement and analysis of information security\n * Processes and controls to determine whether controls are implemented and effective and meet their stated information security objectives\n * Programmes, processes, procedures, records, internal audits and reviews of the ISMS effectiveness to ensure that these are traceable to top management decisions and the information security policy and objectives\nOnce you have completed stage two and passed the audit — you will receive your\nofficial certification.\n * Surveillance/periodic audits: happen between certification and recertification audits focusing on specific areas of the ISMS. This is done every year.\n * Recertification audit: This is necessary to keep your certification and covers all aspects of the standard and must be carried out every 3 years.\n## How long does it take to get ready for an ISO 27001 external audit?\nDepending on the size of your company or organisation, you can be audit-ready\nin about 8 weeks. If you decide to go the manual route of building your\ndocumentation from scratch, it can take at least', 'doc_ID': 141, 'relevance_score': 0.98221964}), Document(page_content=""in the iso/iec 27001 standard. the certification body will take the time to gain a sufficient understanding of the isms design in the context of your organization, risk assessment and treatment (including the controls determined), information security policy and objectives. a large emphasis will also be put on your company's preparedness for the audit. this allows planning for stage 2. * **stage 2 audit:** based on documented findings in stage 1's audit report, the certification body will develop an audit plan to conduct stage 2 of the audit. in addition to evaluating the effective implementation of the isms, the aim of stage 2 is to confirm that your company adheres to its own policies, objectives and procedures.\nto do this, the audit will focus on:\n * top management leadership and commitment to information security policy and the information security objectives\n * documentation requirements listed in iso/iec 27001\n * assessment of information security-related risks and that the assessments produce consistent, valid and comparable results if repeated\n * determination of control objectives and controls based on the information security risk assessment risk treatment processes\n * information security performance and the effectiveness of the isms, evaluating against the information security objectives\n * correspondence between the determined controls, the statement of applicability and the results of the information security risk assessment and risk treatment process and the information security"", metadata={'source': 'https://www.dataguard.co.uk/knowledge/iso-27001-certification/', 'title': 'ISO 27001 Certification: Your ultimate guide [free guide available]', 'description': 'No matter if you’re an SMB or an international corporation — getting an ISO 27001 certification should be on your agenda. Here’s the ultimate guide on how.', 'language': 'en-gb', 'original_text': ""in the ISO/IEC 27001 standard. The certification body will take the time to gain a sufficient understanding of the ISMS design in the context of your organization, risk assessment and treatment (including the controls determined), information security policy and objectives. A large emphasis will also be put on your company's preparedness for the audit. This allows planning for stage 2. * **Stage 2 Audit:** Based on documented findings in stage 1's audit report, the certification body will develop an audit plan to conduct stage 2 of the audit. In addition to evaluating the effective implementation of the ISMS, the aim of stage 2 is to confirm that your company adheres to its own policies, objectives and procedures.\nTo do this, the audit will focus on:\n * Top management leadership and commitment to information security policy and the information security objectives\n * Documentation requirements listed in ISO/IEC 27001\n * Assessment of information security-related risks and that the assessments produce consistent, valid and comparable results if repeated\n * Determination of control objectives and controls based on the information security risk assessment Risk treatment processes\n * Information security performance and the effectiveness of the ISMS, evaluating against the information security objectives\n * Correspondence between the determined controls, the Statement of Applicability and the results of the information security risk assessment and risk treatment process and the information security"", 'doc_ID': 140, 'relevance_score': 0.97123843}), Document(page_content='more comprehensive. please refer again to the explanations on the scope in isms-4.3.\n(e) the top management level should ensure the achievement of the isms objectives.\nthis requirement is intended to remind the top management level that it is ultimately their responsibility to ensure a correctly functioning and effective isms. while the operational security responsibility within the organization can be delegated, for example, to the role of an it security officer, the top management level does not absolve itself of the fundamental leadership task and responsibility in terms of information security.\nwhat can the top management level do to ensure the achievement of the objectives?\nespecially in the initial phase, this includes creating an effective organizational structure for the isms, filling necessary roles with qualified personnel in a timely manner, and providing necessary resources for the isms.\nin later phases, it is more about comparing expectations with the results of the isms. an important tool for this is the so-called management review, which should be carried out regularly (e.g. once a year) by the top management level. we will discuss this in detail in connection with isms-10. it assesses the performance and achievement of the isms objectives: if they are not sufficient, corrective measures must be ordered. the evaluation also includes reports on security incidents that have occurred and the resulting consequences.\nthere are generally risks involved in achieving the objectives: what can', metadata={'doc_ID': 2604, 'original_text': 'more comprehensive. Please refer again to the explanations on the scope in ISMS-4.3.\n(e) The top management level should ensure the achievement of the ISMS objectives.\nThis requirement is intended to remind the top management level that it is ultimately their responsibility to ensure a correctly functioning and effective ISMS. While the operational security responsibility within the organization can be delegated, for example, to the role of an IT security officer, the top management level does not absolve itself of the fundamental leadership task and responsibility in terms of information security.\nWhat can the top management level do to ensure the achievement of the objectives?\nEspecially in the initial phase, this includes creating an effective organizational structure for the ISMS, filling necessary roles with qualified personnel in a timely manner, and providing necessary resources for the ISMS.\nIn later phases, it is more about comparing expectations with the results of the ISMS. An important tool for this is the so-called management review, which should be carried out regularly (e.g. once a year) by the top management level. We will discuss this in detail in connection with ISMS-10. It assesses the performance and achievement of the ISMS objectives: if they are not sufficient, corrective measures must be ordered. The evaluation also includes reports on security incidents that have occurred and the resulting consequences.\nThere are generally risks involved in achieving the objectives: what can', 'source': 'ISO 27001_2022_Kersten_und_Schroeder.pdf', 'title': 'ISO 27001_2022_Kersten_und_Schroeder', 'relevance_score': 0.96926606}), Document(page_content='of measurements. an interesting aspect here would be the degree of implementation as an average across all controls of the isms - for example, as the average of individual values or with appropriate weighting. it is clear that this average/weighted degree of implementation says something about the effectiveness of the isms: information security can only be incomplete if the controls are not fully implemented, i.e. the isms does not provide full performance and is most likely not fully effective.\nof course, there are dependencies between the aspects of the correctness of implementation, effectiveness, and adequacy. a precise separation is difficult. however, it is clear that these aspects are the focus of performance evaluation, as isms-10 also emphasizes.\nin addition to these measurements/monitoring of security objectives, other (extended) objectives are of interest to the organization: adherence to planned budgets or monitoring of overall resource consumption, adherence to deadlines in the establishment and operation of the isms, etc. the degree of goal achievement is also interesting for such objectives and contributes to the performance of the isms and information security. measurements could be carried out by comparing them with the planning (budget, resource, implementation plan).\none final, but central and measurable objective of the organization for this book: the conformity of the isms with iso 27001. the degree of compliance with individual norm requirements can be monitored and measured by', metadata={'doc_ID': 2666, 'original_text': 'of measurements. An interesting aspect here would be the degree of implementation as an average across all controls of the ISMS - for example, as the average of individual values or with appropriate weighting. It is clear that this average/weighted degree of implementation says something about the effectiveness of the ISMS: Information security can only be incomplete if the controls are not fully implemented, i.e. the ISMS does not provide full performance and is most likely not fully effective.\nOf course, there are dependencies between the aspects of the correctness of implementation, effectiveness, and adequacy. A precise separation is difficult. However, it is clear that these aspects are the focus of performance evaluation, as ISMS-10 also emphasizes.\nIn addition to these measurements/monitoring of security objectives, other (extended) objectives are of interest to the organization: adherence to planned budgets or monitoring of overall resource consumption, adherence to deadlines in the establishment and operation of the ISMS, etc. The degree of goal achievement is also interesting for such objectives and contributes to the performance of the ISMS and information security. Measurements could be carried out by comparing them with the planning (budget, resource, implementation plan).\nOne final, but central and measurable objective of the organization for this book: the conformity of the ISMS with ISO 27001. The degree of compliance with individual norm requirements can be monitored and measured by', 'source': 'ISO 27001_2022_Kersten_und_Schroeder.pdf', 'title': 'ISO 27001_2022_Kersten_und_Schroeder', 'relevance_score': 0.9683812})]","The three levels considered when evaluating the security and effectiveness of the ISMS are:
1. Level - Monitoring, measurement, analysis, and evaluation by the responsible authorities or roles for security (topic 9.1)
2. Level - Review and assessment of security by an independent body separate from operational security (internal audit) (topic 9.2)
3. Level - Evaluation of the ISMS by top management (topic 9.3)","The evaluation of the security and effectiveness of an Information Security Management System (ISMS) in the context of ISO 27001 certification involves three levels. First, the ISMS is evaluated against the information security objectives, including the correspondence between the determined controls, the Statement of Applicability, and the results of the risk assessment and treatment process. The implementation of controls is also assessed, taking into account the external and internal context and related risks. The organization's monitoring, measurement, and analysis of information security processes and controls are also evaluated.

During the ISO 27001 certification process, the certification body gains a sufficient understanding of the ISMS design, risk assessment and treatment, policies, objectives, and preparedness for the audit. The stage 2 audit focuses on the effective implementation of the ISMS, adherence to policies, objectives, and procedures, and the top management's leadership and commitment to information security.

The degree of implementation, effectiveness, and adequacy of the ISMS are measured, with a focus on the correctness of implementation, performance, and achievement of the ISMS objectives. These measurements contribute to the performance of the ISMS and information security. Additionally, the organization's adherence to",True,0.2823529411764706,0.10276679841897235,0.18823529411764703,0.4778020977973938,0.8311644047498703,0.998988687992096,0.6872170941987081,0,0,2.147691249847412,3.6139516830444336,0.2260453701019287,5.761642932891846
Fine-tuned_finetuned-ISO-27001_1024_l2_All_1536_264_False,Hybrid_Rerank_Cohere,4,mixtral-8x7B-v0.1,16000,0,1,What aspects are reviewed in internal audits for ISO 27001 according to NA 9.2 and what information should be specified in the audit program to effectively manage these tasks?,"[Document(page_content=""* the audit must cover all aspects of the isms, including risk assessment, information security controls, isms documentation, awareness and training, and management review. * the audit findings must be documented in a report that is submitted to the organisation's management.\norganisations that are certified according to iso 27001 must also undergo an\nexternal audit by a certification body. there are two kinds of external audit,\none conducted once annually called a surveillance audit where the isms will be\nreviewed as part of ongoing evaluation and the other known as a full external\naudit which is more in-depth and conducted every three years.\nbenefits of iso 27001 audit:\n * improved information security posture * reduced risk of information security incidents * increased compliance with regulations * improved customer confidence * competitive advantage\nif you are considering implementing iso 27001 or if you are already certified,\nit is important to ensure that you are conducting regular internal audits.\ninternal audits are an essential tool for maintaining an effective isms and\nprotecting your organisation from information security threats.\n## where is an internal audit mandatory?\nan internal audit is not required by law or regulation. however, it is a good\npractice for all organisations to conduct regular internal audits of their\ninformation security and other management systems.\nin order to comply with iso 27001, all companies must conduct internal"", metadata={'source': 'https://www.dataguard.co.uk/knowledge/iso-27001/clause-9-2-internal-audit/', 'title': 'ISO 27001 Clause 9.2: Internal Audit', 'description': 'Ensure your ISMS is operating effectively for ISO 27001 compliance. Learn all you need to know about ISO 27001 Clause 9.2 internal audits in our guide.\n', 'language': 'en-gb', 'original_text': ""* The audit must cover all aspects of the ISMS, including risk assessment, information security controls, ISMS documentation, awareness and training, and management review. * The audit findings must be documented in a report that is submitted to the organisation's management.\nOrganisations that are certified according to ISO 27001 must also undergo an\nexternal audit by a certification body. There are two kinds of external audit,\none conducted once annually called a surveillance audit where the ISMS will be\nreviewed as part of ongoing evaluation and the other known as a full external\naudit which is more in-depth and conducted every three years.\nBenefits of ISO 27001 audit:\n * Improved information security posture * Reduced risk of information security incidents * Increased compliance with regulations * Improved customer confidence * Competitive advantage\nIf you are considering implementing ISO 27001 or if you are already certified,\nit is important to ensure that you are conducting regular internal audits.\nInternal audits are an essential tool for maintaining an effective ISMS and\nprotecting your organisation from information security threats.\n## Where is an internal audit mandatory?\nAn internal audit is not required by law or regulation. However, it is a good\npractice for all organisations to conduct regular internal audits of their\ninformation security and other management systems.\nIn order to comply with ISO 27001, all companies must conduct internal"", 'doc_ID': 422, 'relevance_score': 0.9936611}), Document(page_content='findings:** the organisation should follow up on the audit findings and implement any necessary corrective actions.\n## what to look for during an iso 27001 internal audit\nduring an iso 27001 internal audit, the auditor will look for evidence that\nthe isms is conforming to the requirements of iso 27001 and that it is\noperating effectively. the auditor will focus on the following areas and\nevidence that supports them:\n * risk assessment: the auditor will assess whether the organisation has conducted a thorough risk assessment and whether the identified risks have been appropriately addressed. * information security controls: the auditor will assess whether the organisation has implemented and is maintaining appropriate information security controls to mitigate the identified risks. * isms documentation: the auditor will assess whether the isms is adequately documented. you can find a list of the required documentation for the iso 27001 certification here. * awareness and training: the auditor will assess whether staff are aware of their information security responsibilities and have received appropriate training. * management review: the auditor will assess whether the organisation conducts regular management reviews of the isms.\n## how to report on the findings of an iso 27001 internal audit\nthe audit findings should be documented in a report. this report should\ninclude the following:\n * audit objectives: the audit objectives should be clearly stated in the report.', metadata={'description': 'Ensure your ISMS is operating effectively for ISO 27001 compliance. Learn all you need to know about ISO 27001 Clause 9.2 internal audits in our guide.\n', 'doc_ID': 424, 'language': 'en-gb', 'original_text': 'findings:** The organisation should follow up on the audit findings and implement any necessary corrective actions.\n## What to look for during an ISO 27001 internal audit\nDuring an ISO 27001 internal audit, the auditor will look for evidence that\nthe ISMS is conforming to the requirements of ISO 27001 and that it is\noperating effectively. The auditor will focus on the following areas and\nevidence that supports them:\n * Risk assessment: The auditor will assess whether the organisation has conducted a thorough risk assessment and whether the identified risks have been appropriately addressed. * Information security controls: The auditor will assess whether the organisation has implemented and is maintaining appropriate information security controls to mitigate the identified risks. * ISMS documentation: The auditor will assess whether the ISMS is adequately documented. You can find a list of the required documentation for the ISO 27001 certification here. * Awareness and training: The auditor will assess whether staff are aware of their information security responsibilities and have received appropriate training. * Management review: The auditor will assess whether the organisation conducts regular management reviews of the ISMS.\n## How to report on the findings of an ISO 27001 internal audit\nThe audit findings should be documented in a report. This report should\ninclude the following:\n * Audit objectives: The audit objectives should be clearly stated in the report.', 'source': 'https://www.dataguard.co.uk/knowledge/iso-27001/clause-9-2-internal-audit/', 'title': 'ISO 27001 Clause 9.2: Internal Audit', 'relevance_score': 0.9900251}), Document(page_content=""to stakeholders that the isms is operating effectively and that the organisation is taking steps to protect its sensitive information.\n## does iso 27001 require an internal audit?\nyes, iso 27001 requires organisations to conduct regular internal audits of\ntheir information security management system. this is stated in clause 9.2 of\nthe standard, which states that:\nthe organisation shall conduct internal audits at planned intervals to provide\ninformation on whether the isms:\n 1. conforms to the organisation's own requirements for its information security management system; and 2. meets the requirements of this international standard.\nthe standard does not specify how often internal audits should be conducted,\nbut it is recommended that they be conducted at least annually.\ninternal audits are an important part of maintaining an effective isms. they\nhelp organisations to identify and address any weaknesses in their isms before\nthey are exploited by attackers.\n## what are iso 27001 internal audit requirements?\niso 27001 audit requirements:\n * the audit must be conducted by an independent auditor who is qualified to audit iso 27001. * the audit must be planned and conducted in accordance with a documented audit methodology. * the audit must cover all aspects of the isms, including risk assessment, information security controls, isms documentation, awareness and training, and management review. * the audit findings must be documented in a report that is submitted to the"", metadata={'source': 'https://www.dataguard.co.uk/knowledge/iso-27001/clause-9-2-internal-audit/', 'title': 'ISO 27001 Clause 9.2: Internal Audit', 'description': 'Ensure your ISMS is operating effectively for ISO 27001 compliance. Learn all you need to know about ISO 27001 Clause 9.2 internal audits in our guide.\n', 'language': 'en-gb', 'original_text': ""to stakeholders that the ISMS is operating effectively and that the organisation is taking steps to protect its sensitive information.\n## Does ISO 27001 require an internal audit?\nYes, ISO 27001 requires organisations to conduct regular internal audits of\ntheir information security management system. This is stated in Clause 9.2 of\nthe standard, which states that:\nThe organisation shall conduct internal audits at planned intervals to provide\ninformation on whether the ISMS:\n 1. conforms to the organisation's own requirements for its information security management system; and 2. meets the requirements of this international standard.\nThe standard does not specify how often internal audits should be conducted,\nbut it is recommended that they be conducted at least annually.\nInternal audits are an important part of maintaining an effective ISMS. They\nhelp organisations to identify and address any weaknesses in their ISMS before\nthey are exploited by attackers.\n## What are ISO 27001 internal audit requirements?\nISO 27001 audit requirements:\n * The audit must be conducted by an independent auditor who is qualified to audit ISO 27001. * The audit must be planned and conducted in accordance with a documented audit methodology. * The audit must cover all aspects of the ISMS, including risk assessment, information security controls, ISMS documentation, awareness and training, and management review. * The audit findings must be documented in a report that is submitted to the"", 'doc_ID': 421, 'relevance_score': 0.98403233}), Document(page_content='monitoring/measurement program according to isms-9.1, reports from conducted internal audits according to isms-9.2, the degree of fulfillment of security objectives (effectiveness).\n- have new risks been identified during the risk assessment in the past period? what is the status of risk treatment? the goal here is to be able to recognize consistent and prompt risk treatment.\n- are there any ideas and suggestions for improving the isms and its performance? such material can come from customers, partners, own staff or from external sources.\nthis comprehensive package of information must be made available to the management level from the isms and other sources.\nwhat should the output of the management review consist of? the management level should definitively determine what needs to be done for the continuous improvement of the isms and how to deal with recognized change needs in the isms for the next time interval.\nfrom this, specific tasks for individual organizational units and roles can be derived - this should also be associated with the release of corresponding resources, otherwise this action will be ineffective. it should not go unmentioned at this point that the result of the management review can also be ""continue as before"". however, based on all experience, this is likely to be a rare exception.\ndue to the character of the assignment, but also due to the fundamental requirement of traceability of all processes, the results of the management review must be documented information (in writing)', metadata={'source': 'ISO 27001_2022_Kersten_und_Schroeder.pdf', 'title': 'ISO 27001_2022_Kersten_und_Schroeder', 'original_text': 'monitoring/measurement program according to ISMS-9.1, reports from conducted internal audits according to ISMS-9.2, the degree of fulfillment of security objectives (effectiveness).\n- Have new risks been identified during the risk assessment in the past period? What is the status of risk treatment? The goal here is to be able to recognize consistent and prompt risk treatment.\n- Are there any ideas and suggestions for improving the ISMS and its performance? Such material can come from customers, partners, own staff or from external sources.\nThis comprehensive package of information must be made available to the management level from the ISMS and other sources.\nWhat should the output of the management review consist of? The management level should definitively determine what needs to be done for the continuous improvement of the ISMS and how to deal with recognized change needs in the ISMS for the next time interval.\nFrom this, specific tasks for individual organizational units and roles can be derived - this should also be associated with the release of corresponding resources, otherwise this action will be ineffective. It should not go unmentioned at this point that the result of the management review can also be ""continue as before"". However, based on all experience, this is likely to be a rare exception.\nDue to the character of the assignment, but also due to the fundamental requirement of traceability of all processes, the results of the management review must be documented information (in writing)', 'doc_ID': 2678, 'relevance_score': 0.9806178})]","The following aspects are reviewed in internal audits according to topic 9.2:
1. The establishment of the ISMS according to the planning
2. The proper functioning of the ISMS
3. The effectiveness of the ISMS
4. Compliance with the requirements of ISO 27001

To effectively manage these tasks, the audit program should specify the following:
1. Different audits with their subject and frequency
2. The responsible personnel for conducting the audits
3. The type of documentation and reporting
4. An audit plan with scheduling, content, and procedural planning
5. Documentation of findings and results in the audit report
6. Inclusion and evaluation of identified deficiencies in the audit report
7. Specification and scheduling of corrective actions
8. Evidence of implementation of corrective actions in the aftermath","ISO 27001 requires organizations to conduct regular internal audits to ensure their Information Security Management System (ISMS) conforms to the organization's requirements and the standard's requirements. NA 9.2 specifically refers to the internal audit process. 

The internal audit program should cover all aspects of the ISMS, including risk assessment, information security controls, ISMS documentation, awareness and training, and management review. The audit should provide evidence that these areas are being effectively managed according to the organization's policies and the ISO 27001 standard.
",True,0.40375586854460094,0.10426540284360189,0.20657276995305163,0.4756621718406677,0.9098690748214722,0.999876856803894,0.7604829788775047,0,0,2.386396646499634,2.1190028190612793,0.23799610137939453,4.505399465560913
Fine-tuned_finetuned-ISO-27001_1024_l2_All_1536_264_False,Hybrid_Rerank_Cohere,4,mixtral-8x7B-v0.1,16000,0,1,What steps need to be taken to address a deviation of the ISMS from the ISO 27001 norm and what measures can be taken to eliminate the causes of the deviation?,"[Document(page_content='must be observed.\n88 2 requirements for the isms\nisms-10.2 nonconformity and corrective measures\ndeviation from the norm concerns circumstances in an isms that contradict or at least do not fully meet the requirements of iso 27001.\nsuch deviations can be identified in internal audits and certification audits - of course, they can also be discovered by any other form of examination within the framework of the isms. sometimes they are also detected more or less accidentally. however, a corresponding correction is necessary in order to achieve or maintain conformity with the norm. in terms of correction, the following requirements (a) to (g) are made in isms-10.2.\nin clause (a), it is required to react to any occurring (i.e. known) deviation from the norm by initially planning and scheduling a suitable correction (measure).\noften there seems to be a simple correction for a deviation - here a short document, there a quick measure! however, if you analyze it more closely, you will find that this correction ""has wider implications"" - i.e. has consequences for other areas in the isms, perhaps even causes new deviations there. in view of this experience, it is required to first consider the consequences of the planned correction and only then implement it.\nclause (b) essentially asks the following question: how did the deviation in question occur? there must be causes for this. perhaps a certain requirement of the norm was simply overlooked or misunderstood, initially postponed and later forgotten. of course,', metadata={'source': 'ISO 27001_2022_Kersten_und_Schroeder.pdf', 'title': 'ISO 27001_2022_Kersten_und_Schroeder', 'original_text': 'must be observed.\n88 2 Requirements for the ISMS\nISMS-10.2 Nonconformity and corrective measures\nDeviation from the norm concerns circumstances in an ISMS that contradict or at least do not fully meet the requirements of ISO 27001.\nSuch deviations can be identified in internal audits and certification audits - of course, they can also be discovered by any other form of examination within the framework of the ISMS. Sometimes they are also detected more or less accidentally. However, a corresponding correction is necessary in order to achieve or maintain conformity with the norm. In terms of correction, the following requirements (a) to (g) are made in ISMS-10.2.\nIn clause (a), it is required to react to any occurring (i.e. known) deviation from the norm by initially planning and scheduling a suitable correction (measure).\nOften there seems to be a simple correction for a deviation - here a short document, there a quick measure! However, if you analyze it more closely, you will find that this correction ""has wider implications"" - i.e. has consequences for other areas in the ISMS, perhaps even causes new deviations there. In view of this experience, it is required to first consider the consequences of the planned correction and only then implement it.\nClause (b) essentially asks the following question: How did the deviation in question occur? There must be causes for this. Perhaps a certain requirement of the norm was simply overlooked or misunderstood, initially postponed and later forgotten. Of course,', 'doc_ID': 2682, 'relevance_score': 0.9975177}), Document(page_content=""a security policy is not up to date. * **major nonconformity:** a firewall is misconfigured, allowing unauthorized access to the organisation's network. * **minor nonconformity:** a user account is not properly disabled when an employee leaves the organisation. * **major nonconformity:** a data breach occurs due to a lack of security controls. * **minor nonconformity:** a security training session is not conducted on time. * **major nonconformity:** employees are not following security procedures, such as using strong passwords and avoiding phishing emails.\norganisations should have a process in place for identifying, reporting, and\nresolving both minor and major nonconformities. this process should be\ndocumented and communicated to all employees.\nby promptly addressing nonconformities, organisations can help to improve the\noverall effectiveness of their isms and protect their information assets.\n### what are corrective actions in iso 27001?\nonce the root cause of a nonconformity has been determined, the organisation\nshould take corrective action to eliminate the cause and prevent it from\nhappening again. corrective action may involve changing policies and\nprocedures, training employees, or implementing new security controls.\n## nonconformity and corrective action process\nthe following is a general overview of the nonconformity and corrective action\nprocess:\n 1. **identify the nonconformity:** this can be done through a variety of means, such as internal audits,"", metadata={'description': 'Identify & address Nonconformities in your ISMS to improve information security, according to ISO 27001 clause 10.2. Explore our Comprehensive Guide Today!', 'doc_ID': 438, 'language': 'en-gb', 'original_text': ""A security policy is not up to date. * **Major nonconformity:** A firewall is misconfigured, allowing unauthorized access to the organisation's network. * **Minor nonconformity:** A user account is not properly disabled when an employee leaves the organisation. * **Major nonconformity:** A data breach occurs due to a lack of security controls. * **Minor nonconformity:** A security training session is not conducted on time. * **Major nonconformity:** Employees are not following security procedures, such as using strong passwords and avoiding phishing emails.\nOrganisations should have a process in place for identifying, reporting, and\nresolving both minor and major nonconformities. This process should be\ndocumented and communicated to all employees.\nBy promptly addressing nonconformities, organisations can help to improve the\noverall effectiveness of their ISMS and protect their information assets.\n### What are corrective actions in ISO 27001?\nOnce the root cause of a nonconformity has been determined, the organisation\nshould take corrective action to eliminate the cause and prevent it from\nhappening again. Corrective action may involve changing policies and\nprocedures, training employees, or implementing new security controls.\n## Nonconformity and corrective action process\nThe following is a general overview of the nonconformity and corrective action\nprocess:\n 1. **Identify the nonconformity:** This can be done through a variety of means, such as internal audits,"", 'source': 'https://www.dataguard.co.uk/knowledge/iso-27001/clause-10-2-nonconformity-and-corrective-action/', 'title': 'ISO 27001 Clause 10.2: Nonconformity and Corrective Action', 'relevance_score': 0.9953544}), Document(page_content=""in isms maintenance\ntrain personnel on common threats facing your organization and how to respond\nestablish disciplinary or sanctions policies or processes for personnel found\nout of compliance with information security requirements\n12\nperform an internal audit\nallocate internal resources with necessary competencies who are independent of\nisms development and maintenance, or engage an independent third party\nverify conformance with requirements from annex a deemed applicable in your\nisms's statement of applicability\nshare internal audit results, including nonconformities, with the isms\ngoverning body and senior management\naddress identified issues before proceeding with the external audit\n13\nundergo external audit of isms to obtain iso 27001 certification\nengage an independent iso 27001 auditor\nconduct stage 1 audit consisting of an extensive documentation review; obtain\nfeedback regarding readiness to move to stage 2 audit\nconduct stage 2 audit consisting of tests performed on the isms to ensure\nproper design, implementation, and ongoing functionality; evaluate fairness,\nsuitability, and effective implementation and operation of controls\n14\naddress any nonconformities\nensure that all requirements of the iso 27001 standard are being addressed\nensure org is following processes that it has specified and documented\nensure org is upholding contractual requirements with third parties\naddress specific nonconformities identified by the iso 27001 auditor\nreceive auditor’s formal validation"", metadata={'description': 'Our ISO 27001 compliance checklist will help simplify your path to compliance.', 'doc_ID': 11, 'language': 'en', 'original_text': ""in ISMS maintenance\nTrain personnel on common threats facing your organization and how to respond\nEstablish disciplinary or sanctions policies or processes for personnel found\nout of compliance with information security requirements\n12\nPerform an internal audit\nAllocate internal resources with necessary competencies who are independent of\nISMS development and maintenance, or engage an independent third party\nVerify conformance with requirements from Annex A deemed applicable in your\nISMS's Statement of Applicability\nShare internal audit results, including nonconformities, with the ISMS\ngoverning body and senior management\nAddress identified issues before proceeding with the external audit\n13\nUndergo external audit of ISMS to obtain ISO 27001 certification\nEngage an independent ISO 27001 auditor\nConduct Stage 1 Audit consisting of an extensive documentation review; obtain\nfeedback regarding readiness to move to Stage 2 Audit\nConduct Stage 2 Audit consisting of tests performed on the ISMS to ensure\nproper design, implementation, and ongoing functionality; evaluate fairness,\nsuitability, and effective implementation and operation of controls\n14\nAddress any nonconformities\nEnsure that all requirements of the ISO 27001 standard are being addressed\nEnsure org is following processes that it has specified and documented\nEnsure org is upholding contractual requirements with third parties\nAddress specific nonconformities identified by the ISO 27001 auditor\nReceive auditor’s formal validation"", 'source': 'https://www.vanta.com/resources/iso-27001-compliance-checklist', 'title': 'The ISO 27001 compliance checklist', 'relevance_score': 0.9939496}), Document(page_content=""clause 10.2 of iso 27001 requires organisations to identify, investigate, and\nresolve nonconformities. a nonconformity is a departure from the requirements\nof the isms.\nthis article will discuss the requirements of iso 27001 clause 10.2 and\nprovide guidance on how to implement a nonconformity and corrective action\nprocess in order to achieve or maintain an iso 27001 certification.\n### what is a nonconformity in iso 27001?\nnonconformities can be identified through a variety of means, such as internal\naudits, management reviews, and external audits. once a nonconformity has been\nidentified, the organisation should investigate it to determine the root cause\nand any potential impact on information security.\n## what is the difference between minor nonconformities and major\nnonconformities?\nthe difference between minor nonconformities and major nonconformities is the\nseverity of the impact on the organisation's information security management\nsystem.\nminor nonconformities are those that do not have a significant impact on the\neffectiveness of the isms. they may be isolated incidents or one-off\noccurrences. minor nonconformities can be dealt with relatively quickly and\neasily, and they do not necessarily require immediate corrective action.\nmajor nonconformities, on the other hand, are those that have a significant\nimpact on the effectiveness of the isms. they may be systemic problems that\ncould lead to serious information security risks. major nonconformities\nrequire immediate corrective action to mitigate"", metadata={'description': 'Identify & address Nonconformities in your ISMS to improve information security, according to ISO 27001 clause 10.2. Explore our Comprehensive Guide Today!', 'doc_ID': 436, 'language': 'en-gb', 'original_text': ""Clause 10.2 of ISO 27001 requires organisations to identify, investigate, and\nresolve nonconformities. A nonconformity is a departure from the requirements\nof the ISMS.\nThis article will discuss the requirements of ISO 27001 clause 10.2 and\nprovide guidance on how to implement a nonconformity and corrective action\nprocess in order to achieve or maintain an ISO 27001 certification.\n### What is a nonconformity in ISO 27001?\nNonconformities can be identified through a variety of means, such as internal\naudits, management reviews, and external audits. Once a nonconformity has been\nidentified, the organisation should investigate it to determine the root cause\nand any potential impact on information security.\n## What is the difference between minor nonconformities and major\nnonconformities?\nThe difference between minor nonconformities and major nonconformities is the\nseverity of the impact on the organisation's information security management\nsystem.\nMinor nonconformities are those that do not have a significant impact on the\neffectiveness of the ISMS. They may be isolated incidents or one-off\noccurrences. Minor nonconformities can be dealt with relatively quickly and\neasily, and they do not necessarily require immediate corrective action.\nMajor nonconformities, on the other hand, are those that have a significant\nimpact on the effectiveness of the ISMS. They may be systemic problems that\ncould lead to serious information security risks. Major nonconformities\nrequire immediate corrective action to mitigate"", 'source': 'https://www.dataguard.co.uk/knowledge/iso-27001/clause-10-2-nonconformity-and-corrective-action/', 'title': 'ISO 27001 Clause 10.2: Nonconformity and Corrective Action', 'relevance_score': 0.9913223})]","Treating a deviation in the ISMS requires several steps. Firstly, detailed monitoring should be conducted to accurately capture the situation. Then corrective actions can be taken to eliminate the deviation. It is important to evaluate which measures are suitable for identifying and eliminating the causes of the deviation. A root cause analysis should be conducted to determine if the deviation exists elsewhere or can reoccur. All measures should be appropriate and weighed against the negative consequences of a persisting deviation. The implementation and effectiveness of the measures should be reviewed, and changes to the ISMS may be necessary. It is important to document all steps and outcomes.","To address a deviation of the Information Security Management System (ISMS) from the ISO 27001 standard, the following steps should be taken:

1. Identify the deviation: The first step is to identify and document the deviation from the ISO 27001 requirements. This can be done through internal audits, management reviews, or other forms of examination.

2. Plan and schedule a correction: Once the deviation is identified, plan and schedule a suitable correction measure in accordance with clause (a) of ISMS-10.2. This requires reacting to any occurring deviation by planning and scheduling a correction measure.

3. Analyze the consequences: Consider the consequences of the planned correction before implementing it, as it may have wider implications and cause new deviations in other areas of the ISMS.

4. Determine the root cause: Identify the cause of the deviation, as required by clause (b) of ISMS-10.2. This may involve overlooking or misunderstanding a specific requirement, postponing and later forgetting a requirement, or not keeping a security policy up-to-date.

5. Implement corrective action:",True,0.43416370106761565,0.1290322580645161,0.24199288256227755,0.5579432249069214,0.7104737907648087,0.9998906850814819,0.7402298134034382,0,0,2.557878255844116,3.730531692504883,0.23877930641174316,6.288409948348999
Fine-tuned_finetuned-ISO-27001_1024_l2_All_1536_264_False,Hybrid_Rerank_Cohere,4,mixtral-8x7B-v0.1,16000,0,1,"What purpose does a self-assessment play in evaluating the effectiveness of protective measures for an ISMS, and what consequences can deviations have?","[Document(page_content='objectives: if they are not sufficient, corrective measures must be ordered. the evaluation also includes reports on security incidents that have occurred and the resulting consequences.\nthere are generally risks involved in achieving the objectives: what can happen on the way to achieving the objectives and what are the consequences for the organization? conclusion: an isms requires qualified risk management, which should be established by the top management level as early as possible.\n(f) it must be ensured that all individuals in the target group contribute to the effectiveness of the isms.\nthe individuals mentioned must take responsibility for security in their work area or work processes so that the isms can fulfill its task. what does this mean specifically? each person in the target group must first know what security requirements apply to their own work area, what this means in practice, how deviations are identified, and that these deviations must be reported.\nas an example for such reports, let\'s take the ""ordinary"" user in the organization who uses an it application and suddenly notices long response times or incorrect data. the security management must be informed about this immediately. if this is not done, these error conditions could escalate, spread, and possibly be repairable only with great effort or reputation loss - scenarios that would contradict the organization\'s goals.\nit is important to realize that the individuals mentioned initially need to be sensitized and trained before they', metadata={'source': 'ISO 27001_2022_Kersten_und_Schroeder.pdf', 'title': 'ISO 27001_2022_Kersten_und_Schroeder', 'original_text': 'objectives: if they are not sufficient, corrective measures must be ordered. The evaluation also includes reports on security incidents that have occurred and the resulting consequences.\nThere are generally risks involved in achieving the objectives: what can happen on the way to achieving the objectives and what are the consequences for the organization? Conclusion: An ISMS requires qualified risk management, which should be established by the top management level as early as possible.\n(f) It must be ensured that all individuals in the target group contribute to the effectiveness of the ISMS.\nThe individuals mentioned must take responsibility for security in their work area or work processes so that the ISMS can fulfill its task. What does this mean specifically? Each person in the target group must first know what security requirements apply to their own work area, what this means in practice, how deviations are identified, and that these deviations must be reported.\nAs an example for such reports, let\'s take the ""ordinary"" user in the organization who uses an IT application and suddenly notices long response times or incorrect data. The security management must be informed about this immediately. If this is not done, these error conditions could escalate, spread, and possibly be repairable only with great effort or reputation loss - scenarios that would contradict the organization\'s goals.\nIt is important to realize that the individuals mentioned initially need to be sensitized and trained before they', 'doc_ID': 2605, 'relevance_score': 0.95318794}), Document(page_content='we have already considered these aspects in the measurements/audits of the isms processes and controls. if no objections arise here, an isms generally delivers the expected performance (= the expected result). the question of adequacy can also be asked for the isms as a whole - analogous to the consideration of controls.\nin terms of effectiveness, it must be assessed whether the organization achieves its security objectives according to isms-5.1 (a) overall. to put it differently, it is difficult to imagine achieving security objectives if:\n- security incidents occur frequently and cause damage,\n- security vulnerabilities exist that pose potential risks,\n- other known risks have not been addressed, or\n- the required controls have not been fully implemented.\nlet\'s go through the four points mentioned above.\nregarding security incidents, one could say: the less incidents and the smaller their impact on the organization, the higher or better the effectiveness of the isms. so what should be monitored/measured in this case? we analyze the security incidents recorded in a ticket system and also capture the severity of the incidents or their damage class (alternatively, their processing priority in the ticket system). this way, we have determined the number of security incidents for each damage class defined in the risk analysis during the considered period. since serious incidents should have a greater impact in the assessment than minor ones, it leads to a product formation of ""number x damage class,"" whose', metadata={'doc_ID': 2664, 'original_text': 'We have already considered these aspects in the measurements/audits of the ISMS processes and controls. If no objections arise here, an ISMS generally delivers the expected performance (= the expected result). The question of adequacy can also be asked for the ISMS as a whole - analogous to the consideration of controls.\nIn terms of effectiveness, it must be assessed whether the organization achieves its security objectives according to ISMS-5.1 (a) overall. To put it differently, it is difficult to imagine achieving security objectives if:\n- Security incidents occur frequently and cause damage,\n- Security vulnerabilities exist that pose potential risks,\n- Other known risks have not been addressed, or\n- The required controls have not been fully implemented.\nLet\'s go through the four points mentioned above.\nRegarding security incidents, one could say: The less incidents and the smaller their impact on the organization, the higher or better the effectiveness of the ISMS. So what should be monitored/measured in this case? We analyze the security incidents recorded in a ticket system and also capture the severity of the incidents or their damage class (alternatively, their processing priority in the ticket system). This way, we have determined the number of security incidents for each damage class defined in the risk analysis during the considered period. Since serious incidents should have a greater impact in the assessment than minor ones, it leads to a product formation of ""number x damage class,"" whose', 'source': 'ISO 27001_2022_Kersten_und_Schroeder.pdf', 'title': 'ISO 27001_2022_Kersten_und_Schroeder', 'relevance_score': 0.9046505}), Document(page_content='number of security incidents for each damage class defined in the risk analysis during the considered period. since serious incidents should have a greater impact in the assessment than minor ones, it leads to a product formation of ""number x damage class,"" whose distribution then becomes the indicator ""security incidents in the isms.""\nduring audit activities in the isms, security vulnerabilities or weaknesses are often identified or knowledge of possible vulnerabilities and new risks is obtained from various sources. an effective isms is characterized by promptly responding to such insights: recording the insights, analyzing the resulting risks, fixing deficits/weaknesses if necessary, documenting solutions.\nin this context, the efficiency of handling such insights is a notable indicator for the performance of the isms. an organization could proceed with the motto: if we have no deficits or weaknesses, or at least quickly eliminate them, we have largely achieved our goal of secure information processing.\nsecurity objectives have been assigned controls according to isms-6.2. we have already discussed step-by-step plans for the implementation of controls above for each individual control.\nsome things have been implemented, including the possibility of measurements. an interesting aspect here would be the degree of implementation as an average across all controls of the isms - for example, as the average of individual values or with appropriate weighting. it is clear that this average/weighted degree of', metadata={'doc_ID': 2665, 'original_text': 'number of security incidents for each damage class defined in the risk analysis during the considered period. Since serious incidents should have a greater impact in the assessment than minor ones, it leads to a product formation of ""number x damage class,"" whose distribution then becomes the indicator ""security incidents in the ISMS.""\nDuring audit activities in the ISMS, security vulnerabilities or weaknesses are often identified or knowledge of possible vulnerabilities and new risks is obtained from various sources. An effective ISMS is characterized by promptly responding to such insights: Recording the insights, analyzing the resulting risks, fixing deficits/weaknesses if necessary, documenting solutions.\nIn this context, the efficiency of handling such insights is a notable indicator for the performance of the ISMS. An organization could proceed with the motto: If we have no deficits or weaknesses, or at least quickly eliminate them, we have largely achieved our goal of secure information processing.\nSecurity objectives have been assigned controls according to ISMS-6.2. We have already discussed step-by-step plans for the implementation of controls above for each individual control.\nsome things have been implemented, including the possibility of measurements. An interesting aspect here would be the degree of implementation as an average across all controls of the ISMS - for example, as the average of individual values or with appropriate weighting. It is clear that this average/weighted degree of', 'source': 'ISO 27001_2022_Kersten_und_Schroeder.pdf', 'title': 'ISO 27001_2022_Kersten_und_Schroeder', 'relevance_score': 0.8640812}), Document(page_content=""includes the regular review of the organization's own isms to identify any deviations or potential for improvement and to initiate their implementation.\nthis immediately brings to mind roles such as auditor, compliance manager, internal auditor, whereas the it security officer, if present, is less suitable for this purpose: reviewing and evaluating one's own activities leads to a typical conflict of interest.\nthe role under 2. must be seen in conjunction with the so-called performance evaluation of the isms as required in section isms-10. we will provide further explanation on this in the corresponding section at the end of this chapter. reporting to the management level is the minimum requirement: of course, corresponding reports can also be made available to other entities and individuals - by the same role under 2. or by another.\nin iso 27001, the information security officer is only mentioned as an example of a role within the isms, see control a-5.2 in chapter 3.\nthis includes, for example, compliance with data protection requirements (ds-gvo [1] and bdsg [3] and others) and thus also the role of the data protection officer.\nappendix a of iso 27001 lists a number of security-related activities that should be assigned to a role within the isms - however, appendix a is not binding. for more details, see chapter 3 in this book.\n2.2 leadership (isms-5) 49\nonce agreement has been reached on all necessary and desired roles, their tasks and authorities should be documented in writing, for example in a"", metadata={'source': 'ISO 27001_2022_Kersten_und_Schroeder.pdf', 'title': 'ISO 27001_2022_Kersten_und_Schroeder', 'original_text': ""includes the regular review of the organization's own ISMS to identify any deviations or potential for improvement and to initiate their implementation.\nThis immediately brings to mind roles such as auditor, compliance manager, internal auditor, whereas the IT security officer, if present, is less suitable for this purpose: Reviewing and evaluating one's own activities leads to a typical conflict of interest.\nThe role under 2. must be seen in conjunction with the so-called performance evaluation of the ISMS as required in section ISMS-10. We will provide further explanation on this in the corresponding section at the end of this chapter. Reporting to the management level is the minimum requirement: Of course, corresponding reports can also be made available to other entities and individuals - by the same role under 2. or by another.\nIn ISO 27001, the information security officer is only mentioned as an example of a role within the ISMS, see control A-5.2 in chapter 3.\nThis includes, for example, compliance with data protection requirements (DS-GVO [1] and BDSG [3] and others) and thus also the role of the data protection officer.\nAppendix A of ISO 27001 lists a number of security-related activities that should be assigned to a role within the ISMS - however, Appendix A is not binding. For more details, see chapter 3 in this book.\n2.2 Leadership (ISMS-5) 49\nOnce agreement has been reached on all necessary and desired roles, their tasks and authorities should be documented in writing, for example in a"", 'doc_ID': 2615, 'relevance_score': 0.84156543})]","Self-assessment plays an significant role in evaluating the effectiveness of protective measures. It involves a self-assessment by management, which is then reviewed by auditors or inspectors for completeness, correctness, and validity. Deviations are documented as issues and classified as minor or major issues depending on their magnitude. For compliance with laws and regulations, even a significant deviation or multiple minor deviations can indicate non-compliance.","A self-assessment in the context of an Information Security Management System (ISMS) for ISO 27001 serves to evaluate the effectiveness of protective measures. It helps determine if the security measures are sufficient and if the established objectives are being met. 

The consequences of deviations can be significant. They may lead to security incidents, which could result in damage, disruption of operations, or non-compliance with legal or regulatory requirements. This could negatively impact the organization's reputation and financial status. 

The self-assessment process involves all individuals in the target group, who are responsible for security in their respective work areas. They must understand the security requirements, identify deviations, and report them promptly. This ensures that the ISMS can fulfill its task of protecting the organization's information assets.

The effectiveness of the ISMS can be measured by the number and severity of security incidents, the efficiency in addressing security vulnerabilities, the implementation of assigned controls, and the regular review and improvement of the ISMS. 

The role of the information security officer, as outlined in ISO 27001, is crucial in this process. They ensure compliance with data protection requirements, oversee the",True,0.30115830115830117,0.0933852140077821,0.14671814671814673,0.4469446539878845,0.898302286863327,0.9998883008956909,0.7117868101410604,0,0,2.2448558807373047,3.576349973678589,0.23991918563842773,5.8212058544158936
Fine-tuned_finetuned-ISO-27001_1024_l2_All_1536_264_False,Hybrid_Rerank_Cohere,4,mixtral-8x7B-v0.1,16000,0,1,What tasks does the role of the risk manager have and why is it important?,"[Document(page_content='with other roles involved in risk management.\nbusiness managers (who are also likely to be information\nasset ‘owners’): are responsible for determining the\ncriticality and sensitivity of business operations and,\ntherefore, of the information assets on which those business\noperations depend. business managers are best placed to\nassess the real asset value that will inform the impact side of\nthe risk assessment equation.\nbusiness and functional managers: those responsible for\nbusiness operations and the procurement process; they must\n61\n4: roles and responsibilities\nalso take an active role in the risk management process.\nthese managers are the individuals with the authority and\nresponsibility for making the trade-off decisions essential to\nachieving business objectives. their involvement in the risk\nmanagement process helps deliver effective security for the\ninformation systems, helping the organisation achieve its\nobjectives with minimal expenditure on resources.\ninformation security officers (isos), information\nsecurity managers and computer security officers: are\nresponsible for their organisation’s information security\nactivity, including the implementation of risk treatment\ndecisions. isos should all be appropriately qualified;\nappropriate qualifications are those (such as cism®,\ncismp) that are focused on managing information security,\nrather than its technical implementation.2> isos have a\nleading role to play in introducing an appropriate, structured\nmethodology that helps identify, evaluate and', metadata={'doc_ID': 712, 'original_text': 'with other roles involved in risk management.\nBusiness managers (who are also likely to be information\nasset ‘owners’): are responsible for determining the\ncriticality and sensitivity of business operations and,\ntherefore, of the information assets on which those business\noperations depend. Business managers are best placed to\nassess the real asset value that will inform the impact side of\nthe risk assessment equation.\nBusiness and functional managers: those responsible for\nbusiness operations and the procurement process; they must\n61\n4: Roles and responsibilities\nalso take an active role in the risk management process.\nThese managers are the individuals with the authority and\nresponsibility for making the trade-off decisions essential to\nachieving business objectives. Their involvement in the risk\nmanagement process helps deliver effective security for the\ninformation systems, helping the organisation achieve its\nobjectives with minimal expenditure on resources.\nInformation security officers (ISOs), information\nsecurity managers and computer security officers: are\nresponsible for their organisation’s information security\nactivity, including the implementation of risk treatment\ndecisions. ISOs should all be appropriately qualified;\nappropriate qualifications are those (such as CISM®,\nCISMP) that are focused on managing information security,\nrather than its technical implementation.2> ISOs have a\nleading role to play in introducing an appropriate, structured\nmethodology that helps identify, evaluate and', 'source': 'Calder - 2019 - Information Security Risk Management for ISO 27001.pdf', 'title': 'Calder - 2019 - Information Security Risk Management for ISO 27001', 'relevance_score': 0.9142907}), Document(page_content='management context.\nrisk management: two phases\nrisk management is the process that allows managers to\nbalance the operational and economic costs of protective\nmeasures and achieve gains in mission capability by\nprotecting the it systems and data that support their\norganisation’s missions.""!\norganisations develop and implement risk management\nstrategies in order to reduce negative impacts and to provide\na structured, consistent basis for making decisions around\nrisk mitigation options. for the purpose of considering the\ntopic of risk management, it has two phases: risk assessment\nand risk treatment, but in practice it is a continual activity\nthat includes horizon scanning, risk assessment, risk\ndecisions, risk treatment(s), communication, reassessment,\nfurther treatments, and so on.\n° iso 27001, clause 5.1 a).\n© tso 27001, clause 5.2 a).\n\'i nist sp 800-30, introduction.\n17\n1: risk management\nrisk assessment is the process of identifying and estimating\nthe risks that the organisation may be subject to.\nrisk treatment is the process of responding to identified risks\nin light of risk decisions.\nrisk assessment typically adopts one of two methods:\ne the process of identifying scenarios, their impact on the\norganisation and the frequency at which they may occur.\ne focusing on information assets and the threats that they\nare subject to. considering the vulnerabilities the threats\nmight exploit enables the risk assessor to identify the\nlikelihood and impact of each identified risk.\nin the simplified', metadata={'doc_ID': 663, 'original_text': 'management context.\nRisk management: two phases\nRisk management is the process that allows managers to\nbalance the operational and economic costs of protective\nmeasures and achieve gains in mission capability by\nprotecting the IT systems and data that support their\norganisation’s missions.""!\nOrganisations develop and implement risk management\nstrategies in order to reduce negative impacts and to provide\na structured, consistent basis for making decisions around\nrisk mitigation options. For the purpose of considering the\ntopic of risk management, it has two phases: risk assessment\nand risk treatment, but in practice it is a continual activity\nthat includes horizon scanning, risk assessment, risk\ndecisions, risk treatment(s), communication, reassessment,\nfurther treatments, and so on.\n° ISO 27001, Clause 5.1 a).\n© TSO 27001, Clause 5.2 a).\n\'I NIST SP 800-30, Introduction.\n17\n1: Risk management\nRisk assessment is the process of identifying and estimating\nthe risks that the organisation may be subject to.\nRisk treatment is the process of responding to identified risks\nin light of risk decisions.\nRisk assessment typically adopts one of two methods:\ne The process of identifying scenarios, their impact on the\norganisation and the frequency at which they may occur.\ne Focusing on information assets and the threats that they\nare subject to. Considering the vulnerabilities the threats\nmight exploit enables the risk assessor to identify the\nlikelihood and impact of each identified risk.\nIn the simplified', 'source': 'Calder - 2019 - Information Security Risk Management for ISO 27001.pdf', 'title': 'Calder - 2019 - Information Security Risk Management for ISO 27001', 'relevance_score': 0.9066531}), Document(page_content='risk is managed by agreeing with the board, risk\nowners and the forum, the organization’s approach to risk management,\nthe risk treatment plan and the level of assurance that will be necessary.\nselecting control objectives and controls that, when implemented, will\nmeet the objectives.\npreparing the statement of applicability and risk treatment plan.\nrecording and handling security incidents, including establishing their\ncauses and determining appropriate corrective and/or preventive action.\nreporting to the forum on progress with implementing the isms, and\non incidents, issues, security matters and current threats.\nensuring management reviews are carried out as required.\norganizing information security 61\n14 monitoring compliance with the standard and reporting to management\non the effectiveness of the isms.\n15 driving continual improvement activity across the entire isms.\nthe cross-functional management forum\nthe concept of a cross-functional forum has disappeared from iso27001. it\nwas a sensible idea and organizations should consider setting one up. the\ndriving logic is that information security activities would be coordinated by\nrepresentatives from different parts of the organization with relevant roles\nand job functions. this is particularly relevant for larger organizations,\nwhere security activity needs to be coordinated across a number of divi-\nsions, companies or sites, each of which may have its own information\nsecurity manager or adviser. this cross-functional forum could, in', metadata={'doc_ID': 1980, 'original_text': 'risk is managed by agreeing with the board, risk\nowners and the forum, the organization’s approach to risk management,\nthe risk treatment plan and the level of assurance that will be necessary.\nSelecting control objectives and controls that, when implemented, will\nmeet the objectives.\nPreparing the statement of applicability and risk treatment plan.\nRecording and handling security incidents, including establishing their\ncauses and determining appropriate corrective and/or preventive action.\nReporting to the forum on progress with implementing the ISMS, and\non incidents, issues, security matters and current threats.\nEnsuring management reviews are carried out as required.\nORGANIZING INFORMATION SECURITY 61\n14 Monitoring compliance with the standard and reporting to management\non the effectiveness of the ISMS.\n15 Driving continual improvement activity across the entire ISMS.\nThe cross-functional management forum\nThe concept of a cross-functional forum has disappeared from ISO27001. It\nwas a sensible idea and organizations should consider setting one up. The\ndriving logic is that information security activities would be coordinated by\nrepresentatives from different parts of the organization with relevant roles\nand job functions. This is particularly relevant for larger organizations,\nwhere security activity needs to be coordinated across a number of divi-\nsions, companies or sites, each of which may have its own information\nsecurity manager or adviser. This cross-functional forum could, in', 'source': 'Watkins, Calder - 2020 - IT Governance - An International Guide to Data Security and ISO 27001 ISO 27002.pdf', 'title': 'Watkins, Calder - 2020 - IT Governance - An International Guide to Data Security and ISO 27001 ISO 27002', 'relevance_score': 0.8854335}), Document(page_content='be periodic reviews of\nsecurity risks and related controls - taking account of new threats and\nvulnerabilities, assessing the impact of changes in the business, its goals or\nprocesses, technology and/or its external environment (such as legislation,\nregulation or society) and simply to confirm that controls remain effective\nand appropriate.\nthe second is that the standard requires the organization to identify the\ncompetences required of the people operating within the isms, including\nthose involved in risk assessment. the need for an appropriately competent\nperson was covered in some detail in chapter 4. it is essential that risk\nassessment — the core competency of information security management — is\nconducted by an appropriately qualified and experienced person. this is\nlogical; the key step on which the entire isms will be built needs, itself, to\nbe solid. the iso27001 auditor will therefore want to see documentary\nevidence of appropriate knowledge skills.\na number of organizations will already have a risk management function\nstaffed by people with training that enables them to carry out risk assess-\nments. the role of the risk management department is, usually, systematically\nto identify, evaluate and control potential losses to the organization that\nmay result from things that have not yet happened. the skills and methodol-\nogy of this department may or may not meet the organization’s requirements.\neither way, there are potentially significant benefits for such an organization\nif its information', metadata={'doc_ID': 2037, 'original_text': 'be periodic reviews of\nsecurity risks and related controls - taking account of new threats and\nvulnerabilities, assessing the impact of changes in the business, its goals or\nprocesses, technology and/or its external environment (such as legislation,\nregulation or society) and simply to confirm that controls remain effective\nand appropriate.\nThe second is that the standard requires the organization to identify the\ncompetences required of the people operating within the ISMS, including\nthose involved in risk assessment. The need for an appropriately competent\nperson was covered in some detail in Chapter 4. It is essential that risk\nassessment — the core competency of information security management — is\nconducted by an appropriately qualified and experienced person. This is\nlogical; the key step on which the entire ISMS will be built needs, itself, to\nbe solid. The ISO27001 auditor will therefore want to see documentary\nevidence of appropriate knowledge skills.\nA number of organizations will already have a risk management function\nstaffed by people with training that enables them to carry out risk assess-\nments. The role of the risk management department is, usually, systematically\nto identify, evaluate and control potential losses to the organization that\nmay result from things that have not yet happened. The skills and methodol-\nogy of this department may or may not meet the organization’s requirements.\nEither way, there are potentially significant benefits for such an organization\nif its information', 'source': 'Watkins, Calder - 2020 - IT Governance - An International Guide to Data Security and ISO 27001 ISO 27002.pdf', 'title': 'Watkins, Calder - 2020 - IT Governance - An International Guide to Data Security and ISO 27001 ISO 27002', 'relevance_score': 0.8734309})]","The role of the risk manager encompasses crucial tasks in risk management:

1. Introduction and Implementation:
Responsible for the introduction, implementation, and maintenance of risk management with adequate resources.
2. Ensuring Compliance:
Ensuring that processes align with business requirements and comply with legal and contractual obligations.
3. Maintenance of Security:
Correct application of measures to maintain appropriate security.
4. Audits and Improvements:
Leading audits, responding to results, and continuously improving risk management.
5. Delegation of Tasks:
Delegating tasks, especially to the risk coordinator for risk analysis with departments.
6. Training and Competence Development:
Ensuring that risk management personnel possess necessary competencies through training planning and coordination.

This role is important for effectively managing risks, complying with laws, implementing appropriate security measures, and training personnel, contributing to overall performance improvement in risk management.","The role of the risk manager in the context of ISO 27001 certification involves identifying, evaluating, and controlling potential information security risks that may result in losses for the organization. This role is crucial as it helps the organization balance the operational and economic costs of protective measures and achieve gains in mission capability by protecting the IT systems and data that support their operations.

Risk managers are responsible for conducting risk assessments, which typically involve identifying scenarios, their impact on the organization, and the frequency at which they may occur. They also focus on information assets and the threats they are subject to, considering the vulnerabilities that may be exploited to identify the likelihood and impact of each identified risk.

After assessing the risks, risk managers are involved in the risk treatment process, which involves responding to identified risks in light of risk decisions. They work with business and functional managers to make trade-off decisions essential to achieving business objectives while minimizing expenditure on resources.

Risk managers also play a leading role in introducing a structured methodology for risk management and ensuring that appropriate controls are implemented when necessary. They are responsible for recording and handling security incidents, reporting to management on incidents, issues, security matters, and current threats, and driving continual improvement activity across",True,0.3896848137535816,0.12103746397694524,0.20630372492836677,0.47045600414276123,0.8697817027568817,0.9983094930648804,0.7413502901187611,0,0,2.161951780319214,4.327093839645386,0.22700023651123047,6.4890456199646
Fine-tuned_finetuned-ISO-27001_1024_l2_All_1536_264_False,Hybrid_Rerank_Cohere,4,mixtral-8x7B-v0.1,16000,0,1,"What does it mean to monitor or measure objects and their attributes within the framework of the ISMS, and can you give an example for that related to awareness?","[Document(page_content='evaluated with regard to the defined purpose. the question then arises as to what can be derived from the analysis/evaluation for the organization: an assessment of the results.\nin the context of the isms, it is primarily about monitoring the performance of the isms. for this purpose, data is collected during operation that can provide information on:\ne whether the isms is generally able to achieve and maintain the security objectives of the organization (suitability),\ne whether the isms actually achieves the security objectives of the organization with its processes, rules, controls/measures (effectiveness),\ne to what extent the isms in terms of structure, equipment, and operations is appropriate compared to the desired level of security (adequacy).\n26 1 the iso/iec 27000 series of standards and their basic concepts\nfor the organization\'s extended goals (see the keyword ""goals"" in this section), monitoring/measurements can also be established.\nfor all relevant monitoring/measurements, an appropriate program (referred to as a measurement program) should be established within the isms. what is required for this and how the program can be designed will be discussed in chapter 2 in the section on isms-9.1 of the standard.\nto organize the measurement program in the isms properly, especially in a consistent manner, iso 27004 proposes a standardized model for measurements. we will explain it using a simple example and take the incident management process of the isms as an example.\nincident management is the', metadata={'doc_ID': 2574, 'original_text': 'evaluated with regard to the defined purpose. The question then arises as to what can be derived from the analysis/evaluation for the organization: an assessment of the results.\nIn the context of the ISMS, it is primarily about monitoring the performance of the ISMS. For this purpose, data is collected during operation that can provide information on:\ne whether the ISMS is generally able to achieve and maintain the security objectives of the organization (suitability),\ne whether the ISMS actually achieves the security objectives of the organization with its processes, rules, controls/measures (effectiveness),\ne to what extent the ISMS in terms of structure, equipment, and operations is appropriate compared to the desired level of security (adequacy).\n26 1 The ISO/IEC 27000 series of standards and their basic concepts\nFor the organization\'s extended goals (see the keyword ""goals"" in this section), monitoring/measurements can also be established.\nFor all relevant monitoring/measurements, an appropriate program (referred to as a measurement program) should be established within the ISMS. What is required for this and how the program can be designed will be discussed in Chapter 2 in the section on ISMS-9.1 of the standard.\nTo organize the measurement program in the ISMS properly, especially in a consistent manner, ISO 27004 proposes a standardized model for measurements. We will explain it using a simple example and take the incident management process of the ISMS as an example.\nIncident Management is the', 'source': 'ISO 27001_2022_Kersten_und_Schroeder.pdf', 'title': 'ISO 27001_2022_Kersten_und_Schroeder', 'relevance_score': 0.9951136}), Document(page_content='actual objects that should be measured. this defining process could be exemplified by the following\nexample: the organization is the overall object — organization process a/or it system x is a part of that\nobject and constitutes an object in itself— objects within that process that affect information security (people,\nrules, network, applications, facilities etc.) are generally the objects of measure in order to see the\neffectiveness of protecting information.\nwhen implementing an information security measurement program, care should be taken to consider that the\nobjects of measure may serve many organization processes within the isms scope, and may therefore have a\nlarger impact on the effectiveness of the isms and control objectives. such objects should generally be\nprioritized with the scope of the program, such as the security organization and linked process, computer\nhall, co-workers regarding information security, etc.\nthe measurement interval may vary, but is preferable that the measurement is done or summarized at certain\nintervals in order to fit into the management review and the continual improvement process and ambitions of\nthe isms. the design of the program should state this.\nthe reporting of the results should be designed so that communication is assured according to\niso/iec 27004:2009.\n© iso/iec 2010 — all rights reserved 65\niso/iec 27003:2010(e)\nthe design of the information security measurement program should be concluded in a document stipulating\nthe procedure, which should be approved', metadata={'source': 'ISO 27003 2010 (E).pdf', 'title': 'ISO 27003 2010 (E)', 'original_text': 'actual objects that should be measured. This defining process could be exemplified by the following\nexample: The Organization is the overall object — Organization Process A/or IT system X is a part of that\nobject and constitutes an object in itself— Objects within that process that affect information security (People,\nRules, Network, Applications, Facilities etc.) are generally the objects of measure in order to see the\neffectiveness of protecting information.\nWhen implementing an Information Security Measurement Program, care should be taken to consider that the\nobjects of measure may serve many organization processes within the ISMS scope, and may therefore have a\nlarger impact on the effectiveness of the ISMS and Control objectives. Such Objects should generally be\nprioritized with the scope of the program, such as the Security Organization and linked process, Computer\nHall, co-workers regarding information security, etc.\nThe measurement interval may vary, but is preferable that the measurement is done or summarized at certain\nintervals in order to fit into the management review and the continual improvement process and ambitions of\nthe ISMS. The design of the program should state this.\nThe reporting of the results should be designed so that communication is assured according to\nISO/IEC 27004:2009.\n© ISO/IEC 2010 — All rights reserved 65\nISO/IEC 27003:2010(E)\nThe design of the Information Security Measurement program should be concluded in a document stipulating\nthe procedure, which should be approved', 'doc_ID': 1534, 'relevance_score': 0.99290615}), Document(page_content='and measuring the organisation’s information security risks to identify any new or emerging risks. * **information security controls:** this includes monitoring and measuring the effectiveness of the organisation’s information security controls to ensure that they are operating as intended. * **information security awareness and training:** this includes monitoring and measuring the effectiveness of the organisation’s information security awareness and training programs to ensure that employees are aware of the organisation’s information security risks and policies.\nby monitoring and measuring these items, organisations can identify and\naddress weaknesses in their isms, reduce the risk of information security\nincidents, and improve their overall information security posture.\n## what are the requirements for monitoring and measurement of isms?\nthe requirements for monitoring and measurement of isms in iso 27001 9.1 are\nas follows:\n * identify the information security objectives and risks that will be monitored and measured. this should be done based on theorganisation’s risk assessment. * select the appropriate monitoring and measurement tools and techniques. the tools and techniques selected should be appropriate for the size and complexity of theorganisation’s isms, as well as the information security objectives and risks that will be monitored and measured. * develop a monitoring and measurement plan. the plan should document the following: * the information security', metadata={'description': 'Learn based on ISO 27001 clause 9.1, how to evaluate the performance of your ISMS and identify areas for improvement to protect your information and data.', 'doc_ID': 415, 'language': 'en-gb', 'original_text': 'and measuring the organisation’s information security risks to identify any new or emerging risks. * **Information security controls:** This includes monitoring and measuring the effectiveness of the organisation’s information security controls to ensure that they are operating as intended. * **Information security awareness and training:** This includes monitoring and measuring the effectiveness of the organisation’s information security awareness and training programs to ensure that employees are aware of the organisation’s information security risks and policies.\nBy monitoring and measuring these items, organisations can identify and\naddress weaknesses in their ISMS, reduce the risk of information security\nincidents, and improve their overall information security posture.\n## What are the requirements for monitoring and measurement of ISMS?\nThe requirements for monitoring and measurement of ISMS in ISO 27001 9.1 are\nas follows:\n * Identify the information security objectives and risks that will be monitored and measured. This should be done based on theorganisation’s risk assessment. * Select the appropriate monitoring and measurement tools and techniques. The tools and techniques selected should be appropriate for the size and complexity of theorganisation’s ISMS, as well as the information security objectives and risks that will be monitored and measured. * Develop a monitoring and measurement plan. The plan should document the following: * The information security', 'source': 'https://www.dataguard.co.uk/knowledge/iso-27001/clause-9-1-monitoring-measurement-analysis-and-evaluation/', 'title': 'ISO 27001 Clause 9.1: Monitoring, Measurement, Analysis and Evaluation', 'relevance_score': 0.9927952}), Document(page_content='isms-9.1, there is only a hint to include the isms processes and controls when determining the monitoring/measurement subject. how should this hint be understood?\nisms processes are, of course, part of the isms and therefore indirect influencing factors for the overall performance of the isms - but they also usually have their own measurable performance. under isms-8.1, monitoring of isms processes - during operation or their application - is required according to criteria defined by the organization.\nwe will consider some examples below, but we want to anticipate that a crucial prerequisite for the performance of an isms process is its correct implementation according to the planning. however, this cannot be verified through monitoring/measurement as defined in isms-9.1, but should be subject to inspection or internal audits beforehand. therefore, we assume correct implementation for the following.\n- in complex isms processes that are built or expanded step by step, the current degree of implementation could be an important indicator. a process that is still under development may only partially achieve its planned performance, if at all. the degree of implementation can be determined or measured based on the implementation plan.\n- an isms process could be supplied with insufficient/unsuitable resources during operation or its application. if the necessary resources are specified in the process description, the comparison needed/available can be carried out, recorded, and evaluated after a certain', metadata={'doc_ID': 2660, 'original_text': 'ISMS-9.1, there is only a hint to include the ISMS processes and controls when determining the monitoring/measurement subject. How should this hint be understood?\nISMS processes are, of course, part of the ISMS and therefore indirect influencing factors for the overall performance of the ISMS - but they also usually have their own measurable performance. Under ISMS-8.1, monitoring of ISMS processes - during operation or their application - is required according to criteria defined by the organization.\nWe will consider some examples below, but we want to anticipate that a crucial prerequisite for the performance of an ISMS process is its correct implementation according to the planning. However, this cannot be verified through monitoring/measurement as defined in ISMS-9.1, but should be subject to inspection or internal audits beforehand. Therefore, we assume correct implementation for the following.\n- In complex ISMS processes that are built or expanded step by step, the current degree of implementation could be an important indicator. A process that is still under development may only partially achieve its planned performance, if at all. The degree of implementation can be determined or measured based on the implementation plan.\n- An ISMS process could be supplied with insufficient/unsuitable resources during operation or its application. If the necessary resources are specified in the process description, the comparison needed/available can be carried out, recorded, and evaluated after a certain', 'source': 'ISO 27001_2022_Kersten_und_Schroeder.pdf', 'title': 'ISO 27001_2022_Kersten_und_Schroeder', 'relevance_score': 0.9905874})]","Within the framework of the ISMS (Information Security Management System), it means to monitor or measure objects and their attributes to analyze and evaluate the effectiveness of the ISMS. An example of this is verifying the effectiveness of organizational measures. The attributes of the objects can include various aspects, such as awareness of a measure. Through interviews, it can be measured how many people are aware of the measure. The results of these measurements can be used to take follow-up actions, such as more intensive training, to improve the effectiveness of the measure. The organization can determine the method of measurement, but certain conditions must be met, such as consistency of measurement results when repeated and regular conduct of the measurements.","Monitoring and measuring objects and their attributes within the ISMS, as per ISO 27001, refers to the evaluation of the ISMS performance, security objectives, suitability, effectiveness, and adequacy. This process involves the collection and analysis of data to ensure that the ISMS is functioning as intended and aligned with the organization's goals.

In the context of awareness, an example could be monitoring the effectiveness of the organization's information security awareness and training programs. This could involve measuring the understanding and application of information security policies among employees through tests, surveys, or incident rates.

The ISO 27004 standard proposes a model for measurements, suggesting that the measurement program should consider the overall organization as well as specific processes, rules, networks, applications, and facilities that affect information security. The measurement interval should be consistent and fit into the management review and continual improvement process of the ISMS.

The reporting of results should be designed to ensure effective communication. When determining the monitoring and measurement subject, the hint in ISMS-9.1 suggests including ISMS processes and controls. This could mean monitoring the performance of ISMS processes, such as incident management, and the effectiveness of information security controls to ensure they are operating",True,0.47530864197530864,0.13664596273291926,0.25308641975308643,0.430009126663208,0.6970774084329605,0.9987096786499023,0.8185429586142371,0,0,2.300112009048462,3.5490145683288574,0.22598719596862793,5.849126577377319
Fine-tuned_finetuned-ISO-27001_1024_l2_All_1536_264_False,Hybrid_Rerank_Cohere,4,mixtral-8x7B-v0.1,16000,0,1,Why can conformity to ISO 27001 be important and what benefits does it offer to an organization?,"[Document(page_content='to any organisation.\nthe iso 27001 controls help to clearly categorise potential risks. but what\nare the tangible benefits of mitigating risks?\nnot all organisations choose to adopt iso 27001 certification, but many use it\nas a framework to keep their isms safe from the risk of information security\nbreaches.\niso 27001 compliance demonstrates to stakeholders (such as customers and\nshareholders) that an organisation has prioritised the implementation of\ninformation security best practices. this can lead to the following benefits:\n * improved competitiveness * reduced risks of fines and losses due to data protection breaches * improved brand perception * compliance with relevant business, legal, economic and statutory requirements * improved structure and focus * reduced number of required audits * unbiased assessment of the organisation’s security posture\nin short, iso 27001 certification makes it easier to satisfy regulatory\nobligations, demonstrates your organisation’s reliability to partners, and\nshows your dedication to maintaining the highest standards of information\nsecurity. it also increases the value of your brand, resulting in a win-win\nsituations.\n## our checklist: how to achieve iso 27001 compliance even if they are not seeking official certification, there is always the\noption for organisations to pursue compliance with the iso 27001 standard\nrequirements. the following list shows the best practices you can implement to\nachieve this and can be', metadata={'description': 'ISO 27001 Controls are all 93 measures from Annex A of the new ISO 27001:2022. Explore our Guide and learn everything about the ISO 27001 Annex A controls.', 'doc_ID': 191, 'language': 'en-gb', 'original_text': 'to any organisation.\nThe ISO 27001 controls help to clearly categorise potential risks. But what\nare the tangible benefits of mitigating risks?\nNot all organisations choose to adopt ISO 27001 certification, but many use it\nas a framework to keep their ISMS safe from the risk of information security\nbreaches.\nISO 27001 compliance demonstrates to stakeholders (such as customers and\nshareholders) that an organisation has prioritised the implementation of\ninformation security best practices. This can lead to the following benefits:\n * Improved competitiveness * Reduced risks of fines and losses due to data protection breaches * Improved brand perception * Compliance with relevant business, legal, economic and statutory requirements * Improved structure and focus * Reduced number of required audits * Unbiased assessment of the organisation’s security posture\nIn short, ISO 27001 certification makes it easier to satisfy regulatory\nobligations, demonstrates your organisation’s reliability to partners, and\nshows your dedication to maintaining the highest standards of information\nsecurity. It also increases the value of your brand, resulting in a win-win\nsituations.\n## Our checklist: How to achieve ISO 27001 compliance Even if they are not seeking official certification, there is always the\noption for organisations to pursue compliance with the ISO 27001 standard\nrequirements. The following list shows the best practices you can implement to\nachieve this and can be', 'source': 'https://www.dataguard.co.uk/knowledge/iso-27001-controls-annex-a/', 'title': 'ISO 27001 Controls: Overview of all measures from Annex A', 'relevance_score': 0.9990073}), Document(page_content='for certification can be resource-intensive and time-consuming,\noften taking up to 18 months from the start of the initial certification process in addition to the baseline iso\n27001 certification cost. despite these requirements, iso 27001 certification comes with many benefits that\nset your organization apart from the competition.\nstrongcm 5\nfor example, as the only internationally recognized security standard for isms management, some\norganizations require the companies they work with to demonstrate iso 27001 compliance or certification.\nthus, certification can help you attract and retain clients.\nthis gives organizations of all sizes a clear business advantage and a strong reputation within the international\nmarketplace. plus, even before your organization is officially certified, external audits showing your alignment\nwith iso 27001 isms standards can offer peace of mind to new customers or clients.\nthe regular auditing schedule required for compliance also helps improve your security posture, streamline\nregulatory and compliance reporting, and present new opportunities to strengthen your isms as your\norganization grows and new risks emerge. this is a clear benefit of iso 27001 for startups.\nan iso 27001 audit conducted by an auditing firm or certifying body also provides valuable insight that can\nhelp your organization create more efficient policies or procedures, close security gaps, and improve controls.\nstronger security practices reduce the likelihood of a successful breach, so your organization', metadata={'doc_ID': 1337, 'original_text': 'for certification can be resource-intensive and time-consuming,\noften taking up to 18 months from the start of the initial certification process in addition to the baseline ISO\n27001 certification cost. Despite these requirements, ISO 27001 certification comes with many benefits that\nset your organization apart from the competition.\nstrongcm 5\nFor example, as the only internationally recognized security standard for ISMS management, some\norganizations require the companies they work with to demonstrate ISO 27001 compliance or certification.\nThus, certification can help you attract and retain clients.\nThis gives organizations of all sizes a clear business advantage and a strong reputation within the international\nmarketplace. Plus, even before your organization is officially certified, external audits showing your alignment\nwith ISO 27001 ISMS standards can offer peace of mind to new customers or clients.\nThe regular auditing schedule required for compliance also helps improve your security posture, streamline\nregulatory and compliance reporting, and present new opportunities to strengthen your ISMS as your\norganization grows and new risks emerge. This is a clear benefit of ISO 27001 for startups.\nAn ISO 27001 audit conducted by an auditing firm or certifying body also provides valuable insight that can\nhelp your organization create more efficient policies or procedures, close security gaps, and improve controls.\nStronger security practices reduce the likelihood of a successful breach, so your organization', 'source': 'complete-guide-iso-27001-compliance.pdf', 'title': 'complete-guide-iso-27001-compliance', 'relevance_score': 0.9986276}), Document(page_content=""27001\nclearly, identifying and addressing security risks is beneficial for any\nbusiness. the iso 27001 controls play an important role in the clear\ncategorization of potential risks. but what are the specific benefits of\nmitigating risks?\nbuild trust with all stakeholders\niso 27001 equips organizations with the information they need to protect\nvaluable data by applying good information security practices. iso 27001\ncompliance gives customers, partners, and key stakeholders the assurance that\nthe organization has taken the necessary security measures to treat valuable\ninformation and sensitive data appropriately.\nprotect organizations from data breaches\nthe iso 27001 standard defines policies and procedures for security measures\nthat, when implemented, protect an organization from unauthorized access to\nits data and from complete data loss.\nby implementing the proposed measures, the risk of data breaches or fines for\nsuch incidents is also reduced. the guidelines cover information security\nacross all areas. however, it is important to note that iso 27001 does not offer an absolute\nguarantee against security incidents or data breaches. but it creates a\nframework to reduce the likelihood of such incidents and strengthen an\norganization's ability to respond to them appropriately. the precise\nimplementation and effectiveness of the measures depend on the individual\norganization and its environment.\nif data is compromised in any way, the iso 27001 standard sets out procedures\nfor responsible and effective"", metadata={'source': 'https://experta.com/shared-post/367d5f2c-e60f-4187-9faf-cb44fb209cdc', 'title': 'Experta', 'language': 'No language found.', 'original_text': ""27001\nClearly, identifying and addressing security risks is beneficial for any\nbusiness. The ISO 27001 controls play an important role in the clear\ncategorization of potential risks. But what are the specific benefits of\nmitigating risks?\nBuild trust with all stakeholders\nISO 27001 equips organizations with the information they need to protect\nvaluable data by applying good information security practices. ISO 27001\ncompliance gives customers, partners, and key stakeholders the assurance that\nthe organization has taken the necessary security measures to treat valuable\ninformation and sensitive data appropriately.\nProtect organizations from data breaches\nThe ISO 27001 standard defines policies and procedures for security measures\nthat, when implemented, protect an organization from unauthorized access to\nits data and from complete data loss.\nBy implementing the proposed measures, the risk of data breaches or fines for\nsuch incidents is also reduced. The guidelines cover information security\nacross all areas. However, it is important to note that ISO 27001 does not offer an absolute\nguarantee against security incidents or data breaches. But it creates a\nframework to reduce the likelihood of such incidents and strengthen an\norganization's ability to respond to them appropriately. The precise\nimplementation and effectiveness of the measures depend on the individual\norganization and its environment.\nIf data is compromised in any way, the ISO 27001 standard sets out procedures\nfor responsible and effective"", 'doc_ID': 296, 'relevance_score': 0.99856186}), Document(page_content='the iso 27001 information security standards involve\ninformation and data to protecting information assets across the organization. that means\nmaintain hig h com pliance multiple teams are trained and committed to proactively protecting\nstandards."" company information and data to maintain high compliance\nstandards.\nthe documentation required for iso 27001 certification requires businesses to clearly define the business\nprocesses and procedures designed to maintain, monitor, and improve the isms for exceptional asset security.\nit also defines who is responsible for managing these processes. this can improve operational efficiency, reduce\nhuman error, improve identity and access management practices, and ultimately provide a more cost-effective\nway to handle security management.\nsince improvement is built into the certification and recertification process, your organization can proactively\nprevent security breaches and unexpected security gaps, too. achieving and maintaining iso 27001 compliance\ninvolves regular internal and external audits to find nonconformities and improvements. plus, management\naudits ensure that teams successfully complete recommended implementations.\no04\nbenefits of iso 27001 certification\nmeeting the rigorous iso 27001 standards for certification can be resource-intensive and time-consuming,\noften taking up to 18 months from the start of the initial certification process in addition to the baseline iso\n27001 certification cost. despite these requirements, iso 27001 certification', metadata={'doc_ID': 1336, 'original_text': 'the ISO 27001 information security standards involve\ninformation and data to protecting information assets across the organization. That means\nmaintain hig h com pliance multiple teams are trained and committed to proactively protecting\nstandards."" company information and data to maintain high compliance\nstandards.\nThe documentation required for ISO 27001 certification requires businesses to clearly define the business\nprocesses and procedures designed to maintain, monitor, and improve the ISMS for exceptional asset security.\nIt also defines who is responsible for managing these processes. This can improve operational efficiency, reduce\nhuman error, improve identity and access management practices, and ultimately provide a more cost-effective\nway to handle security management.\nSince improvement is built into the certification and recertification process, your organization can proactively\nprevent security breaches and unexpected security gaps, too. Achieving and maintaining ISO 27001 compliance\ninvolves regular internal and external audits to find nonconformities and improvements. Plus, management\naudits ensure that teams successfully complete recommended implementations.\nO04\nBenefits of ISO 27001 Certification\nMeeting the rigorous ISO 27001 standards for certification can be resource-intensive and time-consuming,\noften taking up to 18 months from the start of the initial certification process in addition to the baseline ISO\n27001 certification cost. Despite these requirements, ISO 27001 certification', 'source': 'complete-guide-iso-27001-compliance.pdf', 'title': 'complete-guide-iso-27001-compliance', 'relevance_score': 0.9983515})]","Conformity to ISO 27001 can be important for an organization to meet legal requirements, fulfill external regulations, and be able to participate in bidding processes. Conforming to the standard indicates the organization's competence in information security and can serve as a reference when selecting partners. Additionally, certification provides the advantage of independent experts confirming that information security is in order. A successful audit and certification allow the organization to demonstrate its conformity to third parties and fulfill external regulations.","ISO 27001 certification is important for an organization as it demonstrates the implementation of information security best practices, thereby improving competitiveness, reducing risks of fines and losses due to data protection breaches, enhancing brand perception, ensuring compliance with relevant requirements, and improving the structure and focus of the organization's ISMS. The certification process, though resource-intensive and time-consuming, provides a clear business advantage and a strong reputation in the international marketplace. It also helps attract and retain clients, particularly those that require ISO 27001 compliance from the companies they work with. Regular auditing required for compliance improves security posture, streamlines regulatory and compliance reporting, and provides opportunities to strengthen the ISMS as the organization grows and new risks emerge. The certification audit also offers valuable insights to improve policies, procedures, and controls, thereby reducing the likelihood of a successful breach. ISO 27001 equips organizations with the information they need to protect valuable data and build trust with all stakeholders.",True,0.34024896265560167,0.07531380753138076,0.20746887966804978,0.5435627698898315,0.9672210812568665,0.9985824823379517,0.7338204402047701,0,0,2.193347454071045,3.0549185276031494,0.23917865753173828,5.248265981674194
Fine-tuned_finetuned-ISO-27001_1024_l2_All_1536_264_False,Hybrid_Rerank_Cohere,4,mixtral-8x7B-v0.1,16000,0,1,What role do audits and certifications play in providing evidence of compliance with ISO 27001?,"[Document(page_content=""comes to the iso 27001 certification are:\ndocumentation, undergoing audits and ensuring your employees adopt the\nprocesses.\n**documentation** includes the creation and maintenance of necessary\ndocumentation for your information security management system (isms), such as\npolicies, procedures, risk assessments, and controls.\n**undergoing audits** includes both the stage 1 audit, which reviews\ndocumentation and readiness, and the stage 2 audit, which assesses the\npractical implementation of your isms. successful completion of these audits\nis necessary to achieve iso 27001 certification. you will also be required to\nundergo internal audits and management reviews.\nit's also crucial to **communicate the processes effectively** this is to\nensure that your organization's information security practices align with the\niso 27001 standards. you will need to have the documentation in place but also\nput the processes into action by ensuring employees are aware of and follow\nthem.\nthe mandatory documents required for the iso 27001 standard are listed below.\nall criteria must be followed and documented accordingly for an organisation\nto present during external audits. the standard requires you to undergo an\ninternal audit before an external one. this will expose any gaps in your isms.\nonce you have prepared the documentation and undergone an internal audit as\nwell as a management review, you need to undergo an external audit by a\ncertified body such as the ukas.\nthe mandatory documents required for iso 27001 are:\n *"", metadata={'description': 'No matter if you’re an SMB or an international corporation — getting an ISO 27001 certification should be on your agenda. Here’s the ultimate guide on how.', 'doc_ID': 146, 'language': 'en-gb', 'original_text': ""comes to the ISO 27001 certification are:\ndocumentation, undergoing audits and ensuring your employees adopt the\nprocesses.\n**Documentation** includes the creation and maintenance of necessary\ndocumentation for your Information Security Management System (ISMS), such as\npolicies, procedures, risk assessments, and controls.\n**Undergoing audits** includes both the Stage 1 Audit, which reviews\ndocumentation and readiness, and the Stage 2 Audit, which assesses the\npractical implementation of your ISMS. Successful completion of these audits\nis necessary to achieve ISO 27001 certification. You will also be required to\nundergo internal audits and management reviews.\nIt's also crucial to **communicate the processes effectively** This is to\nensure that your organization's information security practices align with the\nISO 27001 standards. You will need to have the documentation in place but also\nput the processes into action by ensuring employees are aware of and follow\nthem.\nThe mandatory documents required for the ISO 27001 standard are listed below.\nAll criteria must be followed and documented accordingly for an organisation\nto present during external audits. The standard requires you to undergo an\ninternal audit before an external one. This will expose any gaps in your ISMS.\nOnce you have prepared the documentation and undergone an internal audit as\nwell as a management review, you need to undergo an external audit by a\ncertified body such as the UKAS.\nThe mandatory documents required for ISO 27001 are:\n *"", 'source': 'https://www.dataguard.co.uk/knowledge/iso-27001-certification/', 'title': 'ISO 27001 Certification: Your ultimate guide [free guide available]', 'relevance_score': 0.99090964}), Document(page_content='you may choose to engage a third-\nparty consultant to perform the internal audit, or a member of your\norganization, who is qualified and independent of the control owners, may\nperform the audit.\n\u200d\n **7\\. complete a full certification audit**\nthis is the key piece of your iso 27001 certification: the full audit. your\ncertification organization will conduct an in-depth investigation of your isms\nto evaluate your iso 27001 compliance. this can be an extensive on-site\nprocess.\n keep in mind, though, that compliance automation software like vanta can make\nthis process simpler. as it scans your system, vanta compiles and documents\nevidence of your compliance, so your auditor will have all this documentation\nin one convenient place.\n\u200d\n **8\\. receive your certification**\nif your auditor determines that you adhere to all the necessary components of\niso 27001, you will officially receive your certification.\n\u200d\n\u200d\n## maintain your iso 27001 certification\n\u200d\nit’s important to understand that iso 27001 certification is not a one-time\nprocess. your certification will need to be renewed to some degree every year.\n these certificates use a three-year cycle. one year after your first\ncertification, your certification organization will conduct a less extensive\naudit to check a few key controls. if you pass this, you’ll retain your\ncertification. if not, the organization will conduct a full, intensive audit\nas they did in the first year.\n the same is true for the second year after your initial certification:', metadata={'description': 'Need to get ISO 27001 certified? Find out what you can expect from the ISO 27001 certification process from security compliance experts.', 'doc_ID': 16, 'language': 'en', 'original_text': 'You may choose to engage a third-\nparty consultant to perform the internal audit, or a member of your\norganization, who is qualified and independent of the control owners, may\nperform the audit.\n\u200d\n **7\\. Complete a full certification audit**\nThis is the key piece of your ISO 27001 certification: the full audit. Your\ncertification organization will conduct an in-depth investigation of your ISMS\nto evaluate your ISO 27001 compliance. This can be an extensive on-site\nprocess.\n Keep in mind, though, that compliance automation software like Vanta can make\nthis process simpler. As it scans your system, Vanta compiles and documents\nevidence of your compliance, so your auditor will have all this documentation\nin one convenient place.\n\u200d\n **8\\. Receive your certification**\nIf your auditor determines that you adhere to all the necessary components of\nISO 27001, you will officially receive your certification.\n\u200d\n\u200d\n## Maintain your ISO 27001 certification\n\u200d\nIt’s important to understand that ISO 27001 certification is not a one-time\nprocess. Your certification will need to be renewed to some degree every year.\n These certificates use a three-year cycle. One year after your first\ncertification, your certification organization will conduct a less extensive\naudit to check a few key controls. If you pass this, you’ll retain your\ncertification. If not, the organization will conduct a full, intensive audit\nas they did in the first year.\n The same is true for the second year after your initial certification:', 'source': 'https://www.vanta.com/resources/how-long-does-it-take-to-get-iso-certified', 'title': 'What is the ISO certification timeline?', 'relevance_score': 0.9906238}), Document(page_content='to work with experts such as dataguard or an external\nconsultant, you may receive documentation templates that will help cut down on\nyour manual work significantly compared to creating them from scratch.\n## what is an audit, and why is it important?\nan audit is basically the process of checking that your isms meets the\nrequirements and criteria of a standard. if you are certifying against iso\n27001, it will be the requirements of the iso 27001 standard.\naudits ensure the success of your isms by identifying information security\nnon-conformities and can be either internal or external. internal audits can\nbe carried out using the organisations’ own resources — whether that’s\ninternal employees of the company or contracted independent consultants (2nd\nparty auditors).\nexternal audits are carried out by a certification body, external partners or\ncustomers who want to assess the isms on their own terms. the latter is rather\nthe exception than the rule — when referring to an external audit, a\ncertification body is meant in most cases.\naudits are incredibly important not only because they are:\n * **a concrete **requirement** of the iso 27001 standard.**\n * the only way of **verifying whether you comply** with the standard.\n * necessary to **obtain your iso 27001 certification.**\n## conducting internal audits: how to go about it\ninternal audits are vital for long-term success in earning and keeping your\niso 27001 certification. they should be carried out on a regular basis by\nemployees within the company,', metadata={'description': 'No matter if you’re an SMB or an international corporation — getting an ISO 27001 certification should be on your agenda. Here’s the ultimate guide on how.', 'doc_ID': 137, 'language': 'en-gb', 'original_text': 'to work with experts such as DataGuard or an external\nconsultant, you may receive documentation templates that will help cut down on\nyour manual work significantly compared to creating them from scratch.\n## What is an audit, and why is it important?\nAn audit is basically the process of checking that your ISMS meets the\nrequirements and criteria of a standard. If you are certifying against ISO\n27001, it will be the requirements of the ISO 27001 standard.\nAudits ensure the success of your ISMS by identifying information security\nnon-conformities and can be either internal or external. Internal audits can\nbe carried out using the organisations’ own resources — whether that’s\ninternal employees of the company or contracted independent consultants (2nd\nparty auditors).\nExternal audits are carried out by a certification body, external partners or\ncustomers who want to assess the ISMS on their own terms. The latter is rather\nthe exception than the rule — when referring to an external audit, a\ncertification body is meant in most cases.\nAudits are incredibly important not only because they are:\n * **A concrete **requirement** of the ISO 27001 standard.**\n * The only way of **verifying whether you comply** with the standard.\n * Necessary to **obtain your ISO 27001 certification.**\n## Conducting internal audits: How to go about it\nInternal audits are vital for long-term success in earning and keeping your\nISO 27001 certification. They should be carried out on a regular basis by\nemployees within the company,', 'source': 'https://www.dataguard.co.uk/knowledge/iso-27001-certification/', 'title': 'ISO 27001 Certification: Your ultimate guide [free guide available]', 'relevance_score': 0.9882222}), Document(page_content='one of the key requirements to obtain an iso 27001 certification is to conduct\nregular internal audits of the information security management system (isms).\ninternal audits help organisations to identify and address any weaknesses in\ntheir isms and to ensure that it is operating effectively.\n## what is an iso 27001 internal audit?\nan iso 27001 internal audit is an independent assessment of the isms to\ndetermine whether it is conforming to the requirements of iso 27001 and\nwhether it is operating effectively. the audit is conducted by an internal\nauditor who is independent of the isms being audited.\n## why are iso 27001 internal audits important?\niso 27001 internal audits are important for a number of reasons:\n * to comply with iso 27001: iso 27001 requires organisations to conduct regular internal audits of their isms. * to identify and address weaknesses in the isms: internal audits can help organisations identify weaknesses in their information security management system (isms) before they are exploited by attackers. * to improve the effectiveness of the isms: internal audits can help organisations identify areas where the isms can be improved. * to provide assurance to stakeholders: internal audits can provide assurance to stakeholders that the isms is operating effectively and that the organisation is taking steps to protect its sensitive information.\n## does iso 27001 require an internal audit?\nyes, iso 27001 requires organisations to conduct regular internal audits', metadata={'description': 'Ensure your ISMS is operating effectively for ISO 27001 compliance. Learn all you need to know about ISO 27001 Clause 9.2 internal audits in our guide.\n', 'doc_ID': 420, 'language': 'en-gb', 'original_text': 'One of the key requirements to obtain an ISO 27001 certification is to conduct\nregular internal audits of the information security management system (ISMS).\nInternal audits help organisations to identify and address any weaknesses in\ntheir ISMS and to ensure that it is operating effectively.\n## What is an ISO 27001 Internal Audit?\nAn ISO 27001 internal audit is an independent assessment of the ISMS to\ndetermine whether it is conforming to the requirements of ISO 27001 and\nwhether it is operating effectively. The audit is conducted by an internal\nauditor who is independent of the ISMS being audited.\n## Why are ISO 27001 Internal Audits Important?\nISO 27001 internal audits are important for a number of reasons:\n * To comply with ISO 27001: ISO 27001 requires organisations to conduct regular internal audits of their ISMS. * To identify and address weaknesses in the ISMS: Internal audits can help organisations identify weaknesses in their information security management system (ISMS) before they are exploited by attackers. * To improve the effectiveness of the ISMS: Internal audits can help organisations identify areas where the ISMS can be improved. * To provide assurance to stakeholders: Internal audits can provide assurance to stakeholders that the ISMS is operating effectively and that the organisation is taking steps to protect its sensitive information.\n## Does ISO 27001 require an internal audit?\nYes, ISO 27001 requires organisations to conduct regular internal audits', 'source': 'https://www.dataguard.co.uk/knowledge/iso-27001/clause-9-2-internal-audit/', 'title': 'ISO 27001 Clause 9.2: Internal Audit', 'relevance_score': 0.9827572})]","Audits and certifications play a crucial role in demonstrating conformity to ISO 27001. During and as a result of an audit, deficiencies or deviations from the standard may be identified. Rather than being seen as negative, these findings serve as clear indications of improvement potential that will be further addressed. Following a successful external audit and potential certification, it is confirmed that the Information Security Management System (ISMS) is practical, effective, and well-established.

The audit report, documenting the results, is essential and must comply with the requirements of ISO 19011. To demonstrate conformity to third parties, the audit report can be presented to an independent and trustworthy certification body. This body can issue a recognized certificate of conformity that does not contain critical internal information, making it suitable for dissemination to third parties and for proving compliance with external requirements.

Choosing an accredited certification body is recommended to ensure recognition and comparability. In industries with specific requirements, there may be industry-specific standards in addition to ISO 27001. The audit can be based on both standards, allowing a single assessment to demonstrate conformity. The resulting certificate then attests conformity to both ISO 27001 and, if applicable, the industry-specific standard.","Audits and certifications play a crucial role in providing evidence of compliance with ISO 27001. There are two types of audits: internal and external. Internal audits, conducted by employees or contracted consultants, assess the readiness of an organization's Information Security Management System (ISMS) for ISO 27001 compliance. These audits help identify and address any weaknesses in the ISMS.

External audits, conducted by certification bodies, evaluate the practical implementation of the ISMS. Successful completion of both stages of the external audit is necessary to achieve ISO 27001 certification. The certification is not a one-time process, as it needs to be renewed every year through less extensive audits and intensive audits in the subsequent years.

The audits ensure that the ISMS meets the requirements and criteria of the ISO 27001 standard, and they provide assurance to stakeholders that the organization is taking steps to protect its sensitive information. ISO 27001 requires organizations to conduct regular internal audits, making them essential for both obtaining and maintaining the certification.",True,0.49456521739130427,0.12021857923497267,0.2554347826086956,0.5415114760398865,0.9505314379930496,0.999840259552002,0.8301063928140742,0,0,2.18420672416687,3.365502119064331,0.2380509376525879,5.549708843231201
Fine-tuned_finetuned-ISO-27001_1024_l2_All_1536_264_False,Hybrid_Rerank_Cohere,4,mixtral-8x7B-v0.1,16000,0,1,Is the audit of the ISMS a one-time thing?,"[Document(page_content=""* the audit must cover all aspects of the isms, including risk assessment, information security controls, isms documentation, awareness and training, and management review. * the audit findings must be documented in a report that is submitted to the organisation's management.\norganisations that are certified according to iso 27001 must also undergo an\nexternal audit by a certification body. there are two kinds of external audit,\none conducted once annually called a surveillance audit where the isms will be\nreviewed as part of ongoing evaluation and the other known as a full external\naudit which is more in-depth and conducted every three years.\nbenefits of iso 27001 audit:\n * improved information security posture * reduced risk of information security incidents * increased compliance with regulations * improved customer confidence * competitive advantage\nif you are considering implementing iso 27001 or if you are already certified,\nit is important to ensure that you are conducting regular internal audits.\ninternal audits are an essential tool for maintaining an effective isms and\nprotecting your organisation from information security threats.\n## where is an internal audit mandatory?\nan internal audit is not required by law or regulation. however, it is a good\npractice for all organisations to conduct regular internal audits of their\ninformation security and other management systems.\nin order to comply with iso 27001, all companies must conduct internal"", metadata={'source': 'https://www.dataguard.co.uk/knowledge/iso-27001/clause-9-2-internal-audit/', 'title': 'ISO 27001 Clause 9.2: Internal Audit', 'description': 'Ensure your ISMS is operating effectively for ISO 27001 compliance. Learn all you need to know about ISO 27001 Clause 9.2 internal audits in our guide.\n', 'language': 'en-gb', 'original_text': ""* The audit must cover all aspects of the ISMS, including risk assessment, information security controls, ISMS documentation, awareness and training, and management review. * The audit findings must be documented in a report that is submitted to the organisation's management.\nOrganisations that are certified according to ISO 27001 must also undergo an\nexternal audit by a certification body. There are two kinds of external audit,\none conducted once annually called a surveillance audit where the ISMS will be\nreviewed as part of ongoing evaluation and the other known as a full external\naudit which is more in-depth and conducted every three years.\nBenefits of ISO 27001 audit:\n * Improved information security posture * Reduced risk of information security incidents * Increased compliance with regulations * Improved customer confidence * Competitive advantage\nIf you are considering implementing ISO 27001 or if you are already certified,\nit is important to ensure that you are conducting regular internal audits.\nInternal audits are an essential tool for maintaining an effective ISMS and\nprotecting your organisation from information security threats.\n## Where is an internal audit mandatory?\nAn internal audit is not required by law or regulation. However, it is a good\npractice for all organisations to conduct regular internal audits of their\ninformation security and other management systems.\nIn order to comply with ISO 27001, all companies must conduct internal"", 'doc_ID': 422, 'relevance_score': 0.996503}), Document(page_content='be seen as part of a more comprehensive monitoring/measurement plan to be determined by the organization itself.\nisms-9.2 - internal audit\nsuch an audit compares the existing reality with the existing requirements. this comparison takes place at specific points in time - practically a snapshot of the conditions. while a one-time audit may be helpful, this procedure only achieves its full effect through regular repetition.\nthe general requirement under isms-9.2 is to conduct internal audits at planned intervals to gain insights into whether the isms:\n- meets the organization\'s own requirements and the requirements of the standard,\n- is effectively established and continuously developed.\n""internal"" means that such an audit is conducted under the control of the organization itself and is carried out by its own personnel - or by external personnel commissioned by the organization. depending on the size and complexity of the organization, an internal audit is more likely to be conducted by an audit team.\nthe planned intervals suggest that a schedule - e.g. annually - is created in which the preparation phase, the audit itself, and the necessary follow-up work - e.g. addressing identified deficiencies - as well as reporting to the management level are pre-planned.\nthe first point mentioned above indicates that the required audit should compare the actual isms with the organization\'s own requirements. a second comparison should reflect the actual isms against the requirements of the standard. the wording also', metadata={'source': 'ISO 27001_2022_Kersten_und_Schroeder.pdf', 'title': 'ISO 27001_2022_Kersten_und_Schroeder', 'original_text': 'be seen as part of a more comprehensive monitoring/measurement plan to be determined by the organization itself.\nISMS-9.2 - Internal Audit\nSuch an audit compares the existing reality with the existing requirements. This comparison takes place at specific points in time - practically a snapshot of the conditions. While a one-time audit may be helpful, this procedure only achieves its full effect through regular repetition.\nThe general requirement under ISMS-9.2 is to conduct internal audits at planned intervals to gain insights into whether the ISMS:\n- meets the organization\'s own requirements and the requirements of the standard,\n- is effectively established and continuously developed.\n""Internal"" means that such an audit is conducted under the control of the organization itself and is carried out by its own personnel - or by external personnel commissioned by the organization. Depending on the size and complexity of the organization, an internal audit is more likely to be conducted by an audit team.\nThe planned intervals suggest that a schedule - e.g. annually - is created in which the preparation phase, the audit itself, and the necessary follow-up work - e.g. addressing identified deficiencies - as well as reporting to the management level are pre-planned.\nThe first point mentioned above indicates that the required audit should compare the actual ISMS with the organization\'s own requirements. A second comparison should reflect the actual ISMS against the requirements of the standard. The wording also', 'doc_ID': 2672, 'relevance_score': 0.9954261}), Document(page_content='pre-planned.\nthe first point mentioned above indicates that the required audit should compare the actual isms with the organization\'s own requirements. a second comparison should reflect the actual isms against the requirements of the standard. the wording also suggests again that the organization\'s goals should not solely be to comply with the standard.\naccording to the list above, another task of the audit team is to assess the effectiveness of the isms. we have already provided many hints on this under isms-9.1. the audit team should also examine whether the isms is being ""reasonably"" developed. for this purpose, the team examines the (hopefully existing) records of how the organization has responded to new external and internal requirements (changes in context), how new technological capabilities have been incorporated into the isms, whether the process of continuous improvement is functioning, and how the results of previous audits have been dealt with. overall, a (positive) development of the organization must be recognizable.\nconducting internal audits is an important isms process according to the standard. therefore, it should be documented like any other process (process description), applied regularly, monitored, and adjusted or improved if necessary. when planning, it should be taken into account that the parts of the isms that are of high importance for information security receive correspondingly high attention - assuming that such differentiation based on importance is possible and', metadata={'source': 'ISO 27001_2022_Kersten_und_Schroeder.pdf', 'title': 'ISO 27001_2022_Kersten_und_Schroeder', 'original_text': 'pre-planned.\nThe first point mentioned above indicates that the required audit should compare the actual ISMS with the organization\'s own requirements. A second comparison should reflect the actual ISMS against the requirements of the standard. The wording also suggests again that the organization\'s goals should not solely be to comply with the standard.\nAccording to the list above, another task of the audit team is to assess the effectiveness of the ISMS. We have already provided many hints on this under ISMS-9.1. The audit team should also examine whether the ISMS is being ""reasonably"" developed. For this purpose, the team examines the (hopefully existing) records of how the organization has responded to new external and internal requirements (changes in context), how new technological capabilities have been incorporated into the ISMS, whether the process of continuous improvement is functioning, and how the results of previous audits have been dealt with. Overall, a (positive) development of the organization must be recognizable.\nConducting internal audits is an important ISMS process according to the standard. Therefore, it should be documented like any other process (process description), applied regularly, monitored, and adjusted or improved if necessary. When planning, it should be taken into account that the parts of the ISMS that are of high importance for information security receive correspondingly high attention - assuming that such differentiation based on importance is possible and', 'doc_ID': 2673, 'relevance_score': 0.9864156}), Document(page_content='an annual repetition is planned or, for example, one could follow the pdca process: after completing a pdca cycle in (information) security management - i.e. after the act phase - a management review always takes place. the latter could have the advantage that really up-to-date new information is available, but the disadvantage is that one becomes dependent on another isms process and its regular implementation.\nthe minimum information that must be available as input for the management review is specified in isms-9.3. we formulate the information in question form:\n- have all tasks from the last management review been completed or what is the current status? deficiencies or improvement opportunities may have been specified and delegated to the staff during the last implementation. the correct resolution must be verified.\n- have there been any changes in the organizational context that could be relevant to the isms? this concerns internal and external requirements and expectations, especially also requirements and expectations of interested parties (isms-4.2).\n- are there any information about the performance of the isms? the following points are mentioned: known deviations from the standard and corresponding corrective measures, results from the monitoring/measurement program according to isms-9.1, reports from conducted internal audits according to isms-9.2, the degree of fulfillment of security objectives (effectiveness).\n- have new risks been identified during the risk assessment in the past period?', metadata={'doc_ID': 2677, 'original_text': 'an annual repetition is planned or, for example, one could follow the PDCA process: After completing a PDCA cycle in (information) security management - i.e. after the ACT phase - a management review always takes place. The latter could have the advantage that really up-to-date new information is available, but the disadvantage is that one becomes dependent on another ISMS process and its regular implementation.\nThe minimum information that must be available as input for the management review is specified in ISMS-9.3. We formulate the information in question form:\n- Have all tasks from the last management review been completed or what is the current status? Deficiencies or improvement opportunities may have been specified and delegated to the staff during the last implementation. The correct resolution must be verified.\n- Have there been any changes in the organizational context that could be relevant to the ISMS? This concerns internal and external requirements and expectations, especially also requirements and expectations of interested parties (ISMS-4.2).\n- Are there any information about the performance of the ISMS? The following points are mentioned: known deviations from the standard and corresponding corrective measures, results from the monitoring/measurement program according to ISMS-9.1, reports from conducted internal audits according to ISMS-9.2, the degree of fulfillment of security objectives (effectiveness).\n- Have new risks been identified during the risk assessment in the past period?', 'source': 'ISO 27001_2022_Kersten_und_Schroeder.pdf', 'title': 'ISO 27001_2022_Kersten_und_Schroeder', 'relevance_score': 0.9858821})]","No, the audit of the ISMS is not a one-time thing. It is advisable to conduct regular reviews to enable continuous improvements. The certification of the ISMS has a time limit and can only be maintained or extended through repeated audits. The duration of validity of a certificate varies depending on the certification body, but in most cases, annual review audits are required. Additionally, security-related changes must be communicated to the certification board, which can lead to a cause-based examination. It is strongly recommended to plan audits in the long term and conduct external audits as a complement to internal audits.",The audit of the Information Security Management System (ISMS) as per ISO 2,True,0.11965811965811966,0.052173913043478265,0.10256410256410257,0.3730103373527527,0.2175726955756545,0.9902163743972778,0.6441616234012262,0,0,2.2913894653320312,1.0953352451324463,0.23839783668518066,3.3867247104644775
Fine-tuned_finetuned-ISO-27001_1024_l2_All_1536_264_False,Hybrid_Rerank_Cohere,4,mixtral-8x7B-v0.1,16000,0,1,What are the different types of audits regarding ISO 27001?,"[Document(page_content=""* the audit must cover all aspects of the isms, including risk assessment, information security controls, isms documentation, awareness and training, and management review. * the audit findings must be documented in a report that is submitted to the organisation's management.\norganisations that are certified according to iso 27001 must also undergo an\nexternal audit by a certification body. there are two kinds of external audit,\none conducted once annually called a surveillance audit where the isms will be\nreviewed as part of ongoing evaluation and the other known as a full external\naudit which is more in-depth and conducted every three years.\nbenefits of iso 27001 audit:\n * improved information security posture * reduced risk of information security incidents * increased compliance with regulations * improved customer confidence * competitive advantage\nif you are considering implementing iso 27001 or if you are already certified,\nit is important to ensure that you are conducting regular internal audits.\ninternal audits are an essential tool for maintaining an effective isms and\nprotecting your organisation from information security threats.\n## where is an internal audit mandatory?\nan internal audit is not required by law or regulation. however, it is a good\npractice for all organisations to conduct regular internal audits of their\ninformation security and other management systems.\nin order to comply with iso 27001, all companies must conduct internal"", metadata={'description': 'Ensure your ISMS is operating effectively for ISO 27001 compliance. Learn all you need to know about ISO 27001 Clause 9.2 internal audits in our guide.\n', 'doc_ID': 422, 'language': 'en-gb', 'original_text': ""* The audit must cover all aspects of the ISMS, including risk assessment, information security controls, ISMS documentation, awareness and training, and management review. * The audit findings must be documented in a report that is submitted to the organisation's management.\nOrganisations that are certified according to ISO 27001 must also undergo an\nexternal audit by a certification body. There are two kinds of external audit,\none conducted once annually called a surveillance audit where the ISMS will be\nreviewed as part of ongoing evaluation and the other known as a full external\naudit which is more in-depth and conducted every three years.\nBenefits of ISO 27001 audit:\n * Improved information security posture * Reduced risk of information security incidents * Increased compliance with regulations * Improved customer confidence * Competitive advantage\nIf you are considering implementing ISO 27001 or if you are already certified,\nit is important to ensure that you are conducting regular internal audits.\nInternal audits are an essential tool for maintaining an effective ISMS and\nprotecting your organisation from information security threats.\n## Where is an internal audit mandatory?\nAn internal audit is not required by law or regulation. However, it is a good\npractice for all organisations to conduct regular internal audits of their\ninformation security and other management systems.\nIn order to comply with ISO 27001, all companies must conduct internal"", 'source': 'https://www.dataguard.co.uk/knowledge/iso-27001/clause-9-2-internal-audit/', 'title': 'ISO 27001 Clause 9.2: Internal Audit', 'relevance_score': 0.99520767}), Document(page_content=""an external auditor, your company will\nfirst be required to perform an internal audit. an internal audit involves a\nthorough examination of your organization’s isms and is one of the best ways\nto ensure that your organization’s isms is operating effectively and is in\nalignment with the iso 27001 standard. specifically, organizations are\nrequired to self-verify conformance with the requirements from annex a of iso\n27001 deemed applicable in the isms's documented statement of applicability.\nthe internal audit is intended to help identify any gaps or deficiencies that\ncould affect your isms and impact your organization’s ability to meet its\nintended objectives, as well as to successfully complete an initial or annual\niso 27001 certification audit and maintain the certification.\n **the internal audit function is a requirement under the iso 27001 standard**\nand can be challenging to implement in a way that meets each of the\nrequirements set forth in the standard, especially for smaller organizations.\nthis is because of the prescriptive nature outlined in the standard, and the\nneed for allocated resources that are both independent of the development and\nmaintenance of the isms, while still possessing the necessary competencies to\nperform the internal audit function.\n**unlike a certification review where you must use an external third-party to\nconduct the audit, the internal audit can be conducted either by staff within\nyour organization or by an independent third party, such as a consulting\nfirm.** when"", metadata={'description': 'In this guide, we share the recommended approach to successful implementation of an Information Security Management System (ISMS) according to the ISO 27001 standard to help prepare your organization to undergo an independent evaluation of your ISMS in order to obtain your ISO 27001 certification.', 'doc_ID': 60, 'language': 'en', 'original_text': ""an external auditor, your company will\nfirst be required to perform an internal audit. An internal audit involves a\nthorough examination of your organization’s ISMS and is one of the best ways\nto ensure that your organization’s ISMS is operating effectively and is in\nalignment with the ISO 27001 standard. Specifically, organizations are\nrequired to self-verify conformance with the requirements from Annex A of ISO\n27001 deemed applicable in the ISMS's documented Statement of Applicability.\nThe internal audit is intended to help identify any gaps or deficiencies that\ncould affect your ISMS and impact your organization’s ability to meet its\nintended objectives, as well as to successfully complete an initial or annual\nISO 27001 certification audit and maintain the certification.\n **The internal audit function is a requirement under the ISO 27001 standard**\nand can be challenging to implement in a way that meets each of the\nrequirements set forth in the standard, especially for smaller organizations.\nThis is because of the prescriptive nature outlined in the standard, and the\nneed for allocated resources that are both independent of the development and\nmaintenance of the ISMS, while still possessing the necessary competencies to\nperform the internal audit function.\n**Unlike a certification review where you must use an external third-party to\nconduct the audit, the internal audit can be conducted either by staff within\nyour organization or by an independent third party, such as a consulting\nfirm.** When"", 'source': 'https://www.vanta.com/resources/the-ultimate-iso-27001-guide-powered-by-vanta-and-aprio', 'title': 'The ultimate ISO 27001 guide', 'relevance_score': 0.9937345}), Document(page_content='audit should follow the requirements of iso 27007, including topics such as personnel selection, planning, implementation, and reporting of results. it is important to note that these audits primarily focus on the management system (isms).\nin contrast, iso 27008 focuses on audits regarding the controls and their implementation - in short, it primarily focuses on technical audits. however, it should be noted that the performance of such (technical) audits is not generally required by iso 27001 or within the scope of certification. however, in practice, during management audits, the controls and their implementation are often reviewed on a sampling basis. the correct implementation of relevant controls and their effectiveness are the main focus.\nthe requirements of iso 27006-1 are not exhaustive: the mentioned institutions must also comply with iso 17021-1 [1] and iso 19011 [2].\nprivacy information management system (pims).\nthe iso/iec 27000 series and its fundamental concepts\ntable 1.1 basic standards\nstandard parts stand-e stand-d\n27000 2018-02 2020-06\n27001 2022-10 2023-04 (draft)\n27002 2022-02 2022-08 (draft)\n27003 2017-03 -\n27004 2016-12 -\n27005 2022-10\n27006 iso 27006-1 2015-10 + correction 2020 2023-05 (draft)\niso 27006-2 2021-02 -\n27007 2020-01 2022-10?\n27008 2019-01 -\n27009 2020-04 2022-09\nsince almost all basic standards in the series are kept at a relatively abstract level, there is often a need to interpret, refine, or supplement the requirements of iso 27001 for specific topics,', metadata={'source': 'ISO 27001_2022_Kersten_und_Schroeder.pdf', 'title': 'ISO 27001_2022_Kersten_und_Schroeder', 'original_text': 'audit should follow the requirements of ISO 27007, including topics such as personnel selection, planning, implementation, and reporting of results. It is important to note that these audits primarily focus on the management system (ISMS).\nIn contrast, ISO 27008 focuses on audits regarding the controls and their implementation - in short, it primarily focuses on technical audits. However, it should be noted that the performance of such (technical) audits is not generally required by ISO 27001 or within the scope of certification. However, in practice, during management audits, the controls and their implementation are often reviewed on a sampling basis. The correct implementation of relevant controls and their effectiveness are the main focus.\nThe requirements of ISO 27006-1 are not exhaustive: the mentioned institutions must also comply with ISO 17021-1 [1] and ISO 19011 [2].\nPrivacy Information Management System (PIMS).\nThe ISO/IEC 27000 series and its fundamental concepts\nTable 1.1 Basic standards\nStandard Parts Stand-E Stand-D\n27000 2018-02 2020-06\n27001 2022-10 2023-04 (Draft)\n27002 2022-02 2022-08 (Draft)\n27003 2017-03 -\n27004 2016-12 -\n27005 2022-10\n27006 ISO 27006-1 2015-10 + Correction 2020 2023-05 (Draft)\nISO 27006-2 2021-02 -\n27007 2020-01 2022-10?\n27008 2019-01 -\n27009 2020-04 2022-09\nSince almost all basic standards in the series are kept at a relatively abstract level, there is often a need to interpret, refine, or supplement the requirements of ISO 27001 for specific topics,', 'doc_ID': 2538, 'relevance_score': 0.9906961}), Document(page_content='you may choose to engage a third-\nparty consultant to perform the internal audit, or a member of your\norganization, who is qualified and independent of the control owners, may\nperform the audit.\n\u200d\n **7\\. complete a full certification audit**\nthis is the key piece of your iso 27001 certification: the full audit. your\ncertification organization will conduct an in-depth investigation of your isms\nto evaluate your iso 27001 compliance. this can be an extensive on-site\nprocess.\n keep in mind, though, that compliance automation software like vanta can make\nthis process simpler. as it scans your system, vanta compiles and documents\nevidence of your compliance, so your auditor will have all this documentation\nin one convenient place.\n\u200d\n **8\\. receive your certification**\nif your auditor determines that you adhere to all the necessary components of\niso 27001, you will officially receive your certification.\n\u200d\n\u200d\n## maintain your iso 27001 certification\n\u200d\nit’s important to understand that iso 27001 certification is not a one-time\nprocess. your certification will need to be renewed to some degree every year.\n these certificates use a three-year cycle. one year after your first\ncertification, your certification organization will conduct a less extensive\naudit to check a few key controls. if you pass this, you’ll retain your\ncertification. if not, the organization will conduct a full, intensive audit\nas they did in the first year.\n the same is true for the second year after your initial certification:', metadata={'description': 'Need to get ISO 27001 certified? Find out what you can expect from the ISO 27001 certification process from security compliance experts.', 'doc_ID': 16, 'language': 'en', 'original_text': 'You may choose to engage a third-\nparty consultant to perform the internal audit, or a member of your\norganization, who is qualified and independent of the control owners, may\nperform the audit.\n\u200d\n **7\\. Complete a full certification audit**\nThis is the key piece of your ISO 27001 certification: the full audit. Your\ncertification organization will conduct an in-depth investigation of your ISMS\nto evaluate your ISO 27001 compliance. This can be an extensive on-site\nprocess.\n Keep in mind, though, that compliance automation software like Vanta can make\nthis process simpler. As it scans your system, Vanta compiles and documents\nevidence of your compliance, so your auditor will have all this documentation\nin one convenient place.\n\u200d\n **8\\. Receive your certification**\nIf your auditor determines that you adhere to all the necessary components of\nISO 27001, you will officially receive your certification.\n\u200d\n\u200d\n## Maintain your ISO 27001 certification\n\u200d\nIt’s important to understand that ISO 27001 certification is not a one-time\nprocess. Your certification will need to be renewed to some degree every year.\n These certificates use a three-year cycle. One year after your first\ncertification, your certification organization will conduct a less extensive\naudit to check a few key controls. If you pass this, you’ll retain your\ncertification. If not, the organization will conduct a full, intensive audit\nas they did in the first year.\n The same is true for the second year after your initial certification:', 'source': 'https://www.vanta.com/resources/how-long-does-it-take-to-get-iso-certified', 'title': 'What is the ISO certification timeline?', 'relevance_score': 0.9878996})]","There are different types of audits regarding ISO 27001. The first aspect under which audits can be classified is the maturity level of the ISMS being audited. Pre-audits, internal audits, certification audits, surveillance audits, and recertification audits differ in this regard. The second aspect relates to the scope and preparation of the audit. There are audits that are scheduled both in terms of timing and content, audits that are only scheduled in terms of timing and content, and unannounced audits. Each of these types of audits serves its own purpose and is used at different times and in different situations.",ISO 2,True,0.019417475728155338,0.0,0.019417475728155338,0.15476247668266296,0.2994007058441639,0.0028133203741163015,0.3824564163330656,0,0,2.614001989364624,0.928002119064331,0.22999906539916992,3.542004108428955
Fine-tuned_finetuned-ISO-27001_1024_l2_All_1536_264_False,Hybrid_Rerank_Cohere,4,mixtral-8x7B-v0.1,16000,0,1,What requirements must be met to qualify as an (internal/external) auditor for an ISMS?,"[Document(page_content=""an external auditor, your company will\nfirst be required to perform an internal audit. an internal audit involves a\nthorough examination of your organization’s isms and is one of the best ways\nto ensure that your organization’s isms is operating effectively and is in\nalignment with the iso 27001 standard. specifically, organizations are\nrequired to self-verify conformance with the requirements from annex a of iso\n27001 deemed applicable in the isms's documented statement of applicability.\nthe internal audit is intended to help identify any gaps or deficiencies that\ncould affect your isms and impact your organization’s ability to meet its\nintended objectives, as well as to successfully complete an initial or annual\niso 27001 certification audit and maintain the certification.\n **the internal audit function is a requirement under the iso 27001 standard**\nand can be challenging to implement in a way that meets each of the\nrequirements set forth in the standard, especially for smaller organizations.\nthis is because of the prescriptive nature outlined in the standard, and the\nneed for allocated resources that are both independent of the development and\nmaintenance of the isms, while still possessing the necessary competencies to\nperform the internal audit function.\n**unlike a certification review where you must use an external third-party to\nconduct the audit, the internal audit can be conducted either by staff within\nyour organization or by an independent third party, such as a consulting\nfirm.** when"", metadata={'description': 'In this guide, we share the recommended approach to successful implementation of an Information Security Management System (ISMS) according to the ISO 27001 standard to help prepare your organization to undergo an independent evaluation of your ISMS in order to obtain your ISO 27001 certification.', 'doc_ID': 60, 'language': 'en', 'original_text': ""an external auditor, your company will\nfirst be required to perform an internal audit. An internal audit involves a\nthorough examination of your organization’s ISMS and is one of the best ways\nto ensure that your organization’s ISMS is operating effectively and is in\nalignment with the ISO 27001 standard. Specifically, organizations are\nrequired to self-verify conformance with the requirements from Annex A of ISO\n27001 deemed applicable in the ISMS's documented Statement of Applicability.\nThe internal audit is intended to help identify any gaps or deficiencies that\ncould affect your ISMS and impact your organization’s ability to meet its\nintended objectives, as well as to successfully complete an initial or annual\nISO 27001 certification audit and maintain the certification.\n **The internal audit function is a requirement under the ISO 27001 standard**\nand can be challenging to implement in a way that meets each of the\nrequirements set forth in the standard, especially for smaller organizations.\nThis is because of the prescriptive nature outlined in the standard, and the\nneed for allocated resources that are both independent of the development and\nmaintenance of the ISMS, while still possessing the necessary competencies to\nperform the internal audit function.\n**Unlike a certification review where you must use an external third-party to\nconduct the audit, the internal audit can be conducted either by staff within\nyour organization or by an independent third party, such as a consulting\nfirm.** When"", 'source': 'https://www.vanta.com/resources/the-ultimate-iso-27001-guide-powered-by-vanta-and-aprio', 'title': 'The ultimate ISO 27001 guide', 'relevance_score': 0.9976495}), Document(page_content='the identified information security requirements, and are\neffectively implemented and maintained.\nhowever, selecting the internal isms auditors may be difficult for small companies. if not enough resources\nare available to have these kinds of audits performed by experienced internal members of staff, external\nexperts should instead be charged with carrying out auditing activities.\\when organizations use external\nauditors, the following should be considered: external auditors are themselves familiar with the internal isms\naudits; however they may not have enough knowledge about the organizational environment of the\norganization. this information should be supplied by internal staff. on the other hand, internal auditors may be\nable to perform detailed audits considering the organization’s organizational environment, but may not have\nenough knowledge about performing isms audits. organizations should recognize the characteristics and\npotential shortcomings of internal vs. external auditors carrying out the internal isms audits.\nthe effectiveness and efficiency of the implemented controls (see iso/iec 27004:2009) should be examined\nwithin the scope of internal audits.\nit is important that none of the audits are carried out by those individuals who were involved in the planning\nand design of the security objectives, because it is difficult to find one’s own mistakes. therefore, organization\nunits or individuals that are outside the scope of internal isms audits should be selected as the auditors by\nmanagement.', metadata={'doc_ID': 1516, 'original_text': 'the identified information security requirements, and are\neffectively implemented and maintained.\nHowever, selecting the internal ISMS auditors may be difficult for small companies. If not enough resources\nare available to have these kinds of audits performed by experienced internal members of staff, external\nexperts should instead be charged with carrying out auditing activities.\\When organizations use external\nauditors, the following should be considered: external auditors are themselves familiar with the internal ISMS\naudits; however they may not have enough knowledge about the organizational environment of the\norganization. This information should be supplied by internal staff. On the other hand, internal auditors may be\nable to perform detailed audits considering the organization’s organizational environment, but may not have\nenough knowledge about performing ISMS audits. Organizations should recognize the characteristics and\npotential shortcomings of internal vs. external auditors carrying out the internal ISMS audits.\nThe effectiveness and efficiency of the implemented controls (see ISO/IEC 27004:2009) should be examined\nwithin the scope of internal audits.\nIt is important that none of the audits are carried out by those individuals who were involved in the planning\nand design of the security objectives, because it is difficult to find one’s own mistakes. Therefore, Organization\nunits or individuals that are outside the scope of internal ISMS audits should be selected as the auditors by\nmanagement.', 'source': 'ISO 27003 2010 (E).pdf', 'title': 'ISO 27003 2010 (E)', 'relevance_score': 0.99732697}), Document(page_content='organization should have its implementation of its\ninformation security policy independently reviewed. iss027002 makes it\nclear that this can include bringing in outside auditors to review the isms or\nbringing in independent third-party certification auditors to certify it; the\naccredited certification audit meets this control requirement of the standard.\nit does, however, recognize (as does any quality management system) that\nan organization ought to have its implementation of any key system or\nprocess reviewed by someone other than the person responsible for imple-\nmenting it. this is a standard principle of an iso9001-certificated\nmanagement system, and any company that has such a management system\nin place can simply graft an extra responsibility on to those who have the\nexisting ones.\nan internal audit function that only has experience in financial audit will\nnot, however, be adequately trained to carry out a quality management\nsystem audit. equally, an audit function that already deals with internal\naudit of another management system will not be automatically capable of\ncompetently conducting an iso27001 audit.\nthere is an ibitgq internal audit qualification, and most third-party\ncertification bodies are likely to provide training courses for internal audit\nteams. quality system auditing is a necessary basis for isms auditing, but\nis not sufficient. at the very least, the internal auditor should attend a\nfoundations of information security management course described earlier\nin this chapter — a', metadata={'doc_ID': 2007, 'original_text': 'organization should have its implementation of its\ninformation security policy independently reviewed. IsS027002 makes it\nclear that this can include bringing in outside auditors to review the ISMS or\nbringing in independent third-party certification auditors to certify it; the\naccredited certification audit meets this control requirement of the standard.\nIt does, however, recognize (as does any quality management system) that\nan organization ought to have its implementation of any key system or\nprocess reviewed by someone other than the person responsible for imple-\nmenting it. This is a standard principle of an ISO9001-certificated\nmanagement system, and any company that has such a management system\nin place can simply graft an extra responsibility on to those who have the\nexisting ones.\nAn internal audit function that only has experience in financial audit will\nnot, however, be adequately trained to carry out a quality management\nsystem audit. Equally, an audit function that already deals with internal\naudit of another management system will not be automatically capable of\ncompetently conducting an ISO27001 audit.\nThere is an IBITGQ Internal Audit qualification, and most third-party\ncertification bodies are likely to provide training courses for internal audit\nteams. Quality system auditing is a necessary basis for ISMS auditing, but\nis not sufficient. At the very least, the internal auditor should attend a\nFoundations of Information Security Management course described earlier\nin this chapter — a', 'source': 'Watkins, Calder - 2020 - IT Governance - An International Guide to Data Security and ISO 27001 ISO 27002.pdf', 'title': 'Watkins, Calder - 2020 - IT Governance - An International Guide to Data Security and ISO 27001 ISO 27002', 'relevance_score': 0.9966234}), Document(page_content='an identity\nbadge prepared and reserve a parking space. book a room for the auditor’s use (more if\nthere is a team) and ensure that refreshments will be available, including lunch if possible.\nyou will be needing to show documents and discuss them, so some form of large screen or\nprojector will be useful.\nfor a remote audit, ensure that the online meeting tool you are going to use is agreed and\nthat everyone involved knows how to use it, including how to share the screen to show the\nauditor some documented information. check that microphones and cameras work and that\nthe area behind each participant (in view of the camera) is appropriate. if technology such\nas a mobile phone is going to be used to perform a virtual walkaround of the offices, then\ntest that first too.\nonce the basic arrangements are in place you need to ensure that whoever is going to act as\nthe auditor’s guide around the isms is ready. this means knowing where all the relevant\ndocuments are and how each of the requirements is met within the documents. supporting\ninformation such as hr and training records should also be available if required. anyone\nwho might be able to help the auditor such as managers and support staff should be on\nstandby and everyone who is planned to talk to the auditor should be prepared.\nthere is no substitute for practice so conduct a mock audit beforehand if you can and\nidentify any improvements needed before the day. having obvious signs of information\nsecurity-related activity on display at your location does no', metadata={'source': 'CERTIKIT_ISO27001_Implementation_Guide_v12.pdf.pdf', 'title': 'CERTIKIT_ISO27001_Implementation_Guide_v12.pdf', 'original_text': 'an identity\nbadge prepared and reserve a parking space. Book a room for the auditor’s use (more if\nthere is a team) and ensure that refreshments will be available, including lunch if possible.\nYou will be needing to show documents and discuss them, so some form of large screen or\nprojector will be useful.\nFor a remote audit, ensure that the online meeting tool you are going to use is agreed and\nthat everyone involved knows how to use it, including how to share the screen to show the\nauditor some documented information. Check that microphones and cameras work and that\nthe area behind each participant (in view of the camera) is appropriate. If technology such\nas a mobile phone is going to be used to perform a virtual walkaround of the offices, then\ntest that first too.\nOnce the basic arrangements are in place you need to ensure that whoever is going to act as\nthe auditor’s guide around the ISMS is ready. This means knowing where all the relevant\ndocuments are and how each of the requirements is met within the documents. Supporting\ninformation such as HR and training records should also be available if required. Anyone\nwho might be able to help the auditor such as managers and support staff should be on\nstandby and everyone who is planned to talk to the auditor should be prepared.\nThere is no substitute for practice so conduct a mock audit beforehand if you can and\nidentify any improvements needed before the day. Having obvious signs of information\nsecurity-related activity on display at your location does no', 'doc_ID': 962, 'relevance_score': 0.99630713})]","To qualify as an auditor for an ISMS, several requirements must be met. First, employees from departments involved in the implementation of information security should not be assigned as auditors. Suitable candidates, however, would be employees from the auditing, quality management, or similar cross-functional or staff functions, provided they have experience in the field of information security. It may also be useful to have an IT specialist on the audit team who can assess technical security aspects. Personal requirements are also important, as auditors should be objective, impartial, polite, and correct in their conduct. Furthermore, auditors should not be subordinate to the superiors to ensure independent verification. If certification is sought, it is advisable to document the selection of internal auditors and provide qualification evidence such as training, degrees, or reference projects. External auditors should be qualified and have proof of qualification. It is important that the external audit is conducted separately from any form of consulting to ensure neutrality and objectivity.","To qualify as an internal or external auditor for an Information Security Management System (ISMS) certified under ISO 27001, certain requirements must be met. An internal auditor can be a staff member within the organization or an independent third-party consultant. Key competencies for internal auditors include understanding the organizational environment and the ISO 27001 standard. If the internal audit function is challenging for smaller organizations, they can engage external experts.

External auditors, on the other hand, are typically engaged from consulting firms or certification bodies. They should be accredited and impartial, with demonstrable expertise in ISO 27001 and information security. External auditors must provide a detailed report on the ISMS's conformance with the standard, identifying any gaps or non-conformities.

Regardless of whether the auditor is internal or external, they should not be involved in the planning and design of the security objectives. The auditor's role is to independently review the ISMS's implementation and effectiveness. This includes examining the risk assessment process, the risk treatment plan, and the monitoring and review activities.

In terms of training, an internal auditor should ideally have a background",True,0.45014245014245013,0.10888252148997135,0.22792022792022792,0.420906126499176,0.7646846026182175,0.9998089671134949,0.8012023521729055,0,0,2.2974884510040283,3.660937786102295,0.23305320739746094,5.958426237106323
Fine-tuned_finetuned-ISO-27001_1024_l2_All_1536_264_False,Hybrid_Rerank_Cohere,4,mixtral-8x7B-v0.1,16000,0,1,What preparations can be made before an initial audit for the ISO 27001 certification to ensure that the existing documentation meets the requirements of the standard?,"[Document(page_content='auditor should be prepared.\nthere is no substitute for practice so conduct a mock audit beforehand if you can and\nidentify any improvements needed before the day. having obvious signs of information\nsecurity-related activity on display at your location does no harm; this could be performance\ncharts or posters for raising awareness on the walls.\nit’s all about showing the auditor that you are a professional organization that is in control;\nyou may be surprised how little the auditor feels they need to look at if the overall\nimpression they are getting is very positive.\n5.4 during the audit\nthe auditor should have provided an audit plan which will set out the structure of the audit,\nincluding areas to be reviewed, people to be met and timings (this often doesn’t happen so\n page 76 of 79\niso/iec 27001 implementation guide\ndon’t worry if you don’t get one). despite the appearance of power, auditing is quite strictly\nregulated so the auditor will have specific things they need to do, in a specific format,\nstarting with an opening meeting and ending with a closing meeting. do what you can to\nmake it easy for them by providing access to the relevant documents and resources as\nquickly and smoothly as possible.\nbasically, all the auditor is doing is the same exercise as you did yourself when you\nperformed (and repeated) the gap assessment. it’s purely a matter of going through the\nrequirements of the iso/iec 27001 standard and asking to be shown how you meet them.\nthe auditor will need to record the evidence', metadata={'doc_ID': 963, 'original_text': 'auditor should be prepared.\nThere is no substitute for practice so conduct a mock audit beforehand if you can and\nidentify any improvements needed before the day. Having obvious signs of information\nsecurity-related activity on display at your location does no harm; this could be performance\ncharts or posters for raising awareness on the walls.\nIt’s all about showing the auditor that you are a professional organization that is in control;\nyou may be surprised how little the auditor feels they need to look at if the overall\nimpression they are getting is very positive.\n5.4 During the audit\nThe auditor should have provided an audit plan which will set out the structure of the audit,\nincluding areas to be reviewed, people to be met and timings (this often doesn’t happen so\n Page 76 of 79\nISO/IEC 27001 Implementation Guide\ndon’t worry if you don’t get one). Despite the appearance of power, auditing is quite strictly\nregulated so the auditor will have specific things they need to do, in a specific format,\nstarting with an opening meeting and ending with a closing meeting. Do what you can to\nmake it easy for them by providing access to the relevant documents and resources as\nquickly and smoothly as possible.\nBasically, all the auditor is doing is the same exercise as you did yourself when you\nperformed (and repeated) the gap assessment. It’s purely a matter of going through the\nrequirements of the ISO/IEC 27001 standard and asking to be shown how you meet them.\nThe auditor will need to record the evidence', 'source': 'CERTIKIT_ISO27001_Implementation_Guide_v12.pdf.pdf', 'title': 'CERTIKIT_ISO27001_Implementation_Guide_v12.pdf', 'relevance_score': 0.9940197}), Document(page_content='defines the boundaries\nof your organization’s isms, what elements of your\nisms are reviewed for certification, and which\ncontrols are relevant to the scope of your project.\nled\ncc\ncc]\nplanning\nthis section helps organizations to create objectives\nbased on risks and opportunities. organizations use\nthis information to establish a plan to maintain a\nrisk-based approach to isms management and\ndetermine how they will monitor and measure\ntheir objectives.\nperformance evaluation\nthis section guides organizations to define\nprocedures for measuring, monitoring, and main-\ntaining isms records. it also includes information\non establishing an internal audit schedule and\nmanagement reviews to address remediation\nactions for issues discovered during audits.\nimprovement\nhelps organizations create a process for recording\nand managing recommendations for improvement\nand non-conformities discovered during audits.\nthe initial certification process for iso 27001 certificate eligibility comprises two stages: a documentation\nreview audit and an evidential audit. the clauses detailed in part 1 of the iso 27001 structure help organizations\nprepare written documentation, processes, procedures, and guidelines that explain your isms implementation\nand the business processes that support it.\nthese documents are then reviewed by an approved, objective auditor during the stage 1 documentation\nreview. during this first stage, the auditor ensures that a company’s documentation aligns with iso 27001\nstandards and may recommend them', metadata={'doc_ID': 1340, 'original_text': 'defines the boundaries\nof your organization’s ISMS, what elements of your\nISMS are reviewed for certification, and which\ncontrols are relevant to the scope of your project.\nLed\nCc\nCc]\nPlanning\nThis section helps organizations to create objectives\nbased on risks and opportunities. Organizations use\nthis information to establish a plan to maintain a\nrisk-based approach to ISMS management and\ndetermine how they will monitor and measure\ntheir objectives.\nPerformance Evaluation\nThis section guides organizations to define\nprocedures for measuring, monitoring, and main-\ntaining ISMS records. It also includes information\non establishing an internal audit schedule and\nmanagement reviews to address remediation\nactions for issues discovered during audits.\nImprovement\nHelps organizations create a process for recording\nand managing recommendations for improvement\nand non-conformities discovered during audits.\nThe initial certification process for ISO 27001 certificate eligibility comprises two stages: a documentation\nreview audit and an evidential audit. The clauses detailed in part 1 of the ISO 27001 structure help organizations\nprepare written documentation, processes, procedures, and guidelines that explain your ISMS implementation\nand the business processes that support it.\nThese documents are then reviewed by an approved, objective auditor during the Stage 1 Documentation\nReview. During this first stage, the auditor ensures that a company’s documentation aligns with ISO 27001\nstandards and may recommend them', 'source': 'complete-guide-iso-27001-compliance.pdf', 'title': 'complete-guide-iso-27001-compliance', 'relevance_score': 0.9918121}), Document(page_content='of these issues.\nsteve also warns against these things when preparing for iso 27001:\nimproperly defining the isms scope\ninadequate employee security training\nimproperly performed risk assessments\nmetrics and implementation plans for info sec don’t align with company objectives\nimproper record keeping—iso is really big on having evidence\ninadequate access controls and access management—especially in devops how do i know my organization is ready for an iso 27001 audit?\nif you’re in a mature organization with several infosec controls, it could merely be putting those policies into place. for those starting from scratch, it could be a heavier lift. once you have everything in place (internal audit, pre-certification readiness assessment), steve recommends conducting a management review to make sure upper management is aware of the entire isms. these reviews go over every single part of the isms—including policies, metrics, operations, and any deficiencies in the internal audit.\nbefore undergoing an audit, steve suggests you have:\nall the basic documentation in place, including running the system for a period of three to six months.\na trained team that promotes a cyber aware culture.\nrisk assessment and risk treatment plans in place.\na connection with your certification body—they can offer specific advice as to what you need to do to get ready and what you should be on the lookout for.\nat least 75% passing tests and controls in your compliance automation system.\n“you’ll know if you’re ready. do', metadata={'description': 'Achieving ISO 27001 can come with a lot of questions. Lead Auditor at ARORA Solutions, Steve Cullen, breaks down how to set your organization up for a successful ISO 27001 audit.', 'doc_ID': 91, 'language': 'en', 'original_text': 'of these issues.\nSteve also warns against these things when preparing for ISO 27001:\nImproperly defining the ISMS scope\nInadequate employee security training\nImproperly performed risk assessments\nMetrics and implementation plans for info sec don’t align with company objectives\nImproper record keeping—ISO is really big on having evidence\nInadequate access controls and access management—especially in DevOps How Do I Know My Organization is Ready for an ISO 27001 Audit?\nIf you’re in a mature organization with several infosec controls, it could merely be putting those policies into place. For those starting from scratch, it could be a heavier lift. Once you have everything in place (internal audit, pre-certification readiness assessment), Steve recommends conducting a management review to make sure upper management is aware of the entire ISMS. These reviews go over every single part of the ISMS—including policies, metrics, operations, and any deficiencies in the internal audit.\nBefore undergoing an audit, Steve suggests you have:\nAll the basic documentation in place, including running the system for a period of three to six months.\nA trained team that promotes a cyber aware culture.\nRisk assessment and risk treatment plans in place.\nA connection with your certification body—they can offer specific advice as to what you need to do to get ready and what you should be on the lookout for.\nAt least 75% passing tests and controls in your compliance automation system.\n“You’ll know if you’re ready. Do', 'source': 'https://www.drata.com/blog/ask-an-auditor-demystifying-iso-27001', 'title': 'Ask an Auditor: Demystifying the ISO 27001 Certification Process With Steve Cullen From ARORA Solutions', 'relevance_score': 0.9891816}), Document(page_content=""plan will vary from company to company, depending on how\ncomplex it is and its various roles and responsibilities.\nstep 4: complete the documentation\nduring this step, you need to define and implement the policies, procedures, and other\nrecord documents, such as review logs, network logs, and training records that are\nmandatory, as per the iso 27001 standard guideline.\nstep 5: schedule your stage 1 audit\nat this point, you should have all the documents ready and the preparation complete.\nit’s time to schedule the stage 1 audits with the external agency or auditor. you can get\nguidance from the auditor and clarify any doubts. this is your best chance to improve.\n250\nchapter 9 external audit\nstep 6: prepare your team\nnow it’s time to prepare your team for the audit. discuss with the team and send an\nemail if required about what they should expect to be asked and how to reply. the best\nway to reply to an auditor is to give real-life examples when you're asked for evidence.\nstep 7: close the gaps\nduring this step, you need to close all the gaps or issues shared by the auditor during the\nstage 1 audit. by this time, the team will have confidence and will understand the audit\ncycle, as they already went through a stage 1 audit. once the gaps are closed, they need\nto be sent back to the auditor for review. you need to obtain the auditor’s approval that\nthe issues have been resolved.\nstep 8: schedule stage 2 audit\nthis is the final step before receiving the iso 27001 certificate. schedule your stage"", metadata={'doc_ID': 1312, 'original_text': ""plan will vary from company to company, depending on how\ncomplex it is and its various roles and responsibilities.\nStep 4: Complete the Documentation\nDuring this step, you need to define and implement the policies, procedures, and other\nrecord documents, such as review logs, network logs, and training records that are\nmandatory, as per the ISO 27001 standard guideline.\nStep 5: Schedule Your Stage 1 Audit\nAt this point, you should have all the documents ready and the preparation complete.\nIt’s time to schedule the stage 1 audits with the external agency or auditor. You can get\nguidance from the auditor and clarify any doubts. This is your best chance to improve.\n250\nCHAPTER 9 EXTERNAL AUDIT\nStep 6: Prepare Your Team\nNow it’s time to prepare your team for the audit. Discuss with the team and send an\nemail if required about what they should expect to be asked and how to reply. The best\nway to reply to an auditor is to give real-life examples when you're asked for evidence.\nStep 7: Close the Gaps\nDuring this step, you need to close all the gaps or issues shared by the auditor during the\nstage 1 audit. By this time, the team will have confidence and will understand the audit\ncycle, as they already went through a stage 1 audit. Once the gaps are closed, they need\nto be sent back to the auditor for review. You need to obtain the auditor’s approval that\nthe issues have been resolved.\nStep 8: Schedule Stage 2 Audit\nThis is the final step before receiving the ISO 27001 certificate. Schedule your stage"", 'source': 'Chopra, Chaudhary - 2020 - Implementing an Information Security Management System - Security Management Based On ISO 27001.pdf', 'title': 'Chopra, Chaudhary - 2020 - Implementing an Information Security Management System - Security Management Based On ISO 27001', 'relevance_score': 0.9871293})]","To ensure that the existing documentation meets the requirements of the standard, various preparations can be made before an initial audit. One option is to engage external consultants with experience in dealing with the relevant standard. They can assist in writing critical documents or examining existing records to assess conformity. Additionally, contractual agreements with the certification body should be checked to determine which documents and evidence are required and whether they are available, up-to-date, and formally correct. Furthermore, it is important to ensure that the documentation is consistent and coherent and meets the requirements of the standard. Additionally, any agreed-upon corrective and preventive actions from previous audits should be implemented and documented in writing.","To prepare for an initial audit for ISO 27001 certification, an organization should first define the boundaries and scope of its Information Security Management System (ISMS). This includes identifying which elements of the ISMS will be reviewed for certification and which controls are relevant to the project. 

Next, the organization should create objectives based on risks and opportunities, and establish a plan to maintain a risk-based approach to ISMS management. This plan should include procedures for measuring, monitoring, and maintaining ISMS records, as well as an internal audit schedule and management reviews to address remediation actions for issues discovered during audits.

The organization should also ensure that all necessary documentation is in place, including policies, procedures, and records such as review logs, network logs, and training records. It is important that these documents align with ISO 27001 standards and are implemented and followed within the organization.

Prior to the audit, the organization should schedule a stage 1 documentation review with an approved auditor. During this review, the auditor will ensure that the organization's documentation aligns with ISO 27001 standards and may recommend improvements. The organization should use this opportunity to ask the auditor for guidance and clarification on",True,0.35962145110410093,0.0634920634920635,0.17665615141955834,0.4543989896774292,0.8026310056447983,0.9991243481636047,0.6409133920895052,0,0,2.2553060054779053,3.580129384994507,0.23399686813354492,5.835435390472412
Fine-tuned_finetuned-ISO-27001_1024_l2_All_1536_264_False,Hybrid_Rerank_Cohere,4,mixtral-8x7B-v0.1,16000,0,1,What would be useful to do just before an external audit for the ISO 27001 certification to become more confident?,"[Document(page_content=""comes to the iso 27001 certification are:\ndocumentation, undergoing audits and ensuring your employees adopt the\nprocesses.\n**documentation** includes the creation and maintenance of necessary\ndocumentation for your information security management system (isms), such as\npolicies, procedures, risk assessments, and controls.\n**undergoing audits** includes both the stage 1 audit, which reviews\ndocumentation and readiness, and the stage 2 audit, which assesses the\npractical implementation of your isms. successful completion of these audits\nis necessary to achieve iso 27001 certification. you will also be required to\nundergo internal audits and management reviews.\nit's also crucial to **communicate the processes effectively** this is to\nensure that your organization's information security practices align with the\niso 27001 standards. you will need to have the documentation in place but also\nput the processes into action by ensuring employees are aware of and follow\nthem.\nthe mandatory documents required for the iso 27001 standard are listed below.\nall criteria must be followed and documented accordingly for an organisation\nto present during external audits. the standard requires you to undergo an\ninternal audit before an external one. this will expose any gaps in your isms.\nonce you have prepared the documentation and undergone an internal audit as\nwell as a management review, you need to undergo an external audit by a\ncertified body such as the ukas.\nthe mandatory documents required for iso 27001 are:\n *"", metadata={'source': 'https://experta.com/shared-post/a73a0b00-a398-4e8a-afcf-632f9631cb69', 'title': 'Experta', 'language': 'No language found.', 'original_text': ""comes to the ISO 27001 certification are:\ndocumentation, undergoing audits and ensuring your employees adopt the\nprocesses.\n**Documentation** includes the creation and maintenance of necessary\ndocumentation for your Information Security Management System (ISMS), such as\npolicies, procedures, risk assessments, and controls.\n**Undergoing audits** includes both the Stage 1 Audit, which reviews\ndocumentation and readiness, and the Stage 2 Audit, which assesses the\npractical implementation of your ISMS. Successful completion of these audits\nis necessary to achieve ISO 27001 certification. You will also be required to\nundergo internal audits and management reviews.\nIt's also crucial to **communicate the processes effectively** This is to\nensure that your organization's information security practices align with the\nISO 27001 standards. You will need to have the documentation in place but also\nput the processes into action by ensuring employees are aware of and follow\nthem.\nThe mandatory documents required for the ISO 27001 standard are listed below.\nAll criteria must be followed and documented accordingly for an organisation\nto present during external audits. The standard requires you to undergo an\ninternal audit before an external one. This will expose any gaps in your ISMS.\nOnce you have prepared the documentation and undergone an internal audit as\nwell as a management review, you need to undergo an external audit by a\ncertified body such as the UKAS.\nThe mandatory documents required for ISO 27001 are:\n *"", 'doc_ID': 283, 'relevance_score': 0.9915544}), Document(page_content='auditor should be prepared.\nthere is no substitute for practice so conduct a mock audit beforehand if you can and\nidentify any improvements needed before the day. having obvious signs of information\nsecurity-related activity on display at your location does no harm; this could be performance\ncharts or posters for raising awareness on the walls.\nit’s all about showing the auditor that you are a professional organization that is in control;\nyou may be surprised how little the auditor feels they need to look at if the overall\nimpression they are getting is very positive.\n5.4 during the audit\nthe auditor should have provided an audit plan which will set out the structure of the audit,\nincluding areas to be reviewed, people to be met and timings (this often doesn’t happen so\n page 76 of 79\niso/iec 27001 implementation guide\ndon’t worry if you don’t get one). despite the appearance of power, auditing is quite strictly\nregulated so the auditor will have specific things they need to do, in a specific format,\nstarting with an opening meeting and ending with a closing meeting. do what you can to\nmake it easy for them by providing access to the relevant documents and resources as\nquickly and smoothly as possible.\nbasically, all the auditor is doing is the same exercise as you did yourself when you\nperformed (and repeated) the gap assessment. it’s purely a matter of going through the\nrequirements of the iso/iec 27001 standard and asking to be shown how you meet them.\nthe auditor will need to record the evidence', metadata={'doc_ID': 963, 'original_text': 'auditor should be prepared.\nThere is no substitute for practice so conduct a mock audit beforehand if you can and\nidentify any improvements needed before the day. Having obvious signs of information\nsecurity-related activity on display at your location does no harm; this could be performance\ncharts or posters for raising awareness on the walls.\nIt’s all about showing the auditor that you are a professional organization that is in control;\nyou may be surprised how little the auditor feels they need to look at if the overall\nimpression they are getting is very positive.\n5.4 During the audit\nThe auditor should have provided an audit plan which will set out the structure of the audit,\nincluding areas to be reviewed, people to be met and timings (this often doesn’t happen so\n Page 76 of 79\nISO/IEC 27001 Implementation Guide\ndon’t worry if you don’t get one). Despite the appearance of power, auditing is quite strictly\nregulated so the auditor will have specific things they need to do, in a specific format,\nstarting with an opening meeting and ending with a closing meeting. Do what you can to\nmake it easy for them by providing access to the relevant documents and resources as\nquickly and smoothly as possible.\nBasically, all the auditor is doing is the same exercise as you did yourself when you\nperformed (and repeated) the gap assessment. It’s purely a matter of going through the\nrequirements of the ISO/IEC 27001 standard and asking to be shown how you meet them.\nThe auditor will need to record the evidence', 'source': 'CERTIKIT_ISO27001_Implementation_Guide_v12.pdf.pdf', 'title': 'CERTIKIT_ISO27001_Implementation_Guide_v12.pdf', 'relevance_score': 0.9861514}), Document(page_content='is\nthat you select some basic measurements that are easy to collect and interpret and use\nthose for a while. after some time has passed it will probably become obvious that other\nspecific measurements are needed to be able to assess whether things are going well so\nthese can be added gradually. be careful not to start with a wide range of possibly\nmeaningless, hard to collect measurements that will simply slow everything down and give\nthe isms a bad reputation before it has got going.\nhaving chosen your measurements you need to decide what does “good” look like; what\nnumerical values would mean that performance is in line with expectations? again, the\ndefinition of your objectives may need tweaking over time as you gain experience with\ntaking the measurements and your isms moves from implementation mode into ongoing\noperation mode.\nif you find that your objectives are not being met, then an improvement may be required to\nbring the situation back into line; such improvements should be added to the\nnonconformity and corrective action log provided within the toolkit and tracked through to\ncompletion.\n3.10.2 clause 9.2 internal audit\nthe standard requires that there is an internal auditing programme in place which audits all\naspects of the isms within a reasonable period. if you embrace the idea of internal auditing\nas a useful early warning of any issues at external audit, then you won’t go far wrong.\ninternal audits should ensure that there are no surprises during the annual\n page 33 of 79\niso/iec 27001', metadata={'source': 'CERTIKIT_ISO27001_Implementation_Guide_v12.pdf.pdf', 'title': 'CERTIKIT_ISO27001_Implementation_Guide_v12.pdf', 'original_text': 'is\nthat you select some basic measurements that are easy to collect and interpret and use\nthose for a while. After some time has passed it will probably become obvious that other\nspecific measurements are needed to be able to assess whether things are going well so\nthese can be added gradually. Be careful not to start with a wide range of possibly\nmeaningless, hard to collect measurements that will simply slow everything down and give\nthe ISMS a bad reputation before it has got going.\nHaving chosen your measurements you need to decide what does “good” look like; what\nnumerical values would mean that performance is in line with expectations? Again, the\ndefinition of your objectives may need tweaking over time as you gain experience with\ntaking the measurements and your ISMS moves from implementation mode into ongoing\noperation mode.\nIf you find that your objectives are not being met, then an improvement may be required to\nbring the situation back into line; such improvements should be added to the\nNonconformity and Corrective Action Log provided within the Toolkit and tracked through to\ncompletion.\n3.10.2 Clause 9.2 Internal Audit\nThe standard requires that there is an internal auditing programme in place which audits all\naspects of the ISMS within a reasonable period. If you embrace the idea of internal auditing\nas a useful early warning of any issues at external audit, then you won’t go far wrong.\nInternal audits should ensure that there are no surprises during the annual\n Page 33 of 79\nISO/IEC 27001', 'doc_ID': 889, 'relevance_score': 0.9859904}), Document(page_content='tool and the certification readiness checklist within the toolkit as a guide to\nyour readiness, but don’t expect to be 100% compliant before going for stage one. a more\nappropriate figure is probably 90% or so but it does depend on which areas are not yet\ncomplete.\nbefore arranging the stage one you should have completed the following:\ne information security policy\ne risk assessment and treatment plan\ne implemented most (but not necessarily all) of your information security controls\ne conducted user awareness training\ne internal audits of all areas of the standard\n page 75 of 79\niso/iec 27001 implementation guide\ne atleast one management review (ideally more)\nnot having any of the above available would probably mean that the stage one visit is\ninconclusive in terms of judging your readiness for the stage two i.e. the auditor would tell\nyou just weren’t ready yet.\n5.3 preparing for audit day\nonce you feel you’re ready to be visited by the auditor for either the stage one or stage\ntwo, there are sensible preparations to take to make the best impression from the start.\nfirstly, make sure that the visit is confirmed, provide directions and check the time of arrival\nof the auditor(s). if appropriate, inform reception that they will be coming, get an identity\nbadge prepared and reserve a parking space. book a room for the auditor’s use (more if\nthere is a team) and ensure that refreshments will be available, including lunch if possible.\nyou will be needing to show documents and discuss them, so some form', metadata={'source': 'CERTIKIT_ISO27001_Implementation_Guide_v12.pdf.pdf', 'title': 'CERTIKIT_ISO27001_Implementation_Guide_v12.pdf', 'original_text': 'Tool and the Certification Readiness Checklist within the Toolkit as a guide to\nyour readiness, but don’t expect to be 100% compliant before going for Stage One. A more\nappropriate figure is probably 90% or so but it does depend on which areas are not yet\ncomplete.\nBefore arranging the Stage One you should have completed the following:\ne Information security policy\ne Risk assessment and treatment plan\ne Implemented most (but not necessarily all) of your information security controls\ne Conducted user awareness training\ne Internal audits of all areas of the standard\n Page 75 of 79\nISO/IEC 27001 Implementation Guide\ne Atleast one management review (ideally more)\nNot having any of the above available would probably mean that the Stage One visit is\ninconclusive in terms of judging your readiness for the Stage Two i.e. the auditor would tell\nyou just weren’t ready yet.\n5.3 Preparing for audit day\nOnce you feel you’re ready to be visited by the auditor for either the Stage One or Stage\nTwo, there are sensible preparations to take to make the best impression from the start.\nFirstly, make sure that the visit is confirmed, provide directions and check the time of arrival\nof the auditor(s). If appropriate, inform reception that they will be coming, get an identity\nbadge prepared and reserve a parking space. Book a room for the auditor’s use (more if\nthere is a team) and ensure that refreshments will be available, including lunch if possible.\nYou will be needing to show documents and discuss them, so some form', 'doc_ID': 961, 'relevance_score': 0.9802809})]","To feel more confident before an external audit, it would be advisable to conduct a pre-audit shortly beforehand. This pre-audit can be considered as an internal audit carried out in accordance with the requirements of ISO 27001. It is important that a stress test is conducted during this trial run, where the audit subjects and the exact date are not communicated, thus surprising all employees. A favorable time for the pre-audit is about 4 weeks before the official audit, to allow time for any identified deficiencies to be addressed. It is also important to create an audit report listing all identified deficiencies. It is not a problem to identify shortcomings if appropriate measures are derived from them.","To increase confidence before an external audit for ISO 27001 certification, focus on three main areas: documentation, practical implementation, and employee adoption. Ensure that all necessary documentation is in place, including policies, procedures, risk assessments, and controls. Conduct internal audits to identify and address any gaps in your Information Security Management System (ISMS). Practically implement your ISMS by demonstrating its use in daily operations. This can be shown through signs of information security-related activity, such as performance charts or posters. Lastly, ensure that your employees are aware of and follow the processes. Communicate the importance of ISO 27001 standards and their role in maintaining information security. Consider conducting a mock audit to identify any improvements needed before the actual audit day.",True,0.3388429752066116,0.1,0.18181818181818182,0.48939841985702515,0.8783430904150009,0.9998853206634521,0.6633003533707296,0,0,2.4108715057373047,2.5659046173095703,0.3950004577636719,4.976776123046875
Fine-tuned_finetuned-ISO-27001_1024_l2_All_1536_264_False,Hybrid_Rerank_Cohere,4,mixtral-8x7B-v0.1,16000,0,1,How is the process of an ISO 27001 audit determined in the planning phase and what steps are involved?,"[Document(page_content='audit is not required by law or regulation. however, it is a good\npractice for all organisations to conduct regular internal audits of their\ninformation security and other management systems.\nin order to comply with iso 27001, all companies must conduct internal audits,\nno matter their country or industry.\n## how to plan and conduct an iso 27001 internal audit\nto plan and conduct an iso 27001 internal audit, organisations should follow\nthe following steps:\n 1. **define the scope of the audit:** the first step is to define the scope of the audit. this includes identifying the isms processes and controls that will be audited. 2. **develop an audit plan:** the next step is to develop an audit plan. this plan should identify the audit objectives, the audit methodology, and the audit resources required. 3. **conduct the audit:** the audit should be conducted in accordance with the audit plan. this involves interviewing staff, reviewing documentation, and observing processes. 4. **document the audit findings:** the audit findings should be documented in a report. this report should include the audit objectives, the audit methodology, the audit findings, and any recommendations for improvement. 5. **follow up on the audit findings:** the organisation should follow up on the audit findings and implement any necessary corrective actions.\n## what to look for during an iso 27001 internal audit\nduring an iso 27001 internal audit, the auditor will look for evidence that\nthe isms is', metadata={'description': 'Ensure your ISMS is operating effectively for ISO 27001 compliance. Learn all you need to know about ISO 27001 Clause 9.2 internal audits in our guide.\n', 'doc_ID': 423, 'language': 'en-gb', 'original_text': 'audit is not required by law or regulation. However, it is a good\npractice for all organisations to conduct regular internal audits of their\ninformation security and other management systems.\nIn order to comply with ISO 27001, all companies must conduct internal audits,\nno matter their country or industry.\n## How to plan and conduct an ISO 27001 internal audit\nTo plan and conduct an ISO 27001 internal audit, organisations should follow\nthe following steps:\n 1. **Define the scope of the audit:** The first step is to define the scope of the audit. This includes identifying the ISMS processes and controls that will be audited. 2. **Develop an audit plan:** The next step is to develop an audit plan. This plan should identify the audit objectives, the audit methodology, and the audit resources required. 3. **Conduct the audit:** The audit should be conducted in accordance with the audit plan. This involves interviewing staff, reviewing documentation, and observing processes. 4. **Document the audit findings:** The audit findings should be documented in a report. This report should include the audit objectives, the audit methodology, the audit findings, and any recommendations for improvement. 5. **Follow up on the audit findings:** The organisation should follow up on the audit findings and implement any necessary corrective actions.\n## What to look for during an ISO 27001 internal audit\nDuring an ISO 27001 internal audit, the auditor will look for evidence that\nthe ISMS is', 'source': 'https://www.dataguard.co.uk/knowledge/iso-27001/clause-9-2-internal-audit/', 'title': 'ISO 27001 Clause 9.2: Internal Audit', 'relevance_score': 0.98813087}), Document(page_content='defines the boundaries\nof your organization’s isms, what elements of your\nisms are reviewed for certification, and which\ncontrols are relevant to the scope of your project.\nled\ncc\ncc]\nplanning\nthis section helps organizations to create objectives\nbased on risks and opportunities. organizations use\nthis information to establish a plan to maintain a\nrisk-based approach to isms management and\ndetermine how they will monitor and measure\ntheir objectives.\nperformance evaluation\nthis section guides organizations to define\nprocedures for measuring, monitoring, and main-\ntaining isms records. it also includes information\non establishing an internal audit schedule and\nmanagement reviews to address remediation\nactions for issues discovered during audits.\nimprovement\nhelps organizations create a process for recording\nand managing recommendations for improvement\nand non-conformities discovered during audits.\nthe initial certification process for iso 27001 certificate eligibility comprises two stages: a documentation\nreview audit and an evidential audit. the clauses detailed in part 1 of the iso 27001 structure help organizations\nprepare written documentation, processes, procedures, and guidelines that explain your isms implementation\nand the business processes that support it.\nthese documents are then reviewed by an approved, objective auditor during the stage 1 documentation\nreview. during this first stage, the auditor ensures that a company’s documentation aligns with iso 27001\nstandards and may recommend them', metadata={'doc_ID': 1340, 'original_text': 'defines the boundaries\nof your organization’s ISMS, what elements of your\nISMS are reviewed for certification, and which\ncontrols are relevant to the scope of your project.\nLed\nCc\nCc]\nPlanning\nThis section helps organizations to create objectives\nbased on risks and opportunities. Organizations use\nthis information to establish a plan to maintain a\nrisk-based approach to ISMS management and\ndetermine how they will monitor and measure\ntheir objectives.\nPerformance Evaluation\nThis section guides organizations to define\nprocedures for measuring, monitoring, and main-\ntaining ISMS records. It also includes information\non establishing an internal audit schedule and\nmanagement reviews to address remediation\nactions for issues discovered during audits.\nImprovement\nHelps organizations create a process for recording\nand managing recommendations for improvement\nand non-conformities discovered during audits.\nThe initial certification process for ISO 27001 certificate eligibility comprises two stages: a documentation\nreview audit and an evidential audit. The clauses detailed in part 1 of the ISO 27001 structure help organizations\nprepare written documentation, processes, procedures, and guidelines that explain your ISMS implementation\nand the business processes that support it.\nThese documents are then reviewed by an approved, objective auditor during the Stage 1 Documentation\nReview. During this first stage, the auditor ensures that a company’s documentation aligns with ISO 27001\nstandards and may recommend them', 'source': 'complete-guide-iso-27001-compliance.pdf', 'title': 'complete-guide-iso-27001-compliance', 'relevance_score': 0.98667485}), Document(page_content=""in the iso/iec 27001 standard. the certification body will take the time to gain a sufficient understanding of the isms design in the context of your organization, risk assessment and treatment (including the controls determined), information security policy and objectives. a large emphasis will also be put on your company's preparedness for the audit. this allows planning for stage 2. * **stage 2 audit:** based on documented findings in stage 1's audit report, the certification body will develop an audit plan to conduct stage 2 of the audit. in addition to evaluating the effective implementation of the isms, the aim of stage 2 is to confirm that your company adheres to its own policies, objectives and procedures.\nto do this, the audit will focus on:\n * top management leadership and commitment to information security policy and the information security objectives\n * documentation requirements listed in iso/iec 27001\n * assessment of information security-related risks and that the assessments produce consistent, valid and comparable results if repeated\n * determination of control objectives and controls based on the information security risk assessment risk treatment processes\n * information security performance and the effectiveness of the isms, evaluating against the information security objectives\n * correspondence between the determined controls, the statement of applicability and the results of the information security risk assessment and risk treatment process and the information security"", metadata={'description': 'No matter if you’re an SMB or an international corporation — getting an ISO 27001 certification should be on your agenda. Here’s the ultimate guide on how.', 'doc_ID': 140, 'language': 'en-gb', 'original_text': ""in the ISO/IEC 27001 standard. The certification body will take the time to gain a sufficient understanding of the ISMS design in the context of your organization, risk assessment and treatment (including the controls determined), information security policy and objectives. A large emphasis will also be put on your company's preparedness for the audit. This allows planning for stage 2. * **Stage 2 Audit:** Based on documented findings in stage 1's audit report, the certification body will develop an audit plan to conduct stage 2 of the audit. In addition to evaluating the effective implementation of the ISMS, the aim of stage 2 is to confirm that your company adheres to its own policies, objectives and procedures.\nTo do this, the audit will focus on:\n * Top management leadership and commitment to information security policy and the information security objectives\n * Documentation requirements listed in ISO/IEC 27001\n * Assessment of information security-related risks and that the assessments produce consistent, valid and comparable results if repeated\n * Determination of control objectives and controls based on the information security risk assessment Risk treatment processes\n * Information security performance and the effectiveness of the ISMS, evaluating against the information security objectives\n * Correspondence between the determined controls, the Statement of Applicability and the results of the information security risk assessment and risk treatment process and the information security"", 'source': 'https://www.dataguard.co.uk/knowledge/iso-27001-certification/', 'title': 'ISO 27001 Certification: Your ultimate guide [free guide available]', 'relevance_score': 0.98109454}), Document(page_content='when you go on vacation, you plan the travel, and then plan for\nthe stay. why do we plan in this manner? the answer is to avoid any risk during your\nvacation or trip.\nsimilarly, when you audit your organization, planning is a must. before initializing\nthe internal audit, the organization must develop an audit plan that defines the audit’s\nobjectives, scope, and criteria. the following key items cover what you should take care\nof when planning for an iso 27001 internal audit:\n224\n1.\nnote\nchapter 7 — internal audit\nobjective and scope of audit plan: the client should define the\nobjectives and scope of the audit. here are some examples of good\nobjectives:\ne toassess the implementation and effectiveness of the iso 27001\ncontrols.\ne to assess compliance with the applicable laws and regulations.\ne to assess compliance with internal policies and procedures.\nsimilarly, the scope should also be covered in the audit plan. for\nexample; the scope of work for internal audit can be:\ne toreview the policies and procedures of the organization.\ne toreview the means of safeguarding assets of the organization.\ne toreview the laws and regulations that impact the business.\nthe scope of the audit should include a description of the physical\nlocation of the organization, units, support functions, and any\nexclusions.\naudit schedule: once the scope of the audit is clear, the next\nthing to do is to prepare the audit schedule. the audit schedule\nwill cover all the projects/departments that will be audited as\npart of the new', metadata={'source': 'Chopra, Chaudhary - 2020 - Implementing an Information Security Management System - Security Management Based On ISO 27001.pdf', 'title': 'Chopra, Chaudhary - 2020 - Implementing an Information Security Management System - Security Management Based On ISO 27001', 'original_text': 'when you go on vacation, you plan the travel, and then plan for\nthe stay. Why do we plan in this manner? The answer is to avoid any risk during your\nvacation or trip.\nSimilarly, when you audit your organization, planning is a must. Before initializing\nthe internal audit, the organization must develop an audit plan that defines the audit’s\nobjectives, scope, and criteria. The following key items cover what you should take care\nof when planning for an ISO 27001 internal audit:\n224\n1.\nNote\nCHAPTER 7 — INTERNAL AUDIT\nObjective and scope of audit plan: The client should define the\nobjectives and scope of the audit. Here are some examples of good\nobjectives:\ne Toassess the implementation and effectiveness of the ISO 27001\ncontrols.\ne To assess compliance with the applicable laws and regulations.\ne To assess compliance with internal policies and procedures.\nSimilarly, the scope should also be covered in the audit plan. For\nexample; the scope of work for internal audit can be:\ne Toreview the policies and procedures of the organization.\ne Toreview the means of safeguarding assets of the organization.\ne Toreview the laws and regulations that impact the business.\nThe scope of the audit should include a description of the physical\nlocation of the organization, units, support functions, and any\nexclusions.\nAudit schedule: Once the scope of the audit is clear, the next\nthing to do is to prepare the audit schedule. The audit schedule\nwill cover all the projects/departments that will be audited as\npart of the new', 'doc_ID': 1283, 'relevance_score': 0.9788344})]","The process of an audit in the planning phase is determined in a joint meeting of the parties involved. The audit subject, objective, and procedure, as well as the necessary personnel, are discussed and consensus is reached. Prior to the actual audit, auditors can create checklists to serve as a guide for the process. During the planning phase, there are technical discussions where the organization presents any changes compared to the previous audit, and the auditors ask questions and express any correction requests.","The process of planning an ISO 27001 audit involves defining the scope of the audit, developing an audit plan, conducting the audit, documenting the audit findings, and following up on the audit findings. In the planning phase, the first step is to define the scope of the audit, which includes identifying the ISMS processes and controls that will be audited. The next step is to develop an audit plan, which should identify the audit objectives, methodology, and resources required. The audit should be conducted in accordance with the audit plan, which involves interviewing staff, reviewing documentation, and observing processes. The audit findings should be documented in a report, which should include the audit objectives, methodology, findings, and any recommendations for improvement. The organization should follow up on the audit findings and implement any necessary corrective actions. During the audit, the auditor will look for evidence that the ISMS is defined, implemented, and maintained in accordance with the ISO 27001 standard. This includes reviewing the organization's information security policy, risk assessment and treatment, and the effectiveness of the controls implemented. The planning phase is crucial to ensure that the audit is conducted efficiently and effectively, and that it provides a comprehensive assessment of the organization's",True,0.3252595155709343,0.11149825783972124,0.22145328719723179,0.44238942861557007,0.8084283173084259,0.9999035596847534,0.726802532506339,0,0,2.509530544281006,3.486639976501465,0.23419785499572754,5.996170520782471
Fine-tuned_finetuned-ISO-27001_1024_l2_All_1536_264_False,Hybrid_Rerank_Cohere,4,mixtral-8x7B-v0.1,16000,0,1,What should be considered during on-site visits as part of an ISO 27001 audit?,"[Document(page_content='auditor should be prepared.\nthere is no substitute for practice so conduct a mock audit beforehand if you can and\nidentify any improvements needed before the day. having obvious signs of information\nsecurity-related activity on display at your location does no harm; this could be performance\ncharts or posters for raising awareness on the walls.\nit’s all about showing the auditor that you are a professional organization that is in control;\nyou may be surprised how little the auditor feels they need to look at if the overall\nimpression they are getting is very positive.\n5.4 during the audit\nthe auditor should have provided an audit plan which will set out the structure of the audit,\nincluding areas to be reviewed, people to be met and timings (this often doesn’t happen so\n page 76 of 79\niso/iec 27001 implementation guide\ndon’t worry if you don’t get one). despite the appearance of power, auditing is quite strictly\nregulated so the auditor will have specific things they need to do, in a specific format,\nstarting with an opening meeting and ending with a closing meeting. do what you can to\nmake it easy for them by providing access to the relevant documents and resources as\nquickly and smoothly as possible.\nbasically, all the auditor is doing is the same exercise as you did yourself when you\nperformed (and repeated) the gap assessment. it’s purely a matter of going through the\nrequirements of the iso/iec 27001 standard and asking to be shown how you meet them.\nthe auditor will need to record the evidence', metadata={'doc_ID': 963, 'original_text': 'auditor should be prepared.\nThere is no substitute for practice so conduct a mock audit beforehand if you can and\nidentify any improvements needed before the day. Having obvious signs of information\nsecurity-related activity on display at your location does no harm; this could be performance\ncharts or posters for raising awareness on the walls.\nIt’s all about showing the auditor that you are a professional organization that is in control;\nyou may be surprised how little the auditor feels they need to look at if the overall\nimpression they are getting is very positive.\n5.4 During the audit\nThe auditor should have provided an audit plan which will set out the structure of the audit,\nincluding areas to be reviewed, people to be met and timings (this often doesn’t happen so\n Page 76 of 79\nISO/IEC 27001 Implementation Guide\ndon’t worry if you don’t get one). Despite the appearance of power, auditing is quite strictly\nregulated so the auditor will have specific things they need to do, in a specific format,\nstarting with an opening meeting and ending with a closing meeting. Do what you can to\nmake it easy for them by providing access to the relevant documents and resources as\nquickly and smoothly as possible.\nBasically, all the auditor is doing is the same exercise as you did yourself when you\nperformed (and repeated) the gap assessment. It’s purely a matter of going through the\nrequirements of the ISO/IEC 27001 standard and asking to be shown how you meet them.\nThe auditor will need to record the evidence', 'source': 'CERTIKIT_ISO27001_Implementation_Guide_v12.pdf.pdf', 'title': 'CERTIKIT_ISO27001_Implementation_Guide_v12.pdf', 'relevance_score': 0.9781772}), Document(page_content='consideration of what evidence — measures of\neffectiveness — will be required “to provide information on\nwhether the information security management system is\n152\n14: risk treatment and the selection of controls\neffectively implemented and maintained”** and that each\nrisk has been reduced to an acceptable level. in other words,\ncontrols must be constructed in such a manner that any error,\nor failure during their execution, can be promptly detected\nand that planned corrective action, whether automated or\nmanual, is effective in reducing the risk of whatever may\nhappen next to an acceptable level.\nannex a of iso 27001 has 14 major categories of control,\neach of which has a number of subsections. there are 114\nsub-clauses, each of which has a four-character alpha-\nnumeric clause number. each of these is a control under iso\n27001 and each needs to be considered and a decision made\nas to whether or not it is applicable. the outcome of that\ndecision is recorded in the soa, which is described in the\nnext chapter.\nthe application of a control should reduce the risk it is\ndesigned to address. it will not always reduce that risk below\nthe acceptable risk level. in this case, additional controls\nmust be selected and applied until the cumulative effect of\nthe controls is to reduce the identified risk below that\nacceptable risk threshold. the principle of not investing\nmore on controlling a risk continues to apply as the size of\nthe risk is reduced by the application of successive controls.\nit is, in other words,', metadata={'source': 'Calder - 2019 - Information Security Risk Management for ISO 27001.pdf', 'title': 'Calder - 2019 - Information Security Risk Management for ISO 27001', 'original_text': 'consideration of what evidence — measures of\neffectiveness — will be required “to provide information on\nwhether the information security management system is\n152\n14: Risk treatment and the selection of controls\neffectively implemented and maintained”** and that each\nrisk has been reduced to an acceptable level. In other words,\ncontrols must be constructed in such a manner that any error,\nor failure during their execution, can be promptly detected\nand that planned corrective action, whether automated or\nmanual, is effective in reducing the risk of whatever may\nhappen next to an acceptable level.\nAnnex A of ISO 27001 has 14 major categories of control,\neach of which has a number of subsections. There are 114\nsub-clauses, each of which has a four-character alpha-\nnumeric clause number. Each of these is a control under ISO\n27001 and each needs to be considered and a decision made\nas to whether or not it is applicable. The outcome of that\ndecision is recorded in the SoA, which is described in the\nnext chapter.\nThe application of a control should reduce the risk it is\ndesigned to address. It will not always reduce that risk below\nthe acceptable risk level. In this case, additional controls\nmust be selected and applied until the cumulative effect of\nthe controls is to reduce the identified risk below that\nacceptable risk threshold. The principle of not investing\nmore on controlling a risk continues to apply as the size of\nthe risk is reduced by the application of successive controls.\nIt is, in other words,', 'doc_ID': 818, 'relevance_score': 0.97324073}), Document(page_content='tool and the certification readiness checklist within the toolkit as a guide to\nyour readiness, but don’t expect to be 100% compliant before going for stage one. a more\nappropriate figure is probably 90% or so but it does depend on which areas are not yet\ncomplete.\nbefore arranging the stage one you should have completed the following:\ne information security policy\ne risk assessment and treatment plan\ne implemented most (but not necessarily all) of your information security controls\ne conducted user awareness training\ne internal audits of all areas of the standard\n page 75 of 79\niso/iec 27001 implementation guide\ne atleast one management review (ideally more)\nnot having any of the above available would probably mean that the stage one visit is\ninconclusive in terms of judging your readiness for the stage two i.e. the auditor would tell\nyou just weren’t ready yet.\n5.3 preparing for audit day\nonce you feel you’re ready to be visited by the auditor for either the stage one or stage\ntwo, there are sensible preparations to take to make the best impression from the start.\nfirstly, make sure that the visit is confirmed, provide directions and check the time of arrival\nof the auditor(s). if appropriate, inform reception that they will be coming, get an identity\nbadge prepared and reserve a parking space. book a room for the auditor’s use (more if\nthere is a team) and ensure that refreshments will be available, including lunch if possible.\nyou will be needing to show documents and discuss them, so some form', metadata={'doc_ID': 961, 'original_text': 'Tool and the Certification Readiness Checklist within the Toolkit as a guide to\nyour readiness, but don’t expect to be 100% compliant before going for Stage One. A more\nappropriate figure is probably 90% or so but it does depend on which areas are not yet\ncomplete.\nBefore arranging the Stage One you should have completed the following:\ne Information security policy\ne Risk assessment and treatment plan\ne Implemented most (but not necessarily all) of your information security controls\ne Conducted user awareness training\ne Internal audits of all areas of the standard\n Page 75 of 79\nISO/IEC 27001 Implementation Guide\ne Atleast one management review (ideally more)\nNot having any of the above available would probably mean that the Stage One visit is\ninconclusive in terms of judging your readiness for the Stage Two i.e. the auditor would tell\nyou just weren’t ready yet.\n5.3 Preparing for audit day\nOnce you feel you’re ready to be visited by the auditor for either the Stage One or Stage\nTwo, there are sensible preparations to take to make the best impression from the start.\nFirstly, make sure that the visit is confirmed, provide directions and check the time of arrival\nof the auditor(s). If appropriate, inform reception that they will be coming, get an identity\nbadge prepared and reserve a parking space. Book a room for the auditor’s use (more if\nthere is a team) and ensure that refreshments will be available, including lunch if possible.\nYou will be needing to show documents and discuss them, so some form', 'source': 'CERTIKIT_ISO27001_Implementation_Guide_v12.pdf.pdf', 'title': 'CERTIKIT_ISO27001_Implementation_Guide_v12.pdf', 'relevance_score': 0.956796}), Document(page_content='findings:** the organisation should follow up on the audit findings and implement any necessary corrective actions.\n## what to look for during an iso 27001 internal audit\nduring an iso 27001 internal audit, the auditor will look for evidence that\nthe isms is conforming to the requirements of iso 27001 and that it is\noperating effectively. the auditor will focus on the following areas and\nevidence that supports them:\n * risk assessment: the auditor will assess whether the organisation has conducted a thorough risk assessment and whether the identified risks have been appropriately addressed. * information security controls: the auditor will assess whether the organisation has implemented and is maintaining appropriate information security controls to mitigate the identified risks. * isms documentation: the auditor will assess whether the isms is adequately documented. you can find a list of the required documentation for the iso 27001 certification here. * awareness and training: the auditor will assess whether staff are aware of their information security responsibilities and have received appropriate training. * management review: the auditor will assess whether the organisation conducts regular management reviews of the isms.\n## how to report on the findings of an iso 27001 internal audit\nthe audit findings should be documented in a report. this report should\ninclude the following:\n * audit objectives: the audit objectives should be clearly stated in the report.', metadata={'description': 'Ensure your ISMS is operating effectively for ISO 27001 compliance. Learn all you need to know about ISO 27001 Clause 9.2 internal audits in our guide.\n', 'doc_ID': 424, 'language': 'en-gb', 'original_text': 'findings:** The organisation should follow up on the audit findings and implement any necessary corrective actions.\n## What to look for during an ISO 27001 internal audit\nDuring an ISO 27001 internal audit, the auditor will look for evidence that\nthe ISMS is conforming to the requirements of ISO 27001 and that it is\noperating effectively. The auditor will focus on the following areas and\nevidence that supports them:\n * Risk assessment: The auditor will assess whether the organisation has conducted a thorough risk assessment and whether the identified risks have been appropriately addressed. * Information security controls: The auditor will assess whether the organisation has implemented and is maintaining appropriate information security controls to mitigate the identified risks. * ISMS documentation: The auditor will assess whether the ISMS is adequately documented. You can find a list of the required documentation for the ISO 27001 certification here. * Awareness and training: The auditor will assess whether staff are aware of their information security responsibilities and have received appropriate training. * Management review: The auditor will assess whether the organisation conducts regular management reviews of the ISMS.\n## How to report on the findings of an ISO 27001 internal audit\nThe audit findings should be documented in a report. This report should\ninclude the following:\n * Audit objectives: The audit objectives should be clearly stated in the report.', 'source': 'https://www.dataguard.co.uk/knowledge/iso-27001/clause-9-2-internal-audit/', 'title': 'ISO 27001 Clause 9.2: Internal Audit', 'relevance_score': 0.95301336})]","During on-site visits as part of an ISO 27001 audit, several things need to be considered. The auditors will want to inspect specific premises, workstations, processes, or IT systems to conduct a comparison between documentation and practice. It is important to plan the route through the premises in advance and only show the relevant areas to minimize potential attack surfaces. If the ISMS is distributed across multiple locations, travel between the sites may be required. The results of the on-site visits will be documented in an audit report and communicated to the organization. Corrective and preventive actions can be agreed upon to address identified issues. In case of significant deviations, a re-audit on-site may be conducted.","During an on-site visit as part of an ISO 27001 audit, the auditor will focus on several key areas, including the risk assessment, information security controls, ISMS documentation, staff awareness and training, and management reviews. The auditor will look for evidence that the organization has conducted a thorough risk assessment and that identified risks have been appropriately addressed through the implementation and maintenance of appropriate information security controls. 

The ISMS should be adequately documented, and staff should be aware of their information security responsibilities and have received appropriate training. The organization should also conduct regular management reviews of the ISMS. 

It's important to make it easy for the auditor by providing access to relevant documents and resources as quickly and smoothly as possible. The auditor will record the evidence to provide information on whether the information security management system is effectively implemented and maintained. Any findings should be documented in a report, including the audit objectives and a description of any necessary corrective actions. 

It's also important to note that before arranging the Stage One of the audit, the organization should have completed several key tasks, such as implementing most information security controls, conducting user awareness training, and internal audits of all areas of the standard.",True,0.3890577507598784,0.12232415902140674,0.23708206686930092,0.5081246495246887,0.5347402170300484,0.9973902106285095,0.7512195082387346,0,0,2.4841971397399902,5.674464464187622,0.22995662689208984,8.158661603927612
Fine-tuned_finetuned-ISO-27001_1024_l2_All_1536_264_False,Hybrid_Rerank_Cohere,4,mixtral-8x7B-v0.1,16000,0,1,What are typical deficits within the security policy and organization that can arise during an ISO 27001 audit?,"[Document(page_content='of these issues.\nsteve also warns against these things when preparing for iso 27001:\nimproperly defining the isms scope\ninadequate employee security training\nimproperly performed risk assessments\nmetrics and implementation plans for info sec don’t align with company objectives\nimproper record keeping—iso is really big on having evidence\ninadequate access controls and access management—especially in devops how do i know my organization is ready for an iso 27001 audit?\nif you’re in a mature organization with several infosec controls, it could merely be putting those policies into place. for those starting from scratch, it could be a heavier lift. once you have everything in place (internal audit, pre-certification readiness assessment), steve recommends conducting a management review to make sure upper management is aware of the entire isms. these reviews go over every single part of the isms—including policies, metrics, operations, and any deficiencies in the internal audit.\nbefore undergoing an audit, steve suggests you have:\nall the basic documentation in place, including running the system for a period of three to six months.\na trained team that promotes a cyber aware culture.\nrisk assessment and risk treatment plans in place.\na connection with your certification body—they can offer specific advice as to what you need to do to get ready and what you should be on the lookout for.\nat least 75% passing tests and controls in your compliance automation system.\n“you’ll know if you’re ready. do', metadata={'description': 'Achieving ISO 27001 can come with a lot of questions. Lead Auditor at ARORA Solutions, Steve Cullen, breaks down how to set your organization up for a successful ISO 27001 audit.', 'doc_ID': 91, 'language': 'en', 'original_text': 'of these issues.\nSteve also warns against these things when preparing for ISO 27001:\nImproperly defining the ISMS scope\nInadequate employee security training\nImproperly performed risk assessments\nMetrics and implementation plans for info sec don’t align with company objectives\nImproper record keeping—ISO is really big on having evidence\nInadequate access controls and access management—especially in DevOps How Do I Know My Organization is Ready for an ISO 27001 Audit?\nIf you’re in a mature organization with several infosec controls, it could merely be putting those policies into place. For those starting from scratch, it could be a heavier lift. Once you have everything in place (internal audit, pre-certification readiness assessment), Steve recommends conducting a management review to make sure upper management is aware of the entire ISMS. These reviews go over every single part of the ISMS—including policies, metrics, operations, and any deficiencies in the internal audit.\nBefore undergoing an audit, Steve suggests you have:\nAll the basic documentation in place, including running the system for a period of three to six months.\nA trained team that promotes a cyber aware culture.\nRisk assessment and risk treatment plans in place.\nA connection with your certification body—they can offer specific advice as to what you need to do to get ready and what you should be on the lookout for.\nAt least 75% passing tests and controls in your compliance automation system.\n“You’ll know if you’re ready. Do', 'source': 'https://www.drata.com/blog/ask-an-auditor-demystifying-iso-27001', 'title': 'Ask an Auditor: Demystifying the ISO 27001 Certification Process With Steve Cullen From ARORA Solutions', 'relevance_score': 0.98469365}), Document(page_content='access control policy.\n144\nchapter 6 execution\nfor external audit: an external auditor conducting the iso 27001 certification audit\nwill check the access control policy in order to verify how the organization has defined\nand communicated the policy to all stakeholders.\na.9.1.2 access to networks and network services (iso 27001 control)\nusers should only be provided access to the network and network services that they have\nbeen specifically authorized to use.\nexplanation/what is required: the requirement is the same as the objective says,\norganizations must ensure only authorized users/employees are provided access to\norganization network and network services. any unauthorized use can pose a threat to\nthe organization’s information.\nthe network policy should cover the following:\ne information on networks that is accessible\ne how the users/employees would be authenticated for permissions\n¢ mode of using the network i.e. wireless, lan, vpn, etc.\ne hownetwork will be monitored to safeguard information\nevidence that can be prepared: access control policy, network control policy,\nnetwork diagram, and network monitoring logs\nwho prepares it: the it helpdesk team along with the information security team\nwould prepare the evidence.\nfor external audit: an external auditor conducting the iso 27001 certification\naudit will check the evidence in order to verify how the organization has defined and\nimplemented network policy, measures taken to protect network and network services.\na.9.2 user access', metadata={'doc_ID': 1167, 'original_text': 'access control policy.\n144\nCHAPTER 6 EXECUTION\nFor external audit: An external auditor conducting the ISO 27001 certification audit\nwill check the access control policy in order to verify how the organization has defined\nand communicated the policy to all stakeholders.\nA.9.1.2 Access to Networks and Network Services (ISO 27001 Control)\nUsers should only be provided access to the network and network services that they have\nbeen specifically authorized to use.\nExplanation/what is required: The requirement is the same as the objective says,\norganizations must ensure only authorized users/employees are provided access to\norganization network and network services. Any unauthorized use can pose a threat to\nthe organization’s information.\nThe network policy should cover the following:\ne Information on networks that is accessible\ne How the users/employees would be authenticated for permissions\n¢ Mode of using the network i.e. wireless, LAN, VPN, etc.\ne Hownetwork will be monitored to safeguard information\nEvidence that can be prepared: Access control policy, network control policy,\nnetwork diagram, and network monitoring logs\nWho prepares it: The IT Helpdesk team along with the information security team\nwould prepare the evidence.\nFor external audit: An external auditor conducting the ISO 27001 certification\naudit will check the evidence in order to verify how the organization has defined and\nimplemented network policy, measures taken to protect network and network services.\nA.9.2 User Access', 'source': 'Chopra, Chaudhary - 2020 - Implementing an Information Security Management System - Security Management Based On ISO 27001.pdf', 'title': 'Chopra, Chaudhary - 2020 - Implementing an Information Security Management System - Security Management Based On ISO 27001', 'relevance_score': 0.88363826}), Document(page_content='findings:** the organisation should follow up on the audit findings and implement any necessary corrective actions.\n## what to look for during an iso 27001 internal audit\nduring an iso 27001 internal audit, the auditor will look for evidence that\nthe isms is conforming to the requirements of iso 27001 and that it is\noperating effectively. the auditor will focus on the following areas and\nevidence that supports them:\n * risk assessment: the auditor will assess whether the organisation has conducted a thorough risk assessment and whether the identified risks have been appropriately addressed. * information security controls: the auditor will assess whether the organisation has implemented and is maintaining appropriate information security controls to mitigate the identified risks. * isms documentation: the auditor will assess whether the isms is adequately documented. you can find a list of the required documentation for the iso 27001 certification here. * awareness and training: the auditor will assess whether staff are aware of their information security responsibilities and have received appropriate training. * management review: the auditor will assess whether the organisation conducts regular management reviews of the isms.\n## how to report on the findings of an iso 27001 internal audit\nthe audit findings should be documented in a report. this report should\ninclude the following:\n * audit objectives: the audit objectives should be clearly stated in the report.', metadata={'source': 'https://www.dataguard.co.uk/knowledge/iso-27001/clause-9-2-internal-audit/', 'title': 'ISO 27001 Clause 9.2: Internal Audit', 'description': 'Ensure your ISMS is operating effectively for ISO 27001 compliance. Learn all you need to know about ISO 27001 Clause 9.2 internal audits in our guide.\n', 'language': 'en-gb', 'original_text': 'findings:** The organisation should follow up on the audit findings and implement any necessary corrective actions.\n## What to look for during an ISO 27001 internal audit\nDuring an ISO 27001 internal audit, the auditor will look for evidence that\nthe ISMS is conforming to the requirements of ISO 27001 and that it is\noperating effectively. The auditor will focus on the following areas and\nevidence that supports them:\n * Risk assessment: The auditor will assess whether the organisation has conducted a thorough risk assessment and whether the identified risks have been appropriately addressed. * Information security controls: The auditor will assess whether the organisation has implemented and is maintaining appropriate information security controls to mitigate the identified risks. * ISMS documentation: The auditor will assess whether the ISMS is adequately documented. You can find a list of the required documentation for the ISO 27001 certification here. * Awareness and training: The auditor will assess whether staff are aware of their information security responsibilities and have received appropriate training. * Management review: The auditor will assess whether the organisation conducts regular management reviews of the ISMS.\n## How to report on the findings of an ISO 27001 internal audit\nThe audit findings should be documented in a report. This report should\ninclude the following:\n * Audit objectives: The audit objectives should be clearly stated in the report.', 'doc_ID': 424, 'relevance_score': 0.87652874}), Document(page_content='how do you begin your journey for iso 27001?\ninitiating the project usually involves a few steps. before conducting a readiness assessment or an internal audit, getting management buy-in for the project will be at the top of your list. steve recommends clearly defining the benefits of iso 27001, including ways strong cyber and information security can strengthen the brand, increase client trust, and save the organization millions of dollars by preventing data breaches.\nonce management signs off, it’s always best to perform a readiness assessment or an internal audit to see which areas of your organization need improvement.\nwhat is the biggest mistake companies make when preparing for iso 27001?\nnot conducting a readiness assessment or internal audit beforehand can bring up a lot of problems down the road. steve points out that it’s common for businesses to move forward with a project without actually assessing their implementation or usage of the controls they’ve put in place. certification bodies want to see companies that fully understand and apply the measures they’ve set, so it’s important to keep your employees educated and accountable. it’s also wise to conduct a gap assessment once you’ve started to put controls in place to catch any of these issues.\nsteve also warns against these things when preparing for iso 27001:\nimproperly defining the isms scope\ninadequate employee security training\nimproperly performed risk assessments\nmetrics and implementation plans for info sec don’t align with', metadata={'description': 'Achieving ISO 27001 can come with a lot of questions. Lead Auditor at ARORA Solutions, Steve Cullen, breaks down how to set your organization up for a successful ISO 27001 audit.', 'doc_ID': 90, 'language': 'en', 'original_text': 'How Do You Begin Your Journey for ISO 27001?\nInitiating the project usually involves a few steps. Before conducting a readiness assessment or an internal audit, getting management buy-in for the project will be at the top of your list. Steve recommends clearly defining the benefits of ISO 27001, including ways strong cyber and information security can strengthen the brand, increase client trust, and save the organization millions of dollars by preventing data breaches.\nOnce management signs off, it’s always best to perform a readiness assessment or an internal audit to see which areas of your organization need improvement.\nWhat is the Biggest Mistake Companies Make When Preparing for ISO 27001?\nNot conducting a readiness assessment or internal audit beforehand can bring up a lot of problems down the road. Steve points out that it’s common for businesses to move forward with a project without actually assessing their implementation or usage of the controls they’ve put in place. Certification bodies want to see companies that fully understand and apply the measures they’ve set, so it’s important to keep your employees educated and accountable. It’s also wise to conduct a gap assessment once you’ve started to put controls in place to catch any of these issues.\nSteve also warns against these things when preparing for ISO 27001:\nImproperly defining the ISMS scope\nInadequate employee security training\nImproperly performed risk assessments\nMetrics and implementation plans for info sec don’t align with', 'source': 'https://www.drata.com/blog/ask-an-auditor-demystifying-iso-27001', 'title': 'Ask an Auditor: Demystifying the ISO 27001 Certification Process With Steve Cullen From ARORA Solutions', 'relevance_score': 0.84619683})]","Typical deficiencies within the security policy and organization that can occur during an audit are:

1. Lack of involvement from management: No security policies are commissioned or not enforced through signatures. There is no approved resource plan for information security, and there is no official security organization. Additionally, no reporting system has been installed.
2. Lack of participation from organization departments: There is no interest in participation, lack of transparency in business processes, and no contributions to security planning. The level of implementation of measures is unknown, and there is no information flow within the organization.
3. Insufficiently informed and motivated employees: They are not familiar with the guidelines, no training is planned, and they are unaware of their security responsibilities. Furthermore, relevant documents are not available at the workplace.
4. Overloaded security management with conflicting tasks. It functions only as a figurehead.","Based on the provided context, there are several deficits within the security policy and organization that can arise during an ISO 27001 audit. These include improperly defining the scope of the Information Security Management System (ISMS), inadequate employee security training, improperly performed risk assessments, misalignment of information security metrics and implementation plans with company objectives, and improper record keeping. 

Moreover, deficiencies in access controls and access management, especially in DevOps, can also be a significant issue. The access control policy should clearly define and communicate to all stakeholders who has access to the organization's network and network services. 

During an ISO 27001 internal audit, the auditor will look for evidence that the ISMS is conforming to the requirements of ISO 27001 and that it is operating effectively. The auditor will focus on areas such as risk assessment, information security controls, ISMS documentation, awareness and training, and management review. 

To prepare for an ISO 27001 audit, organizations should ensure that all the basic documentation is in place, have a trained team that promotes a cyber-aware culture, conduct a management review",True,0.34567901234567905,0.06832298136645962,0.19753086419753088,0.48770612478256226,0.7601946517825127,0.9997156262397766,0.6301513454265337,0,0,2.4533700942993164,3.550938367843628,0.22999930381774902,6.004308462142944
Fine-tuned_finetuned-ISO-27001_1024_l2_All_1536_264_False,Hybrid_Rerank_Cohere,4,mixtral-8x7B-v0.1,16000,0,1,What are typical deficits identified during an ISO 27001 audit regarding assets and risks?,"[Document(page_content='number of security incidents for each damage class defined in the risk analysis during the considered period. since serious incidents should have a greater impact in the assessment than minor ones, it leads to a product formation of ""number x damage class,"" whose distribution then becomes the indicator ""security incidents in the isms.""\nduring audit activities in the isms, security vulnerabilities or weaknesses are often identified or knowledge of possible vulnerabilities and new risks is obtained from various sources. an effective isms is characterized by promptly responding to such insights: recording the insights, analyzing the resulting risks, fixing deficits/weaknesses if necessary, documenting solutions.\nin this context, the efficiency of handling such insights is a notable indicator for the performance of the isms. an organization could proceed with the motto: if we have no deficits or weaknesses, or at least quickly eliminate them, we have largely achieved our goal of secure information processing.\nsecurity objectives have been assigned controls according to isms-6.2. we have already discussed step-by-step plans for the implementation of controls above for each individual control.\nsome things have been implemented, including the possibility of measurements. an interesting aspect here would be the degree of implementation as an average across all controls of the isms - for example, as the average of individual values or with appropriate weighting. it is clear that this average/weighted degree of', metadata={'source': 'ISO 27001_2022_Kersten_und_Schroeder.pdf', 'title': 'ISO 27001_2022_Kersten_und_Schroeder', 'original_text': 'number of security incidents for each damage class defined in the risk analysis during the considered period. Since serious incidents should have a greater impact in the assessment than minor ones, it leads to a product formation of ""number x damage class,"" whose distribution then becomes the indicator ""security incidents in the ISMS.""\nDuring audit activities in the ISMS, security vulnerabilities or weaknesses are often identified or knowledge of possible vulnerabilities and new risks is obtained from various sources. An effective ISMS is characterized by promptly responding to such insights: Recording the insights, analyzing the resulting risks, fixing deficits/weaknesses if necessary, documenting solutions.\nIn this context, the efficiency of handling such insights is a notable indicator for the performance of the ISMS. An organization could proceed with the motto: If we have no deficits or weaknesses, or at least quickly eliminate them, we have largely achieved our goal of secure information processing.\nSecurity objectives have been assigned controls according to ISMS-6.2. We have already discussed step-by-step plans for the implementation of controls above for each individual control.\nsome things have been implemented, including the possibility of measurements. An interesting aspect here would be the degree of implementation as an average across all controls of the ISMS - for example, as the average of individual values or with appropriate weighting. It is clear that this average/weighted degree of', 'doc_ID': 2665, 'relevance_score': 0.93439513}), Document(page_content='they gather about their risks to develop\nand implement appropriate controls to mitigate those risks. controls can be\ntechnical, procedural, or organisational.\norganisations should also conduct internal audits, assessments, and management\nreviews on a regular basis to ensure that their isms is effective in managing\nrisks. this will help organisations to identify and address any gaps in their\nisms.\n> overall, clause 4.1 is an important requirement of iso 27001. by\n> understanding the organisation and its context, organisations can better\n> protect their information assets and achieve their business goals.', metadata={'description': ""Guide to ISO 27001 Clause 4.1: Delve into the organisation's internal & external issues. Explore the significance of this clause in forming a robust ISMS."", 'doc_ID': 198, 'language': 'en-gb', 'original_text': 'they gather about their risks to develop\nand implement appropriate controls to mitigate those risks. Controls can be\ntechnical, procedural, or organisational.\nOrganisations should also conduct internal audits, assessments, and management\nreviews on a regular basis to ensure that their ISMS is effective in managing\nrisks. This will help organisations to identify and address any gaps in their\nISMS.\n> Overall, Clause 4.1 is an important requirement of ISO 27001. By\n> understanding the organisation and its context, organisations can better\n> protect their information assets and achieve their business goals.', 'source': 'https://www.dataguard.co.uk/knowledge/iso-27001/clause-4-1-requirements-of-interested-parties/', 'title': 'ISO 27001 Clause 4.1: Understanding Organisation & Context for Infosec', 'relevance_score': 0.9094255}), Document(page_content='iso 27001 is an international standard that provides a framework for managing\ninformation security. it is designed to help organisations protect their\ninformation assets from a variety of threats, including unauthorized access,\nuse, disclosure, modification, or destruction.\nclause 8.2 of iso 27001 is concerned with information security risk\nassessment. this clause requires organisations to identify, assess, and\ncontrol the risks to their information assets.\n## what is iso 27001 clause 8.2 information security risk assessment?\niso 27001 clause 8.2 information security risk assessment is titled\n""information security risk assessment"". information security risk assessment\nis a critical process for any organization that wants to protect its data and\nsystems. by identifying and assessing risks, organizations can take steps to\nmitigate them and prevent security incidents from occurring. a risk management\nprocess should be following:\n * systematic * documented * regularly reviewed and updated.\n## asset-based risk management vs. scenario-based risk management\nthere are two main types of information security risk assessment: asset-based\nand scenario-based.\nasset-based risk assessment focuses on identifying and assessing the risks to\nspecific information assets, such as customer data, financial data, and\nintellectual property.\n### asset-based risk management process\nasset-based risk assessment typically involves the following steps:\n 1. identify the information assets that need to be', metadata={'description': 'Learn about ISO 27001 clause 8.2, requiring organisations to conduct a risk assessment to identify, assess & prioritize risks to their information assets. ', 'doc_ID': 399, 'language': 'en-gb', 'original_text': 'ISO 27001 is an international standard that provides a framework for managing\ninformation security. It is designed to help organisations protect their\ninformation assets from a variety of threats, including unauthorized access,\nuse, disclosure, modification, or destruction.\nClause 8.2 of ISO 27001 is concerned with information security risk\nassessment. This clause requires organisations to identify, assess, and\ncontrol the risks to their information assets.\n## What is ISO 27001 clause 8.2 information security risk assessment?\nISO 27001 clause 8.2 information security risk assessment is titled\n""Information security risk assessment"". Information security risk assessment\nis a critical process for any organization that wants to protect its data and\nsystems. By identifying and assessing risks, organizations can take steps to\nmitigate them and prevent security incidents from occurring. A risk management\nprocess should be following:\n * Systematic * Documented * Regularly reviewed and updated.\n## Asset-based risk management vs. scenario-based risk management\nThere are two main types of information security risk assessment: asset-based\nand scenario-based.\nAsset-based risk assessment focuses on identifying and assessing the risks to\nspecific information assets, such as customer data, financial data, and\nintellectual property.\n### Asset-based risk management process\nAsset-based risk assessment typically involves the following steps:\n 1. Identify the information assets that need to be', 'source': 'https://www.dataguard.co.uk/knowledge/iso-27001/clause-8-2-information-security-risk-assessment/', 'title': 'ISO 27001 Clause 8.2: Information security risk assessment ', 'relevance_score': 0.89947516}), Document(page_content='findings:** the organisation should follow up on the audit findings and implement any necessary corrective actions.\n## what to look for during an iso 27001 internal audit\nduring an iso 27001 internal audit, the auditor will look for evidence that\nthe isms is conforming to the requirements of iso 27001 and that it is\noperating effectively. the auditor will focus on the following areas and\nevidence that supports them:\n * risk assessment: the auditor will assess whether the organisation has conducted a thorough risk assessment and whether the identified risks have been appropriately addressed. * information security controls: the auditor will assess whether the organisation has implemented and is maintaining appropriate information security controls to mitigate the identified risks. * isms documentation: the auditor will assess whether the isms is adequately documented. you can find a list of the required documentation for the iso 27001 certification here. * awareness and training: the auditor will assess whether staff are aware of their information security responsibilities and have received appropriate training. * management review: the auditor will assess whether the organisation conducts regular management reviews of the isms.\n## how to report on the findings of an iso 27001 internal audit\nthe audit findings should be documented in a report. this report should\ninclude the following:\n * audit objectives: the audit objectives should be clearly stated in the report.', metadata={'source': 'https://www.dataguard.co.uk/knowledge/iso-27001/clause-9-2-internal-audit/', 'title': 'ISO 27001 Clause 9.2: Internal Audit', 'description': 'Ensure your ISMS is operating effectively for ISO 27001 compliance. Learn all you need to know about ISO 27001 Clause 9.2 internal audits in our guide.\n', 'language': 'en-gb', 'original_text': 'findings:** The organisation should follow up on the audit findings and implement any necessary corrective actions.\n## What to look for during an ISO 27001 internal audit\nDuring an ISO 27001 internal audit, the auditor will look for evidence that\nthe ISMS is conforming to the requirements of ISO 27001 and that it is\noperating effectively. The auditor will focus on the following areas and\nevidence that supports them:\n * Risk assessment: The auditor will assess whether the organisation has conducted a thorough risk assessment and whether the identified risks have been appropriately addressed. * Information security controls: The auditor will assess whether the organisation has implemented and is maintaining appropriate information security controls to mitigate the identified risks. * ISMS documentation: The auditor will assess whether the ISMS is adequately documented. You can find a list of the required documentation for the ISO 27001 certification here. * Awareness and training: The auditor will assess whether staff are aware of their information security responsibilities and have received appropriate training. * Management review: The auditor will assess whether the organisation conducts regular management reviews of the ISMS.\n## How to report on the findings of an ISO 27001 internal audit\nThe audit findings should be documented in a report. This report should\ninclude the following:\n * Audit objectives: The audit objectives should be clearly stated in the report.', 'doc_ID': 424, 'relevance_score': 0.8975158})]","Typical deficiencies in an ISO 27001 audit regarding information assets and risks include:

1. Unidentified information assets: Comprehensive identification and documentation of all relevant information were lacking, leading to unclear protective measures.
2. Inconsistent directories within the organization: There were different directories of information assets within the same organization, indicating a lack of standardization and clear structures.
3. Lack of assignment of information assets to responsible owners: Clear responsibilities for protecting information assets were not established, affecting the effectiveness of information management.
4. Incomplete identification of risks and vulnerabilities: Potential risks were not comprehensively recognized, and vulnerabilities in the security structure were overlooked.
5. Unrealistic risk assessments: The risk analysis was either too detailed or flawed, and the assumed figures were unrealistic, compromising the efficiency of risk assessment.","During an ISO 27001 audit, common deficits identified in the context of assets and risks include inadequate risk assessments and insufficient security controls. Organizations may not have properly identified and assessed risks to their information assets, or they may not have implemented appropriate controls to mitigate those risks. 

ISO 27001 clause 8.2 specifically addresses information security risk assessment, requiring organizations to identify, assess, and control risks to their information assets. However, organizations may struggle to effectively implement this clause. They may lack a systematic, documented, and regularly reviewed risk management process, or they may not have properly identified and assessed all relevant information assets.

Additionally, organizations may not have properly implemented and maintained information security controls to mitigate identified risks. Controls may be inadequate or not properly configured, or they may not be consistently enforced throughout the organization.

Another common deficit is inadequate ISMS documentation. The ISMS should be thoroughly documented, including risk assessments, security controls, and other relevant information. However, organizations may not have complete or up-to-date documentation, making it difficult to demonstrate compliance with ISO 27001 requirements.

Fin",True,0.3215434083601286,0.0970873786407767,0.19292604501607716,0.5146738290786743,0.7369704097509384,0.9966586828231812,0.7559361636559024,0,0,2.5285913944244385,3.5924625396728516,0.22299742698669434,6.12105393409729
Fine-tuned_finetuned-ISO-27001_1024_l2_All_1536_264_False,Hybrid_Rerank_Cohere,4,mixtral-8x7B-v0.1,16000,0,1,How is the ISO 27001 audit report created after an audit and what information does it contain?,"[Document(page_content=""of the isms.\n## how to report on the findings of an iso 27001 internal audit\nthe audit findings should be documented in a report. this report should\ninclude the following:\n * audit objectives: the audit objectives should be clearly stated in the report. * audit methodology: the audit methodology should be described in the report. this includes the audit techniques that were used and the sampling methods that were applied. * audit findings: the audit findings should be described in the report. this includes a description of any weaknesses that were identified in the isms. * recommendations: the report should include any recommendations for improvement.\nthe audit report should be submitted to the organisation's management"", metadata={'description': 'Ensure your ISMS is operating effectively for ISO 27001 compliance. Learn all you need to know about ISO 27001 Clause 9.2 internal audits in our guide.\n', 'doc_ID': 425, 'language': 'en-gb', 'original_text': ""of the ISMS.\n## How to report on the findings of an ISO 27001 internal audit\nThe audit findings should be documented in a report. This report should\ninclude the following:\n * Audit objectives: The audit objectives should be clearly stated in the report. * Audit methodology: The audit methodology should be described in the report. This includes the audit techniques that were used and the sampling methods that were applied. * Audit findings: The audit findings should be described in the report. This includes a description of any weaknesses that were identified in the ISMS. * Recommendations: The report should include any recommendations for improvement.\nThe audit report should be submitted to the organisation's management"", 'source': 'https://www.dataguard.co.uk/knowledge/iso-27001/clause-9-2-internal-audit/', 'title': 'ISO 27001 Clause 9.2: Internal Audit', 'relevance_score': 0.9717254}), Document(page_content='findings:** the organisation should follow up on the audit findings and implement any necessary corrective actions.\n## what to look for during an iso 27001 internal audit\nduring an iso 27001 internal audit, the auditor will look for evidence that\nthe isms is conforming to the requirements of iso 27001 and that it is\noperating effectively. the auditor will focus on the following areas and\nevidence that supports them:\n * risk assessment: the auditor will assess whether the organisation has conducted a thorough risk assessment and whether the identified risks have been appropriately addressed. * information security controls: the auditor will assess whether the organisation has implemented and is maintaining appropriate information security controls to mitigate the identified risks. * isms documentation: the auditor will assess whether the isms is adequately documented. you can find a list of the required documentation for the iso 27001 certification here. * awareness and training: the auditor will assess whether staff are aware of their information security responsibilities and have received appropriate training. * management review: the auditor will assess whether the organisation conducts regular management reviews of the isms.\n## how to report on the findings of an iso 27001 internal audit\nthe audit findings should be documented in a report. this report should\ninclude the following:\n * audit objectives: the audit objectives should be clearly stated in the report.', metadata={'source': 'https://www.dataguard.co.uk/knowledge/iso-27001/clause-9-2-internal-audit/', 'title': 'ISO 27001 Clause 9.2: Internal Audit', 'description': 'Ensure your ISMS is operating effectively for ISO 27001 compliance. Learn all you need to know about ISO 27001 Clause 9.2 internal audits in our guide.\n', 'language': 'en-gb', 'original_text': 'findings:** The organisation should follow up on the audit findings and implement any necessary corrective actions.\n## What to look for during an ISO 27001 internal audit\nDuring an ISO 27001 internal audit, the auditor will look for evidence that\nthe ISMS is conforming to the requirements of ISO 27001 and that it is\noperating effectively. The auditor will focus on the following areas and\nevidence that supports them:\n * Risk assessment: The auditor will assess whether the organisation has conducted a thorough risk assessment and whether the identified risks have been appropriately addressed. * Information security controls: The auditor will assess whether the organisation has implemented and is maintaining appropriate information security controls to mitigate the identified risks. * ISMS documentation: The auditor will assess whether the ISMS is adequately documented. You can find a list of the required documentation for the ISO 27001 certification here. * Awareness and training: The auditor will assess whether staff are aware of their information security responsibilities and have received appropriate training. * Management review: The auditor will assess whether the organisation conducts regular management reviews of the ISMS.\n## How to report on the findings of an ISO 27001 internal audit\nThe audit findings should be documented in a report. This report should\ninclude the following:\n * Audit objectives: The audit objectives should be clearly stated in the report.', 'doc_ID': 424, 'relevance_score': 0.9705764}), Document(page_content=""* the audit must cover all aspects of the isms, including risk assessment, information security controls, isms documentation, awareness and training, and management review. * the audit findings must be documented in a report that is submitted to the organisation's management.\norganisations that are certified according to iso 27001 must also undergo an\nexternal audit by a certification body. there are two kinds of external audit,\none conducted once annually called a surveillance audit where the isms will be\nreviewed as part of ongoing evaluation and the other known as a full external\naudit which is more in-depth and conducted every three years.\nbenefits of iso 27001 audit:\n * improved information security posture * reduced risk of information security incidents * increased compliance with regulations * improved customer confidence * competitive advantage\nif you are considering implementing iso 27001 or if you are already certified,\nit is important to ensure that you are conducting regular internal audits.\ninternal audits are an essential tool for maintaining an effective isms and\nprotecting your organisation from information security threats.\n## where is an internal audit mandatory?\nan internal audit is not required by law or regulation. however, it is a good\npractice for all organisations to conduct regular internal audits of their\ninformation security and other management systems.\nin order to comply with iso 27001, all companies must conduct internal"", metadata={'source': 'https://www.dataguard.co.uk/knowledge/iso-27001/clause-9-2-internal-audit/', 'title': 'ISO 27001 Clause 9.2: Internal Audit', 'description': 'Ensure your ISMS is operating effectively for ISO 27001 compliance. Learn all you need to know about ISO 27001 Clause 9.2 internal audits in our guide.\n', 'language': 'en-gb', 'original_text': ""* The audit must cover all aspects of the ISMS, including risk assessment, information security controls, ISMS documentation, awareness and training, and management review. * The audit findings must be documented in a report that is submitted to the organisation's management.\nOrganisations that are certified according to ISO 27001 must also undergo an\nexternal audit by a certification body. There are two kinds of external audit,\none conducted once annually called a surveillance audit where the ISMS will be\nreviewed as part of ongoing evaluation and the other known as a full external\naudit which is more in-depth and conducted every three years.\nBenefits of ISO 27001 audit:\n * Improved information security posture * Reduced risk of information security incidents * Increased compliance with regulations * Improved customer confidence * Competitive advantage\nIf you are considering implementing ISO 27001 or if you are already certified,\nit is important to ensure that you are conducting regular internal audits.\nInternal audits are an essential tool for maintaining an effective ISMS and\nprotecting your organisation from information security threats.\n## Where is an internal audit mandatory?\nAn internal audit is not required by law or regulation. However, it is a good\npractice for all organisations to conduct regular internal audits of their\ninformation security and other management systems.\nIn order to comply with ISO 27001, all companies must conduct internal"", 'doc_ID': 422, 'relevance_score': 0.962462}), Document(page_content='one of the key requirements to obtain an iso 27001 certification is to conduct\nregular internal audits of the information security management system (isms).\ninternal audits help organisations to identify and address any weaknesses in\ntheir isms and to ensure that it is operating effectively.\n## what is an iso 27001 internal audit?\nan iso 27001 internal audit is an independent assessment of the isms to\ndetermine whether it is conforming to the requirements of iso 27001 and\nwhether it is operating effectively. the audit is conducted by an internal\nauditor who is independent of the isms being audited.\n## why are iso 27001 internal audits important?\niso 27001 internal audits are important for a number of reasons:\n * to comply with iso 27001: iso 27001 requires organisations to conduct regular internal audits of their isms. * to identify and address weaknesses in the isms: internal audits can help organisations identify weaknesses in their information security management system (isms) before they are exploited by attackers. * to improve the effectiveness of the isms: internal audits can help organisations identify areas where the isms can be improved. * to provide assurance to stakeholders: internal audits can provide assurance to stakeholders that the isms is operating effectively and that the organisation is taking steps to protect its sensitive information.\n## does iso 27001 require an internal audit?\nyes, iso 27001 requires organisations to conduct regular internal audits', metadata={'source': 'https://www.dataguard.co.uk/knowledge/iso-27001/clause-9-2-internal-audit/', 'title': 'ISO 27001 Clause 9.2: Internal Audit', 'description': 'Ensure your ISMS is operating effectively for ISO 27001 compliance. Learn all you need to know about ISO 27001 Clause 9.2 internal audits in our guide.\n', 'language': 'en-gb', 'original_text': 'One of the key requirements to obtain an ISO 27001 certification is to conduct\nregular internal audits of the information security management system (ISMS).\nInternal audits help organisations to identify and address any weaknesses in\ntheir ISMS and to ensure that it is operating effectively.\n## What is an ISO 27001 Internal Audit?\nAn ISO 27001 internal audit is an independent assessment of the ISMS to\ndetermine whether it is conforming to the requirements of ISO 27001 and\nwhether it is operating effectively. The audit is conducted by an internal\nauditor who is independent of the ISMS being audited.\n## Why are ISO 27001 Internal Audits Important?\nISO 27001 internal audits are important for a number of reasons:\n * To comply with ISO 27001: ISO 27001 requires organisations to conduct regular internal audits of their ISMS. * To identify and address weaknesses in the ISMS: Internal audits can help organisations identify weaknesses in their information security management system (ISMS) before they are exploited by attackers. * To improve the effectiveness of the ISMS: Internal audits can help organisations identify areas where the ISMS can be improved. * To provide assurance to stakeholders: Internal audits can provide assurance to stakeholders that the ISMS is operating effectively and that the organisation is taking steps to protect its sensitive information.\n## Does ISO 27001 require an internal audit?\nYes, ISO 27001 requires organisations to conduct regular internal audits', 'doc_ID': 420, 'relevance_score': 0.8738621})]","After an ISO 27001 audit, the auditors, possibly supported by specialists, prepare an audit report for the organization's management. The audit report serves to describe the audit process, the input used, and the presentation of identified problems and deviations from the desired state. The audit report also reflects the organization's proposed action plan, including agreed-upon implementation deadlines, assessed as effective by the auditors. In this way, the audit report becomes a document that serves as a basis for preparing the next regular (internal, external) audit. The organization's management, in turn, uses the audit report to decide, assign, and monitor the corrective actions for the identified deficiencies. Remediation of deficiencies should occur without undue delay. If deadlines were already agreed upon during the audit's closing discussion, the responsible management should ensure compliance with these dates. A good audit report is characterized by describing in understandable language what was examined, how it was assessed, and with what results. In cases of deviations from the standard, the auditors specify the normative requirements, describe the found condition regarding documentation and implementation, and provide a justification, if necessary, especially in all non-obvious cases.","The ISO 27001 audit report is created after an audit and includes the audit objectives, methodology, findings, and recommendations. The audit findings should cover all aspects of the Information Security Management System (ISMS), including risk assessment, information security controls, ISMS documentation, awareness and training, and management review. The report is submitted to the organization's management, who should follow up on the findings and implement any necessary corrective actions.

An internal audit is mandatory for ISO 27001 certification, and it is conducted by an internal auditor who is independent of the ISMS being audited. The internal audit is important for compliance with ISO 27001, identifying and addressing weaknesses in the ISMS, improving the effectiveness of the ISMS, and providing assurance to stakeholders.

The benefits of ISO 27001 audit include improved information security posture, reduced risk of information security incidents, increased compliance with regulations, improved customer confidence, and competitive advantage. The audit is not required by law or regulation but is a good practice for all organizations to conduct regular internal audits of their information security and other management systems.",True,0.418230563002681,0.10242587601078167,0.2091152815013405,0.4479820728302002,0.7230211645364761,0.9997872710227966,0.6157876673988228,0,0,2.2814407348632812,3.303844451904297,0.2779996395111084,5.585285186767578
Fine-tuned_finetuned-ISO-27001_1024_l2_All_1536_264_False,Hybrid_Rerank_Cohere,4,mixtral-8x7B-v0.1,16000,0,1,How is Annex A of ISO 27001 (version 2013) structured and what information does it contain?,"[Document(page_content='to those in annex a as a\ncheck to confirm that no necessary\ncontrol has been overlooked\nrelevance of the soa to certification audits\nthe soa is a principal driver of certification audits. common practice amongst\ncertification bodies is to devise an assessment programme that covers all the\ncontrols in annex a as well as the isms requirements (i.e., iso/iec 27001 clauses\n4-10).\nit is important to realise, however, that the controls in iso/iec 27001 annex a are\nnot requirements, albeit the necessary controls in the soa are organisational\nrequirements. the iso requirement (clause 6.1.3 c)) is the comparison process.\nmoreover, there is no requirement to express the organisation’s necessary controls\nin terms of the annex a controls. that means:\na) the soa does not need to have the same structure as annex a.\nb) provided that there are no unnecessary controls in annex a, the soa does\nnot have to contain any annex a controls (otherwise the soa will have to\nidentify and justify those that are unnecessary).\nhowever, it is prudent to be able to demonstrate conformity with clause 6.1.3 c),\nand most organisations do that by adopting the structure of annex a for their soa.\nthus, the practice of auditing all the controls in annex a is just a shorthand for\nauditing all the necessary controls.\ncustom controls, obviations, and variants\niso/iec 27003 provides guidance and understanding of the iso/iec 27001\nrequirements. in its explanation of the soa, it introduces the concepts of a custom\ncontrol and an obviated', metadata={'doc_ID': 565, 'original_text': 'to those in Annex A as a\ncheck to confirm that no necessary\ncontrol has been overlooked\nRelevance of the SOA to certification audits\nThe SOA is a principal driver of certification audits. Common practice amongst\ncertification bodies is to devise an assessment programme that covers all the\ncontrols in Annex A as well as the ISMS requirements (i.e., ISO/IEC 27001 Clauses\n4-10).\nIt is important to realise, however, that the controls in ISO/IEC 27001 Annex A are\nnot requirements, albeit the necessary controls in the SOA are organisational\nrequirements. The ISO requirement (Clause 6.1.3 c)) is the comparison process.\nMoreover, there is no requirement to express the organisation’s necessary controls\nin terms of the Annex A controls. That means:\na) The SOA does not need to have the same structure as Annex A.\nb) Provided that there are no unnecessary controls in Annex A, the SOA does\nnot have to contain any Annex A controls (otherwise the SOA will have to\nidentify and justify those that are unnecessary).\nHowever, it is prudent to be able to demonstrate conformity with Clause 6.1.3 c),\nand most organisations do that by adopting the structure of Annex A for their SOA.\nThus, the practice of auditing all the controls in Annex A is just a shorthand for\nauditing all the necessary controls.\nCustom controls, obviations, and variants\nISO/IEC 27003 provides guidance and understanding of the ISO/IEC 27001\nrequirements. In its explanation of the SOA, it introduces the concepts of a custom\ncontrol and an obviated', 'source': 'Brewer - 2020 - ISO IEC 27001 Mastering Risk Assessment and the Statement of Applicability.pdf', 'title': 'Brewer - 2020 - ISO IEC 27001 Mastering Risk Assessment and the Statement of Applicability', 'relevance_score': 0.99351174}), Document(page_content='the standard was revised for the third time. the current version of the\nstandard is iso 27001:2022.\nthis framework, iso 27001, safeguards the confidentiality, integrity and\navailability of the sensitive consumer information you collect. compliance\nwith iso 27001 helps you prevent unauthorised access, breaches and regulatory\nfines.\nmoreover, achieving iso 27001 certification not only ensures robust\ninformation security but also aligns with the requirements of nis2, the new eu\ndirective, emphasising its importance in the current digital landscape.\n## what is the iso 27001 annex a?\na simple approach to think of annex a is as a portfolio of information\nsecurity controls that you can choose from – you can pick and select from 93\nmeasures specified in annex a that are relevant to your organisation’s scope.\niso 27001 annex a is arguably the most well-known annex of all the iso\nstandards, as it contains the essential instrument for managing information\nsecurity risks: a list of security controls (or safeguards) that should be\nused to strengthen the security of information assets.\nthe 27001 annex a lists all relevant controls and provides guidance on how to\nimplement the standard measures.\n## iso 27001 vs. iso 27002: what is the difference?\niso 27001 is the framework that gives companies a basic understanding of the\ncontrols and clauses in annex a. while it does not go into great depth\nregarding each control, it does provide you with an idea of what you need to\naccomplish, but not how to execute it. each', metadata={'source': 'https://www.dataguard.co.uk/knowledge/iso-27001-controls-annex-a/', 'title': 'ISO 27001 Controls: Overview of all measures from Annex A', 'description': 'ISO 27001 Controls are all 93 measures from Annex A of the new ISO 27001:2022. Explore our Guide and learn everything about the ISO 27001 Annex A controls.', 'language': 'en-gb', 'original_text': 'the standard was revised for the third time. The current version of the\nstandard is ISO 27001:2022.\nThis framework, ISO 27001, safeguards the confidentiality, integrity and\navailability of the sensitive consumer information you collect. Compliance\nwith ISO 27001 helps you prevent unauthorised access, breaches and regulatory\nfines.\nMoreover, achieving ISO 27001 certification not only ensures robust\ninformation security but also aligns with the requirements of NIS2, the new EU\nDirective, emphasising its importance in the current digital landscape.\n## What is the ISO 27001 Annex A?\nA simple approach to think of Annex A is as a portfolio of information\nsecurity controls that you can choose from – you can pick and select from 93\nmeasures specified in Annex A that are relevant to your organisation’s scope.\nISO 27001 Annex A is arguably the most well-known annex of all the ISO\nstandards, as it contains the essential instrument for managing information\nsecurity risks: a list of security controls (or safeguards) that should be\nused to strengthen the security of information assets.\nThe 27001 Annex A lists all relevant controls and provides guidance on how to\nimplement the standard measures.\n## ISO 27001 vs. ISO 27002: What is the difference?\nISO 27001 is the framework that gives companies a basic understanding of the\ncontrols and clauses in Annex A. While it does not go into great depth\nregarding each control, it does provide you with an idea of what you need to\naccomplish, but not how to execute it. Each', 'doc_ID': 180, 'relevance_score': 0.9928509}), Document(page_content='and capable of certification to multiple\nstandards, is becoming much easier for the average organization to achieve.\na note on numbering\n1so27001 adopts the same standard numbering methodology for its clauses\nand sub-clauses as will other management system specifications. this means\nthat the requirements of the standard (what you have to do if you are to\nclaim compliance with it) are set out in clauses 4-10, with clauses 1-3 being\nintroductory and the annexes being excluded from the requirements.\n18027002 follows a different numbering sequence, with clauses 1-4\nproviding general guidance on the use of the standard, and clauses 5 through\n18 providing guidance on individual controls. annex a to iso27001 is\nnumbered from as to a18, in order to match the control clauses in iso027002.\nin this book, we refer to annex a controls by means of the ‘a’ prefix (as in\na.5.1.1.) and to those same controls in is027002 by means of the iso027002\nnumbering (as in 5.1.1), where we identify clauses in is027001, we are\nspecifically referring to the stated requirements of the standard.\nreturning to iso 27001, the numbering is solely for the purpose of refer-\nencing. the standard itself recognizes that the order and number of clauses\ndoes not indicate relative importance or an order of implementation.\nstructured approach to implementation\nalthough is027001:2013 allows the organization to tackle its clauses in\nany appropriate order, it makes sense to have a structured approach to the\nestablishment of an isms, there are six', metadata={'doc_ID': 1950, 'original_text': 'and capable of certification to multiple\nstandards, is becoming much easier for the average organization to achieve.\nA note on numbering\n1SO27001 adopts the same standard numbering methodology for its clauses\nand sub-clauses as will other management system specifications. This means\nthat the requirements of the standard (what you have to do if you are to\nclaim compliance with it) are set out in clauses 4-10, with clauses 1-3 being\nintroductory and the annexes being excluded from the requirements.\n18027002 follows a different numbering sequence, with clauses 1-4\nproviding general guidance on the use of the standard, and clauses 5 through\n18 providing guidance on individual controls. Annex A to ISO27001 is\nnumbered from AS to A18, in order to match the control clauses in ISO027002.\nIn this book, we refer to Annex A controls by means of the ‘A’ prefix (as in\nA.5.1.1.) and to those same controls in IS027002 by means of the ISO027002\nnumbering (as in 5.1.1), Where we identify clauses in IS027001, we are\nspecifically referring to the stated requirements of the standard.\nReturning to ISO 27001, the numbering is solely for the purpose of refer-\nencing. The standard itself recognizes that the order and number of clauses\ndoes not indicate relative importance or an order of implementation.\nStructured approach to implementation\nAlthough IS027001:2013 allows the organization to tackle its clauses in\nany appropriate order, it makes sense to have a structured approach to the\nestablishment of an ISMS, There are six', 'source': 'Watkins, Calder - 2020 - IT Governance - An International Guide to Data Security and ISO 27001 ISO 27002.pdf', 'title': 'Watkins, Calder - 2020 - IT Governance - An International Guide to Data Security and ISO 27001 ISO 27002', 'relevance_score': 0.9916842}), Document(page_content='practice, the order of the steps can of course be reversed and one can start with annex a - and check at the end whether there is still a need for additional own controls.\nin conclusion, it should be noted that the implementation of all controls from annex a is not mandatory! in extreme cases, an organization could even determine (if justifiable) that the entire annex a is not relevant or too specific for them - and then work exclusively with their own controls.\nafter these ""warnings,"" we now dive into annex a. in the new version of the standard, there are a total of 93 controls - compared to 114 in the old version. some old controls have been removed, some new ones added - the reduced number is due to a restructuring of annex a. the following fig. 3.2 provides an initial overview.\nthe controls are grouped into four groups, which start with the number 5 following a previous tradition. within each group, the controls are numbered sequentially (starting with 1). therefore, we reference the controls as follows: a-6.2, for example, is the second control from group 6 (personnel) in annex a. the controls also each have a readable label.\nfor those primarily interested in comparing the controls in the old and new versions of iso 27001, please refer to chapter 4.\n3.2 characteristics of the controls\' order\nthe classification of the controls into the four groups\ne a-5: organizational controls\ne a-6: personnel controls\n2 we have taken these designations from the latest german draft of iso 27002 - even if the', metadata={'doc_ID': 2689, 'original_text': 'practice, the order of the steps can of course be reversed and one can start with Annex A - and check at the end whether there is still a need for additional own controls.\nIn conclusion, it should be noted that the implementation of all controls from Annex A is not mandatory! In extreme cases, an organization could even determine (if justifiable) that the entire Annex A is not relevant or too specific for them - and then work exclusively with their own controls.\nAfter these ""warnings,"" we now dive into Annex A. In the new version of the standard, there are a total of 93 controls - compared to 114 in the old version. Some old controls have been removed, some new ones added - the reduced number is due to a restructuring of Annex A. The following Fig. 3.2 provides an initial overview.\nThe controls are grouped into four groups, which start with the number 5 following a previous tradition. Within each group, the controls are numbered sequentially (starting with 1). Therefore, we reference the controls as follows: A-6.2, for example, is the second control from Group 6 (Personnel) in Annex A. The controls also each have a readable label.\nFor those primarily interested in comparing the controls in the old and new versions of ISO 27001, please refer to Chapter 4.\n3.2 Characteristics of the Controls\' Order\nThe classification of the controls into the four groups\ne A-5: Organizational controls\ne A-6: Personnel controls\n2 We have taken these designations from the latest German draft of ISO 27002 - even if the', 'source': 'ISO 27001_2022_Kersten_und_Schroeder.pdf', 'title': 'ISO 27001_2022_Kersten_und_Schroeder', 'relevance_score': 0.9910146})]","Annex A of ISO 27001 (version 2013) is a catalog that includes 14 security domains, 35 control objectives, and 114 controls. Each security domain is broken down into one or more objectives that are intended to be achieved through the implementation of the associated controls. Annex A is normative and all controls must be ""addressed,"" but only the controls relevant to the organization need to be implemented. All other controls can be left out, however, this needs to be justified.",Annex A of ISO 27001:2,True,0.11627906976744186,0.09523809523809523,0.11627906976744186,0.3001044988632202,0.32820523995906115,0.02706420235335827,0.6733506623253949,0,0,2.1610002517700195,1.0427210330963135,0.29399919509887695,3.203721284866333
Fine-tuned_finetuned-ISO-27001_1024_l2_All_1536_264_False,Hybrid_Rerank_Cohere,4,mixtral-8x7B-v0.1,16000,0,1,What are the 14 security topics included in the appendix of ISO 27001 (version 2013)?,"[Document(page_content='is made up of a list\nof security controls that your company can utilize to improve the security of\nits information assets. iso 27001 comprises 114 controls divided into 14\nsections, also known as domains. the sections are focused on information\ntechnology and beyond, taking into consideration the wide range of factors\nthat can impact the security of your information environment. the 14 iso\ndomains are focused on organizational issues, human resources, it, physical\nsecurity, and legal issues. there is no requirement to implement the full list\nof iso 27001’s controls; rather, they are possibilities for an organization to\nconsider based on its particular needs. utilizing the 114 controls listed in\nannex a, your company can select those that are applicable to the needs of\nyour company and your customers. the 14 domains are:\n * information security policies (a.5)\n * organization of information security and assignment of responsibility (a.6)\n * human resources security (a.7)\n * asset management (a.8)\n * user access control (a.9)\n * encryption and management of sensitive information (a.10)\n * physical and environmental security (a.11)\n * operational security (a.12)\n * communications security (a.13)\n * system acquisition, development, and maintenance (a.14)\n * supplier relationships (a.15)\n * information security incident management (a.16)\n * information security aspects of business continuity management (a.17)\n * compliance (a.18)\n## deep-dive: iso 27001 required documents\niso 27001 isms required', metadata={'source': 'https://www.vanta.com/resources/the-ultimate-iso-27001-guide-powered-by-vanta-and-aprio', 'title': 'The ultimate ISO 27001 guide', 'description': 'In this guide, we share the recommended approach to successful implementation of an Information Security Management System (ISMS) according to the ISO 27001 standard to help prepare your organization to undergo an independent evaluation of your ISMS in order to obtain your ISO 27001 certification.', 'language': 'en', 'original_text': 'is made up of a list\nof security controls that your company can utilize to improve the security of\nits information assets. ISO 27001 comprises 114 controls divided into 14\nsections, also known as domains. The sections are focused on information\ntechnology and beyond, taking into consideration the wide range of factors\nthat can impact the security of your information environment. The 14 ISO\ndomains are focused on organizational issues, human resources, IT, physical\nsecurity, and legal issues. There is no requirement to implement the full list\nof ISO 27001’s controls; rather, they are possibilities for an organization to\nconsider based on its particular needs. Utilizing the 114 controls listed in\nAnnex A, your company can select those that are applicable to the needs of\nyour company and your customers. The 14 domains are:\n * Information security policies (A.5)\n * Organization of information security and assignment of responsibility (A.6)\n * Human resources security (A.7)\n * Asset management (A.8)\n * User access control (A.9)\n * Encryption and management of sensitive information (A.10)\n * Physical and environmental security (A.11)\n * Operational security (A.12)\n * Communications security (A.13)\n * System acquisition, development, and maintenance (A.14)\n * Supplier relationships (A.15)\n * Information security incident management (A.16)\n * Information security aspects of business continuity management (A.17)\n * Compliance (A.18)\n## Deep-dive: ISO 27001 required documents\nISO 27001 ISMS Required', 'doc_ID': 64, 'relevance_score': 0.99317604}), Document(page_content='it easier to apply\nthe relevant controls selectively to your organization.\norganizational controls (37 measures)\nthese controls are applicable when the risks do not fall under the topics of\npeople, technology, or physical security. they include, for example, identity\nmanagement, responsibilities, and evidence collection.\nnew organizational controls include:\n * 5.7: threat intelligence * 5.23: information security for the use of cloud services * 5.30: ict readiness for business continuity\nthreat intelligence is a particularly important innovation in this area. this\nmeasure goes beyond the detection of malicious domain names. threat analysis\nhelps organizations better understand how they can be attacked and take\nappropriate precautions.\npeople controls (8 measures)\nremote work is a hot topic in the people area. however, the restructuring of\nthe working world also comes with risks. this is where the people measures of\niso 27001 come in. the area related to personnel only includes eight controls.\nthese focus on how employees handle sensitive information during their daily\nwork. this includes topics such as remote work, non-disclosure agreements, and\nscreenings. in addition, onboarding and offboarding processes and\nresponsibilities for reporting incidents are relevant.\nphysical controls (14 measures)\nphysical controls include security monitoring, maintenance, facility security,\nand storage media. this category is about how you protect yourself against\nphysical and environmental threats', metadata={'source': 'https://experta.com/shared-post/367d5f2c-e60f-4187-9faf-cb44fb209cdc', 'title': 'Experta', 'language': 'No language found.', 'original_text': 'it easier to apply\nthe relevant controls selectively to your organization.\nOrganizational controls (37 measures)\nThese controls are applicable when the risks do not fall under the topics of\npeople, technology, or physical security. They include, for example, identity\nmanagement, responsibilities, and evidence collection.\nNew organizational controls include:\n * 5.7: Threat intelligence * 5.23: Information security for the use of cloud services * 5.30: ICT readiness for business continuity\nThreat intelligence is a particularly important innovation in this area. This\nmeasure goes beyond the detection of malicious domain names. Threat analysis\nhelps organizations better understand how they can be attacked and take\nappropriate precautions.\nPeople controls (8 measures)\nRemote work is a hot topic in the people area. However, the restructuring of\nthe working world also comes with risks. This is where the people measures of\nISO 27001 come in. The area related to personnel only includes eight controls.\nThese focus on how employees handle sensitive information during their daily\nwork. This includes topics such as remote work, non-disclosure agreements, and\nscreenings. In addition, onboarding and offboarding processes and\nresponsibilities for reporting incidents are relevant.\nPhysical controls (14 measures)\nPhysical controls include security monitoring, maintenance, facility security,\nand storage media. This category is about how you protect yourself against\nphysical and environmental threats', 'doc_ID': 307, 'relevance_score': 0.9692078}), Document(page_content='here, management topics are primarily addressed.\nsecurity domain\nwhich security domain does the control contribute to? here: (it) governance and ecosystem, protection, defense, resilience.\nthese attributes are assigned the following attribute values - in the designation, each starting with #:\nattributes and attribute values from iso 27002\ncontrol type: #preventive, #detective, #corrective\ninformation security property: #confidentiality, #integrity, #availability\ncybersecurity concept: #identify, #protect, #detect, #respond, #recover\noperational capability: #governance, #asset_management, #information_\nprotection, #human_ resource_security, #physical_\nsecurity, #system_and_network_security, #applica-\ntion_security, #secure_configuration, #identity_and_\naccess_management, #threat_and_vulnerability_\nmanagement, #continuity, #supplier_relationships_\nsecurity, #legal_and_compliance, #information_\nsecurity_event_management, #information_security_\nassurance\nsecurity domain: #governance_and_ecosystem, #protection, #defense,\n#resilience\neach control from annex a of the standard has been ""attached"" with the appropriate attribute values according to this scheme in iso 27002.\nif all controls are recorded, for example, in a table and the respective attribute values are included, the controls can be sorted and evaluated accordingly.\nquestions such as ""what are we doing regarding the confidentiality of our data?"" or ""what preventive measures are we taking?"" or ""what contributes to asset management?"" can', metadata={'source': 'ISO 27001_2022_Kersten_und_Schroeder.pdf', 'title': 'ISO 27001_2022_Kersten_und_Schroeder', 'original_text': 'Here, management topics are primarily addressed.\nSecurity Domain\nWhich security domain does the control contribute to? Here: (IT) governance and ecosystem, protection, defense, resilience.\nThese attributes are assigned the following attribute values - in the designation, each starting with #:\nAttributes and attribute values from ISO 27002\nControl Type: #Preventive, #Detective, #Corrective\nInformation Security Property: #Confidentiality, #Integrity, #Availability\nCybersecurity Concept: #Identify, #Protect, #Detect, #Respond, #Recover\nOperational Capability: #Governance, #Asset_management, #Information_\nprotection, #Human_ resource_security, #Physical_\nsecurity, #System_and_network_security, #Applica-\ntion_security, #Secure_configuration, #Identity_and_\naccess_management, #Threat_and_vulnerability_\nmanagement, #Continuity, #Supplier_relationships_\nsecurity, #Legal_and_compliance, #Information_\nsecurity_event_management, #Information_security_\nassurance\nSecurity Domain: #Governance_and_Ecosystem, #Protection, #Defense,\n#Resilience\nEach control from Annex A of the standard has been ""attached"" with the appropriate attribute values according to this scheme in ISO 27002.\nIf all controls are recorded, for example, in a table and the respective attribute values are included, the controls can be sorted and evaluated accordingly.\nQuestions such as ""What are we doing regarding the confidentiality of our data?"" or ""What preventive measures are we taking?"" or ""What contributes to asset management?"" can', 'doc_ID': 2691, 'relevance_score': 0.9635062}), Document(page_content=""to prove that the controls identified in the\nsoa align with the standards outlined in annex a. if the implementation of these controls and appropriate\nbusiness processes operates as expected, an organization is eligible for iso 27001 certification.\nstrongcm 8\niso 27001 controls\nthe controls defined in annex a go beyond the responsibility of it. the\n114 controls sorted into 14 category domains detail security measures\nthat support information asset management best practices across the\norganization, even if the scope of an organization's isms iso 27001\ncertifications is more limited. these 14 domains include:\ninformation security policies\norganization of information security\nhuman resources security\nasset management\naccess control\ncryptography\nphysical and environmental security\noperational security\ncommunications security\nsystem acquisition, development, and maintenance\n“teattihh||\nsupplier relationships\ninformation security incident management\ncompliance\ninformation security aspects of business continuity\nmanagement\ncreating controls for risk management and demonstrating their success is an essential part of achieving iso\n27001 certification. as part of the organization's risk treatment plan, some control objectives must be put in\nplace during the certification process.\nbusinesses explain their choice to use or not use each control in annex a within their soa. however, based on\nthe updated guidelines in iso 21007:2013, there is no express requirement to use the controls suggested in\nannex a."", metadata={'source': 'complete-guide-iso-27001-compliance.pdf', 'title': 'complete-guide-iso-27001-compliance', 'original_text': ""to prove that the controls identified in the\nSoA align with the standards outlined in Annex A. If the implementation of these controls and appropriate\nbusiness processes operates as expected, an organization is eligible for ISO 27001 certification.\nstrongcm 8\nISO 27001 Controls\nThe controls defined in Annex A go beyond the responsibility of IT. The\n114 controls sorted into 14 category domains detail security measures\nthat support information asset management best practices across the\norganization, even if the scope of an organization's ISMS ISO 27001\ncertifications is more limited. These 14 domains include:\nInformation Security Policies\nOrganization of Information Security\nHuman Resources Security\nAsset Management\nAccess Control\nCryptography\nPhysical and Environmental Security\nOperational Security\nCommunications Security\nSystem Acquisition, Development, and Maintenance\n“teattihh||\nSupplier Relationships\nInformation Security Incident Management\nCompliance\nInformation Security Aspects of Business Continuity\nManagement\nCreating controls for risk management and demonstrating their success is an essential part of achieving ISO\n27001 certification. As part of the organization's risk treatment plan, some control objectives must be put in\nplace during the certification process.\nBusinesses explain their choice to use or not use each control in Annex A within their SoA. However, based on\nthe updated guidelines in ISO 21007:2013, there is no express requirement to use the controls suggested in\nAnnex A."", 'doc_ID': 1342, 'relevance_score': 0.9269676})]","The 14 security topics in Appendix A of ISO 27001 (version 2013) are:

1. Information security policies
2. Organization of information security
3. Human resource security
4. Asset management
5. Access control
6. Cryptography
7. Physical and environmental security
8. Operations security
9. Communications security
10. Acquisition, development, and maintenance of information systems
11. Supplier relationships
12. Incident management
13. Business continuity management
14. Compliance with legal, contractual, and regulatory requirements.","The 14 security topics, or domains, included in the appendix of ISO 27001 (version 2013) are: Information security policies, Organization of information security and assignment of responsibility, Human resources security, Asset management, User access control, Encryption and management of sensitive information, Physical and environmental security, Operational security, Communications security, System acquisition, development, and maintenance, Supplier relationships, Information security incident management, Information security aspects of business continuity management, and Compliance. These domains cover a wide range of factors that can impact the security of an organization's information environment, including organizational issues, human resources, IT, physical security, and legal issues. It is not necessary for an organization to implement all of the controls listed in ISO 27001; rather, they can select those that are applicable to their specific needs.",True,0.5226130653266332,0.2944162436548224,0.4723618090452261,0.6254028677940369,0.8070930242538452,0.9999666213989258,0.8567649152862058,0,0,2.2575273513793945,2.7994143962860107,0.22904682159423828,5.056941747665405
Fine-tuned_finetuned-ISO-27001_1024_l2_All_1536_264_False,Hybrid_Rerank_Cohere,4,mixtral-8x7B-v0.1,16000,0,1,What is the purpose of information security policies (A.5) in an organization and how are they defined?,"[Document(page_content=""## **what is an information security policy?**\nan information security policy, often referred to as an _infosec policy_ , is\na set of regulations carefully designed to govern the access, use and\nretention of critical business information. these policies implement a robust\nframework of processes and tools to ensure absolute protection against\nunauthorised access, thereby safeguarding an organisation's sensitive\ninformation assets.\ninformation security policies follow a common structure and format. they\ninclude:\n * a statement describing the types of activities covered by the policy\n * a statement of commitment issued by management, providing evidence that management has assigned sufficient resources to support ongoing compliance with the policy\n * a number of specific responsibilities for employees regarding their use and protection of organisational data. note that most organisations should aim to employ a data protection officer, whose role it is to maintain and implement these changes as well as add solutions to data protection problems.\n## **what is annex a.5?**\nthis annex describes the concepts, requirements and recommendations related to\ninformation security policies. the purpose of this annex is to describe the\nconcepts, requirements and recommendations related to information security\npolicies. it covers policy definition, implementation and review.\nin addition to providing guidance on the implementation of information\nsecurity policies, annex a.5 also addresses how to report on"", metadata={'source': 'https://www.dataguard.co.uk/blog/iso-27001-annex-a5-information-security-policies', 'title': 'ISO 27001 - Annex A.5 - Information Security Policies - DataGuard', 'description': ""Annex A 5 is a set of policies that manage how information is stored and used. Read on to learn more about information security policies and its' benefits. "", 'language': 'en-gb', 'original_text': ""## **What is an information security policy?**\nAn information security policy, often referred to as an _infosec policy_ , is\na set of regulations carefully designed to govern the access, use and\nretention of critical business information. These policies implement a robust\nframework of processes and tools to ensure absolute protection against\nunauthorised access, thereby safeguarding an organisation's sensitive\ninformation assets.\nInformation security policies follow a common structure and format. They\ninclude:\n * A statement describing the types of activities covered by the policy\n * A statement of commitment issued by management, providing evidence that management has assigned sufficient resources to support ongoing compliance with the policy\n * A number of specific responsibilities for employees regarding their use and protection of organisational data. Note that most organisations should aim to employ a data protection officer, whose role it is to maintain and implement these changes as well as add solutions to data protection problems.\n## **What is Annex A.5?**\nThis Annex describes the concepts, requirements and recommendations related to\ninformation security policies. The purpose of this Annex is to describe the\nconcepts, requirements and recommendations related to information security\npolicies. It covers policy definition, implementation and review.\nIn addition to providing guidance on the implementation of information\nsecurity policies, Annex A.5 also addresses how to report on"", 'doc_ID': 443, 'relevance_score': 0.99928474}), Document(page_content='though both are against organisational policy), that could be considered inconsistent enforcement.\n * **integrity:** when assigning system permissions, have the system users got minimum viable access rights, or do they have permissions that could compromise the integrity of the system unnecessarily?\n## **what is the objective of annex a.5?**\nthe purpose of information security policies is to help protect an\norganisation’s assets and operations from risks associated with cybersecurity.\nthey are meant to be flexible enough to cover different types of systems and\ntheir vulnerabilities, as well as multiple modes of operation, such as\ntraditional and cloud-based operations.\ninformation security policies are the documents that define the standards for\ninformation security within an organisation. they can be formal or informal.\nthis annex describes how to develop an information security policy and how to\nimplement it in your organisation.\n## **what are the annex a.5 information security policy controls?**\n### **a.5.1.1 policies for information security**\naccording to iso 27001, all organisations must conduct themselves in a\ntransparent manner with their stakeholders. to protect their data, all\nstakeholders must be informed of the policies in place within the\norganisation.\npolicies play a critical role throughout the whole information security\nprocess. therefore, any policies created by the business must first be\nexamined, authorised, and then communicated to employees and third parties.\nthey must also be', metadata={'source': 'https://www.dataguard.co.uk/blog/iso-27001-annex-a5-information-security-policies', 'title': 'ISO 27001 - Annex A.5 - Information Security Policies - DataGuard', 'description': ""Annex A 5 is a set of policies that manage how information is stored and used. Read on to learn more about information security policies and its' benefits. "", 'language': 'en-gb', 'original_text': 'though both are against organisational policy), that could be considered inconsistent enforcement.\n * **Integrity:** When assigning system permissions, have the system users got minimum viable access rights, or do they have permissions that could compromise the integrity of the system unnecessarily?\n## **What is the objective of Annex A.5?**\nThe purpose of information security policies is to help protect an\norganisation’s assets and operations from risks associated with cybersecurity.\nThey are meant to be flexible enough to cover different types of systems and\ntheir vulnerabilities, as well as multiple modes of operation, such as\ntraditional and cloud-based operations.\nInformation security policies are the documents that define the standards for\ninformation security within an organisation. They can be formal or informal.\nThis Annex describes how to develop an information security policy and how to\nimplement it in your organisation.\n## **What are the Annex A.5 information security policy controls?**\n### **A.5.1.1 Policies for information security**\nAccording to ISO 27001, all organisations must conduct themselves in a\ntransparent manner with their stakeholders. To protect their data, all\nstakeholders must be informed of the policies in place within the\norganisation.\nPolicies play a critical role throughout the whole information security\nprocess. Therefore, any policies created by the business must first be\nexamined, authorised, and then communicated to employees and third parties.\nThey must also be', 'doc_ID': 445, 'relevance_score': 0.9992206}), Document(page_content=""within the\norganisation.\npolicies play a critical role throughout the whole information security\nprocess. therefore, any policies created by the business must first be\nexamined, authorised, and then communicated to employees and third parties.\nthey must also be included in the a.7 human resource security control, and\nthey must be adhered to by all employees.\n### **a.5.1.2 review of the policies for information security**\nto keep updated with any changes, whether internal or external, the\norganisation's isms policies must be updated on a regular basis. management\nchanges, governing laws, industry standards, and technology are examples of\nthese developments.\nthe documentation should always represent standards and procedures to preserve\nthe confidentiality, integrity, and availability of files, and an information\nsecurity breach may result in policy change and improvement.\n## **why is information security policy important for your organisation's\ninformation security management?**\nan information security policy helps your organisation classify your\norganisations' sensitive data. this depends in part on applicable regulations,\nbut it should also take into account any external factors that could affect\nrisk perception, such as industry competition or geopolitical climate change.\ninformation classifications can range from low (confidential) through medium\n(secret), high (top secret), even top secret plus or beyond top secret. the\nexact terms used may vary slightly depending on which agency or company"", metadata={'description': ""Annex A 5 is a set of policies that manage how information is stored and used. Read on to learn more about information security policies and its' benefits. "", 'doc_ID': 446, 'language': 'en-gb', 'original_text': ""within the\norganisation.\nPolicies play a critical role throughout the whole information security\nprocess. Therefore, any policies created by the business must first be\nexamined, authorised, and then communicated to employees and third parties.\nThey must also be included in the A.7 human resource security control, and\nthey must be adhered to by all employees.\n### **A.5.1.2 Review of the policies for information security**\nTo keep updated with any changes, whether internal or external, the\norganisation's ISMS policies must be updated on a regular basis. Management\nchanges, governing laws, industry standards, and technology are examples of\nthese developments.\nThe documentation should always represent standards and procedures to preserve\nthe confidentiality, integrity, and availability of files, and an information\nsecurity breach may result in policy change and improvement.\n## **Why is information security policy important for your organisation's\ninformation security management?**\nAn information security policy helps your organisation classify your\norganisations' sensitive data. This depends in part on applicable regulations,\nbut it should also take into account any external factors that could affect\nrisk perception, such as industry competition or geopolitical climate change.\nInformation classifications can range from low (confidential) through medium\n(secret), high (top secret), even top secret plus or beyond top secret. The\nexact terms used may vary slightly depending on which agency or company"", 'source': 'https://www.dataguard.co.uk/blog/iso-27001-annex-a5-information-security-policies', 'title': 'ISO 27001 - Annex A.5 - Information Security Policies - DataGuard', 'relevance_score': 0.9979888}), Document(page_content=""iso 27001 controls and objectives for version 2015\na.5 security policy (80 27001:2015, version 2015)\na.5.1 information security policy (\\so 27001:2015, version 2015)\nobjective: to provide management direction and support for information security in\naccordance with business requirements and relevant laws and regulations.\na.5.1.1 information security policy document\ncontrol\nan information security policy document shall be approved by management, and\npublished and communicated to all employees and relevant external parties.\na.5.1.2 review of the information security policy\ncontrol\nthe information security policy shall be reviewed at planned intervals or if significant\nchanges occur to ensure its continuing suitability, adequacy, and effectiveness.\na.6 organization of information security (1so 27001:2015, version 2015)\na.6.1 internal organization ('$0 27001:2015, version 2015)\nobjective: to manage information security within the organization.\na.6.1.1 management commitment to information security\ncontrol\nmanagement shall actively support security within the organization through clear\ndirection, demonstrated commitment, explicit assignment, and acknowledgment of\ninformation security responsibilities.\na.6.1.2 information security coordination\ncontrol\ninformation security activities shall be co-ordinated by representatives from different\nparts of the organization with relevant roles and job functions.\na.6.1.3 allocation of information security responsibilities\ncontrol\nall information security"", metadata={'doc_ID': 1407, 'original_text': ""ISO 27001 Controls and Objectives for version 2015\nA.5 Security policy (80 27001:2015, version 2015)\nA.5.1 Information security policy (\\so 27001:2015, Version 2015)\nObjective: To provide management direction and support for information security in\naccordance with business requirements and relevant laws and regulations.\nA.5.1.1 Information security policy document\nControl\nAn information security policy document shall be approved by management, and\npublished and communicated to all employees and relevant external parties.\nA.5.1.2 Review of the information security policy\nControl\nThe information security policy shall be reviewed at planned intervals or if significant\nchanges occur to ensure its continuing suitability, adequacy, and effectiveness.\nA.6 Organization of information security (1so 27001:2015, Version 2015)\nA.6.1 Internal organization ('$0 27001:2015, Version 2015)\nObjective: To manage information security within the organization.\nA.6.1.1 Management commitment to information security\nControl\nManagement shall actively support security within the organization through clear\ndirection, demonstrated commitment, explicit assignment, and acknowledgment of\ninformation security responsibilities.\nA.6.1.2 Information security coordination\nControl\nInformation security activities shall be co-ordinated by representatives from different\nparts of the organization with relevant roles and job functions.\nA.6.1.3 Allocation of information security responsibilities\nControl\nAll information security"", 'source': 'ISO 27001 Controls and Objectives Annex A.pdf', 'title': 'ISO 27001 Controls and Objectives Annex A', 'relevance_score': 0.99768585})]","Information security policies (A.5) hold great importance in an organization. They serve to depict the overall direction of the organization regarding information security and establish goals and strategies to achieve these objectives. These policies contain fundamental rules and procedures that are applicable within the organization. In addition to a security policy, there are often topic-specific security policies targeting specific audiences, which describe the applicable security rules and measures for a particular subject. Examples of such policies include workplace security practices, virus/malware protection, email security, and access control. The organization is free to create and implement relevant policies.","Information security policies, as described in ISO 27001 Annex A.5, are regulations designed to govern the access, use, and retention of critical business information. They establish a framework of processes and tools to protect sensitive information assets from unauthorized access. The purpose of these policies is to help protect an organization’s assets and operations from cybersecurity risks, covering various systems and modes of operation.

ISO 27001 requires organizations to have approved, published, and communicated information security policies, which should be reviewed at planned intervals or when significant changes occur. The policies should be transparent and communicated to all employees and relevant external parties. Organizations must also coordinate information security activities and assign information security responsibilities.

Information security policies play a critical role in the information security process, providing management direction and support for information security in accordance with business requirements and relevant laws and regulations. They help classify sensitive data and ensure its confidentiality, integrity, and availability. Regular reviews are essential to keep policies up-to-date with internal and external changes, such as management changes, governing laws, industry standards, and technology.",True,0.3873239436619718,0.05673758865248227,0.20422535211267606,0.5183249711990356,0.8308511674404144,0.9991576671600342,0.7014767056592889,0,0,2.5359997749328613,3.285041570663452,0.24004197120666504,5.8210413455963135
Fine-tuned_finetuned-ISO-27001_1024_l2_All_1536_264_False,Hybrid_Rerank_Cohere,4,mixtral-8x7B-v0.1,16000,0,1,What should a guideline for the use of mobile devices in a professional context include?,"[Document(page_content='never be left unattended.\nnotebooks should always be carried as hand luggage and, wherever\npossible, disguised. notebook computers or usb sticks should not be left\nin cabs, on planes or anywhere else — but they often are, and the\norganization needs to think through the consequent risks. possible\ncontrols include placing a limit on the data that can be carried on the c:\ndrive of a notebook, requiring back-ups to a usb stick to be carried out\nat regular intervals, signing up for a web-based incremental back-up\nservice, and limiting the period of time that confidential information can\nbe stored on the notebook. preferably, password protection (including\nscreen savers) should be standard, and confidential information should\nbe encrypted. mobile devices should be backed up regularly, and access\nto both smartphones should be restricted by means of access codes.\n- staff should be trained in how to protect equipment from risks identified\nby the manufacturer, such as electromagnetic fields, and these requirements\nshould be built into the user authorization requirements. while the idea\nof creating rules for handoffs between staff in relation to custody of\nmobile devices seems intellectually interesting, the reality is that devices\nwill be lost or mislaid and, therefore, building remote wipe into the\nmobile device policy may be a more pragmatic solution to this issue than\nan exchanges log.\n« a risk assessment in respect of home working should lead to designation\nof standard — and, where necessary, special — measures,', metadata={'source': 'Watkins, Calder - 2020 - IT Governance - An International Guide to Data Security and ISO 27001 ISO 27002.pdf', 'title': 'Watkins, Calder - 2020 - IT Governance - An International Guide to Data Security and ISO 27001 ISO 27002', 'original_text': 'never be left unattended.\nNotebooks should always be carried as hand luggage and, wherever\npossible, disguised. Notebook computers or USB sticks should not be left\nin cabs, on planes or anywhere else — but they often are, and the\norganization needs to think through the consequent risks. Possible\ncontrols include placing a limit on the data that can be carried on the C:\ndrive of a notebook, requiring back-ups to a USB stick to be carried out\nat regular intervals, signing up for a web-based incremental back-up\nservice, and limiting the period of time that confidential information can\nbe stored on the notebook. Preferably, password protection (including\nscreen savers) should be standard, and confidential information should\nbe encrypted. Mobile devices should be backed up regularly, and access\nto both smartphones should be restricted by means of access codes.\n- Staff should be trained in how to protect equipment from risks identified\nby the manufacturer, such as electromagnetic fields, and these requirements\nshould be built into the user authorization requirements. While the idea\nof creating rules for handoffs between staff in relation to custody of\nmobile devices seems intellectually interesting, the reality is that devices\nwill be lost or mislaid and, therefore, building remote wipe into the\nmobile device policy may be a more pragmatic solution to this issue than\nan exchanges log.\n« A risk assessment in respect of home working should lead to designation\nof standard — and, where necessary, special — measures,', 'doc_ID': 2270, 'relevance_score': 0.9832789}), Document(page_content='(notebooks, smart-\nphones).\nit governance\nthis policy should consolidate all the procedures discussed elsewhere in\nthis manual in respect of mobile computing and handheld usage. it should\nset out clearly the requirements for physical protection, access controls,\ncryptography, back-ups and malware protection. it should include clear\nguidance on how to connect to the organizational network and how mobile\ntools should be used in public places. ‘public places’ include meeting rooms\noutside the organization’s own secure premises and wherever notebooks\nand handhelds remain tempting targets for hackers and thieves, who can\nhave as much impact on the availability of data as a particularly virulent\nvirus. guidance on where mobile devices may be used, and for what\npurposes, should also be provided, with due consideration being given to\nwho may be able to see or hear what is being ‘processed’.\nthe organization will need to develop an effective method of ensuring\nthat anti-malware protection is completely up to date on mobile computers\n(which are also known as ‘endpoints’, reflecting the reality that for many\nnetworks, it is the notebook and mobile devices that exist beyond the secure\ncorporate perimeter that are the endpoint for corporate security activity).\nthis is best done by using an automatic update service that updates all\ncomputers the moment they log on to the organizational network. it is\nimportant that the mobile user is not given any authority to override this\nupdate and is not able to proceed until the', metadata={'source': 'Watkins, Calder - 2020 - IT Governance - An International Guide to Data Security and ISO 27001 ISO 27002.pdf', 'title': 'Watkins, Calder - 2020 - IT Governance - An International Guide to Data Security and ISO 27001 ISO 27002', 'original_text': '(notebooks, smart-\nphones).\nIT GOVERNANCE\nThis policy should consolidate all the procedures discussed elsewhere in\nthis manual in respect of mobile computing and handheld usage. It should\nset out clearly the requirements for physical protection, access controls,\ncryptography, back-ups and malware protection. It should include clear\nguidance on how to connect to the organizational network and how mobile\ntools should be used in public places. ‘Public places’ include meeting rooms\noutside the organization’s own secure premises and wherever notebooks\nand handhelds remain tempting targets for hackers and thieves, who can\nhave as much impact on the availability of data as a particularly virulent\nvirus. Guidance on where mobile devices may be used, and for what\npurposes, should also be provided, with due consideration being given to\nwho may be able to see or hear what is being ‘processed’.\nThe organization will need to develop an effective method of ensuring\nthat anti-malware protection is completely up to date on mobile computers\n(which are also known as ‘endpoints’, reflecting the reality that for many\nnetworks, it is the notebook and mobile devices that exist beyond the secure\ncorporate perimeter that are the endpoint for corporate security activity).\nThis is best done by using an automatic update service that updates all\ncomputers the moment they log on to the organizational network. It is\nimportant that the mobile user is not given any authority to override this\nupdate and is not able to proceed until the', 'doc_ID': 2079, 'relevance_score': 0.94407386}), Document(page_content='their controls as necessary to its business operations.\n¢ mobile devices given to employees/contractors must be registered.\nthis helps ensure that only registered devices are using your office\nnetwork and the information is accessed from a known device only. it\nis possible when organizations are monitoring them.\ne employees should not be allowed to install software on these\ndevices on their own, as this could pose an information security risk.\nrequired software must be installed by an authorized individual,\nsuch as a member of the it helpdesk team. it is advisable to disable\ninstallation by anyone else.\ne ensure that security patches are updated on these devices on time.\ndevices that could not be patched must be tracked and updated as\nsoon as possible.\n128\nchapter 6 execution\ne these devices must be automatically locked out when unattended for a\nfew minutes and must be password protected. they must use a phone\nscreen lock password or a folder password. if they are stolen or lost,\nunauthorized people should not be able to gain access to these devices.\ne ensure that antivirus software is running on these devices so that a\nregular scan can be performed on the device to detect any virus or\nmalware.\ne regular backups are also performed so that information can be\nretrieved in any unexpected incident.\ne the policy must also explain what employees should do to report an\nincident (stolen or lost phone) to the it helpdesk team and to their\nimmediate supervisors, so that they can also take steps to minimize\nthe', metadata={'doc_ID': 1142, 'original_text': 'their controls as necessary to its business operations.\n¢ Mobile devices given to employees/contractors must be registered.\nThis helps ensure that only registered devices are using your office\nnetwork and the information is accessed from a known device only. It\nis possible when organizations are monitoring them.\ne Employees should not be allowed to install software on these\ndevices on their own, as this could pose an information security risk.\nRequired software must be installed by an authorized individual,\nsuch as a member of the IT Helpdesk team. It is advisable to disable\ninstallation by anyone else.\ne Ensure that security patches are updated on these devices on time.\nDevices that could not be patched must be tracked and updated as\nsoon as possible.\n128\nCHAPTER 6 EXECUTION\ne These devices must be automatically locked out when unattended for a\nfew minutes and must be password protected. They must use a phone\nscreen lock password or a folder password. If they are stolen or lost,\nunauthorized people should not be able to gain access to these devices.\ne Ensure that antivirus software is running on these devices so that a\nregular scan can be performed on the device to detect any virus or\nmalware.\ne Regular backups are also performed so that information can be\nretrieved in any unexpected incident.\ne The policy must also explain what employees should do to report an\nincident (stolen or lost phone) to the IT Helpdesk team and to their\nimmediate supervisors, so that they can also take steps to minimize\nthe', 'source': 'Chopra, Chaudhary - 2020 - Implementing an Information Security Management System - Security Management Based On ISO 27001.pdf', 'title': 'Chopra, Chaudhary - 2020 - Implementing an Information Security Management System - Security Management Based On ISO 27001', 'relevance_score': 0.9428234}), Document(page_content='ensure that no assets — equip-\nment, information or software - are removed from its premises without\nauthorization. this is clearly a basic control that is useful in deterring theft\nof assets. the procedure for obtaining authorization (and the identity of\nthose where are empowered to provide authorization) should be clearly laid\nout in the isms, and the steps that are required should be proportionate to\nthe sensitivity or value of the asset. valuable assets should be logged out of\nthe premises and logged back in again; staff who are regularly carrying valu-\nable assets in and out (such as notebook computers) should perhaps have\nwritten authority to do so, which they should carry with them at all times\nand be able to provide on challenge. of course, the proliferation of mobile\ndevices may mean that a number of individuals are issued with them as part\nof their basic employment contract and, therefore, some more sophisticated\nmethod of tagging might be required. it has to be recognized that, in detail,\nthe guidance of iso27002 is difficult to apply in an environment where\nmobile devices are ubiquitous; smart organizations will want to consider\noptions for tagging mobile devices to identify cards. spot checks should take\nplace to detect unauthorized removals, and all staff and contractors should\nbe made aware of this policy and that breach of it may be considered a disci-\nplinary matter, perhaps involving the police. remote workers who have\ncompany assets at home should be required annually to endorse an', metadata={'source': 'Watkins, Calder - 2020 - IT Governance - An International Guide to Data Security and ISO 27001 ISO 27002.pdf', 'title': 'Watkins, Calder - 2020 - IT Governance - An International Guide to Data Security and ISO 27001 ISO 27002', 'original_text': 'ensure that no assets — equip-\nment, information or software - are removed from its premises without\nauthorization. This is clearly a basic control that is useful in deterring theft\nof assets. The procedure for obtaining authorization (and the identity of\nthose where are empowered to provide authorization) should be clearly laid\nout in the ISMS, and the steps that are required should be proportionate to\nthe sensitivity or value of the asset. Valuable assets should be logged out of\nthe premises and logged back in again; staff who are regularly carrying valu-\nable assets in and out (such as notebook computers) should perhaps have\nwritten authority to do so, which they should carry with them at all times\nand be able to provide on challenge. Of course, the proliferation of mobile\ndevices may mean that a number of individuals are issued with them as part\nof their basic employment contract and, therefore, some more sophisticated\nmethod of tagging might be required. It has to be recognized that, in detail,\nthe guidance of ISO27002 is difficult to apply in an environment where\nmobile devices are ubiquitous; smart organizations will want to consider\noptions for tagging mobile devices to identify cards. Spot checks should take\nplace to detect unauthorized removals, and all staff and contractors should\nbe made aware of this policy and that breach of it may be considered a disci-\nplinary matter, perhaps involving the police. Remote workers who have\ncompany assets at home should be required annually to endorse an', 'doc_ID': 2268, 'relevance_score': 0.94250673})]","A guideline for the use of mobile devices in a professional context should include the following:

- Determination of whether the professional use of personal mobile devices (BYOD) is allowed
- Regulations regarding the private use of organization-owned mobile devices
- Guidelines for procurement, configuration, and issuance of mobile devices
- Clarification of software licensing issues and restrictions on configuration changes
- Regulations regarding the use of organization-owned devices by third parties
- Obligation to report suspected misuse or loss of a device
- Measures for theft protection
- Obligation to apply cryptographic procedures
- Rules for backup, restore, online synchronization, and antivirus protection
- Prohibition of using unsecured Wi-Fi and hotspots","A guideline for the use of mobile devices in a professional context should include measures to ensure physical protection, access controls, cryptography, back-ups, and malware protection. Mobile devices should be password protected and encrypted to secure confidential information. It is also important to limit the data that can be carried on mobile devices and regularly back-up data. Mobile devices should be connected to the organizational network securely, and their usage in public places should be restricted. Anti-malware protection should be up-to-date, and unauthorized software installation should not be allowed. Security patches should be updated regularly, and devices must be automatically locked out when unattended. Antivirus software should be installed, and regular backups should be performed. A policy should be in place to report any incidents, such as stolen or lost devices, to minimize potential damage. Additionally, mobile devices should be registered, and their removal from the premises should require authorization to prevent theft.",True,0.34220532319391633,0.13026819923371646,0.24334600760456274,0.5613623261451721,0.9651668816804886,0.9999650716781616,0.7747122630137722,0,0,2.2767324447631836,2.8773128986358643,0.2370011806488037,5.154045343399048
Fine-tuned_finetuned-ISO-27001_1024_l2_All_1536_264_False,Hybrid_Rerank_Cohere,4,mixtral-8x7B-v0.1,16000,0,1,How does ISO 27001 certification ensure the security of employees and contractors in terms of their responsibilities and roles?,"[Document(page_content='version 2015)\nobjective: to ensure that employees, contractors and third party users understand their\nresponsibilities, and are suitable for the roles they are considered for, and to reduce the\nrisk of theft, fraud or misuse of facilities.\na.8.1.1\nroles and responsibilities\ncontrol\nsecurity roles and responsibilities of employees, contractors and third party users shall be\ndefined and documented in accordance with the organization’s information security\npolicy.\na.8.1.2\nscreening\ncontrol\nbackground verification checks on all candidates for employment, contractors, and third\nparty users shall be carried out in accordance with relevant laws, regulations and ethics,\nand proportional to the business requirements, the classification of the information to be\naccessed, and the perceived risks.\na.8.1.3 terms and conditions of employment\ncontrol\nas part of their contractual obligation, employees, contractors and third party users shall\nagree and sign the terms and conditions of their employment contract, which shall state\ntheir and the organization’s responsibilities for information security.\na. 8.2 during employment (iso 27001:2015, version 2015)\nobjective: to ensure that all employees, contractors and third party users are aware of\ninformation security threats and concerns, their responsibilities and liabilities, and are\nequipped to support organizational security policy in the course of their normal work, and\nto reduce the risk of human error.\na.8.2.1\nmanagement responsibilities\ncontrol\nmanagement', metadata={'source': 'ISO 27001 Controls and Objectives Annex A.pdf', 'title': 'ISO 27001 Controls and Objectives Annex A', 'original_text': 'Version 2015)\nObjective: To ensure that employees, contractors and third party users understand their\nresponsibilities, and are suitable for the roles they are considered for, and to reduce the\nrisk of theft, fraud or misuse of facilities.\nA.8.1.1\nRoles and responsibilities\nControl\nSecurity roles and responsibilities of employees, contractors and third party users shall be\ndefined and documented in accordance with the organization’s information security\npolicy.\nA.8.1.2\nScreening\nControl\nBackground verification checks on all candidates for employment, contractors, and third\nparty users shall be carried out in accordance with relevant laws, regulations and ethics,\nand proportional to the business requirements, the classification of the information to be\naccessed, and the perceived risks.\nA.8.1.3 Terms and conditions of employment\nControl\nAs part of their contractual obligation, employees, contractors and third party users shall\nagree and sign the terms and conditions of their employment contract, which shall state\ntheir and the organization’s responsibilities for information security.\nA. 8.2 During employment (ISO 27001:2015, Version 2015)\nObjective: To ensure that all employees, contractors and third party users are aware of\ninformation security threats and concerns, their responsibilities and liabilities, and are\nequipped to support organizational security policy in the course of their normal work, and\nto reduce the risk of human error.\nA.8.2.1\nManagement responsibilities\nControl\nManagement', 'doc_ID': 1411, 'relevance_score': 0.9989267}), Document(page_content='they will check\nwhether all the terms and conditions are stated clearly and completely.\na.7.2 during employment\nobjective: to ensure that employees and contractors are aware of and fulfill their\ninformation security responsibilities.\nexplanation: employees are fully aware of the threats to their data that occur during\ntheir daily job activities and understand their responsibilities to mitigate these threats.\na.7.2.1 management responsibilities (iso 27001 control)\nmanagement should require all employees and contractors to follow the information\nsecurity guidelines in accordance with the established policies and procedures of the\norganization.\nexplanation/what is required: this control requires management to communicate\nto employees and contractors the standard operating procedures to ensure that security\npractices are implemented accordingly.\nevidence that can be prepared: communication emails, minutes of the meeting,\nand signed/approved policies and procedures.\nwho prepares it: an email from management, and the minutes of a meeting to be\nmaintained by the information security team. the information security department\nshould also maintain signed hard copies of approved policies and procedures and scan\nsoft copies to be maintained as a backup.\nfor external audit: the external auditor conducting the iso 27001 certification\naudit will check for the evidence.\n133\nchapter 6 execution\na.7.2.2 information security awareness, education, and training (iso\n27001 control)\nall employees of the organization', metadata={'source': 'Chopra, Chaudhary - 2020 - Implementing an Information Security Management System - Security Management Based On ISO 27001.pdf', 'title': 'Chopra, Chaudhary - 2020 - Implementing an Information Security Management System - Security Management Based On ISO 27001', 'original_text': 'they will check\nwhether all the terms and conditions are stated clearly and completely.\nA.7.2 During Employment\nObjective: To ensure that employees and contractors are aware of and fulfill their\ninformation security responsibilities.\nExplanation: Employees are fully aware of the threats to their data that occur during\ntheir daily job activities and understand their responsibilities to mitigate these threats.\nA.7.2.1 Management Responsibilities (ISO 27001 Control)\nManagement should require all employees and contractors to follow the information\nsecurity guidelines in accordance with the established policies and procedures of the\norganization.\nExplanation/what is required: This control requires management to communicate\nto employees and contractors the standard operating procedures to ensure that security\npractices are implemented accordingly.\nEvidence that can be prepared: Communication emails, minutes of the meeting,\nand signed/approved policies and procedures.\nWho prepares it: An email from management, and the minutes of a meeting to be\nmaintained by the information security team. The information security department\nshould also maintain signed hard copies of approved policies and procedures and scan\nsoft copies to be maintained as a backup.\nFor external audit: The external auditor conducting the ISO 27001 certification\naudit will check for the evidence.\n133\nCHAPTER 6 EXECUTION\nA.7.2.2 Information Security Awareness, Education, and Training (ISO\n27001 Control)\nAll employees of the organization', 'doc_ID': 1149, 'relevance_score': 0.9983515}), Document(page_content='# iso 27001 clause 5.3: organisational roles, responsibilities and authorities\nclause 5.3 of iso 27001 addresses the organisational roles, responsibilities,\nand authorities (or&as) for information security. this clause requires\norganisations to define and assign the or&as for all aspects of their isms.\n### iso 27001:2022 clause 5.3 organisational roles, responsibilities and\nauthorities top management shall ensure that the responsibilities and authorities for\nroles relevant to information security are assigned and communicated within\nthe organisation.\n### top management shall assign the responsibility and authority for:\n * ensuring that the information security management system conforms to the requirements of this document. * reporting on the performance of the information security management system to top management. ## what is the 5th clause of iso 27001?\nthe 5th clause of iso 27001 is titled ""management responsibility"". this clause\nrequires organisations to demonstrate leadership and commitment to information\nsecurity. it also requires organisations to appoint a management\nrepresentative to oversee the implementation and maintenance of the isms.\n### get iso 27001 certified in as little as 3 months.\n### your iso 27001 certification process made simple.\n* * *\n download your free guide to fast & sustainable certification\ndownload your free guide\n## what are the requirements of iso 27001 clause 5.3?\nthe specific requirements of iso 27001 clause 5.3 are as follows:\n * top', metadata={'source': 'https://www.dataguard.co.uk/knowledge/iso-27001/clause-5-3-organisational-roles-responsibilities-and-authorities/', 'title': 'ISO 27001 Clause 5.3: Roles, Responsibilities and Authorities', 'description': 'ISO 27001 Clause 5.3 defines the requirements for defining and assigning organisational roles, responsibilities, and authorities for information security.', 'language': 'en-gb', 'original_text': '# ISO 27001 Clause 5.3: Organisational roles, responsibilities and authorities\nClause 5.3 of ISO 27001 addresses the organisational roles, responsibilities,\nand authorities (OR&As) for information security. This clause requires\norganisations to define and assign the OR&As for all aspects of their ISMS.\n### ISO 27001:2022 Clause 5.3 Organisational roles, responsibilities and\nauthorities Top management shall ensure that the responsibilities and authorities for\nroles relevant to information security are assigned and communicated within\nthe organisation.\n### Top management shall assign the responsibility and authority for:\n * Ensuring that the information security management system conforms to the requirements of this document. * Reporting on the performance of the information security management system to top management. ## What is the 5th clause of ISO 27001?\nThe 5th clause of ISO 27001 is titled ""Management Responsibility"". This clause\nrequires organisations to demonstrate leadership and commitment to information\nsecurity. It also requires organisations to appoint a management\nrepresentative to oversee the implementation and maintenance of the ISMS.\n### Get ISO 27001 certified in as little as 3 months.\n### Your ISO 27001 certification process made simple.\n* * *\n Download your free guide to fast & sustainable certification\nDownload your free guide\n## What are the requirements of ISO 27001 Clause 5.3?\nThe specific requirements of ISO 27001 Clause 5.3 are as follows:\n * Top', 'doc_ID': 221, 'relevance_score': 0.996557}), Document(page_content='license/accounts.\ne list of current users who have vpn access.\ne list of incidents and actions that were taken.\nwho prepares it: the it helpdesk team, with the help of the information security\nteam, creates the policy. the it helpdesk team also:\ne creates and maintains the list of vpn license/accounts and the list of\nusers who have vpn access.\ne maintains the list of incidents and actions.\na.7 human resources security\na.7.1 prior to employment\nobjective: to ensure that employees and contractors understand their responsibilities\nand are suited to the roles for which they are considered.\n130\nchapter 6 execution\nexplanation: before new employees and contractors get access to company\ninformation and assets, it becomes an important duty of the organization to make them\naware of their work-related responsibilities and the safety measures they need to follow.\nit also is important that people are assigned to the right roles in terms of having the\nrelevant skills, experience, and education.\nthe goal is to prevent employees or contractors from stealing company information\nor assets or sharing them with competitors for personal gain. the following sections\ncover the controls that fall under human resources-related security.\na.7.1.1: screening (iso 27001 control)\ncarry out background verification on all candidates for employment in accordance\nwith relevant laws, regulations, and ethics. these checks should be proportional to the\nbusiness requirements, the classification of the information to be accessed, and', metadata={'source': 'Chopra, Chaudhary - 2020 - Implementing an Information Security Management System - Security Management Based On ISO 27001.pdf', 'title': 'Chopra, Chaudhary - 2020 - Implementing an Information Security Management System - Security Management Based On ISO 27001', 'original_text': 'license/accounts.\ne List of current users who have VPN access.\ne List of incidents and actions that were taken.\nWho prepares it: The IT Helpdesk team, with the help of the information security\nteam, creates the policy. The IT Helpdesk team also:\ne Creates and maintains the list of VPN license/accounts and the list of\nusers who have VPN access.\ne Maintains the list of incidents and actions.\nA.7 Human Resources Security\nA.7.1 Prior to Employment\nObjective: To ensure that employees and contractors understand their responsibilities\nand are suited to the roles for which they are considered.\n130\nCHAPTER 6 EXECUTION\nExplanation: Before new employees and contractors get access to company\ninformation and assets, it becomes an important duty of the organization to make them\naware of their work-related responsibilities and the safety measures they need to follow.\nIt also is important that people are assigned to the right roles in terms of having the\nrelevant skills, experience, and education.\nThe goal is to prevent employees or contractors from stealing company information\nor assets or sharing them with competitors for personal gain. The following sections\ncover the controls that fall under human resources-related security.\nA.7.1.1: Screening (ISO 27001 Control)\nCarry out background verification on all candidates for employment in accordance\nwith relevant laws, regulations, and ethics. These checks should be proportional to the\nbusiness requirements, the classification of the information to be accessed, and', 'doc_ID': 1145, 'relevance_score': 0.99648935})]","ISO 27001 certification ensures the security of employees and contractors in terms of their responsibilities and roles by prescribing specific controls and measures. For example, control A.7.1.1 requires a security screening of all individuals applying for employment. This screening must be in accordance with relevant laws, regulations, and ethical principles, and be appropriate to the business requirements, classification of information to be obtained, and perceived risks. It is important that applicants are sufficiently qualified for their tasks and understand their responsibilities. Such screening may include various aspects such as identity verification, verification of education and qualifications, background checks, etc. For personnel provided by contractors, the screening can be done in collaboration with the contractor. It is also important to ensure that the screenings are conducted in accordance with legal requirements and that the information obtained is appropriate for the purpose of the screening.","ISO 27001 certification, under the sections A.8.1 and A.8.2, provides a framework to ensure the security of employees and contractors in terms of their responsibilities and roles. Before employment, background verification checks are conducted to ensure the suitability of candidates for the roles they are considered for (A.8.1.2). Once employed, the roles and responsibilities of employees, contractors, and third-party users are defined and documented according to the organization's information security policy (A.8.1.1). Employees, contractors, and third-party users must sign the terms and conditions of their employment contract, which states their and the organization's responsibilities for information security (A.8.1.3). During employment, management ensures that employees and contractors are aware of information security threats and concerns, their responsibilities and liabilities, and are equipped to support the organizational security policy in their daily job activities (A.8.2). Management should communicate standard operating procedures to ensure that security practices are implemented accordingly (A.7.2.1). ISO 27001 Clause 5.3 also requires organizations to define and assign the roles, responsibilities, and",True,0.4216867469879518,0.14545454545454545,0.2530120481927711,0.4028059244155884,0.6949028670787811,0.9997825026512146,0.7538863923274701,0,0,2.80029034614563,3.569993019104004,0.2705085277557373,6.370283365249634
Fine-tuned_finetuned-ISO-27001_1024_l2_All_1536_264_False,Hybrid_Rerank_Cohere,4,mixtral-8x7B-v0.1,16000,0,1,What activities does control A.7.2.2 include to create adequate awareness among employees?,"[Document(page_content='7.2 and 7.3 of the standard and control a.7.2 (information secu-\nrity awareness and training) require the organization to ensure that its\nemployees and contractors are aware of information security threats as well\nas their responsibilities and liabilities, and that it has appropriately compe-\ntent personnel. the objective of this clause is simply to ensure that all users\nof the organization’s information assets, or those who are assigned respon-\nsibilities in the isms, are aware of information security threats and are\ncompetent and adequately equipped to perform the requested tasks and to\nsupport the organization’s information security policy in their work.\ncontrol a.7.2.2 deals with information security awareness, education\nand training, and follows on from the previous control. all employees of the\norganization (including contractors) must receive appropriate awareness\ntraining and other training, as well as regular updates and communications.\ntraditional training, which relies on someone delivering subject matter\nfrom the front of the classroom, is not a particularly effective method of\nensuring that all of a large number of employees acquire the information,\nskills or knowledge that are needed. it is certainly not a method that reliably\ndemonstrates that this requirement of the standard has been met. the best\nway of delivering information security staff awareness training is via e-learn-\ning that is run on a recognized learning management system (lms) or in a\ncloud-based environment, supported by a range', metadata={'source': 'Watkins, Calder - 2020 - IT Governance - An International Guide to Data Security and ISO 27001 ISO 27002.pdf', 'title': 'Watkins, Calder - 2020 - IT Governance - An International Guide to Data Security and ISO 27001 ISO 27002', 'original_text': '7.2 and 7.3 of the standard and control A.7.2 (information secu-\nrity awareness and training) require the organization to ensure that its\nemployees and contractors are aware of information security threats as well\nas their responsibilities and liabilities, and that it has appropriately compe-\ntent personnel. The objective of this clause is simply to ensure that all users\nof the organization’s information assets, or those who are assigned respon-\nsibilities in the ISMS, are aware of information security threats and are\ncompetent and adequately equipped to perform the requested tasks and to\nsupport the organization’s information security policy in their work.\nControl A.7.2.2 deals with information security awareness, education\nand training, and follows on from the previous control. All employees of the\norganization (including contractors) must receive appropriate awareness\ntraining and other training, as well as regular updates and communications.\nTraditional training, which relies on someone delivering subject matter\nfrom the front of the classroom, is not a particularly effective method of\nensuring that all of a large number of employees acquire the information,\nskills or knowledge that are needed. It is certainly not a method that reliably\ndemonstrates that this requirement of the standard has been met. The best\nway of delivering information security staff awareness training is via e-learn-\ning that is run on a recognized learning management system (LMS) or in a\ncloud-based environment, supported by a range', 'doc_ID': 2105, 'relevance_score': 0.9950177}), Document(page_content='external audit: the external auditor conducting the iso 27001 certification\naudit will check for the evidence.\n133\nchapter 6 execution\na.7.2.2 information security awareness, education, and training (iso\n27001 control)\nall employees of the organization and, when relevant, contractors should receive\nappropriate awareness training and regular updates to organizational policies and\nprocedures, as relevant to their job function.\nexplanation/what is required: information security awareness sessions should\nbe planned and conducted for all the employees, including your support staff, such as\ncleaners, security guards, etc. whenever any changes/updates take place to any of the\npolicies or standard operating procedures, employees must be made aware of them.\nthese awareness sessions must be conducted for contractors and third-party users as\nwell, as they also pose risks to information security.\nawareness helps reduce security risks, so these awareness sessions must be\nconducted on a regular basis and should be a mandatory part of the new hire induction\nprogram.\nevidence that can be prepared: attendance records of participants/employees who\nattended the awareness sessions. feedback forms and records of any quizzes.\nwho prepares it: awareness sessions are conducted by the information security\ndepartment. whenever sessions are conducted, attendance records need to be\nmaintained.\nfor external audit: the external auditor conducting the iso 27001 certification\naudit will check for the records of the awareness', metadata={'source': 'Chopra, Chaudhary - 2020 - Implementing an Information Security Management System - Security Management Based On ISO 27001.pdf', 'title': 'Chopra, Chaudhary - 2020 - Implementing an Information Security Management System - Security Management Based On ISO 27001', 'original_text': 'external audit: The external auditor conducting the ISO 27001 certification\naudit will check for the evidence.\n133\nCHAPTER 6 EXECUTION\nA.7.2.2 Information Security Awareness, Education, and Training (ISO\n27001 Control)\nAll employees of the organization and, when relevant, contractors should receive\nappropriate awareness training and regular updates to organizational policies and\nprocedures, as relevant to their job function.\nExplanation/what is required: Information security awareness sessions should\nbe planned and conducted for all the employees, including your support staff, such as\ncleaners, security guards, etc. Whenever any changes/updates take place to any of the\npolicies or standard operating procedures, employees must be made aware of them.\nThese awareness sessions must be conducted for contractors and third-party users as\nwell, as they also pose risks to information security.\nAwareness helps reduce security risks, so these awareness sessions must be\nconducted on a regular basis and should be a mandatory part of the new hire induction\nprogram.\nEvidence that can be prepared: Attendance records of participants/employees who\nattended the awareness sessions. Feedback forms and records of any quizzes.\nWho prepares it: Awareness sessions are conducted by the information security\ndepartment. Whenever sessions are conducted, attendance records need to be\nmaintained.\nFor external audit: The external auditor conducting the ISO 27001 certification\naudit will check for the records of the awareness', 'doc_ID': 1150, 'relevance_score': 0.9829547}), Document(page_content='a controlling\nownership stake in an outside company and replaces its existing management\nteam.\nadditionally, it is the responsibility of managers to ensure that security\nawareness and conscientiousness are maintained across the organisation and to\nbuild an acceptable ""security culture.""\n#### **a.7.2.2: information security awareness, education and training**\nall workers and, where necessary, contractors should get adequate awareness,\neducation and training, and frequent updates on organisational rules and\nprocedures.\nthe training and awareness must be presented in a way that your employees and\ncontractors have the best chance of understanding and following it. this\nentails paying attention to the content and the medium for delivery. this is\nimportant because auditors would want proof of your training and compliance.\n#### **a.7.2.3: disciplinary process**\nemployees who have violated company information security policies face\ndisciplinary action under a well-defined and stated disciplinary procedure.\nto begin the disciplinary procedure, it must be established that an\ninformation security breach has happened first. employees who are accused of\ncommitting data security breaches should undergo a formal disciplinary\nprocedure to guarantee that they are treated fairly.\n#### **a.7.3.1: termination or change of employment responsibilities**\nthe employee\'s or contractor\'s terms and conditions of employment should\ninclude any responsibilities or tasks that remain in place after the employee\nor contractor\'s', metadata={'source': 'https://www.dataguard.co.uk/blog/iso-27001-annex-a.7-human-resource-security/', 'title': 'ISO 27001 - Annex A.7 - Human Resource Security - DataGuard', 'description': 'Annex A 7 provides guidance to human resource security compliance that is required in InfoSec. Learn more about its benefits and implementation process.', 'language': 'en-gb', 'original_text': 'a controlling\nownership stake in an outside company and replaces its existing management\nteam.\nAdditionally, it is the responsibility of managers to ensure that security\nawareness and conscientiousness are maintained across the organisation and to\nbuild an acceptable ""security culture.""\n#### **A.7.2.2: Information security awareness, education and training**\nAll workers and, where necessary, contractors should get adequate awareness,\neducation and training, and frequent updates on organisational rules and\nprocedures.\nThe training and awareness must be presented in a way that your employees and\ncontractors have the best chance of understanding and following it. This\nentails paying attention to the content and the medium for delivery. This is\nimportant because auditors would want proof of your training and compliance.\n#### **A.7.2.3: Disciplinary process**\nEmployees who have violated company information security policies face\ndisciplinary action under a well-defined and stated disciplinary procedure.\nTo begin the disciplinary procedure, it must be established that an\ninformation security breach has happened first. Employees who are accused of\ncommitting data security breaches should undergo a formal disciplinary\nprocedure to guarantee that they are treated fairly.\n#### **A.7.3.1: Termination or change of employment responsibilities**\nThe employee\'s or contractor\'s terms and conditions of employment should\ninclude any responsibilities or tasks that remain in place after the employee\nor contractor\'s', 'doc_ID': 459, 'relevance_score': 0.9802431}), Document(page_content='they will check\nwhether all the terms and conditions are stated clearly and completely.\na.7.2 during employment\nobjective: to ensure that employees and contractors are aware of and fulfill their\ninformation security responsibilities.\nexplanation: employees are fully aware of the threats to their data that occur during\ntheir daily job activities and understand their responsibilities to mitigate these threats.\na.7.2.1 management responsibilities (iso 27001 control)\nmanagement should require all employees and contractors to follow the information\nsecurity guidelines in accordance with the established policies and procedures of the\norganization.\nexplanation/what is required: this control requires management to communicate\nto employees and contractors the standard operating procedures to ensure that security\npractices are implemented accordingly.\nevidence that can be prepared: communication emails, minutes of the meeting,\nand signed/approved policies and procedures.\nwho prepares it: an email from management, and the minutes of a meeting to be\nmaintained by the information security team. the information security department\nshould also maintain signed hard copies of approved policies and procedures and scan\nsoft copies to be maintained as a backup.\nfor external audit: the external auditor conducting the iso 27001 certification\naudit will check for the evidence.\n133\nchapter 6 execution\na.7.2.2 information security awareness, education, and training (iso\n27001 control)\nall employees of the organization', metadata={'source': 'Chopra, Chaudhary - 2020 - Implementing an Information Security Management System - Security Management Based On ISO 27001.pdf', 'title': 'Chopra, Chaudhary - 2020 - Implementing an Information Security Management System - Security Management Based On ISO 27001', 'original_text': 'they will check\nwhether all the terms and conditions are stated clearly and completely.\nA.7.2 During Employment\nObjective: To ensure that employees and contractors are aware of and fulfill their\ninformation security responsibilities.\nExplanation: Employees are fully aware of the threats to their data that occur during\ntheir daily job activities and understand their responsibilities to mitigate these threats.\nA.7.2.1 Management Responsibilities (ISO 27001 Control)\nManagement should require all employees and contractors to follow the information\nsecurity guidelines in accordance with the established policies and procedures of the\norganization.\nExplanation/what is required: This control requires management to communicate\nto employees and contractors the standard operating procedures to ensure that security\npractices are implemented accordingly.\nEvidence that can be prepared: Communication emails, minutes of the meeting,\nand signed/approved policies and procedures.\nWho prepares it: An email from management, and the minutes of a meeting to be\nmaintained by the information security team. The information security department\nshould also maintain signed hard copies of approved policies and procedures and scan\nsoft copies to be maintained as a backup.\nFor external audit: The external auditor conducting the ISO 27001 certification\naudit will check for the evidence.\n133\nCHAPTER 6 EXECUTION\nA.7.2.2 Information Security Awareness, Education, and Training (ISO\n27001 Control)\nAll employees of the organization', 'doc_ID': 1149, 'relevance_score': 0.9763557})]","Control A.7.2.2 requires that all employees and, if applicable, contractors are adequately informed about the organization's policies and procedures. This is done through raising awareness, education, training and regular updates. Awareness aims to make employees aware of potentially overlooked security issues and explain their impact on the organization. Training imparts solutions, with a focus on a comprehensive understanding of existing regulations and measures. Particularly for critical and complex tasks, practical exercises must be conducted, not just information dissemination. Changes to requirements and measures, as well as current security incidents, should be incorporated into awareness measures. The specific design of the measures is the responsibility of the organization.","Control A.7.2.2 of ISO 27001 pertains to information security awareness, education, and training. This control mandates that all employees and, when relevant, contractors should receive appropriate awareness training and regular updates to organizational policies and procedures, as relevant to their job function. The awareness training should be conducted for all employees, including support staff, contractors, and third-party users. The training can be delivered via e-learning on a recognized learning management system or in a cloud-based environment. The training should cover information security threats and the responsibilities and liabilities of employees. The organization should maintain records of attendance, feedback forms, and quizzes as evidence of compliance. Managers play a crucial role in maintaining security awareness and building an acceptable security culture. The organization should also have a well-defined disciplinary procedure for employees who violate company information security policies.",True,0.47058823529411764,0.15019762845849802,0.24313725490196078,0.5190898776054382,0.9224999994039536,0.9968580007553101,0.7896561684103511,0,0,2.369368314743042,2.726001739501953,0.23495697975158691,5.095370054244995
